[
  {
    "title": "AIIMS May 2017 - 2017-05-07",
    "category": "AIIMS PYQ",
    "file": "AIIMS_May_2017_-_2017-05-07.json",
    "questions": 200
  },
  {
    "title": "AIIMS May 2018 - 2018-05-06",
    "category": "AIIMS PYQ",
    "file": "AIIMS_May_2018_-_2018-05-06.json",
    "questions": 200
  },
  {
    "title": "AIIMS May 2019 - 2019-05-05",
    "category": "AIIMS PYQ",
    "file": "AIIMS_May_2019_-_2019-05-05.json",
    "questions": 200
  },
  {
    "title": "AIIMS May 2020 - 2020-05-10",
    "category": "AIIMS PYQ",
    "file": "AIIMS_May_2020_-_2020-05-10.json",
    "questions": 200
  },
  {
    "title": "AIIMS Nov 2017 - 2017-11-12",
    "category": "AIIMS PYQ",
    "file": "AIIMS_Nov_2017_-_2017-11-12.json",
    "questions": 200
  },
  {
    "title": "AIIMS Nov 2018 - 2018-11-18",
    "category": "AIIMS PYQ",
    "file": "AIIMS_Nov_2018_-_2018-11-18.json",
    "questions": 200
  },
  {
    "title": "AIIMS Nov 2019 - 2019-11-17",
    "category": "AIIMS PYQ",
    "file": "AIIMS_Nov_2019_-_2019-11-17.json",
    "questions": 200
  },
  {
    "title": "AIIMS_MOCK_2020",
    "category": "AIIMS PYQ",
    "file": "AIIMS_MOCK_2020.json",
    "questions": 208
  },
  {
    "title": "Anatomy - AIIMS JUNE 2020",
    "category": "AIIMS PYQ",
    "file": "Anatomy_-_AIIMS_JUNE_2020.json",
    "questions": 15
  },
  {
    "title": "Anatomy - AIIMS MAY 2018",
    "category": "AIIMS PYQ",
    "file": "Anatomy_-_AIIMS_MAY_2018.json",
    "questions": 13
  },
  {
    "title": "Anatomy - AIIMS MAY 2019",
    "category": "AIIMS PYQ",
    "file": "Anatomy_-_AIIMS_MAY_2019.json",
    "questions": 11
  },
  {
    "title": "Anatomy - AIIMS NOV 2018",
    "category": "AIIMS PYQ",
    "file": "Anatomy_-_AIIMS_NOV_2018.json",
    "questions": 30
  },
  {
    "title": "Anatomy - AIIMS NOV 2019",
    "category": "AIIMS PYQ",
    "file": "Anatomy_-_AIIMS_NOV_2019.json",
    "questions": 13
  },
  {
    "title": "Anatomy_AIIMS_2014-2018",
    "category": "AIIMS PYQ",
    "file": "Anatomy_AIIMS_2014-2018.json",
    "questions": 135
  },
  {
    "title": "Anesthesia - AIIMS JUNE 2020",
    "category": "AIIMS PYQ",
    "file": "Anesthesia_-_AIIMS_JUNE_2020.json",
    "questions": 1
  },
  {
    "title": "Anesthesia - AIIMS MAY 2018",
    "category": "AIIMS PYQ",
    "file": "Anesthesia_-_AIIMS_MAY_2018.json",
    "questions": 7
  },
  {
    "title": "Anesthesia - AIIMS MAY 2019",
    "category": "AIIMS PYQ",
    "file": "Anesthesia_-_AIIMS_MAY_2019.json",
    "questions": 2
  },
  {
    "title": "Anesthesia - AIIMS NOV 2018",
    "category": "AIIMS PYQ",
    "file": "Anesthesia_-_AIIMS_NOV_2018.json",
    "questions": 2
  },
  {
    "title": "Anesthesia - AIIMS NOV 2019",
    "category": "AIIMS PYQ",
    "file": "Anesthesia_-_AIIMS_NOV_2019.json",
    "questions": 12
  },
  {
    "title": "Anesthesia_AIIMS_2014-2018",
    "category": "AIIMS PYQ",
    "file": "Anesthesia_AIIMS_2014-2018.json",
    "questions": 68
  },
  {
    "title": "Biochemistry - AIIMS JUNE 2O20",
    "category": "AIIMS PYQ",
    "file": "Biochemistry_-_AIIMS_JUNE_2O20.json",
    "questions": 11
  },
  {
    "title": "Biochemistry - AIIMS MAY 2O19",
    "category": "AIIMS PYQ",
    "file": "Biochemistry_-_AIIMS_MAY_2O19.json",
    "questions": 14
  },
  {
    "title": "Biochemistry - AIIMS NOV 2018",
    "category": "AIIMS PYQ",
    "file": "Biochemistry_-_AIIMS_NOV_2018.json",
    "questions": 7
  },
  {
    "title": "Biochemistry - AIIMS NOV 2019",
    "category": "AIIMS PYQ",
    "file": "Biochemistry_-_AIIMS_NOV_2019.json",
    "questions": 11
  },
  {
    "title": "Biochemistry_AIIMS_2014-2018",
    "category": "AIIMS PYQ",
    "file": "Biochemistry_AIIMS_2014-2018.json",
    "questions": 152
  },
  {
    "title": "Dermatology - AIIMS JUNE 2020",
    "category": "AIIMS PYQ",
    "file": "Dermatology_-_AIIMS_JUNE_2020.json",
    "questions": 4
  },
  {
    "title": "Dermatology - AIIMS MAY 2018",
    "category": "AIIMS PYQ",
    "file": "Dermatology_-_AIIMS_MAY_2018.json",
    "questions": 1
  },
  {
    "title": "Dermatology - AIIMS MAY 2019",
    "category": "AIIMS PYQ",
    "file": "Dermatology_-_AIIMS_MAY_2019.json",
    "questions": 9
  },
  {
    "title": "Dermatology - AIIMS NOV 2018",
    "category": "AIIMS PYQ",
    "file": "Dermatology_-_AIIMS_NOV_2018.json",
    "questions": 8
  },
  {
    "title": "Dermatology - AIIMS NOV 2019",
    "category": "AIIMS PYQ",
    "file": "Dermatology_-_AIIMS_NOV_2019.json",
    "questions": 5
  },
  {
    "title": "Dermatology_AIIMS_2014-2018",
    "category": "AIIMS PYQ",
    "file": "Dermatology_AIIMS_2014-2018.json",
    "questions": 34
  },
  {
    "title": "ENT - AIIMS JUNE 2020",
    "category": "AIIMS PYQ",
    "file": "ENT_-_AIIMS_JUNE_2020.json",
    "questions": 3
  },
  {
    "title": "ENT - AIIMS MAY 2018",
    "category": "AIIMS PYQ",
    "file": "ENT_-_AIIMS_MAY_2018.json",
    "questions": 5
  },
  {
    "title": "ENT - AIIMS MAY 2019",
    "category": "AIIMS PYQ",
    "file": "ENT_-_AIIMS_MAY_2019.json",
    "questions": 3
  },
  {
    "title": "ENT - AIIMS NOV 2018",
    "category": "AIIMS PYQ",
    "file": "ENT_-_AIIMS_NOV_2018.json",
    "questions": 2
  },
  {
    "title": "ENT - AIIMS NOV 2019",
    "category": "AIIMS PYQ",
    "file": "ENT_-_AIIMS_NOV_2019.json",
    "questions": 4
  },
  {
    "title": "ENT_AIIMS_2014-2018",
    "category": "AIIMS PYQ",
    "file": "ENT_AIIMS_2014-2018.json",
    "questions": 70
  },
  {
    "title": "FM - AIIMS JUNE 2020",
    "category": "AIIMS PYQ",
    "file": "FM_-_AIIMS_JUNE_2020.json",
    "questions": 9
  },
  {
    "title": "FM - AIIMS MAY 2018",
    "category": "AIIMS PYQ",
    "file": "FM_-_AIIMS_MAY_2018.json",
    "questions": 9
  },
  {
    "title": "FM - AIIMS MAY 2019",
    "category": "AIIMS PYQ",
    "file": "FM_-_AIIMS_MAY_2019.json",
    "questions": 7
  },
  {
    "title": "FM - AIIMS NOV 2018",
    "category": "AIIMS PYQ",
    "file": "FM_-_AIIMS_NOV_2018.json",
    "questions": 10
  },
  {
    "title": "FM - AIIMS NOV 2019",
    "category": "AIIMS PYQ",
    "file": "FM_-_AIIMS_NOV_2019.json",
    "questions": 6
  },
  {
    "title": "FMT_AIIMS_2014-2018",
    "category": "AIIMS PYQ",
    "file": "FMT_AIIMS_2014-2018.json",
    "questions": 127
  },
  {
    "title": "Gynaecology_AIIMS_2014-2018",
    "category": "AIIMS PYQ",
    "file": "Gynaecology_AIIMS_2014-2018.json",
    "questions": 75
  },
  {
    "title": "Medicine - AIIMS JUNE 2020",
    "category": "AIIMS PYQ",
    "file": "Medicine_-_AIIMS_JUNE_2020.json",
    "questions": 11
  },
  {
    "title": "Medicine - AIIMS MAY 2018",
    "category": "AIIMS PYQ",
    "file": "Medicine_-_AIIMS_MAY_2018.json",
    "questions": 23
  },
  {
    "title": "Medicine - AIIMS MAY 2019",
    "category": "AIIMS PYQ",
    "file": "Medicine_-_AIIMS_MAY_2019.json",
    "questions": 10
  },
  {
    "title": "Medicine - AIIMS NOV 2018",
    "category": "AIIMS PYQ",
    "file": "Medicine_-_AIIMS_NOV_2018.json",
    "questions": 17
  },
  {
    "title": "Medicine - AIIMS NOV 2019",
    "category": "AIIMS PYQ",
    "file": "Medicine_-_AIIMS_NOV_2019.json",
    "questions": 21
  },
  {
    "title": "Medicine_AIIMS_2014-2018",
    "category": "AIIMS PYQ",
    "file": "Medicine_AIIMS_2014-2018.json",
    "questions": 205
  },
  {
    "title": "Microbiology - AIIMS JUNE 2020",
    "category": "AIIMS PYQ",
    "file": "Microbiology_-_AIIMS_JUNE_2020.json",
    "questions": 21
  },
  {
    "title": "Microbiology - AIIMS MAY 2018",
    "category": "AIIMS PYQ",
    "file": "Microbiology_-_AIIMS_MAY_2018.json",
    "questions": 15
  },
  {
    "title": "Microbiology - AIIMS MAY 2019",
    "category": "AIIMS PYQ",
    "file": "Microbiology_-_AIIMS_MAY_2019.json",
    "questions": 14
  },
  {
    "title": "Microbiology - AIIMS NOV 2018",
    "category": "AIIMS PYQ",
    "file": "Microbiology_-_AIIMS_NOV_2018.json",
    "questions": 9
  },
  {
    "title": "Microbiology - AIIMS NOV 2019",
    "category": "AIIMS PYQ",
    "file": "Microbiology_-_AIIMS_NOV_2019.json",
    "questions": 12
  },
  {
    "title": "Microbiology_AIIMS_2014-2018",
    "category": "AIIMS PYQ",
    "file": "Microbiology_AIIMS_2014-2018.json",
    "questions": 170
  },
  {
    "title": "OBG - AIIMS JUNE 2020",
    "category": "AIIMS PYQ",
    "file": "OBG_-_AIIMS_JUNE_2020.json",
    "questions": 15
  },
  {
    "title": "OBG - AIIMS MAY 2018",
    "category": "AIIMS PYQ",
    "file": "OBG_-_AIIMS_MAY_2018.json",
    "questions": 26
  },
  {
    "title": "OBG - AIIMS MAY 2019",
    "category": "AIIMS PYQ",
    "file": "OBG_-_AIIMS_MAY_2019.json",
    "questions": 15
  },
  {
    "title": "OBG - AIIMS NOV 2016",
    "category": "AIIMS PYQ",
    "file": "OBG_-_AIIMS_NOV_2016.json",
    "questions": 11
  },
  {
    "title": "OBG - AIIMS NOV 2018",
    "category": "AIIMS PYQ",
    "file": "OBG_-_AIIMS_NOV_2018.json",
    "questions": 11
  },
  {
    "title": "OBG - AIIMS NOV 2019",
    "category": "AIIMS PYQ",
    "file": "OBG_-_AIIMS_NOV_2019.json",
    "questions": 9
  },
  {
    "title": "Obstetrics_AIIMS_2014-2018",
    "category": "AIIMS PYQ",
    "file": "Obstetrics_AIIMS_2014-2018.json",
    "questions": 89
  },
  {
    "title": "Ophthalmology - AIIMS JUNE 2020",
    "category": "AIIMS PYQ",
    "file": "Ophthalmology_-_AIIMS_JUNE_2020.json",
    "questions": 6
  },
  {
    "title": "Ophthalmology - AIIMS MAY 2018",
    "category": "AIIMS PYQ",
    "file": "Ophthalmology_-_AIIMS_MAY_2018.json",
    "questions": 12
  },
  {
    "title": "Ophthalmology - AIIMS MAY 2019",
    "category": "AIIMS PYQ",
    "file": "Ophthalmology_-_AIIMS_MAY_2019.json",
    "questions": 7
  },
  {
    "title": "Ophthalmology - AIIMS NOV 2018",
    "category": "AIIMS PYQ",
    "file": "Ophthalmology_-_AIIMS_NOV_2018.json",
    "questions": 7
  },
  {
    "title": "Ophthalmology - AIIMS NOV 2019",
    "category": "AIIMS PYQ",
    "file": "Ophthalmology_-_AIIMS_NOV_2019.json",
    "questions": 8
  },
  {
    "title": "Ophthalmology_AIIMS_2014-2018",
    "category": "AIIMS PYQ",
    "file": "Ophthalmology_AIIMS_2014-2018.json",
    "questions": 113
  },
  {
    "title": "Orthopaedics - AIIMS JUNE 2020",
    "category": "AIIMS PYQ",
    "file": "Orthopaedics_-_AIIMS_JUNE_2020.json",
    "questions": 10
  },
  {
    "title": "Orthopaedics - AIIMS MAY 2018",
    "category": "AIIMS PYQ",
    "file": "Orthopaedics_-_AIIMS_MAY_2018.json",
    "questions": 8
  },
  {
    "title": "Orthopaedics - AIIMS MAY 2019",
    "category": "AIIMS PYQ",
    "file": "Orthopaedics_-_AIIMS_MAY_2019.json",
    "questions": 5
  },
  {
    "title": "Orthopaedics - AIIMS NOV 2018",
    "category": "AIIMS PYQ",
    "file": "Orthopaedics_-_AIIMS_NOV_2018.json",
    "questions": 8
  },
  {
    "title": "Orthopaedics - AIIMS NOV 2019",
    "category": "AIIMS PYQ",
    "file": "Orthopaedics_-_AIIMS_NOV_2019.json",
    "questions": 8
  },
  {
    "title": "Orthopedics_AIIMS_2014-2018",
    "category": "AIIMS PYQ",
    "file": "Orthopedics_AIIMS_2014-2018.json",
    "questions": 108
  },
  {
    "title": "PSM - AIIMS JUNE 2020",
    "category": "AIIMS PYQ",
    "file": "PSM_-_AIIMS_JUNE_2020.json",
    "questions": 16
  },
  {
    "title": "PSM - AIIMS MAY 2018",
    "category": "AIIMS PYQ",
    "file": "PSM_-_AIIMS_MAY_2018.json",
    "questions": 9
  },
  {
    "title": "PSM - AIIMS MAY 2019",
    "category": "AIIMS PYQ",
    "file": "PSM_-_AIIMS_MAY_2019.json",
    "questions": 14
  },
  {
    "title": "PSM - AIIMS NOV 2018",
    "category": "AIIMS PYQ",
    "file": "PSM_-_AIIMS_NOV_2018.json",
    "questions": 16
  },
  {
    "title": "PSM - AIIMS NOV 2019",
    "category": "AIIMS PYQ",
    "file": "PSM_-_AIIMS_NOV_2019.json",
    "questions": 24
  },
  {
    "title": "PSM_AIIMS_2014-2018",
    "category": "AIIMS PYQ",
    "file": "PSM_AIIMS_2014-2018.json",
    "questions": 167
  },
  {
    "title": "Pathology - AIIMS JUNE 2020",
    "category": "AIIMS PYQ",
    "file": "Pathology_-_AIIMS_JUNE_2020.json",
    "questions": 12
  },
  {
    "title": "Pathology - AIIMS MAY 2018",
    "category": "AIIMS PYQ",
    "file": "Pathology_-_AIIMS_MAY_2018.json",
    "questions": 16
  },
  {
    "title": "Pathology - AIIMS MAY 2019",
    "category": "AIIMS PYQ",
    "file": "Pathology_-_AIIMS_MAY_2019.json",
    "questions": 14
  },
  {
    "title": "Pathology - AIIMS NOV 2018",
    "category": "AIIMS PYQ",
    "file": "Pathology_-_AIIMS_NOV_2018.json",
    "questions": 19
  },
  {
    "title": "Pathology - AIIMS NOV 2019",
    "category": "AIIMS PYQ",
    "file": "Pathology_-_AIIMS_NOV_2019.json",
    "questions": 19
  },
  {
    "title": "Pathology_AIIMS_2014-2018",
    "category": "AIIMS PYQ",
    "file": "Pathology_AIIMS_2014-2018.json",
    "questions": 253
  },
  {
    "title": "Pediatrics - AIIMS JUNE 2020",
    "category": "AIIMS PYQ",
    "file": "Pediatrics_-_AIIMS_JUNE_2020.json",
    "questions": 8
  },
  {
    "title": "Pediatrics - AIIMS MAY 2018",
    "category": "AIIMS PYQ",
    "file": "Pediatrics_-_AIIMS_MAY_2018.json",
    "questions": 15
  },
  {
    "title": "Pediatrics - AIIMS MAY 2019",
    "category": "AIIMS PYQ",
    "file": "Pediatrics_-_AIIMS_MAY_2019.json",
    "questions": 7
  },
  {
    "title": "Pediatrics - AIIMS NOV 2018",
    "category": "AIIMS PYQ",
    "file": "Pediatrics_-_AIIMS_NOV_2018.json",
    "questions": 7
  },
  {
    "title": "Pediatrics - AIIMS NOV 2019",
    "category": "AIIMS PYQ",
    "file": "Pediatrics_-_AIIMS_NOV_2019.json",
    "questions": 3
  },
  {
    "title": "Pediatrics_AIIMS_2014-2018",
    "category": "AIIMS PYQ",
    "file": "Pediatrics_AIIMS_2014-2018.json",
    "questions": 110
  },
  {
    "title": "Pharmacology - AIIMS JUNE 2020",
    "category": "AIIMS PYQ",
    "file": "Pharmacology_-_AIIMS_JUNE_2020.json",
    "questions": 22
  },
  {
    "title": "Pharmacology - AIIMS MAY 2018",
    "category": "AIIMS PYQ",
    "file": "Pharmacology_-_AIIMS_MAY_2018.json",
    "questions": 27
  },
  {
    "title": "Pharmacology - AIIMS MAY 2019",
    "category": "AIIMS PYQ",
    "file": "Pharmacology_-_AIIMS_MAY_2019.json",
    "questions": 11
  },
  {
    "title": "Pharmacology - AIIMS NOV 2018",
    "category": "AIIMS PYQ",
    "file": "Pharmacology_-_AIIMS_NOV_2018.json",
    "questions": 24
  },
  {
    "title": "Pharmacology - AIIMS NOV 2019",
    "category": "AIIMS PYQ",
    "file": "Pharmacology_-_AIIMS_NOV_2019.json",
    "questions": 17
  },
  {
    "title": "Pharmacology_AIIMS_2014-2018",
    "category": "AIIMS PYQ",
    "file": "Pharmacology_AIIMS_2014-2018.json",
    "questions": 207
  },
  {
    "title": "Physiology - AIIMS JUNE 2020",
    "category": "AIIMS PYQ",
    "file": "Physiology_-_AIIMS_JUNE_2020.json",
    "questions": 11
  },
  {
    "title": "Physiology - AIIMS MAY 2018",
    "category": "AIIMS PYQ",
    "file": "Physiology_-_AIIMS_MAY_2018.json",
    "questions": 8
  },
  {
    "title": "Physiology - AIIMS MAY 2019",
    "category": "AIIMS PYQ",
    "file": "Physiology_-_AIIMS_MAY_2019.json",
    "questions": 14
  },
  {
    "title": "Physiology - AIIMS NOV 2018",
    "category": "AIIMS PYQ",
    "file": "Physiology_-_AIIMS_NOV_2018.json",
    "questions": 10
  },
  {
    "title": "Physiology - AIIMS NOV 2019",
    "category": "AIIMS PYQ",
    "file": "Physiology_-_AIIMS_NOV_2019.json",
    "questions": 5
  },
  {
    "title": "Physiology_AIIMS_2014-2018",
    "category": "AIIMS PYQ",
    "file": "Physiology_AIIMS_2014-2018.json",
    "questions": 128
  },
  {
    "title": "Psychiatry - AIIMS JUNE 2020",
    "category": "AIIMS PYQ",
    "file": "Psychiatry_-_AIIMS_JUNE_2020.json",
    "questions": 2
  },
  {
    "title": "Psychiatry - AIIMS MAY 2018",
    "category": "AIIMS PYQ",
    "file": "Psychiatry_-_AIIMS_MAY_2018.json",
    "questions": 5
  },
  {
    "title": "Psychiatry - AIIMS MAY 2019",
    "category": "AIIMS PYQ",
    "file": "Psychiatry_-_AIIMS_MAY_2019.json",
    "questions": 6
  },
  {
    "title": "Psychiatry - AIIMS NOV 2018",
    "category": "AIIMS PYQ",
    "file": "Psychiatry_-_AIIMS_NOV_2018.json",
    "questions": 7
  },
  {
    "title": "Psychiatry - AIIMS NOV 2019",
    "category": "AIIMS PYQ",
    "file": "Psychiatry_-_AIIMS_NOV_2019.json",
    "questions": 4
  },
  {
    "title": "Psychiatry_AIIMS_2014-2018",
    "category": "AIIMS PYQ",
    "file": "Psychiatry_AIIMS_2014-2018.json",
    "questions": 67
  },
  {
    "title": "Radiology - AIIMS JUNE 2020",
    "category": "AIIMS PYQ",
    "file": "Radiology_-_AIIMS_JUNE_2020.json",
    "questions": 4
  },
  {
    "title": "Radiology - AIIMS MAY 2018",
    "category": "AIIMS PYQ",
    "file": "Radiology_-_AIIMS_MAY_2018.json",
    "questions": 3
  },
  {
    "title": "Radiology - AIIMS MAY 2019",
    "category": "AIIMS PYQ",
    "file": "Radiology_-_AIIMS_MAY_2019.json",
    "questions": 5
  },
  {
    "title": "Radiology - AIIMS NOV 2018",
    "category": "AIIMS PYQ",
    "file": "Radiology_-_AIIMS_NOV_2018.json",
    "questions": 5
  },
  {
    "title": "Radiology - AIIMS NOV 2019",
    "category": "AIIMS PYQ",
    "file": "Radiology_-_AIIMS_NOV_2019.json",
    "questions": 3
  },
  {
    "title": "Radiology_AIIMS_2014-2018",
    "category": "AIIMS PYQ",
    "file": "Radiology_AIIMS_2014-2018.json",
    "questions": 80
  },
  {
    "title": "Surgery - AIIMS JUNE 2020",
    "category": "AIIMS PYQ",
    "file": "Surgery_-_AIIMS_JUNE_2020.json",
    "questions": 14
  },
  {
    "title": "Surgery - AIIMS MAY 2018",
    "category": "AIIMS PYQ",
    "file": "Surgery_-_AIIMS_MAY_2018.json",
    "questions": 16
  },
  {
    "title": "Surgery - AIIMS MAY 2019",
    "category": "AIIMS PYQ",
    "file": "Surgery_-_AIIMS_MAY_2019.json",
    "questions": 20
  },
  {
    "title": "Surgery - AIIMS NOV 2018",
    "category": "AIIMS PYQ",
    "file": "Surgery_-_AIIMS_NOV_2018.json",
    "questions": 13
  },
  {
    "title": "Surgery - AIIMS NOV 2019",
    "category": "AIIMS PYQ",
    "file": "Surgery_-_AIIMS_NOV_2019.json",
    "questions": 11
  },
  {
    "title": "SurgeryAIIMS_2014-2018",
    "category": "AIIMS PYQ",
    "file": "SurgeryAIIMS_2014-2018.json",
    "questions": 226
  },
  {
    "title": "BTR GT-1 - 11-03-2025 - 2025-03-11",
    "category": "Cerebellum / BTR",
    "file": "BTR_GT-1_-_11-03-2025_-_2025-03-11.json",
    "questions": 200
  },
  {
    "title": "BTR GT-2 - 14-03-2025 - 2025-03-14",
    "category": "Cerebellum / BTR",
    "file": "BTR_GT-2_-_14-03-2025_-_2025-03-14.json",
    "questions": 200
  },
  {
    "title": "BTR GT-3 - 16-03-2025 - 2025-03-16",
    "category": "Cerebellum / BTR",
    "file": "BTR_GT-3_-_16-03-2025_-_2025-03-16.json",
    "questions": 200
  },
  {
    "title": "BTR INICET MOCK GT - 2025-05-07",
    "category": "Cerebellum / BTR",
    "file": "BTR_INICET_MOCK_GT_-_2025-05-07.json",
    "questions": 200
  },
  {
    "title": "BTR Integrated Systems test 6.0 - 2025-03-26",
    "category": "Cerebellum / BTR",
    "file": "BTR_Integrated_Systems_test_60_-_2025-03-26.json",
    "questions": 100
  },
  {
    "title": "BTR Mega GT 3.0 - 2024-05-03",
    "category": "Cerebellum / BTR",
    "file": "BTR_Mega_GT_30_-_2024-05-03.json",
    "questions": 200
  },
  {
    "title": "BTR Mega Test and Discussion - 2023-10-17",
    "category": "Cerebellum / BTR",
    "file": "BTR_Mega_Test_and_Discussion_-_2023-10-17.json",
    "questions": 200
  },
  {
    "title": "BTR Mega-GT 4.0 - 29-10-2024 - 2024-10-29",
    "category": "Cerebellum / BTR",
    "file": "BTR_Mega-GT_40_-_29-10-2024_-_2024-10-29.json",
    "questions": 200
  },
  {
    "title": "BTR Mega-Test 2.0 - 2024-02-02",
    "category": "Cerebellum / BTR",
    "file": "BTR_Mega-Test_20_-_2024-02-02.json",
    "questions": 200
  },
  {
    "title": "BTR NEET 2024 GT-1 - 2024-08-02",
    "category": "Cerebellum / BTR",
    "file": "BTR_NEET_2024_GT-1_-_2024-08-02.json",
    "questions": 200
  },
  {
    "title": "BTR NEET 2024 GT-2 - 2024-08-05",
    "category": "Cerebellum / BTR",
    "file": "BTR_NEET_2024_GT-2_-_2024-08-05.json",
    "questions": 200
  },
  {
    "title": "BTR NEET MOCK GT-1 - 2025-06-02",
    "category": "Cerebellum / BTR",
    "file": "BTR_NEET_MOCK_GT-1_-_2025-06-02.json",
    "questions": 200
  },
  {
    "title": "BTR ONLINE MOCK GT-1 - 15-07-2025 - 2025-07-15",
    "category": "Cerebellum / BTR",
    "file": "BTR_ONLINE_MOCK_GT-1_-_15-07-2025_-_2025-07-15.json",
    "questions": 200
  },
  {
    "title": "Basal Ganglia & Cerebellum",
    "category": "Cerebellum / BTR",
    "file": "Basal_Ganglia__Cerebellum.json",
    "questions": 21
  },
  {
    "title": "Biochem FMT 1.0 BTR Test - 2023-10-07",
    "category": "Cerebellum / BTR",
    "file": "Biochem_FMT_10_BTR_Test_-_2023-10-07.json",
    "questions": 100
  },
  {
    "title": "Biochem, FMT BTR Test 4.0 - 2024-09-24",
    "category": "Cerebellum / BTR",
    "file": "Biochem_FMT_BTR_Test_40_-_2024-09-24.json",
    "questions": 100
  },
  {
    "title": "Biochem-FMT 5.0 BTR Test - 2024-12-30",
    "category": "Cerebellum / BTR",
    "file": "Biochem-FMT_50_BTR_Test_-_2024-12-30.json",
    "questions": 180
  },
  {
    "title": "Biochem-FMT BTR Test 2.0 - 2024-01-12",
    "category": "Cerebellum / BTR",
    "file": "Biochem-FMT_BTR_Test_20_-_2024-01-12.json",
    "questions": 100
  },
  {
    "title": "Biochem-FMT BTR Test 6.0 - 2025-04-05",
    "category": "Cerebellum / BTR",
    "file": "Biochem-FMT_BTR_Test_60_-_2025-04-05.json",
    "questions": 100
  },
  {
    "title": "Biochem-FMT BTR test 3.0 - 2024-04-06",
    "category": "Cerebellum / BTR",
    "file": "Biochem-FMT_BTR_test_30_-_2024-04-06.json",
    "questions": 100
  },
  {
    "title": "CNS_Physiology-Basal_Ganglia_and_Cerebellum",
    "category": "Cerebellum / BTR",
    "file": "CNS_Physiology-Basal_Ganglia_and_Cerebellum.json",
    "questions": 16
  },
  {
    "title": "Cardiopulmonary_Cerebral_Resuscitation",
    "category": "Cerebellum / BTR",
    "file": "Cardiopulmonary_Cerebral_Resuscitation.json",
    "questions": 6
  },
  {
    "title": "Cardiopulmonary_Cerebral_Resuscitation-CPCR",
    "category": "Cerebellum / BTR",
    "file": "Cardiopulmonary_Cerebral_Resuscitation-CPCR.json",
    "questions": 15
  },
  {
    "title": "Cardiopulmonary_Cerebral_Resuscitation-Previous_Year_Questions",
    "category": "Cerebellum / BTR",
    "file": "Cardiopulmonary_Cerebral_Resuscitation-Previous_Year_Questions.json",
    "questions": 20
  },
  {
    "title": "Cerebel-HUM Super-30 Grand Test - 2023-09-05",
    "category": "Cerebellum / BTR",
    "file": "Cerebel-HUM_Super-30_Grand_Test_-_2023-09-05.json",
    "questions": 100
  },
  {
    "title": "Cerebellum",
    "category": "Cerebellum / BTR",
    "file": "Cerebellum.json",
    "questions": 13
  },
  {
    "title": "Cerebral Cortex",
    "category": "Cerebellum / BTR",
    "file": "Cerebral_Cortex.json",
    "questions": 15
  },
  {
    "title": "Cerebral Palsy, Brain Tumor & Neurocutaneous Disorders",
    "category": "Cerebellum / BTR",
    "file": "Cerebral_Palsy_Brain_Tumor__Neurocutaneous_Disorders.json",
    "questions": 37
  },
  {
    "title": "Cerebrum - Homunculus, Histology & Diencephalon",
    "category": "Cerebellum / BTR",
    "file": "Cerebrum_-_Homunculus_Histology__Diencephalon.json",
    "questions": 8
  },
  {
    "title": "ENT, Ophthalmology & Psychiatry BTR 5.0 Test - 2025-01-25",
    "category": "Cerebellum / BTR",
    "file": "ENT_Ophthalmology__Psychiatry_BTR_50_Test_-_2025-01-25.json",
    "questions": 175
  },
  {
    "title": "Extra-edge BTR test_ Micro-Anat - 2025-06-07",
    "category": "Cerebellum / BTR",
    "file": "Extra-edge_BTR_test__Micro-Anat_-_2025-06-07.json",
    "questions": 50
  },
  {
    "title": "Extra-edge BTR test_ PSM-Derma-Anes - 2025-06-12",
    "category": "Cerebellum / BTR",
    "file": "Extra-edge_BTR_test__PSM-Derma-Anes_-_2025-06-12.json",
    "questions": 50
  },
  {
    "title": "FMG Mega-BTR GT - 31-12-2024 - 2024-12-31",
    "category": "Cerebellum / BTR",
    "file": "FMG_Mega-BTR_GT_-_31-12-2024_-_2024-12-31.json",
    "questions": 150
  },
  {
    "title": "Integrated Systems 1.0 BTR Test - 2023-09-30",
    "category": "Cerebellum / BTR",
    "file": "Integrated_Systems_10_BTR_Test_-_2023-09-30.json",
    "questions": 100
  },
  {
    "title": "Integrated Systems 2.0 BTR Test - 2023-12-02",
    "category": "Cerebellum / BTR",
    "file": "Integrated_Systems_20_BTR_Test_-_2023-12-02.json",
    "questions": 120
  },
  {
    "title": "Integrated Systems 3.0 BTR Test-1 - 2024-02-10",
    "category": "Cerebellum / BTR",
    "file": "Integrated_Systems_30_BTR_Test-1_-_2024-02-10.json",
    "questions": 100
  },
  {
    "title": "Integrated Systems 3.0 BTR Test-2 - 2024-02-18",
    "category": "Cerebellum / BTR",
    "file": "Integrated_Systems_30_BTR_Test-2_-_2024-02-18.json",
    "questions": 100
  },
  {
    "title": "Integrated Systems 5.0 BTR Test - 2024-12-20",
    "category": "Cerebellum / BTR",
    "file": "Integrated_Systems_50_BTR_Test_-_2024-12-20.json",
    "questions": 200
  },
  {
    "title": "Integrated Systems BTR test and Discussion 4.0 - 2024-09-18",
    "category": "Cerebellum / BTR",
    "file": "Integrated_Systems_BTR_test_and_Discussion_40_-_2024-09-18.json",
    "questions": 100
  },
  {
    "title": "Integrative Neurophysiology - Cerebral Cortex",
    "category": "Cerebellum / BTR",
    "file": "Integrative_Neurophysiology_-_Cerebral_Cortex.json",
    "questions": 13
  },
  {
    "title": "Mega NEET BTR-1 - 2024-05-27",
    "category": "Cerebellum / BTR",
    "file": "Mega_NEET_BTR-1_-_2024-05-27.json",
    "questions": 40
  },
  {
    "title": "Mega NEET BTR-2 - 2024-06-03",
    "category": "Cerebellum / BTR",
    "file": "Mega_NEET_BTR-2_-_2024-06-03.json",
    "questions": 40
  },
  {
    "title": "Mega NEET BTR-3 - 2024-06-08",
    "category": "Cerebellum / BTR",
    "file": "Mega_NEET_BTR-3_-_2024-06-08.json",
    "questions": 40
  },
  {
    "title": "Mega NEET BTR-4 - 2024-06-14",
    "category": "Cerebellum / BTR",
    "file": "Mega_NEET_BTR-4_-_2024-06-14.json",
    "questions": 40
  },
  {
    "title": "Mega NEET BTR-5 - 2024-06-19",
    "category": "Cerebellum / BTR",
    "file": "Mega_NEET_BTR-5_-_2024-06-19.json",
    "questions": 40
  },
  {
    "title": "Micro-Anatomy BTR 5.0 test - 2025-01-11",
    "category": "Cerebellum / BTR",
    "file": "Micro-Anatomy_BTR_50_test_-_2025-01-11.json",
    "questions": 175
  },
  {
    "title": "Micro-Anatomy BTR test 3.0 - 2024-03-29",
    "category": "Cerebellum / BTR",
    "file": "Micro-Anatomy_BTR_test_30_-_2024-03-29.json",
    "questions": 100
  },
  {
    "title": "Microbiology & Anatomy 1.0 BTR Test - 2023-08-22",
    "category": "Cerebellum / BTR",
    "file": "Microbiology__Anatomy_10_BTR_Test_-_2023-08-22.json",
    "questions": 100
  },
  {
    "title": "Microbiology, Anatomy BTR Test 4.0 - 2024-10-01",
    "category": "Cerebellum / BTR",
    "file": "Microbiology_Anatomy_BTR_Test_40_-_2024-10-01.json",
    "questions": 100
  },
  {
    "title": "Microbiology-Anatomy 2.0 BTR Test - 2024-01-03",
    "category": "Cerebellum / BTR",
    "file": "Microbiology-Anatomy_20_BTR_Test_-_2024-01-03.json",
    "questions": 100
  },
  {
    "title": "Microbiology-Anatomy BTR 6.0 Test - 2025-04-18",
    "category": "Cerebellum / BTR",
    "file": "Microbiology-Anatomy_BTR_60_Test_-_2025-04-18.json",
    "questions": 100
  },
  {
    "title": "Neuro_Anatomy-Brainstem__Cranial_Nerves__and_Cerebellum",
    "category": "Cerebellum / BTR",
    "file": "Neuro_Anatomy-Brainstem__Cranial_Nerves__and_Cerebellum.json",
    "questions": 26
  },
  {
    "title": "Neuro_Anatomy-Cerebrum_and_Associated_Structures",
    "category": "Cerebellum / BTR",
    "file": "Neuro_Anatomy-Cerebrum_and_Associated_Structures.json",
    "questions": 17
  },
  {
    "title": "Neurosurgery-Cerebrovascular_Diseases",
    "category": "Cerebellum / BTR",
    "file": "Neurosurgery-Cerebrovascular_Diseases.json",
    "questions": 12
  },
  {
    "title": "OBG-Pediatrics 1.0 BTR Test - 2023-09-19",
    "category": "Cerebellum / BTR",
    "file": "OBG-Pediatrics_10_BTR_Test_-_2023-09-19.json",
    "questions": 100
  },
  {
    "title": "PSM, Anaes, Derma 1.0 BTR Test - 2023-09-11",
    "category": "Cerebellum / BTR",
    "file": "PSM_Anaes_Derma_10_BTR_Test_-_2023-09-11.json",
    "questions": 100
  },
  {
    "title": "PSM, Derma, Anesthesia 3.0 BTR Test - 2024-03-18",
    "category": "Cerebellum / BTR",
    "file": "PSM_Derma_Anesthesia_30_BTR_Test_-_2024-03-18.json",
    "questions": 100
  },
  {
    "title": "PSM, Dermatology, Anesthesia 4.0 BTR test - 2024-10-09",
    "category": "Cerebellum / BTR",
    "file": "PSM_Dermatology_Anesthesia_40_BTR_test_-_2024-10-09.json",
    "questions": 100
  },
  {
    "title": "PSM, Dermatology, Anesthesia 5.0 BTR test - 2025-02-22",
    "category": "Cerebellum / BTR",
    "file": "PSM_Dermatology_Anesthesia_50_BTR_test_-_2025-02-22.json",
    "questions": 150
  },
  {
    "title": "PSM-Derma-Anesthesia BTR test 6.0 - 2025-03-31",
    "category": "Cerebellum / BTR",
    "file": "PSM-Derma-Anesthesia_BTR_test_60_-_2025-03-31.json",
    "questions": 100
  },
  {
    "title": "Pediatrics & OBG BTR 6.0 test - 2025-05-01",
    "category": "Cerebellum / BTR",
    "file": "Pediatrics__OBG_BTR_60_test_-_2025-05-01.json",
    "questions": 100
  },
  {
    "title": "Pediatrics OBG BTR 5.0 test - 2025-03-08",
    "category": "Cerebellum / BTR",
    "file": "Pediatrics_OBG_BTR_50_test_-_2025-03-08.json",
    "questions": 150
  },
  {
    "title": "Pediatrics-OBG 4.0 BTR test - 2024-10-25",
    "category": "Cerebellum / BTR",
    "file": "Pediatrics-OBG_40_BTR_test_-_2024-10-25.json",
    "questions": 100
  },
  {
    "title": "Pediatrics-OBG BTR Test 2.0 - 2024-01-20",
    "category": "Cerebellum / BTR",
    "file": "Pediatrics-OBG_BTR_Test_20_-_2024-01-20.json",
    "questions": 100
  },
  {
    "title": "Pediatrics-OBG BTR Test 3.0 - 2024-03-04",
    "category": "Cerebellum / BTR",
    "file": "Pediatrics-OBG_BTR_Test_30_-_2024-03-04.json",
    "questions": 100
  },
  {
    "title": "Psychi Optha ENT BTR Test 2.0 - 2024-01-31",
    "category": "Cerebellum / BTR",
    "file": "Psychi_Optha_ENT_BTR_Test_20_-_2024-01-31.json",
    "questions": 100
  },
  {
    "title": "Psychi Opthal ENT 1.0 BTR Test - 2023-10-13",
    "category": "Cerebellum / BTR",
    "file": "Psychi_Opthal_ENT_10_BTR_Test_-_2023-10-13.json",
    "questions": 100
  },
  {
    "title": "Psychiatry, ENT & Ophtha 4.0 BTR test - 2024-10-18",
    "category": "Cerebellum / BTR",
    "file": "Psychiatry_ENT__Ophtha_40_BTR_test_-_2024-10-18.json",
    "questions": 100
  },
  {
    "title": "Psychiatry, ENT & Ophthalmology BTR 6.0 test - 2025-04-25",
    "category": "Cerebellum / BTR",
    "file": "Psychiatry_ENT__Ophthalmology_BTR_60_test_-_2025-04-25.json",
    "questions": 100
  },
  {
    "title": "Surgery, Ortho & Radiology BTR 5.0 test - 2025-02-10",
    "category": "Cerebellum / BTR",
    "file": "Surgery_Ortho__Radiology_BTR_50_test_-_2025-02-10.json",
    "questions": 150
  },
  {
    "title": "Surgery, Ortho & Radiology BTR 6.0 test - 2025-04-12",
    "category": "Cerebellum / BTR",
    "file": "Surgery_Ortho__Radiology_BTR_60_test_-_2025-04-12.json",
    "questions": 100
  },
  {
    "title": "Surgery-Ortho-Radio 1.0 BTR Test - 2023-09-01",
    "category": "Cerebellum / BTR",
    "file": "Surgery-Ortho-Radio_10_BTR_Test_-_2023-09-01.json",
    "questions": 100
  },
  {
    "title": "Surgery-Ortho-Radio 4.0 BTR test - 2024-09-03",
    "category": "Cerebellum / BTR",
    "file": "Surgery-Ortho-Radio_40_BTR_test_-_2024-09-03.json",
    "questions": 100
  },
  {
    "title": "White Matter of Cerebrum (Part 1)",
    "category": "Cerebellum / BTR",
    "file": "White_Matter_of_Cerebrum_Part_1.json",
    "questions": 14
  },
  {
    "title": "White Matter of Cerebrum (Part 2)",
    "category": "Cerebellum / BTR",
    "file": "White_Matter_of_Cerebrum_Part_2.json",
    "questions": 6
  },
  {
    "title": "ALL INDIA DAMS NEETPG CBT-1 (March) 2025",
    "category": "DAMS / DQB",
    "file": "ALL_INDIA_DAMS_NEETPG_CBT-1_March_2025.json",
    "questions": 200
  },
  {
    "title": "ALL INDIA DAMS NEETPG CBT-2 (May) 2025",
    "category": "DAMS / DQB",
    "file": "ALL_INDIA_DAMS_NEETPG_CBT-2_May_2025.json",
    "questions": 200
  },
  {
    "title": "ALL INDIA DAMS NEETPG CBT-3 (31st May) 2025",
    "category": "DAMS / DQB",
    "file": "ALL_INDIA_DAMS_NEETPG_CBT-3_31st_May_2025.json",
    "questions": 200
  },
  {
    "title": "ALL_INDIA_DAMS_NEETPG_CBT-4_12th_July_2025",
    "category": "DAMS / DQB",
    "file": "ALL_INDIA_DAMS_NEETPG_CBT-4_12th_July_2025.json",
    "questions": 200
  },
  {
    "title": "ALL_INDIA_DAMS_NEETPG_MOCK_18_TO_21_2025",
    "category": "DAMS / DQB",
    "file": "ALL_INDIA_DAMS_NEETPG_MOCK_18_TO_21_2025.json",
    "questions": 200
  },
  {
    "title": "ALL_INDIA_DAMS_NEETPG_MOCK_18_TO_21_2025",
    "category": "DAMS / DQB",
    "file": "ALL_INDIA_DAMS_NEETPG_MOCK_18_TO_21_2025_1.json",
    "questions": 200
  },
  {
    "title": "ANAESTHESIA-(INICET NOV 2024)",
    "category": "INICET PYQ",
    "file": "ANAESTHESIA-INICET_NOV_2024.json",
    "questions": 6
  },
  {
    "title": "ANATOMY-(INICET NOV 2024)",
    "category": "INICET PYQ",
    "file": "ANATOMY-INICET_NOV_2024.json",
    "questions": 11
  },
  {
    "title": "Anatomy - INICET MAY 2024",
    "category": "INICET PYQ",
    "file": "Anatomy_-_INICET_MAY_2024.json",
    "questions": 11
  },
  {
    "title": "Anatomy E&D - Mission 2.0 (INICET) - 28-09-2024 - 2024-09-28",
    "category": "INICET PYQ",
    "file": "Anatomy_ED_-_Mission_20_INICET_-_28-09-2024_-_2024-09-28.json",
    "questions": 100
  },
  {
    "title": "Anatomy_INICET_PYQ",
    "category": "INICET PYQ",
    "file": "Anatomy_INICET_PYQ.json",
    "questions": 159
  },
  {
    "title": "Anesthesia - INICET MAY 2024",
    "category": "INICET PYQ",
    "file": "Anesthesia_-_INICET_MAY_2024.json",
    "questions": 6
  },
  {
    "title": "Anesthesia E&D (Mission NEET PG_INICET 2.0) - 26-04-2024 - 2024-04-26",
    "category": "INICET PYQ",
    "file": "Anesthesia_ED_Mission_NEET_PG_INICET_20_-_26-04-2024_-_2024-04-26.json",
    "questions": 75
  },
  {
    "title": "Anesthesia E&D - Mission 2.0 (INICET) - 03-10-2024 - 2024-10-03",
    "category": "INICET PYQ",
    "file": "Anesthesia_ED_-_Mission_20_INICET_-_03-10-2024_-_2024-10-03.json",
    "questions": 75
  },
  {
    "title": "Anesthesia_INICET_PYQ",
    "category": "INICET PYQ",
    "file": "Anesthesia_INICET_PYQ.json",
    "questions": 54
  },
  {
    "title": "BIOCHEMISTRY-(INICET NOV 2024)",
    "category": "INICET PYQ",
    "file": "BIOCHEMISTRY-INICET_NOV_2024.json",
    "questions": 6
  },
  {
    "title": "Biochemistry - INICET MAY 2024",
    "category": "INICET PYQ",
    "file": "Biochemistry_-_INICET_MAY_2024.json",
    "questions": 12
  },
  {
    "title": "Biochemistry E&D (Mission NEET PG_INICET 2.0) - 12-06-2024 - 2024-06-12",
    "category": "INICET PYQ",
    "file": "Biochemistry_ED_Mission_NEET_PG_INICET_20_-_12-06-2024_-_2024-06-12.json",
    "questions": 100
  },
  {
    "title": "Biochemistry E&D - Mission 2.0 (INICET) - 24-09-2024 - 2024-09-24",
    "category": "INICET PYQ",
    "file": "Biochemistry_ED_-_Mission_20_INICET_-_24-09-2024_-_2024-09-24.json",
    "questions": 100
  },
  {
    "title": "Biochemistry_INICET_PYQ",
    "category": "INICET PYQ",
    "file": "Biochemistry_INICET_PYQ.json",
    "questions": 156
  },
  {
    "title": "DERMATOLOGY-(INICET NOV 2024)",
    "category": "INICET PYQ",
    "file": "DERMATOLOGY-INICET_NOV_2024.json",
    "questions": 5
  },
  {
    "title": "Dermatology - INICET MAY 2024",
    "category": "INICET PYQ",
    "file": "Dermatology_-_INICET_MAY_2024.json",
    "questions": 4
  },
  {
    "title": "Dermatology E&D (Mission NEET PG_INICET 2.0) - 15-06-2024 - 2024-06-15",
    "category": "INICET PYQ",
    "file": "Dermatology_ED_Mission_NEET_PG_INICET_20_-_15-06-2024_-_2024-06-15.json",
    "questions": 75
  },
  {
    "title": "Dermatology E&D - Mission 2.0 (INICET) - 07-10-2024 - 2024-10-07",
    "category": "INICET PYQ",
    "file": "Dermatology_ED_-_Mission_20_INICET_-_07-10-2024_-_2024-10-07.json",
    "questions": 75
  },
  {
    "title": "Dermatology_INICET_PYQ",
    "category": "INICET PYQ",
    "file": "Dermatology_INICET_PYQ.json",
    "questions": 93
  },
  {
    "title": "ENT - INICET MAY 2024",
    "category": "INICET PYQ",
    "file": "ENT_-_INICET_MAY_2024.json",
    "questions": 6
  },
  {
    "title": "ENT E&D (Mission NEET PG_INICET 2.0) - 12-05-2024 - 2024-05-12",
    "category": "INICET PYQ",
    "file": "ENT_ED_Mission_NEET_PG_INICET_20_-_12-05-2024_-_2024-05-12.json",
    "questions": 100
  },
  {
    "title": "ENT E&D - Mission 2.0 (INICET) - 16-10-2024 - 2024-10-16",
    "category": "INICET PYQ",
    "file": "ENT_ED_-_Mission_20_INICET_-_16-10-2024_-_2024-10-16.json",
    "questions": 75
  },
  {
    "title": "ENT-(INICET NOV 2024)",
    "category": "INICET PYQ",
    "file": "ENT-INICET_NOV_2024.json",
    "questions": 8
  },
  {
    "title": "ENT_INICET_PYQ",
    "category": "INICET PYQ",
    "file": "ENT_INICET_PYQ.json",
    "questions": 79
  },
  {
    "title": "FM E&D - Mission 2.0 (INICET) - 21-09-2024 - 2024-09-21",
    "category": "INICET PYQ",
    "file": "FM_ED_-_Mission_20_INICET_-_21-09-2024_-_2024-09-21.json",
    "questions": 75
  },
  {
    "title": "FMT_INICET_PYQ",
    "category": "INICET PYQ",
    "file": "FMT_INICET_PYQ.json",
    "questions": 139
  },
  {
    "title": "FORENSIC MEDICINE-(INICET NOV 2024)",
    "category": "INICET PYQ",
    "file": "FORENSIC_MEDICINE-INICET_NOV_2024.json",
    "questions": 5
  },
  {
    "title": "Forensic Medicine - INICET MAY 2024",
    "category": "INICET PYQ",
    "file": "Forensic_Medicine_-_INICET_MAY_2024.json",
    "questions": 6
  },
  {
    "title": "Forensic Medicine E&D (Mission NEET PG_INICET 2.0) - 07-07-2024 - 2024-07-07",
    "category": "INICET PYQ",
    "file": "Forensic_Medicine_ED_Mission_NEET_PG_INICET_20_-_07-07-2024_-_2024-07-07.json",
    "questions": 75
  },
  {
    "title": "Free_National_Mock_Test_INICET_November",
    "category": "INICET PYQ",
    "file": "Free_National_Mock_Test_INICET_November.json",
    "questions": 200
  },
  {
    "title": "Gynaecology_INICET_PYQ",
    "category": "INICET PYQ",
    "file": "Gynaecology_INICET_PYQ.json",
    "questions": 133
  },
  {
    "title": "INICET Champions Test.__.16th Oct 2024.__.OCTOBER 2024.__..__.1.__.",
    "category": "INICET PYQ",
    "file": "INICET_Champions_Test__16th_Oct_2024__OCTOBER_2024____1__.json",
    "questions": 200
  },
  {
    "title": "INICET Grand Test - 1 - 2023-04-16",
    "category": "INICET PYQ",
    "file": "INICET_Grand_Test_-_1_-_2023-04-16.json",
    "questions": 200
  },
  {
    "title": "INICET Grand Test - 2 - 2023-04-30",
    "category": "INICET PYQ",
    "file": "INICET_Grand_Test_-_2_-_2023-04-30.json",
    "questions": 200
  },
  {
    "title": "INICET Grand Test - 3 - 2023-10-26",
    "category": "INICET PYQ",
    "file": "INICET_Grand_Test_-_3_-_2023-10-26.json",
    "questions": 200
  },
  {
    "title": "INICET Grand Test 04.__.26th Feb 2025.__.FEBRUARY 2025.__..__.0.__.",
    "category": "INICET PYQ",
    "file": "INICET_Grand_Test_04__26th_Feb_2025__FEBRUARY_2025____0__.json",
    "questions": 200
  },
  {
    "title": "INICET Grand Test 2.__.16th Aug 2024.__.AUGUST 2024.__..__.0.__.",
    "category": "INICET PYQ",
    "file": "INICET_Grand_Test_2__16th_Aug_2024__AUGUST_2024____0__.json",
    "questions": 200
  },
  {
    "title": "INICET Grand Test 3.__.18th Dec 2024.__.DECEMBER 2024.__..__.0.__.",
    "category": "INICET PYQ",
    "file": "INICET_Grand_Test_3__18th_Dec_2024__DECEMBER_2024____0__.json",
    "questions": 200
  },
  {
    "title": "INICET MOCK Test-1 - 27-04-2025 - 2025-04-27",
    "category": "INICET PYQ",
    "file": "INICET_MOCK_Test-1_-_27-04-2025_-_2025-04-27.json",
    "questions": 200
  },
  {
    "title": "INICET MOCK Test-2 - 03-05-2025 - 2025-05-03",
    "category": "INICET PYQ",
    "file": "INICET_MOCK_Test-2_-_03-05-2025_-_2025-05-03.json",
    "questions": 200
  },
  {
    "title": "INICET May 2021 - 2021-05-09",
    "category": "INICET PYQ",
    "file": "INICET_May_2021_-_2021-05-09.json",
    "questions": 200
  },
  {
    "title": "INICET May 2022 - 2022-05-08",
    "category": "INICET PYQ",
    "file": "INICET_May_2022_-_2022-05-08.json",
    "questions": 200
  },
  {
    "title": "INICET May 2023 - 2023-05-07",
    "category": "INICET PYQ",
    "file": "INICET_May_2023_-_2023-05-07.json",
    "questions": 200
  },
  {
    "title": "INICET May 2024",
    "category": "INICET PYQ",
    "file": "INICET_May_2024.json",
    "questions": 200
  },
  {
    "title": "INICET May 2024 - 2024-05-19",
    "category": "INICET PYQ",
    "file": "INICET_May_2024_-_2024-05-19.json",
    "questions": 200
  },
  {
    "title": "INICET May 2024 Mock Test-1 (Part-1) - 19-04-2024 - 2024-04-19",
    "category": "INICET PYQ",
    "file": "INICET_May_2024_Mock_Test-1_Part-1_-_19-04-2024_-_2024-04-19.json",
    "questions": 50
  },
  {
    "title": "INICET May 2024 Mock Test-1 (Part-2) - 19-04-2024 - 2024-04-19",
    "category": "INICET PYQ",
    "file": "INICET_May_2024_Mock_Test-1_Part-2_-_19-04-2024_-_2024-04-19.json",
    "questions": 50
  },
  {
    "title": "INICET May 2024 Mock Test-1 (Part-3) - 19-04-2024 - 2024-04-19",
    "category": "INICET PYQ",
    "file": "INICET_May_2024_Mock_Test-1_Part-3_-_19-04-2024_-_2024-04-19.json",
    "questions": 50
  },
  {
    "title": "INICET May 2024 Mock Test-1 (Part-4) - 19-04-2024 - 2024-04-19",
    "category": "INICET PYQ",
    "file": "INICET_May_2024_Mock_Test-1_Part-4_-_19-04-2024_-_2024-04-19.json",
    "questions": 50
  },
  {
    "title": "INICET May 2024 Mock Test-2 (Part-1) - 28-04-2024 - 2024-04-28",
    "category": "INICET PYQ",
    "file": "INICET_May_2024_Mock_Test-2_Part-1_-_28-04-2024_-_2024-04-28.json",
    "questions": 50
  },
  {
    "title": "INICET May 2024 Mock Test-2 (Part-2) - 28-04-2024 - 2024-04-28",
    "category": "INICET PYQ",
    "file": "INICET_May_2024_Mock_Test-2_Part-2_-_28-04-2024_-_2024-04-28.json",
    "questions": 50
  },
  {
    "title": "INICET May 2024 Mock Test-2 (Part-3) - 28-04-2024 - 2024-04-28",
    "category": "INICET PYQ",
    "file": "INICET_May_2024_Mock_Test-2_Part-3_-_28-04-2024_-_2024-04-28.json",
    "questions": 50
  },
  {
    "title": "INICET May 2024 Mock Test-2 (Part-4) - 28-04-2024 - 2024-04-28",
    "category": "INICET PYQ",
    "file": "INICET_May_2024_Mock_Test-2_Part-4_-_28-04-2024_-_2024-04-28.json",
    "questions": 50
  },
  {
    "title": "INICET May 2024 Mock Test-3 (Part-1) - 12-05-2024 - 2024-05-12",
    "category": "INICET PYQ",
    "file": "INICET_May_2024_Mock_Test-3_Part-1_-_12-05-2024_-_2024-05-12.json",
    "questions": 50
  },
  {
    "title": "INICET May 2024 Mock Test-3 (Part-2) - 12-05-2024 - 2024-05-12",
    "category": "INICET PYQ",
    "file": "INICET_May_2024_Mock_Test-3_Part-2_-_12-05-2024_-_2024-05-12.json",
    "questions": 50
  },
  {
    "title": "INICET May 2024 Mock Test-3 (Part-3) - 12-05-2024 - 2024-05-12",
    "category": "INICET PYQ",
    "file": "INICET_May_2024_Mock_Test-3_Part-3_-_12-05-2024_-_2024-05-12.json",
    "questions": 50
  },
  {
    "title": "INICET May 2024 Mock Test-3 (Part-4) - 12-05-2024 - 2024-05-12",
    "category": "INICET PYQ",
    "file": "INICET_May_2024_Mock_Test-3_Part-4_-_12-05-2024_-_2024-05-12.json",
    "questions": 50
  },
  {
    "title": "INICET Nov 2020 - 2020-11-20",
    "category": "INICET PYQ",
    "file": "INICET_Nov_2020_-_2020-11-20.json",
    "questions": 200
  },
  {
    "title": "INICET Nov 2021 - 2021-11-14",
    "category": "INICET PYQ",
    "file": "INICET_Nov_2021_-_2021-11-14.json",
    "questions": 200
  },
  {
    "title": "INICET Nov 2022 - Session 1 - 2022-11-13",
    "category": "INICET PYQ",
    "file": "INICET_Nov_2022_-_Session_1_-_2022-11-13.json",
    "questions": 200
  },
  {
    "title": "INICET Nov 2022 - Session 2 - 2022-11-13",
    "category": "INICET PYQ",
    "file": "INICET_Nov_2022_-_Session_2_-_2022-11-13.json",
    "questions": 200
  },
  {
    "title": "INICET Nov 2023 - 2023-11-05",
    "category": "INICET PYQ",
    "file": "INICET_Nov_2023_-_2023-11-05.json",
    "questions": 200
  },
  {
    "title": "INICET Nov 2024",
    "category": "INICET PYQ",
    "file": "INICET_Nov_2024.json",
    "questions": 200
  },
  {
    "title": "INICET Nov 2024 - 2024-11-10",
    "category": "INICET PYQ",
    "file": "INICET_Nov_2024_-_2024-11-10.json",
    "questions": 228
  },
  {
    "title": "INICET Nov 2024 Mock Test-1 - 19-10-2024 - 2024-10-19",
    "category": "INICET PYQ",
    "file": "INICET_Nov_2024_Mock_Test-1_-_19-10-2024_-_2024-10-19.json",
    "questions": 200
  },
  {
    "title": "INICET Nov 2024 Mock Test-2 - 27-10-2024 - 2024-10-27",
    "category": "INICET PYQ",
    "file": "INICET_Nov_2024_Mock_Test-2_-_27-10-2024_-_2024-10-27.json",
    "questions": 200
  },
  {
    "title": "INICET_2024_NOV_Paper_4_Section",
    "category": "INICET PYQ",
    "file": "INICET_2024_NOV_Paper_4_Section.json",
    "questions": 200
  },
  {
    "title": "INICET_MOCK_5_4_Sections",
    "category": "INICET PYQ",
    "file": "INICET_MOCK_5_4_Sections.json",
    "questions": 200
  },
  {
    "title": "INICET_MOCK_6_4_Sections",
    "category": "INICET PYQ",
    "file": "INICET_MOCK_6_4_Sections.json",
    "questions": 200
  },
  {
    "title": "INICET_Mock_10_4_Sections",
    "category": "INICET PYQ",
    "file": "INICET_Mock_10_4_Sections.json",
    "questions": 200
  },
  {
    "title": "INICET_Mock_11_4_Sections",
    "category": "INICET PYQ",
    "file": "INICET_Mock_11_4_Sections.json",
    "questions": 200
  },
  {
    "title": "INICET_Mock_2",
    "category": "INICET PYQ",
    "file": "INICET_Mock_2.json",
    "questions": 209
  },
  {
    "title": "INICET_Mock_3",
    "category": "INICET PYQ",
    "file": "INICET_Mock_3.json",
    "questions": 202
  },
  {
    "title": "INICET_Mock_4",
    "category": "INICET PYQ",
    "file": "INICET_Mock_4.json",
    "questions": 200
  },
  {
    "title": "INICET_Mock_7_4_Sections",
    "category": "INICET PYQ",
    "file": "INICET_Mock_7_4_Sections.json",
    "questions": 200
  },
  {
    "title": "INICET_Mock_8_4_Sections",
    "category": "INICET PYQ",
    "file": "INICET_Mock_8_4_Sections.json",
    "questions": 200
  },
  {
    "title": "INICET_Mock_9_4_Sections",
    "category": "INICET PYQ",
    "file": "INICET_Mock_9_4_Sections.json",
    "questions": 200
  },
  {
    "title": "Late Night PYQs (INICET - 1) - 2025-05-06",
    "category": "INICET PYQ",
    "file": "Late_Night_PYQs_INICET_-_1_-_2025-05-06.json",
    "questions": 50
  },
  {
    "title": "Late Night PYQs (INICET - 10) - 2025-05-15",
    "category": "INICET PYQ",
    "file": "Late_Night_PYQs_INICET_-_10_-_2025-05-15.json",
    "questions": 50
  },
  {
    "title": "Late Night PYQs (INICET - 11) - 2025-05-16",
    "category": "INICET PYQ",
    "file": "Late_Night_PYQs_INICET_-_11_-_2025-05-16.json",
    "questions": 50
  },
  {
    "title": "Late Night PYQs (INICET - 2) - 2025-05-07",
    "category": "INICET PYQ",
    "file": "Late_Night_PYQs_INICET_-_2_-_2025-05-07.json",
    "questions": 50
  },
  {
    "title": "Late Night PYQs (INICET - 3) - 2025-05-08",
    "category": "INICET PYQ",
    "file": "Late_Night_PYQs_INICET_-_3_-_2025-05-08.json",
    "questions": 50
  },
  {
    "title": "Late Night PYQs (INICET - 4) - 2025-05-09",
    "category": "INICET PYQ",
    "file": "Late_Night_PYQs_INICET_-_4_-_2025-05-09.json",
    "questions": 50
  },
  {
    "title": "Late Night PYQs (INICET - 5) - 2025-05-10",
    "category": "INICET PYQ",
    "file": "Late_Night_PYQs_INICET_-_5_-_2025-05-10.json",
    "questions": 50
  },
  {
    "title": "Late Night PYQs (INICET - 6) - 2025-05-11",
    "category": "INICET PYQ",
    "file": "Late_Night_PYQs_INICET_-_6_-_2025-05-11.json",
    "questions": 50
  },
  {
    "title": "Late Night PYQs (INICET - 7) - 2025-05-12",
    "category": "INICET PYQ",
    "file": "Late_Night_PYQs_INICET_-_7_-_2025-05-12.json",
    "questions": 50
  },
  {
    "title": "Late Night PYQs (INICET - 8) - 2025-05-13",
    "category": "INICET PYQ",
    "file": "Late_Night_PYQs_INICET_-_8_-_2025-05-13.json",
    "questions": 50
  },
  {
    "title": "Late Night PYQs (INICET - 9) - 2025-05-14",
    "category": "INICET PYQ",
    "file": "Late_Night_PYQs_INICET_-_9_-_2025-05-14.json",
    "questions": 50
  },
  {
    "title": "MEDICINE-(INICET NOV 2024)",
    "category": "INICET PYQ",
    "file": "MEDICINE-INICET_NOV_2024.json",
    "questions": 21
  },
  {
    "title": "MICROBIOLOGY-(INICET NOV 2024)",
    "category": "INICET PYQ",
    "file": "MICROBIOLOGY-INICET_NOV_2024.json",
    "questions": 15
  },
  {
    "title": "Medicine - INICET MAY 2024",
    "category": "INICET PYQ",
    "file": "Medicine_-_INICET_MAY_2024.json",
    "questions": 24
  },
  {
    "title": "Medicine E&D Part 1 - Mission 2.0 (INICET) - 16-09-2024 - 2024-09-16",
    "category": "INICET PYQ",
    "file": "Medicine_ED_Part_1_-_Mission_20_INICET_-_16-09-2024_-_2024-09-16.json",
    "questions": 75
  },
  {
    "title": "Medicine E&D Part 2 - Mission 2.0 (INICET) - 18-09-2024 - 2024-09-18",
    "category": "INICET PYQ",
    "file": "Medicine_ED_Part_2_-_Mission_20_INICET_-_18-09-2024_-_2024-09-18.json",
    "questions": 75
  },
  {
    "title": "Medicine_INICET_PYQ",
    "category": "INICET PYQ",
    "file": "Medicine_INICET_PYQ.json",
    "questions": 266
  },
  {
    "title": "Microbiology - INICET MAY 2024",
    "category": "INICET PYQ",
    "file": "Microbiology_-_INICET_MAY_2024.json",
    "questions": 13
  },
  {
    "title": "Microbiology E&D (Mission NEET PG_INICET 2.0) - 01-06-2024 - 2024-06-01",
    "category": "INICET PYQ",
    "file": "Microbiology_ED_Mission_NEET_PG_INICET_20_-_01-06-2024_-_2024-06-01.json",
    "questions": 100
  },
  {
    "title": "Microbiology E&D - Mission 2.0 (INICET) - 30-09-2024 - 2024-09-30",
    "category": "INICET PYQ",
    "file": "Microbiology_ED_-_Mission_20_INICET_-_30-09-2024_-_2024-09-30.json",
    "questions": 75
  },
  {
    "title": "Microbiology_INICET_PYQ",
    "category": "INICET PYQ",
    "file": "Microbiology_INICET_PYQ.json",
    "questions": 148
  },
  {
    "title": "Mission NEET PG-INICET Grand Test-15 - 16-06-2024 - 2024-06-16",
    "category": "INICET PYQ",
    "file": "Mission_NEET_PG-INICET_Grand_Test-15_-_16-06-2024_-_2024-06-16.json",
    "questions": 200
  },
  {
    "title": "Mission NEET PG-INICET Grand Test-16 - 03-07-2024 - 2024-07-03",
    "category": "INICET PYQ",
    "file": "Mission_NEET_PG-INICET_Grand_Test-16_-_03-07-2024_-_2024-07-03.json",
    "questions": 200
  },
  {
    "title": "Mission NEET PG-INICET Grand Test-17- 29-09-2024 - 2024-09-29",
    "category": "INICET PYQ",
    "file": "Mission_NEET_PG-INICET_Grand_Test-17-_29-09-2024_-_2024-09-29.json",
    "questions": 200
  },
  {
    "title": "Mission NEET PG-INICET Grand Test-18 - 20-11-2024 - 2024-11-20",
    "category": "INICET PYQ",
    "file": "Mission_NEET_PG-INICET_Grand_Test-18_-_20-11-2024_-_2024-11-20.json",
    "questions": 200
  },
  {
    "title": "Mission NEET PG-INICET Grand Test-19 - 16-12-2024 - 2024-12-16",
    "category": "INICET PYQ",
    "file": "Mission_NEET_PG-INICET_Grand_Test-19_-_16-12-2024_-_2024-12-16.json",
    "questions": 200
  },
  {
    "title": "Mission NEET PG-INICET Grand Test-20 - 29-12-2024 - 2024-12-29",
    "category": "INICET PYQ",
    "file": "Mission_NEET_PG-INICET_Grand_Test-20_-_29-12-2024_-_2024-12-29.json",
    "questions": 200
  },
  {
    "title": "Mission NEET PG-INICET Grand Test-21 - 13-01-2025 - 2025-01-13",
    "category": "INICET PYQ",
    "file": "Mission_NEET_PG-INICET_Grand_Test-21_-_13-01-2025_-_2025-01-13.json",
    "questions": 200
  },
  {
    "title": "Mission NEET PG-INICET Grand Test-22 - 31-01-2025 - 2025-01-31",
    "category": "INICET PYQ",
    "file": "Mission_NEET_PG-INICET_Grand_Test-22_-_31-01-2025_-_2025-01-31.json",
    "questions": 200
  },
  {
    "title": "Mission NEET PG-INICET Grand Test-23 - 14-02-2025 - 2025-02-14",
    "category": "INICET PYQ",
    "file": "Mission_NEET_PG-INICET_Grand_Test-23_-_14-02-2025_-_2025-02-14.json",
    "questions": 200
  },
  {
    "title": "Mission NEET PG-INICET Grand Test-24 - 28-02-2025 - 2025-02-28",
    "category": "INICET PYQ",
    "file": "Mission_NEET_PG-INICET_Grand_Test-24_-_28-02-2025_-_2025-02-28.json",
    "questions": 200
  },
  {
    "title": "Mission NEET PG-INICET Grand Test-25 - 10-03-2025 - 2025-03-10",
    "category": "INICET PYQ",
    "file": "Mission_NEET_PG-INICET_Grand_Test-25_-_10-03-2025_-_2025-03-10.json",
    "questions": 200
  },
  {
    "title": "Mission NEET PG-INICET Grand Test-26 - 29-03-2025 - 2025-03-29",
    "category": "INICET PYQ",
    "file": "Mission_NEET_PG-INICET_Grand_Test-26_-_29-03-2025_-_2025-03-29.json",
    "questions": 200
  },
  {
    "title": "Mission NEET PG-INICET Grand Test-27 - 18-04-2025 - 2025-04-18",
    "category": "INICET PYQ",
    "file": "Mission_NEET_PG-INICET_Grand_Test-27_-_18-04-2025_-_2025-04-18.json",
    "questions": 200
  },
  {
    "title": "Mission NEETPG_INICET GT - 1 - 2023-06-25",
    "category": "INICET PYQ",
    "file": "Mission_NEETPG_INICET_GT_-_1_-_2023-06-25.json",
    "questions": 200
  },
  {
    "title": "Mission NEETPG_INICET GT - 10 - 2024-02-19",
    "category": "INICET PYQ",
    "file": "Mission_NEETPG_INICET_GT_-_10_-_2024-02-19.json",
    "questions": 200
  },
  {
    "title": "Mission NEETPG_INICET GT - 11 - 2024-03-03",
    "category": "INICET PYQ",
    "file": "Mission_NEETPG_INICET_GT_-_11_-_2024-03-03.json",
    "questions": 200
  },
  {
    "title": "Mission NEETPG_INICET GT - 12 - 2024-03-17",
    "category": "INICET PYQ",
    "file": "Mission_NEETPG_INICET_GT_-_12_-_2024-03-17.json",
    "questions": 200
  },
  {
    "title": "Mission NEETPG_INICET GT - 13 - 2024-04-08",
    "category": "INICET PYQ",
    "file": "Mission_NEETPG_INICET_GT_-_13_-_2024-04-08.json",
    "questions": 200
  },
  {
    "title": "Mission NEETPG_INICET GT - 14 - 2024-05-05",
    "category": "INICET PYQ",
    "file": "Mission_NEETPG_INICET_GT_-_14_-_2024-05-05.json",
    "questions": 200
  },
  {
    "title": "Mission NEETPG_INICET GT - 15 - 2024-05-27",
    "category": "INICET PYQ",
    "file": "Mission_NEETPG_INICET_GT_-_15_-_2024-05-27.json",
    "questions": 200
  },
  {
    "title": "Mission NEETPG_INICET GT - 2 - 2023-08-06",
    "category": "INICET PYQ",
    "file": "Mission_NEETPG_INICET_GT_-_2_-_2023-08-06.json",
    "questions": 200
  },
  {
    "title": "Mission NEETPG_INICET GT - 3 - 2023-09-03",
    "category": "INICET PYQ",
    "file": "Mission_NEETPG_INICET_GT_-_3_-_2023-09-03.json",
    "questions": 200
  },
  {
    "title": "Mission NEETPG_INICET GT - 4 - 2023-10-08",
    "category": "INICET PYQ",
    "file": "Mission_NEETPG_INICET_GT_-_4_-_2023-10-08.json",
    "questions": 200
  },
  {
    "title": "Mission NEETPG_INICET GT - 5 - 2023-12-01",
    "category": "INICET PYQ",
    "file": "Mission_NEETPG_INICET_GT_-_5_-_2023-12-01.json",
    "questions": 200
  },
  {
    "title": "Mission NEETPG_INICET GT - 6 - 2023-12-18",
    "category": "INICET PYQ",
    "file": "Mission_NEETPG_INICET_GT_-_6_-_2023-12-18.json",
    "questions": 200
  },
  {
    "title": "Mission NEETPG_INICET GT - 7 - 2024-01-05",
    "category": "INICET PYQ",
    "file": "Mission_NEETPG_INICET_GT_-_7_-_2024-01-05.json",
    "questions": 200
  },
  {
    "title": "Mission NEETPG_INICET GT - 8 - 2024-01-21",
    "category": "INICET PYQ",
    "file": "Mission_NEETPG_INICET_GT_-_8_-_2024-01-21.json",
    "questions": 200
  },
  {
    "title": "Mission NEETPG_INICET GT - 9 - 2024-02-04",
    "category": "INICET PYQ",
    "file": "Mission_NEETPG_INICET_GT_-_9_-_2024-02-04.json",
    "questions": 200
  },
  {
    "title": "OBG - INICET MAY 2024",
    "category": "INICET PYQ",
    "file": "OBG_-_INICET_MAY_2024.json",
    "questions": 14
  },
  {
    "title": "OBG E&D (Mission NEET PG_INICET 2.0) - 16-07-2024 - 2024-07-16",
    "category": "INICET PYQ",
    "file": "OBG_ED_Mission_NEET_PG_INICET_20_-_16-07-2024_-_2024-07-16.json",
    "questions": 100
  },
  {
    "title": "OBG E&D - Mission 2.0 (INICET) - 19-10-2024 - 2024-10-19",
    "category": "INICET PYQ",
    "file": "OBG_ED_-_Mission_20_INICET_-_19-10-2024_-_2024-10-19.json",
    "questions": 150
  },
  {
    "title": "OBG-(INICET NOV 2024)",
    "category": "INICET PYQ",
    "file": "OBG-INICET_NOV_2024.json",
    "questions": 16
  },
  {
    "title": "OPHTHALMOLOGY-(INICET NOV 2024)",
    "category": "INICET PYQ",
    "file": "OPHTHALMOLOGY-INICET_NOV_2024.json",
    "questions": 11
  },
  {
    "title": "ORTHOPEDICS-(INICET NOV 2024)",
    "category": "INICET PYQ",
    "file": "ORTHOPEDICS-INICET_NOV_2024.json",
    "questions": 5
  },
  {
    "title": "Obstetrics_INICET_PYQ",
    "category": "INICET PYQ",
    "file": "Obstetrics_INICET_PYQ.json",
    "questions": 164
  },
  {
    "title": "Ophthalmology - INICET MAY 2024",
    "category": "INICET PYQ",
    "file": "Ophthalmology_-_INICET_MAY_2024.json",
    "questions": 11
  },
  {
    "title": "Ophthalmology E&D (Mission NEET PG_INICET 2.0) - 12-07-2024 - 2024-07-12",
    "category": "INICET PYQ",
    "file": "Ophthalmology_ED_Mission_NEET_PG_INICET_20_-_12-07-2024_-_2024-07-12.json",
    "questions": 100
  },
  {
    "title": "Ophthalmology E&D - Mission 2.0 (INICET) - 14-10-2024 - 2024-10-14",
    "category": "INICET PYQ",
    "file": "Ophthalmology_ED_-_Mission_20_INICET_-_14-10-2024_-_2024-10-14.json",
    "questions": 75
  },
  {
    "title": "Opthalmology_INICET_PYQ",
    "category": "INICET PYQ",
    "file": "Opthalmology_INICET_PYQ.json",
    "questions": 141
  },
  {
    "title": "Orthopaedics - INICET MAY 2024",
    "category": "INICET PYQ",
    "file": "Orthopaedics_-_INICET_MAY_2024.json",
    "questions": 6
  },
  {
    "title": "Orthopaedics_INICET_PYQ",
    "category": "INICET PYQ",
    "file": "Orthopaedics_INICET_PYQ.json",
    "questions": 86
  },
  {
    "title": "Orthopedics E&D (Mission NEET PG_INICET 2.0) - 10-08-2024 - 2024-08-10",
    "category": "INICET PYQ",
    "file": "Orthopedics_ED_Mission_NEET_PG_INICET_20_-_10-08-2024_-_2024-08-10.json",
    "questions": 50
  },
  {
    "title": "Orthopedics E&D - Mission 2.0 (INICET) - 30-08-2024 - 2024-08-30",
    "category": "INICET PYQ",
    "file": "Orthopedics_ED_-_Mission_20_INICET_-_30-08-2024_-_2024-08-30.json",
    "questions": 50
  },
  {
    "title": "PATHOLOGY-(INICET NOV 2024)",
    "category": "INICET PYQ",
    "file": "PATHOLOGY-INICET_NOV_2024.json",
    "questions": 18
  },
  {
    "title": "PEDIATRICS-(INICET NOV 2024)",
    "category": "INICET PYQ",
    "file": "PEDIATRICS-INICET_NOV_2024.json",
    "questions": 11
  },
  {
    "title": "PHARMACOLOGY-(INICET NOV 2024)",
    "category": "INICET PYQ",
    "file": "PHARMACOLOGY-INICET_NOV_2024.json",
    "questions": 10
  },
  {
    "title": "PHYSIOLOGY-(INICET NOV 2024)",
    "category": "INICET PYQ",
    "file": "PHYSIOLOGY-INICET_NOV_2024.json",
    "questions": 10
  },
  {
    "title": "PSM - INICET MAY 2024",
    "category": "INICET PYQ",
    "file": "PSM_-_INICET_MAY_2024.json",
    "questions": 7
  },
  {
    "title": "PSM E&D (Mission NEET PG_INICET 2.0) - 07-08-2024 - 2024-08-07",
    "category": "INICET PYQ",
    "file": "PSM_ED_Mission_NEET_PG_INICET_20_-_07-08-2024_-_2024-08-07.json",
    "questions": 100
  },
  {
    "title": "PSM E&D - Mission 2.0 (INICET) - 09-10-2024 - 2024-10-09",
    "category": "INICET PYQ",
    "file": "PSM_ED_-_Mission_20_INICET_-_09-10-2024_-_2024-10-09.json",
    "questions": 100
  },
  {
    "title": "PSM-(INICET NOV 2024)",
    "category": "INICET PYQ",
    "file": "PSM-INICET_NOV_2024.json",
    "questions": 17
  },
  {
    "title": "PSM_INICET_PYQ",
    "category": "INICET PYQ",
    "file": "PSM_INICET_PYQ.json",
    "questions": 194
  },
  {
    "title": "PSYCHIATRY-(INICET NOV 2024)",
    "category": "INICET PYQ",
    "file": "PSYCHIATRY-INICET_NOV_2024.json",
    "questions": 1
  },
  {
    "title": "Pathology - INICET MAY 2024",
    "category": "INICET PYQ",
    "file": "Pathology_-_INICET_MAY_2024.json",
    "questions": 17
  },
  {
    "title": "Pathology E&D (Mission NEET PG_INICET 2.0) - 07-05-2024 - 2024-05-07",
    "category": "INICET PYQ",
    "file": "Pathology_ED_Mission_NEET_PG_INICET_20_-_07-05-2024_-_2024-05-07.json",
    "questions": 70
  },
  {
    "title": "Pathology E&D - Mission 2.0 (INICET) - 10-09-2024 - 2024-09-10",
    "category": "INICET PYQ",
    "file": "Pathology_ED_-_Mission_20_INICET_-_10-09-2024_-_2024-09-10.json",
    "questions": 70
  },
  {
    "title": "Pathology_INICET_PYQ",
    "category": "INICET PYQ",
    "file": "Pathology_INICET_PYQ.json",
    "questions": 258
  },
  {
    "title": "Pediatrics - INICET MAY 2024",
    "category": "INICET PYQ",
    "file": "Pediatrics_-_INICET_MAY_2024.json",
    "questions": 10
  },
  {
    "title": "Pediatrics E&D (Mission NEET PG_INICET 2.0) - 06-06-2024 - 2024-06-06",
    "category": "INICET PYQ",
    "file": "Pediatrics_ED_Mission_NEET_PG_INICET_20_-_06-06-2024_-_2024-06-06.json",
    "questions": 100
  },
  {
    "title": "Pediatrics E&D - Mission 2.0 (INICET) - 22-10-2024 - 2024-10-22",
    "category": "INICET PYQ",
    "file": "Pediatrics_ED_-_Mission_20_INICET_-_22-10-2024_-_2024-10-22.json",
    "questions": 75
  },
  {
    "title": "Pediatrics_INICET_PYQ",
    "category": "INICET PYQ",
    "file": "Pediatrics_INICET_PYQ.json",
    "questions": 151
  },
  {
    "title": "Pharmacology - INICET MAY 2024",
    "category": "INICET PYQ",
    "file": "Pharmacology_-_INICET_MAY_2024.json",
    "questions": 13
  },
  {
    "title": "Pharmacology E&D (Mission NEET PG_INICET 2.0) - 26-05-2024 - 2024-05-26",
    "category": "INICET PYQ",
    "file": "Pharmacology_ED_Mission_NEET_PG_INICET_20_-_26-05-2024_-_2024-05-26.json",
    "questions": 100
  },
  {
    "title": "Pharmacology E&D - Mission 2.0 (INICET) - 08-09-2024 - 2024-09-07",
    "category": "INICET PYQ",
    "file": "Pharmacology_ED_-_Mission_20_INICET_-_08-09-2024_-_2024-09-07.json",
    "questions": 75
  },
  {
    "title": "Pharmacology_INICET_PYQ",
    "category": "INICET PYQ",
    "file": "Pharmacology_INICET_PYQ.json",
    "questions": 272
  },
  {
    "title": "Physiology - INICET MAY 2024",
    "category": "INICET PYQ",
    "file": "Physiology_-_INICET_MAY_2024.json",
    "questions": 11
  },
  {
    "title": "Physiology E&D (Mission NEET PG_INICET 2.0) - 27-06-2024 - 2024-06-27",
    "category": "INICET PYQ",
    "file": "Physiology_ED_Mission_NEET_PG_INICET_20_-_27-06-2024_-_2024-06-27.json",
    "questions": 100
  },
  {
    "title": "Physiology E&D - Mission 2.0 (INICET) - 13-09-2024 - 2024-09-13",
    "category": "INICET PYQ",
    "file": "Physiology_ED_-_Mission_20_INICET_-_13-09-2024_-_2024-09-13.json",
    "questions": 100
  },
  {
    "title": "Physiology_INICET_PYQ",
    "category": "INICET PYQ",
    "file": "Physiology_INICET_PYQ.json",
    "questions": 154
  },
  {
    "title": "Psychiatry - INICET MAY 2024",
    "category": "INICET PYQ",
    "file": "Psychiatry_-_INICET_MAY_2024.json",
    "questions": 6
  },
  {
    "title": "Psychiatry E&D (Mission NEET PG_INICET 2.0) - 23-04-2024 - 2024-04-23",
    "category": "INICET PYQ",
    "file": "Psychiatry_ED_Mission_NEET_PG_INICET_20_-_23-04-2024_-_2024-04-23.json",
    "questions": 75
  },
  {
    "title": "Psychiatry E&D - Mission 2.0 (INICET) - 11-10-2024 - 2024-10-11",
    "category": "INICET PYQ",
    "file": "Psychiatry_ED_-_Mission_20_INICET_-_11-10-2024_-_2024-10-11.json",
    "questions": 75
  },
  {
    "title": "Psychiatry_INICET_PYQ",
    "category": "INICET PYQ",
    "file": "Psychiatry_INICET_PYQ.json",
    "questions": 106
  },
  {
    "title": "RADIOLOGY-(INICET NOV 2024)",
    "category": "INICET PYQ",
    "file": "RADIOLOGY-INICET_NOV_2024.json",
    "questions": 3
  },
  {
    "title": "Radiology - INICET MAY 2024",
    "category": "INICET PYQ",
    "file": "Radiology_-_INICET_MAY_2024.json",
    "questions": 7
  },
  {
    "title": "Radiology E&D (Mission NEET PG_INICET 2.0) - 20-07-2024 - 2024-07-20",
    "category": "INICET PYQ",
    "file": "Radiology_ED_Mission_NEET_PG_INICET_20_-_20-07-2024_-_2024-07-20.json",
    "questions": 50
  },
  {
    "title": "Radiology E&D - Mission 2.0 (INICET) - 28-08-2024 - 2024-08-28",
    "category": "INICET PYQ",
    "file": "Radiology_ED_-_Mission_20_INICET_-_28-08-2024_-_2024-08-28.json",
    "questions": 60
  },
  {
    "title": "Radiology_INICET_PYQ",
    "category": "INICET PYQ",
    "file": "Radiology_INICET_PYQ.json",
    "questions": 117
  },
  {
    "title": "SURGERY-(INICET NOV 2024)",
    "category": "INICET PYQ",
    "file": "SURGERY-INICET_NOV_2024.json",
    "questions": 21
  },
  {
    "title": "Surgery - INICET MAY 2024",
    "category": "INICET PYQ",
    "file": "Surgery_-_INICET_MAY_2024.json",
    "questions": 16
  },
  {
    "title": "Surgery E&D (Mission NEET PG_INICET 2.0) - 29-07-2024 - 2024-07-29",
    "category": "INICET PYQ",
    "file": "Surgery_ED_Mission_NEET_PG_INICET_20_-_29-07-2024_-_2024-07-29.json",
    "questions": 100
  },
  {
    "title": "Surgery E&D - Mission 2.0 (INICET) - 03-09-2024 - 2024-09-03",
    "category": "INICET PYQ",
    "file": "Surgery_ED_-_Mission_20_INICET_-_03-09-2024_-_2024-09-03.json",
    "questions": 100
  },
  {
    "title": "Surgery_INICET_PYQ",
    "category": "INICET PYQ",
    "file": "Surgery_INICET_PYQ.json",
    "questions": 238
  },
  {
    "title": "All India NEET PG Grand Test 1.__.8th Feb 2023.__.FEBRUARY 2023.__..__.1.__.",
    "category": "NEET PG PYQ",
    "file": "All_India_NEET_PG_Grand_Test_1__8th_Feb_2023__FEBRUARY_2023____1__.json",
    "questions": 200
  },
  {
    "title": "All India NEET PG Grand Test 2.__.22nd Feb 2023.__.FEBRUARY 2023.__..__.1.__.",
    "category": "NEET PG PYQ",
    "file": "All_India_NEET_PG_Grand_Test_2__22nd_Feb_2023__FEBRUARY_2023____1__.json",
    "questions": 200
  },
  {
    "title": "All India NEET PG Grand Test.__.4th May 2022.__.MAY 2022.__..__.1.__.",
    "category": "NEET PG PYQ",
    "file": "All_India_NEET_PG_Grand_Test__4th_May_2022__MAY_2022____1__.json",
    "questions": 200
  },
  {
    "title": "Anatomy - NEET PG 2018",
    "category": "NEET PG PYQ",
    "file": "Anatomy_-_NEET_PG_2018.json",
    "questions": 12
  },
  {
    "title": "Anatomy - NEET PG 2019",
    "category": "NEET PG PYQ",
    "file": "Anatomy_-_NEET_PG_2019.json",
    "questions": 20
  },
  {
    "title": "Anatomy - NEET PG 2020",
    "category": "NEET PG PYQ",
    "file": "Anatomy_-_NEET_PG_2020.json",
    "questions": 17
  },
  {
    "title": "Anatomy - NEET PG 2021",
    "category": "NEET PG PYQ",
    "file": "Anatomy_-_NEET_PG_2021.json",
    "questions": 7
  },
  {
    "title": "Anatomy - NEET PG 2022",
    "category": "NEET PG PYQ",
    "file": "Anatomy_-_NEET_PG_2022.json",
    "questions": 3
  },
  {
    "title": "Anatomy - NEET PG 2023",
    "category": "NEET PG PYQ",
    "file": "Anatomy_-_NEET_PG_2023.json",
    "questions": 10
  },
  {
    "title": "Anatomy - NEET PG 2024",
    "category": "NEET PG PYQ",
    "file": "Anatomy_-_NEET_PG_2024.json",
    "questions": 10
  },
  {
    "title": "Anatomy E&D - Mission NEET PG 2.0 - Final Batch - 10-06-2025 - 2025-06-10",
    "category": "NEET PG PYQ",
    "file": "Anatomy_ED_-_Mission_NEET_PG_20_-_Final_Batch_-_10-06-2025_-_2025-06-10.json",
    "questions": 75
  },
  {
    "title": "Anatomy_NEETPG_PYQ",
    "category": "NEET PG PYQ",
    "file": "Anatomy_NEETPG_PYQ.json",
    "questions": 95
  },
  {
    "title": "Anesthesia - NEET PG 2018",
    "category": "NEET PG PYQ",
    "file": "Anesthesia_-_NEET_PG_2018.json",
    "questions": 8
  },
  {
    "title": "Anesthesia - NEET PG 2019",
    "category": "NEET PG PYQ",
    "file": "Anesthesia_-_NEET_PG_2019.json",
    "questions": 7
  },
  {
    "title": "Anesthesia - NEET PG 2020",
    "category": "NEET PG PYQ",
    "file": "Anesthesia_-_NEET_PG_2020.json",
    "questions": 5
  },
  {
    "title": "Anesthesia - NEET PG 2021",
    "category": "NEET PG PYQ",
    "file": "Anesthesia_-_NEET_PG_2021.json",
    "questions": 5
  },
  {
    "title": "Anesthesia - NEET PG 2022",
    "category": "NEET PG PYQ",
    "file": "Anesthesia_-_NEET_PG_2022.json",
    "questions": 3
  },
  {
    "title": "Anesthesia - NEET PG 2023",
    "category": "NEET PG PYQ",
    "file": "Anesthesia_-_NEET_PG_2023.json",
    "questions": 3
  },
  {
    "title": "Anesthesia - NEET PG 2024",
    "category": "NEET PG PYQ",
    "file": "Anesthesia_-_NEET_PG_2024.json",
    "questions": 14
  },
  {
    "title": "Anesthesia E&D (Mission NEET PG) - 14-08-2023 - 2023-08-14",
    "category": "NEET PG PYQ",
    "file": "Anesthesia_ED_Mission_NEET_PG_-_14-08-2023_-_2023-08-14.json",
    "questions": 25
  },
  {
    "title": "Anesthesia E&D - Mission NEET PG 2.0 - Final Batch - 09-06-2025 - 2025-06-09",
    "category": "NEET PG PYQ",
    "file": "Anesthesia_ED_-_Mission_NEET_PG_20_-_Final_Batch_-_09-06-2025_-_2025-06-09.json",
    "questions": 50
  },
  {
    "title": "Anesthesia NEET PG Revision E&D - 24-12-2023 - 2023-12-24",
    "category": "NEET PG PYQ",
    "file": "Anesthesia_NEET_PG_Revision_ED_-_24-12-2023_-_2023-12-24.json",
    "questions": 50
  },
  {
    "title": "Anesthesia_NEETPG_PYQ",
    "category": "NEET PG PYQ",
    "file": "Anesthesia_NEETPG_PYQ.json",
    "questions": 26
  },
  {
    "title": "Biochemistry - NEET PG 2018",
    "category": "NEET PG PYQ",
    "file": "Biochemistry_-_NEET_PG_2018.json",
    "questions": 12
  },
  {
    "title": "Biochemistry - NEET PG 2019",
    "category": "NEET PG PYQ",
    "file": "Biochemistry_-_NEET_PG_2019.json",
    "questions": 24
  },
  {
    "title": "Biochemistry - NEET PG 2020",
    "category": "NEET PG PYQ",
    "file": "Biochemistry_-_NEET_PG_2020.json",
    "questions": 17
  },
  {
    "title": "Biochemistry - NEET PG 2021",
    "category": "NEET PG PYQ",
    "file": "Biochemistry_-_NEET_PG_2021.json",
    "questions": 14
  },
  {
    "title": "Biochemistry - NEET PG 2022",
    "category": "NEET PG PYQ",
    "file": "Biochemistry_-_NEET_PG_2022.json",
    "questions": 19
  },
  {
    "title": "Biochemistry - NEET PG 2023",
    "category": "NEET PG PYQ",
    "file": "Biochemistry_-_NEET_PG_2023.json",
    "questions": 15
  },
  {
    "title": "Biochemistry - NEET PG 2024",
    "category": "NEET PG PYQ",
    "file": "Biochemistry_-_NEET_PG_2024.json",
    "questions": 20
  },
  {
    "title": "Biochemistry E&D (Mission NEET PG) - 09-10-2023 - 2023-10-09",
    "category": "NEET PG PYQ",
    "file": "Biochemistry_ED_Mission_NEET_PG_-_09-10-2023_-_2023-10-09.json",
    "questions": 50
  },
  {
    "title": "Biochemistry E&D - Mission NEET PG 2.0 - Final Batch - 16-06-2025 - 2025-06-16",
    "category": "NEET PG PYQ",
    "file": "Biochemistry_ED_-_Mission_NEET_PG_20_-_Final_Batch_-_16-06-2025_-_2025-06-16.json",
    "questions": 75
  },
  {
    "title": "Biochemistry NEET PG Revision E&D - 09-01-2024 - 2024-01-09",
    "category": "NEET PG PYQ",
    "file": "Biochemistry_NEET_PG_Revision_ED_-_09-01-2024_-_2024-01-09.json",
    "questions": 50
  },
  {
    "title": "Biochemistry_NEETPG_PYQ",
    "category": "NEET PG PYQ",
    "file": "Biochemistry_NEETPG_PYQ.json",
    "questions": 89
  },
  {
    "title": "Champions Exam NEET PG - 2.__.15th Jun 2024.__.JUNE 2024.__..__.1.__.",
    "category": "NEET PG PYQ",
    "file": "Champions_Exam_NEET_PG_-_2__15th_Jun_2024__JUNE_2024____1__.json",
    "questions": 200
  },
  {
    "title": "Champions Exam NEET PG- 3.__.17th Jul 2024.__.JULY 2024.__..__.1.__.",
    "category": "NEET PG PYQ",
    "file": "Champions_Exam_NEET_PG-_3__17th_Jul_2024__JULY_2024____1__.json",
    "questions": 200
  },
  {
    "title": "Champions Exam NEET PG.__.21st May 2025.__.MAY 2025.__..__.1.__.",
    "category": "NEET PG PYQ",
    "file": "Champions_Exam_NEET_PG__21st_May_2025__MAY_2025____1__.json",
    "questions": 200
  },
  {
    "title": "Champions Exam NEET PG.__.7th May 2025.__.MAY 2025.__..__.1.__.",
    "category": "NEET PG PYQ",
    "file": "Champions_Exam_NEET_PG__7th_May_2025__MAY_2025____1__.json",
    "questions": 200
  },
  {
    "title": "Dermatology - NEET PG 2018",
    "category": "NEET PG PYQ",
    "file": "Dermatology_-_NEET_PG_2018.json",
    "questions": 11
  },
  {
    "title": "Dermatology - NEET PG 2019",
    "category": "NEET PG PYQ",
    "file": "Dermatology_-_NEET_PG_2019.json",
    "questions": 9
  },
  {
    "title": "Dermatology - NEET PG 2020",
    "category": "NEET PG PYQ",
    "file": "Dermatology_-_NEET_PG_2020.json",
    "questions": 6
  },
  {
    "title": "Dermatology - NEET PG 2021",
    "category": "NEET PG PYQ",
    "file": "Dermatology_-_NEET_PG_2021.json",
    "questions": 7
  },
  {
    "title": "Dermatology - NEET PG 2022",
    "category": "NEET PG PYQ",
    "file": "Dermatology_-_NEET_PG_2022.json",
    "questions": 4
  },
  {
    "title": "Dermatology - NEET PG 2023",
    "category": "NEET PG PYQ",
    "file": "Dermatology_-_NEET_PG_2023.json",
    "questions": 11
  },
  {
    "title": "Dermatology - NEET PG 2024",
    "category": "NEET PG PYQ",
    "file": "Dermatology_-_NEET_PG_2024.json",
    "questions": 12
  },
  {
    "title": "Dermatology E&D (Mission NEET PG) - 25-07-2023 - 2023-07-25",
    "category": "NEET PG PYQ",
    "file": "Dermatology_ED_Mission_NEET_PG_-_25-07-2023_-_2023-07-25.json",
    "questions": 50
  },
  {
    "title": "Dermatology E&D - Mission NEET PG 2.0 - Final Batch - 11-06-2025 - 2025-06-11",
    "category": "NEET PG PYQ",
    "file": "Dermatology_ED_-_Mission_NEET_PG_20_-_Final_Batch_-_11-06-2025_-_2025-06-11.json",
    "questions": 50
  },
  {
    "title": "Dermatology NEET PG Revision E&D - 21-12-2023 - 2023-12-21",
    "category": "NEET PG PYQ",
    "file": "Dermatology_NEET_PG_Revision_ED_-_21-12-2023_-_2023-12-21.json",
    "questions": 50
  },
  {
    "title": "Dermatology_NEETPG_PYQ",
    "category": "NEET PG PYQ",
    "file": "Dermatology_NEETPG_PYQ.json",
    "questions": 70
  },
  {
    "title": "ENT - NEET PG 2018",
    "category": "NEET PG PYQ",
    "file": "ENT_-_NEET_PG_2018.json",
    "questions": 6
  },
  {
    "title": "ENT - NEET PG 2019",
    "category": "NEET PG PYQ",
    "file": "ENT_-_NEET_PG_2019.json",
    "questions": 7
  },
  {
    "title": "ENT - NEET PG 2020",
    "category": "NEET PG PYQ",
    "file": "ENT_-_NEET_PG_2020.json",
    "questions": 10
  },
  {
    "title": "ENT - NEET PG 2021",
    "category": "NEET PG PYQ",
    "file": "ENT_-_NEET_PG_2021.json",
    "questions": 6
  },
  {
    "title": "ENT - NEET PG 2022",
    "category": "NEET PG PYQ",
    "file": "ENT_-_NEET_PG_2022.json",
    "questions": 9
  },
  {
    "title": "ENT - NEET PG 2023",
    "category": "NEET PG PYQ",
    "file": "ENT_-_NEET_PG_2023.json",
    "questions": 9
  },
  {
    "title": "ENT - NEET PG 2024",
    "category": "NEET PG PYQ",
    "file": "ENT_-_NEET_PG_2024.json",
    "questions": 13
  },
  {
    "title": "ENT E&D (Mission NEET PG) - 10-07-2023 - 2023-07-10",
    "category": "NEET PG PYQ",
    "file": "ENT_ED_Mission_NEET_PG_-_10-07-2023_-_2023-07-10.json",
    "questions": 100
  },
  {
    "title": "ENT NEET PG Revision E&D - 30-01-2024 - 2024-01-30",
    "category": "NEET PG PYQ",
    "file": "ENT_NEET_PG_Revision_ED_-_30-01-2024_-_2024-01-30.json",
    "questions": 50
  },
  {
    "title": "ENT_NEETPG_PYQ",
    "category": "NEET PG PYQ",
    "file": "ENT_NEETPG_PYQ.json",
    "questions": 62
  },
  {
    "title": "FM - NEET PG 2018",
    "category": "NEET PG PYQ",
    "file": "FM_-_NEET_PG_2018.json",
    "questions": 9
  },
  {
    "title": "FM - NEET PG 2019",
    "category": "NEET PG PYQ",
    "file": "FM_-_NEET_PG_2019.json",
    "questions": 9
  },
  {
    "title": "FM - NEET PG 2020",
    "category": "NEET PG PYQ",
    "file": "FM_-_NEET_PG_2020.json",
    "questions": 11
  },
  {
    "title": "FM - NEET PG 2021",
    "category": "NEET PG PYQ",
    "file": "FM_-_NEET_PG_2021.json",
    "questions": 8
  },
  {
    "title": "FM - NEET PG 2022",
    "category": "NEET PG PYQ",
    "file": "FM_-_NEET_PG_2022.json",
    "questions": 5
  },
  {
    "title": "FMT_NEETPG_PYQ",
    "category": "NEET PG PYQ",
    "file": "FMT_NEETPG_PYQ.json",
    "questions": 80
  },
  {
    "title": "Forensic Medicine - NEET PG 2023",
    "category": "NEET PG PYQ",
    "file": "Forensic_Medicine_-_NEET_PG_2023.json",
    "questions": 4
  },
  {
    "title": "Forensic Medicine - NEET PG 2024",
    "category": "NEET PG PYQ",
    "file": "Forensic_Medicine_-_NEET_PG_2024.json",
    "questions": 17
  },
  {
    "title": "Forensic Medicine E&D (Mission NEET PG) - 13-09-2023 - 2023-09-13",
    "category": "NEET PG PYQ",
    "file": "Forensic_Medicine_ED_Mission_NEET_PG_-_13-09-2023_-_2023-09-13.json",
    "questions": 50
  },
  {
    "title": "Forensic Medicine E&D - Mission NEET PG 2.0 - Final Batch - 08-06-2025 - 2025-06-08",
    "category": "NEET PG PYQ",
    "file": "Forensic_Medicine_ED_-_Mission_NEET_PG_20_-_Final_Batch_-_08-06-2025_-_2025-06-08.json",
    "questions": 50
  },
  {
    "title": "Forensic Medicine NEET PG Revision E&D - 07-01-2024 - 2024-01-07",
    "category": "NEET PG PYQ",
    "file": "Forensic_Medicine_NEET_PG_Revision_ED_-_07-01-2024_-_2024-01-07.json",
    "questions": 50
  },
  {
    "title": "Free_Grand_Test_Pattern_of_NEETPG",
    "category": "NEET PG PYQ",
    "file": "Free_Grand_Test_Pattern_of_NEETPG.json",
    "questions": 200
  },
  {
    "title": "Free_National_Mock_Test_Based_on_NEETPG_May",
    "category": "NEET PG PYQ",
    "file": "Free_National_Mock_Test_Based_on_NEETPG_May.json",
    "questions": 200
  },
  {
    "title": "Gynaecology_NEETPG_PYQ",
    "category": "NEET PG PYQ",
    "file": "Gynaecology_NEETPG_PYQ.json",
    "questions": 90
  },
  {
    "title": "Late Night PYQs (NEETPG) - Final\u00a01 - 2025-06-10",
    "category": "NEET PG PYQ",
    "file": "Late_Night_PYQs_NEETPG_-_Final\u00a01_-_2025-06-10.json",
    "questions": 50
  },
  {
    "title": "Late Night PYQs (NEETPG) - Final\u00a02 - 2025-06-11",
    "category": "NEET PG PYQ",
    "file": "Late_Night_PYQs_NEETPG_-_Final\u00a02_-_2025-06-11.json",
    "questions": 50
  },
  {
    "title": "Late Night PYQs (NEETPG) - Final\u00a03 - 2025-06-12",
    "category": "NEET PG PYQ",
    "file": "Late_Night_PYQs_NEETPG_-_Final\u00a03_-_2025-06-12.json",
    "questions": 50
  },
  {
    "title": "Late Night PYQs (NEETPG-1) - 2025-05-17",
    "category": "NEET PG PYQ",
    "file": "Late_Night_PYQs_NEETPG-1_-_2025-05-17.json",
    "questions": 50
  },
  {
    "title": "Late Night PYQs (NEETPG-10) - 2025-05-26",
    "category": "NEET PG PYQ",
    "file": "Late_Night_PYQs_NEETPG-10_-_2025-05-26.json",
    "questions": 50
  },
  {
    "title": "Late Night PYQs (NEETPG-11) - 2025-05-27",
    "category": "NEET PG PYQ",
    "file": "Late_Night_PYQs_NEETPG-11_-_2025-05-27.json",
    "questions": 50
  },
  {
    "title": "Late Night PYQs (NEETPG-12) - 2025-05-28",
    "category": "NEET PG PYQ",
    "file": "Late_Night_PYQs_NEETPG-12_-_2025-05-28.json",
    "questions": 50
  },
  {
    "title": "Late Night PYQs (NEETPG-13) - 2025-05-29",
    "category": "NEET PG PYQ",
    "file": "Late_Night_PYQs_NEETPG-13_-_2025-05-29.json",
    "questions": 50
  },
  {
    "title": "Late Night PYQs (NEETPG-14) - 2025-05-30",
    "category": "NEET PG PYQ",
    "file": "Late_Night_PYQs_NEETPG-14_-_2025-05-30.json",
    "questions": 50
  },
  {
    "title": "Late Night PYQs (NEETPG-15) - 2025-05-31",
    "category": "NEET PG PYQ",
    "file": "Late_Night_PYQs_NEETPG-15_-_2025-05-31.json",
    "questions": 50
  },
  {
    "title": "Late Night PYQs (NEETPG-16) - 2025-06-01",
    "category": "NEET PG PYQ",
    "file": "Late_Night_PYQs_NEETPG-16_-_2025-06-01.json",
    "questions": 50
  },
  {
    "title": "Late Night PYQs (NEETPG-17) - 2025-06-02",
    "category": "NEET PG PYQ",
    "file": "Late_Night_PYQs_NEETPG-17_-_2025-06-02.json",
    "questions": 50
  },
  {
    "title": "Late Night PYQs (NEETPG-18) - 2025-06-03",
    "category": "NEET PG PYQ",
    "file": "Late_Night_PYQs_NEETPG-18_-_2025-06-03.json",
    "questions": 50
  },
  {
    "title": "Late Night PYQs (NEETPG-19) - 2025-06-04",
    "category": "NEET PG PYQ",
    "file": "Late_Night_PYQs_NEETPG-19_-_2025-06-04.json",
    "questions": 50
  },
  {
    "title": "Late Night PYQs (NEETPG-2) - 2025-05-18",
    "category": "NEET PG PYQ",
    "file": "Late_Night_PYQs_NEETPG-2_-_2025-05-18.json",
    "questions": 50
  },
  {
    "title": "Late Night PYQs (NEETPG-20) - 2025-06-05",
    "category": "NEET PG PYQ",
    "file": "Late_Night_PYQs_NEETPG-20_-_2025-06-05.json",
    "questions": 50
  },
  {
    "title": "Late Night PYQs (NEETPG-21) - 2025-06-06",
    "category": "NEET PG PYQ",
    "file": "Late_Night_PYQs_NEETPG-21_-_2025-06-06.json",
    "questions": 50
  },
  {
    "title": "Late Night PYQs (NEETPG-22) - 2025-06-07",
    "category": "NEET PG PYQ",
    "file": "Late_Night_PYQs_NEETPG-22_-_2025-06-07.json",
    "questions": 50
  },
  {
    "title": "Late Night PYQs (NEETPG-23) - 2025-06-08",
    "category": "NEET PG PYQ",
    "file": "Late_Night_PYQs_NEETPG-23_-_2025-06-08.json",
    "questions": 50
  },
  {
    "title": "Late Night PYQs (NEETPG-24) - 2025-06-09",
    "category": "NEET PG PYQ",
    "file": "Late_Night_PYQs_NEETPG-24_-_2025-06-09.json",
    "questions": 50
  },
  {
    "title": "Late Night PYQs (NEETPG-3) - 2025-05-19",
    "category": "NEET PG PYQ",
    "file": "Late_Night_PYQs_NEETPG-3_-_2025-05-19.json",
    "questions": 50
  },
  {
    "title": "Late Night PYQs (NEETPG-4) - 2025-05-20",
    "category": "NEET PG PYQ",
    "file": "Late_Night_PYQs_NEETPG-4_-_2025-05-20.json",
    "questions": 50
  },
  {
    "title": "Late Night PYQs (NEETPG-5) - 2025-05-21",
    "category": "NEET PG PYQ",
    "file": "Late_Night_PYQs_NEETPG-5_-_2025-05-21.json",
    "questions": 50
  },
  {
    "title": "Late Night PYQs (NEETPG-6) - 2025-05-22",
    "category": "NEET PG PYQ",
    "file": "Late_Night_PYQs_NEETPG-6_-_2025-05-22.json",
    "questions": 50
  },
  {
    "title": "Late Night PYQs (NEETPG-7) - 2025-05-23",
    "category": "NEET PG PYQ",
    "file": "Late_Night_PYQs_NEETPG-7_-_2025-05-23.json",
    "questions": 50
  },
  {
    "title": "Late Night PYQs (NEETPG-8) - 2025-05-24",
    "category": "NEET PG PYQ",
    "file": "Late_Night_PYQs_NEETPG-8_-_2025-05-24.json",
    "questions": 50
  },
  {
    "title": "Late Night PYQs (NEETPG-9) - 2025-05-25",
    "category": "NEET PG PYQ",
    "file": "Late_Night_PYQs_NEETPG-9_-_2025-05-25.json",
    "questions": 50
  },
  {
    "title": "Medicine - NEET PG 2018",
    "category": "NEET PG PYQ",
    "file": "Medicine_-_NEET_PG_2018.json",
    "questions": 46
  },
  {
    "title": "Medicine - NEET PG 2019",
    "category": "NEET PG PYQ",
    "file": "Medicine_-_NEET_PG_2019.json",
    "questions": 17
  },
  {
    "title": "Medicine - NEET PG 2020",
    "category": "NEET PG PYQ",
    "file": "Medicine_-_NEET_PG_2020.json",
    "questions": 17
  },
  {
    "title": "Medicine - NEET PG 2021",
    "category": "NEET PG PYQ",
    "file": "Medicine_-_NEET_PG_2021.json",
    "questions": 22
  },
  {
    "title": "Medicine - NEET PG 2022",
    "category": "NEET PG PYQ",
    "file": "Medicine_-_NEET_PG_2022.json",
    "questions": 21
  },
  {
    "title": "Medicine - NEET PG 2023",
    "category": "NEET PG PYQ",
    "file": "Medicine_-_NEET_PG_2023.json",
    "questions": 21
  },
  {
    "title": "Medicine - NEET PG 2024",
    "category": "NEET PG PYQ",
    "file": "Medicine_-_NEET_PG_2024.json",
    "questions": 41
  },
  {
    "title": "Medicine E&D Part-1 (Mission NEET PG) - 11-08-2023 - 2023-08-11",
    "category": "NEET PG PYQ",
    "file": "Medicine_ED_Part-1_Mission_NEET_PG_-_11-08-2023_-_2023-08-11.json",
    "questions": 74
  },
  {
    "title": "Medicine E&D Part-2 (Mission NEET PG) - 10-11-2023 - 2023-11-10",
    "category": "NEET PG PYQ",
    "file": "Medicine_ED_Part-2_Mission_NEET_PG_-_10-11-2023_-_2023-11-10.json",
    "questions": 75
  },
  {
    "title": "Medicine NEET PG Revision E&D - 30-11-2023 - 2023-11-30",
    "category": "NEET PG PYQ",
    "file": "Medicine_NEET_PG_Revision_ED_-_30-11-2023_-_2023-11-30.json",
    "questions": 100
  },
  {
    "title": "Medicine_NEETPG_PYQ",
    "category": "NEET PG PYQ",
    "file": "Medicine_NEETPG_PYQ.json",
    "questions": 152
  },
  {
    "title": "Microbiology - NEET PG 2018",
    "category": "NEET PG PYQ",
    "file": "Microbiology_-_NEET_PG_2018.json",
    "questions": 11
  },
  {
    "title": "Microbiology - NEET PG 2019",
    "category": "NEET PG PYQ",
    "file": "Microbiology_-_NEET_PG_2019.json",
    "questions": 25
  },
  {
    "title": "Microbiology - NEET PG 2020",
    "category": "NEET PG PYQ",
    "file": "Microbiology_-_NEET_PG_2020.json",
    "questions": 19
  },
  {
    "title": "Microbiology - NEET PG 2021",
    "category": "NEET PG PYQ",
    "file": "Microbiology_-_NEET_PG_2021.json",
    "questions": 14
  },
  {
    "title": "Microbiology - NEET PG 2022",
    "category": "NEET PG PYQ",
    "file": "Microbiology_-_NEET_PG_2022.json",
    "questions": 17
  },
  {
    "title": "Microbiology - NEET PG 2023",
    "category": "NEET PG PYQ",
    "file": "Microbiology_-_NEET_PG_2023.json",
    "questions": 4
  },
  {
    "title": "Microbiology - NEET PG 2024",
    "category": "NEET PG PYQ",
    "file": "Microbiology_-_NEET_PG_2024.json",
    "questions": 25
  },
  {
    "title": "Microbiology E&D (Mission NEET PG) - 20-10-2023 - 2023-10-20",
    "category": "NEET PG PYQ",
    "file": "Microbiology_ED_Mission_NEET_PG_-_20-10-2023_-_2023-10-20.json",
    "questions": 50
  },
  {
    "title": "Microbiology E&D - Mission NEET PG 2.0 - Final Batch - 15-06-2025 - 2025-06-15",
    "category": "NEET PG PYQ",
    "file": "Microbiology_ED_-_Mission_NEET_PG_20_-_Final_Batch_-_15-06-2025_-_2025-06-15.json",
    "questions": 75
  },
  {
    "title": "Microbiology NEET PG Revision E&D - 30-12-2023 - 2023-12-30",
    "category": "NEET PG PYQ",
    "file": "Microbiology_NEET_PG_Revision_ED_-_30-12-2023_-_2023-12-30.json",
    "questions": 50
  },
  {
    "title": "Microbiology_NEETPG_PYQ",
    "category": "NEET PG PYQ",
    "file": "Microbiology_NEETPG_PYQ.json",
    "questions": 111
  },
  {
    "title": "Mid Day PYQs (NEET PG)\u00a0-\u00a0Final\u00a01 - 2025-06-11",
    "category": "NEET PG PYQ",
    "file": "Mid_Day_PYQs_NEET_PG\u00a0-\u00a0Final\u00a01_-_2025-06-11.json",
    "questions": 25
  },
  {
    "title": "Mid Day PYQs (NEET PG)\u00a0-\u00a0Final\u00a02 - 2025-06-12",
    "category": "NEET PG PYQ",
    "file": "Mid_Day_PYQs_NEET_PG\u00a0-\u00a0Final\u00a02_-_2025-06-12.json",
    "questions": 25
  },
  {
    "title": "Mid Day PYQs (NEETPG-1) - 2025-05-17",
    "category": "NEET PG PYQ",
    "file": "Mid_Day_PYQs_NEETPG-1_-_2025-05-17.json",
    "questions": 25
  },
  {
    "title": "Mid Day PYQs (NEETPG-10) - 2025-05-26",
    "category": "NEET PG PYQ",
    "file": "Mid_Day_PYQs_NEETPG-10_-_2025-05-26.json",
    "questions": 25
  },
  {
    "title": "Mid Day PYQs (NEETPG-11) - 2025-05-27",
    "category": "NEET PG PYQ",
    "file": "Mid_Day_PYQs_NEETPG-11_-_2025-05-27.json",
    "questions": 25
  },
  {
    "title": "Mid Day PYQs (NEETPG-12) - 2025-05-28",
    "category": "NEET PG PYQ",
    "file": "Mid_Day_PYQs_NEETPG-12_-_2025-05-28.json",
    "questions": 25
  },
  {
    "title": "Mid Day PYQs (NEETPG-13) - 2025-05-29",
    "category": "NEET PG PYQ",
    "file": "Mid_Day_PYQs_NEETPG-13_-_2025-05-29.json",
    "questions": 25
  },
  {
    "title": "Mid Day PYQs (NEETPG-14) - 2025-05-30",
    "category": "NEET PG PYQ",
    "file": "Mid_Day_PYQs_NEETPG-14_-_2025-05-30.json",
    "questions": 25
  },
  {
    "title": "Mid Day PYQs (NEETPG-15) - 2025-05-31",
    "category": "NEET PG PYQ",
    "file": "Mid_Day_PYQs_NEETPG-15_-_2025-05-31.json",
    "questions": 25
  },
  {
    "title": "Mid Day PYQs (NEETPG-16) - 2025-06-01",
    "category": "NEET PG PYQ",
    "file": "Mid_Day_PYQs_NEETPG-16_-_2025-06-01.json",
    "questions": 25
  },
  {
    "title": "Mid Day PYQs (NEETPG-17) - 2025-06-02",
    "category": "NEET PG PYQ",
    "file": "Mid_Day_PYQs_NEETPG-17_-_2025-06-02.json",
    "questions": 25
  },
  {
    "title": "Mid Day PYQs (NEETPG-18) - 2025-06-03",
    "category": "NEET PG PYQ",
    "file": "Mid_Day_PYQs_NEETPG-18_-_2025-06-03.json",
    "questions": 25
  },
  {
    "title": "Mid Day PYQs (NEETPG-19) - 2025-06-04",
    "category": "NEET PG PYQ",
    "file": "Mid_Day_PYQs_NEETPG-19_-_2025-06-04.json",
    "questions": 25
  },
  {
    "title": "Mid Day PYQs (NEETPG-2) - 2025-05-18",
    "category": "NEET PG PYQ",
    "file": "Mid_Day_PYQs_NEETPG-2_-_2025-05-18.json",
    "questions": 25
  },
  {
    "title": "Mid Day PYQs (NEETPG-20) - 2025-06-05",
    "category": "NEET PG PYQ",
    "file": "Mid_Day_PYQs_NEETPG-20_-_2025-06-05.json",
    "questions": 25
  },
  {
    "title": "Mid Day PYQs (NEETPG-21) - 2025-06-06",
    "category": "NEET PG PYQ",
    "file": "Mid_Day_PYQs_NEETPG-21_-_2025-06-06.json",
    "questions": 25
  },
  {
    "title": "Mid Day PYQs (NEETPG-22) - 2025-06-07",
    "category": "NEET PG PYQ",
    "file": "Mid_Day_PYQs_NEETPG-22_-_2025-06-07.json",
    "questions": 25
  },
  {
    "title": "Mid Day PYQs (NEETPG-23) - 2025-06-08",
    "category": "NEET PG PYQ",
    "file": "Mid_Day_PYQs_NEETPG-23_-_2025-06-08.json",
    "questions": 25
  },
  {
    "title": "Mid Day PYQs (NEETPG-24) - 2025-06-09",
    "category": "NEET PG PYQ",
    "file": "Mid_Day_PYQs_NEETPG-24_-_2025-06-09.json",
    "questions": 25
  },
  {
    "title": "Mid Day PYQs (NEETPG-25) - 2025-06-10",
    "category": "NEET PG PYQ",
    "file": "Mid_Day_PYQs_NEETPG-25_-_2025-06-10.json",
    "questions": 25
  },
  {
    "title": "Mid Day PYQs (NEETPG-3) - 2025-05-19",
    "category": "NEET PG PYQ",
    "file": "Mid_Day_PYQs_NEETPG-3_-_2025-05-19.json",
    "questions": 25
  },
  {
    "title": "Mid Day PYQs (NEETPG-4) - 2025-05-20",
    "category": "NEET PG PYQ",
    "file": "Mid_Day_PYQs_NEETPG-4_-_2025-05-20.json",
    "questions": 25
  },
  {
    "title": "Mid Day PYQs (NEETPG-5) - 2025-05-21",
    "category": "NEET PG PYQ",
    "file": "Mid_Day_PYQs_NEETPG-5_-_2025-05-21.json",
    "questions": 25
  },
  {
    "title": "Mid Day PYQs (NEETPG-6) - 2025-05-22",
    "category": "NEET PG PYQ",
    "file": "Mid_Day_PYQs_NEETPG-6_-_2025-05-22.json",
    "questions": 24
  },
  {
    "title": "Mid Day PYQs (NEETPG-7) - 2025-05-23",
    "category": "NEET PG PYQ",
    "file": "Mid_Day_PYQs_NEETPG-7_-_2025-05-23.json",
    "questions": 25
  },
  {
    "title": "Mid Day PYQs (NEETPG-8) - 2025-05-24",
    "category": "NEET PG PYQ",
    "file": "Mid_Day_PYQs_NEETPG-8_-_2025-05-24.json",
    "questions": 25
  },
  {
    "title": "Mid Day PYQs (NEETPG-9) - 2025-05-25",
    "category": "NEET PG PYQ",
    "file": "Mid_Day_PYQs_NEETPG-9_-_2025-05-25.json",
    "questions": 25
  },
  {
    "title": "NEET Mock with Video Solutions - 11-07-2024 - 2024-07-11",
    "category": "NEET PG PYQ",
    "file": "NEET_Mock_with_Video_Solutions_-_11-07-2024_-_2024-07-11.json",
    "questions": 200
  },
  {
    "title": "NEET PG 2018",
    "category": "NEET PG PYQ",
    "file": "NEET_PG_2018.json",
    "questions": 293
  },
  {
    "title": "NEET PG 2018 - 2018-01-07",
    "category": "NEET PG PYQ",
    "file": "NEET_PG_2018_-_2018-01-07.json",
    "questions": 300
  },
  {
    "title": "NEET PG 2019",
    "category": "NEET PG PYQ",
    "file": "NEET_PG_2019.json",
    "questions": 299
  },
  {
    "title": "NEET PG 2019 - 2019-01-06",
    "category": "NEET PG PYQ",
    "file": "NEET_PG_2019_-_2019-01-06.json",
    "questions": 300
  },
  {
    "title": "NEET PG 2020",
    "category": "NEET PG PYQ",
    "file": "NEET_PG_2020.json",
    "questions": 298
  },
  {
    "title": "NEET PG 2020 - 2020-01-05",
    "category": "NEET PG PYQ",
    "file": "NEET_PG_2020_-_2020-01-05.json",
    "questions": 300
  },
  {
    "title": "NEET PG 2021",
    "category": "NEET PG PYQ",
    "file": "NEET_PG_2021.json",
    "questions": 200
  },
  {
    "title": "NEET PG 2021 - 2021-09-11",
    "category": "NEET PG PYQ",
    "file": "NEET_PG_2021_-_2021-09-11.json",
    "questions": 200
  },
  {
    "title": "NEET PG 2022",
    "category": "NEET PG PYQ",
    "file": "NEET_PG_2022.json",
    "questions": 200
  },
  {
    "title": "NEET PG 2022 - 2022-05-21",
    "category": "NEET PG PYQ",
    "file": "NEET_PG_2022_-_2022-05-21.json",
    "questions": 200
  },
  {
    "title": "NEET PG 2023",
    "category": "NEET PG PYQ",
    "file": "NEET_PG_2023.json",
    "questions": 200
  },
  {
    "title": "NEET PG 2023 - 2023-03-05",
    "category": "NEET PG PYQ",
    "file": "NEET_PG_2023_-_2023-03-05.json",
    "questions": 200
  },
  {
    "title": "NEET PG 2024 - Session 1 - 2024-08-11",
    "category": "NEET PG PYQ",
    "file": "NEET_PG_2024_-_Session_1_-_2024-08-11.json",
    "questions": 200
  },
  {
    "title": "NEET PG 2024 - Session 2 - 2024-08-11",
    "category": "NEET PG PYQ",
    "file": "NEET_PG_2024_-_Session_2_-_2024-08-11.json",
    "questions": 200
  },
  {
    "title": "NEET PG August 2024 (Evening Batch)",
    "category": "NEET PG PYQ",
    "file": "NEET_PG_August_2024_Evening_Batch.json",
    "questions": 200
  },
  {
    "title": "NEET PG August 2024 (Morning Batch)",
    "category": "NEET PG PYQ",
    "file": "NEET_PG_August_2024_Morning_Batch.json",
    "questions": 200
  },
  {
    "title": "NEET PG Champions Exam.__.22nd May 2024.__.MAY 2024.__..__.1.__.",
    "category": "NEET PG PYQ",
    "file": "NEET_PG_Champions_Exam__22nd_May_2024__MAY_2024____1__.json",
    "questions": 200
  },
  {
    "title": "NEET PG Grand Test 01.__.10th May 2023.__.MAY 2023.__..__.1.__.",
    "category": "NEET PG PYQ",
    "file": "NEET_PG_Grand_Test_01__10th_May_2023__MAY_2023____1__.json",
    "questions": 200
  },
  {
    "title": "NEET PG Grand Test 01.__.24th Mar 2021.__.MARCH 2021.__..__.1.__.",
    "category": "NEET PG PYQ",
    "file": "NEET_PG_Grand_Test_01__24th_Mar_2021__MARCH_2021____1__.json",
    "questions": 200
  },
  {
    "title": "NEET PG Grand Test 01.__.8th Jun 2022.__.JUNE 2022.__..__.0.__.",
    "category": "NEET PG PYQ",
    "file": "NEET_PG_Grand_Test_01__8th_Jun_2022__JUNE_2022____0__.json",
    "questions": 200
  },
  {
    "title": "NEET PG Grand Test 02.__.19th Jul 2023.__.JULY 2023.__..__.1.__.",
    "category": "NEET PG PYQ",
    "file": "NEET_PG_Grand_Test_02__19th_Jul_2023__JULY_2023____1__.json",
    "questions": 200
  },
  {
    "title": "NEET PG Grand Test 02.__.7th Apr 2021.__.APRIL 2021.__..__.0.__.",
    "category": "NEET PG PYQ",
    "file": "NEET_PG_Grand_Test_02__7th_Apr_2021__APRIL_2021____0__.json",
    "questions": 200
  },
  {
    "title": "NEET PG Grand Test 03.__.10th Aug 2022.__.AUGUST 2022.__..__.0.__.",
    "category": "NEET PG PYQ",
    "file": "NEET_PG_Grand_Test_03__10th_Aug_2022__AUGUST_2022____0__.json",
    "questions": 200
  },
  {
    "title": "NEET PG Grand Test 03.__.20th Sep 2023.__.SEPTEMBER 2023.__..__.1.__.",
    "category": "NEET PG PYQ",
    "file": "NEET_PG_Grand_Test_03__20th_Sep_2023__SEPTEMBER_2023____1__.json",
    "questions": 200
  },
  {
    "title": "NEET PG Grand Test 03.__.23rd Apr 2021.__.APRIL 2021.__..__.1.__.",
    "category": "NEET PG PYQ",
    "file": "NEET_PG_Grand_Test_03__23rd_Apr_2021__APRIL_2021____1__.json",
    "questions": 200
  },
  {
    "title": "NEET PG Grand Test 04.__.14th Sep 2022.__.SEPTEMBER 2022.__..__.0.__.",
    "category": "NEET PG PYQ",
    "file": "NEET_PG_Grand_Test_04__14th_Sep_2022__SEPTEMBER_2022____0__.json",
    "questions": 200
  },
  {
    "title": "NEET PG Grand Test 04.__.22nd Nov 2023.__.NOVEMBER 2023.__..__.1.__.",
    "category": "NEET PG PYQ",
    "file": "NEET_PG_Grand_Test_04__22nd_Nov_2023__NOVEMBER_2023____1__.json",
    "questions": 200
  },
  {
    "title": "NEET PG Grand Test 04.__.7th May 2021.__.MAY 2021.__..__.1.__.",
    "category": "NEET PG PYQ",
    "file": "NEET_PG_Grand_Test_04__7th_May_2021__MAY_2021____1__.json",
    "questions": 200
  },
  {
    "title": "NEET PG Grand Test 05.__.12th May 2021.__.MAY 2021.__..__.1.__.",
    "category": "NEET PG PYQ",
    "file": "NEET_PG_Grand_Test_05__12th_May_2021__MAY_2021____1__.json",
    "questions": 200
  },
  {
    "title": "NEET PG Grand Test 05.__.12th Oct 2022.__.OCTOBER 2022.__..__.0.__.",
    "category": "NEET PG PYQ",
    "file": "NEET_PG_Grand_Test_05__12th_Oct_2022__OCTOBER_2022____0__.json",
    "questions": 200
  },
  {
    "title": "NEET PG Grand Test 05.__.15th Jan 2025.__.JANUARY 2025.__..__.0.__.",
    "category": "NEET PG PYQ",
    "file": "NEET_PG_Grand_Test_05__15th_Jan_2025__JANUARY_2025____0__.json",
    "questions": 200
  },
  {
    "title": "NEET PG Grand Test 05.__.20th Dec 2023.__.DECEMBER 2023.__..__.1.__.",
    "category": "NEET PG PYQ",
    "file": "NEET_PG_Grand_Test_05__20th_Dec_2023__DECEMBER_2023____1__.json",
    "questions": 200
  },
  {
    "title": "NEET PG Grand Test 06.__.20th Mar 2025.__.MARCH 2025.__..__.0.__.",
    "category": "NEET PG PYQ",
    "file": "NEET_PG_Grand_Test_06__20th_Mar_2025__MARCH_2025____0__.json",
    "questions": 200
  },
  {
    "title": "NEET PG Grand Test 06.__.21st May 2021.__.MAY 2021.__..__.1.__.",
    "category": "NEET PG PYQ",
    "file": "NEET_PG_Grand_Test_06__21st_May_2021__MAY_2021____1__.json",
    "questions": 197
  },
  {
    "title": "NEET PG Grand Test 06.__.9th Nov 2022.__.NOVEMBER 2022.__..__.0.__.",
    "category": "NEET PG PYQ",
    "file": "NEET_PG_Grand_Test_06__9th_Nov_2022__NOVEMBER_2022____0__.json",
    "questions": 200
  },
  {
    "title": "NEET PG Grand Test 07.__.14th Jul 2022.__.JULY 2022.__..__.0.__.",
    "category": "NEET PG PYQ",
    "file": "NEET_PG_Grand_Test_07__14th_Jul_2022__JULY_2022____0__.json",
    "questions": 200
  },
  {
    "title": "NEET PG Grand Test 07.__.7th Jul 2021.__.JULY 2021.__..__.0.__.",
    "category": "NEET PG PYQ",
    "file": "NEET_PG_Grand_Test_07__7th_Jul_2021__JULY_2021____0__.json",
    "questions": 200
  },
  {
    "title": "NEET PG Grand Test 08.__.21st Jul 2021.__.JULY 2021.__..__.0.__.",
    "category": "NEET PG PYQ",
    "file": "NEET_PG_Grand_Test_08__21st_Jul_2021__JULY_2021____0__.json",
    "questions": 200
  },
  {
    "title": "NEET PG Grand Test 08.__.28th Dec 2022.__.DECEMBER 2022.__..__.0.__.",
    "category": "NEET PG PYQ",
    "file": "NEET_PG_Grand_Test_08__28th_Dec_2022__DECEMBER_2022____0__.json",
    "questions": 200
  },
  {
    "title": "NEET PG Grand Test 09.__.11th Jan 2023.__.JANUARY 2023.__..__.0.__.",
    "category": "NEET PG PYQ",
    "file": "NEET_PG_Grand_Test_09__11th_Jan_2023__JANUARY_2023____0__.json",
    "questions": 200
  },
  {
    "title": "NEET PG Grand Test 09.__.4th Aug 2021.__.AUGUST 2021.__..__.0.__.",
    "category": "NEET PG PYQ",
    "file": "NEET_PG_Grand_Test_09__4th_Aug_2021__AUGUST_2021____0__.json",
    "questions": 200
  },
  {
    "title": "NEET PG Grand Test 1.__.24th Jan 2024.__.JANUARY 2024.__..__.0.__.",
    "category": "NEET PG PYQ",
    "file": "NEET_PG_Grand_Test_1__24th_Jan_2024__JANUARY_2024____0__.json",
    "questions": 100
  },
  {
    "title": "NEET PG Grand Test 10.__.1st Sep 2021.__.SEPTEMBER 2021.__..__.1.__.",
    "category": "NEET PG PYQ",
    "file": "NEET_PG_Grand_Test_10__1st_Sep_2021__SEPTEMBER_2021____1__.json",
    "questions": 200
  },
  {
    "title": "NEET PG Grand Test 11.__.29th Sep 2021.__.SEPTEMBER 2021.__..__.1.__.",
    "category": "NEET PG PYQ",
    "file": "NEET_PG_Grand_Test_11__29th_Sep_2021__SEPTEMBER_2021____1__.json",
    "questions": 200
  },
  {
    "title": "NEET PG Grand Test 12.__.24th Nov 2021.__.NOVEMBER 2021.__..__.1.__.",
    "category": "NEET PG PYQ",
    "file": "NEET_PG_Grand_Test_12__24th_Nov_2021__NOVEMBER_2021____1__.json",
    "questions": 200
  },
  {
    "title": "NEET PG Grand Test 13.__.8th Dec 2021.__.DECEMBER 2021.__..__.0.__.",
    "category": "NEET PG PYQ",
    "file": "NEET_PG_Grand_Test_13__8th_Dec_2021__DECEMBER_2021____0__.json",
    "questions": 200
  },
  {
    "title": "NEET PG Grand Test 14.__.19th Jan 2022.__.JANUARY 2022.__..__.0.__.",
    "category": "NEET PG PYQ",
    "file": "NEET_PG_Grand_Test_14__19th_Jan_2022__JANUARY_2022____0__.json",
    "questions": 200
  },
  {
    "title": "NEET PG Grand Test 15.__.9th Feb 2022.__.FEBRUARY 2022.__..__.0.__.",
    "category": "NEET PG PYQ",
    "file": "NEET_PG_Grand_Test_15__9th_Feb_2022__FEBRUARY_2022____0__.json",
    "questions": 200
  },
  {
    "title": "NEET PG Grand Test 16.__.23rd Feb 2022.__.FEBRUARY 2022.__..__.0.__.",
    "category": "NEET PG PYQ",
    "file": "NEET_PG_Grand_Test_16__23rd_Feb_2022__FEBRUARY_2022____0__.json",
    "questions": 200
  },
  {
    "title": "NEET PG Grand Test 17.__.23rd Mar 2022.__.MARCH 2022.__..__.0.__.",
    "category": "NEET PG PYQ",
    "file": "NEET_PG_Grand_Test_17__23rd_Mar_2022__MARCH_2022____0__.json",
    "questions": 200
  },
  {
    "title": "NEET PG Grand Test 18.__.13th Apr 2022.__.APRIL 2022.__..__.0.__.",
    "category": "NEET PG PYQ",
    "file": "NEET_PG_Grand_Test_18__13th_Apr_2022__APRIL_2022____0__.json",
    "questions": 200
  },
  {
    "title": "NEET PG Grand Test 19.__.27th Apr 2022.__.APRIL 2022.__..__.1.__.",
    "category": "NEET PG PYQ",
    "file": "NEET_PG_Grand_Test_19__27th_Apr_2022__APRIL_2022____1__.json",
    "questions": 200
  },
  {
    "title": "NEET PG Grand Test 2.__.13th Jul 2022.__.JULY 2022.__..__.0.__.",
    "category": "NEET PG PYQ",
    "file": "NEET_PG_Grand_Test_2__13th_Jul_2022__JULY_2022____0__.json",
    "questions": 200
  },
  {
    "title": "NEET PG Grand Test 2.__.14th Feb 2024.__.FEBRUARY 2024.__..__.0.__.",
    "category": "NEET PG PYQ",
    "file": "NEET_PG_Grand_Test_2__14th_Feb_2024__FEBRUARY_2024____0__.json",
    "questions": 200
  },
  {
    "title": "NEET PG Grand Test 4.__.13th Nov 2024.__.NOVEMBER 2024.__..__.0.__.",
    "category": "NEET PG PYQ",
    "file": "NEET_PG_Grand_Test_4__13th_Nov_2024__NOVEMBER_2024____0__.json",
    "questions": 200
  },
  {
    "title": "NEET PG PYQ BASED MOCK TEST - 30-07-2024 - 2024-07-30",
    "category": "NEET PG PYQ",
    "file": "NEET_PG_PYQ_BASED_MOCK_TEST_-_30-07-2024_-_2024-07-30.json",
    "questions": 200
  },
  {
    "title": "NEET PG_INI-CET BASELINE GRAND TEST - 31-08-2024 - 2024-08-31",
    "category": "NEET PG PYQ",
    "file": "NEET_PG_INI-CET_BASELINE_GRAND_TEST_-_31-08-2024_-_2024-08-31.json",
    "questions": 200
  },
  {
    "title": "NEETPG June 2024 Mock Test-1 - 10-06-2024 - 2024-06-10",
    "category": "NEET PG PYQ",
    "file": "NEETPG_June_2024_Mock_Test-1_-_10-06-2024_-_2024-06-10.json",
    "questions": 200
  },
  {
    "title": "NEETPG Mock-1 (Advanced Difficulty) - 22-05-2025 - 2025-05-22",
    "category": "NEET PG PYQ",
    "file": "NEETPG_Mock-1_Advanced_Difficulty_-_22-05-2025_-_2025-05-22.json",
    "questions": 200
  },
  {
    "title": "NEETPG Mock-2 (Standard Difficulty) - 30-05-2025 - 2025-05-30",
    "category": "NEET PG PYQ",
    "file": "NEETPG_Mock-2_Standard_Difficulty_-_30-05-2025_-_2025-05-30.json",
    "questions": 200
  },
  {
    "title": "NEETPG Mock-3 (Standard Difficulty) - 15-06-2025 - 2025-06-15",
    "category": "NEET PG PYQ",
    "file": "NEETPG_Mock-3_Standard_Difficulty_-_15-06-2025_-_2025-06-15.json",
    "questions": 200
  },
  {
    "title": "NEETPG Mock-4 (Standard Difficulty) - 02-07-2025 - 2025-07-02",
    "category": "NEET PG PYQ",
    "file": "NEETPG_Mock-4_Standard_Difficulty_-_02-07-2025_-_2025-07-02.json",
    "questions": 200
  },
  {
    "title": "NEETPG_Mock_Test_August",
    "category": "NEET PG PYQ",
    "file": "NEETPG_Mock_Test_August.json",
    "questions": 200
  },
  {
    "title": "NEET_PG_2023_5_Sections",
    "category": "NEET PG PYQ",
    "file": "NEET_PG_2023_5_Sections.json",
    "questions": 200
  },
  {
    "title": "NEET_PG_2024_Paper_Part-A_5_Sections",
    "category": "NEET PG PYQ",
    "file": "NEET_PG_2024_Paper_Part-A_5_Sections.json",
    "questions": 200
  },
  {
    "title": "NEET_PG_2024_Paper_Part-B_5_Sections",
    "category": "NEET PG PYQ",
    "file": "NEET_PG_2024_Paper_Part-B_5_Sections.json",
    "questions": 200
  },
  {
    "title": "NEET_PG_Mock_10_5_Section",
    "category": "NEET PG PYQ",
    "file": "NEET_PG_Mock_10_5_Section.json",
    "questions": 200
  },
  {
    "title": "NEET_PG_Mock_10_5_Section",
    "category": "NEET PG PYQ",
    "file": "NEET_PG_Mock_10_5_Section_1.json",
    "questions": 200
  },
  {
    "title": "NEET_PG_Mock_1_5_Sections",
    "category": "NEET PG PYQ",
    "file": "NEET_PG_Mock_1_5_Sections.json",
    "questions": 199
  },
  {
    "title": "NEET_PG_Mock_1_5_Sections",
    "category": "NEET PG PYQ",
    "file": "NEET_PG_Mock_1_5_Sections_1.json",
    "questions": 199
  },
  {
    "title": "NEET_PG_Mock_1_Based_On_Clinical_Pattern",
    "category": "NEET PG PYQ",
    "file": "NEET_PG_Mock_1_Based_On_Clinical_Pattern.json",
    "questions": 200
  },
  {
    "title": "NEET_PG_Mock_2_5_Sections",
    "category": "NEET PG PYQ",
    "file": "NEET_PG_Mock_2_5_Sections.json",
    "questions": 200
  },
  {
    "title": "NEET_PG_Mock_2_5_Sections",
    "category": "NEET PG PYQ",
    "file": "NEET_PG_Mock_2_5_Sections_1.json",
    "questions": 200
  },
  {
    "title": "NEET_PG_Mock_2_Based_On_Clinical_Pattern",
    "category": "NEET PG PYQ",
    "file": "NEET_PG_Mock_2_Based_On_Clinical_Pattern.json",
    "questions": 200
  },
  {
    "title": "NEET_PG_Mock_3_5_Sections",
    "category": "NEET PG PYQ",
    "file": "NEET_PG_Mock_3_5_Sections.json",
    "questions": 200
  },
  {
    "title": "NEET_PG_Mock_3_5_Sections",
    "category": "NEET PG PYQ",
    "file": "NEET_PG_Mock_3_5_Sections_1.json",
    "questions": 200
  },
  {
    "title": "NEET_PG_Mock_4_5_Sections",
    "category": "NEET PG PYQ",
    "file": "NEET_PG_Mock_4_5_Sections.json",
    "questions": 200
  },
  {
    "title": "NEET_PG_Mock_4_5_Sections",
    "category": "NEET PG PYQ",
    "file": "NEET_PG_Mock_4_5_Sections_1.json",
    "questions": 200
  },
  {
    "title": "NEET_PG_Mock_5_5_Sections",
    "category": "NEET PG PYQ",
    "file": "NEET_PG_Mock_5_5_Sections.json",
    "questions": 200
  },
  {
    "title": "NEET_PG_Mock_5_5_Sections",
    "category": "NEET PG PYQ",
    "file": "NEET_PG_Mock_5_5_Sections_1.json",
    "questions": 200
  },
  {
    "title": "NEET_PG_Mock_6_5_Section",
    "category": "NEET PG PYQ",
    "file": "NEET_PG_Mock_6_5_Section.json",
    "questions": 200
  },
  {
    "title": "NEET_PG_Mock_6_5_Section",
    "category": "NEET PG PYQ",
    "file": "NEET_PG_Mock_6_5_Section_1.json",
    "questions": 200
  },
  {
    "title": "NEET_PG_Mock_7_5_Section",
    "category": "NEET PG PYQ",
    "file": "NEET_PG_Mock_7_5_Section.json",
    "questions": 200
  },
  {
    "title": "NEET_PG_Mock_7_5_Section",
    "category": "NEET PG PYQ",
    "file": "NEET_PG_Mock_7_5_Section_1.json",
    "questions": 200
  },
  {
    "title": "NEET_PG_Mock_8_5_Section",
    "category": "NEET PG PYQ",
    "file": "NEET_PG_Mock_8_5_Section.json",
    "questions": 196
  },
  {
    "title": "NEET_PG_Mock_8_5_Section",
    "category": "NEET PG PYQ",
    "file": "NEET_PG_Mock_8_5_Section_1.json",
    "questions": 196
  },
  {
    "title": "NEET_PG_Mock_9_5_Section",
    "category": "NEET PG PYQ",
    "file": "NEET_PG_Mock_9_5_Section.json",
    "questions": 200
  },
  {
    "title": "NEET_PG_Mock_9_5_Section",
    "category": "NEET PG PYQ",
    "file": "NEET_PG_Mock_9_5_Section_1.json",
    "questions": 200
  },
  {
    "title": "OBG - NEET PG 2018",
    "category": "NEET PG PYQ",
    "file": "OBG_-_NEET_PG_2018.json",
    "questions": 22
  },
  {
    "title": "OBG - NEET PG 2019",
    "category": "NEET PG PYQ",
    "file": "OBG_-_NEET_PG_2019.json",
    "questions": 25
  },
  {
    "title": "OBG - NEET PG 2020",
    "category": "NEET PG PYQ",
    "file": "OBG_-_NEET_PG_2020.json",
    "questions": 20
  },
  {
    "title": "OBG - NEET PG 2021",
    "category": "NEET PG PYQ",
    "file": "OBG_-_NEET_PG_2021.json",
    "questions": 17
  },
  {
    "title": "OBG - NEET PG 2022",
    "category": "NEET PG PYQ",
    "file": "OBG_-_NEET_PG_2022.json",
    "questions": 25
  },
  {
    "title": "OBG - NEET PG 2023",
    "category": "NEET PG PYQ",
    "file": "OBG_-_NEET_PG_2023.json",
    "questions": 17
  },
  {
    "title": "OBG - NEET PG 2024",
    "category": "NEET PG PYQ",
    "file": "OBG_-_NEET_PG_2024.json",
    "questions": 45
  },
  {
    "title": "OBG E&D (Mission NEET PG) - 04-08-2023 - 2023-08-04",
    "category": "NEET PG PYQ",
    "file": "OBG_ED_Mission_NEET_PG_-_04-08-2023_-_2023-08-04.json",
    "questions": 75
  },
  {
    "title": "OBG NEET PG Revision E&D - 16-01-2024 - 2024-01-16",
    "category": "NEET PG PYQ",
    "file": "OBG_NEET_PG_Revision_ED_-_16-01-2024_-_2024-01-16.json",
    "questions": 50
  },
  {
    "title": "Obstetrics_NEETPG_PYQ",
    "category": "NEET PG PYQ",
    "file": "Obstetrics_NEETPG_PYQ.json",
    "questions": 106
  },
  {
    "title": "Ophthalmology - NEET PG 2018",
    "category": "NEET PG PYQ",
    "file": "Ophthalmology_-_NEET_PG_2018.json",
    "questions": 12
  },
  {
    "title": "Ophthalmology - NEET PG 2019",
    "category": "NEET PG PYQ",
    "file": "Ophthalmology_-_NEET_PG_2019.json",
    "questions": 12
  },
  {
    "title": "Ophthalmology - NEET PG 2020",
    "category": "NEET PG PYQ",
    "file": "Ophthalmology_-_NEET_PG_2020.json",
    "questions": 13
  },
  {
    "title": "Ophthalmology - NEET PG 2021",
    "category": "NEET PG PYQ",
    "file": "Ophthalmology_-_NEET_PG_2021.json",
    "questions": 10
  },
  {
    "title": "Ophthalmology - NEET PG 2022",
    "category": "NEET PG PYQ",
    "file": "Ophthalmology_-_NEET_PG_2022.json",
    "questions": 5
  },
  {
    "title": "Ophthalmology - NEET PG 2023",
    "category": "NEET PG PYQ",
    "file": "Ophthalmology_-_NEET_PG_2023.json",
    "questions": 10
  },
  {
    "title": "Ophthalmology - NEET PG 2024",
    "category": "NEET PG PYQ",
    "file": "Ophthalmology_-_NEET_PG_2024.json",
    "questions": 14
  },
  {
    "title": "Ophthalmology E&D (Mission NEET PG) - 27-08-2023 - 2023-08-27",
    "category": "NEET PG PYQ",
    "file": "Ophthalmology_ED_Mission_NEET_PG_-_27-08-2023_-_2023-08-27.json",
    "questions": 50
  },
  {
    "title": "Ophthalmology NEET PG Revision E&D - 27-01-2024 - 2024-01-27",
    "category": "NEET PG PYQ",
    "file": "Ophthalmology_NEET_PG_Revision_ED_-_27-01-2024_-_2024-01-27.json",
    "questions": 50
  },
  {
    "title": "Opthalmology_NEETPG_PYQ",
    "category": "NEET PG PYQ",
    "file": "Opthalmology_NEETPG_PYQ.json",
    "questions": 81
  },
  {
    "title": "Orthopaedics - NEET PG 2018",
    "category": "NEET PG PYQ",
    "file": "Orthopaedics_-_NEET_PG_2018.json",
    "questions": 13
  },
  {
    "title": "Orthopaedics - NEET PG 2019",
    "category": "NEET PG PYQ",
    "file": "Orthopaedics_-_NEET_PG_2019.json",
    "questions": 12
  },
  {
    "title": "Orthopaedics - NEET PG 2020",
    "category": "NEET PG PYQ",
    "file": "Orthopaedics_-_NEET_PG_2020.json",
    "questions": 2
  },
  {
    "title": "Orthopaedics - NEET PG 2021",
    "category": "NEET PG PYQ",
    "file": "Orthopaedics_-_NEET_PG_2021.json",
    "questions": 4
  },
  {
    "title": "Orthopaedics - NEET PG 2022",
    "category": "NEET PG PYQ",
    "file": "Orthopaedics_-_NEET_PG_2022.json",
    "questions": 3
  },
  {
    "title": "Orthopaedics - NEET PG 2023",
    "category": "NEET PG PYQ",
    "file": "Orthopaedics_-_NEET_PG_2023.json",
    "questions": 5
  },
  {
    "title": "Orthopaedics - NEET PG 2024",
    "category": "NEET PG PYQ",
    "file": "Orthopaedics_-_NEET_PG_2024.json",
    "questions": 16
  },
  {
    "title": "Orthopedics E&D (Mission NEET PG) - 14-07-2023 - 2023-07-14",
    "category": "NEET PG PYQ",
    "file": "Orthopedics_ED_Mission_NEET_PG_-_14-07-2023_-_2023-07-14.json",
    "questions": 50
  },
  {
    "title": "Orthopedics NEET PG Revision E&D - 12-12-2023 - 2023-12-12",
    "category": "NEET PG PYQ",
    "file": "Orthopedics_NEET_PG_Revision_ED_-_12-12-2023_-_2023-12-12.json",
    "questions": 50
  },
  {
    "title": "Orthopedics_NEETPG_PYQ",
    "category": "NEET PG PYQ",
    "file": "Orthopedics_NEETPG_PYQ.json",
    "questions": 41
  },
  {
    "title": "PSM - NEET PG 2018",
    "category": "NEET PG PYQ",
    "file": "PSM_-_NEET_PG_2018.json",
    "questions": 20
  },
  {
    "title": "PSM - NEET PG 2019",
    "category": "NEET PG PYQ",
    "file": "PSM_-_NEET_PG_2019.json",
    "questions": 25
  },
  {
    "title": "PSM - NEET PG 2020",
    "category": "NEET PG PYQ",
    "file": "PSM_-_NEET_PG_2020.json",
    "questions": 18
  },
  {
    "title": "PSM - NEET PG 2021",
    "category": "NEET PG PYQ",
    "file": "PSM_-_NEET_PG_2021.json",
    "questions": 15
  },
  {
    "title": "PSM - NEET PG 2022",
    "category": "NEET PG PYQ",
    "file": "PSM_-_NEET_PG_2022.json",
    "questions": 12
  },
  {
    "title": "PSM - NEET PG 2023",
    "category": "NEET PG PYQ",
    "file": "PSM_-_NEET_PG_2023.json",
    "questions": 8
  },
  {
    "title": "PSM - NEET PG 2024",
    "category": "NEET PG PYQ",
    "file": "PSM_-_NEET_PG_2024.json",
    "questions": 33
  },
  {
    "title": "PSM E&D (Mission NEET PG) - 21-09-2023 - 2023-09-21",
    "category": "NEET PG PYQ",
    "file": "PSM_ED_Mission_NEET_PG_-_21-09-2023_-_2023-09-21.json",
    "questions": 50
  },
  {
    "title": "PSM E&D - Mission NEET PG 2.0 - Final Batch - 13-06-2025 - 2025-06-13",
    "category": "NEET PG PYQ",
    "file": "PSM_ED_-_Mission_NEET_PG_20_-_Final_Batch_-_13-06-2025_-_2025-06-13.json",
    "questions": 75
  },
  {
    "title": "PSM NEET PG Revision E&D - 17-12-2023 - 2023-12-17",
    "category": "NEET PG PYQ",
    "file": "PSM_NEET_PG_Revision_ED_-_17-12-2023_-_2023-12-17.json",
    "questions": 42
  },
  {
    "title": "PSM_NEETPG_PYQ",
    "category": "NEET PG PYQ",
    "file": "PSM_NEETPG_PYQ.json",
    "questions": 133
  },
  {
    "title": "Pathology - NEET PG 2018",
    "category": "NEET PG PYQ",
    "file": "Pathology_-_NEET_PG_2018.json",
    "questions": 24
  },
  {
    "title": "Pathology - NEET PG 2019",
    "category": "NEET PG PYQ",
    "file": "Pathology_-_NEET_PG_2019.json",
    "questions": 13
  },
  {
    "title": "Pathology - NEET PG 2020",
    "category": "NEET PG PYQ",
    "file": "Pathology_-_NEET_PG_2020.json",
    "questions": 26
  },
  {
    "title": "Pathology - NEET PG 2021",
    "category": "NEET PG PYQ",
    "file": "Pathology_-_NEET_PG_2021.json",
    "questions": 10
  },
  {
    "title": "Pathology - NEET PG 2022",
    "category": "NEET PG PYQ",
    "file": "Pathology_-_NEET_PG_2022.json",
    "questions": 9
  },
  {
    "title": "Pathology - NEET PG 2023",
    "category": "NEET PG PYQ",
    "file": "Pathology_-_NEET_PG_2023.json",
    "questions": 5
  },
  {
    "title": "Pathology - NEET PG 2024",
    "category": "NEET PG PYQ",
    "file": "Pathology_-_NEET_PG_2024.json",
    "questions": 33
  },
  {
    "title": "Pathology E&D (Mission NEET PG) - 14-10-2023 - 2023-10-14",
    "category": "NEET PG PYQ",
    "file": "Pathology_ED_Mission_NEET_PG_-_14-10-2023_-_2023-10-14.json",
    "questions": 50
  },
  {
    "title": "Pathology NEET PG Revision E&D - 24-11-2023 - 2023-11-24",
    "category": "NEET PG PYQ",
    "file": "Pathology_NEET_PG_Revision_ED_-_24-11-2023_-_2023-11-24.json",
    "questions": 50
  },
  {
    "title": "Pathology_NEETPG_PYQ",
    "category": "NEET PG PYQ",
    "file": "Pathology_NEETPG_PYQ.json",
    "questions": 164
  },
  {
    "title": "Pediatrics - NEET PG 2018",
    "category": "NEET PG PYQ",
    "file": "Pediatrics_-_NEET_PG_2018.json",
    "questions": 6
  },
  {
    "title": "Pediatrics - NEET PG 2019",
    "category": "NEET PG PYQ",
    "file": "Pediatrics_-_NEET_PG_2019.json",
    "questions": 8
  },
  {
    "title": "Pediatrics - NEET PG 2020",
    "category": "NEET PG PYQ",
    "file": "Pediatrics_-_NEET_PG_2020.json",
    "questions": 10
  },
  {
    "title": "Pediatrics - NEET PG 2021",
    "category": "NEET PG PYQ",
    "file": "Pediatrics_-_NEET_PG_2021.json",
    "questions": 7
  },
  {
    "title": "Pediatrics - NEET PG 2022",
    "category": "NEET PG PYQ",
    "file": "Pediatrics_-_NEET_PG_2022.json",
    "questions": 5
  },
  {
    "title": "Pediatrics - NEET PG 2023",
    "category": "NEET PG PYQ",
    "file": "Pediatrics_-_NEET_PG_2023.json",
    "questions": 14
  },
  {
    "title": "Pediatrics - NEET PG 2024",
    "category": "NEET PG PYQ",
    "file": "Pediatrics_-_NEET_PG_2024.json",
    "questions": 6
  },
  {
    "title": "Pediatrics E&D (Mission NEET PG) - 31-07-2023 - 2023-07-31",
    "category": "NEET PG PYQ",
    "file": "Pediatrics_ED_Mission_NEET_PG_-_31-07-2023_-_2023-07-31.json",
    "questions": 124
  },
  {
    "title": "Pediatrics NEET PG Revision E&D - 19-01-2024 - 2024-01-19",
    "category": "NEET PG PYQ",
    "file": "Pediatrics_NEET_PG_Revision_ED_-_19-01-2024_-_2024-01-19.json",
    "questions": 100
  },
  {
    "title": "Pediatrics_NEETPG_PYQ",
    "category": "NEET PG PYQ",
    "file": "Pediatrics_NEETPG_PYQ.json",
    "questions": 38
  },
  {
    "title": "Pharmacology - NEET PG 2018",
    "category": "NEET PG PYQ",
    "file": "Pharmacology_-_NEET_PG_2018.json",
    "questions": 22
  },
  {
    "title": "Pharmacology - NEET PG 2019",
    "category": "NEET PG PYQ",
    "file": "Pharmacology_-_NEET_PG_2019.json",
    "questions": 29
  },
  {
    "title": "Pharmacology - NEET PG 2020",
    "category": "NEET PG PYQ",
    "file": "Pharmacology_-_NEET_PG_2020.json",
    "questions": 19
  },
  {
    "title": "Pharmacology - NEET PG 2021",
    "category": "NEET PG PYQ",
    "file": "Pharmacology_-_NEET_PG_2021.json",
    "questions": 21
  },
  {
    "title": "Pharmacology - NEET PG 2022",
    "category": "NEET PG PYQ",
    "file": "Pharmacology_-_NEET_PG_2022.json",
    "questions": 18
  },
  {
    "title": "Pharmacology - NEET PG 2023",
    "category": "NEET PG PYQ",
    "file": "Pharmacology_-_NEET_PG_2023.json",
    "questions": 6
  },
  {
    "title": "Pharmacology - NEET PG 2024",
    "category": "NEET PG PYQ",
    "file": "Pharmacology_-_NEET_PG_2024.json",
    "questions": 24
  },
  {
    "title": "Pharmacology E&D 1 (Mission NEET PG 1.0) - 27-09-2023 - 2023-09-27",
    "category": "NEET PG PYQ",
    "file": "Pharmacology_ED_1_Mission_NEET_PG_10_-_27-09-2023_-_2023-09-27.json",
    "questions": 50
  },
  {
    "title": "Pharmacology Revision E&D 2 (Mission NEET PG 1.0) - 17-11-2023 - 2023-11-17",
    "category": "NEET PG PYQ",
    "file": "Pharmacology_Revision_ED_2_Mission_NEET_PG_10_-_17-11-2023_-_2023-11-17.json",
    "questions": 50
  },
  {
    "title": "Pharmacology_NEETPG_PYQ",
    "category": "NEET PG PYQ",
    "file": "Pharmacology_NEETPG_PYQ.json",
    "questions": 192
  },
  {
    "title": "Physiology - NEET PG 2018",
    "category": "NEET PG PYQ",
    "file": "Physiology_-_NEET_PG_2018.json",
    "questions": 16
  },
  {
    "title": "Physiology - NEET PG 2019",
    "category": "NEET PG PYQ",
    "file": "Physiology_-_NEET_PG_2019.json",
    "questions": 20
  },
  {
    "title": "Physiology - NEET PG 2020",
    "category": "NEET PG PYQ",
    "file": "Physiology_-_NEET_PG_2020.json",
    "questions": 25
  },
  {
    "title": "Physiology - NEET PG 2021",
    "category": "NEET PG PYQ",
    "file": "Physiology_-_NEET_PG_2021.json",
    "questions": 9
  },
  {
    "title": "Physiology - NEET PG 2022",
    "category": "NEET PG PYQ",
    "file": "Physiology_-_NEET_PG_2022.json",
    "questions": 10
  },
  {
    "title": "Physiology - NEET PG 2023",
    "category": "NEET PG PYQ",
    "file": "Physiology_-_NEET_PG_2023.json",
    "questions": 11
  },
  {
    "title": "Physiology - NEET PG 2024",
    "category": "NEET PG PYQ",
    "file": "Physiology_-_NEET_PG_2024.json",
    "questions": 16
  },
  {
    "title": "Physiology E&D (Mission NEET PG) - 04-10-2023 - 2023-10-04",
    "category": "NEET PG PYQ",
    "file": "Physiology_ED_Mission_NEET_PG_-_04-10-2023_-_2023-10-04.json",
    "questions": 100
  },
  {
    "title": "Physiology NEET PG Revision E&D - 21-11-2023 - 2023-11-21",
    "category": "NEET PG PYQ",
    "file": "Physiology_NEET_PG_Revision_ED_-_21-11-2023_-_2023-11-21.json",
    "questions": 100
  },
  {
    "title": "Physiology NEET PG Revision E&D - 26-11-2023 - 2023-11-26",
    "category": "NEET PG PYQ",
    "file": "Physiology_NEET_PG_Revision_ED_-_26-11-2023_-_2023-11-26.json",
    "questions": 50
  },
  {
    "title": "Physiology_NEETPG_PYQ",
    "category": "NEET PG PYQ",
    "file": "Physiology_NEETPG_PYQ.json",
    "questions": 69
  },
  {
    "title": "Psychiatry - NEET PG 2018",
    "category": "NEET PG PYQ",
    "file": "Psychiatry_-_NEET_PG_2018.json",
    "questions": 12
  },
  {
    "title": "Psychiatry - NEET PG 2019",
    "category": "NEET PG PYQ",
    "file": "Psychiatry_-_NEET_PG_2019.json",
    "questions": 9
  },
  {
    "title": "Psychiatry - NEET PG 2020",
    "category": "NEET PG PYQ",
    "file": "Psychiatry_-_NEET_PG_2020.json",
    "questions": 4
  },
  {
    "title": "Psychiatry - NEET PG 2021",
    "category": "NEET PG PYQ",
    "file": "Psychiatry_-_NEET_PG_2021.json",
    "questions": 5
  },
  {
    "title": "Psychiatry - NEET PG 2022",
    "category": "NEET PG PYQ",
    "file": "Psychiatry_-_NEET_PG_2022.json",
    "questions": 2
  },
  {
    "title": "Psychiatry - NEET PG 2023",
    "category": "NEET PG PYQ",
    "file": "Psychiatry_-_NEET_PG_2023.json",
    "questions": 4
  },
  {
    "title": "Psychiatry - NEET PG 2024",
    "category": "NEET PG PYQ",
    "file": "Psychiatry_-_NEET_PG_2024.json",
    "questions": 10
  },
  {
    "title": "Psychiatry E&D (Mission NEET PG) - 05-07-2023 - 2023-07-05",
    "category": "NEET PG PYQ",
    "file": "Psychiatry_ED_Mission_NEET_PG_-_05-07-2023_-_2023-07-05.json",
    "questions": 50
  },
  {
    "title": "Psychiatry_NEETPG_PYQ",
    "category": "NEET PG PYQ",
    "file": "Psychiatry_NEETPG_PYQ.json",
    "questions": 51
  },
  {
    "title": "Radiology - NEET PG 2018",
    "category": "NEET PG PYQ",
    "file": "Radiology_-_NEET_PG_2018.json",
    "questions": 10
  },
  {
    "title": "Radiology - NEET PG 2019",
    "category": "NEET PG PYQ",
    "file": "Radiology_-_NEET_PG_2019.json",
    "questions": 15
  },
  {
    "title": "Radiology - NEET PG 2020",
    "category": "NEET PG PYQ",
    "file": "Radiology_-_NEET_PG_2020.json",
    "questions": 14
  },
  {
    "title": "Radiology - NEET PG 2021",
    "category": "NEET PG PYQ",
    "file": "Radiology_-_NEET_PG_2021.json",
    "questions": 9
  },
  {
    "title": "Radiology - NEET PG 2022",
    "category": "NEET PG PYQ",
    "file": "Radiology_-_NEET_PG_2022.json",
    "questions": 4
  },
  {
    "title": "Radiology - NEET PG 2023",
    "category": "NEET PG PYQ",
    "file": "Radiology_-_NEET_PG_2023.json",
    "questions": 9
  },
  {
    "title": "Radiology - NEET PG 2024",
    "category": "NEET PG PYQ",
    "file": "Radiology_-_NEET_PG_2024.json",
    "questions": 15
  },
  {
    "title": "Radiology E&D (Mission NEET PG) - 17-07-2023 - 2023-07-17",
    "category": "NEET PG PYQ",
    "file": "Radiology_ED_Mission_NEET_PG_-_17-07-2023_-_2023-07-17.json",
    "questions": 50
  },
  {
    "title": "Radiology NEET PG Revision E&D - 10-12-2023 - 2023-12-10",
    "category": "NEET PG PYQ",
    "file": "Radiology_NEET_PG_Revision_ED_-_10-12-2023_-_2023-12-10.json",
    "questions": 50
  },
  {
    "title": "Radiology_NEET_PG_PYQ",
    "category": "NEET PG PYQ",
    "file": "Radiology_NEET_PG_PYQ.json",
    "questions": 90
  },
  {
    "title": "Surgery - NEET PG -2023",
    "category": "NEET PG PYQ",
    "file": "Surgery_-_NEET_PG_-2023.json",
    "questions": 22
  },
  {
    "title": "Surgery - NEET PG 2018",
    "category": "NEET PG PYQ",
    "file": "Surgery_-_NEET_PG_2018.json",
    "questions": 17
  },
  {
    "title": "Surgery - NEET PG 2019",
    "category": "NEET PG PYQ",
    "file": "Surgery_-_NEET_PG_2019.json",
    "questions": 23
  },
  {
    "title": "Surgery - NEET PG 2020",
    "category": "NEET PG PYQ",
    "file": "Surgery_-_NEET_PG_2020.json",
    "questions": 26
  },
  {
    "title": "Surgery - NEET PG 2021",
    "category": "NEET PG PYQ",
    "file": "Surgery_-_NEET_PG_2021.json",
    "questions": 19
  },
  {
    "title": "Surgery - NEET PG 2022",
    "category": "NEET PG PYQ",
    "file": "Surgery_-_NEET_PG_2022.json",
    "questions": 24
  },
  {
    "title": "Surgery - NEET PG 2024",
    "category": "NEET PG PYQ",
    "file": "Surgery_-_NEET_PG_2024.json",
    "questions": 37
  },
  {
    "title": "Surgery E&D Part-1 (Mission NEET PG) - 01-09-2023 - 2023-09-01",
    "category": "NEET PG PYQ",
    "file": "Surgery_ED_Part-1_Mission_NEET_PG_-_01-09-2023_-_2023-09-01.json",
    "questions": 60
  },
  {
    "title": "Surgery E&D Part-2 (Mission NEET PG) - 08-09-2023 - 2023-09-08",
    "category": "NEET PG PYQ",
    "file": "Surgery_ED_Part-2_Mission_NEET_PG_-_08-09-2023_-_2023-09-08.json",
    "questions": 60
  },
  {
    "title": "Surgery NEET PG Revision E&D - 06-12-2023 - 2023-12-06",
    "category": "NEET PG PYQ",
    "file": "Surgery_NEET_PG_Revision_ED_-_06-12-2023_-_2023-12-06.json",
    "questions": 50
  },
  {
    "title": "Surgery_NEETPG_PYQ",
    "category": "NEET PG PYQ",
    "file": "Surgery_NEETPG_PYQ.json",
    "questions": 212
  },
  {
    "title": "Amenorrhoea",
    "category": "Prepladder / RR",
    "file": "Amenorrhoea.json",
    "questions": 37
  },
  {
    "title": "Amenorrhoea",
    "category": "Prepladder / RR",
    "file": "Amenorrhoea_1.json",
    "questions": 66
  },
  {
    "title": "Anesthetic Implication of Concurrent Diseases",
    "category": "Prepladder / RR",
    "file": "Anesthetic_Implication_of_Concurrent_Diseases.json",
    "questions": 19
  },
  {
    "title": "Anovulation__Hormonal_Disorders_and_Amenorrheas",
    "category": "Prepladder / RR",
    "file": "Anovulation__Hormonal_Disorders_and_Amenorrheas.json",
    "questions": 14
  },
  {
    "title": "Antepartum_Hemorrhage",
    "category": "Prepladder / RR",
    "file": "Antepartum_Hemorrhage.json",
    "questions": 21
  },
  {
    "title": "Antepartum_Hemorrhage_and_Complications",
    "category": "Prepladder / RR",
    "file": "Antepartum_Hemorrhage_and_Complications.json",
    "questions": 13
  },
  {
    "title": "Antiarrythmics Drugs Part 1",
    "category": "Prepladder / RR",
    "file": "Antiarrythmics_Drugs_Part_1.json",
    "questions": 8
  },
  {
    "title": "Antiarrythmics Drugs Part 2",
    "category": "Prepladder / RR",
    "file": "Antiarrythmics_Drugs_Part_2.json",
    "questions": 5
  },
  {
    "title": "Antidiabetic Drugs (Insulin Preparations)",
    "category": "Prepladder / RR",
    "file": "Antidiabetic_Drugs_Insulin_Preparations.json",
    "questions": 5
  },
  {
    "title": "Biostatistics-Types_of_Dispersion__Distribution__and_Errors",
    "category": "Prepladder / RR",
    "file": "Biostatistics-Types_of_Dispersion__Distribution__and_Errors.json",
    "questions": 20
  },
  {
    "title": "Bradyarrhythmias",
    "category": "Prepladder / RR",
    "file": "Bradyarrhythmias.json",
    "questions": 2
  },
  {
    "title": "CVS_-_Arrhythmias",
    "category": "Prepladder / RR",
    "file": "CVS_-_Arrhythmias.json",
    "questions": 16
  },
  {
    "title": "CVS_Pharmacology-Hypolipidemic_Drugs_and_Anti-Arrhythmic_Drugs",
    "category": "Prepladder / RR",
    "file": "CVS_Pharmacology-Hypolipidemic_Drugs_and_Anti-Arrhythmic_Drugs.json",
    "questions": 16
  },
  {
    "title": "Calculation of Refractive Error",
    "category": "Prepladder / RR",
    "file": "Calculation_of_Refractive_Error.json",
    "questions": 6
  },
  {
    "title": "Cardiology-ECG_and_Arrhythmias",
    "category": "Prepladder / RR",
    "file": "Cardiology-ECG_and_Arrhythmias.json",
    "questions": 21
  },
  {
    "title": "Communicable_and_Non-communicable_Diseases-Polio__Hepatitis__Diarrhoea__Cholera___Typhoid",
    "category": "Prepladder / RR",
    "file": "Communicable_and_Non-communicable_Diseases-Polio__Hepatitis__Diarrhoea__Cholera___Typhoid.json",
    "questions": 12
  },
  {
    "title": "Corrosives",
    "category": "Prepladder / RR",
    "file": "Corrosives.json",
    "questions": 8
  },
  {
    "title": "Disorders_of_Puberty_and_Amenorrheas-Previous_Year_Questions",
    "category": "Prepladder / RR",
    "file": "Disorders_of_Puberty_and_Amenorrheas-Previous_Year_Questions.json",
    "questions": 16
  },
  {
    "title": "Drugs Used For Diarrhea",
    "category": "Prepladder / RR",
    "file": "Drugs_Used_For_Diarrhea.json",
    "questions": 12
  },
  {
    "title": "E. Coli Diarrhoeal Disease",
    "category": "Prepladder / RR",
    "file": "E_Coli_Diarrhoeal_Disease.json",
    "questions": 34
  },
  {
    "title": "ECG & Cardiac Arrythmias",
    "category": "Prepladder / RR",
    "file": "ECG__Cardiac_Arrythmias.json",
    "questions": 10
  },
  {
    "title": "ECG & Cardiac Arrythmias - Atrial Fib & Flutter",
    "category": "Prepladder / RR",
    "file": "ECG__Cardiac_Arrythmias_-_Atrial_Fib__Flutter.json",
    "questions": 13
  },
  {
    "title": "Estrogen & Progesterone Preparations",
    "category": "Prepladder / RR",
    "file": "Estrogen__Progesterone_Preparations.json",
    "questions": 21
  },
  {
    "title": "Facial_and_Nose_Trauma_including_CSF_Rhinorrhea",
    "category": "Prepladder / RR",
    "file": "Facial_and_Nose_Trauma_including_CSF_Rhinorrhea.json",
    "questions": 8
  },
  {
    "title": "Ferroptosis",
    "category": "Prepladder / RR",
    "file": "Ferroptosis.json",
    "questions": 1
  },
  {
    "title": "Fractures of Facial Bone & Csf Rhinorrhea",
    "category": "Prepladder / RR",
    "file": "Fractures_of_Facial_Bone__Csf_Rhinorrhea.json",
    "questions": 3
  },
  {
    "title": "GIT_Pharmacology-Laxatives_and_Anti-Diarrheal_Drugs",
    "category": "Prepladder / RR",
    "file": "GIT_Pharmacology-Laxatives_and_Anti-Diarrheal_Drugs.json",
    "questions": 15
  },
  {
    "title": "Gastrointestinal_System-Irritable_Bowel_Syndrome",
    "category": "Prepladder / RR",
    "file": "Gastrointestinal_System-Irritable_Bowel_Syndrome.json",
    "questions": 6
  },
  {
    "title": "Genetics-Advanced_Molecular_Techniques__Recombinant_DNA_technology__Microarray__CRISPR__Lac_operon",
    "category": "Prepladder / RR",
    "file": "Genetics-Advanced_Molecular_Techniques__Recombinant_DNA_technology__Microarray__CRISPR__Lac_operon.json",
    "questions": 18
  },
  {
    "title": "Guillian Barre Syndrome",
    "category": "Prepladder / RR",
    "file": "Guillian_Barre_Syndrome.json",
    "questions": 9
  },
  {
    "title": "Gynecology-Disorders_of_Puberty__Amenorrhea__Menopause",
    "category": "Prepladder / RR",
    "file": "Gynecology-Disorders_of_Puberty__Amenorrhea__Menopause.json",
    "questions": 16
  },
  {
    "title": "Hepatobiliary_System-Autoimmune_Hepatitis__Primary_Biliary_Cirrhosis__Primary_Sclerosing_Cholangitis__and_Paracetamol_Toxicity",
    "category": "Prepladder / RR",
    "file": "Hepatobiliary_System-Autoimmune_Hepatitis__Primary_Biliary_Cirrhosis__Primary_Sclerosing_Cholangitis__and_Paracetamol_Toxicity.json",
    "questions": 11
  },
  {
    "title": "Hepatobiliary_System-Liver_Cirrhosis_and_its_Complications",
    "category": "Prepladder / RR",
    "file": "Hepatobiliary_System-Liver_Cirrhosis_and_its_Complications.json",
    "questions": 21
  },
  {
    "title": "IBD, Diarrhea & Dehydration Management",
    "category": "Prepladder / RR",
    "file": "IBD_Diarrhea__Dehydration_Management.json",
    "questions": 15
  },
  {
    "title": "Inborn Errors of Metabolism",
    "category": "Prepladder / RR",
    "file": "Inborn_Errors_of_Metabolism.json",
    "questions": 27
  },
  {
    "title": "Inborn_Errors_of_Metabolism",
    "category": "Prepladder / RR",
    "file": "Inborn_Errors_of_Metabolism_1.json",
    "questions": 15
  },
  {
    "title": "Inborn_Errors_of_Metabolism-Disorders_of_Carbohydrate_and_Amino_Acid_Metabolism",
    "category": "Prepladder / RR",
    "file": "Inborn_Errors_of_Metabolism-Disorders_of_Carbohydrate_and_Amino_Acid_Metabolism.json",
    "questions": 17
  },
  {
    "title": "Inborn_Errors_of_Metabolism-Lysosomal_Storage_Disorders",
    "category": "Prepladder / RR",
    "file": "Inborn_Errors_of_Metabolism-Lysosomal_Storage_Disorders.json",
    "questions": 10
  },
  {
    "title": "Inborn_Errors_of_Metabolism-Previous_Year_Questions",
    "category": "Prepladder / RR",
    "file": "Inborn_Errors_of_Metabolism-Previous_Year_Questions.json",
    "questions": 7
  },
  {
    "title": "Intracranical Haemorrhages",
    "category": "Prepladder / RR",
    "file": "Intracranical_Haemorrhages.json",
    "questions": 8
  },
  {
    "title": "Miscarriage (Abortion)",
    "category": "Prepladder / RR",
    "file": "Miscarriage_Abortion.json",
    "questions": 11
  },
  {
    "title": "Natural Family Planning Method And Barrier Method",
    "category": "Prepladder / RR",
    "file": "Natural_Family_Planning_Method_And_Barrier_Method.json",
    "questions": 14
  },
  {
    "title": "Neurology-CNS_hemorrhage__Headaches_and_Migraine",
    "category": "Prepladder / RR",
    "file": "Neurology-CNS_hemorrhage__Headaches_and_Migraine.json",
    "questions": 21
  },
  {
    "title": "Neurology-Guillian_Barre_Syndrome_and_Alzheimer_s_disease",
    "category": "Prepladder / RR",
    "file": "Neurology-Guillian_Barre_Syndrome_and_Alzheimer_s_disease.json",
    "questions": 14
  },
  {
    "title": "Nose_and_Paranasal_Sinuses-Rhinitis_and_CSF_Rhinorrhea",
    "category": "Prepladder / RR",
    "file": "Nose_and_Paranasal_Sinuses-Rhinitis_and_CSF_Rhinorrhea.json",
    "questions": 13
  },
  {
    "title": "Obstetric_Hemorrhage___Obstetric_Emergencies-Previous_Year_Questions",
    "category": "Prepladder / RR",
    "file": "Obstetric_Hemorrhage___Obstetric_Emergencies-Previous_Year_Questions.json",
    "questions": 22
  },
  {
    "title": "Obstetrics-Antepartum_Haemorrhage",
    "category": "Prepladder / RR",
    "file": "Obstetrics-Antepartum_Haemorrhage.json",
    "questions": 13
  },
  {
    "title": "Obstetrics-Post-Partum_Hemorrhage",
    "category": "Prepladder / RR",
    "file": "Obstetrics-Post-Partum_Hemorrhage.json",
    "questions": 18
  },
  {
    "title": "Post Partum Hemorrhage (PPH)",
    "category": "Prepladder / RR",
    "file": "Post_Partum_Hemorrhage_PPH.json",
    "questions": 11
  },
  {
    "title": "Post_Partum_Hemorrhage",
    "category": "Prepladder / RR",
    "file": "Post_Partum_Hemorrhage.json",
    "questions": 25
  },
  {
    "title": "Primary Amenorrhea",
    "category": "Prepladder / RR",
    "file": "Primary_Amenorrhea.json",
    "questions": 27
  },
  {
    "title": "Prostaglandin Preparations",
    "category": "Prepladder / RR",
    "file": "Prostaglandin_Preparations.json",
    "questions": 9
  },
  {
    "title": "Rapid_Revision-Previous_Year_Questions",
    "category": "Prepladder / RR",
    "file": "Rapid_Revision-Previous_Year_Questions.json",
    "questions": 1
  },
  {
    "title": "Rapid_Revision-Previous_Year_Questions",
    "category": "Prepladder / RR",
    "file": "Rapid_Revision-Previous_Year_Questions_1.json",
    "questions": 1
  },
  {
    "title": "Rapid_Revision_with_Images-Previous_Year_Questions",
    "category": "Prepladder / RR",
    "file": "Rapid_Revision_with_Images-Previous_Year_Questions.json",
    "questions": 3
  },
  {
    "title": "Renal_Physiology-Acid_Secretion_and_Counter-Current_Mechanism_of_the_Kidney",
    "category": "Prepladder / RR",
    "file": "Renal_Physiology-Acid_Secretion_and_Counter-Current_Mechanism_of_the_Kidney.json",
    "questions": 12
  },
  {
    "title": "Salter_Harris",
    "category": "Prepladder / RR",
    "file": "Salter_Harris.json",
    "questions": 3
  },
  {
    "title": "Spherical Errors",
    "category": "Prepladder / RR",
    "file": "Spherical_Errors.json",
    "questions": 8
  },
  {
    "title": "Stroke - Hemorrhagic Stroke (Part 5)",
    "category": "Prepladder / RR",
    "file": "Stroke_-_Hemorrhagic_Stroke_Part_5.json",
    "questions": 10
  },
  {
    "title": "Types_of_Errors__Randomized_Control_Trial__Clinical_Trials",
    "category": "Prepladder / RR",
    "file": "Types_of_Errors__Randomized_Control_Trial__Clinical_Trials.json",
    "questions": 5
  },
  {
    "title": "Viral Hemorrhagic Fever",
    "category": "Prepladder / RR",
    "file": "Viral_Hemorrhagic_Fever.json",
    "questions": 6
  },
  {
    "title": "07_Anatomy_Dr_Sandeep",
    "category": "Subject Wise / Mixed",
    "file": "07_Anatomy_Dr_Sandeep.json",
    "questions": 40
  },
  {
    "title": "17_Anatomy_FMGE_Dr_Sandeep",
    "category": "Subject Wise / Mixed",
    "file": "17_Anatomy_FMGE_Dr_Sandeep.json",
    "questions": 40
  },
  {
    "title": "215_Microbiology",
    "category": "Subject Wise / Mixed",
    "file": "215_Microbiology.json",
    "questions": 40
  },
  {
    "title": "21_Anesthesia_Dr_Anshul",
    "category": "Subject Wise / Mixed",
    "file": "21_Anesthesia_Dr_Anshul.json",
    "questions": 40
  },
  {
    "title": "253_Ophthalmology_Dr_Manish",
    "category": "Subject Wise / Mixed",
    "file": "253_Ophthalmology_Dr_Manish.json",
    "questions": 40
  },
  {
    "title": "272_Pathology_Dr_Shagun",
    "category": "Subject Wise / Mixed",
    "file": "272_Pathology_Dr_Shagun.json",
    "questions": 40
  },
  {
    "title": "275_Pathology_MIQ_Series",
    "category": "Subject Wise / Mixed",
    "file": "275_Pathology_MIQ_Series.json",
    "questions": 20
  },
  {
    "title": "288_Pediatrics",
    "category": "Subject Wise / Mixed",
    "file": "288_Pediatrics.json",
    "questions": 100
  },
  {
    "title": "292_Pediatrics_Dr_Ashutosh",
    "category": "Subject Wise / Mixed",
    "file": "292_Pediatrics_Dr_Ashutosh.json",
    "questions": 40
  },
  {
    "title": "297_Pediatrics_MIQ_Series",
    "category": "Subject Wise / Mixed",
    "file": "297_Pediatrics_MIQ_Series.json",
    "questions": 20
  },
  {
    "title": "303_Pharmacology_Dr_Dinesh",
    "category": "Subject Wise / Mixed",
    "file": "303_Pharmacology_Dr_Dinesh.json",
    "questions": 40
  },
  {
    "title": "309_Pharmacology_MIQ_Series",
    "category": "Subject Wise / Mixed",
    "file": "309_Pharmacology_MIQ_Series.json",
    "questions": 20
  },
  {
    "title": "317_Physiology_Dr_Kamal",
    "category": "Subject Wise / Mixed",
    "file": "317_Physiology_Dr_Kamal.json",
    "questions": 40
  },
  {
    "title": "323_Physiology_MIQ_Series",
    "category": "Subject Wise / Mixed",
    "file": "323_Physiology_MIQ_Series.json",
    "questions": 20
  },
  {
    "title": "32_Biochemistry_Dr_Sonam",
    "category": "Subject Wise / Mixed",
    "file": "32_Biochemistry_Dr_Sonam.json",
    "questions": 40
  },
  {
    "title": "334_PSM_Dr_Kashish",
    "category": "Subject Wise / Mixed",
    "file": "334_PSM_Dr_Kashish.json",
    "questions": 40
  },
  {
    "title": "335_PSM_Dr_Kashish",
    "category": "Subject Wise / Mixed",
    "file": "335_PSM_Dr_Kashish.json",
    "questions": 40
  },
  {
    "title": "336_PSM_Dr_Kashish",
    "category": "Subject Wise / Mixed",
    "file": "336_PSM_Dr_Kashish.json",
    "questions": 50
  },
  {
    "title": "348_Psychiatry_Dr_Sachin",
    "category": "Subject Wise / Mixed",
    "file": "348_Psychiatry_Dr_Sachin.json",
    "questions": 40
  },
  {
    "title": "350_Psychiatry_Dr_Sachin-2026",
    "category": "Subject Wise / Mixed",
    "file": "350_Psychiatry_Dr_Sachin-2026.json",
    "questions": 49
  },
  {
    "title": "3rd Stage of Labour & It's Management",
    "category": "Subject Wise / Mixed",
    "file": "3rd_Stage_of_Labour__Its_Management.json",
    "questions": 6
  },
  {
    "title": "45_Dermatology_Dr_Chesta",
    "category": "Subject Wise / Mixed",
    "file": "45_Dermatology_Dr_Chesta.json",
    "questions": 40
  },
  {
    "title": "55_ENT_Dr_Deepak",
    "category": "Subject Wise / Mixed",
    "file": "55_ENT_Dr_Deepak.json",
    "questions": 40
  },
  {
    "title": "56_ENT_Dr_Deepak",
    "category": "Subject Wise / Mixed",
    "file": "56_ENT_Dr_Deepak.json",
    "questions": 40
  },
  {
    "title": "59_ENT_Dr_Deepak",
    "category": "Subject Wise / Mixed",
    "file": "59_ENT_Dr_Deepak.json",
    "questions": 40
  },
  {
    "title": "97_FMT_Dr_Mohit",
    "category": "Subject Wise / Mixed",
    "file": "97_FMT_Dr_Mohit.json",
    "questions": 40
  },
  {
    "title": "ADH",
    "category": "Subject Wise / Mixed",
    "file": "ADH.json",
    "questions": 7
  },
  {
    "title": "ADHD & Disruptive Behaviour Disorders",
    "category": "Subject Wise / Mixed",
    "file": "ADHD__Disruptive_Behaviour_Disorders.json",
    "questions": 14
  },
  {
    "title": "ALL INDIA MEDICOS TEST - 2024 BATCH - 2024-12-22",
    "category": "Subject Wise / Mixed",
    "file": "ALL_INDIA_MEDICOS_TEST_-_2024_BATCH_-_2024-12-22.json",
    "questions": 30
  },
  {
    "title": "ANS_Pharmacology-ANS_Introduction_and_Cholinergic_Drugs",
    "category": "Subject Wise / Mixed",
    "file": "ANS_Pharmacology-ANS_Introduction_and_Cholinergic_Drugs.json",
    "questions": 23
  },
  {
    "title": "ANS_Pharmacology-Anticholinergic_Drugs",
    "category": "Subject Wise / Mixed",
    "file": "ANS_Pharmacology-Anticholinergic_Drugs.json",
    "questions": 12
  },
  {
    "title": "ANS_Pharmacology-Previous_Year_Questions",
    "category": "Subject Wise / Mixed",
    "file": "ANS_Pharmacology-Previous_Year_Questions.json",
    "questions": 52
  },
  {
    "title": "ANS_Pharmacology-Sympatholytics",
    "category": "Subject Wise / Mixed",
    "file": "ANS_Pharmacology-Sympatholytics.json",
    "questions": 13
  },
  {
    "title": "ANS_Pharmacology-Sympathomimetics",
    "category": "Subject Wise / Mixed",
    "file": "ANS_Pharmacology-Sympathomimetics.json",
    "questions": 21
  },
  {
    "title": "APGAR & Primitive Reflexes",
    "category": "Subject Wise / Mixed",
    "file": "APGAR__Primitive_Reflexes.json",
    "questions": 16
  },
  {
    "title": "ARDS",
    "category": "Subject Wise / Mixed",
    "file": "ARDS.json",
    "questions": 18
  },
  {
    "title": "ARDS_and_Volkmanns_Ischemia",
    "category": "Subject Wise / Mixed",
    "file": "ARDS_and_Volkmanns_Ischemia.json",
    "questions": 4
  },
  {
    "title": "ARMD",
    "category": "Subject Wise / Mixed",
    "file": "ARMD.json",
    "questions": 6
  },
  {
    "title": "ASOM",
    "category": "Subject Wise / Mixed",
    "file": "ASOM.json",
    "questions": 19
  },
  {
    "title": "AVN",
    "category": "Subject Wise / Mixed",
    "file": "AVN.json",
    "questions": 8
  },
  {
    "title": "Abdnomal Uterine Bleeding",
    "category": "Subject Wise / Mixed",
    "file": "Abdnomal_Uterine_Bleeding.json",
    "questions": 25
  },
  {
    "title": "Abdomen & Pelvis",
    "category": "Subject Wise / Mixed",
    "file": "Abdomen__Pelvis.json",
    "questions": 147
  },
  {
    "title": "Abdomen-Abdomen_Arterial_Supply__Venous_Drainage_of_Thorax_and_Abdomen",
    "category": "Subject Wise / Mixed",
    "file": "Abdomen-Abdomen_Arterial_Supply__Venous_Drainage_of_Thorax_and_Abdomen.json",
    "questions": 17
  },
  {
    "title": "Abdomen-Abdominal_Neurovascular_Bundles",
    "category": "Subject Wise / Mixed",
    "file": "Abdomen-Abdominal_Neurovascular_Bundles.json",
    "questions": 8
  },
  {
    "title": "Abdomen-Anatomy__Abdominal_Organs",
    "category": "Subject Wise / Mixed",
    "file": "Abdomen-Anatomy__Abdominal_Organs.json",
    "questions": 12
  },
  {
    "title": "Abdomen-Anatomy__Pancreas__Kidney__and_Ureter",
    "category": "Subject Wise / Mixed",
    "file": "Abdomen-Anatomy__Pancreas__Kidney__and_Ureter.json",
    "questions": 10
  },
  {
    "title": "Abdomen-Embryology_of_Abdominal_Organs",
    "category": "Subject Wise / Mixed",
    "file": "Abdomen-Embryology_of_Abdominal_Organs.json",
    "questions": 24
  },
  {
    "title": "Abdomen-Inguinal_and_Femoral_Anatomy_and_Hernia__Abdominal_Wall_Layers__Peritoneal_Cavity",
    "category": "Subject Wise / Mixed",
    "file": "Abdomen-Inguinal_and_Femoral_Anatomy_and_Hernia__Abdominal_Wall_Layers__Peritoneal_Cavity.json",
    "questions": 14
  },
  {
    "title": "Abdomen-Previous_Year_Questions",
    "category": "Subject Wise / Mixed",
    "file": "Abdomen-Previous_Year_Questions.json",
    "questions": 46
  },
  {
    "title": "Abdomen_",
    "category": "Subject Wise / Mixed",
    "file": "Abdomen_.json",
    "questions": 7
  },
  {
    "title": "Abdomen__Pelvis",
    "category": "Subject Wise / Mixed",
    "file": "Abdomen__Pelvis_1.json",
    "questions": 178
  },
  {
    "title": "Abdominal Trauma",
    "category": "Subject Wise / Mixed",
    "file": "Abdominal_Trauma.json",
    "questions": 19
  },
  {
    "title": "Abdominal Wall - 1 (Landmarks & Inguinal Canal)",
    "category": "Subject Wise / Mixed",
    "file": "Abdominal_Wall_-_1_Landmarks__Inguinal_Canal.json",
    "questions": 9
  },
  {
    "title": "Abdominal Wall - 2 (Rectus Sheath & Thoracolumbar Fascia)",
    "category": "Subject Wise / Mixed",
    "file": "Abdominal_Wall_-_2_Rectus_Sheath__Thoracolumbar_Fascia.json",
    "questions": 8
  },
  {
    "title": "Abnormal Labor",
    "category": "Subject Wise / Mixed",
    "file": "Abnormal_Labor.json",
    "questions": 95
  },
  {
    "title": "Abnormal Pelvis",
    "category": "Subject Wise / Mixed",
    "file": "Abnormal_Pelvis.json",
    "questions": 5
  },
  {
    "title": "Abnormal Uterine Bleeding",
    "category": "Subject Wise / Mixed",
    "file": "Abnormal_Uterine_Bleeding.json",
    "questions": 8
  },
  {
    "title": "Abnormal_Labor",
    "category": "Subject Wise / Mixed",
    "file": "Abnormal_Labor_1.json",
    "questions": 37
  },
  {
    "title": "Abnormalities_of_Labor-Previous_Year_Questions",
    "category": "Subject Wise / Mixed",
    "file": "Abnormalities_of_Labor-Previous_Year_Questions.json",
    "questions": 16
  },
  {
    "title": "Abortion",
    "category": "Subject Wise / Mixed",
    "file": "Abortion.json",
    "questions": 4
  },
  {
    "title": "Abortions",
    "category": "Subject Wise / Mixed",
    "file": "Abortions.json",
    "questions": 20
  },
  {
    "title": "Abrasions",
    "category": "Subject Wise / Mixed",
    "file": "Abrasions.json",
    "questions": 10
  },
  {
    "title": "Abruption",
    "category": "Subject Wise / Mixed",
    "file": "Abruption.json",
    "questions": 5
  },
  {
    "title": "Acanthamoeba",
    "category": "Subject Wise / Mixed",
    "file": "Acanthamoeba.json",
    "questions": 5
  },
  {
    "title": "Acid Base Balance",
    "category": "Subject Wise / Mixed",
    "file": "Acid_Base_Balance.json",
    "questions": 16
  },
  {
    "title": "Acid Base Disorder (Part 1)",
    "category": "Subject Wise / Mixed",
    "file": "Acid_Base_Disorder_Part_1.json",
    "questions": 14
  },
  {
    "title": "Acid Base Disorder - Anion Gap (Part 2)",
    "category": "Subject Wise / Mixed",
    "file": "Acid_Base_Disorder_-_Anion_Gap_Part_2.json",
    "questions": 10
  },
  {
    "title": "Acoustic Neuroma & Vestibular Neuronitis",
    "category": "Subject Wise / Mixed",
    "file": "Acoustic_Neuroma__Vestibular_Neuronitis.json",
    "questions": 10
  },
  {
    "title": "Acoustic_Neuroma",
    "category": "Subject Wise / Mixed",
    "file": "Acoustic_Neuroma.json",
    "questions": 7
  },
  {
    "title": "Acquired Cataract",
    "category": "Subject Wise / Mixed",
    "file": "Acquired_Cataract.json",
    "questions": 4
  },
  {
    "title": "Acute & Chronic Limb Ischemia (Part 1)",
    "category": "Subject Wise / Mixed",
    "file": "Acute__Chronic_Limb_Ischemia_Part_1.json",
    "questions": 25
  },
  {
    "title": "Acute & Chronic Pharyngitis",
    "category": "Subject Wise / Mixed",
    "file": "Acute__Chronic_Pharyngitis.json",
    "questions": 3
  },
  {
    "title": "Acute & Chronic Tonsillitis",
    "category": "Subject Wise / Mixed",
    "file": "Acute__Chronic_Tonsillitis.json",
    "questions": 6
  },
  {
    "title": "Acute Congestive Glaucoma",
    "category": "Subject Wise / Mixed",
    "file": "Acute_Congestive_Glaucoma.json",
    "questions": 9
  },
  {
    "title": "Acute Kidney Injury",
    "category": "Subject Wise / Mixed",
    "file": "Acute_Kidney_Injury.json",
    "questions": 9
  },
  {
    "title": "Acute Leukemia, Clinical Features & Classification",
    "category": "Subject Wise / Mixed",
    "file": "Acute_Leukemia_Clinical_Features__Classification.json",
    "questions": 16
  },
  {
    "title": "Acyanotic CHD",
    "category": "Subject Wise / Mixed",
    "file": "Acyanotic_CHD.json",
    "questions": 15
  },
  {
    "title": "Adenomyosis-Previous_Year_Questions",
    "category": "Subject Wise / Mixed",
    "file": "Adenomyosis-Previous_Year_Questions.json",
    "questions": 1
  },
  {
    "title": "Adenotonsillectomy",
    "category": "Subject Wise / Mixed",
    "file": "Adenotonsillectomy.json",
    "questions": 8
  },
  {
    "title": "Adipocere, Mummification & Embalming",
    "category": "Subject Wise / Mixed",
    "file": "Adipocere_Mummification__Embalming.json",
    "questions": 15
  },
  {
    "title": "Adnexa & Appendages",
    "category": "Subject Wise / Mixed",
    "file": "Adnexa__Appendages.json",
    "questions": 22
  },
  {
    "title": "Adnexal Management",
    "category": "Subject Wise / Mixed",
    "file": "Adnexal_Management.json",
    "questions": 15
  },
  {
    "title": "Adnexal_Diseases",
    "category": "Subject Wise / Mixed",
    "file": "Adnexal_Diseases.json",
    "questions": 14
  },
  {
    "title": "Adnexal_Mass_and_Gyne_Cancers",
    "category": "Subject Wise / Mixed",
    "file": "Adnexal_Mass_and_Gyne_Cancers.json",
    "questions": 26
  },
  {
    "title": "Adrenal Gland (Adrenal Cortex Neoplasm & Pheochromocytoma)",
    "category": "Subject Wise / Mixed",
    "file": "Adrenal_Gland_Adrenal_Cortex_Neoplasm__Pheochromocytoma.json",
    "questions": 14
  },
  {
    "title": "Adrenal_Gland",
    "category": "Subject Wise / Mixed",
    "file": "Adrenal_Gland.json",
    "questions": 7
  },
  {
    "title": "Adrenergic Drugs",
    "category": "Subject Wise / Mixed",
    "file": "Adrenergic_Drugs.json",
    "questions": 17
  },
  {
    "title": "Adverse Drug Reactions",
    "category": "Subject Wise / Mixed",
    "file": "Adverse_Drug_Reactions.json",
    "questions": 10
  },
  {
    "title": "Age",
    "category": "Subject Wise / Mixed",
    "file": "Age.json",
    "questions": 15
  },
  {
    "title": "Age Estimation By X-Ray Examination",
    "category": "Subject Wise / Mixed",
    "file": "Age_Estimation_By_X-Ray_Examination.json",
    "questions": 6
  },
  {
    "title": "Agriculture Poisons",
    "category": "Subject Wise / Mixed",
    "file": "Agriculture_Poisons.json",
    "questions": 15
  },
  {
    "title": "Alcohol",
    "category": "Subject Wise / Mixed",
    "file": "Alcohol.json",
    "questions": 10
  },
  {
    "title": "Alcoholic Liver Disease",
    "category": "Subject Wise / Mixed",
    "file": "Alcoholic_Liver_Disease.json",
    "questions": 4
  },
  {
    "title": "Alcoholic Liver Disease",
    "category": "Subject Wise / Mixed",
    "file": "Alcoholic_Liver_Disease_1.json",
    "questions": 4
  },
  {
    "title": "Algor Mortis",
    "category": "Subject Wise / Mixed",
    "file": "Algor_Mortis.json",
    "questions": 10
  },
  {
    "title": "All India INI CET Grand Test 01.__.11th Oct 2023.__.OCTOBER 2023.__..__.1.__.",
    "category": "Subject Wise / Mixed",
    "file": "All_India_INI_CET_Grand_Test_01__11th_Oct_2023__OCTOBER_2023____1__.json",
    "questions": 200
  },
  {
    "title": "All India INI CET Grand Test 01.__.12th Apr 2023.__.APRIL 2023.__..__.1.__.",
    "category": "Subject Wise / Mixed",
    "file": "All_India_INI_CET_Grand_Test_01__12th_Apr_2023__APRIL_2023____1__.json",
    "questions": 200
  },
  {
    "title": "All India INI CET Grand Test 02.__.25th Oct 2023.__.OCTOBER 2023.__..__.1.__.",
    "category": "Subject Wise / Mixed",
    "file": "All_India_INI_CET_Grand_Test_02__25th_Oct_2023__OCTOBER_2023____1__.json",
    "questions": 200
  },
  {
    "title": "All India INI CET Grand Test 02.__.26th Apr 2023.__.APRIL 2023.__..__.1.__.",
    "category": "Subject Wise / Mixed",
    "file": "All_India_INI_CET_Grand_Test_02__26th_Apr_2023__APRIL_2023____1__.json",
    "questions": 200
  },
  {
    "title": "All_Recent_Updates_2021-Previous_Year_Questions",
    "category": "Subject Wise / Mixed",
    "file": "All_Recent_Updates_2021-Previous_Year_Questions.json",
    "questions": 1
  },
  {
    "title": "Allergic Conjunctivitis",
    "category": "Subject Wise / Mixed",
    "file": "Allergic_Conjunctivitis.json",
    "questions": 16
  },
  {
    "title": "Allergic, Vasomotor, Atrophic Rhinitis",
    "category": "Subject Wise / Mixed",
    "file": "Allergic_Vasomotor_Atrophic_Rhinitis.json",
    "questions": 12
  },
  {
    "title": "Allied_Health_Disciplines-ESI_Act__Factory_Act__NREGA_Act_and_Disaster_Management",
    "category": "Subject Wise / Mixed",
    "file": "Allied_Health_Disciplines-ESI_Act__Factory_Act__NREGA_Act_and_Disaster_Management.json",
    "questions": 13
  },
  {
    "title": "Allied_Health_Disciplines-Occupational_health",
    "category": "Subject Wise / Mixed",
    "file": "Allied_Health_Disciplines-Occupational_health.json",
    "questions": 20
  },
  {
    "title": "Allied_Health_Disciplines-Previous_Year_Questions",
    "category": "Subject Wise / Mixed",
    "file": "Allied_Health_Disciplines-Previous_Year_Questions.json",
    "questions": 49
  },
  {
    "title": "Allied_Health_Sciences",
    "category": "Subject Wise / Mixed",
    "file": "Allied_Health_Sciences.json",
    "questions": 8
  },
  {
    "title": "Alopecia",
    "category": "Subject Wise / Mixed",
    "file": "Alopecia.json",
    "questions": 9
  },
  {
    "title": "Alopecia",
    "category": "Subject Wise / Mixed",
    "file": "Alopecia_1.json",
    "questions": 10
  },
  {
    "title": "Alpha Blockers",
    "category": "Subject Wise / Mixed",
    "file": "Alpha_Blockers.json",
    "questions": 16
  },
  {
    "title": "Alports Syndrome",
    "category": "Subject Wise / Mixed",
    "file": "Alports_Syndrome.json",
    "questions": 1
  },
  {
    "title": "Amino Acids",
    "category": "Subject Wise / Mixed",
    "file": "Amino_Acids.json",
    "questions": 65
  },
  {
    "title": "Amino Acids - Basics, Classification & Metabolism",
    "category": "Subject Wise / Mixed",
    "file": "Amino_Acids_-_Basics_Classification__Metabolism.json",
    "questions": 28
  },
  {
    "title": "Amino Acids Catabolism, Urea Cycle & Associated Disorders",
    "category": "Subject Wise / Mixed",
    "file": "Amino_Acids_Catabolism_Urea_Cycle__Associated_Disorders.json",
    "questions": 25
  },
  {
    "title": "Amino_Acid_Chemistry",
    "category": "Subject Wise / Mixed",
    "file": "Amino_Acid_Chemistry.json",
    "questions": 42
  },
  {
    "title": "Amino_Acid_Metabolism",
    "category": "Subject Wise / Mixed",
    "file": "Amino_Acid_Metabolism.json",
    "questions": 51
  },
  {
    "title": "Amino_Acid_and_Protein_Metabolism-Previous_Year_Questions",
    "category": "Subject Wise / Mixed",
    "file": "Amino_Acid_and_Protein_Metabolism-Previous_Year_Questions.json",
    "questions": 5
  },
  {
    "title": "Amino_Acids_Metabolism-Previous_Year_Questions",
    "category": "Subject Wise / Mixed",
    "file": "Amino_Acids_Metabolism-Previous_Year_Questions.json",
    "questions": 21
  },
  {
    "title": "Amino_Acids_and_Proteins_Chemistry-Amino_acid_Catabolism__Urea_cycle_and_Hyperammonemia",
    "category": "Subject Wise / Mixed",
    "file": "Amino_Acids_and_Proteins_Chemistry-Amino_acid_Catabolism__Urea_cycle_and_Hyperammonemia.json",
    "questions": 26
  },
  {
    "title": "Amino_Acids_and_Proteins_Chemistry-Phenylalanine___Tyrosine__Amino_Acid_Metabolism_disorders",
    "category": "Subject Wise / Mixed",
    "file": "Amino_Acids_and_Proteins_Chemistry-Phenylalanine___Tyrosine__Amino_Acid_Metabolism_disorders.json",
    "questions": 19
  },
  {
    "title": "Amino_Acids_and_Proteins_Chemistry-Previous_Year_Questions",
    "category": "Subject Wise / Mixed",
    "file": "Amino_Acids_and_Proteins_Chemistry-Previous_Year_Questions.json",
    "questions": 54
  },
  {
    "title": "Amino_Acids_and_Proteins_Chemistry-Protein_Chemistry__Hemoglobin__Myoglobin___EPP_Chromatography",
    "category": "Subject Wise / Mixed",
    "file": "Amino_Acids_and_Proteins_Chemistry-Protein_Chemistry__Hemoglobin__Myoglobin___EPP_Chromatography.json",
    "questions": 25
  },
  {
    "title": "Aminoglycosides & Oxazolidinones",
    "category": "Subject Wise / Mixed",
    "file": "Aminoglycosides__Oxazolidinones.json",
    "questions": 7
  },
  {
    "title": "Amniotic Fluid & It's Disorders",
    "category": "Subject Wise / Mixed",
    "file": "Amniotic_Fluid__Its_Disorders.json",
    "questions": 23
  },
  {
    "title": "Amniotic_Fluid",
    "category": "Subject Wise / Mixed",
    "file": "Amniotic_Fluid.json",
    "questions": 13
  },
  {
    "title": "Amputations",
    "category": "Subject Wise / Mixed",
    "file": "Amputations.json",
    "questions": 8
  },
  {
    "title": "Amyloidosis",
    "category": "Subject Wise / Mixed",
    "file": "Amyloidosis.json",
    "questions": 6
  },
  {
    "title": "Anaesthesia",
    "category": "Subject Wise / Mixed",
    "file": "Anaesthesia.json",
    "questions": 20
  },
  {
    "title": "Anaesthesia-Anaesthetic_Pharmacology",
    "category": "Subject Wise / Mixed",
    "file": "Anaesthesia-Anaesthetic_Pharmacology.json",
    "questions": 18
  },
  {
    "title": "Anaesthesia-Previous_Year_Questions",
    "category": "Subject Wise / Mixed",
    "file": "Anaesthesia-Previous_Year_Questions.json",
    "questions": 6
  },
  {
    "title": "Anaesthesia_Circuits-Previous_Year_Questions",
    "category": "Subject Wise / Mixed",
    "file": "Anaesthesia_Circuits-Previous_Year_Questions.json",
    "questions": 3
  },
  {
    "title": "Anaesthesia_Machine",
    "category": "Subject Wise / Mixed",
    "file": "Anaesthesia_Machine.json",
    "questions": 4
  },
  {
    "title": "Anaesthesia_Machine-Anaesthesia_Machine",
    "category": "Subject Wise / Mixed",
    "file": "Anaesthesia_Machine-Anaesthesia_Machine.json",
    "questions": 18
  },
  {
    "title": "Anaesthesia_Machine-Previous_Year_Questions",
    "category": "Subject Wise / Mixed",
    "file": "Anaesthesia_Machine-Previous_Year_Questions.json",
    "questions": 9
  },
  {
    "title": "Anaesthesia_for_Co-existing_Medical_Illness-Anaesthesia_for_Special_Conditions_and_Fluid_Management",
    "category": "Subject Wise / Mixed",
    "file": "Anaesthesia_for_Co-existing_Medical_Illness-Anaesthesia_for_Special_Conditions_and_Fluid_Management.json",
    "questions": 13
  },
  {
    "title": "Anaesthesia_for_Co-existing_Medical_Illness-Previous_Year_Questions",
    "category": "Subject Wise / Mixed",
    "file": "Anaesthesia_for_Co-existing_Medical_Illness-Previous_Year_Questions.json",
    "questions": 6
  },
  {
    "title": "Anaesthetic_Equipments_and_Pre-operative_Assessment",
    "category": "Subject Wise / Mixed",
    "file": "Anaesthetic_Equipments_and_Pre-operative_Assessment.json",
    "questions": 73
  },
  {
    "title": "Anal Canal & It\u2019s Common Conditions",
    "category": "Subject Wise / Mixed",
    "file": "Anal_Canal__Its_Common_Conditions.json",
    "questions": 18
  },
  {
    "title": "Anat, ENT, Psychi & Radio Cumulative Test (The Champion Batch-2 Hyderabad) - 03-04-2025 - 2025-04-03",
    "category": "Subject Wise / Mixed",
    "file": "Anat_ENT_Psychi__Radio_Cumulative_Test_The_Champion_Batch-2_Hyderabad_-_03-04-2025_-_2025-04-03.json",
    "questions": 199
  },
  {
    "title": "Anatomy",
    "category": "Subject Wise / Mixed",
    "file": "Anatomy.json",
    "questions": 20
  },
  {
    "title": "Anatomy",
    "category": "Subject Wise / Mixed",
    "file": "Anatomy_1.json",
    "questions": 20
  },
  {
    "title": "Anatomy & Physiology",
    "category": "Subject Wise / Mixed",
    "file": "Anatomy__Physiology.json",
    "questions": 16
  },
  {
    "title": "Anatomy & Physiology Of Bone",
    "category": "Subject Wise / Mixed",
    "file": "Anatomy__Physiology_Of_Bone.json",
    "questions": 37
  },
  {
    "title": "Anatomy & Physiology of Lymphatic System",
    "category": "Subject Wise / Mixed",
    "file": "Anatomy__Physiology_of_Lymphatic_System.json",
    "questions": 2
  },
  {
    "title": "Anatomy - INI CET 2020",
    "category": "Subject Wise / Mixed",
    "file": "Anatomy_-_INI_CET_2020.json",
    "questions": 11
  },
  {
    "title": "Anatomy - INI CET JULY 2021",
    "category": "Subject Wise / Mixed",
    "file": "Anatomy_-_INI_CET_JULY_2021.json",
    "questions": 6
  },
  {
    "title": "Anatomy - INI CET MAY 2022",
    "category": "Subject Wise / Mixed",
    "file": "Anatomy_-_INI_CET_MAY_2022.json",
    "questions": 8
  },
  {
    "title": "Anatomy - INI CET MAY 2023",
    "category": "Subject Wise / Mixed",
    "file": "Anatomy_-_INI_CET_MAY_2023.json",
    "questions": 5
  },
  {
    "title": "Anatomy - INI CET NOV 2021",
    "category": "Subject Wise / Mixed",
    "file": "Anatomy_-_INI_CET_NOV_2021.json",
    "questions": 14
  },
  {
    "title": "Anatomy - INI CET NOV 2023",
    "category": "Subject Wise / Mixed",
    "file": "Anatomy_-_INI_CET_NOV_2023.json",
    "questions": 17
  },
  {
    "title": "Anatomy - INI CET NOVEMBER 2022 (PART - A)",
    "category": "Subject Wise / Mixed",
    "file": "Anatomy_-_INI_CET_NOVEMBER_2022_PART_-_A.json",
    "questions": 7
  },
  {
    "title": "Anatomy - INI CET NOVEMBER 2022 (PART - B)",
    "category": "Subject Wise / Mixed",
    "file": "Anatomy_-_INI_CET_NOVEMBER_2022_PART_-_B.json",
    "questions": 15
  },
  {
    "title": "Anatomy E&D - Mission 1.0 - 02-01-2024 - 2024-01-02",
    "category": "Subject Wise / Mixed",
    "file": "Anatomy_ED_-_Mission_10_-_02-01-2024_-_2024-01-02.json",
    "questions": 50
  },
  {
    "title": "Anatomy E&D - Mission 1.0 Revision - 27-10-2023 - 2023-10-27",
    "category": "Subject Wise / Mixed",
    "file": "Anatomy_ED_-_Mission_10_Revision_-_27-10-2023_-_2023-10-27.json",
    "questions": 50
  },
  {
    "title": "Anatomy E&D - Mission 1.5 - 23-03-2024 - 2024-03-23",
    "category": "Subject Wise / Mixed",
    "file": "Anatomy_ED_-_Mission_15_-_23-03-2024_-_2024-03-23.json",
    "questions": 100
  },
  {
    "title": "Anatomy E&D - Mission 1.5, Lap 2 - 09-06-2024 - 2024-06-09",
    "category": "Subject Wise / Mixed",
    "file": "Anatomy_ED_-_Mission_15_Lap_2_-_09-06-2024_-_2024-06-09.json",
    "questions": 50
  },
  {
    "title": "Anatomy E&D - Mission 2.0 (Batch 2) - 13-10-2024 - 2024-10-13",
    "category": "Subject Wise / Mixed",
    "file": "Anatomy_ED_-_Mission_20_Batch_2_-_13-10-2024_-_2024-10-13.json",
    "questions": 100
  },
  {
    "title": "Anatomy E&D - Mission 2.0 (Batch 3) - 11-01-2025 - 2025-01-11",
    "category": "Subject Wise / Mixed",
    "file": "Anatomy_ED_-_Mission_20_Batch_3_-_11-01-2025_-_2025-01-11.json",
    "questions": 75
  },
  {
    "title": "Anatomy E&D - Mission 2.0 - 22-06-2024 - 2024-06-22",
    "category": "Subject Wise / Mixed",
    "file": "Anatomy_ED_-_Mission_20_-_22-06-2024_-_2024-06-22.json",
    "questions": 100
  },
  {
    "title": "Anatomy E&D - Mission 2.0, Lap 2 - 19-04-2025 - 2025-04-19",
    "category": "Subject Wise / Mixed",
    "file": "Anatomy_ED_-_Mission_20_Lap_2_-_19-04-2025_-_2025-04-19.json",
    "questions": 100
  },
  {
    "title": "Anatomy E&D Test-1 - 28-05-2023 - 2023-05-28",
    "category": "Subject Wise / Mixed",
    "file": "Anatomy_ED_Test-1_-_28-05-2023_-_2023-05-28.json",
    "questions": 50
  },
  {
    "title": "Anatomy E&D Test-2 - 03-06-2023 - 2023-06-03",
    "category": "Subject Wise / Mixed",
    "file": "Anatomy_ED_Test-2_-_03-06-2023_-_2023-06-03.json",
    "questions": 50
  },
  {
    "title": "Anatomy Last Month E&D - 17-07-2024 - 2024-07-17",
    "category": "Subject Wise / Mixed",
    "file": "Anatomy_Last_Month_ED_-_17-07-2024_-_2024-07-17.json",
    "questions": 25
  },
  {
    "title": "Anatomy Of External Ear & Tympanic Membrane",
    "category": "Subject Wise / Mixed",
    "file": "Anatomy_Of_External_Ear__Tympanic_Membrane.json",
    "questions": 22
  },
  {
    "title": "Anatomy Of External Genitalia",
    "category": "Subject Wise / Mixed",
    "file": "Anatomy_Of_External_Genitalia.json",
    "questions": 9
  },
  {
    "title": "Anatomy Of Larynx (Part 1)",
    "category": "Subject Wise / Mixed",
    "file": "Anatomy_Of_Larynx_Part_1.json",
    "questions": 10
  },
  {
    "title": "Anatomy Of Larynx (Part 2)",
    "category": "Subject Wise / Mixed",
    "file": "Anatomy_Of_Larynx_Part_2.json",
    "questions": 12
  },
  {
    "title": "Anatomy Test (The Champion Batch Hyderabad) - 11-11-2024 - 2024-11-11",
    "category": "Subject Wise / Mixed",
    "file": "Anatomy_Test_The_Champion_Batch_Hyderabad_-_11-11-2024_-_2024-11-11.json",
    "questions": 100
  },
  {
    "title": "Anatomy Test (The Champion Batch Hyderabad) - 20-05-2024 - 2024-05-20",
    "category": "Subject Wise / Mixed",
    "file": "Anatomy_Test_The_Champion_Batch_Hyderabad_-_20-05-2024_-_2024-05-20.json",
    "questions": 100
  },
  {
    "title": "Anatomy Test (The Champion Batch Hyderabad) - 22-03-2025 - 2025-03-22",
    "category": "Subject Wise / Mixed",
    "file": "Anatomy_Test_The_Champion_Batch_Hyderabad_-_22-03-2025_-_2025-03-22.json",
    "questions": 100
  },
  {
    "title": "Anatomy of Middle Ear (Anterior Wall)",
    "category": "Subject Wise / Mixed",
    "file": "Anatomy_of_Middle_Ear_Anterior_Wall.json",
    "questions": 10
  },
  {
    "title": "Anatomy of Middle Ear - (Medial & Posterior Walls)",
    "category": "Subject Wise / Mixed",
    "file": "Anatomy_of_Middle_Ear_-_Medial__Posterior_Walls.json",
    "questions": 13
  },
  {
    "title": "Anatomy of Sinunes",
    "category": "Subject Wise / Mixed",
    "file": "Anatomy_of_Sinunes.json",
    "questions": 16
  },
  {
    "title": "Anatomy of Throat & Neck Spaces",
    "category": "Subject Wise / Mixed",
    "file": "Anatomy_of_Throat__Neck_Spaces.json",
    "questions": 7
  },
  {
    "title": "Anatomy of Throat & Tonsils",
    "category": "Subject Wise / Mixed",
    "file": "Anatomy_of_Throat__Tonsils.json",
    "questions": 5
  },
  {
    "title": "Anatomy-Special_First_Year_Class_Test",
    "category": "Subject Wise / Mixed",
    "file": "Anatomy-Special_First_Year_Class_Test.json",
    "questions": 30
  },
  {
    "title": "Anatomy-_Class_Test_With_Video_Solution",
    "category": "Subject Wise / Mixed",
    "file": "Anatomy-_Class_Test_With_Video_Solution.json",
    "questions": 75
  },
  {
    "title": "Anatomy_-Thorax__General_Histology-Special_First_Year_Class_Test",
    "category": "Subject Wise / Mixed",
    "file": "Anatomy_-Thorax__General_Histology-Special_First_Year_Class_Test.json",
    "questions": 40
  },
  {
    "title": "Anatomy_Clinical_Vignettes",
    "category": "Subject Wise / Mixed",
    "file": "Anatomy_Clinical_Vignettes.json",
    "questions": 129
  },
  {
    "title": "Anatomy_DR_Sandeep_Class_Test_FMGE",
    "category": "Subject Wise / Mixed",
    "file": "Anatomy_DR_Sandeep_Class_Test_FMGE.json",
    "questions": 40
  },
  {
    "title": "Anatomy_DVT_Revision_Test",
    "category": "Subject Wise / Mixed",
    "file": "Anatomy_DVT_Revision_Test.json",
    "questions": 25
  },
  {
    "title": "Anatomy_Dissection_Based_Questions",
    "category": "Subject Wise / Mixed",
    "file": "Anatomy_Dissection_Based_Questions.json",
    "questions": 50
  },
  {
    "title": "Anatomy_Dr_Sandeep",
    "category": "Subject Wise / Mixed",
    "file": "Anatomy_Dr_Sandeep.json",
    "questions": 25
  },
  {
    "title": "Anatomy_Dr_Sandeep-2026",
    "category": "Subject Wise / Mixed",
    "file": "Anatomy_Dr_Sandeep-2026.json",
    "questions": 200
  },
  {
    "title": "Anatomy_Dr_Sandeep-2026",
    "category": "Subject Wise / Mixed",
    "file": "Anatomy_Dr_Sandeep-2026_1.json",
    "questions": 200
  },
  {
    "title": "Anatomy_FMGE_Dr_Sandeep",
    "category": "Subject Wise / Mixed",
    "file": "Anatomy_FMGE_Dr_Sandeep.json",
    "questions": 40
  },
  {
    "title": "Anatomy_FMGE_PYQ",
    "category": "Subject Wise / Mixed",
    "file": "Anatomy_FMGE_PYQ.json",
    "questions": 115
  },
  {
    "title": "Anatomy_Image_Based_Question",
    "category": "Subject Wise / Mixed",
    "file": "Anatomy_Image_Based_Question.json",
    "questions": 80
  },
  {
    "title": "Anatomy_Lower_Limb_Gen_EmbryoGeneral_Anatomy_Special_First_Year_Class_Test",
    "category": "Subject Wise / Mixed",
    "file": "Anatomy_Lower_Limb_Gen_EmbryoGeneral_Anatomy_Special_First_Year_Class_Test.json",
    "questions": 40
  },
  {
    "title": "Anatomy_MIQ_Series",
    "category": "Subject Wise / Mixed",
    "file": "Anatomy_MIQ_Series.json",
    "questions": 20
  },
  {
    "title": "Anatomy_Upper_Limb-Special_First_Year_Class_Test",
    "category": "Subject Wise / Mixed",
    "file": "Anatomy_Upper_Limb-Special_First_Year_Class_Test.json",
    "questions": 30
  },
  {
    "title": "Anatomy_and_Physiology_of_Larnyx",
    "category": "Subject Wise / Mixed",
    "file": "Anatomy_and_Physiology_of_Larnyx.json",
    "questions": 13
  },
  {
    "title": "Anatomy_and_Physiology_of_Nose",
    "category": "Subject Wise / Mixed",
    "file": "Anatomy_and_Physiology_of_Nose.json",
    "questions": 18
  },
  {
    "title": "Anatomy_of_Ear",
    "category": "Subject Wise / Mixed",
    "file": "Anatomy_of_Ear.json",
    "questions": 6
  },
  {
    "title": "Anatomy_of_Larynx",
    "category": "Subject Wise / Mixed",
    "file": "Anatomy_of_Larynx.json",
    "questions": 4
  },
  {
    "title": "Anatomy_of_Nose_and_Paranasal_Sinuses",
    "category": "Subject Wise / Mixed",
    "file": "Anatomy_of_Nose_and_Paranasal_Sinuses.json",
    "questions": 5
  },
  {
    "title": "Anatomy_of_Pharnyx",
    "category": "Subject Wise / Mixed",
    "file": "Anatomy_of_Pharnyx.json",
    "questions": 10
  },
  {
    "title": "Anemia & Iron Homoestasis",
    "category": "Subject Wise / Mixed",
    "file": "Anemia__Iron_Homoestasis.json",
    "questions": 14
  },
  {
    "title": "Anemia in Pregnancy",
    "category": "Subject Wise / Mixed",
    "file": "Anemia_in_Pregnancy.json",
    "questions": 12
  },
  {
    "title": "Anemia_In_Pregnanacy",
    "category": "Subject Wise / Mixed",
    "file": "Anemia_In_Pregnanacy.json",
    "questions": 8
  },
  {
    "title": "Anesthesia",
    "category": "Subject Wise / Mixed",
    "file": "Anesthesia.json",
    "questions": 100
  },
  {
    "title": "Anesthesia",
    "category": "Subject Wise / Mixed",
    "file": "Anesthesia_1.json",
    "questions": 65
  },
  {
    "title": "Anesthesia & Co-Existing Diseases",
    "category": "Subject Wise / Mixed",
    "file": "Anesthesia__Co-Existing_Diseases.json",
    "questions": 60
  },
  {
    "title": "Anesthesia - INI CET JULY 2021",
    "category": "Subject Wise / Mixed",
    "file": "Anesthesia_-_INI_CET_JULY_2021.json",
    "questions": 8
  },
  {
    "title": "Anesthesia - INI CET MAY 2022",
    "category": "Subject Wise / Mixed",
    "file": "Anesthesia_-_INI_CET_MAY_2022.json",
    "questions": 2
  },
  {
    "title": "Anesthesia - INI CET MAY 2023",
    "category": "Subject Wise / Mixed",
    "file": "Anesthesia_-_INI_CET_MAY_2023.json",
    "questions": 3
  },
  {
    "title": "Anesthesia - INI CET NOV 2020",
    "category": "Subject Wise / Mixed",
    "file": "Anesthesia_-_INI_CET_NOV_2020.json",
    "questions": 6
  },
  {
    "title": "Anesthesia - INI CET NOV 2021",
    "category": "Subject Wise / Mixed",
    "file": "Anesthesia_-_INI_CET_NOV_2021.json",
    "questions": 4
  },
  {
    "title": "Anesthesia - INI CET NOV 2022 (PART A)",
    "category": "Subject Wise / Mixed",
    "file": "Anesthesia_-_INI_CET_NOV_2022_PART_A.json",
    "questions": 2
  },
  {
    "title": "Anesthesia - INI CET NOV 2022 (PART B)",
    "category": "Subject Wise / Mixed",
    "file": "Anesthesia_-_INI_CET_NOV_2022_PART_B.json",
    "questions": 3
  },
  {
    "title": "Anesthesia - INI CET NOV 2023",
    "category": "Subject Wise / Mixed",
    "file": "Anesthesia_-_INI_CET_NOV_2023.json",
    "questions": 2
  },
  {
    "title": "Anesthesia Delivery Systems",
    "category": "Subject Wise / Mixed",
    "file": "Anesthesia_Delivery_Systems.json",
    "questions": 39
  },
  {
    "title": "Anesthesia E&D - Mission 1.5 - 16-03-2024 - 2024-03-16",
    "category": "Subject Wise / Mixed",
    "file": "Anesthesia_ED_-_Mission_15_-_16-03-2024_-_2024-03-16.json",
    "questions": 55
  },
  {
    "title": "Anesthesia E&D - Mission 1.5, Lap 2 - 05-06-2024 - 2024-06-05",
    "category": "Subject Wise / Mixed",
    "file": "Anesthesia_ED_-_Mission_15_Lap_2_-_05-06-2024_-_2024-06-05.json",
    "questions": 50
  },
  {
    "title": "Anesthesia E&D - Mission 2.0 (Batch 2) - 25-10-2024 - 2024-10-25",
    "category": "Subject Wise / Mixed",
    "file": "Anesthesia_ED_-_Mission_20_Batch_2_-_25-10-2024_-_2024-10-25.json",
    "questions": 75
  },
  {
    "title": "Anesthesia E&D - Mission 2.0 (Batch 3) - 05-12-2024 - 2024-12-05",
    "category": "Subject Wise / Mixed",
    "file": "Anesthesia_ED_-_Mission_20_Batch_3_-_05-12-2024_-_2024-12-05.json",
    "questions": 50
  },
  {
    "title": "Anesthesia E&D - Mission 2.0, Lap 2 - 24-03-2025 - 2025-03-24",
    "category": "Subject Wise / Mixed",
    "file": "Anesthesia_ED_-_Mission_20_Lap_2_-_24-03-2025_-_2025-03-24.json",
    "questions": 50
  },
  {
    "title": "Anesthesia Equipment",
    "category": "Subject Wise / Mixed",
    "file": "Anesthesia_Equipment.json",
    "questions": 50
  },
  {
    "title": "Anesthesia Last Month E&D - 07-07-2024 - 2024-07-07",
    "category": "Subject Wise / Mixed",
    "file": "Anesthesia_Last_Month_ED_-_07-07-2024_-_2024-07-07.json",
    "questions": 25
  },
  {
    "title": "Anesthesia Test (The Champion Batch Hyderabad) - 26-04-2024 - 2024-04-26",
    "category": "Subject Wise / Mixed",
    "file": "Anesthesia_Test_The_Champion_Batch_Hyderabad_-_26-04-2024_-_2024-04-26.json",
    "questions": 75
  },
  {
    "title": "Anesthesia Test (The Champion Batch Hyderabad) - 27-11-2024 - 2024-11-27",
    "category": "Subject Wise / Mixed",
    "file": "Anesthesia_Test_The_Champion_Batch_Hyderabad_-_27-11-2024_-_2024-11-27.json",
    "questions": 50
  },
  {
    "title": "Anesthesia-_Class_Test_With_Video_Solution",
    "category": "Subject Wise / Mixed",
    "file": "Anesthesia-_Class_Test_With_Video_Solution.json",
    "questions": 50
  },
  {
    "title": "Anesthesia_DVT_Revision_Test",
    "category": "Subject Wise / Mixed",
    "file": "Anesthesia_DVT_Revision_Test.json",
    "questions": 25
  },
  {
    "title": "Anesthesia_Dr_Anshul",
    "category": "Subject Wise / Mixed",
    "file": "Anesthesia_Dr_Anshul.json",
    "questions": 40
  },
  {
    "title": "Anesthesia_Dr_Anshul-2026",
    "category": "Subject Wise / Mixed",
    "file": "Anesthesia_Dr_Anshul-2026.json",
    "questions": 50
  },
  {
    "title": "Anesthesia_Dr_Anshul_FMGE_CT",
    "category": "Subject Wise / Mixed",
    "file": "Anesthesia_Dr_Anshul_FMGE_CT.json",
    "questions": 40
  },
  {
    "title": "Anesthesia_FMGE_PYQ",
    "category": "Subject Wise / Mixed",
    "file": "Anesthesia_FMGE_PYQ.json",
    "questions": 26
  },
  {
    "title": "Anesthesia_IBQ",
    "category": "Subject Wise / Mixed",
    "file": "Anesthesia_IBQ.json",
    "questions": 20
  },
  {
    "title": "Anesthesia_Image_Based_Question",
    "category": "Subject Wise / Mixed",
    "file": "Anesthesia_Image_Based_Question.json",
    "questions": 20
  },
  {
    "title": "Anesthesia_MIQ_Series",
    "category": "Subject Wise / Mixed",
    "file": "Anesthesia_MIQ_Series.json",
    "questions": 15
  },
  {
    "title": "Aneuploidy Screening",
    "category": "Subject Wise / Mixed",
    "file": "Aneuploidy_Screening.json",
    "questions": 13
  },
  {
    "title": "Aneurysm",
    "category": "Subject Wise / Mixed",
    "file": "Aneurysm.json",
    "questions": 6
  },
  {
    "title": "Aneurysm _ Av Malformation _ Amputation (Part 2)",
    "category": "Subject Wise / Mixed",
    "file": "Aneurysm___Av_Malformation___Amputation_Part_2.json",
    "questions": 17
  },
  {
    "title": "Angle Kappa",
    "category": "Subject Wise / Mixed",
    "file": "Angle_Kappa.json",
    "questions": 6
  },
  {
    "title": "Anisocoria",
    "category": "Subject Wise / Mixed",
    "file": "Anisocoria.json",
    "questions": 4
  },
  {
    "title": "Antenatal Care",
    "category": "Subject Wise / Mixed",
    "file": "Antenatal_Care.json",
    "questions": 152
  },
  {
    "title": "Antenatal Fetal Monitoring",
    "category": "Subject Wise / Mixed",
    "file": "Antenatal_Fetal_Monitoring.json",
    "questions": 10
  },
  {
    "title": "Antenatal Hydronephrosis & Hemolytic Uremic Syndrome",
    "category": "Subject Wise / Mixed",
    "file": "Antenatal_Hydronephrosis__Hemolytic_Uremic_Syndrome.json",
    "questions": 10
  },
  {
    "title": "Antenatal_Screening",
    "category": "Subject Wise / Mixed",
    "file": "Antenatal_Screening.json",
    "questions": 9
  },
  {
    "title": "Anterior Compartment of Thigh & Femoral Nerve",
    "category": "Subject Wise / Mixed",
    "file": "Anterior_Compartment_of_Thigh__Femoral_Nerve.json",
    "questions": 14
  },
  {
    "title": "Anterior Triangles of The Neck",
    "category": "Subject Wise / Mixed",
    "file": "Anterior_Triangles_of_The_Neck.json",
    "questions": 5
  },
  {
    "title": "Anterior Uveitis",
    "category": "Subject Wise / Mixed",
    "file": "Anterior_Uveitis.json",
    "questions": 13
  },
  {
    "title": "Anthrax",
    "category": "Subject Wise / Mixed",
    "file": "Anthrax.json",
    "questions": 4
  },
  {
    "title": "Anti -Thyroid Drugs & Drugs Used in Hypothyroidism",
    "category": "Subject Wise / Mixed",
    "file": "Anti_-Thyroid_Drugs__Drugs_Used_in_Hypothyroidism.json",
    "questions": 14
  },
  {
    "title": "Anti Anginal Drugs",
    "category": "Subject Wise / Mixed",
    "file": "Anti_Anginal_Drugs.json",
    "questions": 22
  },
  {
    "title": "Anti Glaucoma Drugs",
    "category": "Subject Wise / Mixed",
    "file": "Anti_Glaucoma_Drugs.json",
    "questions": 16
  },
  {
    "title": "Anti HIV Drugs",
    "category": "Subject Wise / Mixed",
    "file": "Anti_HIV_Drugs.json",
    "questions": 13
  },
  {
    "title": "Anti Helmintic Drug",
    "category": "Subject Wise / Mixed",
    "file": "Anti_Helmintic_Drug.json",
    "questions": 4
  },
  {
    "title": "Anti Parkinson\u2019s Drugs",
    "category": "Subject Wise / Mixed",
    "file": "Anti_Parkinsons_Drugs.json",
    "questions": 16
  },
  {
    "title": "Anti Protozoal Drugs",
    "category": "Subject Wise / Mixed",
    "file": "Anti_Protozoal_Drugs.json",
    "questions": 22
  },
  {
    "title": "Anti TB Drugs",
    "category": "Subject Wise / Mixed",
    "file": "Anti_TB_Drugs.json",
    "questions": 13
  },
  {
    "title": "Anti Viral Drugs",
    "category": "Subject Wise / Mixed",
    "file": "Anti_Viral_Drugs.json",
    "questions": 16
  },
  {
    "title": "Anti-Cancer Drugs & Immunosuppressants",
    "category": "Subject Wise / Mixed",
    "file": "Anti-Cancer_Drugs__Immunosuppressants.json",
    "questions": 46
  },
  {
    "title": "Anti_Microbials_Part-1",
    "category": "Subject Wise / Mixed",
    "file": "Anti_Microbials_Part-1.json",
    "questions": 14
  },
  {
    "title": "Anti_Microbials_Part-2",
    "category": "Subject Wise / Mixed",
    "file": "Anti_Microbials_Part-2.json",
    "questions": 28
  },
  {
    "title": "Anti_cancer_drugs",
    "category": "Subject Wise / Mixed",
    "file": "Anti_cancer_drugs.json",
    "questions": 140
  },
  {
    "title": "Anticancer_Drugs-Cytotoxic_drugs",
    "category": "Subject Wise / Mixed",
    "file": "Anticancer_Drugs-Cytotoxic_drugs.json",
    "questions": 27
  },
  {
    "title": "Anticancer_Drugs-Previous_Year_Questions",
    "category": "Subject Wise / Mixed",
    "file": "Anticancer_Drugs-Previous_Year_Questions.json",
    "questions": 48
  },
  {
    "title": "Anticancer_Drugs-Targeted_Therapy_and_Monoclonal_Antibodies",
    "category": "Subject Wise / Mixed",
    "file": "Anticancer_Drugs-Targeted_Therapy_and_Monoclonal_Antibodies.json",
    "questions": 13
  },
  {
    "title": "Anticancer_and_Immunomodulators",
    "category": "Subject Wise / Mixed",
    "file": "Anticancer_and_Immunomodulators.json",
    "questions": 17
  },
  {
    "title": "Anticholinergic Drugs",
    "category": "Subject Wise / Mixed",
    "file": "Anticholinergic_Drugs.json",
    "questions": 10
  },
  {
    "title": "Anticholinergic_Drugs",
    "category": "Subject Wise / Mixed",
    "file": "Anticholinergic_Drugs_1.json",
    "questions": 10
  },
  {
    "title": "Anticoagulant Drugs",
    "category": "Subject Wise / Mixed",
    "file": "Anticoagulant_Drugs.json",
    "questions": 22
  },
  {
    "title": "Antidepressant Drugs",
    "category": "Subject Wise / Mixed",
    "file": "Antidepressant_Drugs.json",
    "questions": 20
  },
  {
    "title": "Antidiabetic Drugs(Remaining Drugs & Summary)",
    "category": "Subject Wise / Mixed",
    "file": "Antidiabetic_DrugsRemaining_Drugs__Summary.json",
    "questions": 21
  },
  {
    "title": "Antidiuretic Drugs",
    "category": "Subject Wise / Mixed",
    "file": "Antidiuretic_Drugs.json",
    "questions": 7
  },
  {
    "title": "Antiemetic Drugs",
    "category": "Subject Wise / Mixed",
    "file": "Antiemetic_Drugs.json",
    "questions": 17
  },
  {
    "title": "Antiepileptic Drugs",
    "category": "Subject Wise / Mixed",
    "file": "Antiepileptic_Drugs.json",
    "questions": 14
  },
  {
    "title": "Antifungal Drugs",
    "category": "Subject Wise / Mixed",
    "file": "Antifungal_Drugs.json",
    "questions": 8
  },
  {
    "title": "Antigen & Antibody",
    "category": "Subject Wise / Mixed",
    "file": "Antigen__Antibody.json",
    "questions": 22
  },
  {
    "title": "Antigen - Antibody Reactions",
    "category": "Subject Wise / Mixed",
    "file": "Antigen_-_Antibody_Reactions.json",
    "questions": 22
  },
  {
    "title": "Antigen Presenting Cells & MHC",
    "category": "Subject Wise / Mixed",
    "file": "Antigen_Presenting_Cells__MHC.json",
    "questions": 8
  },
  {
    "title": "Antimalarial Drugs",
    "category": "Subject Wise / Mixed",
    "file": "Antimalarial_Drugs.json",
    "questions": 9
  },
  {
    "title": "Antimicrobial Agents",
    "category": "Subject Wise / Mixed",
    "file": "Antimicrobial_Agents.json",
    "questions": 116
  },
  {
    "title": "Antimicrobial Susceptibility Testing & Genetics",
    "category": "Subject Wise / Mixed",
    "file": "Antimicrobial_Susceptibility_Testing__Genetics.json",
    "questions": 22
  },
  {
    "title": "Antimicrobial_System",
    "category": "Subject Wise / Mixed",
    "file": "Antimicrobial_System.json",
    "questions": 95
  },
  {
    "title": "Antimicrobials-Anti-Parasitic_and_Anti_Protozoal_Drugs",
    "category": "Subject Wise / Mixed",
    "file": "Antimicrobials-Anti-Parasitic_and_Anti_Protozoal_Drugs.json",
    "questions": 20
  },
  {
    "title": "Antimicrobials-Anti-mycobacterial_drugs",
    "category": "Subject Wise / Mixed",
    "file": "Antimicrobials-Anti-mycobacterial_drugs.json",
    "questions": 25
  },
  {
    "title": "Antimicrobials-Antifungal_Drugs",
    "category": "Subject Wise / Mixed",
    "file": "Antimicrobials-Antifungal_Drugs.json",
    "questions": 12
  },
  {
    "title": "Antimicrobials-Antimetabolites_and_Fluroquinolones",
    "category": "Subject Wise / Mixed",
    "file": "Antimicrobials-Antimetabolites_and_Fluroquinolones.json",
    "questions": 13
  },
  {
    "title": "Antimicrobials-Antiviral_Drugs",
    "category": "Subject Wise / Mixed",
    "file": "Antimicrobials-Antiviral_Drugs.json",
    "questions": 24
  },
  {
    "title": "Antimicrobials-Cell_Wall_Synthesis_Inhibitors",
    "category": "Subject Wise / Mixed",
    "file": "Antimicrobials-Cell_Wall_Synthesis_Inhibitors.json",
    "questions": 20
  },
  {
    "title": "Antimicrobials-Previous_Year_Questions",
    "category": "Subject Wise / Mixed",
    "file": "Antimicrobials-Previous_Year_Questions.json",
    "questions": 93
  },
  {
    "title": "Antimicrobials-Properties_of_Anti-microbial_Agents",
    "category": "Subject Wise / Mixed",
    "file": "Antimicrobials-Properties_of_Anti-microbial_Agents.json",
    "questions": 9
  },
  {
    "title": "Antimicrobials-Protein_Synthesis_Inhibitors",
    "category": "Subject Wise / Mixed",
    "file": "Antimicrobials-Protein_Synthesis_Inhibitors.json",
    "questions": 15
  },
  {
    "title": "Antiplatelet Drugs",
    "category": "Subject Wise / Mixed",
    "file": "Antiplatelet_Drugs.json",
    "questions": 12
  },
  {
    "title": "Antiplatelet_and_Anticoagulant",
    "category": "Subject Wise / Mixed",
    "file": "Antiplatelet_and_Anticoagulant.json",
    "questions": 12
  },
  {
    "title": "Antipsychotic Drugs",
    "category": "Subject Wise / Mixed",
    "file": "Antipsychotic_Drugs.json",
    "questions": 20
  },
  {
    "title": "Anxiety Disorders",
    "category": "Subject Wise / Mixed",
    "file": "Anxiety_Disorders.json",
    "questions": 24
  },
  {
    "title": "Anxiety or Fear-Related Disorders",
    "category": "Subject Wise / Mixed",
    "file": "Anxiety_or_Fear-Related_Disorders.json",
    "questions": 15
  },
  {
    "title": "Aorta, CT, SMA & IMA",
    "category": "Subject Wise / Mixed",
    "file": "Aorta_CT_SMA__IMA.json",
    "questions": 14
  },
  {
    "title": "Apoptosis",
    "category": "Subject Wise / Mixed",
    "file": "Apoptosis.json",
    "questions": 29
  },
  {
    "title": "Appendix",
    "category": "Subject Wise / Mixed",
    "file": "Appendix.json",
    "questions": 32
  },
  {
    "title": "Appendix",
    "category": "Subject Wise / Mixed",
    "file": "Appendix_1.json",
    "questions": 29
  },
  {
    "title": "Applied_anatomy_and_heading",
    "category": "Subject Wise / Mixed",
    "file": "Applied_anatomy_and_heading.json",
    "questions": 56
  },
  {
    "title": "Approach To Nephritic Syndromes",
    "category": "Subject Wise / Mixed",
    "file": "Approach_To_Nephritic_Syndromes.json",
    "questions": 15
  },
  {
    "title": "Approach to Anemia",
    "category": "Subject Wise / Mixed",
    "file": "Approach_to_Anemia.json",
    "questions": 16
  },
  {
    "title": "Approach to Breast Lump",
    "category": "Subject Wise / Mixed",
    "file": "Approach_to_Breast_Lump.json",
    "questions": 14
  },
  {
    "title": "Approach to Glomerular Disease",
    "category": "Subject Wise / Mixed",
    "file": "Approach_to_Glomerular_Disease.json",
    "questions": 10
  },
  {
    "title": "Approach to Liver Function Tests",
    "category": "Subject Wise / Mixed",
    "file": "Approach_to_Liver_Function_Tests.json",
    "questions": 15
  },
  {
    "title": "Approach to Muscle Disorders",
    "category": "Subject Wise / Mixed",
    "file": "Approach_to_Muscle_Disorders.json",
    "questions": 16
  },
  {
    "title": "Approach to Polyuria (Polyuria)",
    "category": "Subject Wise / Mixed",
    "file": "Approach_to_Polyuria_Polyuria.json",
    "questions": 5
  },
  {
    "title": "Approach to Shock (Part 1)",
    "category": "Subject Wise / Mixed",
    "file": "Approach_to_Shock_Part_1.json",
    "questions": 5
  },
  {
    "title": "Arches of Foot",
    "category": "Subject Wise / Mixed",
    "file": "Arches_of_Foot.json",
    "questions": 6
  },
  {
    "title": "Arterial Supply of Heart",
    "category": "Subject Wise / Mixed",
    "file": "Arterial_Supply_of_Heart.json",
    "questions": 7
  },
  {
    "title": "Arterial_Disorders",
    "category": "Subject Wise / Mixed",
    "file": "Arterial_Disorders.json",
    "questions": 6
  },
  {
    "title": "Arterial_System",
    "category": "Subject Wise / Mixed",
    "file": "Arterial_System.json",
    "questions": 40
  },
  {
    "title": "Arthritis",
    "category": "Subject Wise / Mixed",
    "file": "Arthritis.json",
    "questions": 98
  },
  {
    "title": "Arthritis-Arthritis",
    "category": "Subject Wise / Mixed",
    "file": "Arthritis-Arthritis.json",
    "questions": 15
  },
  {
    "title": "Arthritis-Previous_Year_Questions",
    "category": "Subject Wise / Mixed",
    "file": "Arthritis-Previous_Year_Questions.json",
    "questions": 15
  },
  {
    "title": "Artificial Reproductive Technology",
    "category": "Subject Wise / Mixed",
    "file": "Artificial_Reproductive_Technology.json",
    "questions": 8
  },
  {
    "title": "Ascending Tracts",
    "category": "Subject Wise / Mixed",
    "file": "Ascending_Tracts.json",
    "questions": 15
  },
  {
    "title": "Ascites",
    "category": "Subject Wise / Mixed",
    "file": "Ascites.json",
    "questions": 10
  },
  {
    "title": "Asphyxia",
    "category": "Subject Wise / Mixed",
    "file": "Asphyxia.json",
    "questions": 41
  },
  {
    "title": "Asphyxial_Deaths-Asphyxial_Death",
    "category": "Subject Wise / Mixed",
    "file": "Asphyxial_Deaths-Asphyxial_Death.json",
    "questions": 18
  },
  {
    "title": "Asphyxial_Deaths-Previous_Year_Questions",
    "category": "Subject Wise / Mixed",
    "file": "Asphyxial_Deaths-Previous_Year_Questions.json",
    "questions": 7
  },
  {
    "title": "Asphyxiants",
    "category": "Subject Wise / Mixed",
    "file": "Asphyxiants.json",
    "questions": 6
  },
  {
    "title": "Assistive Devices For Hearing",
    "category": "Subject Wise / Mixed",
    "file": "Assistive_Devices_For_Hearing.json",
    "questions": 8
  },
  {
    "title": "Asthma",
    "category": "Subject Wise / Mixed",
    "file": "Asthma.json",
    "questions": 16
  },
  {
    "title": "Asthma",
    "category": "Subject Wise / Mixed",
    "file": "Asthma_1.json",
    "questions": 16
  },
  {
    "title": "Asthma (Part 1)",
    "category": "Subject Wise / Mixed",
    "file": "Asthma_Part_1.json",
    "questions": 17
  },
  {
    "title": "Asthma (Part 2)",
    "category": "Subject Wise / Mixed",
    "file": "Asthma_Part_2.json",
    "questions": 11
  },
  {
    "title": "Astigmatism & Accommodation",
    "category": "Subject Wise / Mixed",
    "file": "Astigmatism__Accommodation.json",
    "questions": 13
  },
  {
    "title": "Ataxia Neurodegenerative Disorders",
    "category": "Subject Wise / Mixed",
    "file": "Ataxia_Neurodegenerative_Disorders.json",
    "questions": 11
  },
  {
    "title": "Atelectasis",
    "category": "Subject Wise / Mixed",
    "file": "Atelectasis.json",
    "questions": 1
  },
  {
    "title": "Atrophy",
    "category": "Subject Wise / Mixed",
    "file": "Atrophy.json",
    "questions": 7
  },
  {
    "title": "Atypical Parkinson\u2019s",
    "category": "Subject Wise / Mixed",
    "file": "Atypical_Parkinsons.json",
    "questions": 24
  },
  {
    "title": "Audiometric_Tests_and_Miscellaneous",
    "category": "Subject Wise / Mixed",
    "file": "Audiometric_Tests_and_Miscellaneous.json",
    "questions": 31
  },
  {
    "title": "Audiometry",
    "category": "Subject Wise / Mixed",
    "file": "Audiometry.json",
    "questions": 9
  },
  {
    "title": "Auditory Pathway",
    "category": "Subject Wise / Mixed",
    "file": "Auditory_Pathway.json",
    "questions": 7
  },
  {
    "title": "Autacoids",
    "category": "Subject Wise / Mixed",
    "file": "Autacoids.json",
    "questions": 32
  },
  {
    "title": "Autacoids-Gout_and_Rheumatoid_Arthritis",
    "category": "Subject Wise / Mixed",
    "file": "Autacoids-Gout_and_Rheumatoid_Arthritis.json",
    "questions": 15
  },
  {
    "title": "Autacoids-Histamine__Serotonin_and_Lipid_Autocoids",
    "category": "Subject Wise / Mixed",
    "file": "Autacoids-Histamine__Serotonin_and_Lipid_Autocoids.json",
    "questions": 18
  },
  {
    "title": "Autacoids-Non_Steroidal_Anti_Inflammatory_Drugs",
    "category": "Subject Wise / Mixed",
    "file": "Autacoids-Non_Steroidal_Anti_Inflammatory_Drugs.json",
    "questions": 10
  },
  {
    "title": "Autacoids-Previous_Year_Questions",
    "category": "Subject Wise / Mixed",
    "file": "Autacoids-Previous_Year_Questions.json",
    "questions": 38
  },
  {
    "title": "Autacoids_",
    "category": "Subject Wise / Mixed",
    "file": "Autacoids_.json",
    "questions": 18
  },
  {
    "title": "Autism Spectrum Disorder",
    "category": "Subject Wise / Mixed",
    "file": "Autism_Spectrum_Disorder.json",
    "questions": 9
  },
  {
    "title": "Autoimmune Cholangiopathies",
    "category": "Subject Wise / Mixed",
    "file": "Autoimmune_Cholangiopathies.json",
    "questions": 5
  },
  {
    "title": "Autoimmune Hemolytic Anemia",
    "category": "Subject Wise / Mixed",
    "file": "Autoimmune_Hemolytic_Anemia.json",
    "questions": 5
  },
  {
    "title": "Autoimmunity",
    "category": "Subject Wise / Mixed",
    "file": "Autoimmunity.json",
    "questions": 5
  },
  {
    "title": "Autonomic Nervous System",
    "category": "Subject Wise / Mixed",
    "file": "Autonomic_Nervous_System.json",
    "questions": 79
  },
  {
    "title": "Autonomic_Nervous_System",
    "category": "Subject Wise / Mixed",
    "file": "Autonomic_Nervous_System_1.json",
    "questions": 23
  },
  {
    "title": "Autopsy_FSL",
    "category": "Subject Wise / Mixed",
    "file": "Autopsy_FSL.json",
    "questions": 26
  },
  {
    "title": "Autopsy_Necropsy_Postmortem_Examination_Thanotopsy",
    "category": "Subject Wise / Mixed",
    "file": "Autopsy_Necropsy_Postmortem_Examination_Thanotopsy.json",
    "questions": 8
  },
  {
    "title": "BERA & OAE",
    "category": "Subject Wise / Mixed",
    "file": "BERA__OAE.json",
    "questions": 6
  },
  {
    "title": "BPPV",
    "category": "Subject Wise / Mixed",
    "file": "BPPV.json",
    "questions": 5
  },
  {
    "title": "Back_Region-Back_Region",
    "category": "Subject Wise / Mixed",
    "file": "Back_Region-Back_Region.json",
    "questions": 17
  },
  {
    "title": "Back_Region-Previous_Year_Questions",
    "category": "Subject Wise / Mixed",
    "file": "Back_Region-Previous_Year_Questions.json",
    "questions": 8
  },
  {
    "title": "Bacteria causing UTI",
    "category": "Subject Wise / Mixed",
    "file": "Bacteria_causing_UTI.json",
    "questions": 18
  },
  {
    "title": "Bacterial Atypical Pneumonia",
    "category": "Subject Wise / Mixed",
    "file": "Bacterial_Atypical_Pneumonia.json",
    "questions": 19
  },
  {
    "title": "Bacterial Corneal Ulcer",
    "category": "Subject Wise / Mixed",
    "file": "Bacterial_Corneal_Ulcer.json",
    "questions": 7
  },
  {
    "title": "Bacterial Infections",
    "category": "Subject Wise / Mixed",
    "file": "Bacterial_Infections.json",
    "questions": 13
  },
  {
    "title": "Bacterial Infections",
    "category": "Subject Wise / Mixed",
    "file": "Bacterial_Infections_2.json",
    "questions": 13
  },
  {
    "title": "Bacterial Meningitis",
    "category": "Subject Wise / Mixed",
    "file": "Bacterial_Meningitis.json",
    "questions": 22
  },
  {
    "title": "Bacterial Typical Pneumonia",
    "category": "Subject Wise / Mixed",
    "file": "Bacterial_Typical_Pneumonia.json",
    "questions": 6
  },
  {
    "title": "Bacterial_Infections",
    "category": "Subject Wise / Mixed",
    "file": "Bacterial_Infections_1.json",
    "questions": 23
  },
  {
    "title": "Bacterial_Infections-Bacterial_Infections",
    "category": "Subject Wise / Mixed",
    "file": "Bacterial_Infections-Bacterial_Infections.json",
    "questions": 9
  },
  {
    "title": "Bacterial_Infections-Previous_Year_Questions",
    "category": "Subject Wise / Mixed",
    "file": "Bacterial_Infections-Previous_Year_Questions.json",
    "questions": 4
  },
  {
    "title": "Bacterial_Infections_of_Skin",
    "category": "Subject Wise / Mixed",
    "file": "Bacterial_Infections_of_Skin.json",
    "questions": 4
  },
  {
    "title": "Bacteriology",
    "category": "Subject Wise / Mixed",
    "file": "Bacteriology.json",
    "questions": 311
  },
  {
    "title": "Bacteriology-Part-1",
    "category": "Subject Wise / Mixed",
    "file": "Bacteriology-Part-1.json",
    "questions": 184
  },
  {
    "title": "Bacteriology-Part-2",
    "category": "Subject Wise / Mixed",
    "file": "Bacteriology-Part-2.json",
    "questions": 203
  },
  {
    "title": "Bacteriology_Part-1",
    "category": "Subject Wise / Mixed",
    "file": "Bacteriology_Part-1.json",
    "questions": 15
  },
  {
    "title": "Bacteriology_Part-2",
    "category": "Subject Wise / Mixed",
    "file": "Bacteriology_Part-2.json",
    "questions": 15
  },
  {
    "title": "Ballistics",
    "category": "Subject Wise / Mixed",
    "file": "Ballistics.json",
    "questions": 5
  },
  {
    "title": "Ballistics-Forensic_Ballistics",
    "category": "Subject Wise / Mixed",
    "file": "Ballistics-Forensic_Ballistics.json",
    "questions": 25
  },
  {
    "title": "Ballistics-Previous_Year_Questions",
    "category": "Subject Wise / Mixed",
    "file": "Ballistics-Previous_Year_Questions.json",
    "questions": 5
  },
  {
    "title": "Barbiturates & Chloral Hydrate",
    "category": "Subject Wise / Mixed",
    "file": "Barbiturates__Chloral_Hydrate.json",
    "questions": 4
  },
  {
    "title": "Bariatric_Surgery",
    "category": "Subject Wise / Mixed",
    "file": "Bariatric_Surgery.json",
    "questions": 7
  },
  {
    "title": "Basal Ganglia",
    "category": "Subject Wise / Mixed",
    "file": "Basal_Ganglia.json",
    "questions": 8
  },
  {
    "title": "Basic Concept, Tricks and Magic of Anatomy",
    "category": "Subject Wise / Mixed",
    "file": "Basic_Concept_Tricks_and_Magic_of_Anatomy.json",
    "questions": 2
  },
  {
    "title": "Basic Obs and Gynae",
    "category": "Subject Wise / Mixed",
    "file": "Basic_Obs_and_Gynae.json",
    "questions": 44
  },
  {
    "title": "Basic Pathophysiology of Trauma & Stress (Part 1)",
    "category": "Subject Wise / Mixed",
    "file": "Basic_Pathophysiology_of_Trauma__Stress_Part_1.json",
    "questions": 7
  },
  {
    "title": "Basic Peripheral Nerve Injuries",
    "category": "Subject Wise / Mixed",
    "file": "Basic_Peripheral_Nerve_Injuries.json",
    "questions": 19
  },
  {
    "title": "Basic Terminology & Coxa Vara",
    "category": "Subject Wise / Mixed",
    "file": "Basic_Terminology__Coxa_Vara.json",
    "questions": 8
  },
  {
    "title": "Basic_Concepts_of_Nutrition_RDA_Vitamins",
    "category": "Subject Wise / Mixed",
    "file": "Basic_Concepts_of_Nutrition_RDA_Vitamins.json",
    "questions": 7
  },
  {
    "title": "Basics",
    "category": "Subject Wise / Mixed",
    "file": "Basics.json",
    "questions": 5
  },
  {
    "title": "Basics Of Bone Tumors",
    "category": "Subject Wise / Mixed",
    "file": "Basics_Of_Bone_Tumors.json",
    "questions": 13
  },
  {
    "title": "Basics Of Metabolic Disorders",
    "category": "Subject Wise / Mixed",
    "file": "Basics_Of_Metabolic_Disorders.json",
    "questions": 3
  },
  {
    "title": "Basics Of Trauma General Considerations (Part-1)",
    "category": "Subject Wise / Mixed",
    "file": "Basics_Of_Trauma_General_Considerations_Part-1.json",
    "questions": 12
  },
  {
    "title": "Basics Of Trauma General Considerations (Part-2)",
    "category": "Subject Wise / Mixed",
    "file": "Basics_Of_Trauma_General_Considerations_Part-2.json",
    "questions": 15
  },
  {
    "title": "Basics and Fundamentals of CT",
    "category": "Subject Wise / Mixed",
    "file": "Basics_and_Fundamentals_of_CT.json",
    "questions": 24
  },
  {
    "title": "Basics of Dermatology",
    "category": "Subject Wise / Mixed",
    "file": "Basics_of_Dermatology.json",
    "questions": 44
  },
  {
    "title": "Basics of ECG Understanding",
    "category": "Subject Wise / Mixed",
    "file": "Basics_of_ECG_Understanding.json",
    "questions": 7
  },
  {
    "title": "Basics of Psychiatry",
    "category": "Subject Wise / Mixed",
    "file": "Basics_of_Psychiatry.json",
    "questions": 34
  },
  {
    "title": "Basics of Radiography",
    "category": "Subject Wise / Mixed",
    "file": "Basics_of_Radiography.json",
    "questions": 22
  },
  {
    "title": "Basics of Ultrasound",
    "category": "Subject Wise / Mixed",
    "file": "Basics_of_Ultrasound.json",
    "questions": 34
  },
  {
    "title": "Basics_Of_Pregnancy",
    "category": "Subject Wise / Mixed",
    "file": "Basics_Of_Pregnancy.json",
    "questions": 24
  },
  {
    "title": "Basics_of_Obstetrics-Previous_Year_Questions",
    "category": "Subject Wise / Mixed",
    "file": "Basics_of_Obstetrics-Previous_Year_Questions.json",
    "questions": 36
  },
  {
    "title": "Basics_of_Psychiatry-Basics_of_Psychiatry_",
    "category": "Subject Wise / Mixed",
    "file": "Basics_of_Psychiatry-Basics_of_Psychiatry_.json",
    "questions": 25
  },
  {
    "title": "Basics_of_Psychiatry-Previous_Year_Questions",
    "category": "Subject Wise / Mixed",
    "file": "Basics_of_Psychiatry-Previous_Year_Questions.json",
    "questions": 7
  },
  {
    "title": "Basics_of_Psychiatry_",
    "category": "Subject Wise / Mixed",
    "file": "Basics_of_Psychiatry_.json",
    "questions": 13
  },
  {
    "title": "Basics_of_Radiology-Basics_of_MRI_and_Interventional_Radiology",
    "category": "Subject Wise / Mixed",
    "file": "Basics_of_Radiology-Basics_of_MRI_and_Interventional_Radiology.json",
    "questions": 10
  },
  {
    "title": "Basics_of_Radiology-Basics_of_Radiology",
    "category": "Subject Wise / Mixed",
    "file": "Basics_of_Radiology-Basics_of_Radiology.json",
    "questions": 25
  },
  {
    "title": "Basics_of_Radiology-Previous_Year_Questions",
    "category": "Subject Wise / Mixed",
    "file": "Basics_of_Radiology-Previous_Year_Questions.json",
    "questions": 31
  },
  {
    "title": "Basics_of_Radiology-Radiation_Exposure__Hazards__Protection_Guidelines__and_Contrast_Media",
    "category": "Subject Wise / Mixed",
    "file": "Basics_of_Radiology-Radiation_Exposure__Hazards__Protection_Guidelines__and_Contrast_Media.json",
    "questions": 12
  },
  {
    "title": "Basics_of_Radiology_",
    "category": "Subject Wise / Mixed",
    "file": "Basics_of_Radiology_.json",
    "questions": 12
  },
  {
    "title": "Basics_of_Xrays",
    "category": "Subject Wise / Mixed",
    "file": "Basics_of_Xrays.json",
    "questions": 32
  },
  {
    "title": "Behavioral Disorders",
    "category": "Subject Wise / Mixed",
    "file": "Behavioral_Disorders.json",
    "questions": 10
  },
  {
    "title": "Benign Aggressive Tumors",
    "category": "Subject Wise / Mixed",
    "file": "Benign_Aggressive_Tumors.json",
    "questions": 20
  },
  {
    "title": "Benign Disorders of Breast",
    "category": "Subject Wise / Mixed",
    "file": "Benign_Disorders_of_Breast.json",
    "questions": 19
  },
  {
    "title": "Benign Gynae Disorders",
    "category": "Subject Wise / Mixed",
    "file": "Benign_Gynae_Disorders.json",
    "questions": 49
  },
  {
    "title": "Benign Lesions Of Bone",
    "category": "Subject Wise / Mixed",
    "file": "Benign_Lesions_Of_Bone.json",
    "questions": 11
  },
  {
    "title": "Beta Blockers",
    "category": "Subject Wise / Mixed",
    "file": "Beta_Blockers.json",
    "questions": 18
  },
  {
    "title": "Bilaminar Germ Disk Formation & Gastrulation",
    "category": "Subject Wise / Mixed",
    "file": "Bilaminar_Germ_Disk_Formation__Gastrulation.json",
    "questions": 10
  },
  {
    "title": "Bile_Duct",
    "category": "Subject Wise / Mixed",
    "file": "Bile_Duct.json",
    "questions": 6
  },
  {
    "title": "Biliary_System",
    "category": "Subject Wise / Mixed",
    "file": "Biliary_System.json",
    "questions": 44
  },
  {
    "title": "Binocular Single Vision",
    "category": "Subject Wise / Mixed",
    "file": "Binocular_Single_Vision.json",
    "questions": 12
  },
  {
    "title": "Biochemistry",
    "category": "Subject Wise / Mixed",
    "file": "Biochemistry.json",
    "questions": 20
  },
  {
    "title": "Biochemistry - INI CET 2020",
    "category": "Subject Wise / Mixed",
    "file": "Biochemistry_-_INI_CET_2020.json",
    "questions": 14
  },
  {
    "title": "Biochemistry - INI CET JULY 2021",
    "category": "Subject Wise / Mixed",
    "file": "Biochemistry_-_INI_CET_JULY_2021.json",
    "questions": 16
  },
  {
    "title": "Biochemistry - INI CET MAY 2022",
    "category": "Subject Wise / Mixed",
    "file": "Biochemistry_-_INI_CET_MAY_2022.json",
    "questions": 12
  },
  {
    "title": "Biochemistry - INI CET MAY 2023",
    "category": "Subject Wise / Mixed",
    "file": "Biochemistry_-_INI_CET_MAY_2023.json",
    "questions": 10
  },
  {
    "title": "Biochemistry - INI CET NOV 2021",
    "category": "Subject Wise / Mixed",
    "file": "Biochemistry_-_INI_CET_NOV_2021.json",
    "questions": 11
  },
  {
    "title": "Biochemistry - INI CET NOV 2022",
    "category": "Subject Wise / Mixed",
    "file": "Biochemistry_-_INI_CET_NOV_2022.json",
    "questions": 20
  },
  {
    "title": "Biochemistry E&D - Mission 1.5 - 06-04-2024 - 2024-04-06",
    "category": "Subject Wise / Mixed",
    "file": "Biochemistry_ED_-_Mission_15_-_06-04-2024_-_2024-04-06.json",
    "questions": 100
  },
  {
    "title": "Biochemistry E&D - Mission 1.5, Lap 2 - 30-05-2024 - 2024-05-30",
    "category": "Subject Wise / Mixed",
    "file": "Biochemistry_ED_-_Mission_15_Lap_2_-_30-05-2024_-_2024-05-30.json",
    "questions": 75
  },
  {
    "title": "Biochemistry E&D - Mission 2.0 (Batch 2) - 08-12-2024 - 2024-12-08",
    "category": "Subject Wise / Mixed",
    "file": "Biochemistry_ED_-_Mission_20_Batch_2_-_08-12-2024_-_2024-12-08.json",
    "questions": 100
  },
  {
    "title": "Biochemistry E&D - Mission 2.0 (Batch 3) - 29-12-2024 - 2024-12-29",
    "category": "Subject Wise / Mixed",
    "file": "Biochemistry_ED_-_Mission_20_Batch_3_-_29-12-2024_-_2024-12-29.json",
    "questions": 100
  },
  {
    "title": "Biochemistry E&D - Mission 2.0, Lap 2 - 13-04-2025 - 2025-04-13",
    "category": "Subject Wise / Mixed",
    "file": "Biochemistry_ED_-_Mission_20_Lap_2_-_13-04-2025_-_2025-04-13.json",
    "questions": 75
  },
  {
    "title": "Biochemistry E&D, Mission 3.0 (Early_Intern Batch) - 22-05-2025 - 2025-05-22",
    "category": "Subject Wise / Mixed",
    "file": "Biochemistry_ED_Mission_30_Early_Intern_Batch_-_22-05-2025_-_2025-05-22.json",
    "questions": 100
  },
  {
    "title": "Biochemistry Last Month E&D - 03-08-2024 - 2024-08-03",
    "category": "Subject Wise / Mixed",
    "file": "Biochemistry_Last_Month_ED_-_03-08-2024_-_2024-08-03.json",
    "questions": 25
  },
  {
    "title": "Biochemistry Test (The Champion Batch Hyderabad) - 16-08-2024 - 2024-08-16",
    "category": "Subject Wise / Mixed",
    "file": "Biochemistry_Test_The_Champion_Batch_Hyderabad_-_16-08-2024_-_2024-08-16.json",
    "questions": 75
  },
  {
    "title": "Biochemistry Test (The Champion Batch Hyderabad) - 25-12-2024 - 2024-12-25",
    "category": "Subject Wise / Mixed",
    "file": "Biochemistry_Test_The_Champion_Batch_Hyderabad_-_25-12-2024_-_2024-12-25.json",
    "questions": 100
  },
  {
    "title": "Biochemistry- INI CET NOV 2023",
    "category": "Subject Wise / Mixed",
    "file": "Biochemistry-_INI_CET_NOV_2023.json",
    "questions": 8
  },
  {
    "title": "Biochemistry-Previous_Year_Questions",
    "category": "Subject Wise / Mixed",
    "file": "Biochemistry-Previous_Year_Questions.json",
    "questions": 2
  },
  {
    "title": "Biochemistry-Special_First_Year_Class_Test",
    "category": "Subject Wise / Mixed",
    "file": "Biochemistry-Special_First_Year_Class_Test.json",
    "questions": 20
  },
  {
    "title": "Biochemistry-_Class_Test_With_Video_Solution",
    "category": "Subject Wise / Mixed",
    "file": "Biochemistry-_Class_Test_With_Video_Solution.json",
    "questions": 75
  },
  {
    "title": "Biochemistry_Clinical_Vignettes",
    "category": "Subject Wise / Mixed",
    "file": "Biochemistry_Clinical_Vignettes.json",
    "questions": 53
  },
  {
    "title": "Biochemistry_DVT_Revision_Test",
    "category": "Subject Wise / Mixed",
    "file": "Biochemistry_DVT_Revision_Test.json",
    "questions": 25
  },
  {
    "title": "Biochemistry_Dr_Sonam",
    "category": "Subject Wise / Mixed",
    "file": "Biochemistry_Dr_Sonam.json",
    "questions": 40
  },
  {
    "title": "Biochemistry_Dr_Sonam-2026",
    "category": "Subject Wise / Mixed",
    "file": "Biochemistry_Dr_Sonam-2026.json",
    "questions": 100
  },
  {
    "title": "Biochemistry_Dr_Sonam_FMGE_CT",
    "category": "Subject Wise / Mixed",
    "file": "Biochemistry_Dr_Sonam_FMGE_CT.json",
    "questions": 50
  },
  {
    "title": "Biochemistry_FMGE_PYQ",
    "category": "Subject Wise / Mixed",
    "file": "Biochemistry_FMGE_PYQ.json",
    "questions": 122
  },
  {
    "title": "Biochemistry_IBQ",
    "category": "Subject Wise / Mixed",
    "file": "Biochemistry_IBQ.json",
    "questions": 20
  },
  {
    "title": "Biochemistry_Image_Based_Question",
    "category": "Subject Wise / Mixed",
    "file": "Biochemistry_Image_Based_Question.json",
    "questions": 20
  },
  {
    "title": "Biochemistry_MIQ_Series",
    "category": "Subject Wise / Mixed",
    "file": "Biochemistry_MIQ_Series.json",
    "questions": 20
  },
  {
    "title": "Biochemistry_Special_First_Year_Class_Test",
    "category": "Subject Wise / Mixed",
    "file": "Biochemistry_Special_First_Year_Class_Test.json",
    "questions": 35
  },
  {
    "title": "Biomedical Waste Management",
    "category": "Subject Wise / Mixed",
    "file": "Biomedical_Waste_Management.json",
    "questions": 26
  },
  {
    "title": "Biomedical Waste Management",
    "category": "Subject Wise / Mixed",
    "file": "Biomedical_Waste_Management_1.json",
    "questions": 16
  },
  {
    "title": "Biomedical_Waste_Management-Biomedical_waste_management_and_Genetics_and_Health",
    "category": "Subject Wise / Mixed",
    "file": "Biomedical_Waste_Management-Biomedical_waste_management_and_Genetics_and_Health.json",
    "questions": 15
  },
  {
    "title": "Biomedical_Waste_Management-Previous_Year_Questions",
    "category": "Subject Wise / Mixed",
    "file": "Biomedical_Waste_Management-Previous_Year_Questions.json",
    "questions": 4
  },
  {
    "title": "Biostatistics",
    "category": "Subject Wise / Mixed",
    "file": "Biostatistics.json",
    "questions": 102
  },
  {
    "title": "Biostatistics",
    "category": "Subject Wise / Mixed",
    "file": "Biostatistics_1.json",
    "questions": 34
  },
  {
    "title": "Biostatistics",
    "category": "Subject Wise / Mixed",
    "file": "Biostatistics_2.json",
    "questions": 159
  },
  {
    "title": "Biostatistics-Biostatistics_and_Measures_of_Central_Tendency",
    "category": "Subject Wise / Mixed",
    "file": "Biostatistics-Biostatistics_and_Measures_of_Central_Tendency.json",
    "questions": 10
  },
  {
    "title": "Biostatistics-Previous_Year_Questions",
    "category": "Subject Wise / Mixed",
    "file": "Biostatistics-Previous_Year_Questions.json",
    "questions": 61
  },
  {
    "title": "Bipolar Affective Disorder",
    "category": "Subject Wise / Mixed",
    "file": "Bipolar_Affective_Disorder.json",
    "questions": 11
  },
  {
    "title": "Bladder",
    "category": "Subject Wise / Mixed",
    "file": "Bladder.json",
    "questions": 37
  },
  {
    "title": "Bleeding & Platelet Disorders",
    "category": "Subject Wise / Mixed",
    "file": "Bleeding__Platelet_Disorders.json",
    "questions": 25
  },
  {
    "title": "Blistering (Vesiculobullous) Diseases",
    "category": "Subject Wise / Mixed",
    "file": "Blistering_Vesiculobullous_Diseases.json",
    "questions": 47
  },
  {
    "title": "Blistering Disorders",
    "category": "Subject Wise / Mixed",
    "file": "Blistering_Disorders.json",
    "questions": 22
  },
  {
    "title": "Blistering_Diseases",
    "category": "Subject Wise / Mixed",
    "file": "Blistering_Diseases.json",
    "questions": 45
  },
  {
    "title": "Blistering_Disorders-Previous_Year_Questions",
    "category": "Subject Wise / Mixed",
    "file": "Blistering_Disorders-Previous_Year_Questions.json",
    "questions": 2
  },
  {
    "title": "Blood & Seminal Stains",
    "category": "Subject Wise / Mixed",
    "file": "Blood__Seminal_Stains.json",
    "questions": 10
  },
  {
    "title": "Blood Supply of Brain",
    "category": "Subject Wise / Mixed",
    "file": "Blood_Supply_of_Brain.json",
    "questions": 8
  },
  {
    "title": "Blood Supply of Face",
    "category": "Subject Wise / Mixed",
    "file": "Blood_Supply_of_Face.json",
    "questions": 6
  },
  {
    "title": "Blood Vessels - Axillary Artery & Anastomosis Around Scapula",
    "category": "Subject Wise / Mixed",
    "file": "Blood_Vessels_-_Axillary_Artery__Anastomosis_Around_Scapula.json",
    "questions": 22
  },
  {
    "title": "Blood Vessels - Brachial Artery - Anastomosis Around Elbow",
    "category": "Subject Wise / Mixed",
    "file": "Blood_Vessels_-_Brachial_Artery_-_Anastomosis_Around_Elbow.json",
    "questions": 4
  },
  {
    "title": "Blood Vessels of Head, Neck & Face",
    "category": "Subject Wise / Mixed",
    "file": "Blood_Vessels_of_Head_Neck__Face.json",
    "questions": 9
  },
  {
    "title": "Blood_Banking_and_Transfusion_Medicine-Blood_Banking_and_Transfusion_Pathology",
    "category": "Subject Wise / Mixed",
    "file": "Blood_Banking_and_Transfusion_Medicine-Blood_Banking_and_Transfusion_Pathology.json",
    "questions": 11
  },
  {
    "title": "Blood_Banking_and_Transfusion_Medicine-Previous_Year_Questions",
    "category": "Subject Wise / Mixed",
    "file": "Blood_Banking_and_Transfusion_Medicine-Previous_Year_Questions.json",
    "questions": 6
  },
  {
    "title": "Blood_Disorders",
    "category": "Subject Wise / Mixed",
    "file": "Blood_Disorders.json",
    "questions": 15
  },
  {
    "title": "Blood_Physiology-Blood_Physiology",
    "category": "Subject Wise / Mixed",
    "file": "Blood_Physiology-Blood_Physiology.json",
    "questions": 12
  },
  {
    "title": "Blood_Physiology-Previous_Year_Questions",
    "category": "Subject Wise / Mixed",
    "file": "Blood_Physiology-Previous_Year_Questions.json",
    "questions": 9
  },
  {
    "title": "Blood_Supply_Upper_limb",
    "category": "Subject Wise / Mixed",
    "file": "Blood_Supply_Upper_limb.json",
    "questions": 14
  },
  {
    "title": "Blowout Fracture",
    "category": "Subject Wise / Mixed",
    "file": "Blowout_Fracture.json",
    "questions": 3
  },
  {
    "title": "Blunt Trauma",
    "category": "Subject Wise / Mixed",
    "file": "Blunt_Trauma.json",
    "questions": 6
  },
  {
    "title": "Body Fluids",
    "category": "Subject Wise / Mixed",
    "file": "Body_Fluids.json",
    "questions": 15
  },
  {
    "title": "Bone & Imaging",
    "category": "Subject Wise / Mixed",
    "file": "Bone__Imaging.json",
    "questions": 8
  },
  {
    "title": "Bone & Joint Infections",
    "category": "Subject Wise / Mixed",
    "file": "Bone__Joint_Infections.json",
    "questions": 19
  },
  {
    "title": "Bone_Disorders-Bone_and_soft_tissue_pathology",
    "category": "Subject Wise / Mixed",
    "file": "Bone_Disorders-Bone_and_soft_tissue_pathology.json",
    "questions": 20
  },
  {
    "title": "Bone_Disorders-Previous_Year_Questions",
    "category": "Subject Wise / Mixed",
    "file": "Bone_Disorders-Previous_Year_Questions.json",
    "questions": 5
  },
  {
    "title": "Bone_Infections-Bone_and_Joint_Infections",
    "category": "Subject Wise / Mixed",
    "file": "Bone_Infections-Bone_and_Joint_Infections.json",
    "questions": 27
  },
  {
    "title": "Bone_Infections-Previous_Year_Questions",
    "category": "Subject Wise / Mixed",
    "file": "Bone_Infections-Previous_Year_Questions.json",
    "questions": 8
  },
  {
    "title": "Bone_Tumor",
    "category": "Subject Wise / Mixed",
    "file": "Bone_Tumor.json",
    "questions": 8
  },
  {
    "title": "Bone_Tumors-Bone_Tumours",
    "category": "Subject Wise / Mixed",
    "file": "Bone_Tumors-Bone_Tumours.json",
    "questions": 25
  },
  {
    "title": "Bone_Tumors-Previous_Year_Questions",
    "category": "Subject Wise / Mixed",
    "file": "Bone_Tumors-Previous_Year_Questions.json",
    "questions": 27
  },
  {
    "title": "Bone_Tumour",
    "category": "Subject Wise / Mixed",
    "file": "Bone_Tumour.json",
    "questions": 40
  },
  {
    "title": "Bone_and_Imaging-Bone_and_Imaging-I",
    "category": "Subject Wise / Mixed",
    "file": "Bone_and_Imaging-Bone_and_Imaging-I.json",
    "questions": 16
  },
  {
    "title": "Bone_and_Imaging-Bone_and_Imaging-II",
    "category": "Subject Wise / Mixed",
    "file": "Bone_and_Imaging-Bone_and_Imaging-II.json",
    "questions": 17
  },
  {
    "title": "Bone_and_Imaging-Previous_Year_Questions",
    "category": "Subject Wise / Mixed",
    "file": "Bone_and_Imaging-Previous_Year_Questions.json",
    "questions": 8
  },
  {
    "title": "Brachial Plexus",
    "category": "Subject Wise / Mixed",
    "file": "Brachial_Plexus.json",
    "questions": 16
  },
  {
    "title": "Brachial_Plexus",
    "category": "Subject Wise / Mixed",
    "file": "Brachial_Plexus_1.json",
    "questions": 15
  },
  {
    "title": "Brain",
    "category": "Subject Wise / Mixed",
    "file": "Brain.json",
    "questions": 65
  },
  {
    "title": "Brain Tumors",
    "category": "Subject Wise / Mixed",
    "file": "Brain_Tumors.json",
    "questions": 11
  },
  {
    "title": "Brain_Death-Brain_death",
    "category": "Subject Wise / Mixed",
    "file": "Brain_Death-Brain_death.json",
    "questions": 7
  },
  {
    "title": "Brainstem (Ventral & Dorsal View) & IV Ventricles",
    "category": "Subject Wise / Mixed",
    "file": "Brainstem_Ventral__Dorsal_View__IV_Ventricles.json",
    "questions": 17
  },
  {
    "title": "Brainstem Disorders (Part 1)",
    "category": "Subject Wise / Mixed",
    "file": "Brainstem_Disorders_Part_1.json",
    "questions": 11
  },
  {
    "title": "Brainstem Disorders (Part 2)",
    "category": "Subject Wise / Mixed",
    "file": "Brainstem_Disorders_Part_2.json",
    "questions": 7
  },
  {
    "title": "Brainstem Syndrome",
    "category": "Subject Wise / Mixed",
    "file": "Brainstem_Syndrome.json",
    "questions": 15
  },
  {
    "title": "Breast",
    "category": "Subject Wise / Mixed",
    "file": "Breast.json",
    "questions": 104
  },
  {
    "title": "Breast",
    "category": "Subject Wise / Mixed",
    "file": "Breast_1.json",
    "questions": 10
  },
  {
    "title": "Breast Feeding",
    "category": "Subject Wise / Mixed",
    "file": "Breast_Feeding.json",
    "questions": 31
  },
  {
    "title": "Breast and Endocrine",
    "category": "Subject Wise / Mixed",
    "file": "Breast_and_Endocrine.json",
    "questions": 101
  },
  {
    "title": "Breast_Bone_Skin_Soft_tissue",
    "category": "Subject Wise / Mixed",
    "file": "Breast_Bone_Skin_Soft_tissue.json",
    "questions": 15
  },
  {
    "title": "Breast_Imaging",
    "category": "Subject Wise / Mixed",
    "file": "Breast_Imaging.json",
    "questions": 4
  },
  {
    "title": "Breast_Pathology-Benign_Breast_Lesions",
    "category": "Subject Wise / Mixed",
    "file": "Breast_Pathology-Benign_Breast_Lesions.json",
    "questions": 14
  },
  {
    "title": "Breast_Pathology-Malignant_Breast_Lesions",
    "category": "Subject Wise / Mixed",
    "file": "Breast_Pathology-Malignant_Breast_Lesions.json",
    "questions": 12
  },
  {
    "title": "Breast_Pathology-Previous_Year_Questions",
    "category": "Subject Wise / Mixed",
    "file": "Breast_Pathology-Previous_Year_Questions.json",
    "questions": 6
  },
  {
    "title": "Breech Presentation",
    "category": "Subject Wise / Mixed",
    "file": "Breech_Presentation.json",
    "questions": 7
  },
  {
    "title": "Bronchiectasis",
    "category": "Subject Wise / Mixed",
    "file": "Bronchiectasis.json",
    "questions": 3
  },
  {
    "title": "Bronchiectasis",
    "category": "Subject Wise / Mixed",
    "file": "Bronchiectasis_1.json",
    "questions": 3
  },
  {
    "title": "Burns",
    "category": "Subject Wise / Mixed",
    "file": "Burns.json",
    "questions": 12
  },
  {
    "title": "Burns",
    "category": "Subject Wise / Mixed",
    "file": "Burns_1.json",
    "questions": 30
  },
  {
    "title": "Burns",
    "category": "Subject Wise / Mixed",
    "file": "Burns_2.json",
    "questions": 12
  },
  {
    "title": "Burns_and_Plastic_Surgery",
    "category": "Subject Wise / Mixed",
    "file": "Burns_and_Plastic_Surgery.json",
    "questions": 9
  },
  {
    "title": "CLPN  Basics",
    "category": "Subject Wise / Mixed",
    "file": "CLPN__Basics.json",
    "questions": 7
  },
  {
    "title": "CMV Retinitis",
    "category": "Subject Wise / Mixed",
    "file": "CMV_Retinitis.json",
    "questions": 4
  },
  {
    "title": "CNS",
    "category": "Subject Wise / Mixed",
    "file": "CNS.json",
    "questions": 33
  },
  {
    "title": "CNS Tumors",
    "category": "Subject Wise / Mixed",
    "file": "CNS_Tumors.json",
    "questions": 8
  },
  {
    "title": "CNS-Brainstem_Syndrome",
    "category": "Subject Wise / Mixed",
    "file": "CNS-Brainstem_Syndrome.json",
    "questions": 5
  },
  {
    "title": "CNS-CVA",
    "category": "Subject Wise / Mixed",
    "file": "CNS-CVA.json",
    "questions": 20
  },
  {
    "title": "CNS-Dementia",
    "category": "Subject Wise / Mixed",
    "file": "CNS-Dementia.json",
    "questions": 7
  },
  {
    "title": "CNS-Epilepsy",
    "category": "Subject Wise / Mixed",
    "file": "CNS-Epilepsy.json",
    "questions": 12
  },
  {
    "title": "CNS-GBS",
    "category": "Subject Wise / Mixed",
    "file": "CNS-GBS.json",
    "questions": 5
  },
  {
    "title": "CNS-Headache",
    "category": "Subject Wise / Mixed",
    "file": "CNS-Headache.json",
    "questions": 10
  },
  {
    "title": "CNS-MND",
    "category": "Subject Wise / Mixed",
    "file": "CNS-MND.json",
    "questions": 5
  },
  {
    "title": "CNS-Multiple_Sclerosis",
    "category": "Subject Wise / Mixed",
    "file": "CNS-Multiple_Sclerosis.json",
    "questions": 6
  },
  {
    "title": "CNS-Myasthenia_Gravis",
    "category": "Subject Wise / Mixed",
    "file": "CNS-Myasthenia_Gravis.json",
    "questions": 9
  },
  {
    "title": "CNS-Myelopathy",
    "category": "Subject Wise / Mixed",
    "file": "CNS-Myelopathy.json",
    "questions": 28
  },
  {
    "title": "CNS-Parkinsonism",
    "category": "Subject Wise / Mixed",
    "file": "CNS-Parkinsonism.json",
    "questions": 21
  },
  {
    "title": "CNS_Infections",
    "category": "Subject Wise / Mixed",
    "file": "CNS_Infections.json",
    "questions": 14
  },
  {
    "title": "CNS_Pharmacology-Anti_Epileptic_Drugs",
    "category": "Subject Wise / Mixed",
    "file": "CNS_Pharmacology-Anti_Epileptic_Drugs.json",
    "questions": 15
  },
  {
    "title": "CNS_Pharmacology-Antipsychotics_and_Antidepressants",
    "category": "Subject Wise / Mixed",
    "file": "CNS_Pharmacology-Antipsychotics_and_Antidepressants.json",
    "questions": 16
  },
  {
    "title": "CNS_Pharmacology-Opioids",
    "category": "Subject Wise / Mixed",
    "file": "CNS_Pharmacology-Opioids.json",
    "questions": 12
  },
  {
    "title": "CNS_Pharmacology-Parkinson_s_Disease_and_Other_Disorders",
    "category": "Subject Wise / Mixed",
    "file": "CNS_Pharmacology-Parkinson_s_Disease_and_Other_Disorders.json",
    "questions": 10
  },
  {
    "title": "CNS_Pharmacology-Previous_Year_Questions",
    "category": "Subject Wise / Mixed",
    "file": "CNS_Pharmacology-Previous_Year_Questions.json",
    "questions": 75
  },
  {
    "title": "CNS_Pharmacology-Sedatives_Hypnotics__Drugs_for_Insomnia__and_Alcohol",
    "category": "Subject Wise / Mixed",
    "file": "CNS_Pharmacology-Sedatives_Hypnotics__Drugs_for_Insomnia__and_Alcohol.json",
    "questions": 15
  },
  {
    "title": "CNS_Physiology",
    "category": "Subject Wise / Mixed",
    "file": "CNS_Physiology.json",
    "questions": 24
  },
  {
    "title": "CNS_Physiology-Ascending_and_Descending_Tracts_of_Spinal_Cords",
    "category": "Subject Wise / Mixed",
    "file": "CNS_Physiology-Ascending_and_Descending_Tracts_of_Spinal_Cords.json",
    "questions": 16
  },
  {
    "title": "CNS_Physiology-EEG___Sleep__Learning_and_Memory",
    "category": "Subject Wise / Mixed",
    "file": "CNS_Physiology-EEG___Sleep__Learning_and_Memory.json",
    "questions": 11
  },
  {
    "title": "CNS_Physiology-Previous_Year_Questions",
    "category": "Subject Wise / Mixed",
    "file": "CNS_Physiology-Previous_Year_Questions.json",
    "questions": 6
  },
  {
    "title": "CNS_Physiology-Somatosensory_Receptors__Nociceptors__Proprioceptors__and_Reflexes",
    "category": "Subject Wise / Mixed",
    "file": "CNS_Physiology-Somatosensory_Receptors__Nociceptors__Proprioceptors__and_Reflexes.json",
    "questions": 28
  },
  {
    "title": "CNS_Physiology-Special_Senses",
    "category": "Subject Wise / Mixed",
    "file": "CNS_Physiology-Special_Senses.json",
    "questions": 17
  },
  {
    "title": "CNS_Physiology-Synapse_and_Synaptic_Inhibition",
    "category": "Subject Wise / Mixed",
    "file": "CNS_Physiology-Synapse_and_Synaptic_Inhibition.json",
    "questions": 21
  },
  {
    "title": "COPD (Part 1)",
    "category": "Subject Wise / Mixed",
    "file": "COPD_Part_1.json",
    "questions": 23
  },
  {
    "title": "COPD (Part 2)",
    "category": "Subject Wise / Mixed",
    "file": "COPD_Part_2.json",
    "questions": 13
  },
  {
    "title": "COVID-19",
    "category": "Subject Wise / Mixed",
    "file": "COVID-19.json",
    "questions": 97
  },
  {
    "title": "COVID-19-Previous_Year_Questions",
    "category": "Subject Wise / Mixed",
    "file": "COVID-19-Previous_Year_Questions.json",
    "questions": 2
  },
  {
    "title": "CPR",
    "category": "Subject Wise / Mixed",
    "file": "CPR.json",
    "questions": 19
  },
  {
    "title": "CRAO & CRVO",
    "category": "Subject Wise / Mixed",
    "file": "CRAO__CRVO.json",
    "questions": 9
  },
  {
    "title": "CSR & CME",
    "category": "Subject Wise / Mixed",
    "file": "CSR__CME.json",
    "questions": 6
  },
  {
    "title": "CT",
    "category": "Subject Wise / Mixed",
    "file": "CT.json",
    "questions": 13
  },
  {
    "title": "CT_Medicine_CNS_FMGE_CT",
    "category": "Subject Wise / Mixed",
    "file": "CT_Medicine_CNS_FMGE_CT.json",
    "questions": 40
  },
  {
    "title": "CT_Scan-Previous_Year_Questions",
    "category": "Subject Wise / Mixed",
    "file": "CT_Scan-Previous_Year_Questions.json",
    "questions": 2
  },
  {
    "title": "CT_Scan_Basics__Application",
    "category": "Subject Wise / Mixed",
    "file": "CT_Scan_Basics__Application.json",
    "questions": 51
  },
  {
    "title": "CT_Surgery__Gen__uro_FMGE_CT",
    "category": "Subject Wise / Mixed",
    "file": "CT_Surgery__Gen__uro_FMGE_CT.json",
    "questions": 50
  },
  {
    "title": "CVS",
    "category": "Subject Wise / Mixed",
    "file": "CVS.json",
    "questions": 101
  },
  {
    "title": "CVS Development - Arterial System",
    "category": "Subject Wise / Mixed",
    "file": "CVS_Development_-_Arterial_System.json",
    "questions": 6
  },
  {
    "title": "CVS Development - Heart Tube & Derivates",
    "category": "Subject Wise / Mixed",
    "file": "CVS_Development_-_Heart_Tube__Derivates.json",
    "questions": 12
  },
  {
    "title": "CVS Development - Interatrial & Interventricular Septum",
    "category": "Subject Wise / Mixed",
    "file": "CVS_Development_-_Interatrial__Interventricular_Septum.json",
    "questions": 10
  },
  {
    "title": "CVS Development - Venous System",
    "category": "Subject Wise / Mixed",
    "file": "CVS_Development_-_Venous_System.json",
    "questions": 16
  },
  {
    "title": "CVS Radiology",
    "category": "Subject Wise / Mixed",
    "file": "CVS_Radiology.json",
    "questions": 19
  },
  {
    "title": "CVS-Clinical_Vignette",
    "category": "Subject Wise / Mixed",
    "file": "CVS-Clinical_Vignette.json",
    "questions": 175
  },
  {
    "title": "CVS_-_ACS_and_CAD",
    "category": "Subject Wise / Mixed",
    "file": "CVS_-_ACS_and_CAD.json",
    "questions": 22
  },
  {
    "title": "CVS_-_Acute_Rheumatic_Fever_and_Infective_Endocarditis",
    "category": "Subject Wise / Mixed",
    "file": "CVS_-_Acute_Rheumatic_Fever_and_Infective_Endocarditis.json",
    "questions": 9
  },
  {
    "title": "CVS_-_Cardiomyopathies",
    "category": "Subject Wise / Mixed",
    "file": "CVS_-_Cardiomyopathies.json",
    "questions": 10
  },
  {
    "title": "CVS_-_Diseases_of_the_Pericardium",
    "category": "Subject Wise / Mixed",
    "file": "CVS_-_Diseases_of_the_Pericardium.json",
    "questions": 6
  },
  {
    "title": "CVS_-_ECG",
    "category": "Subject Wise / Mixed",
    "file": "CVS_-_ECG.json",
    "questions": 24
  },
  {
    "title": "CVS_-_Heart_Failure",
    "category": "Subject Wise / Mixed",
    "file": "CVS_-_Heart_Failure.json",
    "questions": 5
  },
  {
    "title": "CVS_-_Hypertension",
    "category": "Subject Wise / Mixed",
    "file": "CVS_-_Hypertension.json",
    "questions": 8
  },
  {
    "title": "CVS_-_Physical_Examination__Cardiovascular_physiology",
    "category": "Subject Wise / Mixed",
    "file": "CVS_-_Physical_Examination__Cardiovascular_physiology.json",
    "questions": 32
  },
  {
    "title": "CVS_-_Valvular_Heart_Disease",
    "category": "Subject Wise / Mixed",
    "file": "CVS_-_Valvular_Heart_Disease.json",
    "questions": 16
  },
  {
    "title": "CVS_Pharmacology-Anti_Anginal_drugs",
    "category": "Subject Wise / Mixed",
    "file": "CVS_Pharmacology-Anti_Anginal_drugs.json",
    "questions": 11
  },
  {
    "title": "CVS_Pharmacology-Antihypertensives",
    "category": "Subject Wise / Mixed",
    "file": "CVS_Pharmacology-Antihypertensives.json",
    "questions": 20
  },
  {
    "title": "CVS_Pharmacology-Myocardial_Infarction___Drugs_for_Heart_Failure",
    "category": "Subject Wise / Mixed",
    "file": "CVS_Pharmacology-Myocardial_Infarction___Drugs_for_Heart_Failure.json",
    "questions": 18
  },
  {
    "title": "CVS_Pharmacology-Previous_Year_Questions",
    "category": "Subject Wise / Mixed",
    "file": "CVS_Pharmacology-Previous_Year_Questions.json",
    "questions": 63
  },
  {
    "title": "CVS__Blood_Vessels_and_Vasculitis-Carditis_and_Cardiac_tumors",
    "category": "Subject Wise / Mixed",
    "file": "CVS__Blood_Vessels_and_Vasculitis-Carditis_and_Cardiac_tumors.json",
    "questions": 16
  },
  {
    "title": "CVS__Blood_Vessels_and_Vasculitis-Ischemic_Heart_Disease_and_Myocardial_Infarction",
    "category": "Subject Wise / Mixed",
    "file": "CVS__Blood_Vessels_and_Vasculitis-Ischemic_Heart_Disease_and_Myocardial_Infarction.json",
    "questions": 11
  },
  {
    "title": "CVS__Blood_Vessels_and_Vasculitis-Previous_Year_Questions",
    "category": "Subject Wise / Mixed",
    "file": "CVS__Blood_Vessels_and_Vasculitis-Previous_Year_Questions.json",
    "questions": 29
  },
  {
    "title": "CVS__Blood_Vessels_and_Vasculitis-RHD_and_Infective_Endocarditis",
    "category": "Subject Wise / Mixed",
    "file": "CVS__Blood_Vessels_and_Vasculitis-RHD_and_Infective_Endocarditis.json",
    "questions": 10
  },
  {
    "title": "CVS__Blood_Vessels_and_Vasculitis-Sclerosis_and_Vascular_Tumors",
    "category": "Subject Wise / Mixed",
    "file": "CVS__Blood_Vessels_and_Vasculitis-Sclerosis_and_Vascular_Tumors.json",
    "questions": 11
  },
  {
    "title": "CVS__Blood_Vessels_and_Vasculitis-Vasculitis",
    "category": "Subject Wise / Mixed",
    "file": "CVS__Blood_Vessels_and_Vasculitis-Vasculitis.json",
    "questions": 13
  },
  {
    "title": "CVS_and_Vasculitis",
    "category": "Subject Wise / Mixed",
    "file": "CVS_and_Vasculitis.json",
    "questions": 28
  },
  {
    "title": "CXR",
    "category": "Subject Wise / Mixed",
    "file": "CXR.json",
    "questions": 59
  },
  {
    "title": "Calcium Disorders - Hypercalcemia (Part 1)",
    "category": "Subject Wise / Mixed",
    "file": "Calcium_Disorders_-_Hypercalcemia_Part_1.json",
    "questions": 16
  },
  {
    "title": "Calcium Disorders - Hypercalcemia (Part 2)",
    "category": "Subject Wise / Mixed",
    "file": "Calcium_Disorders_-_Hypercalcemia_Part_2.json",
    "questions": 6
  },
  {
    "title": "Calcium Disorders - Hypocalcemia (Part 3)",
    "category": "Subject Wise / Mixed",
    "file": "Calcium_Disorders_-_Hypocalcemia_Part_3.json",
    "questions": 5
  },
  {
    "title": "Calcium Disorders - Hypocalcemia (Part 4)",
    "category": "Subject Wise / Mixed",
    "file": "Calcium_Disorders_-_Hypocalcemia_Part_4.json",
    "questions": 8
  },
  {
    "title": "Calcium Metabolism",
    "category": "Subject Wise / Mixed",
    "file": "Calcium_Metabolism.json",
    "questions": 7
  },
  {
    "title": "Cancers",
    "category": "Subject Wise / Mixed",
    "file": "Cancers.json",
    "questions": 15
  },
  {
    "title": "Carbohydrate Chemistry",
    "category": "Subject Wise / Mixed",
    "file": "Carbohydrate_Chemistry_1.json",
    "questions": 23
  },
  {
    "title": "Carbohydrate Metabolism",
    "category": "Subject Wise / Mixed",
    "file": "Carbohydrate_Metabolism_1.json",
    "questions": 149
  },
  {
    "title": "Carbohydrate_Chemistry",
    "category": "Subject Wise / Mixed",
    "file": "Carbohydrate_Chemistry.json",
    "questions": 134
  },
  {
    "title": "Carbohydrate_Chemistry-Carbohydrates",
    "category": "Subject Wise / Mixed",
    "file": "Carbohydrate_Chemistry-Carbohydrates.json",
    "questions": 24
  },
  {
    "title": "Carbohydrate_Chemistry-Citric_Acid_cycle_and_Gluconeogenesis",
    "category": "Subject Wise / Mixed",
    "file": "Carbohydrate_Chemistry-Citric_Acid_cycle_and_Gluconeogenesis.json",
    "questions": 18
  },
  {
    "title": "Carbohydrate_Chemistry-Fates_of_pyruvate__PDH_complex__Electron_Transport_Chain",
    "category": "Subject Wise / Mixed",
    "file": "Carbohydrate_Chemistry-Fates_of_pyruvate__PDH_complex__Electron_Transport_Chain.json",
    "questions": 13
  },
  {
    "title": "Carbohydrate_Chemistry-Fructose_and_galactose_metabolism___HMP_pathway",
    "category": "Subject Wise / Mixed",
    "file": "Carbohydrate_Chemistry-Fructose_and_galactose_metabolism___HMP_pathway.json",
    "questions": 13
  },
  {
    "title": "Carbohydrate_Chemistry-GLUT_transporters_and_Glycolysis",
    "category": "Subject Wise / Mixed",
    "file": "Carbohydrate_Chemistry-GLUT_transporters_and_Glycolysis.json",
    "questions": 12
  },
  {
    "title": "Carbohydrate_Chemistry-Glycogen_Metabolism_and_Glycogen_Storage_Disorders",
    "category": "Subject Wise / Mixed",
    "file": "Carbohydrate_Chemistry-Glycogen_Metabolism_and_Glycogen_Storage_Disorders.json",
    "questions": 17
  },
  {
    "title": "Carbohydrate_Chemistry-Previous_Year_Questions",
    "category": "Subject Wise / Mixed",
    "file": "Carbohydrate_Chemistry-Previous_Year_Questions.json",
    "questions": 29
  },
  {
    "title": "Carbohydrate_Metabolism",
    "category": "Subject Wise / Mixed",
    "file": "Carbohydrate_Metabolism.json",
    "questions": 21
  },
  {
    "title": "Carbohydrate_Metabolism-Previous_Year_Questions",
    "category": "Subject Wise / Mixed",
    "file": "Carbohydrate_Metabolism-Previous_Year_Questions.json",
    "questions": 41
  },
  {
    "title": "Carbohydrates Basics & Cell Organelles",
    "category": "Subject Wise / Mixed",
    "file": "Carbohydrates_Basics__Cell_Organelles.json",
    "questions": 15
  },
  {
    "title": "Carcinoma Lung & Mediastinal Conditions (Part 3)",
    "category": "Subject Wise / Mixed",
    "file": "Carcinoma_Lung__Mediastinal_Conditions_Part_3.json",
    "questions": 14
  },
  {
    "title": "Cardiac Muscle",
    "category": "Subject Wise / Mixed",
    "file": "Cardiac_Muscle.json",
    "questions": 11
  },
  {
    "title": "Cardiac Output (Integrated) (Part 1)",
    "category": "Subject Wise / Mixed",
    "file": "Cardiac_Output_Integrated_Part_1.json",
    "questions": 17
  },
  {
    "title": "Cardiac Output (Integrated) (Part 2)",
    "category": "Subject Wise / Mixed",
    "file": "Cardiac_Output_Integrated_Part_2.json",
    "questions": 21
  },
  {
    "title": "Cardiac Plexus, Thoracic Duct, Esophagus & Posterior Mediastinum",
    "category": "Subject Wise / Mixed",
    "file": "Cardiac_Plexus_Thoracic_Duct_Esophagus__Posterior_Mediastinum.json",
    "questions": 15
  },
  {
    "title": "Cardiac Poisons & Aconite",
    "category": "Subject Wise / Mixed",
    "file": "Cardiac_Poisons__Aconite.json",
    "questions": 3
  },
  {
    "title": "Cardiac_Vascular",
    "category": "Subject Wise / Mixed",
    "file": "Cardiac_Vascular.json",
    "questions": 28
  },
  {
    "title": "Cardinal Movements of Labour",
    "category": "Subject Wise / Mixed",
    "file": "Cardinal_Movements_of_Labour.json",
    "questions": 2
  },
  {
    "title": "Cardio - Pulmonary Resuscitation (CPR)",
    "category": "Subject Wise / Mixed",
    "file": "Cardio_-_Pulmonary_Resuscitation_CPR.json",
    "questions": 30
  },
  {
    "title": "Cardiology",
    "category": "Subject Wise / Mixed",
    "file": "Cardiology.json",
    "questions": 179
  },
  {
    "title": "Cardiology-CHF__BBB__Tachycardia__Bradycardia__and_Heart_Block",
    "category": "Subject Wise / Mixed",
    "file": "Cardiology-CHF__BBB__Tachycardia__Bradycardia__and_Heart_Block.json",
    "questions": 18
  },
  {
    "title": "Cardiology-Diseases_of_the_Pericardium_and_Cardiomyopathies",
    "category": "Subject Wise / Mixed",
    "file": "Cardiology-Diseases_of_the_Pericardium_and_Cardiomyopathies.json",
    "questions": 23
  },
  {
    "title": "Cardiology-Heart_Sounds_and_Murmurs",
    "category": "Subject Wise / Mixed",
    "file": "Cardiology-Heart_Sounds_and_Murmurs.json",
    "questions": 25
  },
  {
    "title": "Cardiology-Hypertension",
    "category": "Subject Wise / Mixed",
    "file": "Cardiology-Hypertension.json",
    "questions": 10
  },
  {
    "title": "Cardiology-Ischemic_Heart_Disease",
    "category": "Subject Wise / Mixed",
    "file": "Cardiology-Ischemic_Heart_Disease.json",
    "questions": 28
  },
  {
    "title": "Cardiology-Takotsubo__Brugada_syndrome__RHD__and_Infective_Endocarditis",
    "category": "Subject Wise / Mixed",
    "file": "Cardiology-Takotsubo__Brugada_syndrome__RHD__and_Infective_Endocarditis.json",
    "questions": 31
  },
  {
    "title": "Cardiology-Valvular_Heart_Disease",
    "category": "Subject Wise / Mixed",
    "file": "Cardiology-Valvular_Heart_Disease.json",
    "questions": 24
  },
  {
    "title": "Cardiology_Part-_1",
    "category": "Subject Wise / Mixed",
    "file": "Cardiology_Part-_1.json",
    "questions": 36
  },
  {
    "title": "Cardiology_Part-_2",
    "category": "Subject Wise / Mixed",
    "file": "Cardiology_Part-_2.json",
    "questions": 38
  },
  {
    "title": "Cardiology_Part-_3",
    "category": "Subject Wise / Mixed",
    "file": "Cardiology_Part-_3.json",
    "questions": 12
  },
  {
    "title": "Cardiomyopathies (Part 1)",
    "category": "Subject Wise / Mixed",
    "file": "Cardiomyopathies_Part_1.json",
    "questions": 13
  },
  {
    "title": "Cardiopulmonary Resuscitation",
    "category": "Subject Wise / Mixed",
    "file": "Cardiopulmonary_Resuscitation.json",
    "questions": 21
  },
  {
    "title": "Cardiothoracic_Vascular_Surgery-Arterial_Disorders",
    "category": "Subject Wise / Mixed",
    "file": "Cardiothoracic_Vascular_Surgery-Arterial_Disorders.json",
    "questions": 25
  },
  {
    "title": "Cardiothoracic_Vascular_Surgery-Lymphatic_System",
    "category": "Subject Wise / Mixed",
    "file": "Cardiothoracic_Vascular_Surgery-Lymphatic_System.json",
    "questions": 10
  },
  {
    "title": "Cardiothoracic_Vascular_Surgery-Previous_Year_Questions",
    "category": "Subject Wise / Mixed",
    "file": "Cardiothoracic_Vascular_Surgery-Previous_Year_Questions.json",
    "questions": 65
  },
  {
    "title": "Cardiothoracic_Vascular_Surgery-Thorax_and_Mediastinum",
    "category": "Subject Wise / Mixed",
    "file": "Cardiothoracic_Vascular_Surgery-Thorax_and_Mediastinum.json",
    "questions": 35
  },
  {
    "title": "Cardiothoracic_Vascular_Surgery-Venous_Disorders",
    "category": "Subject Wise / Mixed",
    "file": "Cardiothoracic_Vascular_Surgery-Venous_Disorders.json",
    "questions": 26
  },
  {
    "title": "Cardiovascular Regulation & Reflexes",
    "category": "Subject Wise / Mixed",
    "file": "Cardiovascular_Regulation__Reflexes.json",
    "questions": 14
  },
  {
    "title": "Cardiovascular System",
    "category": "Subject Wise / Mixed",
    "file": "Cardiovascular_System.json",
    "questions": 65
  },
  {
    "title": "Cardiovascular System",
    "category": "Subject Wise / Mixed",
    "file": "Cardiovascular_System_1.json",
    "questions": 65
  },
  {
    "title": "Cardiovascular System",
    "category": "Subject Wise / Mixed",
    "file": "Cardiovascular_System_3.json",
    "questions": 65
  },
  {
    "title": "Cardiovascular_Emergencies-Previous_Year_Questions",
    "category": "Subject Wise / Mixed",
    "file": "Cardiovascular_Emergencies-Previous_Year_Questions.json",
    "questions": 2
  },
  {
    "title": "Cardiovascular_Physiology-Previous_Year_Questions",
    "category": "Subject Wise / Mixed",
    "file": "Cardiovascular_Physiology-Previous_Year_Questions.json",
    "questions": 6
  },
  {
    "title": "Cardiovascular_Radiology-CVS_Radiology",
    "category": "Subject Wise / Mixed",
    "file": "Cardiovascular_Radiology-CVS_Radiology.json",
    "questions": 16
  },
  {
    "title": "Cardiovascular_Radiology-Previous_Year_Questions",
    "category": "Subject Wise / Mixed",
    "file": "Cardiovascular_Radiology-Previous_Year_Questions.json",
    "questions": 3
  },
  {
    "title": "Cardiovascular_System",
    "category": "Subject Wise / Mixed",
    "file": "Cardiovascular_System_2.json",
    "questions": 106
  },
  {
    "title": "Cardiovascular_System",
    "category": "Subject Wise / Mixed",
    "file": "Cardiovascular_System_4.json",
    "questions": 106
  },
  {
    "title": "Cardiovascular_System",
    "category": "Subject Wise / Mixed",
    "file": "Cardiovascular_System_5.json",
    "questions": 4
  },
  {
    "title": "Cardiovascular_System",
    "category": "Subject Wise / Mixed",
    "file": "Cardiovascular_System_6.json",
    "questions": 4
  },
  {
    "title": "Cardiovascular_System-Cardiac_Conducting_System_and_Action_Potentials",
    "category": "Subject Wise / Mixed",
    "file": "Cardiovascular_System-Cardiac_Conducting_System_and_Action_Potentials.json",
    "questions": 18
  },
  {
    "title": "Cardiovascular_System-Cardiac_Cycle_and_Cardiac_Output",
    "category": "Subject Wise / Mixed",
    "file": "Cardiovascular_System-Cardiac_Cycle_and_Cardiac_Output.json",
    "questions": 17
  },
  {
    "title": "Cardiovascular_System-ECG",
    "category": "Subject Wise / Mixed",
    "file": "Cardiovascular_System-ECG.json",
    "questions": 11
  },
  {
    "title": "Cardiovascular_System-Hemodynamics__BP_Regulation__and_Regional_Circulation",
    "category": "Subject Wise / Mixed",
    "file": "Cardiovascular_System-Hemodynamics__BP_Regulation__and_Regional_Circulation.json",
    "questions": 14
  },
  {
    "title": "Cardiovascular_System-Previous_Year_Questions",
    "category": "Subject Wise / Mixed",
    "file": "Cardiovascular_System-Previous_Year_Questions.json",
    "questions": 40
  },
  {
    "title": "Cardiovascular_System_",
    "category": "Subject Wise / Mixed",
    "file": "Cardiovascular_System_.json",
    "questions": 20
  },
  {
    "title": "Case_Control__Cross_Sectional__Ecological_Study",
    "category": "Subject Wise / Mixed",
    "file": "Case_Control__Cross_Sectional__Ecological_Study.json",
    "questions": 8
  },
  {
    "title": "Cataract",
    "category": "Subject Wise / Mixed",
    "file": "Cataract.json",
    "questions": 16
  },
  {
    "title": "Cavernous Sinus",
    "category": "Subject Wise / Mixed",
    "file": "Cavernous_Sinus.json",
    "questions": 4
  },
  {
    "title": "Cdh & Blounts Disease",
    "category": "Subject Wise / Mixed",
    "file": "Cdh__Blounts_Disease.json",
    "questions": 9
  },
  {
    "title": "Cell & General Physiology",
    "category": "Subject Wise / Mixed",
    "file": "Cell__General_Physiology.json",
    "questions": 17
  },
  {
    "title": "Cell Injury",
    "category": "Subject Wise / Mixed",
    "file": "Cell_Injury.json",
    "questions": 53
  },
  {
    "title": "Cell_Adaptation_Injury_And_Death",
    "category": "Subject Wise / Mixed",
    "file": "Cell_Adaptation_Injury_And_Death.json",
    "questions": 66
  },
  {
    "title": "Cell_Injury-Cell_Death",
    "category": "Subject Wise / Mixed",
    "file": "Cell_Injury-Cell_Death.json",
    "questions": 15
  },
  {
    "title": "Cell_Injury-Cell_Injury__Free_Radical_Injury__and_ER_Stress_Related",
    "category": "Subject Wise / Mixed",
    "file": "Cell_Injury-Cell_Injury__Free_Radical_Injury__and_ER_Stress_Related.json",
    "questions": 12
  },
  {
    "title": "Cell_Injury-Cell_ageing__Autophagy_and_Cellular_adaptations",
    "category": "Subject Wise / Mixed",
    "file": "Cell_Injury-Cell_ageing__Autophagy_and_Cellular_adaptations.json",
    "questions": 14
  },
  {
    "title": "Cell_Injury-Intracellular_Accumulations",
    "category": "Subject Wise / Mixed",
    "file": "Cell_Injury-Intracellular_Accumulations.json",
    "questions": 12
  },
  {
    "title": "Cell_Injury-Previous_Year_Questions",
    "category": "Subject Wise / Mixed",
    "file": "Cell_Injury-Previous_Year_Questions.json",
    "questions": 30
  },
  {
    "title": "Cell_Injury_Part_1",
    "category": "Subject Wise / Mixed",
    "file": "Cell_Injury_Part_1.json",
    "questions": 28
  },
  {
    "title": "Cell_Sub_Organelles_Test_Types_of_Blood_Collection_Tubes",
    "category": "Subject Wise / Mixed",
    "file": "Cell_Sub_Organelles_Test_Types_of_Blood_Collection_Tubes.json",
    "questions": 9
  },
  {
    "title": "Cellular Ageing",
    "category": "Subject Wise / Mixed",
    "file": "Cellular_Ageing.json",
    "questions": 7
  },
  {
    "title": "Cellular Events of Inflammation",
    "category": "Subject Wise / Mixed",
    "file": "Cellular_Events_of_Inflammation.json",
    "questions": 1
  },
  {
    "title": "Central Nervous System",
    "category": "Subject Wise / Mixed",
    "file": "Central_Nervous_System.json",
    "questions": 183
  },
  {
    "title": "Central Nervous System",
    "category": "Subject Wise / Mixed",
    "file": "Central_Nervous_System_1.json",
    "questions": 183
  },
  {
    "title": "Central Nervous System",
    "category": "Subject Wise / Mixed",
    "file": "Central_Nervous_System_2.json",
    "questions": 183
  },
  {
    "title": "Central Neuraxial Block",
    "category": "Subject Wise / Mixed",
    "file": "Central_Neuraxial_Block.json",
    "questions": 49
  },
  {
    "title": "Central_Nervous_System",
    "category": "Subject Wise / Mixed",
    "file": "Central_Nervous_System_3.json",
    "questions": 84
  },
  {
    "title": "Central_Nervous_System",
    "category": "Subject Wise / Mixed",
    "file": "Central_Nervous_System_4.json",
    "questions": 24
  },
  {
    "title": "Central_Nervous_System-CNS_Pathology",
    "category": "Subject Wise / Mixed",
    "file": "Central_Nervous_System-CNS_Pathology.json",
    "questions": 17
  },
  {
    "title": "Central_Nervous_System-Previous_Year_Questions",
    "category": "Subject Wise / Mixed",
    "file": "Central_Nervous_System-Previous_Year_Questions.json",
    "questions": 17
  },
  {
    "title": "Central_Nervous_System_Pathology",
    "category": "Subject Wise / Mixed",
    "file": "Central_Nervous_System_Pathology.json",
    "questions": 8
  },
  {
    "title": "Central_Neuraxial_Blockade-Previous_Year_Questions",
    "category": "Subject Wise / Mixed",
    "file": "Central_Neuraxial_Blockade-Previous_Year_Questions.json",
    "questions": 1
  },
  {
    "title": "Cephalosporins, Carbapenems & Monobactams",
    "category": "Subject Wise / Mixed",
    "file": "Cephalosporins_Carbapenems__Monobactams.json",
    "questions": 22
  },
  {
    "title": "Cervical Cancer",
    "category": "Subject Wise / Mixed",
    "file": "Cervical_Cancer_1.json",
    "questions": 29
  },
  {
    "title": "Cervical Incompetence",
    "category": "Subject Wise / Mixed",
    "file": "Cervical_Incompetence.json",
    "questions": 4
  },
  {
    "title": "Cervical_Cancer",
    "category": "Subject Wise / Mixed",
    "file": "Cervical_Cancer.json",
    "questions": 40
  },
  {
    "title": "Cesarean Section",
    "category": "Subject Wise / Mixed",
    "file": "Cesarean_Section.json",
    "questions": 10
  },
  {
    "title": "Champions Exam INI-CET.__.23rd Apr 2025.__.APRIL 2025.__..__.1.__.",
    "category": "Subject Wise / Mixed",
    "file": "Champions_Exam_INI-CET__23rd_Apr_2025__APRIL_2025____1__.json",
    "questions": 200
  },
  {
    "title": "Child Psychiatry",
    "category": "Subject Wise / Mixed",
    "file": "Child_Psychiatry.json",
    "questions": 22
  },
  {
    "title": "Child_Psychiatry",
    "category": "Subject Wise / Mixed",
    "file": "Child_Psychiatry_1.json",
    "questions": 25
  },
  {
    "title": "Child_Psychiatry-Child_Psychiatry",
    "category": "Subject Wise / Mixed",
    "file": "Child_Psychiatry-Child_Psychiatry.json",
    "questions": 19
  },
  {
    "title": "Child_Psychiatry-Previous_Year_Questions",
    "category": "Subject Wise / Mixed",
    "file": "Child_Psychiatry-Previous_Year_Questions.json",
    "questions": 13
  },
  {
    "title": "Child_psychiatry_",
    "category": "Subject Wise / Mixed",
    "file": "Child_psychiatry_.json",
    "questions": 6
  },
  {
    "title": "Cholera",
    "category": "Subject Wise / Mixed",
    "file": "Cholera.json",
    "questions": 12
  },
  {
    "title": "Cholesteatoma & Tuberculosis of Ear",
    "category": "Subject Wise / Mixed",
    "file": "Cholesteatoma__Tuberculosis_of_Ear.json",
    "questions": 11
  },
  {
    "title": "Cholesterol & Bile Acids",
    "category": "Subject Wise / Mixed",
    "file": "Cholesterol__Bile_Acids.json",
    "questions": 11
  },
  {
    "title": "Cholesterol_Metabolism",
    "category": "Subject Wise / Mixed",
    "file": "Cholesterol_Metabolism.json",
    "questions": 16
  },
  {
    "title": "Cholinergic Drugs Part -1",
    "category": "Subject Wise / Mixed",
    "file": "Cholinergic_Drugs_Part_-1.json",
    "questions": 11
  },
  {
    "title": "Cholinergic Drugs Part -2",
    "category": "Subject Wise / Mixed",
    "file": "Cholinergic_Drugs_Part_-2.json",
    "questions": 4
  },
  {
    "title": "Cholinergic_Drugs",
    "category": "Subject Wise / Mixed",
    "file": "Cholinergic_Drugs.json",
    "questions": 28
  },
  {
    "title": "Chronic Bronchitis",
    "category": "Subject Wise / Mixed",
    "file": "Chronic_Bronchitis.json",
    "questions": 2
  },
  {
    "title": "Chronic Inflammation",
    "category": "Subject Wise / Mixed",
    "file": "Chronic_Inflammation.json",
    "questions": 3
  },
  {
    "title": "Chronic Kidney Disease",
    "category": "Subject Wise / Mixed",
    "file": "Chronic_Kidney_Disease.json",
    "questions": 21
  },
  {
    "title": "Chronic Laryngitis",
    "category": "Subject Wise / Mixed",
    "file": "Chronic_Laryngitis.json",
    "questions": 7
  },
  {
    "title": "Chronic Lymphocytic Leukemia",
    "category": "Subject Wise / Mixed",
    "file": "Chronic_Lymphocytic_Leukemia.json",
    "questions": 5
  },
  {
    "title": "Chronic Myeloid Leukemia",
    "category": "Subject Wise / Mixed",
    "file": "Chronic_Myeloid_Leukemia.json",
    "questions": 7
  },
  {
    "title": "Chronic Myeloid Leukemia",
    "category": "Subject Wise / Mixed",
    "file": "Chronic_Myeloid_Leukemia_1.json",
    "questions": 7
  },
  {
    "title": "Chronic Myeloproliferative Neoplasms Introduction",
    "category": "Subject Wise / Mixed",
    "file": "Chronic_Myeloproliferative_Neoplasms_Introduction.json",
    "questions": 3
  },
  {
    "title": "Chronic Pancreatitis",
    "category": "Subject Wise / Mixed",
    "file": "Chronic_Pancreatitis.json",
    "questions": 3
  },
  {
    "title": "Chronic Pulmonary Disease Classification",
    "category": "Subject Wise / Mixed",
    "file": "Chronic_Pulmonary_Disease_Classification.json",
    "questions": 3
  },
  {
    "title": "Clash of the Toppers Prof-1 - 2023-10-02",
    "category": "Subject Wise / Mixed",
    "file": "Clash_of_the_Toppers_Prof-1_-_2023-10-02.json",
    "questions": 30
  },
  {
    "title": "Clash of the Toppers Prof-2 - 2023-10-02",
    "category": "Subject Wise / Mixed",
    "file": "Clash_of_the_Toppers_Prof-2_-_2023-10-02.json",
    "questions": 30
  },
  {
    "title": "Clash of the Toppers Prof-3 - 2023-10-02",
    "category": "Subject Wise / Mixed",
    "file": "Clash_of_the_Toppers_Prof-3_-_2023-10-02.json",
    "questions": 30
  },
  {
    "title": "Clash of the Toppers Prof-4 - 2023-10-02",
    "category": "Subject Wise / Mixed",
    "file": "Clash_of_the_Toppers_Prof-4_-_2023-10-02.json",
    "questions": 30
  },
  {
    "title": "Classification & Risk Factor",
    "category": "Subject Wise / Mixed",
    "file": "Classification__Risk_Factor.json",
    "questions": 13
  },
  {
    "title": "Classification In Psychiatry",
    "category": "Subject Wise / Mixed",
    "file": "Classification_In_Psychiatry.json",
    "questions": 7
  },
  {
    "title": "Classification Of Sexual Offences & Rape",
    "category": "Subject Wise / Mixed",
    "file": "Classification_Of_Sexual_Offences__Rape.json",
    "questions": 20
  },
  {
    "title": "Classification of Carbohydrates & Mucopolysaccharidosis",
    "category": "Subject Wise / Mixed",
    "file": "Classification_of_Carbohydrates__Mucopolysaccharidosis.json",
    "questions": 32
  },
  {
    "title": "Classification of Congenital Heart Diseases",
    "category": "Subject Wise / Mixed",
    "file": "Classification_of_Congenital_Heart_Diseases.json",
    "questions": 31
  },
  {
    "title": "Classification of Postmortem Changes",
    "category": "Subject Wise / Mixed",
    "file": "Classification_of_Postmortem_Changes.json",
    "questions": 15
  },
  {
    "title": "Classification_Cohort_Study",
    "category": "Subject Wise / Mixed",
    "file": "Classification_Cohort_Study.json",
    "questions": 4
  },
  {
    "title": "Clavipectoral Fascia & Intermuscular Scapular Spaces",
    "category": "Subject Wise / Mixed",
    "file": "Clavipectoral_Fascia__Intermuscular_Scapular_Spaces.json",
    "questions": 5
  },
  {
    "title": "Cleft_Palate",
    "category": "Subject Wise / Mixed",
    "file": "Cleft_Palate.json",
    "questions": 5
  },
  {
    "title": "Clinical Microbiology",
    "category": "Subject Wise / Mixed",
    "file": "Clinical_Microbiology.json",
    "questions": 17
  },
  {
    "title": "Clinical Pharmacology",
    "category": "Subject Wise / Mixed",
    "file": "Clinical_Pharmacology.json",
    "questions": 12
  },
  {
    "title": "Clinical Trial",
    "category": "Subject Wise / Mixed",
    "file": "Clinical_Trial.json",
    "questions": 15
  },
  {
    "title": "Clinical_Approaches_to_Conditions_in_Reproductive_Age_Group-Previous_Year_Questions",
    "category": "Subject Wise / Mixed",
    "file": "Clinical_Approaches_to_Conditions_in_Reproductive_Age_Group-Previous_Year_Questions.json",
    "questions": 4
  },
  {
    "title": "Clinical_Biochemistry-Previous_Year_Questions",
    "category": "Subject Wise / Mixed",
    "file": "Clinical_Biochemistry-Previous_Year_Questions.json",
    "questions": 21
  },
  {
    "title": "Clinical_Conditions_of_Reproductive_Age_Group",
    "category": "Subject Wise / Mixed",
    "file": "Clinical_Conditions_of_Reproductive_Age_Group.json",
    "questions": 25
  },
  {
    "title": "Clinical_Essentials-Previous_Year_Questions",
    "category": "Subject Wise / Mixed",
    "file": "Clinical_Essentials-Previous_Year_Questions.json",
    "questions": 3
  },
  {
    "title": "Clinical_Essentials-Previous_Year_Questions",
    "category": "Subject Wise / Mixed",
    "file": "Clinical_Essentials-Previous_Year_Questions_1.json",
    "questions": 3
  },
  {
    "title": "Clinical_Essentials-Previous_Year_Questions",
    "category": "Subject Wise / Mixed",
    "file": "Clinical_Essentials-Previous_Year_Questions_2.json",
    "questions": 3
  },
  {
    "title": "Clinical_Microbiology-Previous_Year_Questions",
    "category": "Subject Wise / Mixed",
    "file": "Clinical_Microbiology-Previous_Year_Questions.json",
    "questions": 2
  },
  {
    "title": "Clinical_vignettes_Anesthesia",
    "category": "Subject Wise / Mixed",
    "file": "Clinical_vignettes_Anesthesia.json",
    "questions": 99
  },
  {
    "title": "Clozapine (Story Mnemonic)",
    "category": "Subject Wise / Mixed",
    "file": "Clozapine_Story_Mnemonic.json",
    "questions": 2
  },
  {
    "title": "Coagulation Pathways & Disorders",
    "category": "Subject Wise / Mixed",
    "file": "Coagulation_Pathways__Disorders.json",
    "questions": 28
  },
  {
    "title": "Coarctation of Aorta",
    "category": "Subject Wise / Mixed",
    "file": "Coarctation_of_Aorta.json",
    "questions": 7
  },
  {
    "title": "Collagen Fibers, Junctional Complexes, Cardiac & Skeletal Muscles & Types of Cartilages",
    "category": "Subject Wise / Mixed",
    "file": "Collagen_Fibers_Junctional_Complexes_Cardiac__Skeletal_Muscles__Types_of_Cartilages.json",
    "questions": 11
  },
  {
    "title": "Combo-1 (The Champion Batch Hyderabad) - 15-02-2025 - 2025-02-15",
    "category": "Subject Wise / Mixed",
    "file": "Combo-1_The_Champion_Batch_Hyderabad_-_15-02-2025_-_2025-02-15.json",
    "questions": 200
  },
  {
    "title": "Combo-2 (The Champion Batch Hyderabad) - 02-03-2025 - 2025-03-02",
    "category": "Subject Wise / Mixed",
    "file": "Combo-2_The_Champion_Batch_Hyderabad_-_02-03-2025_-_2025-03-02.json",
    "questions": 200
  },
  {
    "title": "Communicable Disease",
    "category": "Subject Wise / Mixed",
    "file": "Communicable_Disease.json",
    "questions": 114
  },
  {
    "title": "Communicable Diseases",
    "category": "Subject Wise / Mixed",
    "file": "Communicable_Diseases.json",
    "questions": 60
  },
  {
    "title": "Communicable_Diseases__Respiratory_Infections",
    "category": "Subject Wise / Mixed",
    "file": "Communicable_Diseases__Respiratory_Infections.json",
    "questions": 6
  },
  {
    "title": "Communicable_Diseases__Zoonotic_Diseases_Surface_Infections_Intestinal_Infections_STD",
    "category": "Subject Wise / Mixed",
    "file": "Communicable_Diseases__Zoonotic_Diseases_Surface_Infections_Intestinal_Infections_STD.json",
    "questions": 6
  },
  {
    "title": "Communicable_and_Non-communicable_Diseases-Acute_Respiratory_Infection_and_Tuberculosis",
    "category": "Subject Wise / Mixed",
    "file": "Communicable_and_Non-communicable_Diseases-Acute_Respiratory_Infection_and_Tuberculosis.json",
    "questions": 10
  },
  {
    "title": "Communicable_and_Non-communicable_Diseases-Chicken_Pox__Small_Pox_and_Diphtheria",
    "category": "Subject Wise / Mixed",
    "file": "Communicable_and_Non-communicable_Diseases-Chicken_Pox__Small_Pox_and_Diphtheria.json",
    "questions": 10
  },
  {
    "title": "Communicable_and_Non-communicable_Diseases-Dengue__Malaria__and_Rabies",
    "category": "Subject Wise / Mixed",
    "file": "Communicable_and_Non-communicable_Diseases-Dengue__Malaria__and_Rabies.json",
    "questions": 16
  },
  {
    "title": "Communicable_and_Non-communicable_Diseases-Filariasis__Leptospirosis__Japanese_Encephalitis__and_Helminthic_Infections",
    "category": "Subject Wise / Mixed",
    "file": "Communicable_and_Non-communicable_Diseases-Filariasis__Leptospirosis__Japanese_Encephalitis__and_Helminthic_Infections.json",
    "questions": 13
  },
  {
    "title": "Communicable_and_Non-communicable_Diseases-Infectious_Epidemiology",
    "category": "Subject Wise / Mixed",
    "file": "Communicable_and_Non-communicable_Diseases-Infectious_Epidemiology.json",
    "questions": 20
  },
  {
    "title": "Communicable_and_Non-communicable_Diseases-Mumps__Measles__Rubella__Pertussis",
    "category": "Subject Wise / Mixed",
    "file": "Communicable_and_Non-communicable_Diseases-Mumps__Measles__Rubella__Pertussis.json",
    "questions": 10
  },
  {
    "title": "Communicable_and_Non-communicable_Diseases-Plague__Tetanus__HIV_AIDS__Rickettsial_Disease__Ebola__Nipah_and_Zika_Virus",
    "category": "Subject Wise / Mixed",
    "file": "Communicable_and_Non-communicable_Diseases-Plague__Tetanus__HIV_AIDS__Rickettsial_Disease__Ebola__Nipah_and_Zika_Virus.json",
    "questions": 15
  },
  {
    "title": "Communicable_and_Non-communicable_Diseases-Previous_Year_Questions",
    "category": "Subject Wise / Mixed",
    "file": "Communicable_and_Non-communicable_Diseases-Previous_Year_Questions.json",
    "questions": 105
  },
  {
    "title": "Communication_for_Health_Education",
    "category": "Subject Wise / Mixed",
    "file": "Communication_for_Health_Education.json",
    "questions": 20
  },
  {
    "title": "Community Ophthalmology",
    "category": "Subject Wise / Mixed",
    "file": "Community_Ophthalmology.json",
    "questions": 12
  },
  {
    "title": "Community Ophthalmology & Miscellaneous",
    "category": "Subject Wise / Mixed",
    "file": "Community_Ophthalmology__Miscellaneous.json",
    "questions": 29
  },
  {
    "title": "Community_Ophthalmology-Previous_Year_Questions",
    "category": "Subject Wise / Mixed",
    "file": "Community_Ophthalmology-Previous_Year_Questions.json",
    "questions": 9
  },
  {
    "title": "Complication In Orthopaedics",
    "category": "Subject Wise / Mixed",
    "file": "Complication_In_Orthopaedics.json",
    "questions": 28
  },
  {
    "title": "Complications",
    "category": "Subject Wise / Mixed",
    "file": "Complications.json",
    "questions": 4
  },
  {
    "title": "Complications Specific to Pregnancy",
    "category": "Subject Wise / Mixed",
    "file": "Complications_Specific_to_Pregnancy.json",
    "questions": 133
  },
  {
    "title": "Complications of Diabetes, DKA & HHS",
    "category": "Subject Wise / Mixed",
    "file": "Complications_of_Diabetes_DKA__HHS.json",
    "questions": 11
  },
  {
    "title": "Complications of Sinusitis",
    "category": "Subject Wise / Mixed",
    "file": "Complications_of_Sinusitis.json",
    "questions": 7
  },
  {
    "title": "Complications_of_Fractures-Complications_in_Orthopedics",
    "category": "Subject Wise / Mixed",
    "file": "Complications_of_Fractures-Complications_in_Orthopedics.json",
    "questions": 14
  },
  {
    "title": "Complications_of_Fractures-Previous_Year_Questions",
    "category": "Subject Wise / Mixed",
    "file": "Complications_of_Fractures-Previous_Year_Questions.json",
    "questions": 10
  },
  {
    "title": "Complications_of_Sinusitis_and_Epistaxis",
    "category": "Subject Wise / Mixed",
    "file": "Complications_of_Sinusitis_and_Epistaxis.json",
    "questions": 6
  },
  {
    "title": "Concept of Health & Disease",
    "category": "Subject Wise / Mixed",
    "file": "Concept_of_Health__Disease.json",
    "questions": 15
  },
  {
    "title": "Concept_of_Health___Disease",
    "category": "Subject Wise / Mixed",
    "file": "Concept_of_Health___Disease.json",
    "questions": 7
  },
  {
    "title": "Concept_of_Health_and_Disease-Concept_of_Disease___Well-Being",
    "category": "Subject Wise / Mixed",
    "file": "Concept_of_Health_and_Disease-Concept_of_Disease___Well-Being.json",
    "questions": 10
  },
  {
    "title": "Concept_of_Health_and_Disease-Disease_Control__Monitoring_and_Surveillance",
    "category": "Subject Wise / Mixed",
    "file": "Concept_of_Health_and_Disease-Disease_Control__Monitoring_and_Surveillance.json",
    "questions": 15
  },
  {
    "title": "Concept_of_Health_and_Disease-Health_Indicators",
    "category": "Subject Wise / Mixed",
    "file": "Concept_of_Health_and_Disease-Health_Indicators.json",
    "questions": 5
  },
  {
    "title": "Concept_of_Health_and_Disease-Previous_Year_Questions",
    "category": "Subject Wise / Mixed",
    "file": "Concept_of_Health_and_Disease-Previous_Year_Questions.json",
    "questions": 21
  },
  {
    "title": "Concepts",
    "category": "Subject Wise / Mixed",
    "file": "Concepts.json",
    "questions": 9
  },
  {
    "title": "Concepts-Previous_Year_Questions",
    "category": "Subject Wise / Mixed",
    "file": "Concepts-Previous_Year_Questions.json",
    "questions": 7
  },
  {
    "title": "Congenital Anomalies",
    "category": "Subject Wise / Mixed",
    "file": "Congenital_Anomalies.json",
    "questions": 5
  },
  {
    "title": "Congenital Diseases of Larynx - Laryngomalacia",
    "category": "Subject Wise / Mixed",
    "file": "Congenital_Diseases_of_Larynx_-_Laryngomalacia.json",
    "questions": 12
  },
  {
    "title": "Congenital Glaucoma",
    "category": "Subject Wise / Mixed",
    "file": "Congenital_Glaucoma.json",
    "questions": 9
  },
  {
    "title": "Congenital Heart Disease - Atrial Septal Defect",
    "category": "Subject Wise / Mixed",
    "file": "Congenital_Heart_Disease_-_Atrial_Septal_Defect.json",
    "questions": 7
  },
  {
    "title": "Congenital Heart Disease - PDA",
    "category": "Subject Wise / Mixed",
    "file": "Congenital_Heart_Disease_-_PDA.json",
    "questions": 1
  },
  {
    "title": "Congenital Heart Disease - VSD",
    "category": "Subject Wise / Mixed",
    "file": "Congenital_Heart_Disease_-_VSD.json",
    "questions": 9
  },
  {
    "title": "Congenital Infections & Covid19",
    "category": "Subject Wise / Mixed",
    "file": "Congenital_Infections__Covid19.json",
    "questions": 10
  },
  {
    "title": "Congenital Mullerian Malformations",
    "category": "Subject Wise / Mixed",
    "file": "Congenital_Mullerian_Malformations.json",
    "questions": 16
  },
  {
    "title": "Congenital Nephrotic Syndrome & AKI (ARF)",
    "category": "Subject Wise / Mixed",
    "file": "Congenital_Nephrotic_Syndrome__AKI_ARF.json",
    "questions": 21
  },
  {
    "title": "Congenital_Anomalies_Nasal_Polyps_Rhinitis_Sinusitis",
    "category": "Subject Wise / Mixed",
    "file": "Congenital_Anomalies_Nasal_Polyps_Rhinitis_Sinusitis.json",
    "questions": 8
  },
  {
    "title": "Congenital_Anomalies_of_larynx",
    "category": "Subject Wise / Mixed",
    "file": "Congenital_Anomalies_of_larynx.json",
    "questions": 7
  },
  {
    "title": "Congenital__Benign___Inflammatory_Leisions_of_Larynx_Voice___Speech_Disorders",
    "category": "Subject Wise / Mixed",
    "file": "Congenital__Benign___Inflammatory_Leisions_of_Larynx_Voice___Speech_Disorders.json",
    "questions": 5
  },
  {
    "title": "Conjuctiva",
    "category": "Subject Wise / Mixed",
    "file": "Conjuctiva.json",
    "questions": 28
  },
  {
    "title": "Conjunctiva",
    "category": "Subject Wise / Mixed",
    "file": "Conjunctiva.json",
    "questions": 11
  },
  {
    "title": "Conjunctiva",
    "category": "Subject Wise / Mixed",
    "file": "Conjunctiva_1.json",
    "questions": 32
  },
  {
    "title": "Conjunctiva - Introduction",
    "category": "Subject Wise / Mixed",
    "file": "Conjunctiva_-_Introduction.json",
    "questions": 4
  },
  {
    "title": "Conjunctiva-Conjunctiva",
    "category": "Subject Wise / Mixed",
    "file": "Conjunctiva-Conjunctiva.json",
    "questions": 24
  },
  {
    "title": "Conjunctiva-Previous_Year_Questions",
    "category": "Subject Wise / Mixed",
    "file": "Conjunctiva-Previous_Year_Questions.json",
    "questions": 29
  },
  {
    "title": "Conjunctival Degenerations",
    "category": "Subject Wise / Mixed",
    "file": "Conjunctival_Degenerations.json",
    "questions": 19
  },
  {
    "title": "Conjunctivitis",
    "category": "Subject Wise / Mixed",
    "file": "Conjunctivitis.json",
    "questions": 33
  },
  {
    "title": "Connective Tissue Disorders & Drug Eruptions",
    "category": "Subject Wise / Mixed",
    "file": "Connective_Tissue_Disorders__Drug_Eruptions.json",
    "questions": 20
  },
  {
    "title": "Connective_Tissue_Disorders-Connective_tissue_disorders",
    "category": "Subject Wise / Mixed",
    "file": "Connective_Tissue_Disorders-Connective_tissue_disorders.json",
    "questions": 9
  },
  {
    "title": "Connective_Tissue_Disorders-Previous_Year_Questions",
    "category": "Subject Wise / Mixed",
    "file": "Connective_Tissue_Disorders-Previous_Year_Questions.json",
    "questions": 7
  },
  {
    "title": "Consent & Euthanasia",
    "category": "Subject Wise / Mixed",
    "file": "Consent__Euthanasia.json",
    "questions": 6
  },
  {
    "title": "Contraception and MTP",
    "category": "Subject Wise / Mixed",
    "file": "Contraception_and_MTP.json",
    "questions": 67
  },
  {
    "title": "Contraception-Contraception",
    "category": "Subject Wise / Mixed",
    "file": "Contraception-Contraception.json",
    "questions": 23
  },
  {
    "title": "Contraception-Previous_Year_Questions",
    "category": "Subject Wise / Mixed",
    "file": "Contraception-Previous_Year_Questions.json",
    "questions": 21
  },
  {
    "title": "Contrast Agents in Radiology",
    "category": "Subject Wise / Mixed",
    "file": "Contrast_Agents_in_Radiology.json",
    "questions": 11
  },
  {
    "title": "Contrast Media",
    "category": "Subject Wise / Mixed",
    "file": "Contrast_Media.json",
    "questions": 13
  },
  {
    "title": "Contusions",
    "category": "Subject Wise / Mixed",
    "file": "Contusions.json",
    "questions": 8
  },
  {
    "title": "Conus Medullaris & Cauda Equina Syndrome",
    "category": "Subject Wise / Mixed",
    "file": "Conus_Medullaris__Cauda_Equina_Syndrome.json",
    "questions": 9
  },
  {
    "title": "Conversion _ Dissociative Disorders",
    "category": "Subject Wise / Mixed",
    "file": "Conversion___Dissociative_Disorders.json",
    "questions": 23
  },
  {
    "title": "Cornea",
    "category": "Subject Wise / Mixed",
    "file": "Cornea.json",
    "questions": 14
  },
  {
    "title": "Cornea",
    "category": "Subject Wise / Mixed",
    "file": "Cornea_1.json",
    "questions": 49
  },
  {
    "title": "Cornea",
    "category": "Subject Wise / Mixed",
    "file": "Cornea_2.json",
    "questions": 57
  },
  {
    "title": "Cornea - Introduction",
    "category": "Subject Wise / Mixed",
    "file": "Cornea_-_Introduction.json",
    "questions": 13
  },
  {
    "title": "Cornea-Cornea",
    "category": "Subject Wise / Mixed",
    "file": "Cornea-Cornea.json",
    "questions": 35
  },
  {
    "title": "Cornea-Previous_Year_Questions",
    "category": "Subject Wise / Mixed",
    "file": "Cornea-Previous_Year_Questions.json",
    "questions": 43
  },
  {
    "title": "Corneal Dystrophies",
    "category": "Subject Wise / Mixed",
    "file": "Corneal_Dystrophies.json",
    "questions": 11
  },
  {
    "title": "Coronary Blood Flow",
    "category": "Subject Wise / Mixed",
    "file": "Coronary_Blood_Flow.json",
    "questions": 6
  },
  {
    "title": "Corticosteroids Clinical Concepts",
    "category": "Subject Wise / Mixed",
    "file": "Corticosteroids_Clinical_Concepts.json",
    "questions": 12
  },
  {
    "title": "Corticosteroids Therapeutic Uses",
    "category": "Subject Wise / Mixed",
    "file": "Corticosteroids_Therapeutic_Uses.json",
    "questions": 10
  },
  {
    "title": "Counter Coup Lesions & Concussion",
    "category": "Subject Wise / Mixed",
    "file": "Counter_Coup_Lesions__Concussion.json",
    "questions": 5
  },
  {
    "title": "Court_of_Law-Previous_Year_Questions",
    "category": "Subject Wise / Mixed",
    "file": "Court_of_Law-Previous_Year_Questions.json",
    "questions": 7
  },
  {
    "title": "Court_of_Law_Mechanical_Injuries",
    "category": "Subject Wise / Mixed",
    "file": "Court_of_Law_Mechanical_Injuries.json",
    "questions": 9
  },
  {
    "title": "Courts Of Law",
    "category": "Subject Wise / Mixed",
    "file": "Courts_Of_Law.json",
    "questions": 8
  },
  {
    "title": "Cranial Duramater & Dural Venous Sinus",
    "category": "Subject Wise / Mixed",
    "file": "Cranial_Duramater__Dural_Venous_Sinus.json",
    "questions": 12
  },
  {
    "title": "Cranial Nerve - III, IV & VI",
    "category": "Subject Wise / Mixed",
    "file": "Cranial_Nerve_-_III_IV__VI.json",
    "questions": 20
  },
  {
    "title": "Cranial Nerve Nuclei & Columns",
    "category": "Subject Wise / Mixed",
    "file": "Cranial_Nerve_Nuclei__Columns.json",
    "questions": 21
  },
  {
    "title": "Cranial Nerve \u2013 VII",
    "category": "Subject Wise / Mixed",
    "file": "Cranial_Nerve__VII.json",
    "questions": 10
  },
  {
    "title": "Cranial nerves - IX, X, XI & XII Nerves",
    "category": "Subject Wise / Mixed",
    "file": "Cranial_nerves_-_IX_X_XI__XII_Nerves.json",
    "questions": 13
  },
  {
    "title": "Critical Care",
    "category": "Subject Wise / Mixed",
    "file": "Critical_Care.json",
    "questions": 35
  },
  {
    "title": "Critical_Care",
    "category": "Subject Wise / Mixed",
    "file": "Critical_Care_1.json",
    "questions": 20
  },
  {
    "title": "Croup & Choanal Atresia",
    "category": "Subject Wise / Mixed",
    "file": "Croup__Choanal_Atresia.json",
    "questions": 13
  },
  {
    "title": "Csom",
    "category": "Subject Wise / Mixed",
    "file": "Csom.json",
    "questions": 13
  },
  {
    "title": "Ctev & Achondroplasia",
    "category": "Subject Wise / Mixed",
    "file": "Ctev__Achondroplasia.json",
    "questions": 8
  },
  {
    "title": "Cubital Fossa",
    "category": "Subject Wise / Mixed",
    "file": "Cubital_Fossa.json",
    "questions": 6
  },
  {
    "title": "Culture & Identification",
    "category": "Subject Wise / Mixed",
    "file": "Culture__Identification.json",
    "questions": 23
  },
  {
    "title": "Cumulative Exam on 13th July (The Champion Batch Hyderabad) - 13-07-2024 - 2024-07-13",
    "category": "Subject Wise / Mixed",
    "file": "Cumulative_Exam_on_13th_July_The_Champion_Batch_Hyderabad_-_13-07-2024_-_2024-07-13.json",
    "questions": 200
  },
  {
    "title": "Cumulative Exam on 14th Oct (The Champion Batch Hyderabad) - 14-10-2024 - 2024-10-14",
    "category": "Subject Wise / Mixed",
    "file": "Cumulative_Exam_on_14th_Oct_The_Champion_Batch_Hyderabad_-_14-10-2024_-_2024-10-14.json",
    "questions": 200
  },
  {
    "title": "Cumulative Exam on 30th May (The Champion Batch Hyderabad) - 30-05-2024 - 2024-05-30",
    "category": "Subject Wise / Mixed",
    "file": "Cumulative_Exam_on_30th_May_The_Champion_Batch_Hyderabad_-_30-05-2024_-_2024-05-30.json",
    "questions": 200
  },
  {
    "title": "Cumulative Exam on 5th Sep (The Champion Batch Hyderabad) - 05-09-2024 - 2024-09-05",
    "category": "Subject Wise / Mixed",
    "file": "Cumulative_Exam_on_5th_Sep_The_Champion_Batch_Hyderabad_-_05-09-2024_-_2024-09-05.json",
    "questions": 200
  },
  {
    "title": "Cumulative Exam on 8th Dec (The Champion Batch Hyderabad) - 8-12-2024 - 2024-12-08",
    "category": "Subject Wise / Mixed",
    "file": "Cumulative_Exam_on_8th_Dec_The_Champion_Batch_Hyderabad_-_8-12-2024_-_2024-12-08.json",
    "questions": 200
  },
  {
    "title": "Cushings Syndrome",
    "category": "Subject Wise / Mixed",
    "file": "Cushings_Syndrome.json",
    "questions": 8
  },
  {
    "title": "Cutaneous_Infections-Previous_Year_Questions",
    "category": "Subject Wise / Mixed",
    "file": "Cutaneous_Infections-Previous_Year_Questions.json",
    "questions": 26
  },
  {
    "title": "Cutaneous_Tuberculosis___Leprosy",
    "category": "Subject Wise / Mixed",
    "file": "Cutaneous_Tuberculosis___Leprosy.json",
    "questions": 5
  },
  {
    "title": "Cyanotic CHD",
    "category": "Subject Wise / Mixed",
    "file": "Cyanotic_CHD.json",
    "questions": 11
  },
  {
    "title": "Cyanotic Congenital Heart Disease & TOF",
    "category": "Subject Wise / Mixed",
    "file": "Cyanotic_Congenital_Heart_Disease__TOF.json",
    "questions": 4
  },
  {
    "title": "Cyanotic Congenital Heart Disease (Part 2)",
    "category": "Subject Wise / Mixed",
    "file": "Cyanotic_Congenital_Heart_Disease_Part_2.json",
    "questions": 7
  },
  {
    "title": "Cystic Diseases of Kidney ADPKD & ARPKD",
    "category": "Subject Wise / Mixed",
    "file": "Cystic_Diseases_of_Kidney_ADPKD__ARPKD.json",
    "questions": 11
  },
  {
    "title": "Cystic Fibrosis, Pneumonia & ARDS",
    "category": "Subject Wise / Mixed",
    "file": "Cystic_Fibrosis_Pneumonia__ARDS.json",
    "questions": 31
  },
  {
    "title": "DNA Replication & Repair",
    "category": "Subject Wise / Mixed",
    "file": "DNA_Replication__Repair.json",
    "questions": 23
  },
  {
    "title": "DNA Viruses Skin Infections",
    "category": "Subject Wise / Mixed",
    "file": "DNA_Viruses_Skin_Infections.json",
    "questions": 22
  },
  {
    "title": "DNA_Replicatoin_and_Repair",
    "category": "Subject Wise / Mixed",
    "file": "DNA_Replicatoin_and_Repair.json",
    "questions": 17
  },
  {
    "title": "Damage Control Resuscitation",
    "category": "Subject Wise / Mixed",
    "file": "Damage_Control_Resuscitation.json",
    "questions": 5
  },
  {
    "title": "Damage Control Surgery",
    "category": "Subject Wise / Mixed",
    "file": "Damage_Control_Surgery.json",
    "questions": 12
  },
  {
    "title": "Day Care Anesthesia",
    "category": "Subject Wise / Mixed",
    "file": "Day_Care_Anesthesia.json",
    "questions": 7
  },
  {
    "title": "Deaf Child, Tinnitus & Hyperbaric Oxygen Therapy",
    "category": "Subject Wise / Mixed",
    "file": "Deaf_Child_Tinnitus__Hyperbaric_Oxygen_Therapy.json",
    "questions": 11
  },
  {
    "title": "Death & It's Types",
    "category": "Subject Wise / Mixed",
    "file": "Death__Its_Types.json",
    "questions": 10
  },
  {
    "title": "Decomposition",
    "category": "Subject Wise / Mixed",
    "file": "Decomposition.json",
    "questions": 8
  },
  {
    "title": "Deep Cervical Fascia",
    "category": "Subject Wise / Mixed",
    "file": "Deep_Cervical_Fascia.json",
    "questions": 14
  },
  {
    "title": "Deep Fungal Skin Infections",
    "category": "Subject Wise / Mixed",
    "file": "Deep_Fungal_Skin_Infections.json",
    "questions": 22
  },
  {
    "title": "Defects of Inflammation",
    "category": "Subject Wise / Mixed",
    "file": "Defects_of_Inflammation.json",
    "questions": 3
  },
  {
    "title": "Defense Mechanisms",
    "category": "Subject Wise / Mixed",
    "file": "Defense_Mechanisms.json",
    "questions": 18
  },
  {
    "title": "Defenses Against Negligence",
    "category": "Subject Wise / Mixed",
    "file": "Defenses_Against_Negligence.json",
    "questions": 10
  },
  {
    "title": "Definitions",
    "category": "Subject Wise / Mixed",
    "file": "Definitions.json",
    "questions": 10
  },
  {
    "title": "Definitions & Inquest",
    "category": "Subject Wise / Mixed",
    "file": "Definitions__Inquest.json",
    "questions": 12
  },
  {
    "title": "Deliriant Poisons",
    "category": "Subject Wise / Mixed",
    "file": "Deliriant_Poisons.json",
    "questions": 10
  },
  {
    "title": "Dementia - Alzheimer's Disease (Part 1)",
    "category": "Subject Wise / Mixed",
    "file": "Dementia_-_Alzheimers_Disease_Part_1.json",
    "questions": 27
  },
  {
    "title": "Dementia - FTD, Huntington, CJD & NPH (Part 3)",
    "category": "Subject Wise / Mixed",
    "file": "Dementia_-_FTD_Huntington_CJD__NPH_Part_3.json",
    "questions": 31
  },
  {
    "title": "Dementia - Lewy Body Dementia & Vascular Dementia (Part 2)",
    "category": "Subject Wise / Mixed",
    "file": "Dementia_-_Lewy_Body_Dementia__Vascular_Dementia_Part_2.json",
    "questions": 7
  },
  {
    "title": "Demo Test for First Prof Students - 2024-12-20",
    "category": "Subject Wise / Mixed",
    "file": "Demo_Test_for_First_Prof_Students_-_2024-12-20.json",
    "questions": 30
  },
  {
    "title": "Demography & Family Planning",
    "category": "Subject Wise / Mixed",
    "file": "Demography__Family_Planning.json",
    "questions": 68
  },
  {
    "title": "Demography and Health",
    "category": "Subject Wise / Mixed",
    "file": "Demography_and_Health.json",
    "questions": 50
  },
  {
    "title": "Demography__Family_Planning",
    "category": "Subject Wise / Mixed",
    "file": "Demography__Family_Planning_1.json",
    "questions": 40
  },
  {
    "title": "Demography___Health",
    "category": "Subject Wise / Mixed",
    "file": "Demography___Health.json",
    "questions": 5
  },
  {
    "title": "Demography_and_Health-Demography_and_Health",
    "category": "Subject Wise / Mixed",
    "file": "Demography_and_Health-Demography_and_Health.json",
    "questions": 25
  },
  {
    "title": "Demography_and_Health-Previous_Year_Questions",
    "category": "Subject Wise / Mixed",
    "file": "Demography_and_Health-Previous_Year_Questions.json",
    "questions": 24
  },
  {
    "title": "Demonstration-Previous_Year_Questions",
    "category": "Subject Wise / Mixed",
    "file": "Demonstration-Previous_Year_Questions.json",
    "questions": 1
  },
  {
    "title": "Depression",
    "category": "Subject Wise / Mixed",
    "file": "Depression.json",
    "questions": 18
  },
  {
    "title": "Derma, Radio, Ortho, Anes & Psychi Combo (The Champion Batch Hyderabad) - 29-03-2025 - 2025-03-29",
    "category": "Subject Wise / Mixed",
    "file": "Derma_Radio_Ortho_Anes__Psychi_Combo_The_Champion_Batch_Hyderabad_-_29-03-2025_-_2025-03-29.json",
    "questions": 200
  },
  {
    "title": "Dermatology",
    "category": "Subject Wise / Mixed",
    "file": "Dermatology.json",
    "questions": 100
  },
  {
    "title": "Dermatology - INI CET JULY 2021",
    "category": "Subject Wise / Mixed",
    "file": "Dermatology_-_INI_CET_JULY_2021.json",
    "questions": 7
  },
  {
    "title": "Dermatology - INI CET MAY 2022",
    "category": "Subject Wise / Mixed",
    "file": "Dermatology_-_INI_CET_MAY_2022.json",
    "questions": 2
  },
  {
    "title": "Dermatology - INI CET MAY 2023",
    "category": "Subject Wise / Mixed",
    "file": "Dermatology_-_INI_CET_MAY_2023.json",
    "questions": 4
  },
  {
    "title": "Dermatology - INI CET NOV 2020",
    "category": "Subject Wise / Mixed",
    "file": "Dermatology_-_INI_CET_NOV_2020.json",
    "questions": 9
  },
  {
    "title": "Dermatology - INI CET NOV 2021",
    "category": "Subject Wise / Mixed",
    "file": "Dermatology_-_INI_CET_NOV_2021.json",
    "questions": 7
  },
  {
    "title": "Dermatology - INI CET NOV 2022 (PART A)",
    "category": "Subject Wise / Mixed",
    "file": "Dermatology_-_INI_CET_NOV_2022_PART_A.json",
    "questions": 2
  },
  {
    "title": "Dermatology - INI CET NOV 2022 (PART B)",
    "category": "Subject Wise / Mixed",
    "file": "Dermatology_-_INI_CET_NOV_2022_PART_B.json",
    "questions": 5
  },
  {
    "title": "Dermatology - INI CET NOV 2023",
    "category": "Subject Wise / Mixed",
    "file": "Dermatology_-_INI_CET_NOV_2023.json",
    "questions": 5
  },
  {
    "title": "Dermatology E&D - 01-10-2023 - 2023-10-01",
    "category": "Subject Wise / Mixed",
    "file": "Dermatology_ED_-_01-10-2023_-_2023-10-01.json",
    "questions": 50
  },
  {
    "title": "Dermatology E&D - Mission 1.5 - 14-03-2024 - 2024-03-14",
    "category": "Subject Wise / Mixed",
    "file": "Dermatology_ED_-_Mission_15_-_14-03-2024_-_2024-03-14.json",
    "questions": 75
  },
  {
    "title": "Dermatology E&D - Mission 1.5, Lap 2 - 01-06-2024 - 2024-06-01",
    "category": "Subject Wise / Mixed",
    "file": "Dermatology_ED_-_Mission_15_Lap_2_-_01-06-2024_-_2024-06-01.json",
    "questions": 50
  },
  {
    "title": "Dermatology E&D - Mission 2.0 (Batch 2) - 27-12-2024 - 2024-12-27",
    "category": "Subject Wise / Mixed",
    "file": "Dermatology_ED_-_Mission_20_Batch_2_-_27-12-2024_-_2024-12-27.json",
    "questions": 75
  },
  {
    "title": "Dermatology E&D - Mission 2.0 (Batch 3) - 23-02-2025 - 2025-02-23",
    "category": "Subject Wise / Mixed",
    "file": "Dermatology_ED_-_Mission_20_Batch_3_-_23-02-2025_-_2025-02-23.json",
    "questions": 75
  },
  {
    "title": "Dermatology E&D - Mission 2.0, Lap 2 - 29-03-2025 - 2025-03-29",
    "category": "Subject Wise / Mixed",
    "file": "Dermatology_ED_-_Mission_20_Lap_2_-_29-03-2025_-_2025-03-29.json",
    "questions": 50
  },
  {
    "title": "Dermatology Last Month E&D - 09-07-2024 - 2024-07-09",
    "category": "Subject Wise / Mixed",
    "file": "Dermatology_Last_Month_ED_-_09-07-2024_-_2024-07-09.json",
    "questions": 25
  },
  {
    "title": "Dermatology Test (The Champion Batch Hyderabad) - 14-05-2024 - 2024-05-14",
    "category": "Subject Wise / Mixed",
    "file": "Dermatology_Test_The_Champion_Batch_Hyderabad_-_14-05-2024_-_2024-05-14.json",
    "questions": 75
  },
  {
    "title": "Dermatology Test (The Champion Batch Hyderabad) - 15-04-2025 - 2025-04-15",
    "category": "Subject Wise / Mixed",
    "file": "Dermatology_Test_The_Champion_Batch_Hyderabad_-_15-04-2025_-_2025-04-15.json",
    "questions": 50
  },
  {
    "title": "Dermatology Test (The Champion Batch Hyderabad) - 29-10-2024 - 2024-10-29",
    "category": "Subject Wise / Mixed",
    "file": "Dermatology_Test_The_Champion_Batch_Hyderabad_-_29-10-2024_-_2024-10-29.json",
    "questions": 75
  },
  {
    "title": "Dermatology-_Class_Test_With_Video_Solution",
    "category": "Subject Wise / Mixed",
    "file": "Dermatology-_Class_Test_With_Video_Solution.json",
    "questions": 50
  },
  {
    "title": "Dermatology_DVT_Revision_Test",
    "category": "Subject Wise / Mixed",
    "file": "Dermatology_DVT_Revision_Test.json",
    "questions": 25
  },
  {
    "title": "Dermatology_Dr_Chesta",
    "category": "Subject Wise / Mixed",
    "file": "Dermatology_Dr_Chesta.json",
    "questions": 50
  },
  {
    "title": "Dermatology_Dr_Chesta",
    "category": "Subject Wise / Mixed",
    "file": "Dermatology_Dr_Chesta_1.json",
    "questions": 50
  },
  {
    "title": "Dermatology_Dr_Chesta-2026",
    "category": "Subject Wise / Mixed",
    "file": "Dermatology_Dr_Chesta-2026.json",
    "questions": 50
  },
  {
    "title": "Dermatology_Dr_Chesta_FMGE_CT",
    "category": "Subject Wise / Mixed",
    "file": "Dermatology_Dr_Chesta_FMGE_CT.json",
    "questions": 50
  },
  {
    "title": "Dermatology_FMGE_PYQ",
    "category": "Subject Wise / Mixed",
    "file": "Dermatology_FMGE_PYQ.json",
    "questions": 97
  },
  {
    "title": "Dermatology_IBQ",
    "category": "Subject Wise / Mixed",
    "file": "Dermatology_IBQ.json",
    "questions": 20
  },
  {
    "title": "Dermatology_Image_Based_Qs",
    "category": "Subject Wise / Mixed",
    "file": "Dermatology_Image_Based_Qs.json",
    "questions": 52
  },
  {
    "title": "Dermatology_MIQ_Series",
    "category": "Subject Wise / Mixed",
    "file": "Dermatology_MIQ_Series.json",
    "questions": 15
  },
  {
    "title": "Dermoepidermal Junction, DIF & Nail Diseases",
    "category": "Subject Wise / Mixed",
    "file": "Dermoepidermal_Junction_DIF__Nail_Diseases.json",
    "questions": 11
  },
  {
    "title": "Descending Tracts",
    "category": "Subject Wise / Mixed",
    "file": "Descending_Tracts.json",
    "questions": 14
  },
  {
    "title": "Descriptive_Epidemiology__Infectious_Disease_Epidemiology",
    "category": "Subject Wise / Mixed",
    "file": "Descriptive_Epidemiology__Infectious_Disease_Epidemiology.json",
    "questions": 6
  },
  {
    "title": "Development of Eye",
    "category": "Subject Wise / Mixed",
    "file": "Development_of_Eye.json",
    "questions": 3
  },
  {
    "title": "Developmental_and_Behavioral_Disorders-Previous_Year_Questions",
    "category": "Subject Wise / Mixed",
    "file": "Developmental_and_Behavioral_Disorders-Previous_Year_Questions.json",
    "questions": 6
  },
  {
    "title": "Developmental_and_Behavioural_Disorders-Normal_Development__Developmental___Behavioral_Disorders",
    "category": "Subject Wise / Mixed",
    "file": "Developmental_and_Behavioural_Disorders-Normal_Development__Developmental___Behavioral_Disorders.json",
    "questions": 20
  },
  {
    "title": "Diabetes Criteria, Classifications & Pathophysiology",
    "category": "Subject Wise / Mixed",
    "file": "Diabetes_Criteria_Classifications__Pathophysiology.json",
    "questions": 5
  },
  {
    "title": "Diabetes Mellitus (Part 1)",
    "category": "Subject Wise / Mixed",
    "file": "Diabetes_Mellitus_Part_1.json",
    "questions": 8
  },
  {
    "title": "Diabetes Mellitus (Part 2)",
    "category": "Subject Wise / Mixed",
    "file": "Diabetes_Mellitus_Part_2.json",
    "questions": 22
  },
  {
    "title": "Diabetes in Pregnancy",
    "category": "Subject Wise / Mixed",
    "file": "Diabetes_in_Pregnancy.json",
    "questions": 20
  },
  {
    "title": "Diabetes_In_Pregnancy",
    "category": "Subject Wise / Mixed",
    "file": "Diabetes_In_Pregnancy.json",
    "questions": 17
  },
  {
    "title": "Diabetes_Mellitus",
    "category": "Subject Wise / Mixed",
    "file": "Diabetes_Mellitus.json",
    "questions": 117
  },
  {
    "title": "Diabetic Retinopathy",
    "category": "Subject Wise / Mixed",
    "file": "Diabetic_Retinopathy.json",
    "questions": 7
  },
  {
    "title": "Diagnosis & Type",
    "category": "Subject Wise / Mixed",
    "file": "Diagnosis__Type.json",
    "questions": 3
  },
  {
    "title": "Diagnosis of Genetic Disorders",
    "category": "Subject Wise / Mixed",
    "file": "Diagnosis_of_Genetic_Disorders.json",
    "questions": 8
  },
  {
    "title": "Diagnosis of Pregnancy",
    "category": "Subject Wise / Mixed",
    "file": "Diagnosis_of_Pregnancy.json",
    "questions": 9
  },
  {
    "title": "Difficult_airway_management___Ventilators",
    "category": "Subject Wise / Mixed",
    "file": "Difficult_airway_management___Ventilators.json",
    "questions": 4
  },
  {
    "title": "Diphtheria",
    "category": "Subject Wise / Mixed",
    "file": "Diphtheria.json",
    "questions": 3
  },
  {
    "title": "Disaster Management",
    "category": "Subject Wise / Mixed",
    "file": "Disaster_Management.json",
    "questions": 12
  },
  {
    "title": "Disaster Management",
    "category": "Subject Wise / Mixed",
    "file": "Disaster_Management_1.json",
    "questions": 17
  },
  {
    "title": "Disaster_Management",
    "category": "Subject Wise / Mixed",
    "file": "Disaster_Management_2.json",
    "questions": 10
  },
  {
    "title": "Disease of External Ear",
    "category": "Subject Wise / Mixed",
    "file": "Disease_of_External_Ear.json",
    "questions": 30
  },
  {
    "title": "Diseases of External Nose",
    "category": "Subject Wise / Mixed",
    "file": "Diseases_of_External_Nose.json",
    "questions": 40
  },
  {
    "title": "Diseases of Gall bladder\u00a0& Bile\u00a0Ducts",
    "category": "Subject Wise / Mixed",
    "file": "Diseases_of_Gall_bladder\u00a0_Bile\u00a0Ducts.json",
    "questions": 30
  },
  {
    "title": "Diseases of Orbit",
    "category": "Subject Wise / Mixed",
    "file": "Diseases_of_Orbit.json",
    "questions": 7
  },
  {
    "title": "Diseases of Uterus",
    "category": "Subject Wise / Mixed",
    "file": "Diseases_of_Uterus.json",
    "questions": 12
  },
  {
    "title": "Diseases_Infections_and_Tumors_of_Larynx",
    "category": "Subject Wise / Mixed",
    "file": "Diseases_Infections_and_Tumors_of_Larynx.json",
    "questions": 41
  },
  {
    "title": "Diseases_of_Immune_System-Previous_Year_Questions",
    "category": "Subject Wise / Mixed",
    "file": "Diseases_of_Immune_System-Previous_Year_Questions.json",
    "questions": 6
  },
  {
    "title": "Diseases_of_Immune_System-Primary_Immunodeficiency_and_Vasculitis_in_Children",
    "category": "Subject Wise / Mixed",
    "file": "Diseases_of_Immune_System-Primary_Immunodeficiency_and_Vasculitis_in_Children.json",
    "questions": 16
  },
  {
    "title": "Diseases_of_Lens",
    "category": "Subject Wise / Mixed",
    "file": "Diseases_of_Lens.json",
    "questions": 9
  },
  {
    "title": "Diseases_of_Lens-Lens_and_Disorders",
    "category": "Subject Wise / Mixed",
    "file": "Diseases_of_Lens-Lens_and_Disorders.json",
    "questions": 33
  },
  {
    "title": "Diseases_of_Lens-Previous_Year_Questions",
    "category": "Subject Wise / Mixed",
    "file": "Diseases_of_Lens-Previous_Year_Questions.json",
    "questions": 25
  },
  {
    "title": "Diseases_of_Nasal_Septum",
    "category": "Subject Wise / Mixed",
    "file": "Diseases_of_Nasal_Septum.json",
    "questions": 12
  },
  {
    "title": "Diseases_of_Pharynx",
    "category": "Subject Wise / Mixed",
    "file": "Diseases_of_Pharynx.json",
    "questions": 10
  },
  {
    "title": "Diseases_of_the_immune_system",
    "category": "Subject Wise / Mixed",
    "file": "Diseases_of_the_immune_system.json",
    "questions": 22
  },
  {
    "title": "Diseases_of_the_lens",
    "category": "Subject Wise / Mixed",
    "file": "Diseases_of_the_lens.json",
    "questions": 43
  },
  {
    "title": "Disorders Of Carbohydrate Metabolism",
    "category": "Subject Wise / Mixed",
    "file": "Disorders_Of_Carbohydrate_Metabolism.json",
    "questions": 8
  },
  {
    "title": "Disorders Of Protein Metabolism",
    "category": "Subject Wise / Mixed",
    "file": "Disorders_Of_Protein_Metabolism.json",
    "questions": 15
  },
  {
    "title": "Disorders Specifically Associated with Stress",
    "category": "Subject Wise / Mixed",
    "file": "Disorders_Specifically_Associated_with_Stress.json",
    "questions": 8
  },
  {
    "title": "Disorders_of_Glands",
    "category": "Subject Wise / Mixed",
    "file": "Disorders_of_Glands.json",
    "questions": 4
  },
  {
    "title": "Disorders_of_Kidney_and_Urinary_Tract-Previous_Year_Questions",
    "category": "Subject Wise / Mixed",
    "file": "Disorders_of_Kidney_and_Urinary_Tract-Previous_Year_Questions.json",
    "questions": 3
  },
  {
    "title": "Dissociative Disorders",
    "category": "Subject Wise / Mixed",
    "file": "Dissociative_Disorders.json",
    "questions": 6
  },
  {
    "title": "Diuretics",
    "category": "Subject Wise / Mixed",
    "file": "Diuretics.json",
    "questions": 24
  },
  {
    "title": "Drowning",
    "category": "Subject Wise / Mixed",
    "file": "Drowning.json",
    "questions": 10
  },
  {
    "title": "Drug Dependence & Abuse",
    "category": "Subject Wise / Mixed",
    "file": "Drug_Dependence__Abuse.json",
    "questions": 4
  },
  {
    "title": "Drug Reaction",
    "category": "Subject Wise / Mixed",
    "file": "Drug_Reaction.json",
    "questions": 8
  },
  {
    "title": "Drug_Reactions",
    "category": "Subject Wise / Mixed",
    "file": "Drug_Reactions.json",
    "questions": 6
  },
  {
    "title": "Drugs Acting on Ganglia & Anti Smoking Drugs",
    "category": "Subject Wise / Mixed",
    "file": "Drugs_Acting_on_Ganglia__Anti_Smoking_Drugs.json",
    "questions": 7
  },
  {
    "title": "Drugs Affecting RAAS Pathway",
    "category": "Subject Wise / Mixed",
    "file": "Drugs_Affecting_RAAS_Pathway.json",
    "questions": 13
  },
  {
    "title": "Drugs For Anxiety",
    "category": "Subject Wise / Mixed",
    "file": "Drugs_For_Anxiety.json",
    "questions": 7
  },
  {
    "title": "Drugs For Cough",
    "category": "Subject Wise / Mixed",
    "file": "Drugs_For_Cough.json",
    "questions": 5
  },
  {
    "title": "Drugs For Dyslipidemia",
    "category": "Subject Wise / Mixed",
    "file": "Drugs_For_Dyslipidemia.json",
    "questions": 8
  },
  {
    "title": "Drugs For Peptic Ulcer Disease",
    "category": "Subject Wise / Mixed",
    "file": "Drugs_For_Peptic_Ulcer_Disease.json",
    "questions": 13
  },
  {
    "title": "Drugs For Pulmonary Hypertension",
    "category": "Subject Wise / Mixed",
    "file": "Drugs_For_Pulmonary_Hypertension.json",
    "questions": 3
  },
  {
    "title": "Drugs For UTI",
    "category": "Subject Wise / Mixed",
    "file": "Drugs_For_UTI.json",
    "questions": 6
  },
  {
    "title": "Drugs Used For Constipation",
    "category": "Subject Wise / Mixed",
    "file": "Drugs_Used_For_Constipation.json",
    "questions": 12
  },
  {
    "title": "Drugs in Gynae",
    "category": "Subject Wise / Mixed",
    "file": "Drugs_in_Gynae.json",
    "questions": 11
  },
  {
    "title": "Drugs in Obs",
    "category": "Subject Wise / Mixed",
    "file": "Drugs_in_Obs.json",
    "questions": 10
  },
  {
    "title": "Drugs_Affecting_Blood_and_Blood_formation-Anti_Platelets_and_Pro_Platelets__Thrombolytics_and_Anti_Thrombolytics",
    "category": "Subject Wise / Mixed",
    "file": "Drugs_Affecting_Blood_and_Blood_formation-Anti_Platelets_and_Pro_Platelets__Thrombolytics_and_Anti_Thrombolytics.json",
    "questions": 12
  },
  {
    "title": "Drugs_Affecting_Blood_and_Blood_formation-Hematinics__Iron__and_Chelators",
    "category": "Subject Wise / Mixed",
    "file": "Drugs_Affecting_Blood_and_Blood_formation-Hematinics__Iron__and_Chelators.json",
    "questions": 9
  },
  {
    "title": "Drugs_Affecting_Blood_and_Blood_formation-Oral_and_Parenteral_Anticoagulants",
    "category": "Subject Wise / Mixed",
    "file": "Drugs_Affecting_Blood_and_Blood_formation-Oral_and_Parenteral_Anticoagulants.json",
    "questions": 15
  },
  {
    "title": "Drugs_Affecting_Blood_and_Blood_formation-Previous_Year_Questions",
    "category": "Subject Wise / Mixed",
    "file": "Drugs_Affecting_Blood_and_Blood_formation-Previous_Year_Questions.json",
    "questions": 33
  },
  {
    "title": "Drugs_used_in_Obstetrics_and_Gynaecology-Previous_Year_Questions",
    "category": "Subject Wise / Mixed",
    "file": "Drugs_used_in_Obstetrics_and_Gynaecology-Previous_Year_Questions.json",
    "questions": 1
  },
  {
    "title": "ECG",
    "category": "Subject Wise / Mixed",
    "file": "ECG.json",
    "questions": 20
  },
  {
    "title": "ECG & Ischemic Heart Disease",
    "category": "Subject Wise / Mixed",
    "file": "ECG__Ischemic_Heart_Disease.json",
    "questions": 13
  },
  {
    "title": "ECG - Basics & Formation of PQRS Waves (Part 2)",
    "category": "Subject Wise / Mixed",
    "file": "ECG_-_Basics__Formation_of_PQRS_Waves_Part_2.json",
    "questions": 10
  },
  {
    "title": "ECG - Basics & Lead Placement (Part 1)",
    "category": "Subject Wise / Mixed",
    "file": "ECG_-_Basics__Lead_Placement_Part_1.json",
    "questions": 18
  },
  {
    "title": "ECG - PQRS & T Wave Abnormalities (Part 3)",
    "category": "Subject Wise / Mixed",
    "file": "ECG_-_PQRS__T_Wave_Abnormalities_Part_3.json",
    "questions": 19
  },
  {
    "title": "ECG - Ventricular Hypertrophies & Axis (Part 4)",
    "category": "Subject Wise / Mixed",
    "file": "ECG_-_Ventricular_Hypertrophies__Axis_Part_4.json",
    "questions": 2
  },
  {
    "title": "ECG Brugada Wellens Fascicular Block",
    "category": "Subject Wise / Mixed",
    "file": "ECG_Brugada_Wellens_Fascicular_Block.json",
    "questions": 9
  },
  {
    "title": "ECG Electrolytes & Misc",
    "category": "Subject Wise / Mixed",
    "file": "ECG_Electrolytes__Misc.json",
    "questions": 6
  },
  {
    "title": "ECG VT,V fib & Heart Blocks",
    "category": "Subject Wise / Mixed",
    "file": "ECG_VTV_fib__Heart_Blocks.json",
    "questions": 12
  },
  {
    "title": "ENT",
    "category": "Subject Wise / Mixed",
    "file": "ENT.json",
    "questions": 20
  },
  {
    "title": "ENT - INI CET JULY 2021",
    "category": "Subject Wise / Mixed",
    "file": "ENT_-_INI_CET_JULY_2021.json",
    "questions": 3
  },
  {
    "title": "ENT - INI CET MAY 2022",
    "category": "Subject Wise / Mixed",
    "file": "ENT_-_INI_CET_MAY_2022.json",
    "questions": 4
  },
  {
    "title": "ENT - INI CET NOV 2020",
    "category": "Subject Wise / Mixed",
    "file": "ENT_-_INI_CET_NOV_2020.json",
    "questions": 7
  },
  {
    "title": "ENT - INI CET NOV 2021",
    "category": "Subject Wise / Mixed",
    "file": "ENT_-_INI_CET_NOV_2021.json",
    "questions": 5
  },
  {
    "title": "ENT - INI CET NOV 2023",
    "category": "Subject Wise / Mixed",
    "file": "ENT_-_INI_CET_NOV_2023.json",
    "questions": 7
  },
  {
    "title": "ENT - INI CET NOVEMBER 2022 (PART A)",
    "category": "Subject Wise / Mixed",
    "file": "ENT_-_INI_CET_NOVEMBER_2022_PART_A.json",
    "questions": 11
  },
  {
    "title": "ENT - INI CET NOVEMBER 2022 (PART B)",
    "category": "Subject Wise / Mixed",
    "file": "ENT_-_INI_CET_NOVEMBER_2022_PART_B.json",
    "questions": 3
  },
  {
    "title": "ENT E&D - 28-09-2023 - 2023-09-28",
    "category": "Subject Wise / Mixed",
    "file": "ENT_ED_-_28-09-2023_-_2023-09-28.json",
    "questions": 75
  },
  {
    "title": "ENT E&D - Mission 1.5 - 30-04-2024 - 2024-04-30",
    "category": "Subject Wise / Mixed",
    "file": "ENT_ED_-_Mission_15_-_30-04-2024_-_2024-04-30.json",
    "questions": 60
  },
  {
    "title": "ENT E&D - Mission 1.5, Lap 2 - 09-06-2024 - 2024-06-09",
    "category": "Subject Wise / Mixed",
    "file": "ENT_ED_-_Mission_15_Lap_2_-_09-06-2024_-_2024-06-09.json",
    "questions": 75
  },
  {
    "title": "ENT E&D - Mission 2.0 (Batch 2) - 17-09-2024 - 2024-09-17",
    "category": "Subject Wise / Mixed",
    "file": "ENT_ED_-_Mission_20_Batch_2_-_17-09-2024_-_2024-09-17.json",
    "questions": 50
  },
  {
    "title": "ENT E&D - Mission 2.0 (Batch 3) - 25-01-2025 - 2025-01-25",
    "category": "Subject Wise / Mixed",
    "file": "ENT_ED_-_Mission_20_Batch_3_-_25-01-2025_-_2025-01-25.json",
    "questions": 99
  },
  {
    "title": "ENT E&D - Mission 2.0, Lap 2 - 23-04-2025 - 2025-04-23",
    "category": "Subject Wise / Mixed",
    "file": "ENT_ED_-_Mission_20_Lap_2_-_23-04-2025_-_2025-04-23.json",
    "questions": 50
  },
  {
    "title": "ENT Last Month E&D - 19-07-2024 - 2024-07-18",
    "category": "Subject Wise / Mixed",
    "file": "ENT_Last_Month_ED_-_19-07-2024_-_2024-07-18.json",
    "questions": 50
  },
  {
    "title": "ENT Ophthal Psychiatry 3.0 - 2024-05-02",
    "category": "Subject Wise / Mixed",
    "file": "ENT_Ophthal_Psychiatry_30_-_2024-05-02.json",
    "questions": 100
  },
  {
    "title": "ENT Test (The Champion Batch Hyderabad) - 05-01-2025 - 2025-01-05",
    "category": "Subject Wise / Mixed",
    "file": "ENT_Test_The_Champion_Batch_Hyderabad_-_05-01-2025_-_2025-01-05.json",
    "questions": 50
  },
  {
    "title": "ENT Test (The Champion Batch Hyderabad) - 29-03-2025 - 2025-03-29",
    "category": "Subject Wise / Mixed",
    "file": "ENT_Test_The_Champion_Batch_Hyderabad_-_29-03-2025_-_2025-03-29.json",
    "questions": 75
  },
  {
    "title": "ENT Test (The Champion Batch Hyderabad) - 31-05-2024 - 2024-05-31",
    "category": "Subject Wise / Mixed",
    "file": "ENT_Test_The_Champion_Batch_Hyderabad_-_31-05-2024_-_2024-05-31.json",
    "questions": 75
  },
  {
    "title": "ENT Test (The Champion Batch Hyderabad) 11-10-2024 - 2024-10-11",
    "category": "Subject Wise / Mixed",
    "file": "ENT_Test_The_Champion_Batch_Hyderabad_11-10-2024_-_2024-10-11.json",
    "questions": 75
  },
  {
    "title": "ENT- INI CET MAY 2023",
    "category": "Subject Wise / Mixed",
    "file": "ENT-_INI_CET_MAY_2023.json",
    "questions": 5
  },
  {
    "title": "ENT-_Class_Test_With_Video_Solution",
    "category": "Subject Wise / Mixed",
    "file": "ENT-_Class_Test_With_Video_Solution.json",
    "questions": 75
  },
  {
    "title": "ENT_DVT_Revision_Test",
    "category": "Subject Wise / Mixed",
    "file": "ENT_DVT_Revision_Test.json",
    "questions": 25
  },
  {
    "title": "ENT_Dr_Deepak",
    "category": "Subject Wise / Mixed",
    "file": "ENT_Dr_Deepak.json",
    "questions": 75
  },
  {
    "title": "ENT_Dr_Deepak",
    "category": "Subject Wise / Mixed",
    "file": "ENT_Dr_Deepak_1.json",
    "questions": 75
  },
  {
    "title": "ENT_Dr_Deepak-2026",
    "category": "Subject Wise / Mixed",
    "file": "ENT_Dr_Deepak-2026.json",
    "questions": 75
  },
  {
    "title": "ENT_FMGE_PYQ",
    "category": "Subject Wise / Mixed",
    "file": "ENT_FMGE_PYQ.json",
    "questions": 83
  },
  {
    "title": "ENT_MIQ_Series",
    "category": "Subject Wise / Mixed",
    "file": "ENT_MIQ_Series.json",
    "questions": 20
  },
  {
    "title": "ENT_Surgeries-Previous_Year_Questions",
    "category": "Subject Wise / Mixed",
    "file": "ENT_Surgeries-Previous_Year_Questions.json",
    "questions": 5
  },
  {
    "title": "Ear",
    "category": "Subject Wise / Mixed",
    "file": "Ear.json",
    "questions": 319
  },
  {
    "title": "Ear-ASOM_and_CSOM__Complications",
    "category": "Subject Wise / Mixed",
    "file": "Ear-ASOM_and_CSOM__Complications.json",
    "questions": 12
  },
  {
    "title": "Ear-Anatomy_of_External__Middle__and_Internal_Ear",
    "category": "Subject Wise / Mixed",
    "file": "Ear-Anatomy_of_External__Middle__and_Internal_Ear.json",
    "questions": 23
  },
  {
    "title": "Ear-Cholesteatoma_and_CSOM",
    "category": "Subject Wise / Mixed",
    "file": "Ear-Cholesteatoma_and_CSOM.json",
    "questions": 16
  },
  {
    "title": "Ear-Disorders_of_External_Ear_and_Eustachian_Tube",
    "category": "Subject Wise / Mixed",
    "file": "Ear-Disorders_of_External_Ear_and_Eustachian_Tube.json",
    "questions": 16
  },
  {
    "title": "Ear-Facial_Nerve_and_Acoustic_Neuroma",
    "category": "Subject Wise / Mixed",
    "file": "Ear-Facial_Nerve_and_Acoustic_Neuroma.json",
    "questions": 17
  },
  {
    "title": "Ear-Hearing_Rehabilitation__Otalgia__and_Tinnitus",
    "category": "Subject Wise / Mixed",
    "file": "Ear-Hearing_Rehabilitation__Otalgia__and_Tinnitus.json",
    "questions": 8
  },
  {
    "title": "Ear-Meniere_s_Disease_and_Glomus_Tumor",
    "category": "Subject Wise / Mixed",
    "file": "Ear-Meniere_s_Disease_and_Glomus_Tumor.json",
    "questions": 15
  },
  {
    "title": "Ear-Middle_Ear_Diseases__ASOM_SOM",
    "category": "Subject Wise / Mixed",
    "file": "Ear-Middle_Ear_Diseases__ASOM_SOM.json",
    "questions": 10
  },
  {
    "title": "Ear-Otosclerosis",
    "category": "Subject Wise / Mixed",
    "file": "Ear-Otosclerosis.json",
    "questions": 10
  },
  {
    "title": "Ear-Physiology_and_Assessment_of_Hearing",
    "category": "Subject Wise / Mixed",
    "file": "Ear-Physiology_and_Assessment_of_Hearing.json",
    "questions": 23
  },
  {
    "title": "Ear-Previous_Year_Questions",
    "category": "Subject Wise / Mixed",
    "file": "Ear-Previous_Year_Questions.json",
    "questions": 112
  },
  {
    "title": "Ear-Vestibular_System__Physiology__Assessment__and_Associated_Diseases",
    "category": "Subject Wise / Mixed",
    "file": "Ear-Vestibular_System__Physiology__Assessment__and_Associated_Diseases.json",
    "questions": 16
  },
  {
    "title": "Early Pregnancy Complications",
    "category": "Subject Wise / Mixed",
    "file": "Early_Pregnancy_Complications.json",
    "questions": 121
  },
  {
    "title": "Early_Pregnancy_Complications",
    "category": "Subject Wise / Mixed",
    "file": "Early_Pregnancy_Complications_1.json",
    "questions": 24
  },
  {
    "title": "Early_Pregnancy_Complications-Previous_Year_Questions",
    "category": "Subject Wise / Mixed",
    "file": "Early_Pregnancy_Complications-Previous_Year_Questions.json",
    "questions": 13
  },
  {
    "title": "Early_Pregnancy_Complications_-_Abortions-Previous_Year_Questions",
    "category": "Subject Wise / Mixed",
    "file": "Early_Pregnancy_Complications_-_Abortions-Previous_Year_Questions.json",
    "questions": 10
  },
  {
    "title": "Eating Disorders",
    "category": "Subject Wise / Mixed",
    "file": "Eating_Disorders.json",
    "questions": 20
  },
  {
    "title": "Eating Disorders",
    "category": "Subject Wise / Mixed",
    "file": "Eating_Disorders_1.json",
    "questions": 23
  },
  {
    "title": "Eating_Disorders-Eating_disorders",
    "category": "Subject Wise / Mixed",
    "file": "Eating_Disorders-Eating_disorders.json",
    "questions": 9
  },
  {
    "title": "Eating_Disorders-Previous_Year_Questions",
    "category": "Subject Wise / Mixed",
    "file": "Eating_Disorders-Previous_Year_Questions.json",
    "questions": 7
  },
  {
    "title": "Eclampsia",
    "category": "Subject Wise / Mixed",
    "file": "Eclampsia.json",
    "questions": 23
  },
  {
    "title": "Ectopic Pregnancy",
    "category": "Subject Wise / Mixed",
    "file": "Ectopic_Pregnancy.json",
    "questions": 21
  },
  {
    "title": "Ectopic_Pregnancy",
    "category": "Subject Wise / Mixed",
    "file": "Ectopic_Pregnancy_1.json",
    "questions": 24
  },
  {
    "title": "Ectropion & Entropion",
    "category": "Subject Wise / Mixed",
    "file": "Ectropion__Entropion.json",
    "questions": 16
  },
  {
    "title": "Eczema",
    "category": "Subject Wise / Mixed",
    "file": "Eczema.json",
    "questions": 20
  },
  {
    "title": "Eczema",
    "category": "Subject Wise / Mixed",
    "file": "Eczema_1.json",
    "questions": 24
  },
  {
    "title": "Eczema-Eczema",
    "category": "Subject Wise / Mixed",
    "file": "Eczema-Eczema.json",
    "questions": 13
  },
  {
    "title": "Eczema-Previous_Year_Questions",
    "category": "Subject Wise / Mixed",
    "file": "Eczema-Previous_Year_Questions.json",
    "questions": 9
  },
  {
    "title": "Eczemas",
    "category": "Subject Wise / Mixed",
    "file": "Eczemas.json",
    "questions": 3
  },
  {
    "title": "Eczematous Disorders",
    "category": "Subject Wise / Mixed",
    "file": "Eczematous_Disorders.json",
    "questions": 24
  },
  {
    "title": "Elbow Joint",
    "category": "Subject Wise / Mixed",
    "file": "Elbow_Joint.json",
    "questions": 6
  },
  {
    "title": "Electrical Injuries",
    "category": "Subject Wise / Mixed",
    "file": "Electrical_Injuries.json",
    "questions": 6
  },
  {
    "title": "Electrocochleography & Cochlear Vs Retro-Cochlear",
    "category": "Subject Wise / Mixed",
    "file": "Electrocochleography__Cochlear_Vs_Retro-Cochlear.json",
    "questions": 9
  },
  {
    "title": "Electrolyte Abnormalities - Hypernatremia (Part 1)",
    "category": "Subject Wise / Mixed",
    "file": "Electrolyte_Abnormalities_-_Hypernatremia_Part_1.json",
    "questions": 16
  },
  {
    "title": "Electrolyte Abnormalities - Hyponatremia (Part 1)",
    "category": "Subject Wise / Mixed",
    "file": "Electrolyte_Abnormalities_-_Hyponatremia_Part_1.json",
    "questions": 23
  },
  {
    "title": "Electrolyte Abnormalities - Pottassium Disorders",
    "category": "Subject Wise / Mixed",
    "file": "Electrolyte_Abnormalities_-_Pottassium_Disorders.json",
    "questions": 17
  },
  {
    "title": "Electron_Transport_Chain__Oxidative_Phosphorylation",
    "category": "Subject Wise / Mixed",
    "file": "Electron_Transport_Chain__Oxidative_Phosphorylation.json",
    "questions": 42
  },
  {
    "title": "Elimination Round - 2023-10-02",
    "category": "Subject Wise / Mixed",
    "file": "Elimination_Round_-_2023-10-02.json",
    "questions": 50
  },
  {
    "title": "Embryology",
    "category": "Subject Wise / Mixed",
    "file": "Embryology.json",
    "questions": 72
  },
  {
    "title": "Embryology",
    "category": "Subject Wise / Mixed",
    "file": "Embryology_1.json",
    "questions": 6
  },
  {
    "title": "Embryology",
    "category": "Subject Wise / Mixed",
    "file": "Embryology_2.json",
    "questions": 16
  },
  {
    "title": "Embryology of Ear",
    "category": "Subject Wise / Mixed",
    "file": "Embryology_of_Ear.json",
    "questions": 6
  },
  {
    "title": "Embryology of Nose & Sinuses",
    "category": "Subject Wise / Mixed",
    "file": "Embryology_of_Nose__Sinuses.json",
    "questions": 13
  },
  {
    "title": "Embryology-Previous_Year_Questions",
    "category": "Subject Wise / Mixed",
    "file": "Embryology-Previous_Year_Questions.json",
    "questions": 2
  },
  {
    "title": "Emergency Contraception",
    "category": "Subject Wise / Mixed",
    "file": "Emergency_Contraception.json",
    "questions": 2
  },
  {
    "title": "Emergency_Clinical_Vignettes",
    "category": "Subject Wise / Mixed",
    "file": "Emergency_Clinical_Vignettes.json",
    "questions": 36
  },
  {
    "title": "Emergency_Medicine-Emergency_Cardiovascular_Care_Protocols__BCLS__ACLS__Mechanical_ventilation__and_Causes_of_Pulseless_Electrical_Activity",
    "category": "Subject Wise / Mixed",
    "file": "Emergency_Medicine-Emergency_Cardiovascular_Care_Protocols__BCLS__ACLS__Mechanical_ventilation__and_Causes_of_Pulseless_Electrical_Activity.json",
    "questions": 13
  },
  {
    "title": "Emergency_Medicine-Massive_Transfusion_Protocol__ARDS__Snakebite__AHA_updates__Altitude_Sickness",
    "category": "Subject Wise / Mixed",
    "file": "Emergency_Medicine-Massive_Transfusion_Protocol__ARDS__Snakebite__AHA_updates__Altitude_Sickness.json",
    "questions": 18
  },
  {
    "title": "Emergency_Medicine-Previous_Year_Questions",
    "category": "Subject Wise / Mixed",
    "file": "Emergency_Medicine-Previous_Year_Questions.json",
    "questions": 17
  },
  {
    "title": "Emergency_Medicine-Previous_Year_Questions",
    "category": "Subject Wise / Mixed",
    "file": "Emergency_Medicine-Previous_Year_Questions_1.json",
    "questions": 17
  },
  {
    "title": "Emphysema",
    "category": "Subject Wise / Mixed",
    "file": "Emphysema.json",
    "questions": 6
  },
  {
    "title": "Endocrine",
    "category": "Subject Wise / Mixed",
    "file": "Endocrine.json",
    "questions": 101
  },
  {
    "title": "Endocrine System",
    "category": "Subject Wise / Mixed",
    "file": "Endocrine_System.json",
    "questions": 74
  },
  {
    "title": "Endocrine Tumors of Pancreas & MEN Syndromes",
    "category": "Subject Wise / Mixed",
    "file": "Endocrine_Tumors_of_Pancreas__MEN_Syndromes.json",
    "questions": 22
  },
  {
    "title": "Endocrine_Pharmacology-Antithyroid_Drugs",
    "category": "Subject Wise / Mixed",
    "file": "Endocrine_Pharmacology-Antithyroid_Drugs.json",
    "questions": 7
  },
  {
    "title": "Endocrine_Pharmacology-Corticosteroids_and_Sex_Hormones",
    "category": "Subject Wise / Mixed",
    "file": "Endocrine_Pharmacology-Corticosteroids_and_Sex_Hormones.json",
    "questions": 15
  },
  {
    "title": "Endocrine_Pharmacology-HPA_Axis_and_Drugs_acting_on_Bone_and_Osteoporosis",
    "category": "Subject Wise / Mixed",
    "file": "Endocrine_Pharmacology-HPA_Axis_and_Drugs_acting_on_Bone_and_Osteoporosis.json",
    "questions": 19
  },
  {
    "title": "Endocrine_Pharmacology-Oral_Hypoglycemic_Drugs",
    "category": "Subject Wise / Mixed",
    "file": "Endocrine_Pharmacology-Oral_Hypoglycemic_Drugs.json",
    "questions": 17
  },
  {
    "title": "Endocrine_Pharmacology-Parenteral_Hypoglycemic_Drugs",
    "category": "Subject Wise / Mixed",
    "file": "Endocrine_Pharmacology-Parenteral_Hypoglycemic_Drugs.json",
    "questions": 10
  },
  {
    "title": "Endocrine_Pharmacology-Previous_Year_Questions",
    "category": "Subject Wise / Mixed",
    "file": "Endocrine_Pharmacology-Previous_Year_Questions.json",
    "questions": 55
  },
  {
    "title": "Endocrine_Physiology-Previous_Year_Questions",
    "category": "Subject Wise / Mixed",
    "file": "Endocrine_Physiology-Previous_Year_Questions.json",
    "questions": 4
  },
  {
    "title": "Endocrine_Surgery-Breast-I",
    "category": "Subject Wise / Mixed",
    "file": "Endocrine_Surgery-Breast-I.json",
    "questions": 21
  },
  {
    "title": "Endocrine_Surgery-Breast-II",
    "category": "Subject Wise / Mixed",
    "file": "Endocrine_Surgery-Breast-II.json",
    "questions": 20
  },
  {
    "title": "Endocrine_Surgery-Parathyroid_and_Adrenal_Glands",
    "category": "Subject Wise / Mixed",
    "file": "Endocrine_Surgery-Parathyroid_and_Adrenal_Glands.json",
    "questions": 21
  },
  {
    "title": "Endocrine_Surgery-Previous_Year_Questions",
    "category": "Subject Wise / Mixed",
    "file": "Endocrine_Surgery-Previous_Year_Questions.json",
    "questions": 86
  },
  {
    "title": "Endocrine_Surgery-Thyroid-I",
    "category": "Subject Wise / Mixed",
    "file": "Endocrine_Surgery-Thyroid-I.json",
    "questions": 21
  },
  {
    "title": "Endocrine_Surgery-Thyroid-II",
    "category": "Subject Wise / Mixed",
    "file": "Endocrine_Surgery-Thyroid-II.json",
    "questions": 20
  },
  {
    "title": "Endocrine_System",
    "category": "Subject Wise / Mixed",
    "file": "Endocrine_System_1.json",
    "questions": 22
  },
  {
    "title": "Endocrine_System-Adrenal_Physiology_and_Calcium_Regulation",
    "category": "Subject Wise / Mixed",
    "file": "Endocrine_System-Adrenal_Physiology_and_Calcium_Regulation.json",
    "questions": 15
  },
  {
    "title": "Endocrine_System-Hormone_Mechanism___Pituitary_hormone",
    "category": "Subject Wise / Mixed",
    "file": "Endocrine_System-Hormone_Mechanism___Pituitary_hormone.json",
    "questions": 22
  },
  {
    "title": "Endocrine_System-Previous_Year_Questions",
    "category": "Subject Wise / Mixed",
    "file": "Endocrine_System-Previous_Year_Questions.json",
    "questions": 56
  },
  {
    "title": "Endocrine_System-Thyroid_Hormones___Endocrine_Pancreas",
    "category": "Subject Wise / Mixed",
    "file": "Endocrine_System-Thyroid_Hormones___Endocrine_Pancreas.json",
    "questions": 21
  },
  {
    "title": "Endocrine_and_Reproductive_Physiology",
    "category": "Subject Wise / Mixed",
    "file": "Endocrine_and_Reproductive_Physiology.json",
    "questions": 5
  },
  {
    "title": "Endocrine_system_and_Breast",
    "category": "Subject Wise / Mixed",
    "file": "Endocrine_system_and_Breast.json",
    "questions": 27
  },
  {
    "title": "Endocrinology",
    "category": "Subject Wise / Mixed",
    "file": "Endocrinology.json",
    "questions": 76
  },
  {
    "title": "Endocrinology",
    "category": "Subject Wise / Mixed",
    "file": "Endocrinology_1.json",
    "questions": 21
  },
  {
    "title": "Endocrinology",
    "category": "Subject Wise / Mixed",
    "file": "Endocrinology_2.json",
    "questions": 36
  },
  {
    "title": "Endocrinology",
    "category": "Subject Wise / Mixed",
    "file": "Endocrinology_3.json",
    "questions": 36
  },
  {
    "title": "Endocrinology-DKA_and_Hyperosmolar_Coma__Pancreatic_Neuroendocrine_Tumors",
    "category": "Subject Wise / Mixed",
    "file": "Endocrinology-DKA_and_Hyperosmolar_Coma__Pancreatic_Neuroendocrine_Tumors.json",
    "questions": 18
  },
  {
    "title": "Endocrinology-Diabetes_Mellitus-I",
    "category": "Subject Wise / Mixed",
    "file": "Endocrinology-Diabetes_Mellitus-I.json",
    "questions": 19
  },
  {
    "title": "Endocrinology-Diabetes_Mellitus-II",
    "category": "Subject Wise / Mixed",
    "file": "Endocrinology-Diabetes_Mellitus-II.json",
    "questions": 19
  },
  {
    "title": "Endocrinology-Diseases_of_Anterior_Pituitary",
    "category": "Subject Wise / Mixed",
    "file": "Endocrinology-Diseases_of_Anterior_Pituitary.json",
    "questions": 16
  },
  {
    "title": "Endocrinology-Diseases_of_Thyroid",
    "category": "Subject Wise / Mixed",
    "file": "Endocrinology-Diseases_of_Thyroid.json",
    "questions": 16
  },
  {
    "title": "Endocrinology-Disorders_of_Adrenal_Gland_and_Cushing_Syndrome",
    "category": "Subject Wise / Mixed",
    "file": "Endocrinology-Disorders_of_Adrenal_Gland_and_Cushing_Syndrome.json",
    "questions": 20
  },
  {
    "title": "Endocrinology-Disorders_of_Parathyroid_Gland_and_MEN_Syndromes",
    "category": "Subject Wise / Mixed",
    "file": "Endocrinology-Disorders_of_Parathyroid_Gland_and_MEN_Syndromes.json",
    "questions": 16
  },
  {
    "title": "Endocrinology-Parathyroid__Pituitary__and_Adrenal_Glands",
    "category": "Subject Wise / Mixed",
    "file": "Endocrinology-Parathyroid__Pituitary__and_Adrenal_Glands.json",
    "questions": 14
  },
  {
    "title": "Endocrinology-Previous_Year_Questions",
    "category": "Subject Wise / Mixed",
    "file": "Endocrinology-Previous_Year_Questions.json",
    "questions": 16
  },
  {
    "title": "Endocrinology-Previous_Year_Questions",
    "category": "Subject Wise / Mixed",
    "file": "Endocrinology-Previous_Year_Questions_1.json",
    "questions": 16
  },
  {
    "title": "Endocrinology-Thyroid_Gland",
    "category": "Subject Wise / Mixed",
    "file": "Endocrinology-Thyroid_Gland.json",
    "questions": 14
  },
  {
    "title": "Endocrinology_Clinical_Vignettes",
    "category": "Subject Wise / Mixed",
    "file": "Endocrinology_Clinical_Vignettes.json",
    "questions": 109
  },
  {
    "title": "Endocrinology__Reproductive",
    "category": "Subject Wise / Mixed",
    "file": "Endocrinology__Reproductive.json",
    "questions": 20
  },
  {
    "title": "Endometrial Carcinoma",
    "category": "Subject Wise / Mixed",
    "file": "Endometrial_Carcinoma.json",
    "questions": 11
  },
  {
    "title": "Endometrial_Cancer",
    "category": "Subject Wise / Mixed",
    "file": "Endometrial_Cancer.json",
    "questions": 24
  },
  {
    "title": "Endometrial_Hyperplasia___Polyps-Previous_Year_Questions",
    "category": "Subject Wise / Mixed",
    "file": "Endometrial_Hyperplasia___Polyps-Previous_Year_Questions.json",
    "questions": 1
  },
  {
    "title": "Endometriosis",
    "category": "Subject Wise / Mixed",
    "file": "Endometriosis.json",
    "questions": 10
  },
  {
    "title": "Endometriosis",
    "category": "Subject Wise / Mixed",
    "file": "Endometriosis_1.json",
    "questions": 23
  },
  {
    "title": "Endometriosis-Previous_Year_Questions",
    "category": "Subject Wise / Mixed",
    "file": "Endometriosis-Previous_Year_Questions.json",
    "questions": 5
  },
  {
    "title": "Entomology",
    "category": "Subject Wise / Mixed",
    "file": "Entomology.json",
    "questions": 26
  },
  {
    "title": "Entrapment Neuropathies",
    "category": "Subject Wise / Mixed",
    "file": "Entrapment_Neuropathies.json",
    "questions": 11
  },
  {
    "title": "Environment & Health",
    "category": "Subject Wise / Mixed",
    "file": "Environment__Health.json",
    "questions": 30
  },
  {
    "title": "Environment and Health",
    "category": "Subject Wise / Mixed",
    "file": "Environment_and_Health.json",
    "questions": 109
  },
  {
    "title": "Environment_and_Health-Air__Light__Sound__and_Radiation",
    "category": "Subject Wise / Mixed",
    "file": "Environment_and_Health-Air__Light__Sound__and_Radiation.json",
    "questions": 16
  },
  {
    "title": "Environment_and_Health-Entomology",
    "category": "Subject Wise / Mixed",
    "file": "Environment_and_Health-Entomology.json",
    "questions": 12
  },
  {
    "title": "Environment_and_Health-Previous_Year_Questions",
    "category": "Subject Wise / Mixed",
    "file": "Environment_and_Health-Previous_Year_Questions.json",
    "questions": 34
  },
  {
    "title": "Environment_and_Health-Water-_Introduction_and_Purification",
    "category": "Subject Wise / Mixed",
    "file": "Environment_and_Health-Water-_Introduction_and_Purification.json",
    "questions": 15
  },
  {
    "title": "Enzyme",
    "category": "Subject Wise / Mixed",
    "file": "Enzyme.json",
    "questions": 46
  },
  {
    "title": "Enzyme Kinetics & Enzyme Inhibition",
    "category": "Subject Wise / Mixed",
    "file": "Enzyme_Kinetics__Enzyme_Inhibition.json",
    "questions": 13
  },
  {
    "title": "Enzyme Regulation & Uses of Enzymes",
    "category": "Subject Wise / Mixed",
    "file": "Enzyme_Regulation__Uses_of_Enzymes.json",
    "questions": 13
  },
  {
    "title": "Enzymes",
    "category": "Subject Wise / Mixed",
    "file": "Enzymes.json",
    "questions": 90
  },
  {
    "title": "Enzymes Basics & Classification",
    "category": "Subject Wise / Mixed",
    "file": "Enzymes_Basics__Classification.json",
    "questions": 13
  },
  {
    "title": "Enzymes-Enzymes",
    "category": "Subject Wise / Mixed",
    "file": "Enzymes-Enzymes.json",
    "questions": 25
  },
  {
    "title": "Enzymes-Previous_Year_Questions",
    "category": "Subject Wise / Mixed",
    "file": "Enzymes-Previous_Year_Questions.json",
    "questions": 29
  },
  {
    "title": "Epidemiology",
    "category": "Subject Wise / Mixed",
    "file": "Epidemiology.json",
    "questions": 17
  },
  {
    "title": "Epidemiology",
    "category": "Subject Wise / Mixed",
    "file": "Epidemiology_1.json",
    "questions": 149
  },
  {
    "title": "Epidemiology-Basics_of_Epidemiology",
    "category": "Subject Wise / Mixed",
    "file": "Epidemiology-Basics_of_Epidemiology.json",
    "questions": 11
  },
  {
    "title": "Epidemiology-Bias_and_confounders",
    "category": "Subject Wise / Mixed",
    "file": "Epidemiology-Bias_and_confounders.json",
    "questions": 9
  },
  {
    "title": "Epidemiology-Previous_Year_Questions",
    "category": "Subject Wise / Mixed",
    "file": "Epidemiology-Previous_Year_Questions.json",
    "questions": 69
  },
  {
    "title": "Epidemiology-Study_Designs_in_Epidemology",
    "category": "Subject Wise / Mixed",
    "file": "Epidemiology-Study_Designs_in_Epidemology.json",
    "questions": 31
  },
  {
    "title": "Epidemiology-Systematic_Review__Meta-Analysis__and_Evidence-Based_Studies",
    "category": "Subject Wise / Mixed",
    "file": "Epidemiology-Systematic_Review__Meta-Analysis__and_Evidence-Based_Studies.json",
    "questions": 6
  },
  {
    "title": "Epiglottitis & Croup",
    "category": "Subject Wise / Mixed",
    "file": "Epiglottitis__Croup.json",
    "questions": 9
  },
  {
    "title": "Epistaxis",
    "category": "Subject Wise / Mixed",
    "file": "Epistaxis.json",
    "questions": 5
  },
  {
    "title": "Epistaxis & Deviated Nasal Septum",
    "category": "Subject Wise / Mixed",
    "file": "Epistaxis__Deviated_Nasal_Septum.json",
    "questions": 29
  },
  {
    "title": "Epithelial Ovarian Cancer",
    "category": "Subject Wise / Mixed",
    "file": "Epithelial_Ovarian_Cancer.json",
    "questions": 22
  },
  {
    "title": "Eponym\u2019s of fractures",
    "category": "Subject Wise / Mixed",
    "file": "Eponyms_of_fractures.json",
    "questions": 5
  },
  {
    "title": "Esophageal Disorders & Dysphagia",
    "category": "Subject Wise / Mixed",
    "file": "Esophageal_Disorders__Dysphagia.json",
    "questions": 22
  },
  {
    "title": "Esophageal Disorders & Foreign Body Ingestion",
    "category": "Subject Wise / Mixed",
    "file": "Esophageal_Disorders__Foreign_Body_Ingestion.json",
    "questions": 6
  },
  {
    "title": "Esophagus",
    "category": "Subject Wise / Mixed",
    "file": "Esophagus.json",
    "questions": 60
  },
  {
    "title": "Esophagus & Stomach",
    "category": "Subject Wise / Mixed",
    "file": "Esophagus__Stomach.json",
    "questions": 18
  },
  {
    "title": "Esophagus ( Gerd & Functional Disorders )",
    "category": "Subject Wise / Mixed",
    "file": "Esophagus__Gerd__Functional_Disorders.json",
    "questions": 22
  },
  {
    "title": "Esophagus (Carcinoma Esophagus)",
    "category": "Subject Wise / Mixed",
    "file": "Esophagus_Carcinoma_Esophagus.json",
    "questions": 26
  },
  {
    "title": "Esophagus (Esophageal Injury & Other Common Conditions)",
    "category": "Subject Wise / Mixed",
    "file": "Esophagus_Esophageal_Injury__Other_Common_Conditions.json",
    "questions": 18
  },
  {
    "title": "Esophagus (Surgical Anatomy & Investigation)",
    "category": "Subject Wise / Mixed",
    "file": "Esophagus_Surgical_Anatomy__Investigation.json",
    "questions": 35
  },
  {
    "title": "Essential Thromobocythemia",
    "category": "Subject Wise / Mixed",
    "file": "Essential_Thromobocythemia.json",
    "questions": 1
  },
  {
    "title": "Ethanol Pharmacology",
    "category": "Subject Wise / Mixed",
    "file": "Ethanol_Pharmacology.json",
    "questions": 7
  },
  {
    "title": "Evaluation Of Comitant Squint",
    "category": "Subject Wise / Mixed",
    "file": "Evaluation_Of_Comitant_Squint.json",
    "questions": 11
  },
  {
    "title": "Evidence",
    "category": "Subject Wise / Mixed",
    "file": "Evidence.json",
    "questions": 8
  },
  {
    "title": "Evisceration & Enucleation",
    "category": "Subject Wise / Mixed",
    "file": "Evisceration__Enucleation.json",
    "questions": 2
  },
  {
    "title": "Excitation Conduction Cardiac Vectors",
    "category": "Subject Wise / Mixed",
    "file": "Excitation_Conduction_Cardiac_Vectors.json",
    "questions": 20
  },
  {
    "title": "Exclusively for 1st Prof Students - 24-11-2024 - 2024-11-24",
    "category": "Subject Wise / Mixed",
    "file": "Exclusively_for_1st_Prof_Students_-_24-11-2024_-_2024-11-24.json",
    "questions": 30
  },
  {
    "title": "Excretory_Physiology-Previous_Year_Questions",
    "category": "Subject Wise / Mixed",
    "file": "Excretory_Physiology-Previous_Year_Questions.json",
    "questions": 9
  },
  {
    "title": "Explosion Injuries",
    "category": "Subject Wise / Mixed",
    "file": "Explosion_Injuries.json",
    "questions": 3
  },
  {
    "title": "External_Ear_Diseases",
    "category": "Subject Wise / Mixed",
    "file": "External_Ear_Diseases.json",
    "questions": 5
  },
  {
    "title": "External_Ear_and_its_Diseases",
    "category": "Subject Wise / Mixed",
    "file": "External_Ear_and_its_Diseases.json",
    "questions": 23
  },
  {
    "title": "Extra Advantage Series",
    "category": "Subject Wise / Mixed",
    "file": "Extra_Advantage_Series.json",
    "questions": 188
  },
  {
    "title": "Extracranial Complications & Labyrinthitis",
    "category": "Subject Wise / Mixed",
    "file": "Extracranial_Complications__Labyrinthitis.json",
    "questions": 2
  },
  {
    "title": "Extracranial Complications & Mastoiditis",
    "category": "Subject Wise / Mixed",
    "file": "Extracranial_Complications__Mastoiditis.json",
    "questions": 12
  },
  {
    "title": "Eye Changes After Death",
    "category": "Subject Wise / Mixed",
    "file": "Eye_Changes_After_Death.json",
    "questions": 10
  },
  {
    "title": "FFFA",
    "category": "Subject Wise / Mixed",
    "file": "FFFA.json",
    "questions": 10
  },
  {
    "title": "FM - INI CET JULY 2021",
    "category": "Subject Wise / Mixed",
    "file": "FM_-_INI_CET_JULY_2021.json",
    "questions": 10
  },
  {
    "title": "FM - INI CET MAY 2022",
    "category": "Subject Wise / Mixed",
    "file": "FM_-_INI_CET_MAY_2022.json",
    "questions": 9
  },
  {
    "title": "FM - INI CET NOV 2020",
    "category": "Subject Wise / Mixed",
    "file": "FM_-_INI_CET_NOV_2020.json",
    "questions": 8
  },
  {
    "title": "FM - INI CET NOV 2021",
    "category": "Subject Wise / Mixed",
    "file": "FM_-_INI_CET_NOV_2021.json",
    "questions": 9
  },
  {
    "title": "FM E&D - Mission 1.5 - 01-04-2024 - 2024-04-01",
    "category": "Subject Wise / Mixed",
    "file": "FM_ED_-_Mission_15_-_01-04-2024_-_2024-04-01.json",
    "questions": 75
  },
  {
    "title": "FM E&D - Mission 1.5, Lap 2 - 01-06-2024 - 2024-06-01",
    "category": "Subject Wise / Mixed",
    "file": "FM_ED_-_Mission_15_Lap_2_-_01-06-2024_-_2024-06-01.json",
    "questions": 50
  },
  {
    "title": "FM E&D - Mission 2.0 (Batch 2) - 22-12-2024 - 2024-12-22",
    "category": "Subject Wise / Mixed",
    "file": "FM_ED_-_Mission_20_Batch_2_-_22-12-2024_-_2024-12-22.json",
    "questions": 75
  },
  {
    "title": "FM E&D - Mission 2.0 (Batch 3) - 29-12-2024 - 2024-12-29",
    "category": "Subject Wise / Mixed",
    "file": "FM_ED_-_Mission_20_Batch_3_-_29-12-2024_-_2024-12-29.json",
    "questions": 75
  },
  {
    "title": "FM E&D - Mission 2.0, Lap 2 - 13-04-2025 - 2025-04-13",
    "category": "Subject Wise / Mixed",
    "file": "FM_ED_-_Mission_20_Lap_2_-_13-04-2025_-_2025-04-13.json",
    "questions": 50
  },
  {
    "title": "FMGE Aug 2020",
    "category": "Subject Wise / Mixed",
    "file": "FMGE_Aug_2020.json",
    "questions": 296
  },
  {
    "title": "FMGE Aug 2020 - 2020-08-31",
    "category": "Subject Wise / Mixed",
    "file": "FMGE_Aug_2020_-_2020-08-31.json",
    "questions": 241
  },
  {
    "title": "FMGE Dec 2018",
    "category": "Subject Wise / Mixed",
    "file": "FMGE_Dec_2018.json",
    "questions": 300
  },
  {
    "title": "FMGE Dec 2019",
    "category": "Subject Wise / Mixed",
    "file": "FMGE_Dec_2019.json",
    "questions": 299
  },
  {
    "title": "FMGE Dec 2020",
    "category": "Subject Wise / Mixed",
    "file": "FMGE_Dec_2020.json",
    "questions": 298
  },
  {
    "title": "FMGE Dec 2020 - 2020-12-04",
    "category": "Subject Wise / Mixed",
    "file": "FMGE_Dec_2020_-_2020-12-04.json",
    "questions": 239
  },
  {
    "title": "FMGE Dec 2021",
    "category": "Subject Wise / Mixed",
    "file": "FMGE_Dec_2021.json",
    "questions": 298
  },
  {
    "title": "FMGE Dec 2021 - 2021-12-12",
    "category": "Subject Wise / Mixed",
    "file": "FMGE_Dec_2021_-_2021-12-12.json",
    "questions": 250
  },
  {
    "title": "FMGE Jan 2023",
    "category": "Subject Wise / Mixed",
    "file": "FMGE_Jan_2023.json",
    "questions": 299
  },
  {
    "title": "FMGE Jan 2023 - 2023-01-20",
    "category": "Subject Wise / Mixed",
    "file": "FMGE_Jan_2023_-_2023-01-20.json",
    "questions": 255
  },
  {
    "title": "FMGE Jan 2024 - 2024-01-20",
    "category": "Subject Wise / Mixed",
    "file": "FMGE_Jan_2024_-_2024-01-20.json",
    "questions": 397
  },
  {
    "title": "FMGE Jan 2024 Part 1",
    "category": "Subject Wise / Mixed",
    "file": "FMGE_Jan_2024_Part_1.json",
    "questions": 150
  },
  {
    "title": "FMGE Jan 2024 Part 2",
    "category": "Subject Wise / Mixed",
    "file": "FMGE_Jan_2024_Part_2.json",
    "questions": 150
  },
  {
    "title": "FMGE Jan 2025",
    "category": "Subject Wise / Mixed",
    "file": "FMGE_Jan_2025.json",
    "questions": 300
  },
  {
    "title": "FMGE Jan 2025 - 2025-01-12",
    "category": "Subject Wise / Mixed",
    "file": "FMGE_Jan_2025_-_2025-01-12.json",
    "questions": 313
  },
  {
    "title": "FMGE Jan 2025 Part 1",
    "category": "Subject Wise / Mixed",
    "file": "FMGE_Jan_2025_Part_1.json",
    "questions": 150
  },
  {
    "title": "FMGE Jan 2025 Part 2",
    "category": "Subject Wise / Mixed",
    "file": "FMGE_Jan_2025_Part_2.json",
    "questions": 150
  },
  {
    "title": "FMGE July 2023",
    "category": "Subject Wise / Mixed",
    "file": "FMGE_July_2023.json",
    "questions": 282
  },
  {
    "title": "FMGE July 2023 - 2023-07-30",
    "category": "Subject Wise / Mixed",
    "file": "FMGE_July_2023_-_2023-07-30.json",
    "questions": 300
  },
  {
    "title": "FMGE July 2024 - 2024-07-06",
    "category": "Subject Wise / Mixed",
    "file": "FMGE_July_2024_-_2024-07-06.json",
    "questions": 300
  },
  {
    "title": "FMGE June 2019",
    "category": "Subject Wise / Mixed",
    "file": "FMGE_June_2019.json",
    "questions": 63
  },
  {
    "title": "FMGE June 2021",
    "category": "Subject Wise / Mixed",
    "file": "FMGE_June_2021.json",
    "questions": 300
  },
  {
    "title": "FMGE June 2021 - 2021-06-18",
    "category": "Subject Wise / Mixed",
    "file": "FMGE_June_2021_-_2021-06-18.json",
    "questions": 273
  },
  {
    "title": "FMGE June 2022",
    "category": "Subject Wise / Mixed",
    "file": "FMGE_June_2022.json",
    "questions": 254
  },
  {
    "title": "FMGE June 2022 - 2022-06-04",
    "category": "Subject Wise / Mixed",
    "file": "FMGE_June_2022_-_2022-06-04.json",
    "questions": 243
  },
  {
    "title": "FMGE June 2024 Part 1",
    "category": "Subject Wise / Mixed",
    "file": "FMGE_June_2024_Part_1.json",
    "questions": 150
  },
  {
    "title": "FMGE June 2024 Part 2",
    "category": "Subject Wise / Mixed",
    "file": "FMGE_June_2024_Part_2.json",
    "questions": 150
  },
  {
    "title": "FMGE_2024_July_Paper_1",
    "category": "Subject Wise / Mixed",
    "file": "FMGE_2024_July_Paper_1.json",
    "questions": 150
  },
  {
    "title": "FMGE_2024_July_Paper_2",
    "category": "Subject Wise / Mixed",
    "file": "FMGE_2024_July_Paper_2.json",
    "questions": 150
  },
  {
    "title": "FMGE_2025_Jan_Paper_1",
    "category": "Subject Wise / Mixed",
    "file": "FMGE_2025_Jan_Paper_1.json",
    "questions": 150
  },
  {
    "title": "FMGE_2025_Jan_Paper_2",
    "category": "Subject Wise / Mixed",
    "file": "FMGE_2025_Jan_Paper_2.json",
    "questions": 150
  },
  {
    "title": "FMGE_CT-_Anesthesia_Dr_Anshul",
    "category": "Subject Wise / Mixed",
    "file": "FMGE_CT-_Anesthesia_Dr_Anshul.json",
    "questions": 40
  },
  {
    "title": "FMGE_CT-_Dermatology_Dr_Chesta",
    "category": "Subject Wise / Mixed",
    "file": "FMGE_CT-_Dermatology_Dr_Chesta.json",
    "questions": 40
  },
  {
    "title": "FMGE_CT_-_Biochemistry",
    "category": "Subject Wise / Mixed",
    "file": "FMGE_CT_-_Biochemistry.json",
    "questions": 40
  },
  {
    "title": "FMGE_CT_-_FMT",
    "category": "Subject Wise / Mixed",
    "file": "FMGE_CT_-_FMT.json",
    "questions": 40
  },
  {
    "title": "FMGE_CT_-_Medicine_CNS",
    "category": "Subject Wise / Mixed",
    "file": "FMGE_CT_-_Medicine_CNS.json",
    "questions": 40
  },
  {
    "title": "FMGE_CT_-_Medicine_Gastro__Endo",
    "category": "Subject Wise / Mixed",
    "file": "FMGE_CT_-_Medicine_Gastro__Endo.json",
    "questions": 40
  },
  {
    "title": "FMGE_CT_-_Paediatrics",
    "category": "Subject Wise / Mixed",
    "file": "FMGE_CT_-_Paediatrics.json",
    "questions": 43
  },
  {
    "title": "FMGE_CT_-_Psychiatry",
    "category": "Subject Wise / Mixed",
    "file": "FMGE_CT_-_Psychiatry.json",
    "questions": 40
  },
  {
    "title": "FMGE_CT_-_Surgery_General__Urology",
    "category": "Subject Wise / Mixed",
    "file": "FMGE_CT_-_Surgery_General__Urology.json",
    "questions": 40
  },
  {
    "title": "FMGE_CT_-__Surgery_HBP",
    "category": "Subject Wise / Mixed",
    "file": "FMGE_CT_-__Surgery_HBP.json",
    "questions": 40
  },
  {
    "title": "FMGE_Dec_CT_-_Pathology_Gen_Hema",
    "category": "Subject Wise / Mixed",
    "file": "FMGE_Dec_CT_-_Pathology_Gen_Hema.json",
    "questions": 40
  },
  {
    "title": "FMGE_Dec_CT_-_Pharmacology",
    "category": "Subject Wise / Mixed",
    "file": "FMGE_Dec_CT_-_Pharmacology.json",
    "questions": 50
  },
  {
    "title": "FMGE_EndoGITRhumat_Dr_Rahul",
    "category": "Subject Wise / Mixed",
    "file": "FMGE_EndoGITRhumat_Dr_Rahul.json",
    "questions": 45
  },
  {
    "title": "FMGE_MOCK_PAPER_-1_JULY_2025",
    "category": "Subject Wise / Mixed",
    "file": "FMGE_MOCK_PAPER_-1_JULY_2025.json",
    "questions": 150
  },
  {
    "title": "FMGE_MOCK_PAPER_-2_JULY_2025",
    "category": "Subject Wise / Mixed",
    "file": "FMGE_MOCK_PAPER_-2_JULY_2025.json",
    "questions": 150
  },
  {
    "title": "FMGE_Mini_Mock_Test_OphtalmologyENTPathologyPediatrics",
    "category": "Subject Wise / Mixed",
    "file": "FMGE_Mini_Mock_Test_OphtalmologyENTPathologyPediatrics.json",
    "questions": 80
  },
  {
    "title": "FMGE_Mock_1_Paper_1",
    "category": "Subject Wise / Mixed",
    "file": "FMGE_Mock_1_Paper_1.json",
    "questions": 150
  },
  {
    "title": "FMGE_Mock_1_Paper_2",
    "category": "Subject Wise / Mixed",
    "file": "FMGE_Mock_1_Paper_2.json",
    "questions": 150
  },
  {
    "title": "FMGE_Mock_2_Paper_1",
    "category": "Subject Wise / Mixed",
    "file": "FMGE_Mock_2_Paper_1.json",
    "questions": 150
  },
  {
    "title": "FMGE_Mock_2_Paper_2",
    "category": "Subject Wise / Mixed",
    "file": "FMGE_Mock_2_Paper_2.json",
    "questions": 150
  },
  {
    "title": "FMGE_Mock_3_Paper_1",
    "category": "Subject Wise / Mixed",
    "file": "FMGE_Mock_3_Paper_1.json",
    "questions": 150
  },
  {
    "title": "FMGE_Mock_3_Paper_2",
    "category": "Subject Wise / Mixed",
    "file": "FMGE_Mock_3_Paper_2.json",
    "questions": 150
  },
  {
    "title": "FMGE_Mock_4_Paper_1",
    "category": "Subject Wise / Mixed",
    "file": "FMGE_Mock_4_Paper_1.json",
    "questions": 150
  },
  {
    "title": "FMGE_Mock_4_Paper_2",
    "category": "Subject Wise / Mixed",
    "file": "FMGE_Mock_4_Paper_2.json",
    "questions": 150
  },
  {
    "title": "FMGE_Mock_5_Paper_1",
    "category": "Subject Wise / Mixed",
    "file": "FMGE_Mock_5_Paper_1.json",
    "questions": 150
  },
  {
    "title": "FMGE_Mock_5_Paper_2",
    "category": "Subject Wise / Mixed",
    "file": "FMGE_Mock_5_Paper_2.json",
    "questions": 150
  },
  {
    "title": "FMGE_Mock_6_Paper_1",
    "category": "Subject Wise / Mixed",
    "file": "FMGE_Mock_6_Paper_1.json",
    "questions": 150
  },
  {
    "title": "FMGE_Mock_6_Paper_2",
    "category": "Subject Wise / Mixed",
    "file": "FMGE_Mock_6_Paper_2.json",
    "questions": 150
  },
  {
    "title": "FMT",
    "category": "Subject Wise / Mixed",
    "file": "FMT.json",
    "questions": 100
  },
  {
    "title": "FMT-Clinical_Vignettes",
    "category": "Subject Wise / Mixed",
    "file": "FMT-Clinical_Vignettes.json",
    "questions": 53
  },
  {
    "title": "FMT-_Class_Test_With_Video_Solution",
    "category": "Subject Wise / Mixed",
    "file": "FMT-_Class_Test_With_Video_Solution.json",
    "questions": 50
  },
  {
    "title": "FMT_DVT_Revision_Test",
    "category": "Subject Wise / Mixed",
    "file": "FMT_DVT_Revision_Test.json",
    "questions": 25
  },
  {
    "title": "FMT_Dr_Mohit",
    "category": "Subject Wise / Mixed",
    "file": "FMT_Dr_Mohit.json",
    "questions": 40
  },
  {
    "title": "FMT_Dr_Mohit-2026",
    "category": "Subject Wise / Mixed",
    "file": "FMT_Dr_Mohit-2026.json",
    "questions": 100
  },
  {
    "title": "FMT_Dr_Mohit-2026",
    "category": "Subject Wise / Mixed",
    "file": "FMT_Dr_Mohit-2026_1.json",
    "questions": 100
  },
  {
    "title": "FMT_Dr_Mohit_FMGE_CT",
    "category": "Subject Wise / Mixed",
    "file": "FMT_Dr_Mohit_FMGE_CT.json",
    "questions": 40
  },
  {
    "title": "FMT_Dr_Mohit_Gupta",
    "category": "Subject Wise / Mixed",
    "file": "FMT_Dr_Mohit_Gupta.json",
    "questions": 50
  },
  {
    "title": "FMT_FMGE_PYQ",
    "category": "Subject Wise / Mixed",
    "file": "FMT_FMGE_PYQ.json",
    "questions": 83
  },
  {
    "title": "FMT_IBQ",
    "category": "Subject Wise / Mixed",
    "file": "FMT_IBQ.json",
    "questions": 20
  },
  {
    "title": "FMT_Image_Based_Question",
    "category": "Subject Wise / Mixed",
    "file": "FMT_Image_Based_Question.json",
    "questions": 20
  },
  {
    "title": "FSGS",
    "category": "Subject Wise / Mixed",
    "file": "FSGS.json",
    "questions": 5
  },
  {
    "title": "Facial Nerve & Vestibulocochlear Nerve Anatomy",
    "category": "Subject Wise / Mixed",
    "file": "Facial_Nerve__Vestibulocochlear_Nerve_Anatomy.json",
    "questions": 12
  },
  {
    "title": "Facial Nerve Paralysis",
    "category": "Subject Wise / Mixed",
    "file": "Facial_Nerve_Paralysis.json",
    "questions": 9
  },
  {
    "title": "Facial_Injuries_and_Abnormalities",
    "category": "Subject Wise / Mixed",
    "file": "Facial_Injuries_and_Abnormalities.json",
    "questions": 3
  },
  {
    "title": "Facial_Nerve_and_its_Disorders",
    "category": "Subject Wise / Mixed",
    "file": "Facial_Nerve_and_its_Disorders.json",
    "questions": 6
  },
  {
    "title": "Factors Influencing Labour_ Power & Passenger",
    "category": "Subject Wise / Mixed",
    "file": "Factors_Influencing_Labour__Power__Passenger.json",
    "questions": 12
  },
  {
    "title": "Family Planning and Contraception",
    "category": "Subject Wise / Mixed",
    "file": "Family_Planning_and_Contraception.json",
    "questions": 28
  },
  {
    "title": "Family_Planning___Contraceptives",
    "category": "Subject Wise / Mixed",
    "file": "Family_Planning___Contraceptives.json",
    "questions": 8
  },
  {
    "title": "Family_Planning_and_Contraceptives-Family_Planning_and_Contraceptives",
    "category": "Subject Wise / Mixed",
    "file": "Family_Planning_and_Contraceptives-Family_Planning_and_Contraceptives.json",
    "questions": 27
  },
  {
    "title": "Family_Planning_and_Contraceptives-Previous_Year_Questions",
    "category": "Subject Wise / Mixed",
    "file": "Family_Planning_and_Contraceptives-Previous_Year_Questions.json",
    "questions": 17
  },
  {
    "title": "Fascia Lata & Modifications",
    "category": "Subject Wise / Mixed",
    "file": "Fascia_Lata__Modifications.json",
    "questions": 7
  },
  {
    "title": "Fate of Acute Inflammation",
    "category": "Subject Wise / Mixed",
    "file": "Fate_of_Acute_Inflammation.json",
    "questions": 2
  },
  {
    "title": "Fatty_acid_and_TG_synthesis",
    "category": "Subject Wise / Mixed",
    "file": "Fatty_acid_and_TG_synthesis.json",
    "questions": 33
  },
  {
    "title": "Female Infertility",
    "category": "Subject Wise / Mixed",
    "file": "Female_Infertility_1.json",
    "questions": 22
  },
  {
    "title": "Female Reproductive Hormones",
    "category": "Subject Wise / Mixed",
    "file": "Female_Reproductive_Hormones.json",
    "questions": 6
  },
  {
    "title": "Female_Infertility",
    "category": "Subject Wise / Mixed",
    "file": "Female_Infertility.json",
    "questions": 71
  },
  {
    "title": "Female_and_Male_Genital_System",
    "category": "Subject Wise / Mixed",
    "file": "Female_and_Male_Genital_System.json",
    "questions": 11
  },
  {
    "title": "Fertilisation_and_implantation",
    "category": "Subject Wise / Mixed",
    "file": "Fertilisation_and_implantation.json",
    "questions": 8
  },
  {
    "title": "Fertilization & Implantation",
    "category": "Subject Wise / Mixed",
    "file": "Fertilization__Implantation.json",
    "questions": 6
  },
  {
    "title": "Fetal Assessment",
    "category": "Subject Wise / Mixed",
    "file": "Fetal_Assessment.json",
    "questions": 25
  },
  {
    "title": "Fetal Circulation",
    "category": "Subject Wise / Mixed",
    "file": "Fetal_Circulation.json",
    "questions": 13
  },
  {
    "title": "Fetal Skull",
    "category": "Subject Wise / Mixed",
    "file": "Fetal_Skull.json",
    "questions": 5
  },
  {
    "title": "Fetal_Monitoring",
    "category": "Subject Wise / Mixed",
    "file": "Fetal_Monitoring.json",
    "questions": 12
  },
  {
    "title": "Fetal_New_Born_Infanticide",
    "category": "Subject Wise / Mixed",
    "file": "Fetal_New_Born_Infanticide.json",
    "questions": 5
  },
  {
    "title": "Fibrinolytics And Antifibrinolytics",
    "category": "Subject Wise / Mixed",
    "file": "Fibrinolytics_And_Antifibrinolytics.json",
    "questions": 5
  },
  {
    "title": "Fibrinolytics__Miscellaneous_Hematology",
    "category": "Subject Wise / Mixed",
    "file": "Fibrinolytics__Miscellaneous_Hematology.json",
    "questions": 9
  },
  {
    "title": "Fibroid",
    "category": "Subject Wise / Mixed",
    "file": "Fibroid.json",
    "questions": 26
  },
  {
    "title": "Fibroids-Previous_Year_Questions",
    "category": "Subject Wise / Mixed",
    "file": "Fibroids-Previous_Year_Questions.json",
    "questions": 3
  },
  {
    "title": "Finger Printing",
    "category": "Subject Wise / Mixed",
    "file": "Finger_Printing.json",
    "questions": 6
  },
  {
    "title": "Flexor & Extensor Retinaculum",
    "category": "Subject Wise / Mixed",
    "file": "Flexor__Extensor_Retinaculum.json",
    "questions": 6
  },
  {
    "title": "Flexor, Extensor & Peroneal Retinaculum",
    "category": "Subject Wise / Mixed",
    "file": "Flexor_Extensor__Peroneal_Retinaculum.json",
    "questions": 7
  },
  {
    "title": "Fluid_Electrolytes_and_Genetic_Disorders",
    "category": "Subject Wise / Mixed",
    "file": "Fluid_Electrolytes_and_Genetic_Disorders.json",
    "questions": 8
  },
  {
    "title": "Fluid_and_Electrolyte_Disturbances-Acid-Base_Balance__Fluid_and_Electrolyte_Disorders__and_IVF",
    "category": "Subject Wise / Mixed",
    "file": "Fluid_and_Electrolyte_Disturbances-Acid-Base_Balance__Fluid_and_Electrolyte_Disorders__and_IVF.json",
    "questions": 19
  },
  {
    "title": "Fluid_and_Electrolyte_Disturbances-Previous_Year_Questions",
    "category": "Subject Wise / Mixed",
    "file": "Fluid_and_Electrolyte_Disturbances-Previous_Year_Questions.json",
    "questions": 14
  },
  {
    "title": "Fluroquinolones",
    "category": "Subject Wise / Mixed",
    "file": "Fluroquinolones.json",
    "questions": 6
  },
  {
    "title": "Food Poisoning",
    "category": "Subject Wise / Mixed",
    "file": "Food_Poisoning.json",
    "questions": 2
  },
  {
    "title": "Forensic Medicine - INI CET MAY 2023",
    "category": "Subject Wise / Mixed",
    "file": "Forensic_Medicine_-_INI_CET_MAY_2023.json",
    "questions": 9
  },
  {
    "title": "Forensic Medicine - INI CET NOV 2023",
    "category": "Subject Wise / Mixed",
    "file": "Forensic_Medicine_-_INI_CET_NOV_2023.json",
    "questions": 10
  },
  {
    "title": "Forensic Medicine - INI CET NOVEMBER 2022 (PART - A)",
    "category": "Subject Wise / Mixed",
    "file": "Forensic_Medicine_-_INI_CET_NOVEMBER_2022_PART_-_A.json",
    "questions": 8
  },
  {
    "title": "Forensic Medicine - INI CET NOVEMBER 2022 (PART - B)",
    "category": "Subject Wise / Mixed",
    "file": "Forensic_Medicine_-_INI_CET_NOVEMBER_2022_PART_-_B.json",
    "questions": 13
  },
  {
    "title": "Forensic Medicine Last Month E&D - 21-07-2024 - 2024-07-21",
    "category": "Subject Wise / Mixed",
    "file": "Forensic_Medicine_Last_Month_ED_-_21-07-2024_-_2024-07-21.json",
    "questions": 25
  },
  {
    "title": "Forensic Medicine Test (The Champion Batch Hyderabad) - 03-05-2024 - 2024-05-03",
    "category": "Subject Wise / Mixed",
    "file": "Forensic_Medicine_Test_The_Champion_Batch_Hyderabad_-_03-05-2024_-_2024-05-03.json",
    "questions": 75
  },
  {
    "title": "Forensic Medicine Test (The Champion Batch Hyderabad) - 04-06-2025 - 2025-06-04",
    "category": "Subject Wise / Mixed",
    "file": "Forensic_Medicine_Test_The_Champion_Batch_Hyderabad_-_04-06-2025_-_2025-06-04.json",
    "questions": 50
  },
  {
    "title": "Forensic Medicine Test (The Champion Batch Hyderabad) - 25-10-2024 - 2024-10-25",
    "category": "Subject Wise / Mixed",
    "file": "Forensic_Medicine_Test_The_Champion_Batch_Hyderabad_-_25-10-2024_-_2024-10-25.json",
    "questions": 75
  },
  {
    "title": "Forensic Psychiatry",
    "category": "Subject Wise / Mixed",
    "file": "Forensic_Psychiatry.json",
    "questions": 14
  },
  {
    "title": "Forensic Psychiatry",
    "category": "Subject Wise / Mixed",
    "file": "Forensic_Psychiatry_1.json",
    "questions": 15
  },
  {
    "title": "Forensic_Identification-Forensic_Identification",
    "category": "Subject Wise / Mixed",
    "file": "Forensic_Identification-Forensic_Identification.json",
    "questions": 25
  },
  {
    "title": "Forensic_Identification-Previous_Year_Questions",
    "category": "Subject Wise / Mixed",
    "file": "Forensic_Identification-Previous_Year_Questions.json",
    "questions": 25
  },
  {
    "title": "Forensic_Psychiatry-Forensic_Psychiatry",
    "category": "Subject Wise / Mixed",
    "file": "Forensic_Psychiatry-Forensic_Psychiatry.json",
    "questions": 11
  },
  {
    "title": "Forensic_Psychiatry-Forensic_Psychiatry__Electroconvulsive_Therapy__Ect__And_Bereavement",
    "category": "Subject Wise / Mixed",
    "file": "Forensic_Psychiatry-Forensic_Psychiatry__Electroconvulsive_Therapy__Ect__And_Bereavement.json",
    "questions": 9
  },
  {
    "title": "Forensic_Psychiatry-Previous_Year_Questions",
    "category": "Subject Wise / Mixed",
    "file": "Forensic_Psychiatry-Previous_Year_Questions.json",
    "questions": 7
  },
  {
    "title": "Forensic_Psychiatry-Previous_Year_Questions",
    "category": "Subject Wise / Mixed",
    "file": "Forensic_Psychiatry-Previous_Year_Questions_1.json",
    "questions": 7
  },
  {
    "title": "Forensic_Thanatology-Previous_Year_Questions",
    "category": "Subject Wise / Mixed",
    "file": "Forensic_Thanatology-Previous_Year_Questions.json",
    "questions": 39
  },
  {
    "title": "Forensic_Thanatology-Thanatology",
    "category": "Subject Wise / Mixed",
    "file": "Forensic_Thanatology-Thanatology.json",
    "questions": 25
  },
  {
    "title": "Forensic_Toxicology-Forensic_Toxicology_1",
    "category": "Subject Wise / Mixed",
    "file": "Forensic_Toxicology-Forensic_Toxicology_1.json",
    "questions": 20
  },
  {
    "title": "Forensic_Toxicology-Forensic_Toxicology_2",
    "category": "Subject Wise / Mixed",
    "file": "Forensic_Toxicology-Forensic_Toxicology_2.json",
    "questions": 25
  },
  {
    "title": "Forensic_Toxicology-Previous_Year_Questions",
    "category": "Subject Wise / Mixed",
    "file": "Forensic_Toxicology-Previous_Year_Questions.json",
    "questions": 80
  },
  {
    "title": "Forensic_Traumatology-Mechanical_injuries",
    "category": "Subject Wise / Mixed",
    "file": "Forensic_Traumatology-Mechanical_injuries.json",
    "questions": 24
  },
  {
    "title": "Forensic_Traumatology-Previous_Year_Questions",
    "category": "Subject Wise / Mixed",
    "file": "Forensic_Traumatology-Previous_Year_Questions.json",
    "questions": 37
  },
  {
    "title": "Forensic_Traumatology-Regional_injuries",
    "category": "Subject Wise / Mixed",
    "file": "Forensic_Traumatology-Regional_injuries.json",
    "questions": 13
  },
  {
    "title": "Forensic_Traumatology-Thermal_injuries_and_RTA",
    "category": "Subject Wise / Mixed",
    "file": "Forensic_Traumatology-Thermal_injuries_and_RTA.json",
    "questions": 21
  },
  {
    "title": "Four Formulas",
    "category": "Subject Wise / Mixed",
    "file": "Four_Formulas.json",
    "questions": 16
  },
  {
    "title": "Fracture_of_Humerus",
    "category": "Subject Wise / Mixed",
    "file": "Fracture_of_Humerus.json",
    "questions": 22
  },
  {
    "title": "Fractures_of_Facial_Skeleton_and_Tumours_of_Nose_and_PNS",
    "category": "Subject Wise / Mixed",
    "file": "Fractures_of_Facial_Skeleton_and_Tumours_of_Nose_and_PNS.json",
    "questions": 8
  },
  {
    "title": "Free Radicals",
    "category": "Subject Wise / Mixed",
    "file": "Free_Radicals.json",
    "questions": 9
  },
  {
    "title": "Fundamentals of Reproduction",
    "category": "Subject Wise / Mixed",
    "file": "Fundamentals_of_Reproduction.json",
    "questions": 18
  },
  {
    "title": "Fungal Corneal Ulcer",
    "category": "Subject Wise / Mixed",
    "file": "Fungal_Corneal_Ulcer.json",
    "questions": 6
  },
  {
    "title": "Fungal Pneumonia-Part 1",
    "category": "Subject Wise / Mixed",
    "file": "Fungal_Pneumonia-Part_1.json",
    "questions": 2
  },
  {
    "title": "Fungal Pneumonia-Part 2",
    "category": "Subject Wise / Mixed",
    "file": "Fungal_Pneumonia-Part_2.json",
    "questions": 7
  },
  {
    "title": "Fungal infection",
    "category": "Subject Wise / Mixed",
    "file": "Fungal_infection.json",
    "questions": 28
  },
  {
    "title": "Fungal_Infections",
    "category": "Subject Wise / Mixed",
    "file": "Fungal_Infections.json",
    "questions": 40
  },
  {
    "title": "Fungal_Infections-Fungal_Infections",
    "category": "Subject Wise / Mixed",
    "file": "Fungal_Infections-Fungal_Infections.json",
    "questions": 12
  },
  {
    "title": "Fungal_Infections-Previous_Year_Questions",
    "category": "Subject Wise / Mixed",
    "file": "Fungal_Infections-Previous_Year_Questions.json",
    "questions": 4
  },
  {
    "title": "Fungal_Infections_of_Skin",
    "category": "Subject Wise / Mixed",
    "file": "Fungal_Infections_of_Skin.json",
    "questions": 4
  },
  {
    "title": "GI Radiology",
    "category": "Subject Wise / Mixed",
    "file": "GI_Radiology.json",
    "questions": 20
  },
  {
    "title": "GIT",
    "category": "Subject Wise / Mixed",
    "file": "GIT.json",
    "questions": 79
  },
  {
    "title": "GIT",
    "category": "Subject Wise / Mixed",
    "file": "GIT_1.json",
    "questions": 101
  },
  {
    "title": "GIT",
    "category": "Subject Wise / Mixed",
    "file": "GIT_2.json",
    "questions": 79
  },
  {
    "title": "GIT",
    "category": "Subject Wise / Mixed",
    "file": "GIT_3.json",
    "questions": 11
  },
  {
    "title": "GIT",
    "category": "Subject Wise / Mixed",
    "file": "GIT_4.json",
    "questions": 11
  },
  {
    "title": "GIT Development - Foregut",
    "category": "Subject Wise / Mixed",
    "file": "GIT_Development_-_Foregut.json",
    "questions": 6
  },
  {
    "title": "GIT Development - Midgut",
    "category": "Subject Wise / Mixed",
    "file": "GIT_Development_-_Midgut.json",
    "questions": 20
  },
  {
    "title": "GIT_Clinical_Vignettes",
    "category": "Subject Wise / Mixed",
    "file": "GIT_Clinical_Vignettes.json",
    "questions": 47
  },
  {
    "title": "GIT_Hepatology",
    "category": "Subject Wise / Mixed",
    "file": "GIT_Hepatology.json",
    "questions": 30
  },
  {
    "title": "GIT_Liver",
    "category": "Subject Wise / Mixed",
    "file": "GIT_Liver.json",
    "questions": 115
  },
  {
    "title": "GIT_Part-1__Esophagus__Stomach___Peritoneum_",
    "category": "Subject Wise / Mixed",
    "file": "GIT_Part-1__Esophagus__Stomach___Peritoneum_.json",
    "questions": 21
  },
  {
    "title": "GIT_Part-2__Intestinal_Obstruction__Small_Intestine_and_Large_Intestine_",
    "category": "Subject Wise / Mixed",
    "file": "GIT_Part-2__Intestinal_Obstruction__Small_Intestine_and_Large_Intestine_.json",
    "questions": 7
  },
  {
    "title": "GIT_Part-3__Ileostomy___Colostomy__IBD__Appendix__Rectum___Anal_Canal_and_Spleen_",
    "category": "Subject Wise / Mixed",
    "file": "GIT_Part-3__Ileostomy___Colostomy__IBD__Appendix__Rectum___Anal_Canal_and_Spleen_.json",
    "questions": 8
  },
  {
    "title": "GIT_Pharmacology-Drugs_in_Acid_Peptic_Disease",
    "category": "Subject Wise / Mixed",
    "file": "GIT_Pharmacology-Drugs_in_Acid_Peptic_Disease.json",
    "questions": 16
  },
  {
    "title": "GIT_Pharmacology-GIT_Miscellaneous",
    "category": "Subject Wise / Mixed",
    "file": "GIT_Pharmacology-GIT_Miscellaneous.json",
    "questions": 10
  },
  {
    "title": "GIT_Pharmacology-Previous_Year_Questions",
    "category": "Subject Wise / Mixed",
    "file": "GIT_Pharmacology-Previous_Year_Questions.json",
    "questions": 25
  },
  {
    "title": "GIT_Physiology",
    "category": "Subject Wise / Mixed",
    "file": "GIT_Physiology.json",
    "questions": 2
  },
  {
    "title": "GIT_Physiology-Previous_Year_Questions",
    "category": "Subject Wise / Mixed",
    "file": "GIT_Physiology-Previous_Year_Questions.json",
    "questions": 3
  },
  {
    "title": "GIT__Hepatobiliary_System",
    "category": "Subject Wise / Mixed",
    "file": "GIT__Hepatobiliary_System.json",
    "questions": 55
  },
  {
    "title": "GRAND_TEST-170",
    "category": "Subject Wise / Mixed",
    "file": "GRAND_TEST-170.json",
    "questions": 300
  },
  {
    "title": "GU Radiology",
    "category": "Subject Wise / Mixed",
    "file": "GU_Radiology.json",
    "questions": 26
  },
  {
    "title": "Galactose__Fructose_Metabolism",
    "category": "Subject Wise / Mixed",
    "file": "Galactose__Fructose_Metabolism.json",
    "questions": 12
  },
  {
    "title": "Gall Bladder (Choledocholithiasis & Bile Duct Injury)",
    "category": "Subject Wise / Mixed",
    "file": "Gall_Bladder_Choledocholithiasis__Bile_Duct_Injury.json",
    "questions": 25
  },
  {
    "title": "Gall Bladder (Gall Bladder & Bile Duct Cancer)",
    "category": "Subject Wise / Mixed",
    "file": "Gall_Bladder_Gall_Bladder__Bile_Duct_Cancer.json",
    "questions": 17
  },
  {
    "title": "Gall Bladder (Gall Stone Disease)",
    "category": "Subject Wise / Mixed",
    "file": "Gall_Bladder_Gall_Stone_Disease.json",
    "questions": 18
  },
  {
    "title": "Gall Bladder (Surgical Anatomy & Investigations)",
    "category": "Subject Wise / Mixed",
    "file": "Gall_Bladder_Surgical_Anatomy__Investigations.json",
    "questions": 12
  },
  {
    "title": "Gall Bladder Stones",
    "category": "Subject Wise / Mixed",
    "file": "Gall_Bladder_Stones.json",
    "questions": 2
  },
  {
    "title": "Gall_Bladder",
    "category": "Subject Wise / Mixed",
    "file": "Gall_Bladder.json",
    "questions": 99
  },
  {
    "title": "Gall_Bladder",
    "category": "Subject Wise / Mixed",
    "file": "Gall_Bladder_1.json",
    "questions": 6
  },
  {
    "title": "Gametogenesis",
    "category": "Subject Wise / Mixed",
    "file": "Gametogenesis.json",
    "questions": 19
  },
  {
    "title": "Gas Exchange",
    "category": "Subject Wise / Mixed",
    "file": "Gas_Exchange.json",
    "questions": 11
  },
  {
    "title": "Gas Exchange - V_Q Ratio",
    "category": "Subject Wise / Mixed",
    "file": "Gas_Exchange_-_V_Q_Ratio.json",
    "questions": 3
  },
  {
    "title": "Gas Gangrene",
    "category": "Subject Wise / Mixed",
    "file": "Gas_Gangrene.json",
    "questions": 7
  },
  {
    "title": "Gastro_Intestinal_Tract_and_Hepatobiliary_Pancreas",
    "category": "Subject Wise / Mixed",
    "file": "Gastro_Intestinal_Tract_and_Hepatobiliary_Pancreas.json",
    "questions": 8
  },
  {
    "title": "Gastroenterology",
    "category": "Subject Wise / Mixed",
    "file": "Gastroenterology.json",
    "questions": 140
  },
  {
    "title": "Gastrointestinal Radiology",
    "category": "Subject Wise / Mixed",
    "file": "Gastrointestinal_Radiology.json",
    "questions": 31
  },
  {
    "title": "Gastrointestinal System",
    "category": "Subject Wise / Mixed",
    "file": "Gastrointestinal_System.json",
    "questions": 34
  },
  {
    "title": "Gastrointestinal System",
    "category": "Subject Wise / Mixed",
    "file": "Gastrointestinal_System_1.json",
    "questions": 34
  },
  {
    "title": "Gastrointestinal Tract",
    "category": "Subject Wise / Mixed",
    "file": "Gastrointestinal_Tract.json",
    "questions": 242
  },
  {
    "title": "Gastrointestinal_Radiology-GIT_Radiology",
    "category": "Subject Wise / Mixed",
    "file": "Gastrointestinal_Radiology-GIT_Radiology.json",
    "questions": 18
  },
  {
    "title": "Gastrointestinal_Radiology-Previous_Year_Questions",
    "category": "Subject Wise / Mixed",
    "file": "Gastrointestinal_Radiology-Previous_Year_Questions.json",
    "questions": 34
  },
  {
    "title": "Gastrointestinal_Surgery-Appendix",
    "category": "Subject Wise / Mixed",
    "file": "Gastrointestinal_Surgery-Appendix.json",
    "questions": 11
  },
  {
    "title": "Gastrointestinal_Surgery-Esophagus",
    "category": "Subject Wise / Mixed",
    "file": "Gastrointestinal_Surgery-Esophagus.json",
    "questions": 25
  },
  {
    "title": "Gastrointestinal_Surgery-Hernia",
    "category": "Subject Wise / Mixed",
    "file": "Gastrointestinal_Surgery-Hernia.json",
    "questions": 26
  },
  {
    "title": "Gastrointestinal_Surgery-Ileostomy__Colostomy__and_IBD",
    "category": "Subject Wise / Mixed",
    "file": "Gastrointestinal_Surgery-Ileostomy__Colostomy__and_IBD.json",
    "questions": 24
  },
  {
    "title": "Gastrointestinal_Surgery-Intestinal_Obstruction",
    "category": "Subject Wise / Mixed",
    "file": "Gastrointestinal_Surgery-Intestinal_Obstruction.json",
    "questions": 11
  },
  {
    "title": "Gastrointestinal_Surgery-Large_Intestine-I",
    "category": "Subject Wise / Mixed",
    "file": "Gastrointestinal_Surgery-Large_Intestine-I.json",
    "questions": 13
  },
  {
    "title": "Gastrointestinal_Surgery-Large_Intestine-II",
    "category": "Subject Wise / Mixed",
    "file": "Gastrointestinal_Surgery-Large_Intestine-II.json",
    "questions": 18
  },
  {
    "title": "Gastrointestinal_Surgery-Previous_Year_Questions",
    "category": "Subject Wise / Mixed",
    "file": "Gastrointestinal_Surgery-Previous_Year_Questions.json",
    "questions": 205
  },
  {
    "title": "Gastrointestinal_Surgery-Previous_Year_Questions_1",
    "category": "Subject Wise / Mixed",
    "file": "Gastrointestinal_Surgery-Previous_Year_Questions_1.json",
    "questions": 7
  },
  {
    "title": "Gastrointestinal_Surgery-Rectum_and_Anal_Canal",
    "category": "Subject Wise / Mixed",
    "file": "Gastrointestinal_Surgery-Rectum_and_Anal_Canal.json",
    "questions": 26
  },
  {
    "title": "Gastrointestinal_Surgery-Small_Intestine",
    "category": "Subject Wise / Mixed",
    "file": "Gastrointestinal_Surgery-Small_Intestine.json",
    "questions": 25
  },
  {
    "title": "Gastrointestinal_Surgery-Spleen",
    "category": "Subject Wise / Mixed",
    "file": "Gastrointestinal_Surgery-Spleen.json",
    "questions": 10
  },
  {
    "title": "Gastrointestinal_Surgery-Stomach-I",
    "category": "Subject Wise / Mixed",
    "file": "Gastrointestinal_Surgery-Stomach-I.json",
    "questions": 20
  },
  {
    "title": "Gastrointestinal_System",
    "category": "Subject Wise / Mixed",
    "file": "Gastrointestinal_System_2.json",
    "questions": 73
  },
  {
    "title": "Gastrointestinal_System-GIT_Hormones__Secretions__and_Absorption_Mechanisms",
    "category": "Subject Wise / Mixed",
    "file": "Gastrointestinal_System-GIT_Hormones__Secretions__and_Absorption_Mechanisms.json",
    "questions": 23
  },
  {
    "title": "Gastrointestinal_System-GIT_Motility",
    "category": "Subject Wise / Mixed",
    "file": "Gastrointestinal_System-GIT_Motility.json",
    "questions": 11
  },
  {
    "title": "Gastrointestinal_System-Inflammatory_Bowel_Disease-I",
    "category": "Subject Wise / Mixed",
    "file": "Gastrointestinal_System-Inflammatory_Bowel_Disease-I.json",
    "questions": 15
  },
  {
    "title": "Gastrointestinal_System-Inflammatory_Bowel_Disease-II",
    "category": "Subject Wise / Mixed",
    "file": "Gastrointestinal_System-Inflammatory_Bowel_Disease-II.json",
    "questions": 7
  },
  {
    "title": "Gastrointestinal_System-Malabsorption_Syndromes",
    "category": "Subject Wise / Mixed",
    "file": "Gastrointestinal_System-Malabsorption_Syndromes.json",
    "questions": 13
  },
  {
    "title": "Gastrointestinal_System-Peptic_Ulcer_and_Gastrointestinal_Bleeding",
    "category": "Subject Wise / Mixed",
    "file": "Gastrointestinal_System-Peptic_Ulcer_and_Gastrointestinal_Bleeding.json",
    "questions": 14
  },
  {
    "title": "Gastrointestinal_System-Previous_Year_Questions",
    "category": "Subject Wise / Mixed",
    "file": "Gastrointestinal_System-Previous_Year_Questions.json",
    "questions": 21
  },
  {
    "title": "Gastrointestinal_System-Previous_Year_Questions",
    "category": "Subject Wise / Mixed",
    "file": "Gastrointestinal_System-Previous_Year_Questions_1.json",
    "questions": 21
  },
  {
    "title": "Gastrointestinal_System-Zollinger_Ellison_Syndrome",
    "category": "Subject Wise / Mixed",
    "file": "Gastrointestinal_System-Zollinger_Ellison_Syndrome.json",
    "questions": 4
  },
  {
    "title": "Gastrointestinal_Tract-Basics_of_GIT_and_Esophagus",
    "category": "Subject Wise / Mixed",
    "file": "Gastrointestinal_Tract-Basics_of_GIT_and_Esophagus.json",
    "questions": 7
  },
  {
    "title": "Gastrointestinal_Tract-Intestinal_Polyps_and_Intestinal_Carcinoma",
    "category": "Subject Wise / Mixed",
    "file": "Gastrointestinal_Tract-Intestinal_Polyps_and_Intestinal_Carcinoma.json",
    "questions": 14
  },
  {
    "title": "Gastrointestinal_Tract-Malabsorption_Syndrome__Celiac_Disease__and_IBD",
    "category": "Subject Wise / Mixed",
    "file": "Gastrointestinal_Tract-Malabsorption_Syndrome__Celiac_Disease__and_IBD.json",
    "questions": 14
  },
  {
    "title": "Gastrointestinal_Tract-Peptic_Ulcer_Disease__Gastric_Polyps__and_Tumors",
    "category": "Subject Wise / Mixed",
    "file": "Gastrointestinal_Tract-Peptic_Ulcer_Disease__Gastric_Polyps__and_Tumors.json",
    "questions": 20
  },
  {
    "title": "Gastrointestinal_Tract-Previous_Year_Questions",
    "category": "Subject Wise / Mixed",
    "file": "Gastrointestinal_Tract-Previous_Year_Questions.json",
    "questions": 32
  },
  {
    "title": "Gastrointestinal_tract",
    "category": "Subject Wise / Mixed",
    "file": "Gastrointestinal_tract.json",
    "questions": 54
  },
  {
    "title": "General + Upper Limb Traumatology",
    "category": "Subject Wise / Mixed",
    "file": "General__Upper_Limb_Traumatology.json",
    "questions": 156
  },
  {
    "title": "General Anatomy",
    "category": "Subject Wise / Mixed",
    "file": "General_Anatomy.json",
    "questions": 26
  },
  {
    "title": "General Anesthesia - Complications",
    "category": "Subject Wise / Mixed",
    "file": "General_Anesthesia_-_Complications.json",
    "questions": 34
  },
  {
    "title": "General Anesthesia - IV Anesthetics",
    "category": "Subject Wise / Mixed",
    "file": "General_Anesthesia_-_IV_Anesthetics.json",
    "questions": 60
  },
  {
    "title": "General Anesthesia - Inhalational Agents",
    "category": "Subject Wise / Mixed",
    "file": "General_Anesthesia_-_Inhalational_Agents.json",
    "questions": 50
  },
  {
    "title": "General Anesthesia - Introduction",
    "category": "Subject Wise / Mixed",
    "file": "General_Anesthesia_-_Introduction.json",
    "questions": 5
  },
  {
    "title": "General Anesthesia - Muscle Relaxants",
    "category": "Subject Wise / Mixed",
    "file": "General_Anesthesia_-_Muscle_Relaxants.json",
    "questions": 35
  },
  {
    "title": "General Bacteriology (GB)",
    "category": "Subject Wise / Mixed",
    "file": "General_Bacteriology_GB.json",
    "questions": 22
  },
  {
    "title": "General Dermatology",
    "category": "Subject Wise / Mixed",
    "file": "General_Dermatology.json",
    "questions": 23
  },
  {
    "title": "General Microbiology",
    "category": "Subject Wise / Mixed",
    "file": "General_Microbiology_1.json",
    "questions": 49
  },
  {
    "title": "General Mycology",
    "category": "Subject Wise / Mixed",
    "file": "General_Mycology.json",
    "questions": 22
  },
  {
    "title": "General Neonatology",
    "category": "Subject Wise / Mixed",
    "file": "General_Neonatology.json",
    "questions": 21
  },
  {
    "title": "General Neuroanatomy",
    "category": "Subject Wise / Mixed",
    "file": "General_Neuroanatomy.json",
    "questions": 17
  },
  {
    "title": "General Parasitology Part-1",
    "category": "Subject Wise / Mixed",
    "file": "General_Parasitology_Part-1.json",
    "questions": 16
  },
  {
    "title": "General Pharmacology",
    "category": "Subject Wise / Mixed",
    "file": "General_Pharmacology.json",
    "questions": 100
  },
  {
    "title": "General Physiology",
    "category": "Subject Wise / Mixed",
    "file": "General_Physiology.json",
    "questions": 123
  },
  {
    "title": "General Principles of Toxicology",
    "category": "Subject Wise / Mixed",
    "file": "General_Principles_of_Toxicology.json",
    "questions": 15
  },
  {
    "title": "General Surgery",
    "category": "Subject Wise / Mixed",
    "file": "General_Surgery.json",
    "questions": 78
  },
  {
    "title": "General Virology Part-1",
    "category": "Subject Wise / Mixed",
    "file": "General_Virology_Part-1.json",
    "questions": 22
  },
  {
    "title": "General Virology Part-2",
    "category": "Subject Wise / Mixed",
    "file": "General_Virology_Part-2.json",
    "questions": 12
  },
  {
    "title": "General-Miscellaneous_Topics_in_Orthopedics",
    "category": "Subject Wise / Mixed",
    "file": "General-Miscellaneous_Topics_in_Orthopedics.json",
    "questions": 21
  },
  {
    "title": "General-Previous_Year_Questions",
    "category": "Subject Wise / Mixed",
    "file": "General-Previous_Year_Questions.json",
    "questions": 3
  },
  {
    "title": "General-Previous_Year_Questions",
    "category": "Subject Wise / Mixed",
    "file": "General-Previous_Year_Questions_1.json",
    "questions": 3
  },
  {
    "title": "General-Previous_Year_Questions",
    "category": "Subject Wise / Mixed",
    "file": "General-Previous_Year_Questions_2.json",
    "questions": 3
  },
  {
    "title": "General_Amino_Acid_Metabolism",
    "category": "Subject Wise / Mixed",
    "file": "General_Amino_Acid_Metabolism.json",
    "questions": 17
  },
  {
    "title": "General_Anaesthesia-Previous_Year_Questions",
    "category": "Subject Wise / Mixed",
    "file": "General_Anaesthesia-Previous_Year_Questions.json",
    "questions": 13
  },
  {
    "title": "General_Anatomy-Special_First_Year_Class_Test",
    "category": "Subject Wise / Mixed",
    "file": "General_Anatomy-Special_First_Year_Class_Test.json",
    "questions": 30
  },
  {
    "title": "General_Anatomy_Special_First_Year_Class_Test",
    "category": "Subject Wise / Mixed",
    "file": "General_Anatomy_Special_First_Year_Class_Test.json",
    "questions": 30
  },
  {
    "title": "General_Anatomy__Embryology",
    "category": "Subject Wise / Mixed",
    "file": "General_Anatomy__Embryology.json",
    "questions": 62
  },
  {
    "title": "General_Dermatology",
    "category": "Subject Wise / Mixed",
    "file": "General_Dermatology_1.json",
    "questions": 15
  },
  {
    "title": "General_Embryology-Development_Period",
    "category": "Subject Wise / Mixed",
    "file": "General_Embryology-Development_Period.json",
    "questions": 10
  },
  {
    "title": "General_Embryology-Gametogenesis_and_IVF",
    "category": "Subject Wise / Mixed",
    "file": "General_Embryology-Gametogenesis_and_IVF.json",
    "questions": 15
  },
  {
    "title": "General_Embryology-General_Embryology",
    "category": "Subject Wise / Mixed",
    "file": "General_Embryology-General_Embryology.json",
    "questions": 25
  },
  {
    "title": "General_Embryology-Previous_Year_Questions",
    "category": "Subject Wise / Mixed",
    "file": "General_Embryology-Previous_Year_Questions.json",
    "questions": 25
  },
  {
    "title": "General_Histology",
    "category": "Subject Wise / Mixed",
    "file": "General_Histology.json",
    "questions": 6
  },
  {
    "title": "General_Microbiology",
    "category": "Subject Wise / Mixed",
    "file": "General_Microbiology.json",
    "questions": 16
  },
  {
    "title": "General_Microbiology",
    "category": "Subject Wise / Mixed",
    "file": "General_Microbiology_2.json",
    "questions": 96
  },
  {
    "title": "General_Microbiology-Bacterial_Anatomy",
    "category": "Subject Wise / Mixed",
    "file": "General_Microbiology-Bacterial_Anatomy.json",
    "questions": 18
  },
  {
    "title": "General_Microbiology-Bacterial_genetics",
    "category": "Subject Wise / Mixed",
    "file": "General_Microbiology-Bacterial_genetics.json",
    "questions": 7
  },
  {
    "title": "General_Microbiology-Culture_Media",
    "category": "Subject Wise / Mixed",
    "file": "General_Microbiology-Culture_Media.json",
    "questions": 16
  },
  {
    "title": "General_Microbiology-Previous_Year_Questions",
    "category": "Subject Wise / Mixed",
    "file": "General_Microbiology-Previous_Year_Questions.json",
    "questions": 45
  },
  {
    "title": "General_Microbiology-Scientists__Stains__and_Microscopes",
    "category": "Subject Wise / Mixed",
    "file": "General_Microbiology-Scientists__Stains__and_Microscopes.json",
    "questions": 17
  },
  {
    "title": "General_Microbiology-Sterilization_and_Disinfection",
    "category": "Subject Wise / Mixed",
    "file": "General_Microbiology-Sterilization_and_Disinfection.json",
    "questions": 14
  },
  {
    "title": "General_Orthopedics",
    "category": "Subject Wise / Mixed",
    "file": "General_Orthopedics.json",
    "questions": 20
  },
  {
    "title": "General_Pathology_Dr_Sanjeev",
    "category": "Subject Wise / Mixed",
    "file": "General_Pathology_Dr_Sanjeev.json",
    "questions": 25
  },
  {
    "title": "General_Pharmacology",
    "category": "Subject Wise / Mixed",
    "file": "General_Pharmacology_1.json",
    "questions": 88
  },
  {
    "title": "General_Pharmacology-Clinical_Trials_and_Miscellaneous",
    "category": "Subject Wise / Mixed",
    "file": "General_Pharmacology-Clinical_Trials_and_Miscellaneous.json",
    "questions": 13
  },
  {
    "title": "General_Pharmacology-Pharmacodynamics",
    "category": "Subject Wise / Mixed",
    "file": "General_Pharmacology-Pharmacodynamics.json",
    "questions": 16
  },
  {
    "title": "General_Pharmacology-Pharmacokinetics",
    "category": "Subject Wise / Mixed",
    "file": "General_Pharmacology-Pharmacokinetics.json",
    "questions": 20
  },
  {
    "title": "General_Pharmacology-Previous_Year_Questions",
    "category": "Subject Wise / Mixed",
    "file": "General_Pharmacology-Previous_Year_Questions.json",
    "questions": 79
  },
  {
    "title": "General_Pharmacology_",
    "category": "Subject Wise / Mixed",
    "file": "General_Pharmacology_.json",
    "questions": 23
  },
  {
    "title": "General_Physiology",
    "category": "Subject Wise / Mixed",
    "file": "General_Physiology_1.json",
    "questions": 43
  },
  {
    "title": "General_Physiology-Previous_Year_Questions",
    "category": "Subject Wise / Mixed",
    "file": "General_Physiology-Previous_Year_Questions.json",
    "questions": 54
  },
  {
    "title": "General_Physiology-Special_First_Year_Class_Test",
    "category": "Subject Wise / Mixed",
    "file": "General_Physiology-Special_First_Year_Class_Test.json",
    "questions": 30
  },
  {
    "title": "General_Physiology_",
    "category": "Subject Wise / Mixed",
    "file": "General_Physiology_.json",
    "questions": 10
  },
  {
    "title": "General_Psychiatry",
    "category": "Subject Wise / Mixed",
    "file": "General_Psychiatry.json",
    "questions": 39
  },
  {
    "title": "General_Surgery",
    "category": "Subject Wise / Mixed",
    "file": "General_Surgery_1.json",
    "questions": 6
  },
  {
    "title": "General_Surgery-Previous_Year_Questions",
    "category": "Subject Wise / Mixed",
    "file": "General_Surgery-Previous_Year_Questions.json",
    "questions": 46
  },
  {
    "title": "General_Surgery_IBQ",
    "category": "Subject Wise / Mixed",
    "file": "General_Surgery_IBQ.json",
    "questions": 20
  },
  {
    "title": "Genetic",
    "category": "Subject Wise / Mixed",
    "file": "Genetic.json",
    "questions": 4
  },
  {
    "title": "Genetic Techniques",
    "category": "Subject Wise / Mixed",
    "file": "Genetic_Techniques.json",
    "questions": 34
  },
  {
    "title": "Genetic_and_metabolic_disorders",
    "category": "Subject Wise / Mixed",
    "file": "Genetic_and_metabolic_disorders.json",
    "questions": 24
  },
  {
    "title": "Genetics",
    "category": "Subject Wise / Mixed",
    "file": "Genetics.json",
    "questions": 21
  },
  {
    "title": "Genetics",
    "category": "Subject Wise / Mixed",
    "file": "Genetics_1.json",
    "questions": 79
  },
  {
    "title": "Genetics & Skin",
    "category": "Subject Wise / Mixed",
    "file": "Genetics__Skin.json",
    "questions": 19
  },
  {
    "title": "Genetics Basics & Genetic Disorders",
    "category": "Subject Wise / Mixed",
    "file": "Genetics_Basics__Genetic_Disorders.json",
    "questions": 28
  },
  {
    "title": "Genetics _ Molecular Biology",
    "category": "Subject Wise / Mixed",
    "file": "Genetics___Molecular_Biology.json",
    "questions": 158
  },
  {
    "title": "Genetics and Health",
    "category": "Subject Wise / Mixed",
    "file": "Genetics_and_Health.json",
    "questions": 19
  },
  {
    "title": "Genetics-DNA_and_Chromosome_Biochemistry__Structure__Replication__and_Repair",
    "category": "Subject Wise / Mixed",
    "file": "Genetics-DNA_and_Chromosome_Biochemistry__Structure__Replication__and_Repair.json",
    "questions": 27
  },
  {
    "title": "Genetics-Diagnosis_of_Genetic_Disorders_and_Miscellaneous",
    "category": "Subject Wise / Mixed",
    "file": "Genetics-Diagnosis_of_Genetic_Disorders_and_Miscellaneous.json",
    "questions": 15
  },
  {
    "title": "Genetics-Genetics-_Introduction___Mendelian_Disorders",
    "category": "Subject Wise / Mixed",
    "file": "Genetics-Genetics-_Introduction___Mendelian_Disorders.json",
    "questions": 12
  },
  {
    "title": "Genetics-Non-Mendelian_Disorders",
    "category": "Subject Wise / Mixed",
    "file": "Genetics-Non-Mendelian_Disorders.json",
    "questions": 15
  },
  {
    "title": "Genetics-PCR",
    "category": "Subject Wise / Mixed",
    "file": "Genetics-PCR.json",
    "questions": 11
  },
  {
    "title": "Genetics-Previous_Year_Questions",
    "category": "Subject Wise / Mixed",
    "file": "Genetics-Previous_Year_Questions.json",
    "questions": 44
  },
  {
    "title": "Genetics-Previous_Year_Questions",
    "category": "Subject Wise / Mixed",
    "file": "Genetics-Previous_Year_Questions_1.json",
    "questions": 44
  },
  {
    "title": "Genetics-RNA_Transcription__Genetic_code_mutation__Translation_inhibitors",
    "category": "Subject Wise / Mixed",
    "file": "Genetics-RNA_Transcription__Genetic_code_mutation__Translation_inhibitors.json",
    "questions": 20
  },
  {
    "title": "Genetics_",
    "category": "Subject Wise / Mixed",
    "file": "Genetics_.json",
    "questions": 19
  },
  {
    "title": "Genetics_and_Genetic_Disorders-Genetic_Disorders_and_Syndromes",
    "category": "Subject Wise / Mixed",
    "file": "Genetics_and_Genetic_Disorders-Genetic_Disorders_and_Syndromes.json",
    "questions": 19
  },
  {
    "title": "Genetics_and_Genetic_Disorders-Previous_Year_Questions",
    "category": "Subject Wise / Mixed",
    "file": "Genetics_and_Genetic_Disorders-Previous_Year_Questions.json",
    "questions": 20
  },
  {
    "title": "Genital Fistula",
    "category": "Subject Wise / Mixed",
    "file": "Genital_Fistula.json",
    "questions": 8
  },
  {
    "title": "Genital Prolapse",
    "category": "Subject Wise / Mixed",
    "file": "Genital_Prolapse.json",
    "questions": 23
  },
  {
    "title": "Genital Ulcerative Diseases",
    "category": "Subject Wise / Mixed",
    "file": "Genital_Ulcerative_Diseases.json",
    "questions": 20
  },
  {
    "title": "Genital_Infections-Previous_Year_Questions",
    "category": "Subject Wise / Mixed",
    "file": "Genital_Infections-Previous_Year_Questions.json",
    "questions": 26
  },
  {
    "title": "Genital_System-Pathology_of_Female_Genital_Tract-I",
    "category": "Subject Wise / Mixed",
    "file": "Genital_System-Pathology_of_Female_Genital_Tract-I.json",
    "questions": 11
  },
  {
    "title": "Genital_System-Pathology_of_Female_Genital_Tract-II",
    "category": "Subject Wise / Mixed",
    "file": "Genital_System-Pathology_of_Female_Genital_Tract-II.json",
    "questions": 20
  },
  {
    "title": "Genital_System-Pathology_of_Male_Genital_Tract",
    "category": "Subject Wise / Mixed",
    "file": "Genital_System-Pathology_of_Male_Genital_Tract.json",
    "questions": 17
  },
  {
    "title": "Genital_System-Previous_Year_Questions",
    "category": "Subject Wise / Mixed",
    "file": "Genital_System-Previous_Year_Questions.json",
    "questions": 10
  },
  {
    "title": "Genito-Urinary Radiology",
    "category": "Subject Wise / Mixed",
    "file": "Genito-Urinary_Radiology.json",
    "questions": 24
  },
  {
    "title": "Genitourinary_Imaging",
    "category": "Subject Wise / Mixed",
    "file": "Genitourinary_Imaging.json",
    "questions": 27
  },
  {
    "title": "Genitourinary_Radiology-Genitourinary_Radiology",
    "category": "Subject Wise / Mixed",
    "file": "Genitourinary_Radiology-Genitourinary_Radiology.json",
    "questions": 23
  },
  {
    "title": "Genitourinary_Radiology-Previous_Year_Questions",
    "category": "Subject Wise / Mixed",
    "file": "Genitourinary_Radiology-Previous_Year_Questions.json",
    "questions": 8
  },
  {
    "title": "Genodermatoses",
    "category": "Subject Wise / Mixed",
    "file": "Genodermatoses.json",
    "questions": 3
  },
  {
    "title": "Germ Cell And Sex Cord Storms Cancer",
    "category": "Subject Wise / Mixed",
    "file": "Germ_Cell_And_Sex_Cord_Storms_Cancer.json",
    "questions": 23
  },
  {
    "title": "Gestational Trophoblastic Neoplasia",
    "category": "Subject Wise / Mixed",
    "file": "Gestational_Trophoblastic_Neoplasia.json",
    "questions": 6
  },
  {
    "title": "Git & Liver Histology",
    "category": "Subject Wise / Mixed",
    "file": "Git__Liver_Histology.json",
    "questions": 7
  },
  {
    "title": "Glands - Parotid Gland",
    "category": "Subject Wise / Mixed",
    "file": "Glands_-_Parotid_Gland.json",
    "questions": 7
  },
  {
    "title": "Glands - Thyroid Gland",
    "category": "Subject Wise / Mixed",
    "file": "Glands_-_Thyroid_Gland.json",
    "questions": 5
  },
  {
    "title": "Glaucoma",
    "category": "Subject Wise / Mixed",
    "file": "Glaucoma.json",
    "questions": 8
  },
  {
    "title": "Glaucoma",
    "category": "Subject Wise / Mixed",
    "file": "Glaucoma_1.json",
    "questions": 10
  },
  {
    "title": "Glaucoma",
    "category": "Subject Wise / Mixed",
    "file": "Glaucoma_2.json",
    "questions": 10
  },
  {
    "title": "Glaucoma",
    "category": "Subject Wise / Mixed",
    "file": "Glaucoma_3.json",
    "questions": 57
  },
  {
    "title": "Glaucoma - Introduction",
    "category": "Subject Wise / Mixed",
    "file": "Glaucoma_-_Introduction.json",
    "questions": 5
  },
  {
    "title": "Glaucoma-Glaucoma-PACG__Treatment__Congenital_Glaucoma",
    "category": "Subject Wise / Mixed",
    "file": "Glaucoma-Glaucoma-PACG__Treatment__Congenital_Glaucoma.json",
    "questions": 25
  },
  {
    "title": "Glaucoma-Glaucoma_-_POAG__Tonometry__Perimetry",
    "category": "Subject Wise / Mixed",
    "file": "Glaucoma-Glaucoma_-_POAG__Tonometry__Perimetry.json",
    "questions": 18
  },
  {
    "title": "Glaucoma-Previous_Year_Questions",
    "category": "Subject Wise / Mixed",
    "file": "Glaucoma-Previous_Year_Questions.json",
    "questions": 24
  },
  {
    "title": "Glomerulonephritis Basics",
    "category": "Subject Wise / Mixed",
    "file": "Glomerulonephritis_Basics.json",
    "questions": 3
  },
  {
    "title": "Glomerulus",
    "category": "Subject Wise / Mixed",
    "file": "Glomerulus.json",
    "questions": 30
  },
  {
    "title": "Glomus Tumour",
    "category": "Subject Wise / Mixed",
    "file": "Glomus_Tumour.json",
    "questions": 7
  },
  {
    "title": "Glucocorticoid",
    "category": "Subject Wise / Mixed",
    "file": "Glucocorticoid.json",
    "questions": 4
  },
  {
    "title": "Gluconeogenesis",
    "category": "Subject Wise / Mixed",
    "file": "Gluconeogenesis.json",
    "questions": 27
  },
  {
    "title": "Gluconeogenesis",
    "category": "Subject Wise / Mixed",
    "file": "Gluconeogenesis_1.json",
    "questions": 15
  },
  {
    "title": "Glucose Transport",
    "category": "Subject Wise / Mixed",
    "file": "Glucose_Transport.json",
    "questions": 11
  },
  {
    "title": "Gluteal Region",
    "category": "Subject Wise / Mixed",
    "file": "Gluteal_Region.json",
    "questions": 4
  },
  {
    "title": "Glycogen Metabolism",
    "category": "Subject Wise / Mixed",
    "file": "Glycogen_Metabolism.json",
    "questions": 19
  },
  {
    "title": "Glycolysis",
    "category": "Subject Wise / Mixed",
    "file": "Glycolysis.json",
    "questions": 11
  },
  {
    "title": "Glycolysis_And_Pyruvate_Dehydrogenase_Complex",
    "category": "Subject Wise / Mixed",
    "file": "Glycolysis_And_Pyruvate_Dehydrogenase_Complex.json",
    "questions": 38
  },
  {
    "title": "Glycopeptides, Lipopeptides & Polymyxins",
    "category": "Subject Wise / Mixed",
    "file": "Glycopeptides_Lipopeptides__Polymyxins.json",
    "questions": 6
  },
  {
    "title": "Graft Rejection & GVHD",
    "category": "Subject Wise / Mixed",
    "file": "Graft_Rejection__GVHD.json",
    "questions": 4
  },
  {
    "title": "Grand_Test-10_Clinical_New_Pattern",
    "category": "Subject Wise / Mixed",
    "file": "Grand_Test-10_Clinical_New_Pattern.json",
    "questions": 200
  },
  {
    "title": "Grand_Test-11_Clinical_New_Pattern",
    "category": "Subject Wise / Mixed",
    "file": "Grand_Test-11_Clinical_New_Pattern.json",
    "questions": 200
  },
  {
    "title": "Grand_Test-12_Clinical_New_Pattern",
    "category": "Subject Wise / Mixed",
    "file": "Grand_Test-12_Clinical_New_Pattern.json",
    "questions": 200
  },
  {
    "title": "Grand_Test-13_Clinical_New_Pattern",
    "category": "Subject Wise / Mixed",
    "file": "Grand_Test-13_Clinical_New_Pattern.json",
    "questions": 200
  },
  {
    "title": "Grand_Test-14_Clinical_New_Pattern",
    "category": "Subject Wise / Mixed",
    "file": "Grand_Test-14_Clinical_New_Pattern.json",
    "questions": 200
  },
  {
    "title": "Grand_Test-15_Clinical_New_Pattern",
    "category": "Subject Wise / Mixed",
    "file": "Grand_Test-15_Clinical_New_Pattern.json",
    "questions": 200
  },
  {
    "title": "Grand_Test-16_Clinical_New_Pattern",
    "category": "Subject Wise / Mixed",
    "file": "Grand_Test-16_Clinical_New_Pattern.json",
    "questions": 200
  },
  {
    "title": "Grand_Test-179",
    "category": "Subject Wise / Mixed",
    "file": "Grand_Test-179.json",
    "questions": 300
  },
  {
    "title": "Grand_Test-17_Clinical_New_Pattern",
    "category": "Subject Wise / Mixed",
    "file": "Grand_Test-17_Clinical_New_Pattern.json",
    "questions": 200
  },
  {
    "title": "Grand_Test-18_Clinical_New_Pattern",
    "category": "Subject Wise / Mixed",
    "file": "Grand_Test-18_Clinical_New_Pattern.json",
    "questions": 200
  },
  {
    "title": "Grand_Test-19_Clinical_New_Pattern",
    "category": "Subject Wise / Mixed",
    "file": "Grand_Test-19_Clinical_New_Pattern.json",
    "questions": 200
  },
  {
    "title": "Grand_Test-1_Clinical_New_Pattern",
    "category": "Subject Wise / Mixed",
    "file": "Grand_Test-1_Clinical_New_Pattern.json",
    "questions": 200
  },
  {
    "title": "Grand_Test-20_Clinical_New_Pattern",
    "category": "Subject Wise / Mixed",
    "file": "Grand_Test-20_Clinical_New_Pattern.json",
    "questions": 200
  },
  {
    "title": "Grand_Test-21_Clinical_New_Pattern",
    "category": "Subject Wise / Mixed",
    "file": "Grand_Test-21_Clinical_New_Pattern.json",
    "questions": 200
  },
  {
    "title": "Grand_Test-22_Clinical_New_Pattern",
    "category": "Subject Wise / Mixed",
    "file": "Grand_Test-22_Clinical_New_Pattern.json",
    "questions": 200
  },
  {
    "title": "Grand_Test-23_Clinical_New_Pattern",
    "category": "Subject Wise / Mixed",
    "file": "Grand_Test-23_Clinical_New_Pattern.json",
    "questions": 200
  },
  {
    "title": "Grand_Test-25_Clinical_New_Pattern",
    "category": "Subject Wise / Mixed",
    "file": "Grand_Test-25_Clinical_New_Pattern.json",
    "questions": 200
  },
  {
    "title": "Grand_Test-26",
    "category": "Subject Wise / Mixed",
    "file": "Grand_Test-26.json",
    "questions": 200
  },
  {
    "title": "Grand_Test-27",
    "category": "Subject Wise / Mixed",
    "file": "Grand_Test-27.json",
    "questions": 200
  },
  {
    "title": "Grand_Test-28",
    "category": "Subject Wise / Mixed",
    "file": "Grand_Test-28.json",
    "questions": 200
  },
  {
    "title": "Grand_Test-29",
    "category": "Subject Wise / Mixed",
    "file": "Grand_Test-29.json",
    "questions": 200
  },
  {
    "title": "Grand_Test-2_Clinical_New_Pattern",
    "category": "Subject Wise / Mixed",
    "file": "Grand_Test-2_Clinical_New_Pattern.json",
    "questions": 200
  },
  {
    "title": "Grand_Test-30",
    "category": "Subject Wise / Mixed",
    "file": "Grand_Test-30.json",
    "questions": 200
  },
  {
    "title": "Grand_Test-31",
    "category": "Subject Wise / Mixed",
    "file": "Grand_Test-31.json",
    "questions": 200
  },
  {
    "title": "Grand_Test-32",
    "category": "Subject Wise / Mixed",
    "file": "Grand_Test-32.json",
    "questions": 200
  },
  {
    "title": "Grand_Test-33",
    "category": "Subject Wise / Mixed",
    "file": "Grand_Test-33.json",
    "questions": 200
  },
  {
    "title": "Grand_Test-34",
    "category": "Subject Wise / Mixed",
    "file": "Grand_Test-34.json",
    "questions": 200
  },
  {
    "title": "Grand_Test-35",
    "category": "Subject Wise / Mixed",
    "file": "Grand_Test-35.json",
    "questions": 200
  },
  {
    "title": "Grand_Test-36",
    "category": "Subject Wise / Mixed",
    "file": "Grand_Test-36.json",
    "questions": 200
  },
  {
    "title": "Grand_Test-37",
    "category": "Subject Wise / Mixed",
    "file": "Grand_Test-37.json",
    "questions": 200
  },
  {
    "title": "Grand_Test-38",
    "category": "Subject Wise / Mixed",
    "file": "Grand_Test-38.json",
    "questions": 200
  },
  {
    "title": "Grand_Test-39_5_Sections",
    "category": "Subject Wise / Mixed",
    "file": "Grand_Test-39_5_Sections.json",
    "questions": 200
  },
  {
    "title": "Grand_Test-3_Clinical_New_Pattern",
    "category": "Subject Wise / Mixed",
    "file": "Grand_Test-3_Clinical_New_Pattern.json",
    "questions": 200
  },
  {
    "title": "Grand_Test-40_5_Sections",
    "category": "Subject Wise / Mixed",
    "file": "Grand_Test-40_5_Sections.json",
    "questions": 200
  },
  {
    "title": "Grand_Test-41_5_Sections",
    "category": "Subject Wise / Mixed",
    "file": "Grand_Test-41_5_Sections.json",
    "questions": 200
  },
  {
    "title": "Grand_Test-42_5_Sections",
    "category": "Subject Wise / Mixed",
    "file": "Grand_Test-42_5_Sections.json",
    "questions": 200
  },
  {
    "title": "Grand_Test-43_5_Sections",
    "category": "Subject Wise / Mixed",
    "file": "Grand_Test-43_5_Sections.json",
    "questions": 200
  },
  {
    "title": "Grand_Test-44_5_Sections",
    "category": "Subject Wise / Mixed",
    "file": "Grand_Test-44_5_Sections.json",
    "questions": 200
  },
  {
    "title": "Grand_Test-45_5_Sections",
    "category": "Subject Wise / Mixed",
    "file": "Grand_Test-45_5_Sections.json",
    "questions": 200
  },
  {
    "title": "Grand_Test-46_5_Sections",
    "category": "Subject Wise / Mixed",
    "file": "Grand_Test-46_5_Sections.json",
    "questions": 200
  },
  {
    "title": "Grand_Test-47_5_Sections",
    "category": "Subject Wise / Mixed",
    "file": "Grand_Test-47_5_Sections.json",
    "questions": 200
  },
  {
    "title": "Grand_Test-48_5_Sections",
    "category": "Subject Wise / Mixed",
    "file": "Grand_Test-48_5_Sections.json",
    "questions": 200
  },
  {
    "title": "Grand_Test-49_5_Sections",
    "category": "Subject Wise / Mixed",
    "file": "Grand_Test-49_5_Sections.json",
    "questions": 200
  },
  {
    "title": "Grand_Test-4_Clinical_New_Pattern",
    "category": "Subject Wise / Mixed",
    "file": "Grand_Test-4_Clinical_New_Pattern.json",
    "questions": 200
  },
  {
    "title": "Grand_Test-50_5_Sections",
    "category": "Subject Wise / Mixed",
    "file": "Grand_Test-50_5_Sections.json",
    "questions": 200
  },
  {
    "title": "Grand_Test-51_5_Sections",
    "category": "Subject Wise / Mixed",
    "file": "Grand_Test-51_5_Sections.json",
    "questions": 200
  },
  {
    "title": "Grand_Test-5_Clinical_New_Pattern",
    "category": "Subject Wise / Mixed",
    "file": "Grand_Test-5_Clinical_New_Pattern.json",
    "questions": 200
  },
  {
    "title": "Grand_Test-6_Clinical_New_Pattern",
    "category": "Subject Wise / Mixed",
    "file": "Grand_Test-6_Clinical_New_Pattern.json",
    "questions": 200
  },
  {
    "title": "Grand_Test-7_Clinical_New_Pattern",
    "category": "Subject Wise / Mixed",
    "file": "Grand_Test-7_Clinical_New_Pattern.json",
    "questions": 200
  },
  {
    "title": "Grand_Test-8_Clinical_New_Pattern",
    "category": "Subject Wise / Mixed",
    "file": "Grand_Test-8_Clinical_New_Pattern.json",
    "questions": 200
  },
  {
    "title": "Grand_Test-9_Clinical_New_Pattern",
    "category": "Subject Wise / Mixed",
    "file": "Grand_Test-9_Clinical_New_Pattern.json",
    "questions": 200
  },
  {
    "title": "Grand_Test_-_152",
    "category": "Subject Wise / Mixed",
    "file": "Grand_Test_-_152.json",
    "questions": 300
  },
  {
    "title": "Grand_Test_-_153",
    "category": "Subject Wise / Mixed",
    "file": "Grand_Test_-_153.json",
    "questions": 300
  },
  {
    "title": "Grand_Test_-_154",
    "category": "Subject Wise / Mixed",
    "file": "Grand_Test_-_154.json",
    "questions": 300
  },
  {
    "title": "Grand_Test_-_155",
    "category": "Subject Wise / Mixed",
    "file": "Grand_Test_-_155.json",
    "questions": 300
  },
  {
    "title": "Grand_Test_-_156",
    "category": "Subject Wise / Mixed",
    "file": "Grand_Test_-_156.json",
    "questions": 299
  },
  {
    "title": "Grand_Test_-_157",
    "category": "Subject Wise / Mixed",
    "file": "Grand_Test_-_157.json",
    "questions": 300
  },
  {
    "title": "Grand_Test_-_158",
    "category": "Subject Wise / Mixed",
    "file": "Grand_Test_-_158.json",
    "questions": 300
  },
  {
    "title": "Grand_Test_-_159",
    "category": "Subject Wise / Mixed",
    "file": "Grand_Test_-_159.json",
    "questions": 300
  },
  {
    "title": "Grand_Test_-_160",
    "category": "Subject Wise / Mixed",
    "file": "Grand_Test_-_160.json",
    "questions": 300
  },
  {
    "title": "Grand_Test_-_161",
    "category": "Subject Wise / Mixed",
    "file": "Grand_Test_-_161.json",
    "questions": 300
  },
  {
    "title": "Grand_Test_-_162",
    "category": "Subject Wise / Mixed",
    "file": "Grand_Test_-_162.json",
    "questions": 300
  },
  {
    "title": "Grand_Test_-_163",
    "category": "Subject Wise / Mixed",
    "file": "Grand_Test_-_163.json",
    "questions": 300
  },
  {
    "title": "Grand_Test_-_164",
    "category": "Subject Wise / Mixed",
    "file": "Grand_Test_-_164.json",
    "questions": 300
  },
  {
    "title": "Grand_Test_-_165",
    "category": "Subject Wise / Mixed",
    "file": "Grand_Test_-_165.json",
    "questions": 300
  },
  {
    "title": "Grand_Test_-_166",
    "category": "Subject Wise / Mixed",
    "file": "Grand_Test_-_166.json",
    "questions": 300
  },
  {
    "title": "Grand_Test_-_167",
    "category": "Subject Wise / Mixed",
    "file": "Grand_Test_-_167.json",
    "questions": 300
  },
  {
    "title": "Grand_Test_-_168",
    "category": "Subject Wise / Mixed",
    "file": "Grand_Test_-_168.json",
    "questions": 300
  },
  {
    "title": "Grand_Test_-_169",
    "category": "Subject Wise / Mixed",
    "file": "Grand_Test_-_169.json",
    "questions": 300
  },
  {
    "title": "Grand_Test_-_171",
    "category": "Subject Wise / Mixed",
    "file": "Grand_Test_-_171.json",
    "questions": 300
  },
  {
    "title": "Grand_Test_-_172",
    "category": "Subject Wise / Mixed",
    "file": "Grand_Test_-_172.json",
    "questions": 299
  },
  {
    "title": "Grand_Test_-_173",
    "category": "Subject Wise / Mixed",
    "file": "Grand_Test_-_173.json",
    "questions": 300
  },
  {
    "title": "Grand_Test_-_174",
    "category": "Subject Wise / Mixed",
    "file": "Grand_Test_-_174.json",
    "questions": 300
  },
  {
    "title": "Grand_Test_-_175",
    "category": "Subject Wise / Mixed",
    "file": "Grand_Test_-_175.json",
    "questions": 300
  },
  {
    "title": "Grand_Test_-_176",
    "category": "Subject Wise / Mixed",
    "file": "Grand_Test_-_176.json",
    "questions": 300
  },
  {
    "title": "Grand_Test_-_177",
    "category": "Subject Wise / Mixed",
    "file": "Grand_Test_-_177.json",
    "questions": 300
  },
  {
    "title": "Grand_Test_-_178",
    "category": "Subject Wise / Mixed",
    "file": "Grand_Test_-_178.json",
    "questions": 300
  },
  {
    "title": "Grand_Test_150",
    "category": "Subject Wise / Mixed",
    "file": "Grand_Test_150.json",
    "questions": 300
  },
  {
    "title": "Grand_Test_151",
    "category": "Subject Wise / Mixed",
    "file": "Grand_Test_151.json",
