[
  {
    "file": "Abdomen__Pelvis.json",
    "title": "Abdomen  Pelvis",
    "count": 147,
    "category": "Anatomy"
  },
  {
    "file": "Abdomen__Pelvis_1.json",
    "title": "Abdomen  Pelvis 1",
    "count": 178,
    "category": "Anatomy"
  },
  {
    "file": "Abdomen-Abdomen_Arterial_Supply__Venous_Drainage_of_Thorax_and_Abdomen.json",
    "title": "Abdomen Abdomen Arterial Supply  Venous Drainage Of Thorax And Abdomen",
    "count": 17,
    "category": "Anatomy"
  },
  {
    "file": "Abdomen-Abdominal_Neurovascular_Bundles.json",
    "title": "Abdomen Abdominal Neurovascular Bundles",
    "count": 8,
    "category": "Anatomy"
  },
  {
    "file": "Abdomen-Anatomy__Abdominal_Organs.json",
    "title": "Abdomen Anatomy  Abdominal Organs",
    "count": 12,
    "category": "Anatomy"
  },
  {
    "file": "Abdomen-Anatomy__Pancreas__Kidney__and_Ureter.json",
    "title": "Abdomen Anatomy  Pancreas  Kidney  And Ureter",
    "count": 10,
    "category": "Anatomy"
  },
  {
    "file": "Abdomen-Embryology_of_Abdominal_Organs.json",
    "title": "Abdomen Embryology Of Abdominal Organs",
    "count": 24,
    "category": "Anatomy"
  },
  {
    "file": "Abdomen-Inguinal_and_Femoral_Anatomy_and_Hernia__Abdominal_Wall_Layers__Peritoneal_Cavity.json",
    "title": "Abdomen Inguinal And Femoral Anatomy And Hernia  Abdominal Wall Layers  Peritoneal Cavity",
    "count": 14,
    "category": "Anatomy"
  },
  {
    "file": "Abdominal_Wall_-_1_Landmarks__Inguinal_Canal.json",
    "title": "Abdominal Wall   1 Landmarks  Inguinal Canal",
    "count": 9,
    "category": "Anatomy"
  },
  {
    "file": "Abdominal_Wall_-_2_Rectus_Sheath__Thoracolumbar_Fascia.json",
    "title": "Abdominal Wall   2 Rectus Sheath  Thoracolumbar Fascia",
    "count": 8,
    "category": "Anatomy"
  },
  {
    "file": "Adnexa__Appendages.json",
    "title": "Adnexa  Appendages",
    "count": 22,
    "category": "Anatomy"
  },
  {
    "file": "Anat_ENT_Psychi__Radio_Cumulative_Test_The_Champion_Batch-2_Hyderabad_-_03-04-2025_-_2025-04-03.json",
    "title": "Anat Ent Psychi  Radio Cumulative Test The Champion Batch 2 Hyderabad   03 04 2025   2025 04 03",
    "count": 199,
    "category": "Anatomy"
  },
  {
    "file": "Anatomy.json",
    "title": "Anatomy",
    "count": 20,
    "category": "Anatomy"
  },
  {
    "file": "Anatomy_-_AIIMS_JUNE_2020.json",
    "title": "Anatomy   Aiims June 2020",
    "count": 15,
    "category": "Anatomy"
  },
  {
    "file": "Anatomy_-_AIIMS_MAY_2018.json",
    "title": "Anatomy   Aiims May 2018",
    "count": 13,
    "category": "Anatomy"
  },
  {
    "file": "Anatomy_-_AIIMS_MAY_2019.json",
    "title": "Anatomy   Aiims May 2019",
    "count": 11,
    "category": "Anatomy"
  },
  {
    "file": "Anatomy_-_AIIMS_NOV_2018.json",
    "title": "Anatomy   Aiims Nov 2018",
    "count": 30,
    "category": "Anatomy"
  },
  {
    "file": "Anatomy_-_AIIMS_NOV_2019.json",
    "title": "Anatomy   Aiims Nov 2019",
    "count": 13,
    "category": "Anatomy"
  },
  {
    "file": "Anatomy_-_INI_CET_2020.json",
    "title": "Anatomy   Ini Cet 2020",
    "count": 11,
    "category": "Anatomy"
  },
  {
    "file": "Anatomy_-_INI_CET_JULY_2021.json",
    "title": "Anatomy   Ini Cet July 2021",
    "count": 6,
    "category": "Anatomy"
  },
  {
    "file": "Anatomy_-_INI_CET_MAY_2022.json",
    "title": "Anatomy   Ini Cet May 2022",
    "count": 8,
    "category": "Anatomy"
  },
  {
    "file": "Anatomy_-_INI_CET_MAY_2023.json",
    "title": "Anatomy   Ini Cet May 2023",
    "count": 5,
    "category": "Anatomy"
  },
  {
    "file": "Anatomy_-_INI_CET_NOV_2021.json",
    "title": "Anatomy   Ini Cet Nov 2021",
    "count": 14,
    "category": "Anatomy"
  },
  {
    "file": "Anatomy_-_INI_CET_NOV_2023.json",
    "title": "Anatomy   Ini Cet Nov 2023",
    "count": 17,
    "category": "Anatomy"
  },
  {
    "file": "Anatomy_-_INI_CET_NOVEMBER_2022_PART_-_A.json",
    "title": "Anatomy   Ini Cet November 2022 Part   A",
    "count": 7,
    "category": "Anatomy"
  },
  {
    "file": "Anatomy_-_INI_CET_NOVEMBER_2022_PART_-_B.json",
    "title": "Anatomy   Ini Cet November 2022 Part   B",
    "count": 15,
    "category": "Anatomy"
  },
  {
    "file": "Anatomy_-_INICET_MAY_2024.json",
    "title": "Anatomy   Inicet May 2024",
    "count": 11,
    "category": "Anatomy"
  },
  {
    "file": "Anatomy_-_NEET_PG_2018.json",
    "title": "Anatomy   Neet Pg 2018",
    "count": 12,
    "category": "Anatomy"
  },
  {
    "file": "Anatomy_-_NEET_PG_2019.json",
    "title": "Anatomy   Neet Pg 2019",
    "count": 20,
    "category": "Anatomy"
  },
  {
    "file": "Anatomy_-_NEET_PG_2020.json",
    "title": "Anatomy   Neet Pg 2020",
    "count": 17,
    "category": "Anatomy"
  },
  {
    "file": "Anatomy_-_NEET_PG_2021.json",
    "title": "Anatomy   Neet Pg 2021",
    "count": 7,
    "category": "Anatomy"
  },
  {
    "file": "Anatomy_-_NEET_PG_2022.json",
    "title": "Anatomy   Neet Pg 2022",
    "count": 3,
    "category": "Anatomy"
  },
  {
    "file": "Anatomy_-_NEET_PG_2023.json",
    "title": "Anatomy   Neet Pg 2023",
    "count": 10,
    "category": "Anatomy"
  },
  {
    "file": "Anatomy_-_NEET_PG_2024.json",
    "title": "Anatomy   Neet Pg 2024",
    "count": 10,
    "category": "Anatomy"
  },
  {
    "file": "Anatomy-_Class_Test_With_Video_Solution.json",
    "title": "Anatomy  Class Test With Video Solution",
    "count": 75,
    "category": "Anatomy"
  },
  {
    "file": "Anatomy__Physiology.json",
    "title": "Anatomy  Physiology",
    "count": 16,
    "category": "Anatomy"
  },
  {
    "file": "Anatomy__Physiology_Of_Bone.json",
    "title": "Anatomy  Physiology Of Bone",
    "count": 37,
    "category": "Anatomy"
  },
  {
    "file": "Anatomy__Physiology_of_Lymphatic_System.json",
    "title": "Anatomy  Physiology Of Lymphatic System",
    "count": 2,
    "category": "Anatomy"
  },
  {
    "file": "Anatomy_-Thorax__General_Histology-Special_First_Year_Class_Test.json",
    "title": "Anatomy  Thorax  General Histology Special First Year Class Test",
    "count": 40,
    "category": "Anatomy"
  },
  {
    "file": "Anatomy_1.json",
    "title": "Anatomy 1",
    "count": 20,
    "category": "Anatomy"
  },
  {
    "file": "Anatomy_AIIMS_2014-2018.json",
    "title": "Anatomy Aiims 2014 2018",
    "count": 135,
    "category": "Anatomy"
  },
  {
    "file": "Anatomy_and_Physiology_of_Larnyx.json",
    "title": "Anatomy And Physiology Of Larnyx",
    "count": 13,
    "category": "Anatomy"
  },
  {
    "file": "Anatomy_and_Physiology_of_Nose.json",
    "title": "Anatomy And Physiology Of Nose",
    "count": 18,
    "category": "Anatomy"
  },
  {
    "file": "Anatomy_Clinical_Vignettes.json",
    "title": "Anatomy Clinical Vignettes",
    "count": 129,
    "category": "Anatomy"
  },
  {
    "file": "Anatomy_Dissection_Based_Questions.json",
    "title": "Anatomy Dissection Based Questions",
    "count": 50,
    "category": "Anatomy"
  },
  {
    "file": "Anatomy_Dr_Sandeep.json",
    "title": "Anatomy Dr Sandeep",
    "count": 25,
    "category": "Anatomy"
  },
  {
    "file": "07_Anatomy_Dr_Sandeep.json",
    "title": "Anatomy Dr Sandeep",
    "count": 40,
    "category": "Anatomy"
  },
  {
    "file": "Anatomy_Dr_Sandeep-2026.json",
    "title": "Anatomy Dr Sandeep 2026",
    "count": 200,
    "category": "Anatomy"
  },
  {
    "file": "Anatomy_Dr_Sandeep-2026_1.json",
    "title": "Anatomy Dr Sandeep 2026 1",
    "count": 200,
    "category": "Anatomy"
  },
  {
    "file": "Anatomy_DR_Sandeep_Class_Test_FMGE.json",
    "title": "Anatomy Dr Sandeep Class Test Fmge",
    "count": 40,
    "category": "Anatomy"
  },
  {
    "file": "Anatomy_DVT_Revision_Test.json",
    "title": "Anatomy Dvt Revision Test",
    "count": 25,
    "category": "Anatomy"
  },
  {
    "file": "Anatomy_ED_-_Mission_10_-_02-01-2024_-_2024-01-02.json",
    "title": "Anatomy Ed   Mission 10   02 01 2024   2024 01 02",
    "count": 50,
    "category": "Anatomy"
  },
  {
    "file": "Anatomy_ED_-_Mission_10_Revision_-_27-10-2023_-_2023-10-27.json",
    "title": "Anatomy Ed   Mission 10 Revision   27 10 2023   2023 10 27",
    "count": 50,
    "category": "Anatomy"
  },
  {
    "file": "Anatomy_ED_-_Mission_15_-_23-03-2024_-_2024-03-23.json",
    "title": "Anatomy Ed   Mission 15   23 03 2024   2024 03 23",
    "count": 100,
    "category": "Anatomy"
  },
  {
    "file": "Anatomy_ED_-_Mission_15_Lap_2_-_09-06-2024_-_2024-06-09.json",
    "title": "Anatomy Ed   Mission 15 Lap 2   09 06 2024   2024 06 09",
    "count": 50,
    "category": "Anatomy"
  },
  {
    "file": "Anatomy_ED_-_Mission_20_-_22-06-2024_-_2024-06-22.json",
    "title": "Anatomy Ed   Mission 20   22 06 2024   2024 06 22",
    "count": 100,
    "category": "Anatomy"
  },
  {
    "file": "Anatomy_ED_-_Mission_20_Batch_2_-_13-10-2024_-_2024-10-13.json",
    "title": "Anatomy Ed   Mission 20 Batch 2   13 10 2024   2024 10 13",
    "count": 100,
    "category": "Anatomy"
  },
  {
    "file": "Anatomy_ED_-_Mission_20_Batch_3_-_11-01-2025_-_2025-01-11.json",
    "title": "Anatomy Ed   Mission 20 Batch 3   11 01 2025   2025 01 11",
    "count": 75,
    "category": "Anatomy"
  },
  {
    "file": "Anatomy_ED_-_Mission_20_INICET_-_28-09-2024_-_2024-09-28.json",
    "title": "Anatomy Ed   Mission 20 Inicet   28 09 2024   2024 09 28",
    "count": 100,
    "category": "Anatomy"
  },
  {
    "file": "Anatomy_ED_-_Mission_20_Lap_2_-_19-04-2025_-_2025-04-19.json",
    "title": "Anatomy Ed   Mission 20 Lap 2   19 04 2025   2025 04 19",
    "count": 100,
    "category": "Anatomy"
  },
  {
    "file": "Anatomy_ED_-_Mission_NEET_PG_20_-_Final_Batch_-_10-06-2025_-_2025-06-10.json",
    "title": "Anatomy Ed   Mission Neet Pg 20   Final Batch   10 06 2025   2025 06 10",
    "count": 75,
    "category": "Anatomy"
  },
  {
    "file": "Anatomy_ED_Test-1_-_28-05-2023_-_2023-05-28.json",
    "title": "Anatomy Ed Test 1   28 05 2023   2023 05 28",
    "count": 50,
    "category": "Anatomy"
  },
  {
    "file": "Anatomy_ED_Test-2_-_03-06-2023_-_2023-06-03.json",
    "title": "Anatomy Ed Test 2   03 06 2023   2023 06 03",
    "count": 50,
    "category": "Anatomy"
  },
  {
    "file": "17_Anatomy_FMGE_Dr_Sandeep.json",
    "title": "Anatomy Fmge Dr Sandeep",
    "count": 40,
    "category": "Anatomy"
  },
  {
    "file": "Anatomy_FMGE_Dr_Sandeep.json",
    "title": "Anatomy Fmge Dr Sandeep",
    "count": 40,
    "category": "Anatomy"
  },
  {
    "file": "Anatomy_FMGE_PYQ.json",
    "title": "Anatomy Fmge Pyq",
    "count": 115,
    "category": "Anatomy"
  },
  {
    "file": "Anatomy_Image_Based_Question.json",
    "title": "Anatomy Image Based Question",
    "count": 80,
    "category": "Anatomy"
  },
  {
    "file": "ANATOMY-INICET_NOV_2024.json",
    "title": "Anatomy Inicet Nov 2024",
    "count": 11,
    "category": "Anatomy"
  },
  {
    "file": "Anatomy_INICET_PYQ.json",
    "title": "Anatomy Inicet Pyq",
    "count": 159,
    "category": "Anatomy"
  },
  {
    "file": "Anatomy_Last_Month_ED_-_17-07-2024_-_2024-07-17.json",
    "title": "Anatomy Last Month Ed   17 07 2024   2024 07 17",
    "count": 25,
    "category": "Anatomy"
  },
  {
    "file": "Anatomy_Lower_Limb_Gen_EmbryoGeneral_Anatomy_Special_First_Year_Class_Test.json",
    "title": "Anatomy Lower Limb Gen Embryogeneral Anatomy Special First Year Class Test",
    "count": 40,
    "category": "Anatomy"
  },
  {
    "file": "Anatomy_MIQ_Series.json",
    "title": "Anatomy Miq Series",
    "count": 20,
    "category": "Anatomy"
  },
  {
    "file": "Anatomy_NEETPG_PYQ.json",
    "title": "Anatomy Neetpg Pyq",
    "count": 95,
    "category": "Anatomy"
  },
  {
    "file": "Anatomy_of_Ear.json",
    "title": "Anatomy Of Ear",
    "count": 6,
    "category": "Anatomy"
  },
  {
    "file": "Anatomy_Of_External_Ear__Tympanic_Membrane.json",
    "title": "Anatomy Of External Ear  Tympanic Membrane",
    "count": 22,
    "category": "Anatomy"
  },
  {
    "file": "Anatomy_Of_External_Genitalia.json",
    "title": "Anatomy Of External Genitalia",
    "count": 9,
    "category": "Anatomy"
  },
  {
    "file": "Anatomy_of_Larynx.json",
    "title": "Anatomy Of Larynx",
    "count": 4,
    "category": "Anatomy"
  },
  {
    "file": "Anatomy_Of_Larynx_Part_1.json",
    "title": "Anatomy Of Larynx Part 1",
    "count": 10,
    "category": "Anatomy"
  },
  {
    "file": "Anatomy_Of_Larynx_Part_2.json",
    "title": "Anatomy Of Larynx Part 2",
    "count": 12,
    "category": "Anatomy"
  },
  {
    "file": "Anatomy_of_Middle_Ear_-_Medial__Posterior_Walls.json",
    "title": "Anatomy Of Middle Ear   Medial  Posterior Walls",
    "count": 13,
    "category": "Anatomy"
  },
  {
    "file": "Anatomy_of_Middle_Ear_Anterior_Wall.json",
    "title": "Anatomy Of Middle Ear Anterior Wall",
    "count": 10,
    "category": "Anatomy"
  },
  {
    "file": "Anatomy_of_Nose_and_Paranasal_Sinuses.json",
    "title": "Anatomy Of Nose And Paranasal Sinuses",
    "count": 5,
    "category": "Anatomy"
  },
  {
    "file": "Anatomy_of_Pharnyx.json",
    "title": "Anatomy Of Pharnyx",
    "count": 10,
    "category": "Anatomy"
  },
  {
    "file": "Anatomy_of_Sinunes.json",
    "title": "Anatomy Of Sinunes",
    "count": 16,
    "category": "Anatomy"
  },
  {
    "file": "Anatomy_of_Throat__Neck_Spaces.json",
    "title": "Anatomy Of Throat  Neck Spaces",
    "count": 7,
    "category": "Anatomy"
  },
  {
    "file": "Anatomy_of_Throat__Tonsils.json",
    "title": "Anatomy Of Throat  Tonsils",
    "count": 5,
    "category": "Anatomy"
  },
  {
    "file": "Anatomy-Special_First_Year_Class_Test.json",
    "title": "Anatomy Special First Year Class Test",
    "count": 30,
    "category": "Anatomy"
  },
  {
    "file": "Anatomy_Test_The_Champion_Batch_Hyderabad_-_11-11-2024_-_2024-11-11.json",
    "title": "Anatomy Test The Champion Batch Hyderabad   11 11 2024   2024 11 11",
    "count": 100,
    "category": "Anatomy"
  },
  {
    "file": "Anatomy_Test_The_Champion_Batch_Hyderabad_-_20-05-2024_-_2024-05-20.json",
    "title": "Anatomy Test The Champion Batch Hyderabad   20 05 2024   2024 05 20",
    "count": 100,
    "category": "Anatomy"
  },
  {
    "file": "Anatomy_Test_The_Champion_Batch_Hyderabad_-_22-03-2025_-_2025-03-22.json",
    "title": "Anatomy Test The Champion Batch Hyderabad   22 03 2025   2025 03 22",
    "count": 100,
    "category": "Anatomy"
  },
  {
    "file": "Anatomy_Upper_Limb-Special_First_Year_Class_Test.json",
    "title": "Anatomy Upper Limb Special First Year Class Test",
    "count": 30,
    "category": "Anatomy"
  },
  {
    "file": "Anterior_Triangles_of_The_Neck.json",
    "title": "Anterior Triangles Of The Neck",
    "count": 5,
    "category": "Anatomy"
  },
  {
    "file": "Appendix.json",
    "title": "Appendix",
    "count": 32,
    "category": "Anatomy"
  },
  {
    "file": "Appendix_1.json",
    "title": "Appendix 1",
    "count": 29,
    "category": "Anatomy"
  },
  {
    "file": "Applied_anatomy_and_heading.json",
    "title": "Applied Anatomy And Heading",
    "count": 56,
    "category": "Anatomy"
  },
  {
    "file": "Arches_of_Foot.json",
    "title": "Arches Of Foot",
    "count": 6,
    "category": "Anatomy"
  },
  {
    "file": "Arterial_Supply_of_Heart.json",
    "title": "Arterial Supply Of Heart",
    "count": 7,
    "category": "Anatomy"
  },
  {
    "file": "Arterial_System.json",
    "title": "Arterial System",
    "count": 40,
    "category": "Anatomy"
  },
  {
    "file": "Ascending_Tracts.json",
    "title": "Ascending Tracts",
    "count": 15,
    "category": "Anatomy"
  },
  {
    "file": "Back_Region-Back_Region.json",
    "title": "Back Region Back Region",
    "count": 17,
    "category": "Anatomy"
  },
  {
    "file": "Back_Region-Previous_Year_Questions.json",
    "title": "Back Region Previous Year Questions",
    "count": 8,
    "category": "Anatomy"
  },
  {
    "file": "Basal_Ganglia.json",
    "title": "Basal Ganglia",
    "count": 8,
    "category": "Anatomy"
  },
  {
    "file": "Basal_Ganglia__Cerebellum.json",
    "title": "Basal Ganglia  Cerebellum",
    "count": 21,
    "category": "Anatomy"
  },
  {
    "file": "Basic_Concept_Tricks_and_Magic_of_Anatomy.json",
    "title": "Basic Concept Tricks And Magic Of Anatomy",
    "count": 2,
    "category": "Anatomy"
  },
  {
    "file": "Basic_Peripheral_Nerve_Injuries.json",
    "title": "Basic Peripheral Nerve Injuries",
    "count": 19,
    "category": "Anatomy"
  },
  {
    "file": "Bilaminar_Germ_Disk_Formation__Gastrulation.json",
    "title": "Bilaminar Germ Disk Formation  Gastrulation",
    "count": 10,
    "category": "Anatomy"
  },
  {
    "file": "Bile_Duct.json",
    "title": "Bile Duct",
    "count": 6,
    "category": "Anatomy"
  },
  {
    "file": "Biliary_System.json",
    "title": "Biliary System",
    "count": 44,
    "category": "Anatomy"
  },
  {
    "file": "Bladder.json",
    "title": "Bladder",
    "count": 37,
    "category": "Anatomy"
  },
  {
    "file": "Blood_Supply_of_Brain.json",
    "title": "Blood Supply Of Brain",
    "count": 8,
    "category": "Anatomy"
  },
  {
    "file": "Blood_Supply_of_Face.json",
    "title": "Blood Supply Of Face",
    "count": 6,
    "category": "Anatomy"
  },
  {
    "file": "Blood_Supply_Upper_limb.json",
    "title": "Blood Supply Upper Limb",
    "count": 14,
    "category": "Anatomy"
  },
  {
    "file": "Blood_Vessels_-_Axillary_Artery__Anastomosis_Around_Scapula.json",
    "title": "Blood Vessels   Axillary Artery  Anastomosis Around Scapula",
    "count": 22,
    "category": "Anatomy"
  },
  {
    "file": "Blood_Vessels_-_Brachial_Artery_-_Anastomosis_Around_Elbow.json",
    "title": "Blood Vessels   Brachial Artery   Anastomosis Around Elbow",
    "count": 4,
    "category": "Anatomy"
  },
  {
    "file": "Blood_Vessels_of_Head_Neck__Face.json",
    "title": "Blood Vessels Of Head Neck  Face",
    "count": 9,
    "category": "Anatomy"
  },
  {
    "file": "Brachial_Plexus.json",
    "title": "Brachial Plexus",
    "count": 16,
    "category": "Anatomy"
  },
  {
    "file": "Brachial_Plexus_1.json",
    "title": "Brachial Plexus 1",
    "count": 15,
    "category": "Anatomy"
  },
  {
    "file": "Brain.json",
    "title": "Brain",
    "count": 65,
    "category": "Anatomy"
  },
  {
    "file": "Cavernous_Sinus.json",
    "title": "Cavernous Sinus",
    "count": 4,
    "category": "Anatomy"
  },
  {
    "file": "Cerebellum.json",
    "title": "Cerebellum",
    "count": 13,
    "category": "Anatomy"
  },
  {
    "file": "Cerebral_Cortex.json",
    "title": "Cerebral Cortex",
    "count": 15,
    "category": "Anatomy"
  },
  {
    "file": "Cerebrum_-_Homunculus_Histology__Diencephalon.json",
    "title": "Cerebrum   Homunculus Histology  Diencephalon",
    "count": 8,
    "category": "Anatomy"
  },
  {
    "file": "Clavipectoral_Fascia__Intermuscular_Scapular_Spaces.json",
    "title": "Clavipectoral Fascia  Intermuscular Scapular Spaces",
    "count": 5,
    "category": "Anatomy"
  },
  {
    "file": "CNS.json",
    "title": "Cns",
    "count": 33,
    "category": "Anatomy"
  },
  {
    "file": "CNS-Brainstem_Syndrome.json",
    "title": "Cns Brainstem Syndrome",
    "count": 5,
    "category": "Anatomy"
  },
  {
    "file": "Collagen_Fibers_Junctional_Complexes_Cardiac__Skeletal_Muscles__Types_of_Cartilages.json",
    "title": "Collagen Fibers Junctional Complexes Cardiac  Skeletal Muscles  Types Of Cartilages",
    "count": 11,
    "category": "Anatomy"
  },
  {
    "file": "Cranial_Duramater__Dural_Venous_Sinus.json",
    "title": "Cranial Duramater  Dural Venous Sinus",
    "count": 12,
    "category": "Anatomy"
  },
  {
    "file": "Cranial_Nerve_-_III_IV__VI.json",
    "title": "Cranial Nerve   Iii Iv  Vi",
    "count": 20,
    "category": "Anatomy"
  },
  {
    "file": "Cranial_Nerve__VII.json",
    "title": "Cranial Nerve  Vii",
    "count": 10,
    "category": "Anatomy"
  },
  {
    "file": "Cranial_Nerve_Nuclei__Columns.json",
    "title": "Cranial Nerve Nuclei  Columns",
    "count": 21,
    "category": "Anatomy"
  },
  {
    "file": "Cranial_nerves_-_IX_X_XI__XII_Nerves.json",
    "title": "Cranial Nerves   Ix X Xi  Xii Nerves",
    "count": 13,
    "category": "Anatomy"
  },
  {
    "file": "Cubital_Fossa.json",
    "title": "Cubital Fossa",
    "count": 6,
    "category": "Anatomy"
  },
  {
    "file": "Deep_Cervical_Fascia.json",
    "title": "Deep Cervical Fascia",
    "count": 14,
    "category": "Anatomy"
  },
  {
    "file": "Definitions.json",
    "title": "Definitions",
    "count": 10,
    "category": "Anatomy"
  },
  {
    "file": "Descending_Tracts.json",
    "title": "Descending Tracts",
    "count": 14,
    "category": "Anatomy"
  },
  {
    "file": "Ear-Anatomy_of_External__Middle__and_Internal_Ear.json",
    "title": "Ear Anatomy Of External  Middle  And Internal Ear",
    "count": 23,
    "category": "Anatomy"
  },
  {
    "file": "Embryology.json",
    "title": "Embryology",
    "count": 72,
    "category": "Anatomy"
  },
  {
    "file": "Embryology_1.json",
    "title": "Embryology 1",
    "count": 6,
    "category": "Anatomy"
  },
  {
    "file": "Embryology_2.json",
    "title": "Embryology 2",
    "count": 16,
    "category": "Anatomy"
  },
  {
    "file": "Embryology_of_Nose__Sinuses.json",
    "title": "Embryology Of Nose  Sinuses",
    "count": 13,
    "category": "Anatomy"
  },
  {
    "file": "Esophagus.json",
    "title": "Esophagus",
    "count": 60,
    "category": "Anatomy"
  },
  {
    "file": "Esophagus__Stomach.json",
    "title": "Esophagus  Stomach",
    "count": 18,
    "category": "Anatomy"
  },
  {
    "file": "Esophagus_Surgical_Anatomy__Investigation.json",
    "title": "Esophagus Surgical Anatomy  Investigation",
    "count": 35,
    "category": "Anatomy"
  },
  {
    "file": "Extra-edge_BTR_test__Micro-Anat_-_2025-06-07.json",
    "title": "Extra Edge Btr Test  Micro Anat   2025 06 07",
    "count": 50,
    "category": "Anatomy"
  },
  {
    "file": "Facial_Nerve__Vestibulocochlear_Nerve_Anatomy.json",
    "title": "Facial Nerve  Vestibulocochlear Nerve Anatomy",
    "count": 12,
    "category": "Anatomy"
  },
  {
    "file": "Facial_Nerve_and_its_Disorders.json",
    "title": "Facial Nerve And Its Disorders",
    "count": 6,
    "category": "Anatomy"
  },
  {
    "file": "Fascia_Lata__Modifications.json",
    "title": "Fascia Lata  Modifications",
    "count": 7,
    "category": "Anatomy"
  },
  {
    "file": "Female_and_Male_Genital_System.json",
    "title": "Female And Male Genital System",
    "count": 11,
    "category": "Anatomy"
  },
  {
    "file": "Flexor__Extensor_Retinaculum.json",
    "title": "Flexor  Extensor Retinaculum",
    "count": 6,
    "category": "Anatomy"
  },
  {
    "file": "Flexor_Extensor__Peroneal_Retinaculum.json",
    "title": "Flexor Extensor  Peroneal Retinaculum",
    "count": 7,
    "category": "Anatomy"
  },
  {
    "file": "Forensic_Thanatology-Previous_Year_Questions.json",
    "title": "Forensic Thanatology Previous Year Questions",
    "count": 39,
    "category": "Anatomy"
  },
  {
    "file": "Forensic_Thanatology-Thanatology.json",
    "title": "Forensic Thanatology Thanatology",
    "count": 25,
    "category": "Anatomy"
  },
  {
    "file": "Gall_Bladder.json",
    "title": "Gall Bladder",
    "count": 99,
    "category": "Anatomy"
  },
  {
    "file": "Gall_Bladder_Surgical_Anatomy__Investigations.json",
    "title": "Gall Bladder Surgical Anatomy  Investigations",
    "count": 12,
    "category": "Anatomy"
  },
  {
    "file": "Gastro_Intestinal_Tract_and_Hepatobiliary_Pancreas.json",
    "title": "Gastro Intestinal Tract And Hepatobiliary Pancreas",
    "count": 8,
    "category": "Anatomy"
  },
  {
    "file": "Gastrointestinal_tract.json",
    "title": "Gastrointestinal Tract",
    "count": 54,
    "category": "Anatomy"
  },
  {
    "file": "Gastrointestinal_Tract.json",
    "title": "Gastrointestinal Tract",
    "count": 242,
    "category": "Anatomy"
  },
  {
    "file": "General_Anatomy.json",
    "title": "General Anatomy",
    "count": 26,
    "category": "Anatomy"
  },
  {
    "file": "General_Anatomy__Embryology.json",
    "title": "General Anatomy  Embryology",
    "count": 62,
    "category": "Anatomy"
  },
  {
    "file": "General_Anatomy_Special_First_Year_Class_Test.json",
    "title": "General Anatomy Special First Year Class Test",
    "count": 30,
    "category": "Anatomy"
  },
  {
    "file": "General_Anatomy-Special_First_Year_Class_Test.json",
    "title": "General Anatomy Special First Year Class Test",
    "count": 30,
    "category": "Anatomy"
  },
  {
    "file": "General_Embryology-Gametogenesis_and_IVF.json",
    "title": "General Embryology Gametogenesis And Ivf",
    "count": 15,
    "category": "Anatomy"
  },
  {
    "file": "General_Embryology-General_Embryology.json",
    "title": "General Embryology General Embryology",
    "count": 25,
    "category": "Anatomy"
  },
  {
    "file": "General_Histology.json",
    "title": "General Histology",
    "count": 6,
    "category": "Anatomy"
  },
  {
    "file": "General_Microbiology-Bacterial_Anatomy.json",
    "title": "General Microbiology Bacterial Anatomy",
    "count": 18,
    "category": "Anatomy"
  },
  {
    "file": "General_Neuroanatomy.json",
    "title": "General Neuroanatomy",
    "count": 17,
    "category": "Anatomy"
  },
  {
    "file": "GIT.json",
    "title": "Git",
    "count": 79,
    "category": "Anatomy"
  },
  {
    "file": "Git__Liver_Histology.json",
    "title": "Git  Liver Histology",
    "count": 7,
    "category": "Anatomy"
  },
  {
    "file": "GIT_Part-1__Esophagus__Stomach___Peritoneum_.json",
    "title": "Git Part 1  Esophagus  Stomach   Peritoneum ",
    "count": 21,
    "category": "Anatomy"
  },
  {
    "file": "Glands_-_Parotid_Gland.json",
    "title": "Glands   Parotid Gland",
    "count": 7,
    "category": "Anatomy"
  },
  {
    "file": "Glomerulus.json",
    "title": "Glomerulus",
    "count": 30,
    "category": "Anatomy"
  },
  {
    "file": "Gluteal_Region.json",
    "title": "Gluteal Region",
    "count": 4,
    "category": "Anatomy"
  },
  {
    "file": "Greymatter_-_Nuclei__Rexed_Laminae.json",
    "title": "Greymatter   Nuclei  Rexed Laminae",
    "count": 14,
    "category": "Anatomy"
  },
  {
    "file": "Gynecology-Clinical_Anatomy_of_Female.json",
    "title": "Gynecology Clinical Anatomy Of Female",
    "count": 20,
    "category": "Anatomy"
  },
  {
    "file": "Head___Neck.json",
    "title": "Head   Neck",
    "count": 33,
    "category": "Anatomy"
  },
  {
    "file": "Head_and_Neck.json",
    "title": "Head And Neck",
    "count": 24,
    "category": "Anatomy"
  },
  {
    "file": "Head_and_Neck_1.json",
    "title": "Head And Neck 1",
    "count": 3,
    "category": "Anatomy"
  },
  {
    "file": "Head_and_Neck-Anatomy_of_Ear__Nose__and_Eyeball.json",
    "title": "Head And Neck Anatomy Of Ear  Nose  And Eyeball",
    "count": 11,
    "category": "Anatomy"
  },
  {
    "file": "Head_and_Neck-Cranial_Cavity-_Part_II.json",
    "title": "Head And Neck Cranial Cavity  Part Ii",
    "count": 16,
    "category": "Anatomy"
  },
  {
    "file": "Head_and_Neck-Cranial_Nerves_and_Cervical_Plexus.json",
    "title": "Head And Neck Cranial Nerves And Cervical Plexus",
    "count": 27,
    "category": "Anatomy"
  },
  {
    "file": "Head_And_Neck-Oral_Cavity.json",
    "title": "Head And Neck Oral Cavity",
    "count": 26,
    "category": "Anatomy"
  },
  {
    "file": "Head_and_Neck-Pharyngeal_Arches__Pouches_and_Clefts.json",
    "title": "Head And Neck Pharyngeal Arches  Pouches And Clefts",
    "count": 12,
    "category": "Anatomy"
  },
  {
    "file": "Head_and_Neck-Pharynx__Esophagus__and_Larynx.json",
    "title": "Head And Neck Pharynx  Esophagus  And Larynx",
    "count": 22,
    "category": "Anatomy"
  },
  {
    "file": "Head_And_Neck-Salivary_Glands.json",
    "title": "Head And Neck Salivary Glands",
    "count": 19,
    "category": "Anatomy"
  },
  {
    "file": "Head_and_Neck-Scalenus_Anterior__Head_and_Neck_Vasculature_and_Lymphatic_Drainage.json",
    "title": "Head And Neck Scalenus Anterior  Head And Neck Vasculature And Lymphatic Drainage",
    "count": 17,
    "category": "Anatomy"
  },
  {
    "file": "Head_and_Neck-Scalp__Neck_Triangles_and_Parotid_Gland.json",
    "title": "Head And Neck Scalp  Neck Triangles And Parotid Gland",
    "count": 15,
    "category": "Anatomy"
  },
  {
    "file": "Head_and_Neck-Skull_Bones_and_Cranial_Cavity-_Part_I.json",
    "title": "Head And Neck Skull Bones And Cranial Cavity  Part I",
    "count": 11,
    "category": "Anatomy"
  },
  {
    "file": "Head_Face_Neck__Brain.json",
    "title": "Head Face Neck  Brain",
    "count": 225,
    "category": "Anatomy"
  },
  {
    "file": "Head_Neck_and_Face.json",
    "title": "Head Neck And Face",
    "count": 230,
    "category": "Anatomy"
  },
  {
    "file": "Heart.json",
    "title": "Heart",
    "count": 53,
    "category": "Anatomy"
  },
  {
    "file": "Heart_-_External_Features.json",
    "title": "Heart   External Features",
    "count": 7,
    "category": "Anatomy"
  },
  {
    "file": "Hindgut__Urogenital_System.json",
    "title": "Hindgut  Urogenital System",
    "count": 15,
    "category": "Anatomy"
  },
  {
    "file": "Histology.json",
    "title": "Histology",
    "count": 75,
    "category": "Anatomy"
  },
  {
    "file": "Histology_1.json",
    "title": "Histology 1",
    "count": 28,
    "category": "Anatomy"
  },
  {
    "file": "Histology-Tissue_Histology-_I.json",
    "title": "Histology Tissue Histology  I",
    "count": 19,
    "category": "Anatomy"
  },
  {
    "file": "Histology-Tissue_Histology-_II.json",
    "title": "Histology Tissue Histology  Ii",
    "count": 20,
    "category": "Anatomy"
  },
  {
    "file": "Inlet_Of_Thorax__Diaphragm.json",
    "title": "Inlet Of Thorax  Diaphragm",
    "count": 6,
    "category": "Anatomy"
  },
  {
    "file": "Internal_Genitalia_Vagina_And_Ovary.json",
    "title": "Internal Genitalia Vagina And Ovary",
    "count": 21,
    "category": "Anatomy"
  },
  {
    "file": "Introduction_1.json",
    "title": "Introduction 1",
    "count": 12,
    "category": "Anatomy"
  },
  {
    "file": "Ischiorectal_Fossa.json",
    "title": "Ischiorectal Fossa",
    "count": 6,
    "category": "Anatomy"
  },
  {
    "file": "Kidney.json",
    "title": "Kidney",
    "count": 11,
    "category": "Anatomy"
  },
  {
    "file": "Kidney__Ureter.json",
    "title": "Kidney  Ureter",
    "count": 92,
    "category": "Anatomy"
  },
  {
    "file": "Kidney_and_Ureter_Part_1.json",
    "title": "Kidney And Ureter Part 1",
    "count": 6,
    "category": "Anatomy"
  },
  {
    "file": "Kidney_and_Ureter_Part_2.json",
    "title": "Kidney And Ureter Part 2",
    "count": 11,
    "category": "Anatomy"
  },
  {
    "file": "Larynx-Larynx__Anatomy_and_Pathology.json",
    "title": "Larynx Larynx  Anatomy And Pathology",
    "count": 19,
    "category": "Anatomy"
  },
  {
    "file": "Late_Night_PYQ_PYT_Marathon_Anatomy-1_-_2025-01-01.json",
    "title": "Late Night Pyq Pyt Marathon Anatomy 1   2025 01 01",
    "count": 60,
    "category": "Anatomy"
  },
  {
    "file": "Late_Night_PYQ_PYT_Marathon_Anatomy-2_-_2025-01-02.json",
    "title": "Late Night Pyq Pyt Marathon Anatomy 2   2025 01 02",
    "count": 60,
    "category": "Anatomy"
  },
  {
    "file": "Late_Night_PYQ_PYT_Marathon_Anatomy-3_-_2025-01-03.json",
    "title": "Late Night Pyq Pyt Marathon Anatomy 3   2025 01 03",
    "count": 60,
    "category": "Anatomy"
  },
  {
    "file": "Late_Night_PYQ_PYT_Marathon_Anatomy-4_-_2025-01-04.json",
    "title": "Late Night Pyq Pyt Marathon Anatomy 4   2025 01 04",
    "count": 60,
    "category": "Anatomy"
  },
  {
    "file": "Late_Night_PYQ_PYT_Marathon_Anatomy-5_-_2025-01-05.json",
    "title": "Late Night Pyq Pyt Marathon Anatomy 5   2025 01 05",
    "count": 60,
    "category": "Anatomy"
  },
  {
    "file": "Late_Night_PYQ_PYT_Marathon_Anatomy-6_-_2025-01-06.json",
    "title": "Late Night Pyq Pyt Marathon Anatomy 6   2025 01 06",
    "count": 60,
    "category": "Anatomy"
  },
  {
    "file": "Late_Night_PYQ_PYT_Marathon_AnatomyMicrobiology-1_-_2025-01-12.json",
    "title": "Late Night Pyq Pyt Marathon Anatomymicrobiology 1   2025 01 12",
    "count": 60,
    "category": "Anatomy"
  },
  {
    "file": "Late_Night_PYQ_PYT_Marathon_AnatomyMicrobiology-2_-_2025-01-13.json",
    "title": "Late Night Pyq Pyt Marathon Anatomymicrobiology 2   2025 01 13",
    "count": 60,
    "category": "Anatomy"
  },
  {
    "file": "Lens_-_Anatomy__Physiology.json",
    "title": "Lens   Anatomy  Physiology",
    "count": 8,
    "category": "Anatomy"
  },
  {
    "file": "Lining_Epithelium.json",
    "title": "Lining Epithelium",
    "count": 28,
    "category": "Anatomy"
  },
  {
    "file": "Lower_Limb.json",
    "title": "Lower Limb",
    "count": 72,
    "category": "Anatomy"
  },
  {
    "file": "Lower_Limb_.json",
    "title": "Lower Limb ",
    "count": 25,
    "category": "Anatomy"
  },
  {
    "file": "Lower_Limb_-_Hip_Bone.json",
    "title": "Lower Limb   Hip Bone",
    "count": 5,
    "category": "Anatomy"
  },
  {
    "file": "Lower_Limb_1.json",
    "title": "Lower Limb 1",
    "count": 38,
    "category": "Anatomy"
  },
  {
    "file": "Lower_Limb_2.json",
    "title": "Lower Limb 2",
    "count": 38,
    "category": "Anatomy"
  },
  {
    "file": "Lower_Limb-Lower_Limb_Anatomy__Knee_and_Leg.json",
    "title": "Lower Limb Lower Limb Anatomy  Knee And Leg",
    "count": 20,
    "category": "Anatomy"
  },
  {
    "file": "Lower_Limb-Muscles_and_Nerve_Supply_of_the_Hip__Thigh__and_Gluteal_Region.json",
    "title": "Lower Limb Muscles And Nerve Supply Of The Hip  Thigh  And Gluteal Region",
    "count": 24,
    "category": "Anatomy"
  },
  {
    "file": "Lower_Limb-Vascular_Supply_of_Lower_Limb.json",
    "title": "Lower Limb Vascular Supply Of Lower Limb",
    "count": 15,
    "category": "Anatomy"
  },
  {
    "file": "Lumbar_Plexus.json",
    "title": "Lumbar Plexus",
    "count": 38,
    "category": "Anatomy"
  },
  {
    "file": "Lung.json",
    "title": "Lung",
    "count": 20,
    "category": "Anatomy"
  },
  {
    "file": "Lung_Basics__Congenital_Anomalies_of_Lungs.json",
    "title": "Lung Basics  Congenital Anomalies Of Lungs",
    "count": 6,
    "category": "Anatomy"
  },
  {
    "file": "Lung_Pleura_Diaphragm.json",
    "title": "Lung Pleura Diaphragm",
    "count": 37,
    "category": "Anatomy"
  },
  {
    "file": "Lymphatic_System_and_Venous_Disorders.json",
    "title": "Lymphatic System And Venous Disorders",
    "count": 7,
    "category": "Anatomy"
  },
  {
    "file": "Mastoid_Anatomy.json",
    "title": "Mastoid Anatomy",
    "count": 5,
    "category": "Anatomy"
  },
  {
    "file": "Micro-Anatomy_BTR_50_test_-_2025-01-11.json",
    "title": "Micro Anatomy Btr 50 Test   2025 01 11",
    "count": 175,
    "category": "Anatomy"
  },
  {
    "file": "Micro-Anatomy_BTR_test_30_-_2024-03-29.json",
    "title": "Micro Anatomy Btr Test 30   2024 03 29",
    "count": 100,
    "category": "Anatomy"
  },
  {
    "file": "Microbiology__Anatomy_10_BTR_Test_-_2023-08-22.json",
    "title": "Microbiology  Anatomy 10 Btr Test   2023 08 22",
    "count": 100,
    "category": "Anatomy"
  },
  {
    "file": "Microbiology-Anatomy_20_BTR_Test_-_2024-01-03.json",
    "title": "Microbiology Anatomy 20 Btr Test   2024 01 03",
    "count": 100,
    "category": "Anatomy"
  },
  {
    "file": "Microbiology-Anatomy_BTR_60_Test_-_2025-04-18.json",
    "title": "Microbiology Anatomy Btr 60 Test   2025 04 18",
    "count": 100,
    "category": "Anatomy"
  },
  {
    "file": "Microbiology_Anatomy_BTR_Test_40_-_2024-10-01.json",
    "title": "Microbiology Anatomy Btr Test 40   2024 10 01",
    "count": 100,
    "category": "Anatomy"
  },
  {
    "file": "Mid_Day_Module_Anatomy-1_-_2025-01-03.json",
    "title": "Mid Day Module Anatomy 1   2025 01 03",
    "count": 50,
    "category": "Anatomy"
  },
  {
    "file": "Mid_Day_Module_Anatomy-2_-_2025-01-04.json",
    "title": "Mid Day Module Anatomy 2   2025 01 04",
    "count": 50,
    "category": "Anatomy"
  },
  {
    "file": "Mid_Day_Module_Anatomy-3_-_2025-01-05.json",
    "title": "Mid Day Module Anatomy 3   2025 01 05",
    "count": 50,
    "category": "Anatomy"
  },
  {
    "file": "Mid_Day_Module_Anatomy-4_-_2025-01-06.json",
    "title": "Mid Day Module Anatomy 4   2025 01 06",
    "count": 50,
    "category": "Anatomy"
  },
  {
    "file": "Mid_Day_Module_Anatomy-5_-_2025-01-07.json",
    "title": "Mid Day Module Anatomy 5   2025 01 07",
    "count": 50,
    "category": "Anatomy"
  },
  {
    "file": "Mid_Day_Module_AnatomyMicrobiology-1_-_2025-01-13.json",
    "title": "Mid Day Module Anatomymicrobiology 1   2025 01 13",
    "count": 50,
    "category": "Anatomy"
  },
  {
    "file": "Mid_Day_Module_AnatomyMicrobiology-2_-_2025-01-14.json",
    "title": "Mid Day Module Anatomymicrobiology 2   2025 01 14",
    "count": 50,
    "category": "Anatomy"
  },
  {
    "file": "Muscle_CNS__PNS.json",
    "title": "Muscle Cns  Pns",
    "count": 9,
    "category": "Anatomy"
  },
  {
    "file": "Muscles_of_Hand.json",
    "title": "Muscles Of Hand",
    "count": 26,
    "category": "Anatomy"
  },
  {
    "file": "Musculoskeletal_System.json",
    "title": "Musculoskeletal System",
    "count": 14,
    "category": "Anatomy"
  },
  {
    "file": "Nasopharynx__Anatomy__Diseases.json",
    "title": "Nasopharynx  Anatomy  Diseases",
    "count": 5,
    "category": "Anatomy"
  },
  {
    "file": "Neck.json",
    "title": "Neck",
    "count": 5,
    "category": "Anatomy"
  },
  {
    "file": "Nephron_Structure.json",
    "title": "Nephron Structure",
    "count": 16,
    "category": "Anatomy"
  },
  {
    "file": "Nerve_Fiber_Classification.json",
    "title": "Nerve Fiber Classification",
    "count": 8,
    "category": "Anatomy"
  },
  {
    "file": "Nerve_Injuries.json",
    "title": "Nerve Injuries",
    "count": 125,
    "category": "Anatomy"
  },
  {
    "file": "Nerve_Injuries-Previous_Year_Questions.json",
    "title": "Nerve Injuries Previous Year Questions",
    "count": 11,
    "category": "Anatomy"
  },
  {
    "file": "Nerve_Muscle_Physiology-Functional_Anatomy_of_Skeletal_Muscle.json",
    "title": "Nerve Muscle Physiology Functional Anatomy Of Skeletal Muscle",
    "count": 18,
    "category": "Anatomy"
  },
  {
    "file": "Nerve_Palsies.json",
    "title": "Nerve Palsies",
    "count": 6,
    "category": "Anatomy"
  },
  {
    "file": "Neuro_Anatomy-Brainstem__Cranial_Nerves__and_Cerebellum.json",
    "title": "Neuro Anatomy Brainstem  Cranial Nerves  And Cerebellum",
    "count": 26,
    "category": "Anatomy"
  },
  {
    "file": "Neuro_Anatomy-Cerebrum_and_Associated_Structures.json",
    "title": "Neuro Anatomy Cerebrum And Associated Structures",
    "count": 17,
    "category": "Anatomy"
  },
  {
    "file": "Neuro_Anatomy-Nervous_System_Development.json",
    "title": "Neuro Anatomy Nervous System Development",
    "count": 12,
    "category": "Anatomy"
  },
  {
    "file": "Neuro_Anatomy-Neuroanatomy.json",
    "title": "Neuro Anatomy Neuroanatomy",
    "count": 25,
    "category": "Anatomy"
  },
  {
    "file": "Neuro_Anatomy-Previous_Year_Questions.json",
    "title": "Neuro Anatomy Previous Year Questions",
    "count": 62,
    "category": "Anatomy"
  },
  {
    "file": "Neuro_Anatomy-Ventricular_System__White_Matter__and_Neural_Columns.json",
    "title": "Neuro Anatomy Ventricular System  White Matter  And Neural Columns",
    "count": 16,
    "category": "Anatomy"
  },
  {
    "file": "Neuroanatomy.json",
    "title": "Neuroanatomy",
    "count": 28,
    "category": "Anatomy"
  },
  {
    "file": "Normal_Anatomy__Physiology.json",
    "title": "Normal Anatomy  Physiology",
    "count": 3,
    "category": "Anatomy"
  },
  {
    "file": "Nose_and_Paranasal_Sinuses-Anatomy_of_Nose_and_Paranasal_Sinuses.json",
    "title": "Nose And Paranasal Sinuses Anatomy Of Nose And Paranasal Sinuses",
    "count": 18,
    "category": "Anatomy"
  },
  {
    "file": "Oral_Cavity.json",
    "title": "Oral Cavity",
    "count": 26,
    "category": "Anatomy"
  },
  {
    "file": "Oral_Cavity__Oropharynx.json",
    "title": "Oral Cavity  Oropharynx",
    "count": 10,
    "category": "Anatomy"
  },
  {
    "file": "Oral_Cavity__Salivary_Glands.json",
    "title": "Oral Cavity  Salivary Glands",
    "count": 26,
    "category": "Anatomy"
  },
  {
    "file": "Oral_Cavity_1.json",
    "title": "Oral Cavity 1",
    "count": 11,
    "category": "Anatomy"
  },
  {
    "file": "Oral_Cavity_2.json",
    "title": "Oral Cavity 2",
    "count": 6,
    "category": "Anatomy"
  },
  {
    "file": "Oral_Cavity_3.json",
    "title": "Oral Cavity 3",
    "count": 11,
    "category": "Anatomy"
  },
  {
    "file": "Orbit.json",
    "title": "Orbit",
    "count": 9,
    "category": "Anatomy"
  },
  {
    "file": "Orbit_-_Anatomy.json",
    "title": "Orbit   Anatomy",
    "count": 7,
    "category": "Anatomy"
  },
  {
    "file": "Orbit_2.json",
    "title": "Orbit 2",
    "count": 40,
    "category": "Anatomy"
  },
  {
    "file": "Osteology_-_Cranial_Cavity.json",
    "title": "Osteology   Cranial Cavity",
    "count": 24,
    "category": "Anatomy"
  },
  {
    "file": "Osteology_Part_1.json",
    "title": "Osteology Part 1",
    "count": 18,
    "category": "Anatomy"
  },
  {
    "file": "Osteology_Part_2.json",
    "title": "Osteology Part 2",
    "count": 12,
    "category": "Anatomy"
  },
  {
    "file": "Pancreas.json",
    "title": "Pancreas",
    "count": 117,
    "category": "Anatomy"
  },
  {
    "file": "Parasympathetic_Ganglion__Cranial_Nerve_-_V.json",
    "title": "Parasympathetic Ganglion  Cranial Nerve   V",
    "count": 15,
    "category": "Anatomy"
  },
  {
    "file": "Pelvis.json",
    "title": "Pelvis",
    "count": 20,
    "category": "Anatomy"
  },
  {
    "file": "Pelvis___Perineum.json",
    "title": "Pelvis   Perineum",
    "count": 7,
    "category": "Anatomy"
  },
  {
    "file": "Pelvis_and_Perineum-Neurovascular_Anatomy_of_Pelvis__Perineum__Rectum__and_Anal_Canal.json",
    "title": "Pelvis And Perineum Neurovascular Anatomy Of Pelvis  Perineum  Rectum  And Anal Canal",
    "count": 14,
    "category": "Anatomy"
  },
  {
    "file": "Pelvis_and_Perineum-Perineal_Pouches_and_Ischiorectal_Fossa__Extravasation_of_Urine.json",
    "title": "Pelvis And Perineum Perineal Pouches And Ischiorectal Fossa  Extravasation Of Urine",
    "count": 8,
    "category": "Anatomy"
  },
  {
    "file": "Pelvis_and_Perineum-Prostate__Male_Urethra__and_Female_Reproductive_System.json",
    "title": "Pelvis And Perineum Prostate  Male Urethra  And Female Reproductive System",
    "count": 12,
    "category": "Anatomy"
  },
  {
    "file": "Pericardium__Pericardial_Sinuses.json",
    "title": "Pericardium  Pericardial Sinuses",
    "count": 7,
    "category": "Anatomy"
  },
  {
    "file": "Peripheral_Nerve_Injury_1.json",
    "title": "Peripheral Nerve Injury 1",
    "count": 4,
    "category": "Anatomy"
  },
  {
    "file": "Peritoneum.json",
    "title": "Peritoneum",
    "count": 5,
    "category": "Anatomy"
  },
  {
    "file": "Pharyngeal_Spaces.json",
    "title": "Pharyngeal Spaces",
    "count": 5,
    "category": "Anatomy"
  },
  {
    "file": "Pharynx.json",
    "title": "Pharynx",
    "count": 7,
    "category": "Anatomy"
  },
  {
    "file": "Pharynx_1.json",
    "title": "Pharynx 1",
    "count": 41,
    "category": "Anatomy"
  },
  {
    "file": "Pharynx-Anatomy_of_Pharynx_and_Pharyngeal_Spaces.json",
    "title": "Pharynx Anatomy Of Pharynx And Pharyngeal Spaces",
    "count": 14,
    "category": "Anatomy"
  },
  {
    "file": "Pleura__Recesses.json",
    "title": "Pleura  Recesses",
    "count": 6,
    "category": "Anatomy"
  },
  {
    "file": "Popliteal_Fossa.json",
    "title": "Popliteal Fossa",
    "count": 7,
    "category": "Anatomy"
  },
  {
    "file": "Portal_Vein__Portacaval_Anastomosis.json",
    "title": "Portal Vein  Portacaval Anastomosis",
    "count": 11,
    "category": "Anatomy"
  },
  {
    "file": "Posterior_Triangle_of_The_Neck.json",
    "title": "Posterior Triangle Of The Neck",
    "count": 12,
    "category": "Anatomy"
  },
  {
    "file": "Pulmonary_Vasculature.json",
    "title": "Pulmonary Vasculature",
    "count": 8,
    "category": "Anatomy"
  },
  {
    "file": "Radial_Nerve.json",
    "title": "Radial Nerve",
    "count": 6,
    "category": "Anatomy"
  },
  {
    "file": "Radiological_Anatomy.json",
    "title": "Radiological Anatomy",
    "count": 7,
    "category": "Anatomy"
  },
  {
    "file": "Radiological_Anatomy_1.json",
    "title": "Radiological Anatomy 1",
    "count": 9,
    "category": "Anatomy"
  },
  {
    "file": "Rectum_and_anal_canal.json",
    "title": "Rectum And Anal Canal",
    "count": 57,
    "category": "Anatomy"
  },
  {
    "file": "Relevant_Clinical_Anatomy.json",
    "title": "Relevant Clinical Anatomy",
    "count": 5,
    "category": "Anatomy"
  },
  {
    "file": "Relevant_Clinical_Anatomy-Previous_Year_Questions.json",
    "title": "Relevant Clinical Anatomy Previous Year Questions",
    "count": 11,
    "category": "Anatomy"
  },
  {
    "file": "Relevant_Clinical_Embryology_and_Associated_Disorders.json",
    "title": "Relevant Clinical Embryology And Associated Disorders",
    "count": 8,
    "category": "Anatomy"
  },
  {
    "file": "Respiratory_System-Functional_Anatomy__Mechanics__Ventilation-Perfusion__Compliance_of_RS.json",
    "title": "Respiratory System Functional Anatomy  Mechanics  Ventilation Perfusion  Compliance Of Rs",
    "count": 25,
    "category": "Anatomy"
  },
  {
    "file": "Salivary_Gland.json",
    "title": "Salivary Gland",
    "count": 8,
    "category": "Anatomy"
  },
  {
    "file": "Salivary_Glands.json",
    "title": "Salivary Glands",
    "count": 1,
    "category": "Anatomy"
  },
  {
    "file": "Salivary_Glands_1.json",
    "title": "Salivary Glands 1",
    "count": 27,
    "category": "Anatomy"
  },
  {
    "file": "Sciatic_Nerve.json",
    "title": "Sciatic Nerve",
    "count": 7,
    "category": "Anatomy"
  },
  {
    "file": "Shoulder.json",
    "title": "Shoulder",
    "count": 25,
    "category": "Anatomy"
  },
  {
    "file": "Skin.json",
    "title": "Skin",
    "count": 17,
    "category": "Anatomy"
  },
  {
    "file": "Skull_-_Cranial_Cavity.json",
    "title": "Skull   Cranial Cavity",
    "count": 7,
    "category": "Anatomy"
  },
  {
    "file": "Skull_-_Norma_Basalis.json",
    "title": "Skull   Norma Basalis",
    "count": 7,
    "category": "Anatomy"
  },
  {
    "file": "Small__Large_Intestine.json",
    "title": "Small  Large Intestine",
    "count": 16,
    "category": "Anatomy"
  },
  {
    "file": "Small__large_intestine.json",
    "title": "Small  Large Intestine",
    "count": 149,
    "category": "Anatomy"
  },
  {
    "file": "Sole_of_The_Foot.json",
    "title": "Sole Of The Foot",
    "count": 7,
    "category": "Anatomy"
  },
  {
    "file": "Somites_Lateral_Plate_Mesoderm__Neural_Crest_Cells.json",
    "title": "Somites Lateral Plate Mesoderm  Neural Crest Cells",
    "count": 12,
    "category": "Anatomy"
  },
  {
    "file": "Spaces_in_Hand.json",
    "title": "Spaces In Hand",
    "count": 7,
    "category": "Anatomy"
  },
  {
    "file": "Specific_Nerve_Injuries_Part-1.json",
    "title": "Specific Nerve Injuries Part 1",
    "count": 14,
    "category": "Anatomy"
  },
  {
    "file": "Spinal_Cord_-_External_Features.json",
    "title": "Spinal Cord   External Features",
    "count": 18,
    "category": "Anatomy"
  },
  {
    "file": "Spine.json",
    "title": "Spine",
    "count": 27,
    "category": "Anatomy"
  },
  {
    "file": "Spleen.json",
    "title": "Spleen",
    "count": 17,
    "category": "Anatomy"
  },
  {
    "file": "Squint_-_Anatomy.json",
    "title": "Squint   Anatomy",
    "count": 11,
    "category": "Anatomy"
  },
  {
    "file": "Stomach.json",
    "title": "Stomach",
    "count": 80,
    "category": "Anatomy"
  },
  {
    "file": "Stomach_Surgical_Anatomy__Stomach_Surgeries.json",
    "title": "Stomach Surgical Anatomy  Stomach Surgeries",
    "count": 4,
    "category": "Anatomy"
  },
  {
    "file": "Structure_of_Skeletal_Muscle_Cell.json",
    "title": "Structure Of Skeletal Muscle Cell",
    "count": 6,
    "category": "Anatomy"
  },
  {
    "file": "Sturms_Conoid.json",
    "title": "Sturms Conoid",
    "count": 11,
    "category": "Anatomy"
  },
  {
    "file": "Subclavian_Artery__Scalenous_Anterior.json",
    "title": "Subclavian Artery  Scalenous Anterior",
    "count": 7,
    "category": "Anatomy"
  },
  {
    "file": "Surgical_Anatomy.json",
    "title": "Surgical Anatomy",
    "count": 13,
    "category": "Anatomy"
  },
  {
    "file": "Surgical_Anatomy__Cardiopulmonary_Bypass_Part_1.json",
    "title": "Surgical Anatomy  Cardiopulmonary Bypass Part 1",
    "count": 22,
    "category": "Anatomy"
  },
  {
    "file": "Surgical_Anatomy__Investigations_Part_1.json",
    "title": "Surgical Anatomy  Investigations Part 1",
    "count": 12,
    "category": "Anatomy"
  },
  {
    "file": "Swallowing__Esophagus.json",
    "title": "Swallowing  Esophagus",
    "count": 8,
    "category": "Anatomy"
  },
  {
    "file": "SWT-Anatomy_SET-A.json",
    "title": "Swt Anatomy Set A",
    "count": 200,
    "category": "Anatomy"
  },
  {
    "file": "SWT-Anatomy-SET-B.json",
    "title": "Swt Anatomy Set B",
    "count": 200,
    "category": "Anatomy"
  },
  {
    "file": "Sympathetic_Chain_-_Ramus_Communicans.json",
    "title": "Sympathetic Chain   Ramus Communicans",
    "count": 6,
    "category": "Anatomy"
  },
  {
    "file": "Systemic_Embryology-Previous_Year_Questions.json",
    "title": "Systemic Embryology Previous Year Questions",
    "count": 9,
    "category": "Anatomy"
  },
  {
    "file": "Temporomandibular_Joint__Muscles_of_Mastication.json",
    "title": "Temporomandibular Joint  Muscles Of Mastication",
    "count": 5,
    "category": "Anatomy"
  },
  {
    "file": "Testes__Scrotum.json",
    "title": "Testes  Scrotum",
    "count": 50,
    "category": "Anatomy"
  },
  {
    "file": "Testis.json",
    "title": "Testis",
    "count": 22,
    "category": "Anatomy"
  },
  {
    "file": "Testis_and_Scrotum.json",
    "title": "Testis And Scrotum",
    "count": 7,
    "category": "Anatomy"
  },
  {
    "file": "Thalamus__Connections.json",
    "title": "Thalamus  Connections",
    "count": 6,
    "category": "Anatomy"
  },
  {
    "file": "Thanatology.json",
    "title": "Thanatology",
    "count": 54,
    "category": "Anatomy"
  },
  {
    "file": "Thanatology_1.json",
    "title": "Thanatology 1",
    "count": 24,
    "category": "Anatomy"
  },
  {
    "file": "Thoracic_Wall_-_Muscles_Nerves__Vessels.json",
    "title": "Thoracic Wall   Muscles Nerves  Vessels",
    "count": 13,
    "category": "Anatomy"
  },
  {
    "file": "Thorax.json",
    "title": "Thorax",
    "count": 50,
    "category": "Anatomy"
  },
  {
    "file": "Thorax_.json",
    "title": "Thorax ",
    "count": 17,
    "category": "Anatomy"
  },
  {
    "file": "Thorax-Heart_and_Thorax_Anatomy.json",
    "title": "Thorax Heart And Thorax Anatomy",
    "count": 30,
    "category": "Anatomy"
  },
  {
    "file": "Thyroid_-_Surgical_Anatomy__Investigations_Part_1.json",
    "title": "Thyroid   Surgical Anatomy  Investigations Part 1",
    "count": 14,
    "category": "Anatomy"
  },
  {
    "file": "Type_of_Joints_and_Epiphysis.json",
    "title": "Type Of Joints And Epiphysis",
    "count": 2,
    "category": "Anatomy"
  },
  {
    "file": "Types_of_Muscle_Fibers.json",
    "title": "Types Of Muscle Fibers",
    "count": 6,
    "category": "Anatomy"
  },
  {
    "file": "Ulnar_Nerve.json",
    "title": "Ulnar Nerve",
    "count": 5,
    "category": "Anatomy"
  },
  {
    "file": "Upper_Limb.json",
    "title": "Upper Limb",
    "count": 43,
    "category": "Anatomy"
  },
  {
    "file": "Upper_Limb_.json",
    "title": "Upper Limb ",
    "count": 20,
    "category": "Anatomy"
  },
  {
    "file": "Upper_Limb_-_Radius__Ulna.json",
    "title": "Upper Limb   Radius  Ulna",
    "count": 7,
    "category": "Anatomy"
  },
  {
    "file": "Upper_Limb_1.json",
    "title": "Upper Limb 1",
    "count": 44,
    "category": "Anatomy"
  },
  {
    "file": "Upper_Limb_Bones__Muscles.json",
    "title": "Upper Limb Bones  Muscles",
    "count": 85,
    "category": "Anatomy"
  },
  {
    "file": "Upper_Limb-Bones_and_Muscles_of_Proximal_Region__Axilla__and_Scapula.json",
    "title": "Upper Limb Bones And Muscles Of Proximal Region  Axilla  And Scapula",
    "count": 13,
    "category": "Anatomy"
  },
  {
    "file": "Upper_Limb-Muscles_and_Bones_of_Forearm_and_Hand.json",
    "title": "Upper Limb Muscles And Bones Of Forearm And Hand",
    "count": 18,
    "category": "Anatomy"
  },
  {
    "file": "Upper_limb_Nerves.json",
    "title": "Upper Limb Nerves",
    "count": 60,
    "category": "Anatomy"
  },
  {
    "file": "Upper_Limb-Previous_Year_Questions.json",
    "title": "Upper Limb Previous Year Questions",
    "count": 59,
    "category": "Anatomy"
  },
  {
    "file": "Upper_Limb-Upper_Limb__Arterial_supply__Venous_Drainage__Lymphatic_Drainage____Hand_Spaces.json",
    "title": "Upper Limb Upper Limb  Arterial Supply  Venous Drainage  Lymphatic Drainage    Hand Spaces",
    "count": 15,
    "category": "Anatomy"
  },
  {
    "file": "Upper_Limb-Upper_Limb__Nerve_Supply_and_their_Lesions.json",
    "title": "Upper Limb Upper Limb  Nerve Supply And Their Lesions",
    "count": 17,
    "category": "Anatomy"
  },
  {
    "file": "Upper_Limb-Upper_Limb_Embryology_and_Nerves.json",
    "title": "Upper Limb Upper Limb Embryology And Nerves",
    "count": 13,
    "category": "Anatomy"
  },
  {
    "file": "Upper_Motor_Vs_Lower_Motor_Neuron_Lesions.json",
    "title": "Upper Motor Vs Lower Motor Neuron Lesions",
    "count": 1,
    "category": "Anatomy"
  },
  {
    "file": "Ureter.json",
    "title": "Ureter",
    "count": 8,
    "category": "Anatomy"
  },
  {
    "file": "Urethra__Penis.json",
    "title": "Urethra  Penis",
    "count": 17,
    "category": "Anatomy"
  },
  {
    "file": "Urethra__Penis_1.json",
    "title": "Urethra  Penis 1",
    "count": 47,
    "category": "Anatomy"
  },
  {
    "file": "Urinary_Bladder.json",
    "title": "Urinary Bladder",
    "count": 6,
    "category": "Anatomy"
  },
  {
    "file": "Urogenital_Triangle.json",
    "title": "Urogenital Triangle",
    "count": 5,
    "category": "Anatomy"
  },
  {
    "file": "Uveal_Tract_-_Anatomy.json",
    "title": "Uveal Tract   Anatomy",
    "count": 5,
    "category": "Anatomy"
  },
  {
    "file": "Vasculature.json",
    "title": "Vasculature",
    "count": 7,
    "category": "Anatomy"
  },
  {
    "file": "Venous_System.json",
    "title": "Venous System",
    "count": 29,
    "category": "Anatomy"
  },
  {
    "file": "Vertebral_Column_Heart__Abdomen.json",
    "title": "Vertebral Column Heart  Abdomen",
    "count": 4,
    "category": "Anatomy"
  },
  {
    "file": "White_Matter_of_Cerebrum_Part_1.json",
    "title": "White Matter Of Cerebrum Part 1",
    "count": 14,
    "category": "Anatomy"
  },
  {
    "file": "White_Matter_of_Cerebrum_Part_2.json",
    "title": "White Matter Of Cerebrum Part 2",
    "count": 6,
    "category": "Anatomy"
  },
  {
    "file": "Anaesthesia.json",
    "title": "Anaesthesia",
    "count": 20,
    "category": "Anesthesia"
  },
  {
    "file": "ANAESTHESIA-INICET_NOV_2024.json",
    "title": "Anaesthesia Inicet Nov 2024",
    "count": 6,
    "category": "Anesthesia"
  },
  {
    "file": "Anaesthesia_Machine.json",
    "title": "Anaesthesia Machine",
    "count": 4,
    "category": "Anesthesia"
  },
  {
    "file": "Anaesthesia_Machine-Previous_Year_Questions.json",
    "title": "Anaesthesia Machine Previous Year Questions",
    "count": 9,
    "category": "Anesthesia"
  },
  {
    "file": "Anaesthesia-Previous_Year_Questions.json",
    "title": "Anaesthesia Previous Year Questions",
    "count": 6,
    "category": "Anesthesia"
  },
  {
    "file": "Anesthesia.json",
    "title": "Anesthesia",
    "count": 100,
    "category": "Anesthesia"
  },
  {
    "file": "Anesthesia_-_AIIMS_JUNE_2020.json",
    "title": "Anesthesia   Aiims June 2020",
    "count": 1,
    "category": "Anesthesia"
  },
  {
    "file": "Anesthesia_-_AIIMS_MAY_2018.json",
    "title": "Anesthesia   Aiims May 2018",
    "count": 7,
    "category": "Anesthesia"
  },
  {
    "file": "Anesthesia_-_AIIMS_MAY_2019.json",
    "title": "Anesthesia   Aiims May 2019",
    "count": 2,
    "category": "Anesthesia"
  },
  {
    "file": "Anesthesia_-_AIIMS_NOV_2018.json",
    "title": "Anesthesia   Aiims Nov 2018",
    "count": 2,
    "category": "Anesthesia"
  },
  {
    "file": "Anesthesia_-_INI_CET_JULY_2021.json",
    "title": "Anesthesia   Ini Cet July 2021",
    "count": 8,
    "category": "Anesthesia"
  },
  {
    "file": "Anesthesia_-_INI_CET_MAY_2022.json",
    "title": "Anesthesia   Ini Cet May 2022",
    "count": 2,
    "category": "Anesthesia"
  },
  {
    "file": "Anesthesia_-_INI_CET_MAY_2023.json",
    "title": "Anesthesia   Ini Cet May 2023",
    "count": 3,
    "category": "Anesthesia"
  },
  {
    "file": "Anesthesia_-_INI_CET_NOV_2020.json",
    "title": "Anesthesia   Ini Cet Nov 2020",
    "count": 6,
    "category": "Anesthesia"
  },
  {
    "file": "Anesthesia_-_INI_CET_NOV_2021.json",
    "title": "Anesthesia   Ini Cet Nov 2021",
    "count": 4,
    "category": "Anesthesia"
  },
  {
    "file": "Anesthesia_-_INI_CET_NOV_2022_PART_A.json",
    "title": "Anesthesia   Ini Cet Nov 2022 Part A",
    "count": 2,
    "category": "Anesthesia"
  },
  {
    "file": "Anesthesia_-_INI_CET_NOV_2022_PART_B.json",
    "title": "Anesthesia   Ini Cet Nov 2022 Part B",
    "count": 3,
    "category": "Anesthesia"
  },
  {
    "file": "Anesthesia_-_INI_CET_NOV_2023.json",
    "title": "Anesthesia   Ini Cet Nov 2023",
    "count": 2,
    "category": "Anesthesia"
  },
  {
    "file": "Anesthesia_-_NEET_PG_2018.json",
    "title": "Anesthesia   Neet Pg 2018",
    "count": 8,
    "category": "Anesthesia"
  },
  {
    "file": "Anesthesia_-_NEET_PG_2019.json",
    "title": "Anesthesia   Neet Pg 2019",
    "count": 7,
    "category": "Anesthesia"
  },
  {
    "file": "Anesthesia_-_NEET_PG_2020.json",
    "title": "Anesthesia   Neet Pg 2020",
    "count": 5,
    "category": "Anesthesia"
  },
  {
    "file": "Anesthesia_-_NEET_PG_2021.json",
    "title": "Anesthesia   Neet Pg 2021",
    "count": 5,
    "category": "Anesthesia"
  },
  {
    "file": "Anesthesia_-_NEET_PG_2022.json",
    "title": "Anesthesia   Neet Pg 2022",
    "count": 3,
    "category": "Anesthesia"
  },
  {
    "file": "Anesthesia_-_NEET_PG_2023.json",
    "title": "Anesthesia   Neet Pg 2023",
    "count": 3,
    "category": "Anesthesia"
  },
  {
    "file": "Anesthesia_-_NEET_PG_2024.json",
    "title": "Anesthesia   Neet Pg 2024",
    "count": 14,
    "category": "Anesthesia"
  },
  {
    "file": "Anesthesia-_Class_Test_With_Video_Solution.json",
    "title": "Anesthesia  Class Test With Video Solution",
    "count": 50,
    "category": "Anesthesia"
  },
  {
    "file": "Anesthesia__Co-Existing_Diseases.json",
    "title": "Anesthesia  Co Existing Diseases",
    "count": 60,
    "category": "Anesthesia"
  },
  {
    "file": "Anesthesia_1.json",
    "title": "Anesthesia 1",
    "count": 65,
    "category": "Anesthesia"
  },
  {
    "file": "Anesthesia_AIIMS_2014-2018.json",
    "title": "Anesthesia Aiims 2014 2018",
    "count": 68,
    "category": "Anesthesia"
  },
  {
    "file": "Anesthesia_Delivery_Systems.json",
    "title": "Anesthesia Delivery Systems",
    "count": 39,
    "category": "Anesthesia"
  },
  {
    "file": "Anesthesia_Dr_Anshul.json",
    "title": "Anesthesia Dr Anshul",
    "count": 40,
    "category": "Anesthesia"
  },
  {
    "file": "21_Anesthesia_Dr_Anshul.json",
    "title": "Anesthesia Dr Anshul",
    "count": 40,
    "category": "Anesthesia"
  },
  {
    "file": "Anesthesia_Dr_Anshul-2026.json",
    "title": "Anesthesia Dr Anshul 2026",
    "count": 50,
    "category": "Anesthesia"
  },
  {
    "file": "Anesthesia_Dr_Anshul_FMGE_CT.json",
    "title": "Anesthesia Dr Anshul Fmge Ct",
    "count": 40,
    "category": "Anesthesia"
  },
  {
    "file": "Anesthesia_DVT_Revision_Test.json",
    "title": "Anesthesia Dvt Revision Test",
    "count": 25,
    "category": "Anesthesia"
  },
  {
    "file": "Anesthesia_ED_-_Mission_15_Lap_2_-_05-06-2024_-_2024-06-05.json",
    "title": "Anesthesia Ed   Mission 15 Lap 2   05 06 2024   2024 06 05",
    "count": 50,
    "category": "Anesthesia"
  },
  {
    "file": "Anesthesia_ED_-_Mission_20_Batch_3_-_05-12-2024_-_2024-12-05.json",
    "title": "Anesthesia Ed   Mission 20 Batch 3   05 12 2024   2024 12 05",
    "count": 50,
    "category": "Anesthesia"
  },
  {
    "file": "Anesthesia_ED_-_Mission_20_INICET_-_03-10-2024_-_2024-10-03.json",
    "title": "Anesthesia Ed   Mission 20 Inicet   03 10 2024   2024 10 03",
    "count": 75,
    "category": "Anesthesia"
  },
  {
    "file": "Anesthesia_ED_-_Mission_20_Lap_2_-_24-03-2025_-_2025-03-24.json",
    "title": "Anesthesia Ed   Mission 20 Lap 2   24 03 2025   2025 03 24",
    "count": 50,
    "category": "Anesthesia"
  },
  {
    "file": "Anesthesia_ED_-_Mission_NEET_PG_20_-_Final_Batch_-_09-06-2025_-_2025-06-09.json",
    "title": "Anesthesia Ed   Mission Neet Pg 20   Final Batch   09 06 2025   2025 06 09",
    "count": 50,
    "category": "Anesthesia"
  },
  {
    "file": "Anesthesia_ED_Mission_NEET_PG_-_14-08-2023_-_2023-08-14.json",
    "title": "Anesthesia Ed Mission Neet Pg   14 08 2023   2023 08 14",
    "count": 25,
    "category": "Anesthesia"
  },
  {
    "file": "Anesthesia_ED_Mission_NEET_PG_INICET_20_-_26-04-2024_-_2024-04-26.json",
    "title": "Anesthesia Ed Mission Neet Pg Inicet 20   26 04 2024   2024 04 26",
    "count": 75,
    "category": "Anesthesia"
  },
  {
    "file": "Anesthesia_IBQ.json",
    "title": "Anesthesia Ibq",
    "count": 20,
    "category": "Anesthesia"
  },
  {
    "file": "Anesthesia_Image_Based_Question.json",
    "title": "Anesthesia Image Based Question",
    "count": 20,
    "category": "Anesthesia"
  },
  {
    "file": "Anesthesia_MIQ_Series.json",
    "title": "Anesthesia Miq Series",
    "count": 15,
    "category": "Anesthesia"
  },
  {
    "file": "Anesthesia_NEET_PG_Revision_ED_-_24-12-2023_-_2023-12-24.json",
    "title": "Anesthesia Neet Pg Revision Ed   24 12 2023   2023 12 24",
    "count": 50,
    "category": "Anesthesia"
  },
  {
    "file": "Anesthesia_Test_The_Champion_Batch_Hyderabad_-_26-04-2024_-_2024-04-26.json",
    "title": "Anesthesia Test The Champion Batch Hyderabad   26 04 2024   2024 04 26",
    "count": 75,
    "category": "Anesthesia"
  },
  {
    "file": "Anesthesia_Test_The_Champion_Batch_Hyderabad_-_27-11-2024_-_2024-11-27.json",
    "title": "Anesthesia Test The Champion Batch Hyderabad   27 11 2024   2024 11 27",
    "count": 50,
    "category": "Anesthesia"
  },
  {
    "file": "Clinical_vignettes_Anesthesia.json",
    "title": "Clinical Vignettes Anesthesia",
    "count": 99,
    "category": "Anesthesia"
  },
  {
    "file": "Day_Care_Anesthesia.json",
    "title": "Day Care Anesthesia",
    "count": 7,
    "category": "Anesthesia"
  },
  {
    "file": "FMGE_CT-_Anesthesia_Dr_Anshul.json",
    "title": "Fmge Ct  Anesthesia Dr Anshul",
    "count": 40,
    "category": "Anesthesia"
  },
  {
    "file": "General_Anesthesia_-_Complications.json",
    "title": "General Anesthesia   Complications",
    "count": 34,
    "category": "Anesthesia"
  },
  {
    "file": "General_Anesthesia_-_Introduction.json",
    "title": "General Anesthesia   Introduction",
    "count": 5,
    "category": "Anesthesia"
  },
  {
    "file": "General_Anesthesia_-_IV_Anesthetics.json",
    "title": "General Anesthesia   Iv Anesthetics",
    "count": 60,
    "category": "Anesthesia"
  },
  {
    "file": "General_Anesthesia_-_Muscle_Relaxants.json",
    "title": "General Anesthesia   Muscle Relaxants",
    "count": 35,
    "category": "Anesthesia"
  },
  {
    "file": "History_of_Anesthesia.json",
    "title": "History Of Anesthesia",
    "count": 5,
    "category": "Anesthesia"
  },
  {
    "file": "Inhalational_Anaesthetics.json",
    "title": "Inhalational Anaesthetics",
    "count": 4,
    "category": "Anesthesia"
  },
  {
    "file": "Intraoperative_Fluids.json",
    "title": "Intraoperative Fluids",
    "count": 14,
    "category": "Anesthesia"
  },
  {
    "file": "Introduction_and_PAC.json",
    "title": "Introduction And Pac",
    "count": 6,
    "category": "Anesthesia"
  },
  {
    "file": "Introduction_of_Anesthesia.json",
    "title": "Introduction Of Anesthesia",
    "count": 12,
    "category": "Anesthesia"
  },
  {
    "file": "Local_Anaesthetics.json",
    "title": "Local Anaesthetics",
    "count": 3,
    "category": "Anesthesia"
  },
  {
    "file": "Local_Anaesthetics_1.json",
    "title": "Local Anaesthetics 1",
    "count": 27,
    "category": "Anesthesia"
  },
  {
    "file": "Local_Anesthesia.json",
    "title": "Local Anesthesia",
    "count": 11,
    "category": "Anesthesia"
  },
  {
    "file": "Local_Anesthetics.json",
    "title": "Local Anesthetics",
    "count": 30,
    "category": "Anesthesia"
  },
  {
    "file": "Miscellaneous-Nerve_blocks.json",
    "title": "Miscellaneous Nerve Blocks",
    "count": 16,
    "category": "Anesthesia"
  },
  {
    "file": "Monitoring_during_anaesthesia.json",
    "title": "Monitoring During Anaesthesia",
    "count": 3,
    "category": "Anesthesia"
  },
  {
    "file": "Monitoring_in_Anaesthesia.json",
    "title": "Monitoring In Anaesthesia",
    "count": 17,
    "category": "Anesthesia"
  },
  {
    "file": "Monitoring_in_Anaesthesia-Monitoring_during_anaesthesia.json",
    "title": "Monitoring In Anaesthesia Monitoring During Anaesthesia",
    "count": 11,
    "category": "Anesthesia"
  },
  {
    "file": "Monitoring_in_Anaesthesia-Previous_Year_Questions.json",
    "title": "Monitoring In Anaesthesia Previous Year Questions",
    "count": 10,
    "category": "Anesthesia"
  },
  {
    "file": "Monitoring_in_Anesthesia.json",
    "title": "Monitoring In Anesthesia",
    "count": 22,
    "category": "Anesthesia"
  },
  {
    "file": "Monitoring_In_Anesthesia.json",
    "title": "Monitoring In Anesthesia",
    "count": 51,
    "category": "Anesthesia"
  },
  {
    "file": "Nerve_Blocks.json",
    "title": "Nerve Blocks",
    "count": 30,
    "category": "Anesthesia"
  },
  {
    "file": "Neuromuscular_Blockade-Previous_Year_Questions.json",
    "title": "Neuromuscular Blockade Previous Year Questions",
    "count": 7,
    "category": "Anesthesia"
  },
  {
    "file": "Pediatric_and_Obstetric_Anesthesia.json",
    "title": "Pediatric And Obstetric Anesthesia",
    "count": 19,
    "category": "Anesthesia"
  },
  {
    "file": "Peripheral_Nerve_Blocks.json",
    "title": "Peripheral Nerve Blocks",
    "count": 15,
    "category": "Anesthesia"
  },
  {
    "file": "Pre-Anaesthetic_Evaluation-Introduction_and_PAC.json",
    "title": "Pre Anaesthetic Evaluation Introduction And Pac",
    "count": 14,
    "category": "Anesthesia"
  },
  {
    "file": "Pre-Anaesthetic_Evaluation-Previous_Year_Questions.json",
    "title": "Pre Anaesthetic Evaluation Previous Year Questions",
    "count": 19,
    "category": "Anesthesia"
  },
  {
    "file": "Pre-Anesthesia_Evaluation.json",
    "title": "Pre Anesthesia Evaluation",
    "count": 28,
    "category": "Anesthesia"
  },
  {
    "file": "Regional_Anaesthesia__Spinal__Epidural___Caudal.json",
    "title": "Regional Anaesthesia  Spinal  Epidural   Caudal",
    "count": 6,
    "category": "Anesthesia"
  },
  {
    "file": "Regional_Anaesthesia-Regional_Anaesthesia__Spinal__Epidural_And_Caudal.json",
    "title": "Regional Anaesthesia Regional Anaesthesia  Spinal  Epidural And Caudal",
    "count": 23,
    "category": "Anesthesia"
  },
  {
    "file": "Regional_Anesthesia.json",
    "title": "Regional Anesthesia",
    "count": 50,
    "category": "Anesthesia"
  },
  {
    "file": "SWT-Anesthesia-SET-B.json",
    "title": "Swt Anesthesia Set B",
    "count": 100,
    "category": "Anesthesia"
  },
  {
    "file": "SWT-FMT__Anesthesia-SET-A.json",
    "title": "Swt Fmt  Anesthesia Set A",
    "count": 200,
    "category": "Anesthesia"
  },
  {
    "file": "Amino_Acid_Chemistry.json",
    "title": "Amino Acid Chemistry",
    "count": 42,
    "category": "Biochemistry"
  },
  {
    "file": "Amino_Acid_Metabolism.json",
    "title": "Amino Acid Metabolism",
    "count": 51,
    "category": "Biochemistry"
  },
  {
    "file": "Amino_Acids.json",
    "title": "Amino Acids",
    "count": 65,
    "category": "Biochemistry"
  },
  {
    "file": "Amino_Acids_-_Basics_Classification__Metabolism.json",
    "title": "Amino Acids   Basics Classification  Metabolism",
    "count": 28,
    "category": "Biochemistry"
  },
  {
    "file": "Amino_Acids_and_Proteins_Chemistry-Amino_acid_Catabolism__Urea_cycle_and_Hyperammonemia.json",
    "title": "Amino Acids And Proteins Chemistry Amino Acid Catabolism  Urea Cycle And Hyperammonemia",
    "count": 26,
    "category": "Biochemistry"
  },
  {
    "file": "Amino_Acids_and_Proteins_Chemistry-Phenylalanine___Tyrosine__Amino_Acid_Metabolism_disorders.json",
    "title": "Amino Acids And Proteins Chemistry Phenylalanine   Tyrosine  Amino Acid Metabolism Disorders",
    "count": 19,
    "category": "Biochemistry"
  },
  {
    "file": "Amino_Acids_and_Proteins_Chemistry-Previous_Year_Questions.json",
    "title": "Amino Acids And Proteins Chemistry Previous Year Questions",
    "count": 54,
    "category": "Biochemistry"
  },
  {
    "file": "Amino_Acids_and_Proteins_Chemistry-Protein_Chemistry__Hemoglobin__Myoglobin___EPP_Chromatography.json",
    "title": "Amino Acids And Proteins Chemistry Protein Chemistry  Hemoglobin  Myoglobin   Epp Chromatography",
    "count": 25,
    "category": "Biochemistry"
  },
  {
    "file": "Amino_Acids_Catabolism_Urea_Cycle__Associated_Disorders.json",
    "title": "Amino Acids Catabolism Urea Cycle  Associated Disorders",
    "count": 25,
    "category": "Biochemistry"
  },
  {
    "file": "Amino_Acids_Metabolism-Previous_Year_Questions.json",
    "title": "Amino Acids Metabolism Previous Year Questions",
    "count": 21,
    "category": "Biochemistry"
  },
  {
    "file": "Anemia__Iron_Homoestasis.json",
    "title": "Anemia  Iron Homoestasis",
    "count": 14,
    "category": "Biochemistry"
  },
  {
    "file": "Apoptosis.json",
    "title": "Apoptosis",
    "count": 29,
    "category": "Biochemistry"
  },
  {
    "file": "Approach_to_Liver_Function_Tests.json",
    "title": "Approach To Liver Function Tests",
    "count": 15,
    "category": "Biochemistry"
  },
  {
    "file": "Basic_Concepts_of_Nutrition_RDA_Vitamins.json",
    "title": "Basic Concepts Of Nutrition Rda Vitamins",
    "count": 7,
    "category": "Biochemistry"
  },
  {
    "file": "Basics_Of_Metabolic_Disorders.json",
    "title": "Basics Of Metabolic Disorders",
    "count": 3,
    "category": "Biochemistry"
  },
  {
    "file": "Biochem-FMT_50_BTR_Test_-_2024-12-30.json",
    "title": "Biochem Fmt 50 Btr Test   2024 12 30",
    "count": 180,
    "category": "Biochemistry"
  },
  {
    "file": "Biochem-FMT_BTR_Test_60_-_2025-04-05.json",
    "title": "Biochem Fmt Btr Test 60   2025 04 05",
    "count": 100,
    "category": "Biochemistry"
  },
  {
    "file": "Biochemistry.json",
    "title": "Biochemistry",
    "count": 20,
    "category": "Biochemistry"
  },
  {
    "file": "Biochemistry_-_AIIMS_JUNE_2O20.json",
    "title": "Biochemistry   Aiims June 2O20",
    "count": 11,
    "category": "Biochemistry"
  },
  {
    "file": "Biochemistry_-_AIIMS_MAY_2O19.json",
    "title": "Biochemistry   Aiims May 2O19",
    "count": 14,
    "category": "Biochemistry"
  },
  {
    "file": "Biochemistry_-_AIIMS_NOV_2018.json",
    "title": "Biochemistry   Aiims Nov 2018",
    "count": 7,
    "category": "Biochemistry"
  },
  {
    "file": "Biochemistry_-_AIIMS_NOV_2019.json",
    "title": "Biochemistry   Aiims Nov 2019",
    "count": 11,
    "category": "Biochemistry"
  },
  {
    "file": "Biochemistry_-_INI_CET_2020.json",
    "title": "Biochemistry   Ini Cet 2020",
    "count": 14,
    "category": "Biochemistry"
  },
  {
    "file": "Biochemistry_-_INI_CET_JULY_2021.json",
    "title": "Biochemistry   Ini Cet July 2021",
    "count": 16,
    "category": "Biochemistry"
  },
  {
    "file": "Biochemistry_-_INI_CET_NOV_2021.json",
    "title": "Biochemistry   Ini Cet Nov 2021",
    "count": 11,
    "category": "Biochemistry"
  },
  {
    "file": "Biochemistry_-_INI_CET_NOV_2022.json",
    "title": "Biochemistry   Ini Cet Nov 2022",
    "count": 20,
    "category": "Biochemistry"
  },
  {
    "file": "Biochemistry_-_NEET_PG_2019.json",
    "title": "Biochemistry   Neet Pg 2019",
    "count": 24,
    "category": "Biochemistry"
  },
  {
    "file": "Biochemistry_-_NEET_PG_2020.json",
    "title": "Biochemistry   Neet Pg 2020",
    "count": 17,
    "category": "Biochemistry"
  },
  {
    "file": "Biochemistry_-_NEET_PG_2021.json",
    "title": "Biochemistry   Neet Pg 2021",
    "count": 14,
    "category": "Biochemistry"
  },
  {
    "file": "Biochemistry_-_NEET_PG_2022.json",
    "title": "Biochemistry   Neet Pg 2022",
    "count": 19,
    "category": "Biochemistry"
  },
  {
    "file": "Biochemistry-_Class_Test_With_Video_Solution.json",
    "title": "Biochemistry  Class Test With Video Solution",
    "count": 75,
    "category": "Biochemistry"
  },
  {
    "file": "Biochemistry_AIIMS_2014-2018.json",
    "title": "Biochemistry Aiims 2014 2018",
    "count": 152,
    "category": "Biochemistry"
  },
  {
    "file": "Biochemistry_Clinical_Vignettes.json",
    "title": "Biochemistry Clinical Vignettes",
    "count": 53,
    "category": "Biochemistry"
  },
  {
    "file": "Biochemistry_Dr_Sonam.json",
    "title": "Biochemistry Dr Sonam",
    "count": 40,
    "category": "Biochemistry"
  },
  {
    "file": "32_Biochemistry_Dr_Sonam.json",
    "title": "Biochemistry Dr Sonam",
    "count": 40,
    "category": "Biochemistry"
  },
  {
    "file": "Biochemistry_Dr_Sonam_FMGE_CT.json",
    "title": "Biochemistry Dr Sonam Fmge Ct",
    "count": 50,
    "category": "Biochemistry"
  },
  {
    "file": "Biochemistry_DVT_Revision_Test.json",
    "title": "Biochemistry Dvt Revision Test",
    "count": 25,
    "category": "Biochemistry"
  },
  {
    "file": "Biochemistry_ED_-_Mission_15_-_06-04-2024_-_2024-04-06.json",
    "title": "Biochemistry Ed   Mission 15   06 04 2024   2024 04 06",
    "count": 100,
    "category": "Biochemistry"
  },
  {
    "file": "Biochemistry_ED_-_Mission_15_Lap_2_-_30-05-2024_-_2024-05-30.json",
    "title": "Biochemistry Ed   Mission 15 Lap 2   30 05 2024   2024 05 30",
    "count": 75,
    "category": "Biochemistry"
  },
  {
    "file": "Biochemistry_ED_-_Mission_20_Batch_2_-_08-12-2024_-_2024-12-08.json",
    "title": "Biochemistry Ed   Mission 20 Batch 2   08 12 2024   2024 12 08",
    "count": 100,
    "category": "Biochemistry"
  },
  {
    "file": "Biochemistry_ED_-_Mission_20_Batch_3_-_29-12-2024_-_2024-12-29.json",
    "title": "Biochemistry Ed   Mission 20 Batch 3   29 12 2024   2024 12 29",
    "count": 100,
    "category": "Biochemistry"
  },
  {
    "file": "Biochemistry_ED_-_Mission_20_INICET_-_24-09-2024_-_2024-09-24.json",
    "title": "Biochemistry Ed   Mission 20 Inicet   24 09 2024   2024 09 24",
    "count": 100,
    "category": "Biochemistry"
  },
  {
    "file": "Biochemistry_ED_-_Mission_20_Lap_2_-_13-04-2025_-_2025-04-13.json",
    "title": "Biochemistry Ed   Mission 20 Lap 2   13 04 2025   2025 04 13",
    "count": 75,
    "category": "Biochemistry"
  },
  {
    "file": "Biochemistry_ED_-_Mission_NEET_PG_20_-_Final_Batch_-_16-06-2025_-_2025-06-16.json",
    "title": "Biochemistry Ed   Mission Neet Pg 20   Final Batch   16 06 2025   2025 06 16",
    "count": 75,
    "category": "Biochemistry"
  },
  {
    "file": "Biochemistry_ED_Mission_30_Early_Intern_Batch_-_22-05-2025_-_2025-05-22.json",
    "title": "Biochemistry Ed Mission 30 Early Intern Batch   22 05 2025   2025 05 22",
    "count": 100,
    "category": "Biochemistry"
  },
  {
    "file": "Biochemistry_ED_Mission_NEET_PG_-_09-10-2023_-_2023-10-09.json",
    "title": "Biochemistry Ed Mission Neet Pg   09 10 2023   2023 10 09",
    "count": 50,
    "category": "Biochemistry"
  },
  {
    "file": "Biochemistry_ED_Mission_NEET_PG_INICET_20_-_12-06-2024_-_2024-06-12.json",
    "title": "Biochemistry Ed Mission Neet Pg Inicet 20   12 06 2024   2024 06 12",
    "count": 100,
    "category": "Biochemistry"
  },
  {
    "file": "Biochemistry_IBQ.json",
    "title": "Biochemistry Ibq",
    "count": 20,
    "category": "Biochemistry"
  },
  {
    "file": "Biochemistry_Image_Based_Question.json",
    "title": "Biochemistry Image Based Question",
    "count": 20,
    "category": "Biochemistry"
  },
  {
    "file": "Biochemistry_Last_Month_ED_-_03-08-2024_-_2024-08-03.json",
    "title": "Biochemistry Last Month Ed   03 08 2024   2024 08 03",
    "count": 25,
    "category": "Biochemistry"
  },
  {
    "file": "Biochemistry_MIQ_Series.json",
    "title": "Biochemistry Miq Series",
    "count": 20,
    "category": "Biochemistry"
  },
  {
    "file": "Biochemistry_NEETPG_PYQ.json",
    "title": "Biochemistry Neetpg Pyq",
    "count": 89,
    "category": "Biochemistry"
  },
  {
    "file": "Biochemistry-Previous_Year_Questions.json",
    "title": "Biochemistry Previous Year Questions",
    "count": 2,
    "category": "Biochemistry"
  },
  {
    "file": "Biochemistry-Special_First_Year_Class_Test.json",
    "title": "Biochemistry Special First Year Class Test",
    "count": 20,
    "category": "Biochemistry"
  },
  {
    "file": "Biochemistry_Special_First_Year_Class_Test.json",
    "title": "Biochemistry Special First Year Class Test",
    "count": 35,
    "category": "Biochemistry"
  },
  {
    "file": "Biochemistry_Test_The_Champion_Batch_Hyderabad_-_16-08-2024_-_2024-08-16.json",
    "title": "Biochemistry Test The Champion Batch Hyderabad   16 08 2024   2024 08 16",
    "count": 75,
    "category": "Biochemistry"
  },
  {
    "file": "Biochemistry_Test_The_Champion_Batch_Hyderabad_-_25-12-2024_-_2024-12-25.json",
    "title": "Biochemistry Test The Champion Batch Hyderabad   25 12 2024   2024 12 25",
    "count": 100,
    "category": "Biochemistry"
  },
  {
    "file": "Calcium_Metabolism.json",
    "title": "Calcium Metabolism",
    "count": 7,
    "category": "Biochemistry"
  },
  {
    "file": "Carbohydrate_Chemistry.json",
    "title": "Carbohydrate Chemistry",
    "count": 134,
    "category": "Biochemistry"
  },
  {
    "file": "Carbohydrate_Chemistry_1.json",
    "title": "Carbohydrate Chemistry 1",
    "count": 23,
    "category": "Biochemistry"
  },
  {
    "file": "Carbohydrate_Chemistry-Carbohydrates.json",
    "title": "Carbohydrate Chemistry Carbohydrates",
    "count": 24,
    "category": "Biochemistry"
  },
  {
    "file": "Carbohydrate_Chemistry-Citric_Acid_cycle_and_Gluconeogenesis.json",
    "title": "Carbohydrate Chemistry Citric Acid Cycle And Gluconeogenesis",
    "count": 18,
    "category": "Biochemistry"
  },
  {
    "file": "Carbohydrate_Chemistry-Fates_of_pyruvate__PDH_complex__Electron_Transport_Chain.json",
    "title": "Carbohydrate Chemistry Fates Of Pyruvate  Pdh Complex  Electron Transport Chain",
    "count": 13,
    "category": "Biochemistry"
  },
  {
    "file": "Carbohydrate_Chemistry-Fructose_and_galactose_metabolism___HMP_pathway.json",
    "title": "Carbohydrate Chemistry Fructose And Galactose Metabolism   Hmp Pathway",
    "count": 13,
    "category": "Biochemistry"
  },
  {
    "file": "Carbohydrate_Chemistry-GLUT_transporters_and_Glycolysis.json",
    "title": "Carbohydrate Chemistry Glut Transporters And Glycolysis",
    "count": 12,
    "category": "Biochemistry"
  },
  {
    "file": "Carbohydrate_Chemistry-Glycogen_Metabolism_and_Glycogen_Storage_Disorders.json",
    "title": "Carbohydrate Chemistry Glycogen Metabolism And Glycogen Storage Disorders",
    "count": 17,
    "category": "Biochemistry"
  },
  {
    "file": "Carbohydrate_Metabolism.json",
    "title": "Carbohydrate Metabolism",
    "count": 21,
    "category": "Biochemistry"
  },
  {
    "file": "Carbohydrate_Metabolism_1.json",
    "title": "Carbohydrate Metabolism 1",
    "count": 149,
    "category": "Biochemistry"
  },
  {
    "file": "Carbohydrates_Basics__Cell_Organelles.json",
    "title": "Carbohydrates Basics  Cell Organelles",
    "count": 15,
    "category": "Biochemistry"
  },
  {
    "file": "Cell_Sub_Organelles_Test_Types_of_Blood_Collection_Tubes.json",
    "title": "Cell Sub Organelles Test Types Of Blood Collection Tubes",
    "count": 9,
    "category": "Biochemistry"
  },
  {
    "file": "Cholesterol__Bile_Acids.json",
    "title": "Cholesterol  Bile Acids",
    "count": 11,
    "category": "Biochemistry"
  },
  {
    "file": "Cholesterol_Metabolism.json",
    "title": "Cholesterol Metabolism",
    "count": 16,
    "category": "Biochemistry"
  },
  {
    "file": "Classification_of_Carbohydrates__Mucopolysaccharidosis.json",
    "title": "Classification Of Carbohydrates  Mucopolysaccharidosis",
    "count": 32,
    "category": "Biochemistry"
  },
  {
    "file": "Disorders_Of_Carbohydrate_Metabolism.json",
    "title": "Disorders Of Carbohydrate Metabolism",
    "count": 8,
    "category": "Biochemistry"
  },
  {
    "file": "Disorders_Of_Protein_Metabolism.json",
    "title": "Disorders Of Protein Metabolism",
    "count": 15,
    "category": "Biochemistry"
  },
  {
    "file": "DNA_Replication__Repair.json",
    "title": "Dna Replication  Repair",
    "count": 23,
    "category": "Biochemistry"
  },
  {
    "file": "DNA_Replicatoin_and_Repair.json",
    "title": "Dna Replicatoin And Repair",
    "count": 17,
    "category": "Biochemistry"
  },
  {
    "file": "Electron_Transport_Chain__Oxidative_Phosphorylation.json",
    "title": "Electron Transport Chain  Oxidative Phosphorylation",
    "count": 42,
    "category": "Biochemistry"
  },
  {
    "file": "Enzyme.json",
    "title": "Enzyme",
    "count": 46,
    "category": "Biochemistry"
  },
  {
    "file": "Enzyme_Kinetics__Enzyme_Inhibition.json",
    "title": "Enzyme Kinetics  Enzyme Inhibition",
    "count": 13,
    "category": "Biochemistry"
  },
  {
    "file": "Enzyme_Regulation__Uses_of_Enzymes.json",
    "title": "Enzyme Regulation  Uses Of Enzymes",
    "count": 13,
    "category": "Biochemistry"
  },
  {
    "file": "Enzymes.json",
    "title": "Enzymes",
    "count": 90,
    "category": "Biochemistry"
  },
  {
    "file": "Enzymes_Basics__Classification.json",
    "title": "Enzymes Basics  Classification",
    "count": 13,
    "category": "Biochemistry"
  },
  {
    "file": "Enzymes-Enzymes.json",
    "title": "Enzymes Enzymes",
    "count": 25,
    "category": "Biochemistry"
  },
  {
    "file": "Enzymes-Previous_Year_Questions.json",
    "title": "Enzymes Previous Year Questions",
    "count": 29,
    "category": "Biochemistry"
  },
  {
    "file": "Fatty_acid_and_TG_synthesis.json",
    "title": "Fatty Acid And Tg Synthesis",
    "count": 33,
    "category": "Biochemistry"
  },
  {
    "file": "Ferroptosis.json",
    "title": "Ferroptosis",
    "count": 1,
    "category": "Biochemistry"
  },
  {
    "file": "FMGE_CT_-_Biochemistry.json",
    "title": "Fmge Ct   Biochemistry",
    "count": 40,
    "category": "Biochemistry"
  },
  {
    "file": "Four_Formulas.json",
    "title": "Four Formulas",
    "count": 16,
    "category": "Biochemistry"
  },
  {
    "file": "Free_Radicals.json",
    "title": "Free Radicals",
    "count": 9,
    "category": "Biochemistry"
  },
  {
    "file": "Galactose__Fructose_Metabolism.json",
    "title": "Galactose  Fructose Metabolism",
    "count": 12,
    "category": "Biochemistry"
  },
  {
    "file": "General_Amino_Acid_Metabolism.json",
    "title": "General Amino Acid Metabolism",
    "count": 17,
    "category": "Biochemistry"
  },
  {
    "file": "Genetic.json",
    "title": "Genetic",
    "count": 4,
    "category": "Biochemistry"
  },
  {
    "file": "Genetic_and_metabolic_disorders.json",
    "title": "Genetic And Metabolic Disorders",
    "count": 24,
    "category": "Biochemistry"
  },
  {
    "file": "Genetic_Techniques.json",
    "title": "Genetic Techniques",
    "count": 34,
    "category": "Biochemistry"
  },
  {
    "file": "Genetics.json",
    "title": "Genetics",
    "count": 21,
    "category": "Biochemistry"
  },
  {
    "file": "Genetics_.json",
    "title": "Genetics ",
    "count": 19,
    "category": "Biochemistry"
  },
  {
    "file": "Genetics___Molecular_Biology.json",
    "title": "Genetics   Molecular Biology",
    "count": 158,
    "category": "Biochemistry"
  },
  {
    "file": "Genetics_1.json",
    "title": "Genetics 1",
    "count": 79,
    "category": "Biochemistry"
  },
  {
    "file": "Genetics-Advanced_Molecular_Techniques__Recombinant_DNA_technology__Microarray__CRISPR__Lac_operon.json",
    "title": "Genetics Advanced Molecular Techniques  Recombinant Dna Technology  Microarray  Crispr  Lac Operon",
    "count": 18,
    "category": "Biochemistry"
  },
  {
    "file": "Genetics_Basics__Genetic_Disorders.json",
    "title": "Genetics Basics  Genetic Disorders",
    "count": 28,
    "category": "Biochemistry"
  },
  {
    "file": "Genetics-DNA_and_Chromosome_Biochemistry__Structure__Replication__and_Repair.json",
    "title": "Genetics Dna And Chromosome Biochemistry  Structure  Replication  And Repair",
    "count": 27,
    "category": "Biochemistry"
  },
  {
    "file": "Genetics-Genetics-_Introduction___Mendelian_Disorders.json",
    "title": "Genetics Genetics  Introduction   Mendelian Disorders",
    "count": 12,
    "category": "Biochemistry"
  },
  {
    "file": "Genetics-PCR.json",
    "title": "Genetics Pcr",
    "count": 11,
    "category": "Biochemistry"
  },
  {
    "file": "Genetics-RNA_Transcription__Genetic_code_mutation__Translation_inhibitors.json",
    "title": "Genetics Rna Transcription  Genetic Code Mutation  Translation Inhibitors",
    "count": 20,
    "category": "Biochemistry"
  },
  {
    "file": "Gluconeogenesis.json",
    "title": "Gluconeogenesis",
    "count": 27,
    "category": "Biochemistry"
  },
  {
    "file": "Gluconeogenesis_1.json",
    "title": "Gluconeogenesis 1",
    "count": 15,
    "category": "Biochemistry"
  },
  {
    "file": "Glucose_Transport.json",
    "title": "Glucose Transport",
    "count": 11,
    "category": "Biochemistry"
  },
  {
    "file": "Glycogen_Metabolism.json",
    "title": "Glycogen Metabolism",
    "count": 19,
    "category": "Biochemistry"
  },
  {
    "file": "Glycolysis.json",
    "title": "Glycolysis",
    "count": 11,
    "category": "Biochemistry"
  },
  {
    "file": "Glycolysis_And_Pyruvate_Dehydrogenase_Complex.json",
    "title": "Glycolysis And Pyruvate Dehydrogenase Complex",
    "count": 38,
    "category": "Biochemistry"
  },
  {
    "file": "Haem_Metabolism.json",
    "title": "Haem Metabolism",
    "count": 16,
    "category": "Biochemistry"
  },
  {
    "file": "Heme_Metabolism-Previous_Year_Questions.json",
    "title": "Heme Metabolism Previous Year Questions",
    "count": 7,
    "category": "Biochemistry"
  },
  {
    "file": "Heme_Synthesis-Heme_Synthesis_and_Porphyrias.json",
    "title": "Heme Synthesis Heme Synthesis And Porphyrias",
    "count": 10,
    "category": "Biochemistry"
  },
  {
    "file": "HMP_Metabolism_of_Galactose__Fructose.json",
    "title": "Hmp Metabolism Of Galactose  Fructose",
    "count": 16,
    "category": "Biochemistry"
  },
  {
    "file": "Inborn_Errors_of_Metabolism.json",
    "title": "Inborn Errors Of Metabolism",
    "count": 27,
    "category": "Biochemistry"
  },
  {
    "file": "Inborn_Errors_of_Metabolism_1.json",
    "title": "Inborn Errors Of Metabolism 1",
    "count": 15,
    "category": "Biochemistry"
  },
  {
    "file": "Inborn_Errors_of_Metabolism-Disorders_of_Carbohydrate_and_Amino_Acid_Metabolism.json",
    "title": "Inborn Errors Of Metabolism Disorders Of Carbohydrate And Amino Acid Metabolism",
    "count": 17,
    "category": "Biochemistry"
  },
  {
    "file": "Inborn_Errors_of_Metabolism-Lysosomal_Storage_Disorders.json",
    "title": "Inborn Errors Of Metabolism Lysosomal Storage Disorders",
    "count": 10,
    "category": "Biochemistry"
  },
  {
    "file": "Introduction_to_Metabolism.json",
    "title": "Introduction To Metabolism",
    "count": 2,
    "category": "Biochemistry"
  },
  {
    "file": "Ketones.json",
    "title": "Ketones",
    "count": 16,
    "category": "Biochemistry"
  },
  {
    "file": "Krebs_Cycle.json",
    "title": "Krebs Cycle",
    "count": 26,
    "category": "Biochemistry"
  },
  {
    "file": "Link_Reaction__TCA.json",
    "title": "Link Reaction  Tca",
    "count": 19,
    "category": "Biochemistry"
  },
  {
    "file": "Lipid_Chemistry.json",
    "title": "Lipid Chemistry",
    "count": 36,
    "category": "Biochemistry"
  },
  {
    "file": "Lipid_Chemistry__Sphingolipidoses.json",
    "title": "Lipid Chemistry  Sphingolipidoses",
    "count": 15,
    "category": "Biochemistry"
  },
  {
    "file": "Lipid_Chemistry-Fatty_Acid_Synthesis_and_Oxidation.json",
    "title": "Lipid Chemistry Fatty Acid Synthesis And Oxidation",
    "count": 16,
    "category": "Biochemistry"
  },
  {
    "file": "Lipid_Chemistry-Lipid_Chemistry.json",
    "title": "Lipid Chemistry Lipid Chemistry",
    "count": 17,
    "category": "Biochemistry"
  },
  {
    "file": "Lipid_Chemistry-Previous_Year_Questions.json",
    "title": "Lipid Chemistry Previous Year Questions",
    "count": 20,
    "category": "Biochemistry"
  },
  {
    "file": "Lipids.json",
    "title": "Lipids",
    "count": 120,
    "category": "Biochemistry"
  },
  {
    "file": "Lipoprotein_Metabolism.json",
    "title": "Lipoprotein Metabolism",
    "count": 48,
    "category": "Biochemistry"
  },
  {
    "file": "Lysosomal_Storage_Disorders_Peroxisomal_Disorders__Leukodystrophy.json",
    "title": "Lysosomal Storage Disorders Peroxisomal Disorders  Leukodystrophy",
    "count": 10,
    "category": "Biochemistry"
  },
  {
    "file": "Mendelian_Disorders.json",
    "title": "Mendelian Disorders",
    "count": 5,
    "category": "Biochemistry"
  },
  {
    "file": "Metabolic_Disease.json",
    "title": "Metabolic Disease",
    "count": 27,
    "category": "Biochemistry"
  },
  {
    "file": "Metabolic_Disorders.json",
    "title": "Metabolic Disorders",
    "count": 68,
    "category": "Biochemistry"
  },
  {
    "file": "Metabolic_Disorders_1.json",
    "title": "Metabolic Disorders 1",
    "count": 17,
    "category": "Biochemistry"
  },
  {
    "file": "Metabolism_in_Fed_Fasting_Starvation__Diabetic_States.json",
    "title": "Metabolism In Fed Fasting Starvation  Diabetic States",
    "count": 11,
    "category": "Biochemistry"
  },
  {
    "file": "Metabolism_of_Fatty_Acids__Ketone_Bodies.json",
    "title": "Metabolism Of Fatty Acids  Ketone Bodies",
    "count": 26,
    "category": "Biochemistry"
  },
  {
    "file": "Metabolism_of_Glycine_Phenylalanine__Tyrosine.json",
    "title": "Metabolism Of Glycine Phenylalanine  Tyrosine",
    "count": 21,
    "category": "Biochemistry"
  },
  {
    "file": "Metabolism_of_Tryptophan_Cysteine__Methionine.json",
    "title": "Metabolism Of Tryptophan Cysteine  Methionine",
    "count": 10,
    "category": "Biochemistry"
  },
  {
    "file": "MGN.json",
    "title": "Mgn",
    "count": 4,
    "category": "Biochemistry"
  },
  {
    "file": "Mid_Day_Module_Biochemistry-1_-_2024-12-23.json",
    "title": "Mid Day Module Biochemistry 1   2024 12 23",
    "count": 50,
    "category": "Biochemistry"
  },
  {
    "file": "Mid_Day_Module_FMT__Biochemistry-5_-_2024-12-31.json",
    "title": "Mid Day Module Fmt  Biochemistry 5   2024 12 31",
    "count": 50,
    "category": "Biochemistry"
  },
  {
    "file": "NADH_Shuttles__ETC.json",
    "title": "Nadh Shuttles  Etc",
    "count": 20,
    "category": "Biochemistry"
  },
  {
    "file": "Non-Mendelian_Inheritance_-_Part_-1.json",
    "title": "Non Mendelian Inheritance   Part  1",
    "count": 6,
    "category": "Biochemistry"
  },
  {
    "file": "Non-Mendelian_Inheritance_-_Part-2.json",
    "title": "Non Mendelian Inheritance   Part 2",
    "count": 7,
    "category": "Biochemistry"
  },
  {
    "file": "Nucleotide_metabolism.json",
    "title": "Nucleotide Metabolism",
    "count": 27,
    "category": "Biochemistry"
  },
  {
    "file": "Nutrition.json",
    "title": "Nutrition",
    "count": 64,
    "category": "Biochemistry"
  },
  {
    "file": "Nutrition_1.json",
    "title": "Nutrition 1",
    "count": 2,
    "category": "Biochemistry"
  },
  {
    "file": "Nutrition_2.json",
    "title": "Nutrition 2",
    "count": 50,
    "category": "Biochemistry"
  },
  {
    "file": "Nutrition_Part_2.json",
    "title": "Nutrition Part 2",
    "count": 37,
    "category": "Biochemistry"
  },
  {
    "file": "pH__Ionization.json",
    "title": "Ph  Ionization",
    "count": 2,
    "category": "Biochemistry"
  },
  {
    "file": "Phosphorous.json",
    "title": "Phosphorous",
    "count": 9,
    "category": "Biochemistry"
  },
  {
    "file": "Protein_Chemistry.json",
    "title": "Protein Chemistry",
    "count": 62,
    "category": "Biochemistry"
  },
  {
    "file": "Protein_Structure__Fibrous_Proteins.json",
    "title": "Protein Structure  Fibrous Proteins",
    "count": 18,
    "category": "Biochemistry"
  },
  {
    "file": "Proteins.json",
    "title": "Proteins",
    "count": 62,
    "category": "Biochemistry"
  },
  {
    "file": "Regulation_of_Gene_Expression.json",
    "title": "Regulation Of Gene Expression",
    "count": 11,
    "category": "Biochemistry"
  },
  {
    "file": "Scurvy__Osteogenesis_Imperfecta.json",
    "title": "Scurvy  Osteogenesis Imperfecta",
    "count": 12,
    "category": "Biochemistry"
  },
  {
    "file": "Sphingolipidoses.json",
    "title": "Sphingolipidoses",
    "count": 8,
    "category": "Biochemistry"
  },
  {
    "file": "Stains.json",
    "title": "Stains",
    "count": 9,
    "category": "Biochemistry"
  },
  {
    "file": "Structure_and_Organization_of_DNA.json",
    "title": "Structure And Organization Of Dna",
    "count": 22,
    "category": "Biochemistry"
  },
  {
    "file": "SWT-Biochemistry-SET-A.json",
    "title": "Swt Biochemistry Set A",
    "count": 200,
    "category": "Biochemistry"
  },
  {
    "file": "SWT-Biochemistry-SET-B.json",
    "title": "Swt Biochemistry Set B",
    "count": 200,
    "category": "Biochemistry"
  },
  {
    "file": "Transcription.json",
    "title": "Transcription",
    "count": 26,
    "category": "Biochemistry"
  },
  {
    "file": "Transcription_Ribozymes__Splicing.json",
    "title": "Transcription Ribozymes  Splicing",
    "count": 20,
    "category": "Biochemistry"
  },
  {
    "file": "Translation.json",
    "title": "Translation",
    "count": 12,
    "category": "Biochemistry"
  },
  {
    "file": "Translation_Codons__Mutations.json",
    "title": "Translation Codons  Mutations",
    "count": 30,
    "category": "Biochemistry"
  },
  {
    "file": "Urea_Cycle__Related_Disorder.json",
    "title": "Urea Cycle  Related Disorder",
    "count": 19,
    "category": "Biochemistry"
  },
  {
    "file": "Vitamin_Deficiencies.json",
    "title": "Vitamin Deficiencies",
    "count": 25,
    "category": "Biochemistry"
  },
  {
    "file": "Vitamins.json",
    "title": "Vitamins",
    "count": 83,
    "category": "Biochemistry"
  },
  {
    "file": "Vitamins__Minerals.json",
    "title": "Vitamins  Minerals",
    "count": 62,
    "category": "Biochemistry"
  },
  {
    "file": "Vitamins_and_Amino_Acid_Metabolism.json",
    "title": "Vitamins And Amino Acid Metabolism",
    "count": 19,
    "category": "Biochemistry"
  },
  {
    "file": "Vitamins-Fat-soluble_vitamins.json",
    "title": "Vitamins Fat Soluble Vitamins",
    "count": 21,
    "category": "Biochemistry"
  },
  {
    "file": "Vitamins-Water-Soluble_Vitamins__Roles__Deficiencies__and_Alcohol_Impact.json",
    "title": "Vitamins Water Soluble Vitamins  Roles  Deficiencies  And Alcohol Impact",
    "count": 21,
    "category": "Biochemistry"
  },
  {
    "file": "Allied_Health_Disciplines-Occupational_health.json",
    "title": "Allied Health Disciplines Occupational Health",
    "count": 20,
    "category": "Community Medicine"
  },
  {
    "file": "Biostatistics.json",
    "title": "Biostatistics",
    "count": 102,
    "category": "Community Medicine"
  },
  {
    "file": "Biostatistics_1.json",
    "title": "Biostatistics 1",
    "count": 34,
    "category": "Community Medicine"
  },
  {
    "file": "Biostatistics_2.json",
    "title": "Biostatistics 2",
    "count": 159,
    "category": "Community Medicine"
  },
  {
    "file": "Biostatistics-Types_of_Dispersion__Distribution__and_Errors.json",
    "title": "Biostatistics Types Of Dispersion  Distribution  And Errors",
    "count": 20,
    "category": "Community Medicine"
  },
  {
    "file": "Case_Control__Cross_Sectional__Ecological_Study.json",
    "title": "Case Control  Cross Sectional  Ecological Study",
    "count": 8,
    "category": "Community Medicine"
  },
  {
    "file": "Classification__Risk_Factor.json",
    "title": "Classification  Risk Factor",
    "count": 13,
    "category": "Community Medicine"
  },
  {
    "file": "Classification_Cohort_Study.json",
    "title": "Classification Cohort Study",
    "count": 4,
    "category": "Community Medicine"
  },
  {
    "file": "Communicable_and_Non-communicable_Diseases-Acute_Respiratory_Infection_and_Tuberculosis.json",
    "title": "Communicable And Non Communicable Diseases Acute Respiratory Infection And Tuberculosis",
    "count": 10,
    "category": "Community Medicine"
  },
  {
    "file": "Communicable_and_Non-communicable_Diseases-Chicken_Pox__Small_Pox_and_Diphtheria.json",
    "title": "Communicable And Non Communicable Diseases Chicken Pox  Small Pox And Diphtheria",
    "count": 10,
    "category": "Community Medicine"
  },
  {
    "file": "Communicable_and_Non-communicable_Diseases-Dengue__Malaria__and_Rabies.json",
    "title": "Communicable And Non Communicable Diseases Dengue  Malaria  And Rabies",
    "count": 16,
    "category": "Community Medicine"
  },
  {
    "file": "Communicable_and_Non-communicable_Diseases-Filariasis__Leptospirosis__Japanese_Encephalitis__and_Helminthic_Infections.json",
    "title": "Communicable And Non Communicable Diseases Filariasis  Leptospirosis  Japanese Encephalitis  And Helminthic Infections",
    "count": 13,
    "category": "Community Medicine"
  },
  {
    "file": "Communicable_and_Non-communicable_Diseases-Infectious_Epidemiology.json",
    "title": "Communicable And Non Communicable Diseases Infectious Epidemiology",
    "count": 20,
    "category": "Community Medicine"
  },
  {
    "file": "Communicable_and_Non-communicable_Diseases-Mumps__Measles__Rubella__Pertussis.json",
    "title": "Communicable And Non Communicable Diseases Mumps  Measles  Rubella  Pertussis",
    "count": 10,
    "category": "Community Medicine"
  },
  {
    "file": "Communicable_and_Non-communicable_Diseases-Plague__Tetanus__HIV_AIDS__Rickettsial_Disease__Ebola__Nipah_and_Zika_Virus.json",
    "title": "Communicable And Non Communicable Diseases Plague  Tetanus  Hiv Aids  Rickettsial Disease  Ebola  Nipah And Zika Virus",
    "count": 15,
    "category": "Community Medicine"
  },
  {
    "file": "Communicable_and_Non-communicable_Diseases-Polio__Hepatitis__Diarrhoea__Cholera___Typhoid.json",
    "title": "Communicable And Non Communicable Diseases Polio  Hepatitis  Diarrhoea  Cholera   Typhoid",
    "count": 12,
    "category": "Community Medicine"
  },
  {
    "file": "Communicable_and_Non-communicable_Diseases-Previous_Year_Questions.json",
    "title": "Communicable And Non Communicable Diseases Previous Year Questions",
    "count": 105,
    "category": "Community Medicine"
  },
  {
    "file": "Communicable_Disease.json",
    "title": "Communicable Disease",
    "count": 114,
    "category": "Community Medicine"
  },
  {
    "file": "Communicable_Diseases.json",
    "title": "Communicable Diseases",
    "count": 60,
    "category": "Community Medicine"
  },
  {
    "file": "Communicable_Diseases__Respiratory_Infections.json",
    "title": "Communicable Diseases  Respiratory Infections",
    "count": 6,
    "category": "Community Medicine"
  },
  {
    "file": "Communication_for_Health_Education.json",
    "title": "Communication For Health Education",
    "count": 20,
    "category": "Community Medicine"
  },
  {
    "file": "Community_Ophthalmology.json",
    "title": "Community Ophthalmology",
    "count": 12,
    "category": "Community Medicine"
  },
  {
    "file": "Community_Ophthalmology__Miscellaneous.json",
    "title": "Community Ophthalmology  Miscellaneous",
    "count": 29,
    "category": "Community Medicine"
  },
  {
    "file": "Concept_of_Health___Disease.json",
    "title": "Concept Of Health   Disease",
    "count": 7,
    "category": "Community Medicine"
  },
  {
    "file": "Concept_of_Health__Disease.json",
    "title": "Concept Of Health  Disease",
    "count": 15,
    "category": "Community Medicine"
  },
  {
    "file": "Concept_of_Health_and_Disease-Concept_of_Disease___Well-Being.json",
    "title": "Concept Of Health And Disease Concept Of Disease   Well Being",
    "count": 10,
    "category": "Community Medicine"
  },
  {
    "file": "Concept_of_Health_and_Disease-Disease_Control__Monitoring_and_Surveillance.json",
    "title": "Concept Of Health And Disease Disease Control  Monitoring And Surveillance",
    "count": 15,
    "category": "Community Medicine"
  },
  {
    "file": "Concept_of_Health_and_Disease-Health_Indicators.json",
    "title": "Concept Of Health And Disease Health Indicators",
    "count": 5,
    "category": "Community Medicine"
  },
  {
    "file": "CSR__CME.json",
    "title": "Csr  Cme",
    "count": 6,
    "category": "Community Medicine"
  },
  {
    "file": "Demography___Health.json",
    "title": "Demography   Health",
    "count": 5,
    "category": "Community Medicine"
  },
  {
    "file": "Demography__Family_Planning.json",
    "title": "Demography  Family Planning",
    "count": 68,
    "category": "Community Medicine"
  },
  {
    "file": "Demography__Family_Planning_1.json",
    "title": "Demography  Family Planning 1",
    "count": 40,
    "category": "Community Medicine"
  },
  {
    "file": "Demography_and_Health.json",
    "title": "Demography And Health",
    "count": 50,
    "category": "Community Medicine"
  },
  {
    "file": "Demography_and_Health-Demography_and_Health.json",
    "title": "Demography And Health Demography And Health",
    "count": 25,
    "category": "Community Medicine"
  },
  {
    "file": "Descriptive_Epidemiology__Infectious_Disease_Epidemiology.json",
    "title": "Descriptive Epidemiology  Infectious Disease Epidemiology",
    "count": 6,
    "category": "Community Medicine"
  },
  {
    "file": "Epidemiology.json",
    "title": "Epidemiology",
    "count": 17,
    "category": "Community Medicine"
  },
  {
    "file": "Epidemiology_1.json",
    "title": "Epidemiology 1",
    "count": 149,
    "category": "Community Medicine"
  },
  {
    "file": "Epidemiology-Basics_of_Epidemiology.json",
    "title": "Epidemiology Basics Of Epidemiology",
    "count": 11,
    "category": "Community Medicine"
  },
  {
    "file": "Epidemiology-Bias_and_confounders.json",
    "title": "Epidemiology Bias And Confounders",
    "count": 9,
    "category": "Community Medicine"
  },
  {
    "file": "Epidemiology-Previous_Year_Questions.json",
    "title": "Epidemiology Previous Year Questions",
    "count": 69,
    "category": "Community Medicine"
  },
  {
    "file": "Epidemiology-Study_Designs_in_Epidemology.json",
    "title": "Epidemiology Study Designs In Epidemology",
    "count": 31,
    "category": "Community Medicine"
  },
  {
    "file": "Epidemiology-Systematic_Review__Meta-Analysis__and_Evidence-Based_Studies.json",
    "title": "Epidemiology Systematic Review  Meta Analysis  And Evidence Based Studies",
    "count": 6,
    "category": "Community Medicine"
  },
  {
    "file": "Extra-edge_BTR_test__PSM-Derma-Anes_-_2025-06-12.json",
    "title": "Extra Edge Btr Test  Psm Derma Anes   2025 06 12",
    "count": 50,
    "category": "Community Medicine"
  },
  {
    "file": "Family_Planning___Contraceptives.json",
    "title": "Family Planning   Contraceptives",
    "count": 8,
    "category": "Community Medicine"
  },
  {
    "file": "Family_Planning_and_Contraception.json",
    "title": "Family Planning And Contraception",
    "count": 28,
    "category": "Community Medicine"
  },
  {
    "file": "Family_Planning_and_Contraceptives-Family_Planning_and_Contraceptives.json",
    "title": "Family Planning And Contraceptives Family Planning And Contraceptives",
    "count": 27,
    "category": "Community Medicine"
  },
  {
    "file": "Food_Poisoning.json",
    "title": "Food Poisoning",
    "count": 2,
    "category": "Community Medicine"
  },
  {
    "file": "H_Programs_Schemes_Acts.json",
    "title": "H Programs Schemes Acts",
    "count": 63,
    "category": "Community Medicine"
  },
  {
    "file": "Health_and_Disease.json",
    "title": "Health And Disease",
    "count": 29,
    "category": "Community Medicine"
  },
  {
    "file": "Health_and_Disease_1.json",
    "title": "Health And Disease 1",
    "count": 25,
    "category": "Community Medicine"
  },
  {
    "file": "Health_Care_Delivery_System_in_India.json",
    "title": "Health Care Delivery System In India",
    "count": 4,
    "category": "Community Medicine"
  },
  {
    "file": "Health_Care_of_Communly.json",
    "title": "Health Care Of Communly",
    "count": 25,
    "category": "Community Medicine"
  },
  {
    "file": "Health_Care_of_The_Community_in_India-Healthcare_of_Community_and_Health_Delivery_Systems.json",
    "title": "Health Care Of The Community In India Healthcare Of Community And Health Delivery Systems",
    "count": 18,
    "category": "Community Medicine"
  },
  {
    "file": "Health_Care_of_The_Community_in_India-Previous_Year_Questions.json",
    "title": "Health Care Of The Community In India Previous Year Questions",
    "count": 25,
    "category": "Community Medicine"
  },
  {
    "file": "Health_Care_System_in_India.json",
    "title": "Health Care System In India",
    "count": 32,
    "category": "Community Medicine"
  },
  {
    "file": "Health_Communication.json",
    "title": "Health Communication",
    "count": 4,
    "category": "Community Medicine"
  },
  {
    "file": "Health_Communication_1.json",
    "title": "Health Communication 1",
    "count": 22,
    "category": "Community Medicine"
  },
  {
    "file": "Health_Education__Communication.json",
    "title": "Health Education  Communication",
    "count": 9,
    "category": "Community Medicine"
  },
  {
    "file": "Health_Education_and_Communication-Health_Education_and_Communication.json",
    "title": "Health Education And Communication Health Education And Communication",
    "count": 8,
    "category": "Community Medicine"
  },
  {
    "file": "Health_Education_and_Communication-Previous_Year_Questions.json",
    "title": "Health Education And Communication Previous Year Questions",
    "count": 20,
    "category": "Community Medicine"
  },
  {
    "file": "Health_Indicators.json",
    "title": "Health Indicators",
    "count": 17,
    "category": "Community Medicine"
  },
  {
    "file": "Health_Indicators_1.json",
    "title": "Health Indicators 1",
    "count": 4,
    "category": "Community Medicine"
  },
  {
    "file": "Health_Initiative_IDSP_Ayushman_Bharat_Miscellaneous.json",
    "title": "Health Initiative Idsp Ayushman Bharat Miscellaneous",
    "count": 1,
    "category": "Community Medicine"
  },
  {
    "file": "Health_Planning.json",
    "title": "Health Planning",
    "count": 28,
    "category": "Community Medicine"
  },
  {
    "file": "Health_Programmes_of_Inida.json",
    "title": "Health Programmes Of Inida",
    "count": 96,
    "category": "Community Medicine"
  },
  {
    "file": "Health_System_of_India.json",
    "title": "Health System Of India",
    "count": 49,
    "category": "Community Medicine"
  },
  {
    "file": "History_of_Public_Health.json",
    "title": "History Of Public Health",
    "count": 8,
    "category": "Community Medicine"
  },
  {
    "file": "Immunization_Basics_Types__Immunization_Schedules.json",
    "title": "Immunization Basics Types  Immunization Schedules",
    "count": 15,
    "category": "Community Medicine"
  },
  {
    "file": "Immunization-Immunization_and_Vaccines.json",
    "title": "Immunization Immunization And Vaccines",
    "count": 23,
    "category": "Community Medicine"
  },
  {
    "file": "Infectious_Disease_Epidemiology.json",
    "title": "Infectious Disease Epidemiology",
    "count": 44,
    "category": "Community Medicine"
  },
  {
    "file": "International_Health.json",
    "title": "International Health",
    "count": 16,
    "category": "Community Medicine"
  },
  {
    "file": "International_Health_1.json",
    "title": "International Health 1",
    "count": 10,
    "category": "Community Medicine"
  },
  {
    "file": "International_Health-International_health.json",
    "title": "International Health International Health",
    "count": 6,
    "category": "Community Medicine"
  },
  {
    "file": "International_Health-Previous_Year_Questions.json",
    "title": "International Health Previous Year Questions",
    "count": 7,
    "category": "Community Medicine"
  },
  {
    "file": "Introduction_to_Epidemiology.json",
    "title": "Introduction To Epidemiology",
    "count": 3,
    "category": "Community Medicine"
  },
  {
    "file": "Late_Night_PYQ_PYT_Marathon_PSM-1_-_2025-02-11.json",
    "title": "Late Night Pyq Pyt Marathon Psm 1   2025 02 11",
    "count": 60,
    "category": "Community Medicine"
  },
  {
    "file": "Late_Night_PYQ_PYT_Marathon_PSM-2_-_2025-02-12.json",
    "title": "Late Night Pyq Pyt Marathon Psm 2   2025 02 12",
    "count": 60,
    "category": "Community Medicine"
  },
  {
    "file": "Late_Night_PYQ_PYT_Marathon_PSM-3_-_2025-02-13.json",
    "title": "Late Night Pyq Pyt Marathon Psm 3   2025 02 13",
    "count": 60,
    "category": "Community Medicine"
  },
  {
    "file": "Late_Night_PYQ_PYT_Marathon_PSM-4_-_2025-02-14.json",
    "title": "Late Night Pyq Pyt Marathon Psm 4   2025 02 14",
    "count": 60,
    "category": "Community Medicine"
  },
  {
    "file": "Late_Night_PYQ_PYT_Marathon_PSM-5_-_2025-02-15.json",
    "title": "Late Night Pyq Pyt Marathon Psm 5   2025 02 15",
    "count": 60,
    "category": "Community Medicine"
  },
  {
    "file": "Late_Night_PYQ_PYT_Marathon_PSM-6_-_2025-02-16.json",
    "title": "Late Night Pyq Pyt Marathon Psm 6   2025 02 16",
    "count": 60,
    "category": "Community Medicine"
  },
  {
    "file": "Late_Night_PYQ_PYT_Marathon_PSM-7_-_2025-02-17.json",
    "title": "Late Night Pyq Pyt Marathon Psm 7   2025 02 17",
    "count": 60,
    "category": "Community Medicine"
  },
  {
    "file": "Late_Night_PYQ_PYT_Marathon_PSM-8_-_2025-02-18.json",
    "title": "Late Night Pyq Pyt Marathon Psm 8   2025 02 18",
    "count": 60,
    "category": "Community Medicine"
  },
  {
    "file": "Late_Night_PYQ_PYT_Marathon_PSMAnesDerma_-_2025-02-24.json",
    "title": "Late Night Pyq Pyt Marathon Psmanesderma   2025 02 24",
    "count": 60,
    "category": "Community Medicine"
  },
  {
    "file": "Maternal__Child_Health.json",
    "title": "Maternal  Child Health",
    "count": 16,
    "category": "Community Medicine"
  },
  {
    "file": "MCD.json",
    "title": "Mcd",
    "count": 2,
    "category": "Community Medicine"
  },
  {
    "file": "Mid_Day_Module_PSM-1_-_2025-02-12.json",
    "title": "Mid Day Module Psm 1   2025 02 12",
    "count": 50,
    "category": "Community Medicine"
  },
  {
    "file": "Mid_Day_Module_PSM-2_-_2025-02-13.json",
    "title": "Mid Day Module Psm 2   2025 02 13",
    "count": 50,
    "category": "Community Medicine"
  },
  {
    "file": "Mid_Day_Module_PSM-3_-_2025-02-14.json",
    "title": "Mid Day Module Psm 3   2025 02 14",
    "count": 50,
    "category": "Community Medicine"
  },
  {
    "file": "Mid_Day_Module_PSM-4_-_2025-02-16.json",
    "title": "Mid Day Module Psm 4   2025 02 16",
    "count": 50,
    "category": "Community Medicine"
  },
  {
    "file": "Mid_Day_Module_PSM-5_-_2025-02-17.json",
    "title": "Mid Day Module Psm 5   2025 02 17",
    "count": 50,
    "category": "Community Medicine"
  },
  {
    "file": "Mid_Day_Module_PSM-6_-_2025-02-18.json",
    "title": "Mid Day Module Psm 6   2025 02 18",
    "count": 49,
    "category": "Community Medicine"
  },
  {
    "file": "Mid_Day_Module_PSM-7_-_2025-02-19.json",
    "title": "Mid Day Module Psm 7   2025 02 19",
    "count": 50,
    "category": "Community Medicine"
  },
  {
    "file": "Mid_Day_Module_PSMDermaAnes-1_-_2025-02-25.json",
    "title": "Mid Day Module Psmdermaanes 1   2025 02 25",
    "count": 49,
    "category": "Community Medicine"
  },
  {
    "file": "Miscellaneous_International_Health_Sources_of_Health_Information_MTP_Act.json",
    "title": "Miscellaneous International Health Sources Of Health Information Mtp Act",
    "count": 3,
    "category": "Community Medicine"
  },
  {
    "file": "National_Health_Mission_RMNCAH_N_Maternal_Initiatives.json",
    "title": "National Health Mission Rmncah N Maternal Initiatives",
    "count": 4,
    "category": "Community Medicine"
  },
  {
    "file": "National_Health_Programmes.json",
    "title": "National Health Programmes",
    "count": 50,
    "category": "Community Medicine"
  },
  {
    "file": "National_Health_Programs-Blindness_control_program__NLEP__Health_programs_misc_.json",
    "title": "National Health Programs Blindness Control Program  Nlep  Health Programs Misc ",
    "count": 11,
    "category": "Community Medicine"
  },
  {
    "file": "National_Health_Programs-Endgame_strategy_and_national_polio_surveillance_program.json",
    "title": "National Health Programs Endgame Strategy And National Polio Surveillance Program",
    "count": 6,
    "category": "Community Medicine"
  },
  {
    "file": "National_Health_Programs-NACP_global_initiatives.json",
    "title": "National Health Programs Nacp Global Initiatives",
    "count": 12,
    "category": "Community Medicine"
  },
  {
    "file": "National_Health_Programs-National_TB_Elimination_Program__NTEP_.json",
    "title": "National Health Programs National Tb Elimination Program  Ntep ",
    "count": 20,
    "category": "Community Medicine"
  },
  {
    "file": "National_Health_Programs-NCDS___NPCDS.json",
    "title": "National Health Programs Ncds   Npcds",
    "count": 11,
    "category": "Community Medicine"
  },
  {
    "file": "National_Health_Programs-NVBDCP.json",
    "title": "National Health Programs Nvbdcp",
    "count": 15,
    "category": "Community Medicine"
  },
  {
    "file": "National_Health_Programs_TB_HIV_Leprosy_Polio.json",
    "title": "National Health Programs Tb Hiv Leprosy Polio",
    "count": 6,
    "category": "Community Medicine"
  },
  {
    "file": "National_Health_Programs_Vector_Born_Program.json",
    "title": "National Health Programs Vector Born Program",
    "count": 4,
    "category": "Community Medicine"
  },
  {
    "file": "Non_Communicable_Disease.json",
    "title": "Non Communicable Disease",
    "count": 23,
    "category": "Community Medicine"
  },
  {
    "file": "Non-communicable_Diseases.json",
    "title": "Non Communicable Diseases",
    "count": 64,
    "category": "Community Medicine"
  },
  {
    "file": "Non_Communicable_Diseases_and_National_Program_for_Control_of_NCD_s.json",
    "title": "Non Communicable Diseases And National Program For Control Of Ncd S",
    "count": 5,
    "category": "Community Medicine"
  },
  {
    "file": "NPCB.json",
    "title": "Npcb",
    "count": 14,
    "category": "Community Medicine"
  },
  {
    "file": "Nutrition_and_Health.json",
    "title": "Nutrition And Health",
    "count": 42,
    "category": "Community Medicine"
  },
  {
    "file": "Nutrition_and_Health-Food_Adulteration_and_Food_Fortification.json",
    "title": "Nutrition And Health Food Adulteration And Food Fortification",
    "count": 11,
    "category": "Community Medicine"
  },
  {
    "file": "Nutrition_and_Health-Recommended_Dietary_Allowances_and_Nutritional_Health_Programmes.json",
    "title": "Nutrition And Health Recommended Dietary Allowances And Nutritional Health Programmes",
    "count": 12,
    "category": "Community Medicine"
  },
  {
    "file": "Occupational_Health.json",
    "title": "Occupational Health",
    "count": 27,
    "category": "Community Medicine"
  },
  {
    "file": "Occupational_Health_1.json",
    "title": "Occupational Health 1",
    "count": 54,
    "category": "Community Medicine"
  },
  {
    "file": "Occupational_Health_2.json",
    "title": "Occupational Health 2",
    "count": 10,
    "category": "Community Medicine"
  },
  {
    "file": "Pedia_Derma_PSM_Ortho__Physio_Cumulative_Test_The_Champion_Batch-2_Hyderabad_-_15-05-2025_-_2025-05-15.json",
    "title": "Pedia Derma Psm Ortho  Physio Cumulative Test The Champion Batch 2 Hyderabad   15 05 2025   2025 05 15",
    "count": 200,
    "category": "Community Medicine"
  },
  {
    "file": "Pioneers_In_Public_Health.json",
    "title": "Pioneers In Public Health",
    "count": 7,
    "category": "Community Medicine"
  },
  {
    "file": "PSM.json",
    "title": "Psm",
    "count": 20,
    "category": "Community Medicine"
  },
  {
    "file": "PSM_-_AIIMS_JUNE_2020.json",
    "title": "Psm   Aiims June 2020",
    "count": 16,
    "category": "Community Medicine"
  },
  {
    "file": "PSM_-_AIIMS_MAY_2018.json",
    "title": "Psm   Aiims May 2018",
    "count": 9,
    "category": "Community Medicine"
  },
  {
    "file": "PSM_-_AIIMS_MAY_2019.json",
    "title": "Psm   Aiims May 2019",
    "count": 14,
    "category": "Community Medicine"
  },
  {
    "file": "PSM_-_AIIMS_NOV_2018.json",
    "title": "Psm   Aiims Nov 2018",
    "count": 16,
    "category": "Community Medicine"
  },
  {
    "file": "PSM_-_AIIMS_NOV_2019.json",
    "title": "Psm   Aiims Nov 2019",
    "count": 24,
    "category": "Community Medicine"
  },
  {
    "file": "PSM_-_INI_CET_JULY_2021.json",
    "title": "Psm   Ini Cet July 2021",
    "count": 11,
    "category": "Community Medicine"
  },
  {
    "file": "PSM_-_INI_CET_MAY_2022.json",
    "title": "Psm   Ini Cet May 2022",
    "count": 17,
    "category": "Community Medicine"
  },
  {
    "file": "PSM_-_INI_CET_MAY_2023.json",
    "title": "Psm   Ini Cet May 2023",
    "count": 8,
    "category": "Community Medicine"
  },
  {
    "file": "PSM_-_INI_CET_NOV_2020.json",
    "title": "Psm   Ini Cet Nov 2020",
    "count": 8,
    "category": "Community Medicine"
  },
  {
    "file": "PSM_-_INI_CET_NOV_2021.json",
    "title": "Psm   Ini Cet Nov 2021",
    "count": 12,
    "category": "Community Medicine"
  },
  {
    "file": "PSM_-_INI_CET_NOV_2023.json",
    "title": "Psm   Ini Cet Nov 2023",
    "count": 7,
    "category": "Community Medicine"
  },
  {
    "file": "PSM_-_INI_CET_NOVEMBER_2022_PART_-_A.json",
    "title": "Psm   Ini Cet November 2022 Part   A",
    "count": 8,
    "category": "Community Medicine"
  },
  {
    "file": "PSM_-_INI_CET_NOVEMBER_2022_PART_-_B.json",
    "title": "Psm   Ini Cet November 2022 Part   B",
    "count": 14,
    "category": "Community Medicine"
  },
  {
    "file": "PSM_-_INICET_MAY_2024.json",
    "title": "Psm   Inicet May 2024",
    "count": 7,
    "category": "Community Medicine"
  },
  {
    "file": "PSM_-_NEET_PG_2018.json",
    "title": "Psm   Neet Pg 2018",
    "count": 20,
    "category": "Community Medicine"
  },
  {
    "file": "PSM_-_NEET_PG_2019.json",
    "title": "Psm   Neet Pg 2019",
    "count": 25,
    "category": "Community Medicine"
  },
  {
    "file": "PSM_-_NEET_PG_2020.json",
    "title": "Psm   Neet Pg 2020",
    "count": 18,
    "category": "Community Medicine"
  },
  {
    "file": "PSM_-_NEET_PG_2021.json",
    "title": "Psm   Neet Pg 2021",
    "count": 15,
    "category": "Community Medicine"
  },
  {
    "file": "PSM_-_NEET_PG_2022.json",
    "title": "Psm   Neet Pg 2022",
    "count": 12,
    "category": "Community Medicine"
  },
  {
    "file": "PSM_-_NEET_PG_2023.json",
    "title": "Psm   Neet Pg 2023",
    "count": 8,
    "category": "Community Medicine"
  },
  {
    "file": "PSM_-_NEET_PG_2024.json",
    "title": "Psm   Neet Pg 2024",
    "count": 33,
    "category": "Community Medicine"
  },
  {
    "file": "PSM_1.json",
    "title": "Psm 1",
    "count": 20,
    "category": "Community Medicine"
  },
  {
    "file": "PSM_AIIMS_2014-2018.json",
    "title": "Psm Aiims 2014 2018",
    "count": 167,
    "category": "Community Medicine"
  },
  {
    "file": "PSM_Anaes_Derma_10_BTR_Test_-_2023-09-11.json",
    "title": "Psm Anaes Derma 10 Btr Test   2023 09 11",
    "count": 100,
    "category": "Community Medicine"
  },
  {
    "file": "PSM_Clinical_Vignettes.json",
    "title": "Psm Clinical Vignettes",
    "count": 147,
    "category": "Community Medicine"
  },
  {
    "file": "PSM_Derma_Anesthesia_30_BTR_Test_-_2024-03-18.json",
    "title": "Psm Derma Anesthesia 30 Btr Test   2024 03 18",
    "count": 100,
    "category": "Community Medicine"
  },
  {
    "file": "PSM-Derma-Anesthesia_BTR_test_60_-_2025-03-31.json",
    "title": "Psm Derma Anesthesia Btr Test 60   2025 03 31",
    "count": 100,
    "category": "Community Medicine"
  },
  {
    "file": "PSM_Derma_Anesthesia_Test_20_-_2023-12-26.json",
    "title": "Psm Derma Anesthesia Test 20   2023 12 26",
    "count": 100,
    "category": "Community Medicine"
  },
  {
    "file": "PSM_Dermatology_Anesthesia_40_BTR_test_-_2024-10-09.json",
    "title": "Psm Dermatology Anesthesia 40 Btr Test   2024 10 09",
    "count": 100,
    "category": "Community Medicine"
  },
  {
    "file": "PSM_Dermatology_Anesthesia_50_BTR_test_-_2025-02-22.json",
    "title": "Psm Dermatology Anesthesia 50 Btr Test   2025 02 22",
    "count": 150,
    "category": "Community Medicine"
  },
  {
    "file": "334_PSM_Dr_Kashish.json",
    "title": "Psm Dr Kashish",
    "count": 40,
    "category": "Community Medicine"
  },
  {
    "file": "336_PSM_Dr_Kashish.json",
    "title": "Psm Dr Kashish",
    "count": 50,
    "category": "Community Medicine"
  },
  {
    "file": "335_PSM_Dr_Kashish.json",
    "title": "Psm Dr Kashish",
    "count": 40,
    "category": "Community Medicine"
  },
  {
    "file": "PSM_Dr_Kashish.json",
    "title": "Psm Dr Kashish",
    "count": 25,
    "category": "Community Medicine"
  },
  {
    "file": "PSM_Dr_Kashish__BiostatsEpidemiologyScreening_NCDDemographyFamily_planning_MCHHealth_Progra.json",
    "title": "Psm Dr Kashish  Biostatsepidemiologyscreening Ncddemographyfamily Planning Mchhealth Progra",
    "count": 20,
    "category": "Community Medicine"
  },
  {
    "file": "PSM_Dr_Kashish-2026.json",
    "title": "Psm Dr Kashish 2026",
    "count": 100,
    "category": "Community Medicine"
  },
  {
    "file": "PSM_Dr_Sidharth.json",
    "title": "Psm Dr Sidharth",
    "count": 100,
    "category": "Community Medicine"
  },
  {
    "file": "PSM_Dr_Sidharth-2026.json",
    "title": "Psm Dr Sidharth 2026",
    "count": 100,
    "category": "Community Medicine"
  },
  {
    "file": "PSM_DVT_Revision_Test.json",
    "title": "Psm Dvt Revision Test",
    "count": 50,
    "category": "Community Medicine"
  },
  {
    "file": "PSM_ED_-_Mission_15_-_11-03-2024_-_2024-03-11.json",
    "title": "Psm Ed   Mission 15   11 03 2024   2024 03 11",
    "count": 85,
    "category": "Community Medicine"
  },
  {
    "file": "PSM_ED_-_Mission_15_Lap_2_-_28-05-2024_-_2024-05-28.json",
    "title": "Psm Ed   Mission 15 Lap 2   28 05 2024   2024 05 28",
    "count": 75,
    "category": "Community Medicine"
  },
  {
    "file": "PSM_ED_-_Mission_20_Batch_2_-_07-10-2024_-_2024-10-07.json",
    "title": "Psm Ed   Mission 20 Batch 2   07 10 2024   2024 10 07",
    "count": 100,
    "category": "Community Medicine"
  },
  {
    "file": "PSM_ED_-_Mission_20_Batch_3_-_18-02-2025_-_2025-02-18.json",
    "title": "Psm Ed   Mission 20 Batch 3   18 02 2025   2025 02 18",
    "count": 75,
    "category": "Community Medicine"
  },
  {
    "file": "PSM_ED_-_Mission_20_INICET_-_09-10-2024_-_2024-10-09.json",
    "title": "Psm Ed   Mission 20 Inicet   09 10 2024   2024 10 09",
    "count": 100,
    "category": "Community Medicine"
  },
  {
    "file": "PSM_ED_-_Mission_20_Lap_2_-_09-04-2025_-_2025-04-09.json",
    "title": "Psm Ed   Mission 20 Lap 2   09 04 2025   2025 04 09",
    "count": 75,
    "category": "Community Medicine"
  },
  {
    "file": "PSM_ED_-_Mission_NEET_PG_20_-_Final_Batch_-_13-06-2025_-_2025-06-13.json",
    "title": "Psm Ed   Mission Neet Pg 20   Final Batch   13 06 2025   2025 06 13",
    "count": 75,
    "category": "Community Medicine"
  },
  {
    "file": "PSM_ED_Mission_NEET_PG_-_21-09-2023_-_2023-09-21.json",
    "title": "Psm Ed Mission Neet Pg   21 09 2023   2023 09 21",
    "count": 50,
    "category": "Community Medicine"
  },
  {
    "file": "PSM_ED_Mission_NEET_PG_INICET_20_-_07-08-2024_-_2024-08-07.json",
    "title": "Psm Ed Mission Neet Pg Inicet 20   07 08 2024   2024 08 07",
    "count": 100,
    "category": "Community Medicine"
  },
  {
    "file": "PSM_ED_Part-1_Mission_30_Early_Intern_Batch_-_04-05-2025_-_2025-05-04.json",
    "title": "Psm Ed Part 1 Mission 30 Early Intern Batch   04 05 2025   2025 05 04",
    "count": 75,
    "category": "Community Medicine"
  },
  {
    "file": "PSM_ED_Part-2_Mission_30_Early_Intern_Batch_-_08-05-2025_-_2025-05-08.json",
    "title": "Psm Ed Part 2 Mission 30 Early Intern Batch   08 05 2025   2025 05 08",
    "count": 75,
    "category": "Community Medicine"
  },
  {
    "file": "PSM_Epidemiology_History_of_Public_Health_Health__Disease_Screening_of_Disease__Infectious_Dis.json",
    "title": "Psm Epidemiology History Of Public Health Health  Disease Screening Of Disease  Infectious Dis",
    "count": 50,
    "category": "Community Medicine"
  },
  {
    "file": "PSM_FMGE.json",
    "title": "Psm Fmge",
    "count": 40,
    "category": "Community Medicine"
  },
  {
    "file": "PSM_FMGE_PYQ.json",
    "title": "Psm Fmge Pyq",
    "count": 167,
    "category": "Community Medicine"
  },
  {
    "file": "PSM_Image_Based_Question.json",
    "title": "Psm Image Based Question",
    "count": 20,
    "category": "Community Medicine"
  },
  {
    "file": "PSM-INICET_NOV_2024.json",
    "title": "Psm Inicet Nov 2024",
    "count": 17,
    "category": "Community Medicine"
  },
  {
    "file": "PSM_INICET_PYQ.json",
    "title": "Psm Inicet Pyq",
    "count": 194,
    "category": "Community Medicine"
  },
  {
    "file": "PSM_Last_Month_ED_-_28-07-2024_-_2024-07-28.json",
    "title": "Psm Last Month Ed   28 07 2024   2024 07 28",
    "count": 30,
    "category": "Community Medicine"
  },
  {
    "file": "PSM_MIQ_Series.json",
    "title": "Psm Miq Series",
    "count": 20,
    "category": "Community Medicine"
  },
  {
    "file": "PSM_MIQ_Series_Dr_Sidharth.json",
    "title": "Psm Miq Series Dr Sidharth",
    "count": 20,
    "category": "Community Medicine"
  },
  {
    "file": "PSM_NEET_PG_Revision_ED_-_17-12-2023_-_2023-12-17.json",
    "title": "Psm Neet Pg Revision Ed   17 12 2023   2023 12 17",
    "count": 42,
    "category": "Community Medicine"
  },
  {
    "file": "PSM_NEETPG_PYQ.json",
    "title": "Psm Neetpg Pyq",
    "count": 133,
    "category": "Community Medicine"
  },
  {
    "file": "PSM_New_Season.json",
    "title": "Psm New Season",
    "count": 25,
    "category": "Community Medicine"
  },
  {
    "file": "PSM_Test_The_Champion_Batch_Hyderabad_-_11-07-2024_-_2024-07-11.json",
    "title": "Psm Test The Champion Batch Hyderabad   11 07 2024   2024 07 11",
    "count": 75,
    "category": "Community Medicine"
  },
  {
    "file": "PSM_Test_The_Champion_Batch_Hyderabad_-_18-12-2024_-_2024-12-18.json",
    "title": "Psm Test The Champion Batch Hyderabad   18 12 2024   2024 12 18",
    "count": 75,
    "category": "Community Medicine"
  },
  {
    "file": "PSM_Test_The_Champion_Batch_Hyderabad_-_25-04-2025_-_2025-04-25.json",
    "title": "Psm Test The Champion Batch Hyderabad   25 04 2025   2025 04 25",
    "count": 75,
    "category": "Community Medicine"
  },
  {
    "file": "Screening.json",
    "title": "Screening",
    "count": 4,
    "category": "Community Medicine"
  },
  {
    "file": "Screening_of_Disease.json",
    "title": "Screening Of Disease",
    "count": 34,
    "category": "Community Medicine"
  },
  {
    "file": "Screening_of_Disease_1.json",
    "title": "Screening Of Disease 1",
    "count": 50,
    "category": "Community Medicine"
  },
  {
    "file": "Screening_of_Diseases-Screening_of_Diseases.json",
    "title": "Screening Of Diseases Screening Of Diseases",
    "count": 23,
    "category": "Community Medicine"
  },
  {
    "file": "Screening_Test.json",
    "title": "Screening Test",
    "count": 49,
    "category": "Community Medicine"
  },
  {
    "file": "Social_Science_and_Health.json",
    "title": "Social Science And Health",
    "count": 5,
    "category": "Community Medicine"
  },
  {
    "file": "Social_Sciences_and_Health.json",
    "title": "Social Sciences And Health",
    "count": 27,
    "category": "Community Medicine"
  },
  {
    "file": "Social_Sciences_and_Health-Previous_Year_Questions.json",
    "title": "Social Sciences And Health Previous Year Questions",
    "count": 11,
    "category": "Community Medicine"
  },
  {
    "file": "Social_Sciences_and_Health-Social_Sciences_and_Health.json",
    "title": "Social Sciences And Health Social Sciences And Health",
    "count": 9,
    "category": "Community Medicine"
  },
  {
    "file": "Sociology.json",
    "title": "Sociology",
    "count": 9,
    "category": "Community Medicine"
  },
  {
    "file": "STD_Sexually_Transmitted_Diseases.json",
    "title": "Std Sexually Transmitted Diseases",
    "count": 23,
    "category": "Community Medicine"
  },
  {
    "file": "SWT-PSM-SET-A.json",
    "title": "Swt Psm Set A",
    "count": 200,
    "category": "Community Medicine"
  },
  {
    "file": "SWT-PSM-SET-B.json",
    "title": "Swt Psm Set B",
    "count": 200,
    "category": "Community Medicine"
  },
  {
    "file": "Types_of_Errors__Randomized_Control_Trial__Clinical_Trials.json",
    "title": "Types Of Errors  Randomized Control Trial  Clinical Trials",
    "count": 5,
    "category": "Community Medicine"
  },
  {
    "file": "Vaccines_and_Cold_Chain-National_Immunization_Schedule__Delayed_immunization__Cold_chain.json",
    "title": "Vaccines And Cold Chain National Immunization Schedule  Delayed Immunization  Cold Chain",
    "count": 18,
    "category": "Community Medicine"
  },
  {
    "file": "Vaccines_and_Cold_Chain-Vaccines_and_Open_Vial_Policy.json",
    "title": "Vaccines And Cold Chain Vaccines And Open Vial Policy",
    "count": 16,
    "category": "Community Medicine"
  },
  {
    "file": "Waste_Disposal_Housing_Standards_Over_Crowding.json",
    "title": "Waste Disposal Housing Standards Over Crowding",
    "count": 5,
    "category": "Community Medicine"
  },
  {
    "file": "Alopecia.json",
    "title": "Alopecia",
    "count": 9,
    "category": "Dermatology"
  },
  {
    "file": "Alopecia_1.json",
    "title": "Alopecia 1",
    "count": 10,
    "category": "Dermatology"
  },
  {
    "file": "Basics_of_Dermatology.json",
    "title": "Basics Of Dermatology",
    "count": 44,
    "category": "Dermatology"
  },
  {
    "file": "Blistering_Diseases.json",
    "title": "Blistering Diseases",
    "count": 45,
    "category": "Dermatology"
  },
  {
    "file": "Blistering_Disorders.json",
    "title": "Blistering Disorders",
    "count": 22,
    "category": "Dermatology"
  },
  {
    "file": "Blistering_Disorders-Previous_Year_Questions.json",
    "title": "Blistering Disorders Previous Year Questions",
    "count": 2,
    "category": "Dermatology"
  },
  {
    "file": "Blistering_Vesiculobullous_Diseases.json",
    "title": "Blistering Vesiculobullous Diseases",
    "count": 47,
    "category": "Dermatology"
  },
  {
    "file": "Connective_Tissue_Disorders__Drug_Eruptions.json",
    "title": "Connective Tissue Disorders  Drug Eruptions",
    "count": 20,
    "category": "Dermatology"
  },
  {
    "file": "Cutaneous_Infections-Previous_Year_Questions.json",
    "title": "Cutaneous Infections Previous Year Questions",
    "count": 26,
    "category": "Dermatology"
  },
  {
    "file": "Cutaneous_Tuberculosis___Leprosy.json",
    "title": "Cutaneous Tuberculosis   Leprosy",
    "count": 5,
    "category": "Dermatology"
  },
  {
    "file": "Deep_Fungal_Skin_Infections.json",
    "title": "Deep Fungal Skin Infections",
    "count": 22,
    "category": "Dermatology"
  },
  {
    "file": "Dermatology.json",
    "title": "Dermatology",
    "count": 100,
    "category": "Dermatology"
  },
  {
    "file": "Dermatology_-_AIIMS_NOV_2018.json",
    "title": "Dermatology   Aiims Nov 2018",
    "count": 8,
    "category": "Dermatology"
  },
  {
    "file": "Dermatology_-_AIIMS_NOV_2019.json",
    "title": "Dermatology   Aiims Nov 2019",
    "count": 5,
    "category": "Dermatology"
  },
  {
    "file": "Dermatology_-_INI_CET_JULY_2021.json",
    "title": "Dermatology   Ini Cet July 2021",
    "count": 7,
    "category": "Dermatology"
  },
  {
    "file": "Dermatology_-_INI_CET_MAY_2023.json",
    "title": "Dermatology   Ini Cet May 2023",
    "count": 4,
    "category": "Dermatology"
  },
  {
    "file": "Dermatology_-_INI_CET_NOV_2020.json",
    "title": "Dermatology   Ini Cet Nov 2020",
    "count": 9,
    "category": "Dermatology"
  },
  {
    "file": "Dermatology_-_INI_CET_NOV_2021.json",
    "title": "Dermatology   Ini Cet Nov 2021",
    "count": 7,
    "category": "Dermatology"
  },
  {
    "file": "Dermatology_-_INI_CET_NOV_2022_PART_B.json",
    "title": "Dermatology   Ini Cet Nov 2022 Part B",
    "count": 5,
    "category": "Dermatology"
  },
  {
    "file": "Dermatology_-_INI_CET_NOV_2023.json",
    "title": "Dermatology   Ini Cet Nov 2023",
    "count": 5,
    "category": "Dermatology"
  },
  {
    "file": "Dermatology_-_INICET_MAY_2024.json",
    "title": "Dermatology   Inicet May 2024",
    "count": 4,
    "category": "Dermatology"
  },
  {
    "file": "Dermatology_-_NEET_PG_2018.json",
    "title": "Dermatology   Neet Pg 2018",
    "count": 11,
    "category": "Dermatology"
  },
  {
    "file": "Dermatology_-_NEET_PG_2019.json",
    "title": "Dermatology   Neet Pg 2019",
    "count": 9,
    "category": "Dermatology"
  },
  {
    "file": "Dermatology_-_NEET_PG_2020.json",
    "title": "Dermatology   Neet Pg 2020",
    "count": 6,
    "category": "Dermatology"
  },
  {
    "file": "Dermatology_-_NEET_PG_2022.json",
    "title": "Dermatology   Neet Pg 2022",
    "count": 4,
    "category": "Dermatology"
  },
  {
    "file": "Dermatology_-_NEET_PG_2023.json",
    "title": "Dermatology   Neet Pg 2023",
    "count": 11,
    "category": "Dermatology"
  },
  {
    "file": "Dermatology_-_NEET_PG_2024.json",
    "title": "Dermatology   Neet Pg 2024",
    "count": 12,
    "category": "Dermatology"
  },
  {
    "file": "Dermatology-_Class_Test_With_Video_Solution.json",
    "title": "Dermatology  Class Test With Video Solution",
    "count": 50,
    "category": "Dermatology"
  },
  {
    "file": "Dermatology_AIIMS_2014-2018.json",
    "title": "Dermatology Aiims 2014 2018",
    "count": 34,
    "category": "Dermatology"
  },
  {
    "file": "Dermatology_Dr_Chesta.json",
    "title": "Dermatology Dr Chesta",
    "count": 50,
    "category": "Dermatology"
  },
  {
    "file": "45_Dermatology_Dr_Chesta.json",
    "title": "Dermatology Dr Chesta",
    "count": 40,
    "category": "Dermatology"
  },
  {
    "file": "Dermatology_Dr_Chesta_1.json",
    "title": "Dermatology Dr Chesta 1",
    "count": 50,
    "category": "Dermatology"
  },
  {
    "file": "Dermatology_Dr_Chesta-2026.json",
    "title": "Dermatology Dr Chesta 2026",
    "count": 50,
    "category": "Dermatology"
  },
  {
    "file": "Dermatology_Dr_Chesta_FMGE_CT.json",
    "title": "Dermatology Dr Chesta Fmge Ct",
    "count": 50,
    "category": "Dermatology"
  },
  {
    "file": "Dermatology_DVT_Revision_Test.json",
    "title": "Dermatology Dvt Revision Test",
    "count": 25,
    "category": "Dermatology"
  },
  {
    "file": "Dermatology_ED_-_01-10-2023_-_2023-10-01.json",
    "title": "Dermatology Ed   01 10 2023   2023 10 01",
    "count": 50,
    "category": "Dermatology"
  },
  {
    "file": "Dermatology_ED_-_Mission_20_Batch_2_-_27-12-2024_-_2024-12-27.json",
    "title": "Dermatology Ed   Mission 20 Batch 2   27 12 2024   2024 12 27",
    "count": 75,
    "category": "Dermatology"
  },
  {
    "file": "Dermatology_ED_-_Mission_20_Batch_3_-_23-02-2025_-_2025-02-23.json",
    "title": "Dermatology Ed   Mission 20 Batch 3   23 02 2025   2025 02 23",
    "count": 75,
    "category": "Dermatology"
  },
  {
    "file": "Dermatology_ED_-_Mission_20_Lap_2_-_29-03-2025_-_2025-03-29.json",
    "title": "Dermatology Ed   Mission 20 Lap 2   29 03 2025   2025 03 29",
    "count": 50,
    "category": "Dermatology"
  },
  {
    "file": "Dermatology_ED_-_Mission_NEET_PG_20_-_Final_Batch_-_11-06-2025_-_2025-06-11.json",
    "title": "Dermatology Ed   Mission Neet Pg 20   Final Batch   11 06 2025   2025 06 11",
    "count": 50,
    "category": "Dermatology"
  },
  {
    "file": "Dermatology_ED_Mission_NEET_PG_-_25-07-2023_-_2023-07-25.json",
    "title": "Dermatology Ed Mission Neet Pg   25 07 2023   2023 07 25",
    "count": 50,
    "category": "Dermatology"
  },
  {
    "file": "Dermatology_ED_Mission_NEET_PG_INICET_20_-_15-06-2024_-_2024-06-15.json",
    "title": "Dermatology Ed Mission Neet Pg Inicet 20   15 06 2024   2024 06 15",
    "count": 75,
    "category": "Dermatology"
  },
  {
    "file": "Dermatology_FMGE_PYQ.json",
    "title": "Dermatology Fmge Pyq",
    "count": 97,
    "category": "Dermatology"
  },
  {
    "file": "Dermatology_IBQ.json",
    "title": "Dermatology Ibq",
    "count": 20,
    "category": "Dermatology"
  },
  {
    "file": "Dermatology_Image_Based_Qs.json",
    "title": "Dermatology Image Based Qs",
    "count": 52,
    "category": "Dermatology"
  },
  {
    "file": "DERMATOLOGY-INICET_NOV_2024.json",
    "title": "Dermatology Inicet Nov 2024",
    "count": 5,
    "category": "Dermatology"
  },
  {
    "file": "Dermatology_MIQ_Series.json",
    "title": "Dermatology Miq Series",
    "count": 15,
    "category": "Dermatology"
  },
  {
    "file": "Dermatology_Test_The_Champion_Batch_Hyderabad_-_14-05-2024_-_2024-05-14.json",
    "title": "Dermatology Test The Champion Batch Hyderabad   14 05 2024   2024 05 14",
    "count": 75,
    "category": "Dermatology"
  },
  {
    "file": "Dermatology_Test_The_Champion_Batch_Hyderabad_-_15-04-2025_-_2025-04-15.json",
    "title": "Dermatology Test The Champion Batch Hyderabad   15 04 2025   2025 04 15",
    "count": 50,
    "category": "Dermatology"
  },
  {
    "file": "Dermatology_Test_The_Champion_Batch_Hyderabad_-_29-10-2024_-_2024-10-29.json",
    "title": "Dermatology Test The Champion Batch Hyderabad   29 10 2024   2024 10 29",
    "count": 75,
    "category": "Dermatology"
  },
  {
    "file": "Dermoepidermal_Junction_DIF__Nail_Diseases.json",
    "title": "Dermoepidermal Junction Dif  Nail Diseases",
    "count": 11,
    "category": "Dermatology"
  },
  {
    "file": "Eczema.json",
    "title": "Eczema",
    "count": 20,
    "category": "Dermatology"
  },
  {
    "file": "Eczema_1.json",
    "title": "Eczema 1",
    "count": 24,
    "category": "Dermatology"
  },
  {
    "file": "Eczema-Eczema.json",
    "title": "Eczema Eczema",
    "count": 13,
    "category": "Dermatology"
  },
  {
    "file": "Eczema-Previous_Year_Questions.json",
    "title": "Eczema Previous Year Questions",
    "count": 9,
    "category": "Dermatology"
  },
  {
    "file": "Eczemas.json",
    "title": "Eczemas",
    "count": 3,
    "category": "Dermatology"
  },
  {
    "file": "Eczematous_Disorders.json",
    "title": "Eczematous Disorders",
    "count": 24,
    "category": "Dermatology"
  },
  {
    "file": "FMGE_CT-_Dermatology_Dr_Chesta.json",
    "title": "Fmge Ct  Dermatology Dr Chesta",
    "count": 40,
    "category": "Dermatology"
  },
  {
    "file": "Fungal_Infections_of_Skin.json",
    "title": "Fungal Infections Of Skin",
    "count": 4,
    "category": "Dermatology"
  },
  {
    "file": "General_Dermatology.json",
    "title": "General Dermatology",
    "count": 23,
    "category": "Dermatology"
  },
  {
    "file": "General_Dermatology_1.json",
    "title": "General Dermatology 1",
    "count": 15,
    "category": "Dermatology"
  },
  {
    "file": "Genetics__Skin.json",
    "title": "Genetics  Skin",
    "count": 19,
    "category": "Dermatology"
  },
  {
    "file": "Genodermatoses.json",
    "title": "Genodermatoses",
    "count": 3,
    "category": "Dermatology"
  },
  {
    "file": "Hair.json",
    "title": "Hair",
    "count": 22,
    "category": "Dermatology"
  },
  {
    "file": "Hair___Nail_Disorders.json",
    "title": "Hair   Nail Disorders",
    "count": 4,
    "category": "Dermatology"
  },
  {
    "file": "Hair_Diseases_-TB_-_Erythema_Nodosum.json",
    "title": "Hair Diseases  Tb   Erythema Nodosum",
    "count": 6,
    "category": "Dermatology"
  },
  {
    "file": "Immunobullous_Disorders.json",
    "title": "Immunobullous Disorders",
    "count": 4,
    "category": "Dermatology"
  },
  {
    "file": "Immunobullous_Disorders-Immunobullous_disorders.json",
    "title": "Immunobullous Disorders Immunobullous Disorders",
    "count": 20,
    "category": "Dermatology"
  },
  {
    "file": "Important_Short_Topics_Shapes_Of_Skin_Lesions_Woods_Lamp_Disorders_Neutrophilic_Dermatosis__Reactive_Arthritis.json",
    "title": "Important Short Topics Shapes Of Skin Lesions Woods Lamp Disorders Neutrophilic Dermatosis  Reactive Arthritis",
    "count": 26,
    "category": "Dermatology"
  },
  {
    "file": "Introduction_to_Dermatology.json",
    "title": "Introduction To Dermatology",
    "count": 3,
    "category": "Dermatology"
  },
  {
    "file": "Introduction_to_Dermatology-Basics_of_Dermatology.json",
    "title": "Introduction To Dermatology Basics Of Dermatology",
    "count": 10,
    "category": "Dermatology"
  },
  {
    "file": "Introduction_to_Dermatology-Previous_Year_Questions.json",
    "title": "Introduction To Dermatology Previous Year Questions",
    "count": 4,
    "category": "Dermatology"
  },
  {
    "file": "Introduction_to_Dermatology-Skin_Lesions_in_Dermatology.json",
    "title": "Introduction To Dermatology Skin Lesions In Dermatology",
    "count": 7,
    "category": "Dermatology"
  },
  {
    "file": "Leprosy_4.json",
    "title": "Leprosy 4",
    "count": 43,
    "category": "Dermatology"
  },
  {
    "file": "Lichen_Planus.json",
    "title": "Lichen Planus",
    "count": 11,
    "category": "Dermatology"
  },
  {
    "file": "Melanin_Disease.json",
    "title": "Melanin Disease",
    "count": 26,
    "category": "Dermatology"
  },
  {
    "file": "Mid_Day_Module_Dermatology-1_-_2025-02-22.json",
    "title": "Mid Day Module Dermatology 1   2025 02 22",
    "count": 50,
    "category": "Dermatology"
  },
  {
    "file": "Mid_Day_Module_Dermatology-2_-_2025-02-23.json",
    "title": "Mid Day Module Dermatology 2   2025 02 23",
    "count": 50,
    "category": "Dermatology"
  },
  {
    "file": "Miscellaneous_Disorders-Adverse_Drug_Reactions__Pediatric_Dermatoses__Urticaria_and_Angioedema.json",
    "title": "Miscellaneous Disorders Adverse Drug Reactions  Pediatric Dermatoses  Urticaria And Angioedema",
    "count": 10,
    "category": "Dermatology"
  },
  {
    "file": "Miscellaneous_Disorders-Genodermatoses__Vector-Borne_Diseases__Bedside_Tests_in_Dermatology.json",
    "title": "Miscellaneous Disorders Genodermatoses  Vector Borne Diseases  Bedside Tests In Dermatology",
    "count": 10,
    "category": "Dermatology"
  },
  {
    "file": "Nail.json",
    "title": "Nail",
    "count": 23,
    "category": "Dermatology"
  },
  {
    "file": "Nail_Diseases.json",
    "title": "Nail Diseases",
    "count": 6,
    "category": "Dermatology"
  },
  {
    "file": "Papulosquamous_Disorders.json",
    "title": "Papulosquamous Disorders",
    "count": 4,
    "category": "Dermatology"
  },
  {
    "file": "Papulosquamous_Disorders_1.json",
    "title": "Papulosquamous Disorders 1",
    "count": 46,
    "category": "Dermatology"
  },
  {
    "file": "Papulosquamous_Disorders-Papulosquamous_Disorders.json",
    "title": "Papulosquamous Disorders Papulosquamous Disorders",
    "count": 18,
    "category": "Dermatology"
  },
  {
    "file": "Papulosquamous_Disorders-Previous_Year_Questions.json",
    "title": "Papulosquamous Disorders Previous Year Questions",
    "count": 21,
    "category": "Dermatology"
  },
  {
    "file": "Parasitic_Infection-Parasitic_infestations_of_skin.json",
    "title": "Parasitic Infection Parasitic Infestations Of Skin",
    "count": 9,
    "category": "Dermatology"
  },
  {
    "file": "Parasitic_Skin_Infections.json",
    "title": "Parasitic Skin Infections",
    "count": 21,
    "category": "Dermatology"
  },
  {
    "file": "Psoriasis.json",
    "title": "Psoriasis",
    "count": 25,
    "category": "Dermatology"
  },
  {
    "file": "PsoriasisLichen_Planus.json",
    "title": "Psoriasislichen Planus",
    "count": 26,
    "category": "Dermatology"
  },
  {
    "file": "Short_Topics_in_Dermatology.json",
    "title": "Short Topics In Dermatology",
    "count": 14,
    "category": "Dermatology"
  },
  {
    "file": "Skin__Subcutaneous_Tissue_Skin_Tumors__Common_Skin_Conditions.json",
    "title": "Skin  Subcutaneous Tissue Skin Tumors  Common Skin Conditions",
    "count": 19,
    "category": "Dermatology"
  },
  {
    "file": "Skin_Appendages_and_their_Disorders-Disorders_of_Glands.json",
    "title": "Skin Appendages And Their Disorders Disorders Of Glands",
    "count": 10,
    "category": "Dermatology"
  },
  {
    "file": "Skin_Appendages_and_their_Disorders-Hair_and_Nail_disorders.json",
    "title": "Skin Appendages And Their Disorders Hair And Nail Disorders",
    "count": 15,
    "category": "Dermatology"
  },
  {
    "file": "Skin_Appendages_and_their_Disorders-Previous_Year_Questions.json",
    "title": "Skin Appendages And Their Disorders Previous Year Questions",
    "count": 22,
    "category": "Dermatology"
  },
  {
    "file": "Skin_Bone_and_Miscellaneous.json",
    "title": "Skin Bone And Miscellaneous",
    "count": 18,
    "category": "Dermatology"
  },
  {
    "file": "Skin_Cancer.json",
    "title": "Skin Cancer",
    "count": 19,
    "category": "Dermatology"
  },
  {
    "file": "Skin_Tumors-Previous_Year_Questions.json",
    "title": "Skin Tumors Previous Year Questions",
    "count": 7,
    "category": "Dermatology"
  },
  {
    "file": "Skin_Tumours.json",
    "title": "Skin Tumours",
    "count": 4,
    "category": "Dermatology"
  },
  {
    "file": "Skin_Tumours_1.json",
    "title": "Skin Tumours 1",
    "count": 19,
    "category": "Dermatology"
  },
  {
    "file": "Skin_Tumours-Skin_Tumors.json",
    "title": "Skin Tumours Skin Tumors",
    "count": 15,
    "category": "Dermatology"
  },
  {
    "file": "SLE_Juvenile_Dermatomyositis__Scleroderma.json",
    "title": "Sle Juvenile Dermatomyositis  Scleroderma",
    "count": 15,
    "category": "Dermatology"
  },
  {
    "file": "Superficial_Fungal_Skin_Infections.json",
    "title": "Superficial Fungal Skin Infections",
    "count": 22,
    "category": "Dermatology"
  },
  {
    "file": "SWT-Dermatology__Psychitary-SET-A.json",
    "title": "Swt Dermatology  Psychitary Set A",
    "count": 200,
    "category": "Dermatology"
  },
  {
    "file": "SWT-Dermatology-SET-B.json",
    "title": "Swt Dermatology Set B",
    "count": 100,
    "category": "Dermatology"
  },
  {
    "file": "Systemic__Nutritional_Dermatology.json",
    "title": "Systemic  Nutritional Dermatology",
    "count": 18,
    "category": "Dermatology"
  },
  {
    "file": "Systemic_Diseases___Skin.json",
    "title": "Systemic Diseases   Skin",
    "count": 4,
    "category": "Dermatology"
  },
  {
    "file": "Systemic_Diseases_and_Skin-Previous_Year_Questions.json",
    "title": "Systemic Diseases And Skin Previous Year Questions",
    "count": 14,
    "category": "Dermatology"
  },
  {
    "file": "Systemic_Diseases_and_Skin-Systemic_diseases_and_skin.json",
    "title": "Systemic Diseases And Skin Systemic Diseases And Skin",
    "count": 15,
    "category": "Dermatology"
  },
  {
    "file": "Viral_Infections_of_Skin.json",
    "title": "Viral Infections Of Skin",
    "count": 4,
    "category": "Dermatology"
  },
  {
    "file": "Acoustic_Neuroma.json",
    "title": "Acoustic Neuroma",
    "count": 7,
    "category": "ENT"
  },
  {
    "file": "Acoustic_Neuroma__Vestibular_Neuronitis.json",
    "title": "Acoustic Neuroma  Vestibular Neuronitis",
    "count": 10,
    "category": "ENT"
  },
  {
    "file": "Acute__Chronic_Pharyngitis.json",
    "title": "Acute  Chronic Pharyngitis",
    "count": 3,
    "category": "ENT"
  },
  {
    "file": "Acute__Chronic_Tonsillitis.json",
    "title": "Acute  Chronic Tonsillitis",
    "count": 6,
    "category": "ENT"
  },
  {
    "file": "Adenotonsillectomy.json",
    "title": "Adenotonsillectomy",
    "count": 8,
    "category": "ENT"
  },
  {
    "file": "Adnexal_Management.json",
    "title": "Adnexal Management",
    "count": 15,
    "category": "ENT"
  },
  {
    "file": "All_Recent_Updates_2021-Previous_Year_Questions.json",
    "title": "All Recent Updates 2021 Previous Year Questions",
    "count": 1,
    "category": "ENT"
  },
  {
    "file": "Allergic_Vasomotor_Atrophic_Rhinitis.json",
    "title": "Allergic Vasomotor Atrophic Rhinitis",
    "count": 12,
    "category": "ENT"
  },
  {
    "file": "Allied_Health_Disciplines-ESI_Act__Factory_Act__NREGA_Act_and_Disaster_Management.json",
    "title": "Allied Health Disciplines Esi Act  Factory Act  Nrega Act And Disaster Management",
    "count": 13,
    "category": "ENT"
  },
  {
    "file": "Anaesthesia_for_Co-existing_Medical_Illness-Anaesthesia_for_Special_Conditions_and_Fluid_Management.json",
    "title": "Anaesthesia For Co Existing Medical Illness Anaesthesia For Special Conditions And Fluid Management",
    "count": 13,
    "category": "ENT"
  },
  {
    "file": "Anaesthetic_Equipments_and_Pre-operative_Assessment.json",
    "title": "Anaesthetic Equipments And Pre Operative Assessment",
    "count": 73,
    "category": "ENT"
  },
  {
    "file": "Anesthesia_Equipment.json",
    "title": "Anesthesia Equipment",
    "count": 50,
    "category": "ENT"
  },
  {
    "file": "Anesthetic_Implication_of_Concurrent_Diseases.json",
    "title": "Anesthetic Implication Of Concurrent Diseases",
    "count": 19,
    "category": "ENT"
  },
  {
    "file": "Anterior_Compartment_of_Thigh__Femoral_Nerve.json",
    "title": "Anterior Compartment Of Thigh  Femoral Nerve",
    "count": 14,
    "category": "ENT"
  },
  {
    "file": "Antigen_Presenting_Cells__MHC.json",
    "title": "Antigen Presenting Cells  Mhc",
    "count": 8,
    "category": "ENT"
  },
  {
    "file": "Antimicrobial_Agents.json",
    "title": "Antimicrobial Agents",
    "count": 116,
    "category": "ENT"
  },
  {
    "file": "Antimicrobials-Properties_of_Anti-microbial_Agents.json",
    "title": "Antimicrobials Properties Of Anti Microbial Agents",
    "count": 9,
    "category": "ENT"
  },
  {
    "file": "ASOM.json",
    "title": "Asom",
    "count": 19,
    "category": "ENT"
  },
  {
    "file": "Assistive_Devices_For_Hearing.json",
    "title": "Assistive Devices For Hearing",
    "count": 8,
    "category": "ENT"
  },
  {
    "file": "Audiometric_Tests_and_Miscellaneous.json",
    "title": "Audiometric Tests And Miscellaneous",
    "count": 31,
    "category": "ENT"
  },
  {
    "file": "Audiometry.json",
    "title": "Audiometry",
    "count": 9,
    "category": "ENT"
  },
  {
    "file": "Basics_and_Fundamentals_of_CT.json",
    "title": "Basics And Fundamentals Of Ct",
    "count": 24,
    "category": "ENT"
  },
  {
    "file": "Basics_of_Radiology-Basics_of_MRI_and_Interventional_Radiology.json",
    "title": "Basics Of Radiology Basics Of Mri And Interventional Radiology",
    "count": 10,
    "category": "ENT"
  },
  {
    "file": "BERA__OAE.json",
    "title": "Bera  Oae",
    "count": 6,
    "category": "ENT"
  },
  {
    "file": "Biomedical_Waste_Management.json",
    "title": "Biomedical Waste Management",
    "count": 26,
    "category": "ENT"
  },
  {
    "file": "Biomedical_Waste_Management_1.json",
    "title": "Biomedical Waste Management 1",
    "count": 16,
    "category": "ENT"
  },
  {
    "file": "Biomedical_Waste_Management-Biomedical_waste_management_and_Genetics_and_Health.json",
    "title": "Biomedical Waste Management Biomedical Waste Management And Genetics And Health",
    "count": 15,
    "category": "ENT"
  },
  {
    "file": "Biomedical_Waste_Management-Previous_Year_Questions.json",
    "title": "Biomedical Waste Management Previous Year Questions",
    "count": 4,
    "category": "ENT"
  },
  {
    "file": "Biostatistics-Biostatistics_and_Measures_of_Central_Tendency.json",
    "title": "Biostatistics Biostatistics And Measures Of Central Tendency",
    "count": 10,
    "category": "ENT"
  },
  {
    "file": "BPPV.json",
    "title": "Bppv",
    "count": 5,
    "category": "ENT"
  },
  {
    "file": "Brainstem_Ventral__Dorsal_View__IV_Ventricles.json",
    "title": "Brainstem Ventral  Dorsal View  Iv Ventricles",
    "count": 17,
    "category": "ENT"
  },
  {
    "file": "Breech_Presentation.json",
    "title": "Breech Presentation",
    "count": 7,
    "category": "ENT"
  },
  {
    "file": "Cardinal_Movements_of_Labour.json",
    "title": "Cardinal Movements Of Labour",
    "count": 2,
    "category": "ENT"
  },
  {
    "file": "Cardiovascular_System-Cardiac_Conducting_System_and_Action_Potentials.json",
    "title": "Cardiovascular System Cardiac Conducting System And Action Potentials",
    "count": 18,
    "category": "ENT"
  },
  {
    "file": "Cellular_Events_of_Inflammation.json",
    "title": "Cellular Events Of Inflammation",
    "count": 1,
    "category": "ENT"
  },
  {
    "file": "Central_Nervous_System.json",
    "title": "Central Nervous System",
    "count": 183,
    "category": "ENT"
  },
  {
    "file": "Central_Nervous_System_1.json",
    "title": "Central Nervous System 1",
    "count": 183,
    "category": "ENT"
  },
  {
    "file": "Central_Nervous_System_2.json",
    "title": "Central Nervous System 2",
    "count": 183,
    "category": "ENT"
  },
  {
    "file": "Central_Nervous_System_3.json",
    "title": "Central Nervous System 3",
    "count": 84,
    "category": "ENT"
  },
  {
    "file": "Central_Nervous_System_4.json",
    "title": "Central Nervous System 4",
    "count": 24,
    "category": "ENT"
  },
  {
    "file": "Central_Nervous_System-Previous_Year_Questions.json",
    "title": "Central Nervous System Previous Year Questions",
    "count": 17,
    "category": "ENT"
  },
  {
    "file": "Central_Neuraxial_Block.json",
    "title": "Central Neuraxial Block",
    "count": 49,
    "category": "ENT"
  },
  {
    "file": "Central_Neuraxial_Blockade-Previous_Year_Questions.json",
    "title": "Central Neuraxial Blockade Previous Year Questions",
    "count": 1,
    "category": "ENT"
  },
  {
    "file": "Cholesteatoma__Tuberculosis_of_Ear.json",
    "title": "Cholesteatoma  Tuberculosis Of Ear",
    "count": 11,
    "category": "ENT"
  },
  {
    "file": "Chronic_Laryngitis.json",
    "title": "Chronic Laryngitis",
    "count": 7,
    "category": "ENT"
  },
  {
    "file": "Clinical_Essentials-Previous_Year_Questions.json",
    "title": "Clinical Essentials Previous Year Questions",
    "count": 3,
    "category": "ENT"
  },
  {
    "file": "Clinical_Essentials-Previous_Year_Questions_1.json",
    "title": "Clinical Essentials Previous Year Questions 1",
    "count": 3,
    "category": "ENT"
  },
  {
    "file": "Clinical_Essentials-Previous_Year_Questions_2.json",
    "title": "Clinical Essentials Previous Year Questions 2",
    "count": 3,
    "category": "ENT"
  },
  {
    "file": "CNS-Dementia.json",
    "title": "Cns Dementia",
    "count": 7,
    "category": "ENT"
  },
  {
    "file": "Complications_of_Sinusitis.json",
    "title": "Complications Of Sinusitis",
    "count": 7,
    "category": "ENT"
  },
  {
    "file": "Complications_of_Sinusitis_and_Epistaxis.json",
    "title": "Complications Of Sinusitis And Epistaxis",
    "count": 6,
    "category": "ENT"
  },
  {
    "file": "Congenital__Benign___Inflammatory_Leisions_of_Larynx_Voice___Speech_Disorders.json",
    "title": "Congenital  Benign   Inflammatory Leisions Of Larynx Voice   Speech Disorders",
    "count": 5,
    "category": "ENT"
  },
  {
    "file": "Congenital_Anomalies_Nasal_Polyps_Rhinitis_Sinusitis.json",
    "title": "Congenital Anomalies Nasal Polyps Rhinitis Sinusitis",
    "count": 8,
    "category": "ENT"
  },
  {
    "file": "Congenital_Anomalies_of_larynx.json",
    "title": "Congenital Anomalies Of Larynx",
    "count": 7,
    "category": "ENT"
  },
  {
    "file": "Congenital_Diseases_of_Larynx_-_Laryngomalacia.json",
    "title": "Congenital Diseases Of Larynx   Laryngomalacia",
    "count": 12,
    "category": "ENT"
  },
  {
    "file": "Consent__Euthanasia.json",
    "title": "Consent  Euthanasia",
    "count": 6,
    "category": "ENT"
  },
  {
    "file": "Contrast_Agents_in_Radiology.json",
    "title": "Contrast Agents In Radiology",
    "count": 11,
    "category": "ENT"
  },
  {
    "file": "Croup__Choanal_Atresia.json",
    "title": "Croup  Choanal Atresia",
    "count": 13,
    "category": "ENT"
  },
  {
    "file": "Csom.json",
    "title": "Csom",
    "count": 13,
    "category": "ENT"
  },
  {
    "file": "Culture__Identification.json",
    "title": "Culture  Identification",
    "count": 23,
    "category": "ENT"
  },
  {
    "file": "CVS_Development_-_Arterial_System.json",
    "title": "Cvs Development   Arterial System",
    "count": 6,
    "category": "ENT"
  },
  {
    "file": "CVS_Development_-_Heart_Tube__Derivates.json",
    "title": "Cvs Development   Heart Tube  Derivates",
    "count": 12,
    "category": "ENT"
  },
  {
    "file": "CVS_Development_-_Interatrial__Interventricular_Septum.json",
    "title": "Cvs Development   Interatrial  Interventricular Septum",
    "count": 10,
    "category": "ENT"
  },
  {
    "file": "CVS_Development_-_Venous_System.json",
    "title": "Cvs Development   Venous System",
    "count": 16,
    "category": "ENT"
  },
  {
    "file": "Deaf_Child_Tinnitus__Hyperbaric_Oxygen_Therapy.json",
    "title": "Deaf Child Tinnitus  Hyperbaric Oxygen Therapy",
    "count": 11,
    "category": "ENT"
  },
  {
    "file": "Dementia_-_Alzheimers_Disease_Part_1.json",
    "title": "Dementia   Alzheimers Disease Part 1",
    "count": 27,
    "category": "ENT"
  },
  {
    "file": "Dementia_-_FTD_Huntington_CJD__NPH_Part_3.json",
    "title": "Dementia   Ftd Huntington Cjd  Nph Part 3",
    "count": 31,
    "category": "ENT"
  },
  {
    "file": "Dementia_-_Lewy_Body_Dementia__Vascular_Dementia_Part_2.json",
    "title": "Dementia   Lewy Body Dementia  Vascular Dementia Part 2",
    "count": 7,
    "category": "ENT"
  },
  {
    "file": "Demo_Test_for_First_Prof_Students_-_2024-12-20.json",
    "title": "Demo Test For First Prof Students   2024 12 20",
    "count": 30,
    "category": "ENT"
  },
  {
    "file": "Development_of_Eye.json",
    "title": "Development Of Eye",
    "count": 3,
    "category": "ENT"
  },
  {
    "file": "Developmental_and_Behavioral_Disorders-Previous_Year_Questions.json",
    "title": "Developmental And Behavioral Disorders Previous Year Questions",
    "count": 6,
    "category": "ENT"
  },
  {
    "file": "Developmental_and_Behavioural_Disorders-Normal_Development__Developmental___Behavioral_Disorders.json",
    "title": "Developmental And Behavioural Disorders Normal Development  Developmental   Behavioral Disorders",
    "count": 20,
    "category": "ENT"
  },
  {
    "file": "Difficult_airway_management___Ventilators.json",
    "title": "Difficult Airway Management   Ventilators",
    "count": 4,
    "category": "ENT"
  },
  {
    "file": "Disaster_Management.json",
    "title": "Disaster Management",
    "count": 12,
    "category": "ENT"
  },
  {
    "file": "Disaster_Management_1.json",
    "title": "Disaster Management 1",
    "count": 17,
    "category": "ENT"
  },
  {
    "file": "Disaster_Management_2.json",
    "title": "Disaster Management 2",
    "count": 10,
    "category": "ENT"
  },
  {
    "file": "Disease_of_External_Ear.json",
    "title": "Disease Of External Ear",
    "count": 30,
    "category": "ENT"
  },
  {
    "file": "Diseases_Infections_and_Tumors_of_Larynx.json",
    "title": "Diseases Infections And Tumors Of Larynx",
    "count": 41,
    "category": "ENT"
  },
  {
    "file": "Diseases_of_External_Nose.json",
    "title": "Diseases Of External Nose",
    "count": 40,
    "category": "ENT"
  },
  {
    "file": "Diseases_of_Nasal_Septum.json",
    "title": "Diseases Of Nasal Septum",
    "count": 12,
    "category": "ENT"
  },
  {
    "file": "Diseases_of_Pharynx.json",
    "title": "Diseases Of Pharynx",
    "count": 10,
    "category": "ENT"
  },
  {
    "file": "Drugs_Affecting_Blood_and_Blood_formation-Oral_and_Parenteral_Anticoagulants.json",
    "title": "Drugs Affecting Blood And Blood Formation Oral And Parenteral Anticoagulants",
    "count": 15,
    "category": "ENT"
  },
  {
    "file": "Ear.json",
    "title": "Ear",
    "count": 319,
    "category": "ENT"
  },
  {
    "file": "Ear-ASOM_and_CSOM__Complications.json",
    "title": "Ear Asom And Csom  Complications",
    "count": 12,
    "category": "ENT"
  },
  {
    "file": "Ear-Cholesteatoma_and_CSOM.json",
    "title": "Ear Cholesteatoma And Csom",
    "count": 16,
    "category": "ENT"
  },
  {
    "file": "Ear-Disorders_of_External_Ear_and_Eustachian_Tube.json",
    "title": "Ear Disorders Of External Ear And Eustachian Tube",
    "count": 16,
    "category": "ENT"
  },
  {
    "file": "Ear-Facial_Nerve_and_Acoustic_Neuroma.json",
    "title": "Ear Facial Nerve And Acoustic Neuroma",
    "count": 17,
    "category": "ENT"
  },
  {
    "file": "Ear-Hearing_Rehabilitation__Otalgia__and_Tinnitus.json",
    "title": "Ear Hearing Rehabilitation  Otalgia  And Tinnitus",
    "count": 8,
    "category": "ENT"
  },
  {
    "file": "Ear-Meniere_s_Disease_and_Glomus_Tumor.json",
    "title": "Ear Meniere S Disease And Glomus Tumor",
    "count": 15,
    "category": "ENT"
  },
  {
    "file": "Ear-Middle_Ear_Diseases__ASOM_SOM.json",
    "title": "Ear Middle Ear Diseases  Asom Som",
    "count": 10,
    "category": "ENT"
  },
  {
    "file": "Ear-Otosclerosis.json",
    "title": "Ear Otosclerosis",
    "count": 10,
    "category": "ENT"
  },
  {
    "file": "Ear-Physiology_and_Assessment_of_Hearing.json",
    "title": "Ear Physiology And Assessment Of Hearing",
    "count": 23,
    "category": "ENT"
  },
  {
    "file": "Ear-Vestibular_System__Physiology__Assessment__and_Associated_Diseases.json",
    "title": "Ear Vestibular System  Physiology  Assessment  And Associated Diseases",
    "count": 16,
    "category": "ENT"
  },
  {
    "file": "ECG_-_Basics__Lead_Placement_Part_1.json",
    "title": "Ecg   Basics  Lead Placement Part 1",
    "count": 18,
    "category": "ENT"
  },
  {
    "file": "ECG_-_Ventricular_Hypertrophies__Axis_Part_4.json",
    "title": "Ecg   Ventricular Hypertrophies  Axis Part 4",
    "count": 2,
    "category": "ENT"
  },
  {
    "file": "Ectropion__Entropion.json",
    "title": "Ectropion  Entropion",
    "count": 16,
    "category": "ENT"
  },
  {
    "file": "Electrocochleography__Cochlear_Vs_Retro-Cochlear.json",
    "title": "Electrocochleography  Cochlear Vs Retro Cochlear",
    "count": 9,
    "category": "ENT"
  },
  {
    "file": "Embryology_of_Ear.json",
    "title": "Embryology Of Ear",
    "count": 6,
    "category": "ENT"
  },
  {
    "file": "Emergency_Medicine-Emergency_Cardiovascular_Care_Protocols__BCLS__ACLS__Mechanical_ventilation__and_Causes_of_Pulseless_Electrical_Activity.json",
    "title": "Emergency Medicine Emergency Cardiovascular Care Protocols  Bcls  Acls  Mechanical Ventilation  And Causes Of Pulseless Electrical Activity",
    "count": 13,
    "category": "ENT"
  },
  {
    "file": "ENT.json",
    "title": "Ent",
    "count": 20,
    "category": "ENT"
  },
  {
    "file": "ENT_-_AIIMS_JUNE_2020.json",
    "title": "Ent   Aiims June 2020",
    "count": 3,
    "category": "ENT"
  },
  {
    "file": "ENT_-_AIIMS_MAY_2018.json",
    "title": "Ent   Aiims May 2018",
    "count": 5,
    "category": "ENT"
  },
  {
    "file": "ENT_-_AIIMS_MAY_2019.json",
    "title": "Ent   Aiims May 2019",
    "count": 3,
    "category": "ENT"
  },
  {
    "file": "ENT_-_AIIMS_NOV_2018.json",
    "title": "Ent   Aiims Nov 2018",
    "count": 2,
    "category": "ENT"
  },
  {
    "file": "ENT_-_AIIMS_NOV_2019.json",
    "title": "Ent   Aiims Nov 2019",
    "count": 4,
    "category": "ENT"
  },
  {
    "file": "ENT_-_INI_CET_JULY_2021.json",
    "title": "Ent   Ini Cet July 2021",
    "count": 3,
    "category": "ENT"
  },
  {
    "file": "ENT_-_INI_CET_MAY_2022.json",
    "title": "Ent   Ini Cet May 2022",
    "count": 4,
    "category": "ENT"
  },
  {
    "file": "ENT_-_INI_CET_NOV_2020.json",
    "title": "Ent   Ini Cet Nov 2020",
    "count": 7,
    "category": "ENT"
  },
  {
    "file": "ENT_-_INI_CET_NOV_2021.json",
    "title": "Ent   Ini Cet Nov 2021",
    "count": 5,
    "category": "ENT"
  },
  {
    "file": "ENT_-_INI_CET_NOV_2023.json",
    "title": "Ent   Ini Cet Nov 2023",
    "count": 7,
    "category": "ENT"
  },
  {
    "file": "ENT_-_INI_CET_NOVEMBER_2022_PART_A.json",
    "title": "Ent   Ini Cet November 2022 Part A",
    "count": 11,
    "category": "ENT"
  },
  {
    "file": "ENT_-_INI_CET_NOVEMBER_2022_PART_B.json",
    "title": "Ent   Ini Cet November 2022 Part B",
    "count": 3,
    "category": "ENT"
  },
  {
    "file": "ENT_-_INICET_MAY_2024.json",
    "title": "Ent   Inicet May 2024",
    "count": 6,
    "category": "ENT"
  },
  {
    "file": "ENT_-_NEET_PG_2018.json",
    "title": "Ent   Neet Pg 2018",
    "count": 6,
    "category": "ENT"
  },
  {
    "file": "ENT_-_NEET_PG_2019.json",
    "title": "Ent   Neet Pg 2019",
    "count": 7,
    "category": "ENT"
  },
  {
    "file": "ENT_-_NEET_PG_2020.json",
    "title": "Ent   Neet Pg 2020",
    "count": 10,
    "category": "ENT"
  },
  {
    "file": "ENT_-_NEET_PG_2021.json",
    "title": "Ent   Neet Pg 2021",
    "count": 6,
    "category": "ENT"
  },
  {
    "file": "ENT_-_NEET_PG_2022.json",
    "title": "Ent   Neet Pg 2022",
    "count": 9,
    "category": "ENT"
  },
  {
    "file": "ENT_-_NEET_PG_2023.json",
    "title": "Ent   Neet Pg 2023",
    "count": 9,
    "category": "ENT"
  },
  {
    "file": "ENT_-_NEET_PG_2024.json",
    "title": "Ent   Neet Pg 2024",
    "count": 13,
    "category": "ENT"
  },
  {
    "file": "ENT-_Class_Test_With_Video_Solution.json",
    "title": "Ent  Class Test With Video Solution",
    "count": 75,
    "category": "ENT"
  },
  {
    "file": "ENT-_INI_CET_MAY_2023.json",
    "title": "Ent  Ini Cet May 2023",
    "count": 5,
    "category": "ENT"
  },
  {
    "file": "ENT_AIIMS_2014-2018.json",
    "title": "Ent Aiims 2014 2018",
    "count": 70,
    "category": "ENT"
  },
  {
    "file": "ENT_Dr_Deepak.json",
    "title": "Ent Dr Deepak",
    "count": 75,
    "category": "ENT"
  },
  {
    "file": "55_ENT_Dr_Deepak.json",
    "title": "Ent Dr Deepak",
    "count": 40,
    "category": "ENT"
  },
  {
    "file": "56_ENT_Dr_Deepak.json",
    "title": "Ent Dr Deepak",
    "count": 40,
    "category": "ENT"
  },
  {
    "file": "59_ENT_Dr_Deepak.json",
    "title": "Ent Dr Deepak",
    "count": 40,
    "category": "ENT"
  },
  {
    "file": "ENT_Dr_Deepak_1.json",
    "title": "Ent Dr Deepak 1",
    "count": 75,
    "category": "ENT"
  },
  {
    "file": "ENT_Dr_Deepak-2026.json",
    "title": "Ent Dr Deepak 2026",
    "count": 75,
    "category": "ENT"
  },
  {
    "file": "ENT_DVT_Revision_Test.json",
    "title": "Ent Dvt Revision Test",
    "count": 25,
    "category": "ENT"
  },
  {
    "file": "ENT_ED_-_28-09-2023_-_2023-09-28.json",
    "title": "Ent Ed   28 09 2023   2023 09 28",
    "count": 75,
    "category": "ENT"
  },
  {
    "file": "ENT_ED_-_Mission_15_-_30-04-2024_-_2024-04-30.json",
    "title": "Ent Ed   Mission 15   30 04 2024   2024 04 30",
    "count": 60,
    "category": "ENT"
  },
  {
    "file": "ENT_ED_-_Mission_15_Lap_2_-_09-06-2024_-_2024-06-09.json",
    "title": "Ent Ed   Mission 15 Lap 2   09 06 2024   2024 06 09",
    "count": 75,
    "category": "ENT"
  },
  {
    "file": "ENT_ED_-_Mission_20_Batch_2_-_17-09-2024_-_2024-09-17.json",
    "title": "Ent Ed   Mission 20 Batch 2   17 09 2024   2024 09 17",
    "count": 50,
    "category": "ENT"
  },
  {
    "file": "ENT_ED_-_Mission_20_Batch_3_-_25-01-2025_-_2025-01-25.json",
    "title": "Ent Ed   Mission 20 Batch 3   25 01 2025   2025 01 25",
    "count": 99,
    "category": "ENT"
  },
  {
    "file": "ENT_ED_-_Mission_20_INICET_-_16-10-2024_-_2024-10-16.json",
    "title": "Ent Ed   Mission 20 Inicet   16 10 2024   2024 10 16",
    "count": 75,
    "category": "ENT"
  },
  {
    "file": "ENT_ED_-_Mission_20_Lap_2_-_23-04-2025_-_2025-04-23.json",
    "title": "Ent Ed   Mission 20 Lap 2   23 04 2025   2025 04 23",
    "count": 50,
    "category": "ENT"
  },
  {
    "file": "ENT_ED_Mission_NEET_PG_-_10-07-2023_-_2023-07-10.json",
    "title": "Ent Ed Mission Neet Pg   10 07 2023   2023 07 10",
    "count": 100,
    "category": "ENT"
  },
  {
    "file": "ENT_ED_Mission_NEET_PG_INICET_20_-_12-05-2024_-_2024-05-12.json",
    "title": "Ent Ed Mission Neet Pg Inicet 20   12 05 2024   2024 05 12",
    "count": 100,
    "category": "ENT"
  },
  {
    "file": "ENT_FMGE_PYQ.json",
    "title": "Ent Fmge Pyq",
    "count": 83,
    "category": "ENT"
  },
  {
    "file": "ENT-INICET_NOV_2024.json",
    "title": "Ent Inicet Nov 2024",
    "count": 8,
    "category": "ENT"
  },
  {
    "file": "ENT_INICET_PYQ.json",
    "title": "Ent Inicet Pyq",
    "count": 79,
    "category": "ENT"
  },
  {
    "file": "ENT_Last_Month_ED_-_19-07-2024_-_2024-07-18.json",
    "title": "Ent Last Month Ed   19 07 2024   2024 07 18",
    "count": 50,
    "category": "ENT"
  },
  {
    "file": "ENT_MIQ_Series.json",
    "title": "Ent Miq Series",
    "count": 20,
    "category": "ENT"
  },
  {
    "file": "ENT_NEET_PG_Revision_ED_-_30-01-2024_-_2024-01-30.json",
    "title": "Ent Neet Pg Revision Ed   30 01 2024   2024 01 30",
    "count": 50,
    "category": "ENT"
  },
  {
    "file": "ENT_NEETPG_PYQ.json",
    "title": "Ent Neetpg Pyq",
    "count": 62,
    "category": "ENT"
  },
  {
    "file": "ENT_Ophthal_Psychiatry_30_-_2024-05-02.json",
    "title": "Ent Ophthal Psychiatry 30   2024 05 02",
    "count": 100,
    "category": "ENT"
  },
  {
    "file": "ENT_Ophthalmology__Psychiatry_BTR_50_Test_-_2025-01-25.json",
    "title": "Ent Ophthalmology  Psychiatry Btr 50 Test   2025 01 25",
    "count": 175,
    "category": "ENT"
  },
  {
    "file": "ENT_Test_The_Champion_Batch_Hyderabad_-_05-01-2025_-_2025-01-05.json",
    "title": "Ent Test The Champion Batch Hyderabad   05 01 2025   2025 01 05",
    "count": 50,
    "category": "ENT"
  },
  {
    "file": "ENT_Test_The_Champion_Batch_Hyderabad_-_29-03-2025_-_2025-03-29.json",
    "title": "Ent Test The Champion Batch Hyderabad   29 03 2025   2025 03 29",
    "count": 75,
    "category": "ENT"
  },
  {
    "file": "ENT_Test_The_Champion_Batch_Hyderabad_-_31-05-2024_-_2024-05-31.json",
    "title": "Ent Test The Champion Batch Hyderabad   31 05 2024   2024 05 31",
    "count": 75,
    "category": "ENT"
  },
  {
    "file": "ENT_Test_The_Champion_Batch_Hyderabad_11-10-2024_-_2024-10-11.json",
    "title": "Ent Test The Champion Batch Hyderabad 11 10 2024   2024 10 11",
    "count": 75,
    "category": "ENT"
  },
  {
    "file": "Entomology.json",
    "title": "Entomology",
    "count": 26,
    "category": "ENT"
  },
  {
    "file": "Entrapment_Neuropathies.json",
    "title": "Entrapment Neuropathies",
    "count": 11,
    "category": "ENT"
  },
  {
    "file": "Environment__Health.json",
    "title": "Environment  Health",
    "count": 30,
    "category": "ENT"
  },
  {
    "file": "Environment_and_Health.json",
    "title": "Environment And Health",
    "count": 109,
    "category": "ENT"
  },
  {
    "file": "Environment_and_Health-Air__Light__Sound__and_Radiation.json",
    "title": "Environment And Health Air  Light  Sound  And Radiation",
    "count": 16,
    "category": "ENT"
  },
  {
    "file": "Environment_and_Health-Entomology.json",
    "title": "Environment And Health Entomology",
    "count": 12,
    "category": "ENT"
  },
  {
    "file": "Environment_and_Health-Previous_Year_Questions.json",
    "title": "Environment And Health Previous Year Questions",
    "count": 34,
    "category": "ENT"
  },
  {
    "file": "Environment_and_Health-Water-_Introduction_and_Purification.json",
    "title": "Environment And Health Water  Introduction And Purification",
    "count": 15,
    "category": "ENT"
  },
  {
    "file": "Epiglottitis__Croup.json",
    "title": "Epiglottitis  Croup",
    "count": 9,
    "category": "ENT"
  },
  {
    "file": "Epistaxis.json",
    "title": "Epistaxis",
    "count": 5,
    "category": "ENT"
  },
  {
    "file": "Epistaxis__Deviated_Nasal_Septum.json",
    "title": "Epistaxis  Deviated Nasal Septum",
    "count": 29,
    "category": "ENT"
  },
  {
    "file": "Essential_Thromobocythemia.json",
    "title": "Essential Thromobocythemia",
    "count": 1,
    "category": "ENT"
  },
  {
    "file": "Exclusively_for_1st_Prof_Students_-_24-11-2024_-_2024-11-24.json",
    "title": "Exclusively For 1St Prof Students   24 11 2024   2024 11 24",
    "count": 30,
    "category": "ENT"
  },
  {
    "file": "External_Ear_and_its_Diseases.json",
    "title": "External Ear And Its Diseases",
    "count": 23,
    "category": "ENT"
  },
  {
    "file": "External_Ear_Diseases.json",
    "title": "External Ear Diseases",
    "count": 5,
    "category": "ENT"
  },
  {
    "file": "Extracranial_Complications__Labyrinthitis.json",
    "title": "Extracranial Complications  Labyrinthitis",
    "count": 2,
    "category": "ENT"
  },
  {
    "file": "Extracranial_Complications__Mastoiditis.json",
    "title": "Extracranial Complications  Mastoiditis",
    "count": 12,
    "category": "ENT"
  },
  {
    "file": "Facial_and_Nose_Trauma_including_CSF_Rhinorrhea.json",
    "title": "Facial And Nose Trauma Including Csf Rhinorrhea",
    "count": 8,
    "category": "ENT"
  },
  {
    "file": "Fetal_Assessment.json",
    "title": "Fetal Assessment",
    "count": 25,
    "category": "ENT"
  },
  {
    "file": "Forensic_Identification-Forensic_Identification.json",
    "title": "Forensic Identification Forensic Identification",
    "count": 25,
    "category": "ENT"
  },
  {
    "file": "Forensic_Identification-Previous_Year_Questions.json",
    "title": "Forensic Identification Previous Year Questions",
    "count": 25,
    "category": "ENT"
  },
  {
    "file": "Forensic_Psychiatry-Forensic_Psychiatry__Electroconvulsive_Therapy__Ect__And_Bereavement.json",
    "title": "Forensic Psychiatry Forensic Psychiatry  Electroconvulsive Therapy  Ect  And Bereavement",
    "count": 9,
    "category": "ENT"
  },
  {
    "file": "Fractures_of_Facial_Skeleton_and_Tumours_of_Nose_and_PNS.json",
    "title": "Fractures Of Facial Skeleton And Tumours Of Nose And Pns",
    "count": 8,
    "category": "ENT"
  },
  {
    "file": "Fundamentals_of_Reproduction.json",
    "title": "Fundamentals Of Reproduction",
    "count": 18,
    "category": "ENT"
  },
  {
    "file": "Gastroenterology.json",
    "title": "Gastroenterology",
    "count": 140,
    "category": "ENT"
  },
  {
    "file": "General_Anesthesia_-_Inhalational_Agents.json",
    "title": "General Anesthesia   Inhalational Agents",
    "count": 50,
    "category": "ENT"
  },
  {
    "file": "General_Embryology-Development_Period.json",
    "title": "General Embryology Development Period",
    "count": 10,
    "category": "ENT"
  },
  {
    "file": "General_Microbiology-Scientists__Stains__and_Microscopes.json",
    "title": "General Microbiology Scientists  Stains  And Microscopes",
    "count": 17,
    "category": "ENT"
  },
  {
    "file": "GIT_Development_-_Foregut.json",
    "title": "Git Development   Foregut",
    "count": 6,
    "category": "ENT"
  },
  {
    "file": "GIT_Development_-_Midgut.json",
    "title": "Git Development   Midgut",
    "count": 20,
    "category": "ENT"
  },
  {
    "file": "Glaucoma-Glaucoma-PACG__Treatment__Congenital_Glaucoma.json",
    "title": "Glaucoma Glaucoma Pacg  Treatment  Congenital Glaucoma",
    "count": 25,
    "category": "ENT"
  },
  {
    "file": "Glomus_Tumour.json",
    "title": "Glomus Tumour",
    "count": 7,
    "category": "ENT"
  },
  {
    "file": "Granulomatous_Diseases_of_Nose.json",
    "title": "Granulomatous Diseases Of Nose",
    "count": 9,
    "category": "ENT"
  },
  {
    "file": "Growth__Development.json",
    "title": "Growth  Development",
    "count": 59,
    "category": "ENT"
  },
  {
    "file": "Growth_and_Development_Nutrition.json",
    "title": "Growth And Development Nutrition",
    "count": 50,
    "category": "ENT"
  },
  {
    "file": "Growth_Assessment.json",
    "title": "Growth Assessment",
    "count": 22,
    "category": "ENT"
  },
  {
    "file": "Growth_Development_Puberty.json",
    "title": "Growth Development Puberty",
    "count": 7,
    "category": "ENT"
  },
  {
    "file": "Hair__Other_Methods_of_Identification.json",
    "title": "Hair  Other Methods Of Identification",
    "count": 5,
    "category": "ENT"
  },
  {
    "file": "Hamstring_Compartment__Anastomosis.json",
    "title": "Hamstring Compartment  Anastomosis",
    "count": 8,
    "category": "ENT"
  },
  {
    "file": "Head_And_Neck-Neck__Facial_Injuries___Abnormalities.json",
    "title": "Head And Neck Neck  Facial Injuries   Abnormalities",
    "count": 25,
    "category": "ENT"
  },
  {
    "file": "Head_and_Neck-Previous_Year_Questions.json",
    "title": "Head And Neck Previous Year Questions",
    "count": 38,
    "category": "ENT"
  },
  {
    "file": "Health_Management.json",
    "title": "Health Management",
    "count": 21,
    "category": "ENT"
  },
  {
    "file": "Health_Planning__Management.json",
    "title": "Health Planning  Management",
    "count": 14,
    "category": "ENT"
  },
  {
    "file": "Health_Planning_and_Management.json",
    "title": "Health Planning And Management",
    "count": 15,
    "category": "ENT"
  },
  {
    "file": "Health_Planning_and_Management-Health_Planning_and_Management.json",
    "title": "Health Planning And Management Health Planning And Management",
    "count": 8,
    "category": "ENT"
  },
  {
    "file": "Health_Planning_and_Management-Previous_Year_Questions.json",
    "title": "Health Planning And Management Previous Year Questions",
    "count": 15,
    "category": "ENT"
  },
  {
    "file": "Health_Planning_Planning_Committees_Health_Management_Techniques.json",
    "title": "Health Planning Planning Committees Health Management Techniques",
    "count": 4,
    "category": "ENT"
  },
  {
    "file": "Hearing_Loss_Review__Tympanic_Membrane_Images.json",
    "title": "Hearing Loss Review  Tympanic Membrane Images",
    "count": 24,
    "category": "ENT"
  },
  {
    "file": "Helminthic_Gastroenteritis.json",
    "title": "Helminthic Gastroenteritis",
    "count": 14,
    "category": "ENT"
  },
  {
    "file": "Hematology__White_Blood_Cells-WBC_Basics_and_Instruments.json",
    "title": "Hematology  White Blood Cells Wbc Basics And Instruments",
    "count": 9,
    "category": "ENT"
  },
  {
    "file": "Hematology-Blood_components_and_Complications_of_blood_transfusion.json",
    "title": "Hematology Blood Components And Complications Of Blood Transfusion",
    "count": 20,
    "category": "ENT"
  },
  {
    "file": "Higher_Mental_Functions.json",
    "title": "Higher Mental Functions",
    "count": 6,
    "category": "ENT"
  },
  {
    "file": "HIV_-_Treatment_Part_3.json",
    "title": "Hiv   Treatment Part 3",
    "count": 10,
    "category": "ENT"
  },
  {
    "file": "HNF_Development_-_Face__Palate.json",
    "title": "Hnf Development   Face  Palate",
    "count": 13,
    "category": "ENT"
  },
  {
    "file": "HNF_Development_-_Pharyngeal_Arches.json",
    "title": "Hnf Development   Pharyngeal Arches",
    "count": 19,
    "category": "ENT"
  },
  {
    "file": "HNF_Development_-_Tongue_Thyroid__Eyeball.json",
    "title": "Hnf Development   Tongue Thyroid  Eyeball",
    "count": 12,
    "category": "ENT"
  },
  {
    "file": "Hormonal_Agents__Tyrosine_Kinase_Inhibitors.json",
    "title": "Hormonal Agents  Tyrosine Kinase Inhibitors",
    "count": 14,
    "category": "ENT"
  },
  {
    "file": "IBD_Diarrhea__Dehydration_Management.json",
    "title": "Ibd Diarrhea  Dehydration Management",
    "count": 15,
    "category": "ENT"
  },
  {
    "file": "Identification.json",
    "title": "Identification",
    "count": 55,
    "category": "ENT"
  },
  {
    "file": "Identification_1.json",
    "title": "Identification 1",
    "count": 36,
    "category": "ENT"
  },
  {
    "file": "Image_Based_and_Recent_Updates.json",
    "title": "Image Based And Recent Updates",
    "count": 49,
    "category": "ENT"
  },
  {
    "file": "Images_and_Instruments-Orthopedic_Disorders_and_Instruments.json",
    "title": "Images And Instruments Orthopedic Disorders And Instruments",
    "count": 24,
    "category": "ENT"
  },
  {
    "file": "Images_and_Instruments-Previous_Year_Questions.json",
    "title": "Images And Instruments Previous Year Questions",
    "count": 1,
    "category": "ENT"
  },
  {
    "file": "Induction__Augmentation.json",
    "title": "Induction  Augmentation",
    "count": 12,
    "category": "ENT"
  },
  {
    "file": "Infective_Rhinosinusitis_-_1_-_Fungal_Sinusitis.json",
    "title": "Infective Rhinosinusitis   1   Fungal Sinusitis",
    "count": 3,
    "category": "ENT"
  },
  {
    "file": "Infective_Rhinosinusitis_Part_2_-_Bacterial_Sinusitis.json",
    "title": "Infective Rhinosinusitis Part 2   Bacterial Sinusitis",
    "count": 3,
    "category": "ENT"
  },
  {
    "file": "Inhalational_Anaesthetic_Agents-Inhalational_Anaesthetics.json",
    "title": "Inhalational Anaesthetic Agents Inhalational Anaesthetics",
    "count": 16,
    "category": "ENT"
  },
  {
    "file": "Inhalational_Anaesthetic_Agents-Previous_Year_Questions.json",
    "title": "Inhalational Anaesthetic Agents Previous Year Questions",
    "count": 7,
    "category": "ENT"
  },
  {
    "file": "Inhalational_Anesthetic_Agents.json",
    "title": "Inhalational Anesthetic Agents",
    "count": 25,
    "category": "ENT"
  },
  {
    "file": "Inner_Ear_and_its_Diseases.json",
    "title": "Inner Ear And Its Diseases",
    "count": 31,
    "category": "ENT"
  },
  {
    "file": "Inner_Ear_Diseases_and_Facial_Nerve.json",
    "title": "Inner Ear Diseases And Facial Nerve",
    "count": 9,
    "category": "ENT"
  },
  {
    "file": "Instrument.json",
    "title": "Instrument",
    "count": 26,
    "category": "ENT"
  },
  {
    "file": "Instrument_1.json",
    "title": "Instrument 1",
    "count": 26,
    "category": "ENT"
  },
  {
    "file": "Instrument_2.json",
    "title": "Instrument 2",
    "count": 26,
    "category": "ENT"
  },
  {
    "file": "Instrumental_Delivery.json",
    "title": "Instrumental Delivery",
    "count": 6,
    "category": "ENT"
  },
  {
    "file": "Instrumental_Delivery_1.json",
    "title": "Instrumental Delivery 1",
    "count": 9,
    "category": "ENT"
  },
  {
    "file": "Instrumental_Vaginal_Delivery-Previous_Year_Questions.json",
    "title": "Instrumental Vaginal Delivery Previous Year Questions",
    "count": 3,
    "category": "ENT"
  },
  {
    "file": "Instruments.json",
    "title": "Instruments",
    "count": 40,
    "category": "ENT"
  },
  {
    "file": "Instruments__Implants_In_Ortho.json",
    "title": "Instruments  Implants In Ortho",
    "count": 14,
    "category": "ENT"
  },
  {
    "file": "Instruments_for_EAR.json",
    "title": "Instruments For Ear",
    "count": 12,
    "category": "ENT"
  },
  {
    "file": "Instruments_for_Nose__Throat.json",
    "title": "Instruments For Nose  Throat",
    "count": 3,
    "category": "ENT"
  },
  {
    "file": "Instruments_in_Anesthesia.json",
    "title": "Instruments In Anesthesia",
    "count": 56,
    "category": "ENT"
  },
  {
    "file": "Instruments_in_Gynae.json",
    "title": "Instruments In Gynae",
    "count": 21,
    "category": "ENT"
  },
  {
    "file": "Instruments_in_Obs.json",
    "title": "Instruments In Obs",
    "count": 11,
    "category": "ENT"
  },
  {
    "file": "Instruments-Previous_Year_Questions.json",
    "title": "Instruments Previous Year Questions",
    "count": 3,
    "category": "ENT"
  },
  {
    "file": "Instruments-Previous_Year_Questions_1.json",
    "title": "Instruments Previous Year Questions 1",
    "count": 3,
    "category": "ENT"
  },
  {
    "file": "Instruments-Previous_Year_Questions_2.json",
    "title": "Instruments Previous Year Questions 2",
    "count": 3,
    "category": "ENT"
  },
  {
    "file": "Instruments-Previous_Year_Questions_3.json",
    "title": "Instruments Previous Year Questions 3",
    "count": 3,
    "category": "ENT"
  },
  {
    "file": "Intensive_Care_Management.json",
    "title": "Intensive Care Management",
    "count": 11,
    "category": "ENT"
  },
  {
    "file": "Interferential_Statistics.json",
    "title": "Interferential Statistics",
    "count": 5,
    "category": "ENT"
  },
  {
    "file": "Interior_of_Right_Atrium__Right_Ventricle.json",
    "title": "Interior Of Right Atrium  Right Ventricle",
    "count": 7,
    "category": "ENT"
  },
  {
    "file": "Intravenous_Anaesthetic_Agents.json",
    "title": "Intravenous Anaesthetic Agents",
    "count": 13,
    "category": "ENT"
  },
  {
    "file": "Intravenous_Anaesthetic_Agents-Intravenous_Anaesthetic_Agents.json",
    "title": "Intravenous Anaesthetic Agents Intravenous Anaesthetic Agents",
    "count": 20,
    "category": "ENT"
  },
  {
    "file": "Intravenous_Anaesthetic_Agents-Previous_Year_Questions.json",
    "title": "Intravenous Anaesthetic Agents Previous Year Questions",
    "count": 7,
    "category": "ENT"
  },
  {
    "file": "Intravenous_and_Inhaled_Anaesthetic_Agents.json",
    "title": "Intravenous And Inhaled Anaesthetic Agents",
    "count": 104,
    "category": "ENT"
  },
  {
    "file": "Intravenous_Anesthetic_Agents.json",
    "title": "Intravenous Anesthetic Agents",
    "count": 51,
    "category": "ENT"
  },
  {
    "file": "Introduction__DNA_Alkylating_Agents.json",
    "title": "Introduction  Dna Alkylating Agents",
    "count": 20,
    "category": "ENT"
  },
  {
    "file": "Introduction__Examination_of_ENT.json",
    "title": "Introduction  Examination Of Ent",
    "count": 4,
    "category": "ENT"
  },
  {
    "file": "Investigation__Management.json",
    "title": "Investigation  Management",
    "count": 10,
    "category": "ENT"
  },
  {
    "file": "Juvenile_Nasopharyngeal_Angiofibroma.json",
    "title": "Juvenile Nasopharyngeal Angiofibroma",
    "count": 11,
    "category": "ENT"
  },
  {
    "file": "Laryngeal_Carcinoma.json",
    "title": "Laryngeal Carcinoma",
    "count": 12,
    "category": "ENT"
  },
  {
    "file": "Laryngeal_Carcinoma_1.json",
    "title": "Laryngeal Carcinoma 1",
    "count": 6,
    "category": "ENT"
  },
  {
    "file": "Laryngeal_Papilloma.json",
    "title": "Laryngeal Papilloma",
    "count": 2,
    "category": "ENT"
  },
  {
    "file": "Laryngectomy.json",
    "title": "Laryngectomy",
    "count": 7,
    "category": "ENT"
  },
  {
    "file": "Laryngomalacia__Bronchiolar_Disorders.json",
    "title": "Laryngomalacia  Bronchiolar Disorders",
    "count": 13,
    "category": "ENT"
  },
  {
    "file": "Laryngoscopy.json",
    "title": "Laryngoscopy",
    "count": 5,
    "category": "ENT"
  },
  {
    "file": "Larynx.json",
    "title": "Larynx",
    "count": 16,
    "category": "ENT"
  },
  {
    "file": "Larynx_1.json",
    "title": "Larynx 1",
    "count": 78,
    "category": "ENT"
  },
  {
    "file": "Larynx-Laryngeal_Paralysis_and_Laryngeal_Carcinoma.json",
    "title": "Larynx Laryngeal Paralysis And Laryngeal Carcinoma",
    "count": 18,
    "category": "ENT"
  },
  {
    "file": "Laser_in_Ent__Photodynamic_Therapy.json",
    "title": "Laser In Ent  Photodynamic Therapy",
    "count": 4,
    "category": "ENT"
  },
  {
    "file": "Late_Night_PYQ_PYT_Marathon_ENT-1_-_2025-01-21.json",
    "title": "Late Night Pyq Pyt Marathon Ent 1   2025 01 21",
    "count": 60,
    "category": "ENT"
  },
  {
    "file": "Late_Night_PYQ_PYT_Marathon_ENT-2_-_2025-01-22.json",
    "title": "Late Night Pyq Pyt Marathon Ent 2   2025 01 22",
    "count": 60,
    "category": "ENT"
  },
  {
    "file": "Late_Night_PYQ_PYT_Marathon_ENT-3_-_2025-01-23.json",
    "title": "Late Night Pyq Pyt Marathon Ent 3   2025 01 23",
    "count": 60,
    "category": "ENT"
  },
  {
    "file": "Late_Night_PYQ_PYT_Marathon_ENT-4_-_2025-01-24.json",
    "title": "Late Night Pyq Pyt Marathon Ent 4   2025 01 24",
    "count": 60,
    "category": "ENT"
  },
  {
    "file": "Late_Night_PYQ_PYT_Marathon_OphthaENT-1_-_2025-01-25.json",
    "title": "Late Night Pyq Pyt Marathon Ophthaent 1   2025 01 25",
    "count": 60,
    "category": "ENT"
  },
  {
    "file": "Late_Night_PYQ_PYT_Marathon_PsychiatryOphthaENT-1_-_2025-01-26.json",
    "title": "Late Night Pyq Pyt Marathon Psychiatryophthaent 1   2025 01 26",
    "count": 60,
    "category": "ENT"
  },
  {
    "file": "Latent_Squint.json",
    "title": "Latent Squint",
    "count": 8,
    "category": "ENT"
  },
  {
    "file": "Lateral__Third_Ventricles.json",
    "title": "Lateral  Third Ventricles",
    "count": 10,
    "category": "ENT"
  },
  {
    "file": "Leg_Compartments.json",
    "title": "Leg Compartments",
    "count": 3,
    "category": "ENT"
  },
  {
    "file": "Levels_of_Prevention.json",
    "title": "Levels Of Prevention",
    "count": 8,
    "category": "ENT"
  },
  {
    "file": "Liver__Hepatic_Segments.json",
    "title": "Liver  Hepatic Segments",
    "count": 7,
    "category": "ENT"
  },
  {
    "file": "Lungs_-_Mediastinal_Surface__Bronchopulmonary_Segments.json",
    "title": "Lungs   Mediastinal Surface  Bronchopulmonary Segments",
    "count": 7,
    "category": "ENT"
  },
  {
    "file": "Lymphedema_Clinical_Presentation.json",
    "title": "Lymphedema Clinical Presentation",
    "count": 11,
    "category": "ENT"
  },
  {
    "file": "Malpresentation.json",
    "title": "Malpresentation",
    "count": 6,
    "category": "ENT"
  },
  {
    "file": "Management_of_Severe_Acute_Malnutrition.json",
    "title": "Management Of Severe Acute Malnutrition",
    "count": 21,
    "category": "ENT"
  },
  {
    "file": "Management_Part_1.json",
    "title": "Management Part 1",
    "count": 5,
    "category": "ENT"
  },
  {
    "file": "Management_Part_2.json",
    "title": "Management Part 2",
    "count": 14,
    "category": "ENT"
  },
  {
    "file": "Management_Part_3.json",
    "title": "Management Part 3",
    "count": 10,
    "category": "ENT"
  },
  {
    "file": "Management_Part_4.json",
    "title": "Management Part 4",
    "count": 25,
    "category": "ENT"
  },
  {
    "file": "Mechanical_Ventilation_and_Modes_of_Ventilation-Difficult_airway_management_and_Ventilators.json",
    "title": "Mechanical Ventilation And Modes Of Ventilation Difficult Airway Management And Ventilators",
    "count": 13,
    "category": "ENT"
  },
  {
    "file": "Mechanical_Ventilation_and_Modes_of_Ventilation-Previous_Year_Questions.json",
    "title": "Mechanical Ventilation And Modes Of Ventilation Previous Year Questions",
    "count": 5,
    "category": "ENT"
  },
  {
    "file": "Medial_Compartment_of_Thigh__Obturator_Nerve.json",
    "title": "Medial Compartment Of Thigh  Obturator Nerve",
    "count": 8,
    "category": "ENT"
  },
  {
    "file": "Membrane_Potentials.json",
    "title": "Membrane Potentials",
    "count": 15,
    "category": "ENT"
  },
  {
    "file": "Menieres_Disease.json",
    "title": "Menieres Disease",
    "count": 6,
    "category": "ENT"
  },
  {
    "file": "Mental_Health.json",
    "title": "Mental Health",
    "count": 14,
    "category": "ENT"
  },
  {
    "file": "Micronutrients.json",
    "title": "Micronutrients",
    "count": 20,
    "category": "ENT"
  },
  {
    "file": "Mid_Day_Module_ENT-1_-_2025-01-22.json",
    "title": "Mid Day Module Ent 1   2025 01 22",
    "count": 49,
    "category": "ENT"
  },
  {
    "file": "Mid_Day_Module_ENT-2_-_2025-01-23.json",
    "title": "Mid Day Module Ent 2   2025 01 23",
    "count": 50,
    "category": "ENT"
  },
  {
    "file": "Mid_Day_Module_ENT-3_-_2025-01-24.json",
    "title": "Mid Day Module Ent 3   2025 01 24",
    "count": 50,
    "category": "ENT"
  },
  {
    "file": "Mid_Day_Module_ENT-4_-_2025-01-25.json",
    "title": "Mid Day Module Ent 4   2025 01 25",
    "count": 50,
    "category": "ENT"
  },
  {
    "file": "Mid_Day_Module_ENTOphthalmology-5_-_2025-01-26.json",
    "title": "Mid Day Module Entophthalmology 5   2025 01 26",
    "count": 50,
    "category": "ENT"
  },
  {
    "file": "Mid_Day_Module_ENTOphthalmologyPsychiatry-1_-_2025-01-27.json",
    "title": "Mid Day Module Entophthalmologypsychiatry 1   2025 01 27",
    "count": 50,
    "category": "ENT"
  },
  {
    "file": "Middle_Ear_and_its_Diseases.json",
    "title": "Middle Ear And Its Diseases",
    "count": 36,
    "category": "ENT"
  },
  {
    "file": "Middle_Ear_Diseases.json",
    "title": "Middle Ear Diseases",
    "count": 12,
    "category": "ENT"
  },
  {
    "file": "Miscellaneous_Disorders_of_Nose.json",
    "title": "Miscellaneous Disorders Of Nose",
    "count": 19,
    "category": "ENT"
  },
  {
    "file": "Miscellaneous_History_of_Public_Health_Entomology.json",
    "title": "Miscellaneous History Of Public Health Entomology",
    "count": 3,
    "category": "ENT"
  },
  {
    "file": "Miscellaneous-Instruments.json",
    "title": "Miscellaneous Instruments",
    "count": 14,
    "category": "ENT"
  },
  {
    "file": "Missed_pill_management.json",
    "title": "Missed Pill Management",
    "count": 9,
    "category": "ENT"
  },
  {
    "file": "Movement_Disorders_Part_1.json",
    "title": "Movement Disorders Part 1",
    "count": 10,
    "category": "ENT"
  },
  {
    "file": "M\u00e9ni\u00e8reS_Disease.json",
    "title": "M\u00e9ni\u00e8res Disease",
    "count": 17,
    "category": "ENT"
  },
  {
    "file": "Nasal_Polyps.json",
    "title": "Nasal Polyps",
    "count": 6,
    "category": "ENT"
  },
  {
    "file": "Nasal_Tumors_and_Polyposis.json",
    "title": "Nasal Tumors And Polyposis",
    "count": 18,
    "category": "ENT"
  },
  {
    "file": "Nasopharyngeal_Carcinoma.json",
    "title": "Nasopharyngeal Carcinoma",
    "count": 9,
    "category": "ENT"
  },
  {
    "file": "Nasopharynx.json",
    "title": "Nasopharynx",
    "count": 12,
    "category": "ENT"
  },
  {
    "file": "National_Health_Programs-National_health_mission_RMNCH_-_A___maternal_initiatives__Child_and_adolescents_health_initiatives.json",
    "title": "National Health Programs National Health Mission Rmnch   A   Maternal Initiatives  Child And Adolescents Health Initiatives",
    "count": 14,
    "category": "ENT"
  },
  {
    "file": "Neoplasia-Fundamentals_of_Neoplasia.json",
    "title": "Neoplasia Fundamentals Of Neoplasia",
    "count": 10,
    "category": "ENT"
  },
  {
    "file": "Nerve_Muscle_Physiology-Neuron_and_nerve__Action_Potential__RMP__Nerve_fibre_classification.json",
    "title": "Nerve Muscle Physiology Neuron And Nerve  Action Potential  Rmp  Nerve Fibre Classification",
    "count": 26,
    "category": "ENT"
  },
  {
    "file": "Normal_Development-Previous_Year_Questions.json",
    "title": "Normal Development Previous Year Questions",
    "count": 17,
    "category": "ENT"
  },
  {
    "file": "Nose.json",
    "title": "Nose",
    "count": 136,
    "category": "ENT"
  },
  {
    "file": "Nose_and_Paranasal_Sinuses-Diseases_of_the_External_Nose_and_Septum.json",
    "title": "Nose And Paranasal Sinuses Diseases Of The External Nose And Septum",
    "count": 11,
    "category": "ENT"
  },
  {
    "file": "Nose_and_Paranasal_Sinuses-Disorders_of_Paranasal_Sinuses.json",
    "title": "Nose And Paranasal Sinuses Disorders Of Paranasal Sinuses",
    "count": 22,
    "category": "ENT"
  },
  {
    "file": "Nose_and_Paranasal_Sinuses-Epistaxis_and_Facial_Trauma.json",
    "title": "Nose And Paranasal Sinuses Epistaxis And Facial Trauma",
    "count": 15,
    "category": "ENT"
  },
  {
    "file": "Nose_and_Paranasal_Sinuses-Granulomatous_Lesions__Congenital_Anomalies__and_Nasal_Polyps.json",
    "title": "Nose And Paranasal Sinuses Granulomatous Lesions  Congenital Anomalies  And Nasal Polyps",
    "count": 27,
    "category": "ENT"
  },
  {
    "file": "Nose_and_Paranasal_Sinuses-Previous_Year_Questions.json",
    "title": "Nose And Paranasal Sinuses Previous Year Questions",
    "count": 95,
    "category": "ENT"
  },
  {
    "file": "Nose_and_Paranasal_Sinuses-Rhinitis_and_CSF_Rhinorrhea.json",
    "title": "Nose And Paranasal Sinuses Rhinitis And Csf Rhinorrhea",
    "count": 13,
    "category": "ENT"
  },
  {
    "file": "Nutrition_and_Health-Macronutrients.json",
    "title": "Nutrition And Health Macronutrients",
    "count": 14,
    "category": "ENT"
  },
  {
    "file": "Nutrition_and_Health-Micronutrients.json",
    "title": "Nutrition And Health Micronutrients",
    "count": 15,
    "category": "ENT"
  },
  {
    "file": "Nutrition_and_Malnutrition-Breastmilk___Micronutrients.json",
    "title": "Nutrition And Malnutrition Breastmilk   Micronutrients",
    "count": 20,
    "category": "ENT"
  },
  {
    "file": "O2_Independent_Killing.json",
    "title": "O2 Independent Killing",
    "count": 1,
    "category": "ENT"
  },
  {
    "file": "Obstetrics-Abnormalities_of_Placenta_and_Umbilical_Cord.json",
    "title": "Obstetrics Abnormalities Of Placenta And Umbilical Cord",
    "count": 19,
    "category": "ENT"
  },
  {
    "file": "Obstetrics-Instrumental_delivery_and_induction_of_labor.json",
    "title": "Obstetrics Instrumental Delivery And Induction Of Labor",
    "count": 14,
    "category": "ENT"
  },
  {
    "file": "Organic_Mental_Disorders.json",
    "title": "Organic Mental Disorders",
    "count": 31,
    "category": "ENT"
  },
  {
    "file": "Organic_Mental_Disorders_1.json",
    "title": "Organic Mental Disorders 1",
    "count": 26,
    "category": "ENT"
  },
  {
    "file": "Orientation_of_Extra_Ocular_Muscles.json",
    "title": "Orientation Of Extra Ocular Muscles",
    "count": 8,
    "category": "ENT"
  },
  {
    "file": "Oropharynx_and_hypopharynx.json",
    "title": "Oropharynx And Hypopharynx",
    "count": 18,
    "category": "ENT"
  },
  {
    "file": "Otosclerosis.json",
    "title": "Otosclerosis",
    "count": 17,
    "category": "ENT"
  },
  {
    "file": "Otosclerosis_1.json",
    "title": "Otosclerosis 1",
    "count": 9,
    "category": "ENT"
  },
  {
    "file": "Oxygen_Therapy__Mechanical_Ventilation_and_Airway-Previous_Year_Questions.json",
    "title": "Oxygen Therapy  Mechanical Ventilation And Airway Previous Year Questions",
    "count": 25,
    "category": "ENT"
  },
  {
    "file": "Paediatric_Gastroentrology.json",
    "title": "Paediatric Gastroentrology",
    "count": 13,
    "category": "ENT"
  },
  {
    "file": "Pain_Management-Pain_management.json",
    "title": "Pain Management Pain Management",
    "count": 8,
    "category": "ENT"
  },
  {
    "file": "Pancreas_Management_of_Acute__Chronic_Pancreatitis.json",
    "title": "Pancreas Management Of Acute  Chronic Pancreatitis",
    "count": 53,
    "category": "ENT"
  },
  {
    "file": "Pediatric_Gastroenterology-GIT_Disorders_in_Children.json",
    "title": "Pediatric Gastroenterology Git Disorders In Children",
    "count": 20,
    "category": "ENT"
  },
  {
    "file": "Pediatric_Gastroenterology-Liver_Disorders_in_Children.json",
    "title": "Pediatric Gastroenterology Liver Disorders In Children",
    "count": 13,
    "category": "ENT"
  },
  {
    "file": "Pediatric_Gastroenterology-Previous_Year_Questions.json",
    "title": "Pediatric Gastroenterology Previous Year Questions",
    "count": 22,
    "category": "ENT"
  },
  {
    "file": "Pediatric_Nephrology-Renal_Development_and_Congenital_Disorders.json",
    "title": "Pediatric Nephrology Renal Development And Congenital Disorders",
    "count": 19,
    "category": "ENT"
  },
  {
    "file": "Pelvis_and_Perineum-Development_of_GUT__Pelvis___Perineum.json",
    "title": "Pelvis And Perineum Development Of Gut  Pelvis   Perineum",
    "count": 10,
    "category": "ENT"
  },
  {
    "file": "Permanent_Methods_of_Contraception.json",
    "title": "Permanent Methods Of Contraception",
    "count": 14,
    "category": "ENT"
  },
  {
    "file": "Permanent_Sterilisation.json",
    "title": "Permanent Sterilisation",
    "count": 7,
    "category": "ENT"
  },
  {
    "file": "Pharyngeal_Spaces_and_their_Infections.json",
    "title": "Pharyngeal Spaces And Their Infections",
    "count": 10,
    "category": "ENT"
  },
  {
    "file": "Pharyngeal_Tumours.json",
    "title": "Pharyngeal Tumours",
    "count": 10,
    "category": "ENT"
  },
  {
    "file": "Pharynx-Adenoid_and_Palatine_Tonsils.json",
    "title": "Pharynx Adenoid And Palatine Tonsils",
    "count": 14,
    "category": "ENT"
  },
  {
    "file": "Pharynx-JNA_and_Nasopharyngeal_Carcinoma.json",
    "title": "Pharynx Jna And Nasopharyngeal Carcinoma",
    "count": 5,
    "category": "ENT"
  },
  {
    "file": "Pharynx-Ludwig_s_Angina__Pharyngeal_Pouch_and_Abscess_related_to_Pharynx.json",
    "title": "Pharynx Ludwig S Angina  Pharyngeal Pouch And Abscess Related To Pharynx",
    "count": 9,
    "category": "ENT"
  },
  {
    "file": "Physiology_Assessment_of_Ear.json",
    "title": "Physiology Assessment Of Ear",
    "count": 7,
    "category": "ENT"
  },
  {
    "file": "Pigmentary_Disorder.json",
    "title": "Pigmentary Disorder",
    "count": 3,
    "category": "ENT"
  },
  {
    "file": "Pigmentary_Disorders.json",
    "title": "Pigmentary Disorders",
    "count": 21,
    "category": "ENT"
  },
  {
    "file": "Pigmentary_Disorders-Pigmentary_disorders.json",
    "title": "Pigmentary Disorders Pigmentary Disorders",
    "count": 20,
    "category": "ENT"
  },
  {
    "file": "Pigmentary_Disorders-Previous_Year_Questions.json",
    "title": "Pigmentary Disorders Previous Year Questions",
    "count": 14,
    "category": "ENT"
  },
  {
    "file": "Pigmentation_Diseases.json",
    "title": "Pigmentation Diseases",
    "count": 15,
    "category": "ENT"
  },
  {
    "file": "Placenta__Fetus.json",
    "title": "Placenta  Fetus",
    "count": 24,
    "category": "ENT"
  },
  {
    "file": "Placenta_Previa.json",
    "title": "Placenta Previa",
    "count": 7,
    "category": "ENT"
  },
  {
    "file": "Preoperative_Assessment.json",
    "title": "Preoperative Assessment",
    "count": 30,
    "category": "ENT"
  },
  {
    "file": "Prevention_of_Non_communicable_disease.json",
    "title": "Prevention Of Non Communicable Disease",
    "count": 25,
    "category": "ENT"
  },
  {
    "file": "Preventive_and_Social_Obstetrics.json",
    "title": "Preventive And Social Obstetrics",
    "count": 8,
    "category": "ENT"
  },
  {
    "file": "Preventive_Aspects_of_Communicable_Diseases.json",
    "title": "Preventive Aspects Of Communicable Diseases",
    "count": 139,
    "category": "ENT"
  },
  {
    "file": "Preventive_Medicine_in__Obstetrics__Pediatrics_and_Geriatrics-Preventive_Medicine_in_Obstetrics__Pediatrics_and_Geriatrics.json",
    "title": "Preventive Medicine In  Obstetrics  Pediatrics And Geriatrics Preventive Medicine In Obstetrics  Pediatrics And Geriatrics",
    "count": 25,
    "category": "ENT"
  },
  {
    "file": "Preventive_Medicine_in__Obstetrics__Pediatrics_and_Geriatrics-Previous_Year_Questions.json",
    "title": "Preventive Medicine In  Obstetrics  Pediatrics And Geriatrics Previous Year Questions",
    "count": 28,
    "category": "ENT"
  },
  {
    "file": "Preventive_Obstetrics_and_Gynecology__Pediatrics__Growth__Development__School_Health.json",
    "title": "Preventive Obstetrics And Gynecology  Pediatrics  Growth  Development  School Health",
    "count": 6,
    "category": "ENT"
  },
  {
    "file": "Preventive_Obstetrics_Paediatrics__Geriatrics.json",
    "title": "Preventive Obstetrics Paediatrics  Geriatrics",
    "count": 58,
    "category": "ENT"
  },
  {
    "file": "Protozoal_Gastroenteritis.json",
    "title": "Protozoal Gastroenteritis",
    "count": 31,
    "category": "ENT"
  },
  {
    "file": "PSM_Ophthal_ENT__FMT_The_Champion_Batch_Hyderabad_-_17-03-2025_-_2025-03-17.json",
    "title": "Psm Ophthal Ent  Fmt The Champion Batch Hyderabad   17 03 2025   2025 03 17",
    "count": 200,
    "category": "ENT"
  },
  {
    "file": "PSM_Statistics_Demography_Obstetrics__Paediatrics_Nutrition_Environment_Management_Health_ca.json",
    "title": "Psm Statistics Demography Obstetrics  Paediatrics Nutrition Environment Management Health Ca",
    "count": 50,
    "category": "ENT"
  },
  {
    "file": "Psychi_Optha_ENT_BTR_Test_20_-_2024-01-31.json",
    "title": "Psychi Optha Ent Btr Test 20   2024 01 31",
    "count": 100,
    "category": "ENT"
  },
  {
    "file": "Psychi_Opthal_ENT_10_BTR_Test_-_2023-10-13.json",
    "title": "Psychi Opthal Ent 10 Btr Test   2023 10 13",
    "count": 100,
    "category": "ENT"
  },
  {
    "file": "Psychiatry_ENT__Ophtha_40_BTR_test_-_2024-10-18.json",
    "title": "Psychiatry Ent  Ophtha 40 Btr Test   2024 10 18",
    "count": 100,
    "category": "ENT"
  },
  {
    "file": "Psychiatry_ENT__Ophthalmology_BTR_60_test_-_2025-04-25.json",
    "title": "Psychiatry Ent  Ophthalmology Btr 60 Test   2025 04 25",
    "count": 100,
    "category": "ENT"
  },
  {
    "file": "Pulmonary_Ventilation_-_Compliance__Surface_Tension.json",
    "title": "Pulmonary Ventilation   Compliance  Surface Tension",
    "count": 8,
    "category": "ENT"
  },
  {
    "file": "Pulmonary_Ventilation_-_Lung_Volume__Capacities.json",
    "title": "Pulmonary Ventilation   Lung Volume  Capacities",
    "count": 10,
    "category": "ENT"
  },
  {
    "file": "Pulmonary_Ventilation_-_Minute_Ventilation__Dead_Spaces.json",
    "title": "Pulmonary Ventilation   Minute Ventilation  Dead Spaces",
    "count": 3,
    "category": "ENT"
  },
  {
    "file": "Pulmonary_Ventilation_-_Obstructive_Vs_Restrictive_Lung_Disease.json",
    "title": "Pulmonary Ventilation   Obstructive Vs Restrictive Lung Disease",
    "count": 4,
    "category": "ENT"
  },
  {
    "file": "Pulmonary_Ventilation_-_Respiratory_Muscles_Pressures.json",
    "title": "Pulmonary Ventilation   Respiratory Muscles Pressures",
    "count": 5,
    "category": "ENT"
  },
  {
    "file": "Rational_PrescribingEssential_Medicine__Ebm.json",
    "title": "Rational Prescribingessential Medicine  Ebm",
    "count": 4,
    "category": "ENT"
  },
  {
    "file": "3rd_Stage_of_Labour__Its_Management.json",
    "title": "Rd Stage Of Labour  Its Management",
    "count": 6,
    "category": "ENT"
  },
  {
    "file": "Recent_MTP_ACT.json",
    "title": "Recent Mtp Act",
    "count": 3,
    "category": "ENT"
  },
  {
    "file": "Renal_Physiology-Acid_Secretion_and_Counter-Current_Mechanism_of_the_Kidney.json",
    "title": "Renal Physiology Acid Secretion And Counter Current Mechanism Of The Kidney",
    "count": 12,
    "category": "ENT"
  },
  {
    "file": "Retina-Macular_and_Fundus_Disorders__Retinal_Detachment_and_Retinoblastoma.json",
    "title": "Retina Macular And Fundus Disorders  Retinal Detachment And Retinoblastoma",
    "count": 20,
    "category": "ENT"
  },
  {
    "file": "Retinal_Detachment.json",
    "title": "Retinal Detachment",
    "count": 5,
    "category": "ENT"
  },
  {
    "file": "Rhino-Sinusitis_and_Complications.json",
    "title": "Rhino Sinusitis And Complications",
    "count": 24,
    "category": "ENT"
  },
  {
    "file": "Scientists.json",
    "title": "Scientists",
    "count": 8,
    "category": "ENT"
  },
  {
    "file": "Secondary_Developmental_Glaucoma.json",
    "title": "Secondary Developmental Glaucoma",
    "count": 7,
    "category": "ENT"
  },
  {
    "file": "Sociology__Biomedical_Waste_Management.json",
    "title": "Sociology  Biomedical Waste Management",
    "count": 24,
    "category": "ENT"
  },
  {
    "file": "Sociology__Enviroment_and_Health.json",
    "title": "Sociology  Enviroment And Health",
    "count": 76,
    "category": "ENT"
  },
  {
    "file": "Specialty_Management.json",
    "title": "Specialty Management",
    "count": 60,
    "category": "ENT"
  },
  {
    "file": "Speech_Disorders.json",
    "title": "Speech Disorders",
    "count": 10,
    "category": "ENT"
  },
  {
    "file": "Speech_Rehabilitation.json",
    "title": "Speech Rehabilitation",
    "count": 4,
    "category": "ENT"
  },
  {
    "file": "Stridor_Voice_disorders_Tracheostomy_and_Miscellaneous.json",
    "title": "Stridor Voice Disorders Tracheostomy And Miscellaneous",
    "count": 19,
    "category": "ENT"
  },
  {
    "file": "SWT-ENT-SET-A.json",
    "title": "Swt Ent Set A",
    "count": 200,
    "category": "ENT"
  },
  {
    "file": "SWT-ENT-SET-B.json",
    "title": "Swt Ent Set B",
    "count": 100,
    "category": "ENT"
  },
  {
    "file": "Systemic_Bacteriology-Corynebacterium___Filamentous_bacterium.json",
    "title": "Systemic Bacteriology Corynebacterium   Filamentous Bacterium",
    "count": 14,
    "category": "ENT"
  },
  {
    "file": "Systemic_Bacteriology-Vibrio_and_non-fermenters.json",
    "title": "Systemic Bacteriology Vibrio And Non Fermenters",
    "count": 7,
    "category": "ENT"
  },
  {
    "file": "The_Placenta__Fetal_Membranes.json",
    "title": "The Placenta  Fetal Membranes",
    "count": 14,
    "category": "ENT"
  },
  {
    "file": "Thorax-Development_of_the_Cardiovascular_System_and_Fetal_Circulation.json",
    "title": "Thorax Development Of The Cardiovascular System And Fetal Circulation",
    "count": 12,
    "category": "ENT"
  },
  {
    "file": "Thorax-Thorax__Lungs__Joints__Respiratory_Movements.json",
    "title": "Thorax Thorax  Lungs  Joints  Respiratory Movements",
    "count": 19,
    "category": "ENT"
  },
  {
    "file": "Trace_Elements_Nutrition_Health_Programs_Food_Adulteration_Food_Logos.json",
    "title": "Trace Elements Nutrition Health Programs Food Adulteration Food Logos",
    "count": 4,
    "category": "ENT"
  },
  {
    "file": "Traffic_Accident_Injuries.json",
    "title": "Traffic Accident Injuries",
    "count": 3,
    "category": "ENT"
  },
  {
    "file": "Transient_Myeloproliferative_Disorder__Lymphoma_Hl_NHL.json",
    "title": "Transient Myeloproliferative Disorder  Lymphoma Hl Nhl",
    "count": 7,
    "category": "ENT"
  },
  {
    "file": "Treatment.json",
    "title": "Treatment",
    "count": 9,
    "category": "ENT"
  },
  {
    "file": "Treatment_of_Bipolar_Affective_Disorder.json",
    "title": "Treatment Of Bipolar Affective Disorder",
    "count": 2,
    "category": "ENT"
  },
  {
    "file": "Treatment_of_Depression.json",
    "title": "Treatment Of Depression",
    "count": 16,
    "category": "ENT"
  },
  {
    "file": "Treatment_Of_Leprosy_And_Mac.json",
    "title": "Treatment Of Leprosy And Mac",
    "count": 2,
    "category": "ENT"
  },
  {
    "file": "Treatment_of_Otosclerosis__Stapedectomy.json",
    "title": "Treatment Of Otosclerosis  Stapedectomy",
    "count": 5,
    "category": "ENT"
  },
  {
    "file": "Treatment_of_POAG.json",
    "title": "Treatment Of Poag",
    "count": 8,
    "category": "ENT"
  },
  {
    "file": "Treatment_Of_Schizophrenia.json",
    "title": "Treatment Of Schizophrenia",
    "count": 18,
    "category": "ENT"
  },
  {
    "file": "Tubes_and_Catheters_Instruments.json",
    "title": "Tubes And Catheters Instruments",
    "count": 8,
    "category": "ENT"
  },
  {
    "file": "Tumours_of_Nose__Sinuses.json",
    "title": "Tumours Of Nose  Sinuses",
    "count": 6,
    "category": "ENT"
  },
  {
    "file": "Tuning_Fork_Tests.json",
    "title": "Tuning Fork Tests",
    "count": 12,
    "category": "ENT"
  },
  {
    "file": "Tympanometry.json",
    "title": "Tympanometry",
    "count": 8,
    "category": "ENT"
  },
  {
    "file": "Urinary_Bladder_-_Urinary_Diversion_Retention_of_Urine__Incontinence_Part_1.json",
    "title": "Urinary Bladder   Urinary Diversion Retention Of Urine  Incontinence Part 1",
    "count": 9,
    "category": "ENT"
  },
  {
    "file": "Variables_Central_Tendency_Dispersion_Distribution.json",
    "title": "Variables Central Tendency Dispersion Distribution",
    "count": 5,
    "category": "ENT"
  },
  {
    "file": "Vascular_Events_of_Inflammation.json",
    "title": "Vascular Events Of Inflammation",
    "count": 1,
    "category": "ENT"
  },
  {
    "file": "Ventral__Other_Types_of_Hernias.json",
    "title": "Ventral  Other Types Of Hernias",
    "count": 11,
    "category": "ENT"
  },
  {
    "file": "Vertigo_Part_1.json",
    "title": "Vertigo Part 1",
    "count": 5,
    "category": "ENT"
  },
  {
    "file": "Vertigo_Part_2.json",
    "title": "Vertigo Part 2",
    "count": 3,
    "category": "ENT"
  },
  {
    "file": "Vestibular_Function_Caloric_Test__Fistula_Tests.json",
    "title": "Vestibular Function Caloric Test  Fistula Tests",
    "count": 5,
    "category": "ENT"
  },
  {
    "file": "Violent_Asphyxia_Deaths-Previous_Year_Questions.json",
    "title": "Violent Asphyxia Deaths Previous Year Questions",
    "count": 1,
    "category": "ENT"
  },
  {
    "file": "Viral_Gastro_Enteritis.json",
    "title": "Viral Gastro Enteritis",
    "count": 8,
    "category": "ENT"
  },
  {
    "file": "Vocal_Cord_Paralysis.json",
    "title": "Vocal Cord Paralysis",
    "count": 17,
    "category": "ENT"
  },
  {
    "file": "Vocal_Nodules_Polyps_Laryngocele.json",
    "title": "Vocal Nodules Polyps Laryngocele",
    "count": 3,
    "category": "ENT"
  },
  {
    "file": "Voice_Disorders.json",
    "title": "Voice Disorders",
    "count": 13,
    "category": "ENT"
  },
  {
    "file": "Abrasions.json",
    "title": "Abrasions",
    "count": 10,
    "category": "Forensic Medicine"
  },
  {
    "file": "Adipocere_Mummification__Embalming.json",
    "title": "Adipocere Mummification  Embalming",
    "count": 15,
    "category": "Forensic Medicine"
  },
  {
    "file": "Age_Estimation_By_X-Ray_Examination.json",
    "title": "Age Estimation By X Ray Examination",
    "count": 6,
    "category": "Forensic Medicine"
  },
  {
    "file": "Algor_Mortis.json",
    "title": "Algor Mortis",
    "count": 10,
    "category": "Forensic Medicine"
  },
  {
    "file": "Asphyxial_Deaths-Asphyxial_Death.json",
    "title": "Asphyxial Deaths Asphyxial Death",
    "count": 18,
    "category": "Forensic Medicine"
  },
  {
    "file": "Asphyxial_Deaths-Previous_Year_Questions.json",
    "title": "Asphyxial Deaths Previous Year Questions",
    "count": 7,
    "category": "Forensic Medicine"
  },
  {
    "file": "Asphyxiants.json",
    "title": "Asphyxiants",
    "count": 6,
    "category": "Forensic Medicine"
  },
  {
    "file": "Autopsy_FSL.json",
    "title": "Autopsy Fsl",
    "count": 26,
    "category": "Forensic Medicine"
  },
  {
    "file": "Autopsy_Necropsy_Postmortem_Examination_Thanotopsy.json",
    "title": "Autopsy Necropsy Postmortem Examination Thanotopsy",
    "count": 8,
    "category": "Forensic Medicine"
  },
  {
    "file": "Ballistics.json",
    "title": "Ballistics",
    "count": 5,
    "category": "Forensic Medicine"
  },
  {
    "file": "Ballistics-Forensic_Ballistics.json",
    "title": "Ballistics Forensic Ballistics",
    "count": 25,
    "category": "Forensic Medicine"
  },
  {
    "file": "Blood__Seminal_Stains.json",
    "title": "Blood  Seminal Stains",
    "count": 10,
    "category": "Forensic Medicine"
  },
  {
    "file": "Classification_of_Postmortem_Changes.json",
    "title": "Classification Of Postmortem Changes",
    "count": 15,
    "category": "Forensic Medicine"
  },
  {
    "file": "Classification_Of_Sexual_Offences__Rape.json",
    "title": "Classification Of Sexual Offences  Rape",
    "count": 20,
    "category": "Forensic Medicine"
  },
  {
    "file": "Contusions.json",
    "title": "Contusions",
    "count": 8,
    "category": "Forensic Medicine"
  },
  {
    "file": "Corrosives.json",
    "title": "Corrosives",
    "count": 8,
    "category": "Forensic Medicine"
  },
  {
    "file": "Counter_Coup_Lesions__Concussion.json",
    "title": "Counter Coup Lesions  Concussion",
    "count": 5,
    "category": "Forensic Medicine"
  },
  {
    "file": "Court_of_Law_Mechanical_Injuries.json",
    "title": "Court Of Law Mechanical Injuries",
    "count": 9,
    "category": "Forensic Medicine"
  },
  {
    "file": "Courts_Of_Law.json",
    "title": "Courts Of Law",
    "count": 8,
    "category": "Forensic Medicine"
  },
  {
    "file": "Death__Its_Types.json",
    "title": "Death  Its Types",
    "count": 10,
    "category": "Forensic Medicine"
  },
  {
    "file": "Decomposition.json",
    "title": "Decomposition",
    "count": 8,
    "category": "Forensic Medicine"
  },
  {
    "file": "Defenses_Against_Negligence.json",
    "title": "Defenses Against Negligence",
    "count": 10,
    "category": "Forensic Medicine"
  },
  {
    "file": "Definitions__Inquest.json",
    "title": "Definitions  Inquest",
    "count": 12,
    "category": "Forensic Medicine"
  },
  {
    "file": "Drowning.json",
    "title": "Drowning",
    "count": 10,
    "category": "Forensic Medicine"
  },
  {
    "file": "Electrical_Injuries.json",
    "title": "Electrical Injuries",
    "count": 6,
    "category": "Forensic Medicine"
  },
  {
    "file": "Evidence.json",
    "title": "Evidence",
    "count": 8,
    "category": "Forensic Medicine"
  },
  {
    "file": "Explosion_Injuries.json",
    "title": "Explosion Injuries",
    "count": 3,
    "category": "Forensic Medicine"
  },
  {
    "file": "Fetal_New_Born_Infanticide.json",
    "title": "Fetal New Born Infanticide",
    "count": 5,
    "category": "Forensic Medicine"
  },
  {
    "file": "FFFA.json",
    "title": "Fffa",
    "count": 10,
    "category": "Forensic Medicine"
  },
  {
    "file": "Finger_Printing.json",
    "title": "Finger Printing",
    "count": 6,
    "category": "Forensic Medicine"
  },
  {
    "file": "FM_-_AIIMS_JUNE_2020.json",
    "title": "Fm   Aiims June 2020",
    "count": 9,
    "category": "Forensic Medicine"
  },
  {
    "file": "FM_-_AIIMS_MAY_2018.json",
    "title": "Fm   Aiims May 2018",
    "count": 9,
    "category": "Forensic Medicine"
  },
  {
    "file": "FM_-_AIIMS_MAY_2019.json",
    "title": "Fm   Aiims May 2019",
    "count": 7,
    "category": "Forensic Medicine"
  },
  {
    "file": "FM_-_AIIMS_NOV_2018.json",
    "title": "Fm   Aiims Nov 2018",
    "count": 10,
    "category": "Forensic Medicine"
  },
  {
    "file": "FM_-_AIIMS_NOV_2019.json",
    "title": "Fm   Aiims Nov 2019",
    "count": 6,
    "category": "Forensic Medicine"
  },
  {
    "file": "FM_-_INI_CET_JULY_2021.json",
    "title": "Fm   Ini Cet July 2021",
    "count": 10,
    "category": "Forensic Medicine"
  },
  {
    "file": "FM_-_INI_CET_MAY_2022.json",
    "title": "Fm   Ini Cet May 2022",
    "count": 9,
    "category": "Forensic Medicine"
  },
  {
    "file": "FM_-_INI_CET_NOV_2020.json",
    "title": "Fm   Ini Cet Nov 2020",
    "count": 8,
    "category": "Forensic Medicine"
  },
  {
    "file": "FM_-_NEET_PG_2019.json",
    "title": "Fm   Neet Pg 2019",
    "count": 9,
    "category": "Forensic Medicine"
  },
  {
    "file": "FM_-_NEET_PG_2022.json",
    "title": "Fm   Neet Pg 2022",
    "count": 5,
    "category": "Forensic Medicine"
  },
  {
    "file": "FM_ED_-_Mission_15_-_01-04-2024_-_2024-04-01.json",
    "title": "Fm Ed   Mission 15   01 04 2024   2024 04 01",
    "count": 75,
    "category": "Forensic Medicine"
  },
  {
    "file": "FM_ED_-_Mission_20_INICET_-_21-09-2024_-_2024-09-21.json",
    "title": "Fm Ed   Mission 20 Inicet   21 09 2024   2024 09 21",
    "count": 75,
    "category": "Forensic Medicine"
  },
  {
    "file": "FM_ED_-_Mission_20_Lap_2_-_13-04-2025_-_2025-04-13.json",
    "title": "Fm Ed   Mission 20 Lap 2   13 04 2025   2025 04 13",
    "count": 50,
    "category": "Forensic Medicine"
  },
  {
    "file": "FMGE_CT_-_FMT.json",
    "title": "Fmge Ct   Fmt",
    "count": 40,
    "category": "Forensic Medicine"
  },
  {
    "file": "FMT.json",
    "title": "Fmt",
    "count": 100,
    "category": "Forensic Medicine"
  },
  {
    "file": "FMT-_Class_Test_With_Video_Solution.json",
    "title": "Fmt  Class Test With Video Solution",
    "count": 50,
    "category": "Forensic Medicine"
  },
  {
    "file": "FMT_AIIMS_2014-2018.json",
    "title": "Fmt Aiims 2014 2018",
    "count": 127,
    "category": "Forensic Medicine"
  },
  {
    "file": "FMT-Clinical_Vignettes.json",
    "title": "Fmt Clinical Vignettes",
    "count": 53,
    "category": "Forensic Medicine"
  },
  {
    "file": "FMT_Dr_Mohit.json",
    "title": "Fmt Dr Mohit",
    "count": 40,
    "category": "Forensic Medicine"
  },
  {
    "file": "97_FMT_Dr_Mohit.json",
    "title": "Fmt Dr Mohit",
    "count": 40,
    "category": "Forensic Medicine"
  },
  {
    "file": "FMT_Dr_Mohit-2026.json",
    "title": "Fmt Dr Mohit 2026",
    "count": 100,
    "category": "Forensic Medicine"
  },
  {
    "file": "FMT_Dr_Mohit-2026_1.json",
    "title": "Fmt Dr Mohit 2026 1",
    "count": 100,
    "category": "Forensic Medicine"
  },
  {
    "file": "FMT_Dr_Mohit_FMGE_CT.json",
    "title": "Fmt Dr Mohit Fmge Ct",
    "count": 40,
    "category": "Forensic Medicine"
  },
  {
    "file": "FMT_DVT_Revision_Test.json",
    "title": "Fmt Dvt Revision Test",
    "count": 25,
    "category": "Forensic Medicine"
  },
  {
    "file": "FMT_FMGE_PYQ.json",
    "title": "Fmt Fmge Pyq",
    "count": 83,
    "category": "Forensic Medicine"
  },
  {
    "file": "FMT_IBQ.json",
    "title": "Fmt Ibq",
    "count": 20,
    "category": "Forensic Medicine"
  },
  {
    "file": "FMT_Image_Based_Question.json",
    "title": "Fmt Image Based Question",
    "count": 20,
    "category": "Forensic Medicine"
  },
  {
    "file": "Forensic_Medicine_-_INI_CET_MAY_2023.json",
    "title": "Forensic Medicine   Ini Cet May 2023",
    "count": 9,
    "category": "Forensic Medicine"
  },
  {
    "file": "Forensic_Medicine_-_INI_CET_NOV_2023.json",
    "title": "Forensic Medicine   Ini Cet Nov 2023",
    "count": 10,
    "category": "Forensic Medicine"
  },
  {
    "file": "Forensic_Medicine_-_INI_CET_NOVEMBER_2022_PART_-_A.json",
    "title": "Forensic Medicine   Ini Cet November 2022 Part   A",
    "count": 8,
    "category": "Forensic Medicine"
  },
  {
    "file": "Forensic_Medicine_-_INI_CET_NOVEMBER_2022_PART_-_B.json",
    "title": "Forensic Medicine   Ini Cet November 2022 Part   B",
    "count": 13,
    "category": "Forensic Medicine"
  },
  {
    "file": "Forensic_Medicine_-_INICET_MAY_2024.json",
    "title": "Forensic Medicine   Inicet May 2024",
    "count": 6,
    "category": "Forensic Medicine"
  },
  {
    "file": "Forensic_Medicine_-_NEET_PG_2023.json",
    "title": "Forensic Medicine   Neet Pg 2023",
    "count": 4,
    "category": "Forensic Medicine"
  },
  {
    "file": "Forensic_Medicine_-_NEET_PG_2024.json",
    "title": "Forensic Medicine   Neet Pg 2024",
    "count": 17,
    "category": "Forensic Medicine"
  },
  {
    "file": "Forensic_Medicine_ED_-_Mission_NEET_PG_20_-_Final_Batch_-_08-06-2025_-_2025-06-08.json",
    "title": "Forensic Medicine Ed   Mission Neet Pg 20   Final Batch   08 06 2025   2025 06 08",
    "count": 50,
    "category": "Forensic Medicine"
  },
  {
    "file": "Forensic_Medicine_ED_Mission_NEET_PG_-_13-09-2023_-_2023-09-13.json",
    "title": "Forensic Medicine Ed Mission Neet Pg   13 09 2023   2023 09 13",
    "count": 50,
    "category": "Forensic Medicine"
  },
  {
    "file": "Forensic_Medicine_ED_Mission_NEET_PG_INICET_20_-_07-07-2024_-_2024-07-07.json",
    "title": "Forensic Medicine Ed Mission Neet Pg Inicet 20   07 07 2024   2024 07 07",
    "count": 75,
    "category": "Forensic Medicine"
  },
  {
    "file": "FORENSIC_MEDICINE-INICET_NOV_2024.json",
    "title": "Forensic Medicine Inicet Nov 2024",
    "count": 5,
    "category": "Forensic Medicine"
  },
  {
    "file": "Forensic_Medicine_Last_Month_ED_-_21-07-2024_-_2024-07-21.json",
    "title": "Forensic Medicine Last Month Ed   21 07 2024   2024 07 21",
    "count": 25,
    "category": "Forensic Medicine"
  },
  {
    "file": "Forensic_Medicine_NEET_PG_Revision_ED_-_07-01-2024_-_2024-01-07.json",
    "title": "Forensic Medicine Neet Pg Revision Ed   07 01 2024   2024 01 07",
    "count": 50,
    "category": "Forensic Medicine"
  },
  {
    "file": "Forensic_Medicine_Test_The_Champion_Batch_Hyderabad_-_03-05-2024_-_2024-05-03.json",
    "title": "Forensic Medicine Test The Champion Batch Hyderabad   03 05 2024   2024 05 03",
    "count": 75,
    "category": "Forensic Medicine"
  },
  {
    "file": "Forensic_Medicine_Test_The_Champion_Batch_Hyderabad_-_04-06-2025_-_2025-06-04.json",
    "title": "Forensic Medicine Test The Champion Batch Hyderabad   04 06 2025   2025 06 04",
    "count": 50,
    "category": "Forensic Medicine"
  },
  {
    "file": "Forensic_Medicine_Test_The_Champion_Batch_Hyderabad_-_25-10-2024_-_2024-10-25.json",
    "title": "Forensic Medicine Test The Champion Batch Hyderabad   25 10 2024   2024 10 25",
    "count": 75,
    "category": "Forensic Medicine"
  },
  {
    "file": "Forensic_Psychiatry.json",
    "title": "Forensic Psychiatry",
    "count": 14,
    "category": "Forensic Medicine"
  },
  {
    "file": "Forensic_Psychiatry_1.json",
    "title": "Forensic Psychiatry 1",
    "count": 15,
    "category": "Forensic Medicine"
  },
  {
    "file": "Forensic_Psychiatry-Forensic_Psychiatry.json",
    "title": "Forensic Psychiatry Forensic Psychiatry",
    "count": 11,
    "category": "Forensic Medicine"
  },
  {
    "file": "Forensic_Psychiatry-Previous_Year_Questions.json",
    "title": "Forensic Psychiatry Previous Year Questions",
    "count": 7,
    "category": "Forensic Medicine"
  },
  {
    "file": "Forensic_Psychiatry-Previous_Year_Questions_1.json",
    "title": "Forensic Psychiatry Previous Year Questions 1",
    "count": 7,
    "category": "Forensic Medicine"
  },
  {
    "file": "Forensic_Toxicology-Forensic_Toxicology_1.json",
    "title": "Forensic Toxicology Forensic Toxicology 1",
    "count": 20,
    "category": "Forensic Medicine"
  },
  {
    "file": "Forensic_Toxicology-Forensic_Toxicology_2.json",
    "title": "Forensic Toxicology Forensic Toxicology 2",
    "count": 25,
    "category": "Forensic Medicine"
  },
  {
    "file": "Forensic_Toxicology-Previous_Year_Questions.json",
    "title": "Forensic Toxicology Previous Year Questions",
    "count": 80,
    "category": "Forensic Medicine"
  },
  {
    "file": "Forensic_Traumatology-Mechanical_injuries.json",
    "title": "Forensic Traumatology Mechanical Injuries",
    "count": 24,
    "category": "Forensic Medicine"
  },
  {
    "file": "Forensic_Traumatology-Previous_Year_Questions.json",
    "title": "Forensic Traumatology Previous Year Questions",
    "count": 37,
    "category": "Forensic Medicine"
  },
  {
    "file": "Forensic_Traumatology-Regional_injuries.json",
    "title": "Forensic Traumatology Regional Injuries",
    "count": 13,
    "category": "Forensic Medicine"
  },
  {
    "file": "Forensic_Traumatology-Thermal_injuries_and_RTA.json",
    "title": "Forensic Traumatology Thermal Injuries And Rta",
    "count": 21,
    "category": "Forensic Medicine"
  },
  {
    "file": "Hanging.json",
    "title": "Hanging",
    "count": 12,
    "category": "Forensic Medicine"
  },
  {
    "file": "Impotence_Sterility_Virginity_Abortion.json",
    "title": "Impotence Sterility Virginity Abortion",
    "count": 7,
    "category": "Forensic Medicine"
  },
  {
    "file": "Infamous_Conduct.json",
    "title": "Infamous Conduct",
    "count": 8,
    "category": "Forensic Medicine"
  },
  {
    "file": "Infanticide__Child_Abuse.json",
    "title": "Infanticide  Child Abuse",
    "count": 47,
    "category": "Forensic Medicine"
  },
  {
    "file": "Infanticide-Infanticide.json",
    "title": "Infanticide Infanticide",
    "count": 10,
    "category": "Forensic Medicine"
  },
  {
    "file": "Infanticide-Previous_Year_Questions.json",
    "title": "Infanticide Previous Year Questions",
    "count": 1,
    "category": "Forensic Medicine"
  },
  {
    "file": "Injuries_Due_To_Cold__Heat.json",
    "title": "Injuries Due To Cold  Heat",
    "count": 20,
    "category": "Forensic Medicine"
  },
  {
    "file": "Introduction_Legal_Procedure_Law_Forensic_psychiatry.json",
    "title": "Introduction Legal Procedure Law Forensic Psychiatry",
    "count": 40,
    "category": "Forensic Medicine"
  },
  {
    "file": "Introduction_To_Ballistics__Firearms.json",
    "title": "Introduction To Ballistics  Firearms",
    "count": 10,
    "category": "Forensic Medicine"
  },
  {
    "file": "Investigations_Of_Firearms.json",
    "title": "Investigations Of Firearms",
    "count": 4,
    "category": "Forensic Medicine"
  },
  {
    "file": "IPC_Sections-BNS_Sections.json",
    "title": "Ipc Sections Bns Sections",
    "count": 20,
    "category": "Forensic Medicine"
  },
  {
    "file": "Juvenile_Justice_Act_POSCO_Act__HOTA.json",
    "title": "Juvenile Justice Act Posco Act  Hota",
    "count": 1,
    "category": "Forensic Medicine"
  },
  {
    "file": "Lacerations__Incised_Wounds.json",
    "title": "Lacerations  Incised Wounds",
    "count": 8,
    "category": "Forensic Medicine"
  },
  {
    "file": "Late_Night_PYQ_PYT_Marathon_FMT-3_-_2024-12-28.json",
    "title": "Late Night Pyq Pyt Marathon Fmt 3   2024 12 28",
    "count": 60,
    "category": "Forensic Medicine"
  },
  {
    "file": "Legal_Procedures.json",
    "title": "Legal Procedures",
    "count": 33,
    "category": "Forensic Medicine"
  },
  {
    "file": "Lie_Detectors.json",
    "title": "Lie Detectors",
    "count": 5,
    "category": "Forensic Medicine"
  },
  {
    "file": "Ligature_Strangulation__Throttling.json",
    "title": "Ligature Strangulation  Throttling",
    "count": 10,
    "category": "Forensic Medicine"
  },
  {
    "file": "Lightning_Injuries__Scalds.json",
    "title": "Lightning Injuries  Scalds",
    "count": 5,
    "category": "Forensic Medicine"
  },
  {
    "file": "Mechanical_Asphyxia_Torture_Starvation.json",
    "title": "Mechanical Asphyxia Torture Starvation",
    "count": 16,
    "category": "Forensic Medicine"
  },
  {
    "file": "New_Indian_laws.json",
    "title": "New Indian Laws",
    "count": 5,
    "category": "Forensic Medicine"
  },
  {
    "file": "Other_Forms_Of_Asphyxia.json",
    "title": "Other Forms Of Asphyxia",
    "count": 10,
    "category": "Forensic Medicine"
  },
  {
    "file": "Post_Mortem_Hypostasis.json",
    "title": "Post Mortem Hypostasis",
    "count": 10,
    "category": "Forensic Medicine"
  },
  {
    "file": "Post_Mortem_Techniques-Postmortem_autopsy_and_torture.json",
    "title": "Post Mortem Techniques Postmortem Autopsy And Torture",
    "count": 15,
    "category": "Forensic Medicine"
  },
  {
    "file": "Post_Mortem_Techniques-Previous_Year_Questions.json",
    "title": "Post Mortem Techniques Previous Year Questions",
    "count": 7,
    "category": "Forensic Medicine"
  },
  {
    "file": "Professional_Negligence.json",
    "title": "Professional Negligence",
    "count": 12,
    "category": "Forensic Medicine"
  },
  {
    "file": "Professional_Secrecy__Privileged_Communication.json",
    "title": "Professional Secrecy  Privileged Communication",
    "count": 6,
    "category": "Forensic Medicine"
  },
  {
    "file": "Race.json",
    "title": "Race",
    "count": 5,
    "category": "Forensic Medicine"
  },
  {
    "file": "Regional_Injuries_RTA_injuries_Asphyxial_Death.json",
    "title": "Regional Injuries Rta Injuries Asphyxial Death",
    "count": 28,
    "category": "Forensic Medicine"
  },
  {
    "file": "Rifled_Gun__Its_Injuries.json",
    "title": "Rifled Gun  Its Injuries",
    "count": 8,
    "category": "Forensic Medicine"
  },
  {
    "file": "SARPO__FMT.json",
    "title": "Sarpo  Fmt",
    "count": 30,
    "category": "Forensic Medicine"
  },
  {
    "file": "Sex.json",
    "title": "Sex",
    "count": 6,
    "category": "Forensic Medicine"
  },
  {
    "file": "Sexual_Jurisprudence.json",
    "title": "Sexual Jurisprudence",
    "count": 31,
    "category": "Forensic Medicine"
  },
  {
    "file": "Sexual_Jurisprudence-Sexual_Jurisprudence.json",
    "title": "Sexual Jurisprudence Sexual Jurisprudence",
    "count": 21,
    "category": "Forensic Medicine"
  },
  {
    "file": "Sexual_Offences.json",
    "title": "Sexual Offences",
    "count": 29,
    "category": "Forensic Medicine"
  },
  {
    "file": "Sexual_offences.json",
    "title": "Sexual Offences",
    "count": 9,
    "category": "Forensic Medicine"
  },
  {
    "file": "Shotgun__Its_injuries.json",
    "title": "Shotgun  Its Injuries",
    "count": 6,
    "category": "Forensic Medicine"
  },
  {
    "file": "Spinal_Poisons.json",
    "title": "Spinal Poisons",
    "count": 2,
    "category": "Forensic Medicine"
  },
  {
    "file": "Stab_Wounds.json",
    "title": "Stab Wounds",
    "count": 5,
    "category": "Forensic Medicine"
  },
  {
    "file": "Stature.json",
    "title": "Stature",
    "count": 5,
    "category": "Forensic Medicine"
  },
  {
    "file": "Summons.json",
    "title": "Summons",
    "count": 3,
    "category": "Forensic Medicine"
  },
  {
    "file": "SWT-FMT-SET-B.json",
    "title": "Swt Fmt Set B",
    "count": 100,
    "category": "Forensic Medicine"
  },
  {
    "file": "Thermal_Injuries.json",
    "title": "Thermal Injuries",
    "count": 31,
    "category": "Forensic Medicine"
  },
  {
    "file": "Time_Since_Death__Legal_Aspects.json",
    "title": "Time Since Death  Legal Aspects",
    "count": 6,
    "category": "Forensic Medicine"
  },
  {
    "file": "Toxicology.json",
    "title": "Toxicology",
    "count": 155,
    "category": "Forensic Medicine"
  },
  {
    "file": "Traces_of_Evidences-Traces_of_evidence___Sexual_offences.json",
    "title": "Traces Of Evidences Traces Of Evidence   Sexual Offences",
    "count": 24,
    "category": "Forensic Medicine"
  },
  {
    "file": "Unnatural_Sexual_Offences__Perversions.json",
    "title": "Unnatural Sexual Offences  Perversions",
    "count": 12,
    "category": "Forensic Medicine"
  },
  {
    "file": "Vegetable_Poisons.json",
    "title": "Vegetable Poisons",
    "count": 7,
    "category": "Forensic Medicine"
  },
  {
    "file": "Witness.json",
    "title": "Witness",
    "count": 6,
    "category": "Forensic Medicine"
  },
  {
    "file": "ALL_INDIA_DAMS_NEETPG_CBT-1_March_2025.json",
    "title": "All India Dams Neetpg Cbt 1 March 2025",
    "count": 200,
    "category": "Grand Tests"
  },
  {
    "file": "ALL_INDIA_DAMS_NEETPG_CBT-2_May_2025.json",
    "title": "All India Dams Neetpg Cbt 2 May 2025",
    "count": 200,
    "category": "Grand Tests"
  },
  {
    "file": "ALL_INDIA_DAMS_NEETPG_CBT-3_31st_May_2025.json",
    "title": "All India Dams Neetpg Cbt 3 31St May 2025",
    "count": 200,
    "category": "Grand Tests"
  },
  {
    "file": "ALL_INDIA_DAMS_NEETPG_CBT-4_12th_July_2025.json",
    "title": "All India Dams Neetpg Cbt 4 12Th July 2025",
    "count": 200,
    "category": "Grand Tests"
  },
  {
    "file": "ALL_INDIA_DAMS_NEETPG_MOCK_18_TO_21_2025_1.json",
    "title": "All India Dams Neetpg Mock 18 To 21 2025 1",
    "count": 200,
    "category": "Grand Tests"
  },
  {
    "file": "All_India_INI_CET_Grand_Test_01__11th_Oct_2023__OCTOBER_2023____1__.json",
    "title": "All India Ini Cet Grand Test 01  11Th Oct 2023  October 2023    1  ",
    "count": 200,
    "category": "Grand Tests"
  },
  {
    "file": "All_India_INI_CET_Grand_Test_01__12th_Apr_2023__APRIL_2023____1__.json",
    "title": "All India Ini Cet Grand Test 01  12Th Apr 2023  April 2023    1  ",
    "count": 200,
    "category": "Grand Tests"
  },
  {
    "file": "All_India_INI_CET_Grand_Test_02__25th_Oct_2023__OCTOBER_2023____1__.json",
    "title": "All India Ini Cet Grand Test 02  25Th Oct 2023  October 2023    1  ",
    "count": 200,
    "category": "Grand Tests"
  },
  {
    "file": "All_India_INI_CET_Grand_Test_02__26th_Apr_2023__APRIL_2023____1__.json",
    "title": "All India Ini Cet Grand Test 02  26Th Apr 2023  April 2023    1  ",
    "count": 200,
    "category": "Grand Tests"
  },
  {
    "file": "All_India_NEET_PG_Grand_Test__4th_May_2022__MAY_2022____1__.json",
    "title": "All India Neet Pg Grand Test  4Th May 2022  May 2022    1  ",
    "count": 200,
    "category": "Grand Tests"
  },
  {
    "file": "All_India_NEET_PG_Grand_Test_1__8th_Feb_2023__FEBRUARY_2023____1__.json",
    "title": "All India Neet Pg Grand Test 1  8Th Feb 2023  February 2023    1  ",
    "count": 200,
    "category": "Grand Tests"
  },
  {
    "file": "All_India_NEET_PG_Grand_Test_2__22nd_Feb_2023__FEBRUARY_2023____1__.json",
    "title": "All India Neet Pg Grand Test 2  22Nd Feb 2023  February 2023    1  ",
    "count": 200,
    "category": "Grand Tests"
  },
  {
    "file": "BTR_GT-1_-_11-03-2025_-_2025-03-11.json",
    "title": "Btr Gt 1   11 03 2025   2025 03 11",
    "count": 200,
    "category": "Grand Tests"
  },
  {
    "file": "BTR_GT-2_-_14-03-2025_-_2025-03-14.json",
    "title": "Btr Gt 2   14 03 2025   2025 03 14",
    "count": 200,
    "category": "Grand Tests"
  },
  {
    "file": "BTR_GT-3_-_16-03-2025_-_2025-03-16.json",
    "title": "Btr Gt 3   16 03 2025   2025 03 16",
    "count": 200,
    "category": "Grand Tests"
  },
  {
    "file": "BTR_INICET_MOCK_GT_-_2025-05-07.json",
    "title": "Btr Inicet Mock Gt   2025 05 07",
    "count": 200,
    "category": "Grand Tests"
  },
  {
    "file": "BTR_Integrated_Systems_test_60_-_2025-03-26.json",
    "title": "Btr Integrated Systems Test 60   2025 03 26",
    "count": 100,
    "category": "Grand Tests"
  },
  {
    "file": "BTR_Mega_GT_30_-_2024-05-03.json",
    "title": "Btr Mega Gt 30   2024 05 03",
    "count": 200,
    "category": "Grand Tests"
  },
  {
    "file": "BTR_Mega-GT_40_-_29-10-2024_-_2024-10-29.json",
    "title": "Btr Mega Gt 40   29 10 2024   2024 10 29",
    "count": 200,
    "category": "Grand Tests"
  },
  {
    "file": "BTR_Mega-Test_20_-_2024-02-02.json",
    "title": "Btr Mega Test 20   2024 02 02",
    "count": 200,
    "category": "Grand Tests"
  },
  {
    "file": "BTR_NEET_2024_GT-1_-_2024-08-02.json",
    "title": "Btr Neet 2024 Gt 1   2024 08 02",
    "count": 200,
    "category": "Grand Tests"
  },
  {
    "file": "BTR_NEET_2024_GT-2_-_2024-08-05.json",
    "title": "Btr Neet 2024 Gt 2   2024 08 05",
    "count": 200,
    "category": "Grand Tests"
  },
  {
    "file": "BTR_NEET_MOCK_GT-1_-_2025-06-02.json",
    "title": "Btr Neet Mock Gt 1   2025 06 02",
    "count": 200,
    "category": "Grand Tests"
  },
  {
    "file": "BTR_ONLINE_MOCK_GT-1_-_15-07-2025_-_2025-07-15.json",
    "title": "Btr Online Mock Gt 1   15 07 2025   2025 07 15",
    "count": 200,
    "category": "Grand Tests"
  },
  {
    "file": "Cerebel-HUM_Super-30_Grand_Test_-_2023-09-05.json",
    "title": "Cerebel Hum Super 30 Grand Test   2023 09 05",
    "count": 100,
    "category": "Grand Tests"
  },
  {
    "file": "Combo-1_The_Champion_Batch_Hyderabad_-_15-02-2025_-_2025-02-15.json",
    "title": "Combo 1 The Champion Batch Hyderabad   15 02 2025   2025 02 15",
    "count": 200,
    "category": "Grand Tests"
  },
  {
    "file": "Cumulative_Exam_on_8th_Dec_The_Champion_Batch_Hyderabad_-_8-12-2024_-_2024-12-08.json",
    "title": "Cumulative Exam On 8Th Dec The Champion Batch Hyderabad   8 12 2024   2024 12 08",
    "count": 200,
    "category": "Grand Tests"
  },
  {
    "file": "Derma_Radio_Ortho_Anes__Psychi_Combo_The_Champion_Batch_Hyderabad_-_29-03-2025_-_2025-03-29.json",
    "title": "Derma Radio Ortho Anes  Psychi Combo The Champion Batch Hyderabad   29 03 2025   2025 03 29",
    "count": 200,
    "category": "Grand Tests"
  },
  {
    "file": "FMG_Mega-BTR_GT_-_31-12-2024_-_2024-12-31.json",
    "title": "Fmg Mega Btr Gt   31 12 2024   2024 12 31",
    "count": 150,
    "category": "Grand Tests"
  },
  {
    "file": "FMGE_Mock_3_Paper_1.json",
    "title": "Fmge Mock 3 Paper 1",
    "count": 150,
    "category": "Grand Tests"
  },
  {
    "file": "FMGE_Mock_4_Paper_2.json",
    "title": "Fmge Mock 4 Paper 2",
    "count": 150,
    "category": "Grand Tests"
  },
  {
    "file": "FMGE_MOCK_PAPER_-1_JULY_2025.json",
    "title": "Fmge Mock Paper  1 July 2025",
    "count": 150,
    "category": "Grand Tests"
  },
  {
    "file": "FMGE_MOCK_PAPER_-2_JULY_2025.json",
    "title": "Fmge Mock Paper  2 July 2025",
    "count": 150,
    "category": "Grand Tests"
  },
  {
    "file": "Free_Grand_Test_Pattern_of_NEETPG.json",
    "title": "Free Grand Test Pattern Of Neetpg",
    "count": 200,
    "category": "Grand Tests"
  },
  {
    "file": "Free_National_Mock_Test_Based_on_NEETPG_May.json",
    "title": "Free National Mock Test Based On Neetpg May",
    "count": 200,
    "category": "Grand Tests"
  },
  {
    "file": "Free_National_Mock_Test_INICET_November.json",
    "title": "Free National Mock Test Inicet November",
    "count": 200,
    "category": "Grand Tests"
  },
  {
    "file": "Grand_Test_-_152.json",
    "title": "Grand Test   152",
    "count": 300,
    "category": "Grand Tests"
  },
  {
    "file": "Grand_Test_-_153.json",
    "title": "Grand Test   153",
    "count": 300,
    "category": "Grand Tests"
  },
  {
    "file": "Grand_Test_-_154.json",
    "title": "Grand Test   154",
    "count": 300,
    "category": "Grand Tests"
  },
  {
    "file": "Grand_Test_-_155.json",
    "title": "Grand Test   155",
    "count": 300,
    "category": "Grand Tests"
  },
  {
    "file": "Grand_Test_-_156.json",
    "title": "Grand Test   156",
    "count": 299,
    "category": "Grand Tests"
  },
  {
    "file": "Grand_Test_-_157.json",
    "title": "Grand Test   157",
    "count": 300,
    "category": "Grand Tests"
  },
  {
    "file": "Grand_Test_-_158.json",
    "title": "Grand Test   158",
    "count": 300,
    "category": "Grand Tests"
  },
  {
    "file": "Grand_Test_-_159.json",
    "title": "Grand Test   159",
    "count": 300,
    "category": "Grand Tests"
  },
  {
    "file": "Grand_Test_-_160.json",
    "title": "Grand Test   160",
    "count": 300,
    "category": "Grand Tests"
  },
  {
    "file": "Grand_Test_-_161.json",
    "title": "Grand Test   161",
    "count": 300,
    "category": "Grand Tests"
  },
  {
    "file": "Grand_Test_-_162.json",
    "title": "Grand Test   162",
    "count": 300,
    "category": "Grand Tests"
  },
  {
    "file": "Grand_Test_-_163.json",
    "title": "Grand Test   163",
    "count": 300,
    "category": "Grand Tests"
  },
  {
    "file": "Grand_Test_-_164.json",
    "title": "Grand Test   164",
    "count": 300,
    "category": "Grand Tests"
  },
  {
    "file": "Grand_Test_-_165.json",
    "title": "Grand Test   165",
    "count": 300,
    "category": "Grand Tests"
  },
  {
    "file": "Grand_Test_-_166.json",
    "title": "Grand Test   166",
    "count": 300,
    "category": "Grand Tests"
  },
  {
    "file": "Grand_Test_-_167.json",
    "title": "Grand Test   167",
    "count": 300,
    "category": "Grand Tests"
  },
  {
    "file": "Grand_Test_-_168.json",
    "title": "Grand Test   168",
    "count": 300,
    "category": "Grand Tests"
  },
  {
    "file": "Grand_Test_-_169.json",
    "title": "Grand Test   169",
    "count": 300,
    "category": "Grand Tests"
  },
  {
    "file": "Grand_Test_-_171.json",
    "title": "Grand Test   171",
    "count": 300,
    "category": "Grand Tests"
  },
  {
    "file": "Grand_Test_-_172.json",
    "title": "Grand Test   172",
    "count": 299,
    "category": "Grand Tests"
  },
  {
    "file": "Grand_Test_-_173.json",
    "title": "Grand Test   173",
    "count": 300,
    "category": "Grand Tests"
  },
  {
    "file": "Grand_Test_-_174.json",
    "title": "Grand Test   174",
    "count": 300,
    "category": "Grand Tests"
  },
  {
    "file": "Grand_Test_-_175.json",
    "title": "Grand Test   175",
    "count": 300,
    "category": "Grand Tests"
  },
  {
    "file": "Grand_Test_-_176.json",
    "title": "Grand Test   176",
    "count": 300,
    "category": "Grand Tests"
  },
  {
    "file": "Grand_Test_-_177.json",
    "title": "Grand Test   177",
    "count": 300,
    "category": "Grand Tests"
  },
  {
    "file": "Grand_Test_-_178.json",
    "title": "Grand Test   178",
    "count": 300,
    "category": "Grand Tests"
  },
  {
    "file": "Grand_Test-1_Clinical_New_Pattern.json",
    "title": "Grand Test 1 Clinical New Pattern",
    "count": 200,
    "category": "Grand Tests"
  },
  {
    "file": "Grand_Test-10_Clinical_New_Pattern.json",
    "title": "Grand Test 10 Clinical New Pattern",
    "count": 200,
    "category": "Grand Tests"
  },
  {
    "file": "Grand_Test-11_Clinical_New_Pattern.json",
    "title": "Grand Test 11 Clinical New Pattern",
    "count": 200,
    "category": "Grand Tests"
  },
  {
    "file": "Grand_Test-12_Clinical_New_Pattern.json",
    "title": "Grand Test 12 Clinical New Pattern",
    "count": 200,
    "category": "Grand Tests"
  },
  {
    "file": "Grand_Test-13_Clinical_New_Pattern.json",
    "title": "Grand Test 13 Clinical New Pattern",
    "count": 200,
    "category": "Grand Tests"
  },
  {
    "file": "Grand_Test-14_Clinical_New_Pattern.json",
    "title": "Grand Test 14 Clinical New Pattern",
    "count": 200,
    "category": "Grand Tests"
  },
  {
    "file": "Grand_Test-15_Clinical_New_Pattern.json",
    "title": "Grand Test 15 Clinical New Pattern",
    "count": 200,
    "category": "Grand Tests"
  },
  {
    "file": "Grand_Test_150.json",
    "title": "Grand Test 150",
    "count": 300,
    "category": "Grand Tests"
  },
  {
    "file": "Grand_Test_151.json",
    "title": "Grand Test 151",
    "count": 300,
    "category": "Grand Tests"
  },
  {
    "file": "Grand_Test-16_Clinical_New_Pattern.json",
    "title": "Grand Test 16 Clinical New Pattern",
    "count": 200,
    "category": "Grand Tests"
  },
  {
    "file": "Grand_Test-17_Clinical_New_Pattern.json",
    "title": "Grand Test 17 Clinical New Pattern",
    "count": 200,
    "category": "Grand Tests"
  },
  {
    "file": "GRAND_TEST-170.json",
    "title": "Grand Test 170",
    "count": 300,
    "category": "Grand Tests"
  },
  {
    "file": "Grand_Test-179.json",
    "title": "Grand Test 179",
    "count": 300,
    "category": "Grand Tests"
  },
  {
    "file": "Grand_Test-18_Clinical_New_Pattern.json",
    "title": "Grand Test 18 Clinical New Pattern",
    "count": 200,
    "category": "Grand Tests"
  },
  {
    "file": "Grand_Test-19_Clinical_New_Pattern.json",
    "title": "Grand Test 19 Clinical New Pattern",
    "count": 200,
    "category": "Grand Tests"
  },
  {
    "file": "Grand_Test-2_Clinical_New_Pattern.json",
    "title": "Grand Test 2 Clinical New Pattern",
    "count": 200,
    "category": "Grand Tests"
  },
  {
    "file": "Grand_Test-20_Clinical_New_Pattern.json",
    "title": "Grand Test 20 Clinical New Pattern",
    "count": 200,
    "category": "Grand Tests"
  },
  {
    "file": "Grand_Test-21_Clinical_New_Pattern.json",
    "title": "Grand Test 21 Clinical New Pattern",
    "count": 200,
    "category": "Grand Tests"
  },
  {
    "file": "Grand_Test-22_Clinical_New_Pattern.json",
    "title": "Grand Test 22 Clinical New Pattern",
    "count": 200,
    "category": "Grand Tests"
  },
  {
    "file": "Grand_Test-23_Clinical_New_Pattern.json",
    "title": "Grand Test 23 Clinical New Pattern",
    "count": 200,
    "category": "Grand Tests"
  },
  {
    "file": "Grand_Test-25_Clinical_New_Pattern.json",
    "title": "Grand Test 25 Clinical New Pattern",
    "count": 200,
    "category": "Grand Tests"
  },
  {
    "file": "Grand_Test-26.json",
    "title": "Grand Test 26",
    "count": 200,
    "category": "Grand Tests"
  },
  {
    "file": "Grand_Test-27.json",
    "title": "Grand Test 27",
    "count": 200,
    "category": "Grand Tests"
  },
  {
    "file": "Grand_Test-28.json",
    "title": "Grand Test 28",
    "count": 200,
    "category": "Grand Tests"
  },
  {
    "file": "Grand_Test-29.json",
    "title": "Grand Test 29",
    "count": 200,
    "category": "Grand Tests"
  },
  {
    "file": "Grand_Test-3_Clinical_New_Pattern.json",
    "title": "Grand Test 3 Clinical New Pattern",
    "count": 200,
    "category": "Grand Tests"
  },
  {
    "file": "Grand_Test-30.json",
    "title": "Grand Test 30",
    "count": 200,
    "category": "Grand Tests"
  },
  {
    "file": "Grand_Test-31.json",
    "title": "Grand Test 31",
    "count": 200,
    "category": "Grand Tests"
  },
  {
    "file": "Grand_Test-32.json",
    "title": "Grand Test 32",
    "count": 200,
    "category": "Grand Tests"
  },
  {
    "file": "Grand_Test-33.json",
    "title": "Grand Test 33",
    "count": 200,
    "category": "Grand Tests"
  },
  {
    "file": "Grand_Test-34.json",
    "title": "Grand Test 34",
    "count": 200,
    "category": "Grand Tests"
  },
  {
    "file": "Grand_Test-35.json",
    "title": "Grand Test 35",
    "count": 200,
    "category": "Grand Tests"
  },
  {
    "file": "Grand_Test-36.json",
    "title": "Grand Test 36",
    "count": 200,
    "category": "Grand Tests"
  },
  {
    "file": "Grand_Test-37.json",
    "title": "Grand Test 37",
    "count": 200,
    "category": "Grand Tests"
  },
  {
    "file": "Grand_Test-38.json",
    "title": "Grand Test 38",
    "count": 200,
    "category": "Grand Tests"
  },
  {
    "file": "Grand_Test-39_5_Sections.json",
    "title": "Grand Test 39 5 Sections",
    "count": 200,
    "category": "Grand Tests"
  },
  {
    "file": "Grand_Test-4_Clinical_New_Pattern.json",
    "title": "Grand Test 4 Clinical New Pattern",
    "count": 200,
    "category": "Grand Tests"
  },
  {
    "file": "Grand_Test-40_5_Sections.json",
    "title": "Grand Test 40 5 Sections",
    "count": 200,
    "category": "Grand Tests"
  },
  {
    "file": "Grand_Test-41_5_Sections.json",
    "title": "Grand Test 41 5 Sections",
    "count": 200,
    "category": "Grand Tests"
  },
  {
    "file": "Grand_Test-42_5_Sections.json",
    "title": "Grand Test 42 5 Sections",
    "count": 200,
    "category": "Grand Tests"
  },
  {
    "file": "Grand_Test-43_5_Sections.json",
    "title": "Grand Test 43 5 Sections",
    "count": 200,
    "category": "Grand Tests"
  },
  {
    "file": "Grand_Test-44_5_Sections.json",
    "title": "Grand Test 44 5 Sections",
    "count": 200,
    "category": "Grand Tests"
  },
  {
    "file": "Grand_Test-45_5_Sections.json",
    "title": "Grand Test 45 5 Sections",
    "count": 200,
    "category": "Grand Tests"
  },
  {
    "file": "Grand_Test-46_5_Sections.json",
    "title": "Grand Test 46 5 Sections",
    "count": 200,
    "category": "Grand Tests"
  },
  {
    "file": "Grand_Test-47_5_Sections.json",
    "title": "Grand Test 47 5 Sections",
    "count": 200,
    "category": "Grand Tests"
  },
  {
    "file": "Grand_Test-48_5_Sections.json",
    "title": "Grand Test 48 5 Sections",
    "count": 200,
    "category": "Grand Tests"
  },
  {
    "file": "Grand_Test-49_5_Sections.json",
    "title": "Grand Test 49 5 Sections",
    "count": 200,
    "category": "Grand Tests"
  },
  {
    "file": "Grand_Test-5_Clinical_New_Pattern.json",
    "title": "Grand Test 5 Clinical New Pattern",
    "count": 200,
    "category": "Grand Tests"
  },
  {
    "file": "Grand_Test-50_5_Sections.json",
    "title": "Grand Test 50 5 Sections",
    "count": 200,
    "category": "Grand Tests"
  },
  {
    "file": "Grand_Test-51_5_Sections.json",
    "title": "Grand Test 51 5 Sections",
    "count": 200,
    "category": "Grand Tests"
  },
  {
    "file": "Grand_Test-6_Clinical_New_Pattern.json",
    "title": "Grand Test 6 Clinical New Pattern",
    "count": 200,
    "category": "Grand Tests"
  },
  {
    "file": "Grand_Test-7_Clinical_New_Pattern.json",
    "title": "Grand Test 7 Clinical New Pattern",
    "count": 200,
    "category": "Grand Tests"
  },
  {
    "file": "Grand_Test-8_Clinical_New_Pattern.json",
    "title": "Grand Test 8 Clinical New Pattern",
    "count": 200,
    "category": "Grand Tests"
  },
  {
    "file": "Grand_Test-9_Clinical_New_Pattern.json",
    "title": "Grand Test 9 Clinical New Pattern",
    "count": 200,
    "category": "Grand Tests"
  },
  {
    "file": "INI_CET_Grand_Test_01__14th_Jun_2023__JUNE_2023____1__.json",
    "title": "Ini Cet Grand Test 01  14Th Jun 2023  June 2023    1  ",
    "count": 200,
    "category": "Grand Tests"
  },
  {
    "file": "INI_CET_Grand_Test_01__28th_Apr_2021__APRIL_2021____1__.json",
    "title": "Ini Cet Grand Test 01  28Th Apr 2021  April 2021    1  ",
    "count": 200,
    "category": "Grand Tests"
  },
  {
    "file": "INI_CET_Grand_Test_02__16th_Aug_2023__AUGUST_2023____1__.json",
    "title": "Ini Cet Grand Test 02  16Th Aug 2023  August 2023    1  ",
    "count": 200,
    "category": "Grand Tests"
  },
  {
    "file": "INI_CET_Grand_Test_02__26th_May_2021__MAY_2021____1__.json",
    "title": "Ini Cet Grand Test 02  26Th May 2021  May 2021    1  ",
    "count": 200,
    "category": "Grand Tests"
  },
  {
    "file": "INI_CET_Grand_Test_03__9th_Jun_2021__JUNE_2021____1__.json",
    "title": "Ini Cet Grand Test 03  9Th Jun 2021  June 2021    1  ",
    "count": 200,
    "category": "Grand Tests"
  },
  {
    "file": "INI_CET_Grand_Test_04__16th_Jul_2021__JULY_2021____1__.json",
    "title": "Ini Cet Grand Test 04  16Th Jul 2021  July 2021    1  ",
    "count": 200,
    "category": "Grand Tests"
  },
  {
    "file": "INI_CET_Grand_Test_05__18th_Aug_2021__AUGUST_2021____0__.json",
    "title": "Ini Cet Grand Test 05  18Th Aug 2021  August 2021    0  ",
    "count": 200,
    "category": "Grand Tests"
  },
  {
    "file": "INI_CET_Grand_Test_06__15th_Sep_2021__SEPTEMBER_2021____1__.json",
    "title": "Ini Cet Grand Test 06  15Th Sep 2021  September 2021    1  ",
    "count": 200,
    "category": "Grand Tests"
  },
  {
    "file": "INI_CET_Grand_Test_07__6th_Oct_2021__OCTOBER_2021____1__.json",
    "title": "Ini Cet Grand Test 07  6Th Oct 2021  October 2021    1  ",
    "count": 200,
    "category": "Grand Tests"
  },
  {
    "file": "INI_CET_Grand_Test_08__13th_Oct_2021__OCTOBER_2021____0__.json",
    "title": "Ini Cet Grand Test 08  13Th Oct 2021  October 2021    0  ",
    "count": 200,
    "category": "Grand Tests"
  },
  {
    "file": "INI_CET_Grand_Test_09__20th_Oct_2021__OCTOBER_2021____0__.json",
    "title": "Ini Cet Grand Test 09  20Th Oct 2021  October 2021    0  ",
    "count": 200,
    "category": "Grand Tests"
  },
  {
    "file": "INI_CET_Grand_Test_1__20th_Mar_2024__MARCH_2024____0__.json",
    "title": "Ini Cet Grand Test 1  20Th Mar 2024  March 2024    0  ",
    "count": 200,
    "category": "Grand Tests"
  },
  {
    "file": "INI_CET_Grand_Test_10__27th_Oct_2021__OCTOBER_2021____1__.json",
    "title": "Ini Cet Grand Test 10  27Th Oct 2021  October 2021    1  ",
    "count": 200,
    "category": "Grand Tests"
  },
  {
    "file": "INI_CET_Grand_Test_11__10th_Nov_2021__NOVEMBER_2021____0__.json",
    "title": "Ini Cet Grand Test 11  10Th Nov 2021  November 2021    0  ",
    "count": 200,
    "category": "Grand Tests"
  },
  {
    "file": "INI_CET_Grand_Test_12__22nd_Dec_2021__DECEMBER_2021____0__.json",
    "title": "Ini Cet Grand Test 12  22Nd Dec 2021  December 2021    0  ",
    "count": 200,
    "category": "Grand Tests"
  },
  {
    "file": "INI_CET_Grand_Test_13__5th_Jan_2022__JANUARY_2022____0__.json",
    "title": "Ini Cet Grand Test 13  5Th Jan 2022  January 2022    0  ",
    "count": 200,
    "category": "Grand Tests"
  },
  {
    "file": "INI_CET_Grand_Test_14__9th_Mar_2022__MARCH_2022____0__.json",
    "title": "Ini Cet Grand Test 14  9Th Mar 2022  March 2022    0  ",
    "count": 200,
    "category": "Grand Tests"
  },
  {
    "file": "INI_CET_Grand_Test_15__22nd_Jun_2022__JUNE_2022____1__.json",
    "title": "Ini Cet Grand Test 15  22Nd Jun 2022  June 2022    1  ",
    "count": 200,
    "category": "Grand Tests"
  },
  {
    "file": "INI_CET_Grand_Test_16__27th_Jul_2022__JULY_2022____1__.json",
    "title": "Ini Cet Grand Test 16  27Th Jul 2022  July 2022    1  ",
    "count": 200,
    "category": "Grand Tests"
  },
  {
    "file": "INI_CET_Grand_Test_17__24th_Aug_2022__AUGUST_2022____1__.json",
    "title": "Ini Cet Grand Test 17  24Th Aug 2022  August 2022    1  ",
    "count": 200,
    "category": "Grand Tests"
  },
  {
    "file": "INI_CET_Grand_Test_18__28th_Sep_2022__SEPTEMBER_2022____1__.json",
    "title": "Ini Cet Grand Test 18  28Th Sep 2022  September 2022    1  ",
    "count": 200,
    "category": "Grand Tests"
  },
  {
    "file": "INI_CET_Grand_Test_19__26th_Oct_2022__OCTOBER_2022____1__.json",
    "title": "Ini Cet Grand Test 19  26Th Oct 2022  October 2022    1  ",
    "count": 200,
    "category": "Grand Tests"
  },
  {
    "file": "INI_CET_Grand_Test_20__23rd_Nov_2022__NOVEMBER_2022____1__.json",
    "title": "Ini Cet Grand Test 20  23Rd Nov 2022  November 2022    1  ",
    "count": 200,
    "category": "Grand Tests"
  },
  {
    "file": "INI_CET_Grand_Test_21__25th_Jan_2023__JANUARY_2023____0__.json",
    "title": "Ini Cet Grand Test 21  25Th Jan 2023  January 2023    0  ",
    "count": 200,
    "category": "Grand Tests"
  },
  {
    "file": "INI_CET_Grand_Test_22__29th_Mar_2023__MARCH_2023____1__.json",
    "title": "Ini Cet Grand Test 22  29Th Mar 2023  March 2023    1  ",
    "count": 200,
    "category": "Grand Tests"
  },
  {
    "file": "INICET_Grand_Test_-_1_-_2023-04-16.json",
    "title": "Inicet Grand Test   1   2023 04 16",
    "count": 200,
    "category": "Grand Tests"
  },
  {
    "file": "INICET_Grand_Test_-_2_-_2023-04-30.json",
    "title": "Inicet Grand Test   2   2023 04 30",
    "count": 200,
    "category": "Grand Tests"
  },
  {
    "file": "INICET_Grand_Test_-_3_-_2023-10-26.json",
    "title": "Inicet Grand Test   3   2023 10 26",
    "count": 200,
    "category": "Grand Tests"
  },
  {
    "file": "INICET_Grand_Test_04__26th_Feb_2025__FEBRUARY_2025____0__.json",
    "title": "Inicet Grand Test 04  26Th Feb 2025  February 2025    0  ",
    "count": 200,
    "category": "Grand Tests"
  },
  {
    "file": "INICET_Grand_Test_2__16th_Aug_2024__AUGUST_2024____0__.json",
    "title": "Inicet Grand Test 2  16Th Aug 2024  August 2024    0  ",
    "count": 200,
    "category": "Grand Tests"
  },
  {
    "file": "INICET_Grand_Test_3__18th_Dec_2024__DECEMBER_2024____0__.json",
    "title": "Inicet Grand Test 3  18Th Dec 2024  December 2024    0  ",
    "count": 200,
    "category": "Grand Tests"
  },
  {
    "file": "INICET_Mock_10_4_Sections.json",
    "title": "Inicet Mock 10 4 Sections",
    "count": 200,
    "category": "Grand Tests"
  },
  {
    "file": "INICET_Mock_11_4_Sections.json",
    "title": "Inicet Mock 11 4 Sections",
    "count": 200,
    "category": "Grand Tests"
  },
  {
    "file": "INICET_Mock_2.json",
    "title": "Inicet Mock 2",
    "count": 209,
    "category": "Grand Tests"
  },
  {
    "file": "INICET_Mock_3.json",
    "title": "Inicet Mock 3",
    "count": 202,
    "category": "Grand Tests"
  },
  {
    "file": "INICET_Mock_4.json",
    "title": "Inicet Mock 4",
    "count": 200,
    "category": "Grand Tests"
  },
  {
    "file": "INICET_MOCK_5_4_Sections.json",
    "title": "Inicet Mock 5 4 Sections",
    "count": 200,
    "category": "Grand Tests"
  },
  {
    "file": "INICET_MOCK_6_4_Sections.json",
    "title": "Inicet Mock 6 4 Sections",
    "count": 200,
    "category": "Grand Tests"
  },
  {
    "file": "INICET_Mock_7_4_Sections.json",
    "title": "Inicet Mock 7 4 Sections",
    "count": 200,
    "category": "Grand Tests"
  },
  {
    "file": "INICET_Mock_9_4_Sections.json",
    "title": "Inicet Mock 9 4 Sections",
    "count": 200,
    "category": "Grand Tests"
  },
  {
    "file": "INICET_MOCK_Test-2_-_03-05-2025_-_2025-05-03.json",
    "title": "Inicet Mock Test 2   03 05 2025   2025 05 03",
    "count": 200,
    "category": "Grand Tests"
  },
  {
    "file": "Mission_NEET_PG-INICET_Grand_Test-15_-_16-06-2024_-_2024-06-16.json",
    "title": "Mission Neet Pg Inicet Grand Test 15   16 06 2024   2024 06 16",
    "count": 200,
    "category": "Grand Tests"
  },
  {
    "file": "Mission_NEET_PG-INICET_Grand_Test-16_-_03-07-2024_-_2024-07-03.json",
    "title": "Mission Neet Pg Inicet Grand Test 16   03 07 2024   2024 07 03",
    "count": 200,
    "category": "Grand Tests"
  },
  {
    "file": "Mission_NEET_PG-INICET_Grand_Test-17-_29-09-2024_-_2024-09-29.json",
    "title": "Mission Neet Pg Inicet Grand Test 17  29 09 2024   2024 09 29",
    "count": 200,
    "category": "Grand Tests"
  },
  {
    "file": "Mission_NEET_PG-INICET_Grand_Test-18_-_20-11-2024_-_2024-11-20.json",
    "title": "Mission Neet Pg Inicet Grand Test 18   20 11 2024   2024 11 20",
    "count": 200,
    "category": "Grand Tests"
  },
  {
    "file": "Mission_NEET_PG-INICET_Grand_Test-19_-_16-12-2024_-_2024-12-16.json",
    "title": "Mission Neet Pg Inicet Grand Test 19   16 12 2024   2024 12 16",
    "count": 200,
    "category": "Grand Tests"
  },
  {
    "file": "Mission_NEET_PG-INICET_Grand_Test-20_-_29-12-2024_-_2024-12-29.json",
    "title": "Mission Neet Pg Inicet Grand Test 20   29 12 2024   2024 12 29",
    "count": 200,
    "category": "Grand Tests"
  },
  {
    "file": "Mission_NEET_PG-INICET_Grand_Test-21_-_13-01-2025_-_2025-01-13.json",
    "title": "Mission Neet Pg Inicet Grand Test 21   13 01 2025   2025 01 13",
    "count": 200,
    "category": "Grand Tests"
  },
  {
    "file": "Mission_NEET_PG-INICET_Grand_Test-22_-_31-01-2025_-_2025-01-31.json",
    "title": "Mission Neet Pg Inicet Grand Test 22   31 01 2025   2025 01 31",
    "count": 200,
    "category": "Grand Tests"
  },
  {
    "file": "Mission_NEET_PG-INICET_Grand_Test-23_-_14-02-2025_-_2025-02-14.json",
    "title": "Mission Neet Pg Inicet Grand Test 23   14 02 2025   2025 02 14",
    "count": 200,
    "category": "Grand Tests"
  },
  {
    "file": "Mission_NEET_PG-INICET_Grand_Test-24_-_28-02-2025_-_2025-02-28.json",
    "title": "Mission Neet Pg Inicet Grand Test 24   28 02 2025   2025 02 28",
    "count": 200,
    "category": "Grand Tests"
  },
  {
    "file": "Mission_NEET_PG-INICET_Grand_Test-25_-_10-03-2025_-_2025-03-10.json",
    "title": "Mission Neet Pg Inicet Grand Test 25   10 03 2025   2025 03 10",
    "count": 200,
    "category": "Grand Tests"
  },
  {
    "file": "Mission_NEET_PG-INICET_Grand_Test-26_-_29-03-2025_-_2025-03-29.json",
    "title": "Mission Neet Pg Inicet Grand Test 26   29 03 2025   2025 03 29",
    "count": 200,
    "category": "Grand Tests"
  },
  {
    "file": "Mission_NEET_PG-INICET_Grand_Test-27_-_18-04-2025_-_2025-04-18.json",
    "title": "Mission Neet Pg Inicet Grand Test 27   18 04 2025   2025 04 18",
    "count": 200,
    "category": "Grand Tests"
  },
  {
    "file": "Mission_NEETPG_INICET_GT_-_1_-_2023-06-25.json",
    "title": "Mission Neetpg Inicet Gt   1   2023 06 25",
    "count": 200,
    "category": "Grand Tests"
  },
  {
    "file": "Mission_NEETPG_INICET_GT_-_10_-_2024-02-19.json",
    "title": "Mission Neetpg Inicet Gt   10   2024 02 19",
    "count": 200,
    "category": "Grand Tests"
  },
  {
    "file": "Mission_NEETPG_INICET_GT_-_11_-_2024-03-03.json",
    "title": "Mission Neetpg Inicet Gt   11   2024 03 03",
    "count": 200,
    "category": "Grand Tests"
  },
  {
    "file": "Mission_NEETPG_INICET_GT_-_12_-_2024-03-17.json",
    "title": "Mission Neetpg Inicet Gt   12   2024 03 17",
    "count": 200,
    "category": "Grand Tests"
  },
  {
    "file": "Mission_NEETPG_INICET_GT_-_13_-_2024-04-08.json",
    "title": "Mission Neetpg Inicet Gt   13   2024 04 08",
    "count": 200,
    "category": "Grand Tests"
  },
  {
    "file": "Mission_NEETPG_INICET_GT_-_14_-_2024-05-05.json",
    "title": "Mission Neetpg Inicet Gt   14   2024 05 05",
    "count": 200,
    "category": "Grand Tests"
  },
  {
    "file": "Mission_NEETPG_INICET_GT_-_15_-_2024-05-27.json",
    "title": "Mission Neetpg Inicet Gt   15   2024 05 27",
    "count": 200,
    "category": "Grand Tests"
  },
  {
    "file": "Mission_NEETPG_INICET_GT_-_2_-_2023-08-06.json",
    "title": "Mission Neetpg Inicet Gt   2   2023 08 06",
    "count": 200,
    "category": "Grand Tests"
  },
  {
    "file": "Mission_NEETPG_INICET_GT_-_3_-_2023-09-03.json",
    "title": "Mission Neetpg Inicet Gt   3   2023 09 03",
    "count": 200,
    "category": "Grand Tests"
  },
  {
    "file": "Mission_NEETPG_INICET_GT_-_4_-_2023-10-08.json",
    "title": "Mission Neetpg Inicet Gt   4   2023 10 08",
    "count": 200,
    "category": "Grand Tests"
  },
  {
    "file": "Mission_NEETPG_INICET_GT_-_5_-_2023-12-01.json",
    "title": "Mission Neetpg Inicet Gt   5   2023 12 01",
    "count": 200,
    "category": "Grand Tests"
  },
  {
    "file": "Mission_NEETPG_INICET_GT_-_6_-_2023-12-18.json",
    "title": "Mission Neetpg Inicet Gt   6   2023 12 18",
    "count": 200,
    "category": "Grand Tests"
  },
  {
    "file": "Mission_NEETPG_INICET_GT_-_7_-_2024-01-05.json",
    "title": "Mission Neetpg Inicet Gt   7   2024 01 05",
    "count": 200,
    "category": "Grand Tests"
  },
  {
    "file": "Mission_NEETPG_INICET_GT_-_8_-_2024-01-21.json",
    "title": "Mission Neetpg Inicet Gt   8   2024 01 21",
    "count": 200,
    "category": "Grand Tests"
  },
  {
    "file": "Mission_NEETPG_INICET_GT_-_9_-_2024-02-04.json",
    "title": "Mission Neetpg Inicet Gt   9   2024 02 04",
    "count": 200,
    "category": "Grand Tests"
  },
  {
    "file": "NEET_PG_Grand_Test_01__10th_May_2023__MAY_2023____1__.json",
    "title": "Neet Pg Grand Test 01  10Th May 2023  May 2023    1  ",
    "count": 200,
    "category": "Grand Tests"
  },
  {
    "file": "NEET_PG_Grand_Test_01__24th_Mar_2021__MARCH_2021____1__.json",
    "title": "Neet Pg Grand Test 01  24Th Mar 2021  March 2021    1  ",
    "count": 200,
    "category": "Grand Tests"
  },
  {
    "file": "NEET_PG_Grand_Test_01__8th_Jun_2022__JUNE_2022____0__.json",
    "title": "Neet Pg Grand Test 01  8Th Jun 2022  June 2022    0  ",
    "count": 200,
    "category": "Grand Tests"
  },
  {
    "file": "NEET_PG_Grand_Test_02__19th_Jul_2023__JULY_2023____1__.json",
    "title": "Neet Pg Grand Test 02  19Th Jul 2023  July 2023    1  ",
    "count": 200,
    "category": "Grand Tests"
  },
  {
    "file": "NEET_PG_Grand_Test_02__7th_Apr_2021__APRIL_2021____0__.json",
    "title": "Neet Pg Grand Test 02  7Th Apr 2021  April 2021    0  ",
    "count": 200,
    "category": "Grand Tests"
  },
  {
    "file": "NEET_PG_Grand_Test_03__10th_Aug_2022__AUGUST_2022____0__.json",
    "title": "Neet Pg Grand Test 03  10Th Aug 2022  August 2022    0  ",
    "count": 200,
    "category": "Grand Tests"
  },
  {
    "file": "NEET_PG_Grand_Test_03__20th_Sep_2023__SEPTEMBER_2023____1__.json",
    "title": "Neet Pg Grand Test 03  20Th Sep 2023  September 2023    1  ",
    "count": 200,
    "category": "Grand Tests"
  },
  {
    "file": "NEET_PG_Grand_Test_03__23rd_Apr_2021__APRIL_2021____1__.json",
    "title": "Neet Pg Grand Test 03  23Rd Apr 2021  April 2021    1  ",
    "count": 200,
    "category": "Grand Tests"
  },
  {
    "file": "NEET_PG_Grand_Test_04__14th_Sep_2022__SEPTEMBER_2022____0__.json",
    "title": "Neet Pg Grand Test 04  14Th Sep 2022  September 2022    0  ",
    "count": 200,
    "category": "Grand Tests"
  },
  {
    "file": "NEET_PG_Grand_Test_04__22nd_Nov_2023__NOVEMBER_2023____1__.json",
    "title": "Neet Pg Grand Test 04  22Nd Nov 2023  November 2023    1  ",
    "count": 200,
    "category": "Grand Tests"
  },
  {
    "file": "NEET_PG_Grand_Test_04__7th_May_2021__MAY_2021____1__.json",
    "title": "Neet Pg Grand Test 04  7Th May 2021  May 2021    1  ",
    "count": 200,
    "category": "Grand Tests"
  },
  {
    "file": "NEET_PG_Grand_Test_05__12th_May_2021__MAY_2021____1__.json",
    "title": "Neet Pg Grand Test 05  12Th May 2021  May 2021    1  ",
    "count": 200,
    "category": "Grand Tests"
  },
  {
    "file": "NEET_PG_Grand_Test_05__12th_Oct_2022__OCTOBER_2022____0__.json",
    "title": "Neet Pg Grand Test 05  12Th Oct 2022  October 2022    0  ",
    "count": 200,
    "category": "Grand Tests"
  },
  {
    "file": "NEET_PG_Grand_Test_05__15th_Jan_2025__JANUARY_2025____0__.json",
    "title": "Neet Pg Grand Test 05  15Th Jan 2025  January 2025    0  ",
    "count": 200,
    "category": "Grand Tests"
  },
  {
    "file": "NEET_PG_Grand_Test_05__20th_Dec_2023__DECEMBER_2023____1__.json",
    "title": "Neet Pg Grand Test 05  20Th Dec 2023  December 2023    1  ",
    "count": 200,
    "category": "Grand Tests"
  },
  {
    "file": "NEET_PG_Grand_Test_06__20th_Mar_2025__MARCH_2025____0__.json",
    "title": "Neet Pg Grand Test 06  20Th Mar 2025  March 2025    0  ",
    "count": 200,
    "category": "Grand Tests"
  },
  {
    "file": "NEET_PG_Grand_Test_06__21st_May_2021__MAY_2021____1__.json",
    "title": "Neet Pg Grand Test 06  21St May 2021  May 2021    1  ",
    "count": 197,
    "category": "Grand Tests"
  },
  {
    "file": "NEET_PG_Grand_Test_06__9th_Nov_2022__NOVEMBER_2022____0__.json",
    "title": "Neet Pg Grand Test 06  9Th Nov 2022  November 2022    0  ",
    "count": 200,
    "category": "Grand Tests"
  },
  {
    "file": "NEET_PG_Grand_Test_07__14th_Jul_2022__JULY_2022____0__.json",
    "title": "Neet Pg Grand Test 07  14Th Jul 2022  July 2022    0  ",
    "count": 200,
    "category": "Grand Tests"
  },
  {
    "file": "NEET_PG_Grand_Test_07__7th_Jul_2021__JULY_2021____0__.json",
    "title": "Neet Pg Grand Test 07  7Th Jul 2021  July 2021    0  ",
    "count": 200,
    "category": "Grand Tests"
  },
  {
    "file": "NEET_PG_Grand_Test_08__21st_Jul_2021__JULY_2021____0__.json",
    "title": "Neet Pg Grand Test 08  21St Jul 2021  July 2021    0  ",
    "count": 200,
    "category": "Grand Tests"
  },
  {
    "file": "NEET_PG_Grand_Test_08__28th_Dec_2022__DECEMBER_2022____0__.json",
    "title": "Neet Pg Grand Test 08  28Th Dec 2022  December 2022    0  ",
    "count": 200,
    "category": "Grand Tests"
  },
  {
    "file": "NEET_PG_Grand_Test_09__11th_Jan_2023__JANUARY_2023____0__.json",
    "title": "Neet Pg Grand Test 09  11Th Jan 2023  January 2023    0  ",
    "count": 200,
    "category": "Grand Tests"
  },
  {
    "file": "NEET_PG_Grand_Test_09__4th_Aug_2021__AUGUST_2021____0__.json",
    "title": "Neet Pg Grand Test 09  4Th Aug 2021  August 2021    0  ",
    "count": 200,
    "category": "Grand Tests"
  },
  {
    "file": "NEET_PG_Grand_Test_1__24th_Jan_2024__JANUARY_2024____0__.json",
    "title": "Neet Pg Grand Test 1  24Th Jan 2024  January 2024    0  ",
    "count": 100,
    "category": "Grand Tests"
  },
  {
    "file": "NEET_PG_Grand_Test_10__1st_Sep_2021__SEPTEMBER_2021____1__.json",
    "title": "Neet Pg Grand Test 10  1St Sep 2021  September 2021    1  ",
    "count": 200,
    "category": "Grand Tests"
  },
  {
    "file": "NEET_PG_Grand_Test_11__29th_Sep_2021__SEPTEMBER_2021____1__.json",
    "title": "Neet Pg Grand Test 11  29Th Sep 2021  September 2021    1  ",
    "count": 200,
    "category": "Grand Tests"
  },
  {
    "file": "NEET_PG_Grand_Test_12__24th_Nov_2021__NOVEMBER_2021____1__.json",
    "title": "Neet Pg Grand Test 12  24Th Nov 2021  November 2021    1  ",
    "count": 200,
    "category": "Grand Tests"
  },
  {
    "file": "NEET_PG_Grand_Test_13__8th_Dec_2021__DECEMBER_2021____0__.json",
    "title": "Neet Pg Grand Test 13  8Th Dec 2021  December 2021    0  ",
    "count": 200,
    "category": "Grand Tests"
  },
  {
    "file": "NEET_PG_Grand_Test_14__19th_Jan_2022__JANUARY_2022____0__.json",
    "title": "Neet Pg Grand Test 14  19Th Jan 2022  January 2022    0  ",
    "count": 200,
    "category": "Grand Tests"
  },
  {
    "file": "NEET_PG_Grand_Test_15__9th_Feb_2022__FEBRUARY_2022____0__.json",
    "title": "Neet Pg Grand Test 15  9Th Feb 2022  February 2022    0  ",
    "count": 200,
    "category": "Grand Tests"
  },
  {
    "file": "NEET_PG_Grand_Test_16__23rd_Feb_2022__FEBRUARY_2022____0__.json",
    "title": "Neet Pg Grand Test 16  23Rd Feb 2022  February 2022    0  ",
    "count": 200,
    "category": "Grand Tests"
  },
  {
    "file": "NEET_PG_Grand_Test_17__23rd_Mar_2022__MARCH_2022____0__.json",
    "title": "Neet Pg Grand Test 17  23Rd Mar 2022  March 2022    0  ",
    "count": 200,
    "category": "Grand Tests"
  },
  {
    "file": "NEET_PG_Grand_Test_18__13th_Apr_2022__APRIL_2022____0__.json",
    "title": "Neet Pg Grand Test 18  13Th Apr 2022  April 2022    0  ",
    "count": 200,
    "category": "Grand Tests"
  },
  {
    "file": "NEET_PG_Grand_Test_19__27th_Apr_2022__APRIL_2022____1__.json",
    "title": "Neet Pg Grand Test 19  27Th Apr 2022  April 2022    1  ",
    "count": 200,
    "category": "Grand Tests"
  },
  {
    "file": "NEET_PG_Grand_Test_2__13th_Jul_2022__JULY_2022____0__.json",
    "title": "Neet Pg Grand Test 2  13Th Jul 2022  July 2022    0  ",
    "count": 200,
    "category": "Grand Tests"
  },
  {
    "file": "NEET_PG_Grand_Test_2__14th_Feb_2024__FEBRUARY_2024____0__.json",
    "title": "Neet Pg Grand Test 2  14Th Feb 2024  February 2024    0  ",
    "count": 200,
    "category": "Grand Tests"
  },
  {
    "file": "NEET_PG_Grand_Test_4__13th_Nov_2024__NOVEMBER_2024____0__.json",
    "title": "Neet Pg Grand Test 4  13Th Nov 2024  November 2024    0  ",
    "count": 200,
    "category": "Grand Tests"
  },
  {
    "file": "NEET_PG_INI-CET_BASELINE_GRAND_TEST_-_31-08-2024_-_2024-08-31.json",
    "title": "Neet Pg Ini Cet Baseline Grand Test   31 08 2024   2024 08 31",
    "count": 200,
    "category": "Grand Tests"
  },
  {
    "file": "NEET_PG_Mock_1_5_Sections.json",
    "title": "Neet Pg Mock 1 5 Sections",
    "count": 199,
    "category": "Grand Tests"
  },
  {
    "file": "NEET_PG_Mock_1_5_Sections_1.json",
    "title": "Neet Pg Mock 1 5 Sections 1",
    "count": 199,
    "category": "Grand Tests"
  },
  {
    "file": "NEET_PG_Mock_1_Based_On_Clinical_Pattern.json",
    "title": "Neet Pg Mock 1 Based On Clinical Pattern",
    "count": 200,
    "category": "Grand Tests"
  },
  {
    "file": "NEET_PG_Mock_10_5_Section.json",
    "title": "Neet Pg Mock 10 5 Section",
    "count": 200,
    "category": "Grand Tests"
  },
  {
    "file": "NEET_PG_Mock_2_5_Sections.json",
    "title": "Neet Pg Mock 2 5 Sections",
    "count": 200,
    "category": "Grand Tests"
  },
  {
    "file": "NEET_PG_Mock_2_Based_On_Clinical_Pattern.json",
    "title": "Neet Pg Mock 2 Based On Clinical Pattern",
    "count": 200,
    "category": "Grand Tests"
  },
  {
    "file": "NEET_PG_Mock_3_5_Sections.json",
    "title": "Neet Pg Mock 3 5 Sections",
    "count": 200,
    "category": "Grand Tests"
  },
  {
    "file": "NEET_PG_Mock_4_5_Sections.json",
    "title": "Neet Pg Mock 4 5 Sections",
    "count": 200,
    "category": "Grand Tests"
  },
  {
    "file": "NEET_PG_Mock_4_5_Sections_1.json",
    "title": "Neet Pg Mock 4 5 Sections 1",
    "count": 200,
    "category": "Grand Tests"
  },
  {
    "file": "NEET_PG_Mock_5_5_Sections.json",
    "title": "Neet Pg Mock 5 5 Sections",
    "count": 200,
    "category": "Grand Tests"
  },
  {
    "file": "NEET_PG_Mock_5_5_Sections_1.json",
    "title": "Neet Pg Mock 5 5 Sections 1",
    "count": 200,
    "category": "Grand Tests"
  },
  {
    "file": "NEET_PG_Mock_6_5_Section.json",
    "title": "Neet Pg Mock 6 5 Section",
    "count": 200,
    "category": "Grand Tests"
  },
  {
    "file": "NEET_PG_Mock_7_5_Section.json",
    "title": "Neet Pg Mock 7 5 Section",
    "count": 200,
    "category": "Grand Tests"
  },
  {
    "file": "NEET_PG_Mock_7_5_Section_1.json",
    "title": "Neet Pg Mock 7 5 Section 1",
    "count": 200,
    "category": "Grand Tests"
  },
  {
    "file": "NEET_PG_Mock_8_5_Section.json",
    "title": "Neet Pg Mock 8 5 Section",
    "count": 196,
    "category": "Grand Tests"
  },
  {
    "file": "NEET_PG_Mock_8_5_Section_1.json",
    "title": "Neet Pg Mock 8 5 Section 1",
    "count": 196,
    "category": "Grand Tests"
  },
  {
    "file": "NEET_PG_Mock_9_5_Section.json",
    "title": "Neet Pg Mock 9 5 Section",
    "count": 200,
    "category": "Grand Tests"
  },
  {
    "file": "NEET_PG_Mock_9_5_Section_1.json",
    "title": "Neet Pg Mock 9 5 Section 1",
    "count": 200,
    "category": "Grand Tests"
  },
  {
    "file": "NEETPG_Mock-1_Advanced_Difficulty_-_22-05-2025_-_2025-05-22.json",
    "title": "Neetpg Mock 1 Advanced Difficulty   22 05 2025   2025 05 22",
    "count": 200,
    "category": "Grand Tests"
  },
  {
    "file": "NEETPG_Mock-2_Standard_Difficulty_-_30-05-2025_-_2025-05-30.json",
    "title": "Neetpg Mock 2 Standard Difficulty   30 05 2025   2025 05 30",
    "count": 200,
    "category": "Grand Tests"
  },
  {
    "file": "NEETPG_Mock-3_Standard_Difficulty_-_15-06-2025_-_2025-06-15.json",
    "title": "Neetpg Mock 3 Standard Difficulty   15 06 2025   2025 06 15",
    "count": 200,
    "category": "Grand Tests"
  },
  {
    "file": "NEETPG_Mock-4_Standard_Difficulty_-_02-07-2025_-_2025-07-02.json",
    "title": "Neetpg Mock 4 Standard Difficulty   02 07 2025   2025 07 02",
    "count": 200,
    "category": "Grand Tests"
  },
  {
    "file": "NEETPG_Mock_Test_August.json",
    "title": "Neetpg Mock Test August",
    "count": 200,
    "category": "Grand Tests"
  },
  {
    "file": "Target_Test_01__11th_Jun_2025__JUNE_2025____0__.json",
    "title": "Target Test 01  11Th Jun 2025  June 2025    0  ",
    "count": 200,
    "category": "Grand Tests"
  },
  {
    "file": "Target_Test_01__11th_Jun_2025__JUNE_2025____0___1.json",
    "title": "Target Test 01  11Th Jun 2025  June 2025    0   1",
    "count": 200,
    "category": "Grand Tests"
  },
  {
    "file": "Target_Test_02__18th_Jun_2025__JUNE_2025____0__.json",
    "title": "Target Test 02  18Th Jun 2025  June 2025    0  ",
    "count": 200,
    "category": "Grand Tests"
  },
  {
    "file": "Target_Test_03__25th_Jun_2025__JUNE_2025____0__.json",
    "title": "Target Test 03  25Th Jun 2025  June 2025    0  ",
    "count": 200,
    "category": "Grand Tests"
  },
  {
    "file": "Target_Test_03__25th_Jun_2025__JUNE_2025____0___1.json",
    "title": "Target Test 03  25Th Jun 2025  June 2025    0   1",
    "count": 200,
    "category": "Grand Tests"
  },
  {
    "file": "Target_Test_04__2nd_Jul__JULY_2025____0__.json",
    "title": "Target Test 04  2Nd Jul  July 2025    0  ",
    "count": 200,
    "category": "Grand Tests"
  },
  {
    "file": "Target_Test_05__live_on_9th_Jul__JULY_2025____0___1.json",
    "title": "Target Test 05  Live On 9Th Jul  July 2025    0   1",
    "count": 199,
    "category": "Grand Tests"
  },
  {
    "file": "Target_Test_06__live_on_16th_Jul__JULY_2025____0___1.json",
    "title": "Target Test 06  Live On 16Th Jul  July 2025    0   1",
    "count": 200,
    "category": "Grand Tests"
  },
  {
    "file": "Target_Test_07__live_on_23rd_Jul__JULY_2025____0__.json",
    "title": "Target Test 07  Live On 23Rd Jul  July 2025    0  ",
    "count": 200,
    "category": "Grand Tests"
  },
  {
    "file": "Target_Test_07__live_on_23rd_Jul__JULY_2025____0___1.json",
    "title": "Target Test 07  Live On 23Rd Jul  July 2025    0   1",
    "count": 200,
    "category": "Grand Tests"
  },
  {
    "file": "_Medicine_CVS__DR_Arvind_Class_Test_FMGE.json",
    "title": " Medicine Cvs  Dr Arvind Class Test Fmge",
    "count": 40,
    "category": "Medicine"
  },
  {
    "file": "Acute__Chronic_Limb_Ischemia_Part_1.json",
    "title": "Acute  Chronic Limb Ischemia Part 1",
    "count": 25,
    "category": "Medicine"
  },
  {
    "file": "Acute_Kidney_Injury.json",
    "title": "Acute Kidney Injury",
    "count": 9,
    "category": "Medicine"
  },
  {
    "file": "AIIMS_May_2020_-_2020-05-10.json",
    "title": "Aiims May 2020   2020 05 10",
    "count": 200,
    "category": "Medicine"
  },
  {
    "file": "Alcoholic_Liver_Disease.json",
    "title": "Alcoholic Liver Disease",
    "count": 4,
    "category": "Medicine"
  },
  {
    "file": "ALL_INDIA_MEDICOS_TEST_-_2024_BATCH_-_2024-12-22.json",
    "title": "All India Medicos Test   2024 Batch   2024 12 22",
    "count": 30,
    "category": "Medicine"
  },
  {
    "file": "Allied_Health_Sciences.json",
    "title": "Allied Health Sciences",
    "count": 8,
    "category": "Medicine"
  },
  {
    "file": "Anaesthesia_Machine-Anaesthesia_Machine.json",
    "title": "Anaesthesia Machine Anaesthesia Machine",
    "count": 18,
    "category": "Medicine"
  },
  {
    "file": "Aneurysm.json",
    "title": "Aneurysm",
    "count": 6,
    "category": "Medicine"
  },
  {
    "file": "Approach_to_Anemia.json",
    "title": "Approach To Anemia",
    "count": 16,
    "category": "Medicine"
  },
  {
    "file": "Approach_to_Glomerular_Disease.json",
    "title": "Approach To Glomerular Disease",
    "count": 10,
    "category": "Medicine"
  },
  {
    "file": "Approach_to_Muscle_Disorders.json",
    "title": "Approach To Muscle Disorders",
    "count": 16,
    "category": "Medicine"
  },
  {
    "file": "Approach_To_Nephritic_Syndromes.json",
    "title": "Approach To Nephritic Syndromes",
    "count": 15,
    "category": "Medicine"
  },
  {
    "file": "Approach_to_Polyuria_Polyuria.json",
    "title": "Approach To Polyuria Polyuria",
    "count": 5,
    "category": "Medicine"
  },
  {
    "file": "Approach_to_Shock_Part_1.json",
    "title": "Approach To Shock Part 1",
    "count": 5,
    "category": "Medicine"
  },
  {
    "file": "ARDS.json",
    "title": "Ards",
    "count": 18,
    "category": "Medicine"
  },
  {
    "file": "Arterial_Disorders.json",
    "title": "Arterial Disorders",
    "count": 6,
    "category": "Medicine"
  },
  {
    "file": "Ascites.json",
    "title": "Ascites",
    "count": 10,
    "category": "Medicine"
  },
  {
    "file": "Asthma.json",
    "title": "Asthma",
    "count": 16,
    "category": "Medicine"
  },
  {
    "file": "Asthma_1.json",
    "title": "Asthma 1",
    "count": 16,
    "category": "Medicine"
  },
  {
    "file": "Asthma_Part_1.json",
    "title": "Asthma Part 1",
    "count": 17,
    "category": "Medicine"
  },
  {
    "file": "Asthma_Part_2.json",
    "title": "Asthma Part 2",
    "count": 11,
    "category": "Medicine"
  },
  {
    "file": "Ataxia_Neurodegenerative_Disorders.json",
    "title": "Ataxia Neurodegenerative Disorders",
    "count": 11,
    "category": "Medicine"
  },
  {
    "file": "Atypical_Parkinsons.json",
    "title": "Atypical Parkinsons",
    "count": 24,
    "category": "Medicine"
  },
  {
    "file": "Autism_Spectrum_Disorder.json",
    "title": "Autism Spectrum Disorder",
    "count": 9,
    "category": "Medicine"
  },
  {
    "file": "Autoimmunity.json",
    "title": "Autoimmunity",
    "count": 5,
    "category": "Medicine"
  },
  {
    "file": "Basics.json",
    "title": "Basics",
    "count": 5,
    "category": "Medicine"
  },
  {
    "file": "Basics_of_ECG_Understanding.json",
    "title": "Basics Of Ecg Understanding",
    "count": 7,
    "category": "Medicine"
  },
  {
    "file": "Basics_of_Radiology-Radiation_Exposure__Hazards__Protection_Guidelines__and_Contrast_Media.json",
    "title": "Basics Of Radiology Radiation Exposure  Hazards  Protection Guidelines  And Contrast Media",
    "count": 12,
    "category": "Medicine"
  },
  {
    "file": "Biochem_FMT_BTR_Test_40_-_2024-09-24.json",
    "title": "Biochem Fmt Btr Test 40   2024 09 24",
    "count": 100,
    "category": "Medicine"
  },
  {
    "file": "Blood_Banking_and_Transfusion_Medicine-Previous_Year_Questions.json",
    "title": "Blood Banking And Transfusion Medicine Previous Year Questions",
    "count": 6,
    "category": "Medicine"
  },
  {
    "file": "Bradyarrhythmias.json",
    "title": "Bradyarrhythmias",
    "count": 2,
    "category": "Medicine"
  },
  {
    "file": "Brainstem_Disorders_Part_1.json",
    "title": "Brainstem Disorders Part 1",
    "count": 11,
    "category": "Medicine"
  },
  {
    "file": "Brainstem_Disorders_Part_2.json",
    "title": "Brainstem Disorders Part 2",
    "count": 7,
    "category": "Medicine"
  },
  {
    "file": "Bronchiectasis.json",
    "title": "Bronchiectasis",
    "count": 3,
    "category": "Medicine"
  },
  {
    "file": "Bronchiectasis_1.json",
    "title": "Bronchiectasis 1",
    "count": 3,
    "category": "Medicine"
  },
  {
    "file": "Calcium_Disorders_-_Hypocalcemia_Part_3.json",
    "title": "Calcium Disorders   Hypocalcemia Part 3",
    "count": 5,
    "category": "Medicine"
  },
  {
    "file": "Calcium_Disorders_-_Hypocalcemia_Part_4.json",
    "title": "Calcium Disorders   Hypocalcemia Part 4",
    "count": 8,
    "category": "Medicine"
  },
  {
    "file": "Carcinoma_Lung__Mediastinal_Conditions_Part_3.json",
    "title": "Carcinoma Lung  Mediastinal Conditions Part 3",
    "count": 14,
    "category": "Medicine"
  },
  {
    "file": "Cardiac_Plexus_Thoracic_Duct_Esophagus__Posterior_Mediastinum.json",
    "title": "Cardiac Plexus Thoracic Duct Esophagus  Posterior Mediastinum",
    "count": 15,
    "category": "Medicine"
  },
  {
    "file": "Cardio_-_Pulmonary_Resuscitation_CPR.json",
    "title": "Cardio   Pulmonary Resuscitation Cpr",
    "count": 30,
    "category": "Medicine"
  },
  {
    "file": "Cardiology.json",
    "title": "Cardiology",
    "count": 179,
    "category": "Medicine"
  },
  {
    "file": "Cardiology-CHF__BBB__Tachycardia__Bradycardia__and_Heart_Block.json",
    "title": "Cardiology Chf  Bbb  Tachycardia  Bradycardia  And Heart Block",
    "count": 18,
    "category": "Medicine"
  },
  {
    "file": "Cardiology-Diseases_of_the_Pericardium_and_Cardiomyopathies.json",
    "title": "Cardiology Diseases Of The Pericardium And Cardiomyopathies",
    "count": 23,
    "category": "Medicine"
  },
  {
    "file": "Cardiology-ECG_and_Arrhythmias.json",
    "title": "Cardiology Ecg And Arrhythmias",
    "count": 21,
    "category": "Medicine"
  },
  {
    "file": "Cardiology-Heart_Sounds_and_Murmurs.json",
    "title": "Cardiology Heart Sounds And Murmurs",
    "count": 25,
    "category": "Medicine"
  },
  {
    "file": "Cardiology-Hypertension.json",
    "title": "Cardiology Hypertension",
    "count": 10,
    "category": "Medicine"
  },
  {
    "file": "Cardiology-Ischemic_Heart_Disease.json",
    "title": "Cardiology Ischemic Heart Disease",
    "count": 28,
    "category": "Medicine"
  },
  {
    "file": "Cardiology_Part-_1.json",
    "title": "Cardiology Part  1",
    "count": 36,
    "category": "Medicine"
  },
  {
    "file": "Cardiology_Part-_2.json",
    "title": "Cardiology Part  2",
    "count": 38,
    "category": "Medicine"
  },
  {
    "file": "Cardiology_Part-_3.json",
    "title": "Cardiology Part  3",
    "count": 12,
    "category": "Medicine"
  },
  {
    "file": "Cardiology-Takotsubo__Brugada_syndrome__RHD__and_Infective_Endocarditis.json",
    "title": "Cardiology Takotsubo  Brugada Syndrome  Rhd  And Infective Endocarditis",
    "count": 31,
    "category": "Medicine"
  },
  {
    "file": "Cardiology-Valvular_Heart_Disease.json",
    "title": "Cardiology Valvular Heart Disease",
    "count": 24,
    "category": "Medicine"
  },
  {
    "file": "Cardiomyopathies_Part_1.json",
    "title": "Cardiomyopathies Part 1",
    "count": 13,
    "category": "Medicine"
  },
  {
    "file": "Cardiopulmonary_Cerebral_Resuscitation.json",
    "title": "Cardiopulmonary Cerebral Resuscitation",
    "count": 6,
    "category": "Medicine"
  },
  {
    "file": "Cardiopulmonary_Cerebral_Resuscitation-CPCR.json",
    "title": "Cardiopulmonary Cerebral Resuscitation Cpcr",
    "count": 15,
    "category": "Medicine"
  },
  {
    "file": "Cardiopulmonary_Resuscitation.json",
    "title": "Cardiopulmonary Resuscitation",
    "count": 21,
    "category": "Medicine"
  },
  {
    "file": "Cardiovascular_Emergencies-Previous_Year_Questions.json",
    "title": "Cardiovascular Emergencies Previous Year Questions",
    "count": 2,
    "category": "Medicine"
  },
  {
    "file": "Cardiovascular_System-ECG.json",
    "title": "Cardiovascular System Ecg",
    "count": 11,
    "category": "Medicine"
  },
  {
    "file": "Chronic_Bronchitis.json",
    "title": "Chronic Bronchitis",
    "count": 2,
    "category": "Medicine"
  },
  {
    "file": "Chronic_Kidney_Disease.json",
    "title": "Chronic Kidney Disease",
    "count": 21,
    "category": "Medicine"
  },
  {
    "file": "Chronic_Pancreatitis.json",
    "title": "Chronic Pancreatitis",
    "count": 3,
    "category": "Medicine"
  },
  {
    "file": "Chronic_Pulmonary_Disease_Classification.json",
    "title": "Chronic Pulmonary Disease Classification",
    "count": 3,
    "category": "Medicine"
  },
  {
    "file": "Classification_of_Congenital_Heart_Diseases.json",
    "title": "Classification Of Congenital Heart Diseases",
    "count": 31,
    "category": "Medicine"
  },
  {
    "file": "CNS-CVA.json",
    "title": "Cns Cva",
    "count": 20,
    "category": "Medicine"
  },
  {
    "file": "CNS-Epilepsy.json",
    "title": "Cns Epilepsy",
    "count": 12,
    "category": "Medicine"
  },
  {
    "file": "CNS-GBS.json",
    "title": "Cns Gbs",
    "count": 5,
    "category": "Medicine"
  },
  {
    "file": "CNS-Headache.json",
    "title": "Cns Headache",
    "count": 10,
    "category": "Medicine"
  },
  {
    "file": "CNS-MND.json",
    "title": "Cns Mnd",
    "count": 5,
    "category": "Medicine"
  },
  {
    "file": "CNS-Multiple_Sclerosis.json",
    "title": "Cns Multiple Sclerosis",
    "count": 6,
    "category": "Medicine"
  },
  {
    "file": "CNS-Myasthenia_Gravis.json",
    "title": "Cns Myasthenia Gravis",
    "count": 9,
    "category": "Medicine"
  },
  {
    "file": "CNS-Myelopathy.json",
    "title": "Cns Myelopathy",
    "count": 28,
    "category": "Medicine"
  },
  {
    "file": "Coarctation_of_Aorta.json",
    "title": "Coarctation Of Aorta",
    "count": 7,
    "category": "Medicine"
  },
  {
    "file": "Combo-2_The_Champion_Batch_Hyderabad_-_02-03-2025_-_2025-03-02.json",
    "title": "Combo 2 The Champion Batch Hyderabad   02 03 2025   2025 03 02",
    "count": 200,
    "category": "Medicine"
  },
  {
    "file": "Complications_of_Diabetes_DKA__HHS.json",
    "title": "Complications Of Diabetes Dka  Hhs",
    "count": 11,
    "category": "Medicine"
  },
  {
    "file": "Connective_Tissue_Disorders-Connective_tissue_disorders.json",
    "title": "Connective Tissue Disorders Connective Tissue Disorders",
    "count": 9,
    "category": "Medicine"
  },
  {
    "file": "Contrast_Media.json",
    "title": "Contrast Media",
    "count": 13,
    "category": "Medicine"
  },
  {
    "file": "Conus_Medullaris__Cauda_Equina_Syndrome.json",
    "title": "Conus Medullaris  Cauda Equina Syndrome",
    "count": 9,
    "category": "Medicine"
  },
  {
    "file": "COPD_Part_1.json",
    "title": "Copd Part 1",
    "count": 23,
    "category": "Medicine"
  },
  {
    "file": "COPD_Part_2.json",
    "title": "Copd Part 2",
    "count": 13,
    "category": "Medicine"
  },
  {
    "file": "COVID-19.json",
    "title": "Covid 19",
    "count": 97,
    "category": "Medicine"
  },
  {
    "file": "CPR.json",
    "title": "Cpr",
    "count": 19,
    "category": "Medicine"
  },
  {
    "file": "Critical_Care.json",
    "title": "Critical Care",
    "count": 35,
    "category": "Medicine"
  },
  {
    "file": "Critical_Care_1.json",
    "title": "Critical Care 1",
    "count": 20,
    "category": "Medicine"
  },
  {
    "file": "CT_Medicine_CNS_FMGE_CT.json",
    "title": "Ct Medicine Cns Fmge Ct",
    "count": 40,
    "category": "Medicine"
  },
  {
    "file": "Cumulative_Exam_on_5th_Sep_The_Champion_Batch_Hyderabad_-_05-09-2024_-_2024-09-05.json",
    "title": "Cumulative Exam On 5Th Sep The Champion Batch Hyderabad   05 09 2024   2024 09 05",
    "count": 200,
    "category": "Medicine"
  },
  {
    "file": "Cushings_Syndrome.json",
    "title": "Cushings Syndrome",
    "count": 8,
    "category": "Medicine"
  },
  {
    "file": "CVS_-_ACS_and_CAD.json",
    "title": "Cvs   Acs And Cad",
    "count": 22,
    "category": "Medicine"
  },
  {
    "file": "CVS_-_Acute_Rheumatic_Fever_and_Infective_Endocarditis.json",
    "title": "Cvs   Acute Rheumatic Fever And Infective Endocarditis",
    "count": 9,
    "category": "Medicine"
  },
  {
    "file": "CVS_-_Arrhythmias.json",
    "title": "Cvs   Arrhythmias",
    "count": 16,
    "category": "Medicine"
  },
  {
    "file": "CVS_-_Cardiomyopathies.json",
    "title": "Cvs   Cardiomyopathies",
    "count": 10,
    "category": "Medicine"
  },
  {
    "file": "CVS_-_Diseases_of_the_Pericardium.json",
    "title": "Cvs   Diseases Of The Pericardium",
    "count": 6,
    "category": "Medicine"
  },
  {
    "file": "CVS_-_ECG.json",
    "title": "Cvs   Ecg",
    "count": 24,
    "category": "Medicine"
  },
  {
    "file": "CVS_-_Hypertension.json",
    "title": "Cvs   Hypertension",
    "count": 8,
    "category": "Medicine"
  },
  {
    "file": "CVS_-_Valvular_Heart_Disease.json",
    "title": "Cvs   Valvular Heart Disease",
    "count": 16,
    "category": "Medicine"
  },
  {
    "file": "CVS__Blood_Vessels_and_Vasculitis-Ischemic_Heart_Disease_and_Myocardial_Infarction.json",
    "title": "Cvs  Blood Vessels And Vasculitis Ischemic Heart Disease And Myocardial Infarction",
    "count": 11,
    "category": "Medicine"
  },
  {
    "file": "CVS__Blood_Vessels_and_Vasculitis-RHD_and_Infective_Endocarditis.json",
    "title": "Cvs  Blood Vessels And Vasculitis Rhd And Infective Endocarditis",
    "count": 10,
    "category": "Medicine"
  },
  {
    "file": "CVS_and_Vasculitis.json",
    "title": "Cvs And Vasculitis",
    "count": 28,
    "category": "Medicine"
  },
  {
    "file": "CVS-Clinical_Vignette.json",
    "title": "Cvs Clinical Vignette",
    "count": 175,
    "category": "Medicine"
  },
  {
    "file": "Diabetes_Mellitus.json",
    "title": "Diabetes Mellitus",
    "count": 117,
    "category": "Medicine"
  },
  {
    "file": "Diabetes_Mellitus_Part_1.json",
    "title": "Diabetes Mellitus Part 1",
    "count": 8,
    "category": "Medicine"
  },
  {
    "file": "Diabetes_Mellitus_Part_2.json",
    "title": "Diabetes Mellitus Part 2",
    "count": 22,
    "category": "Medicine"
  },
  {
    "file": "Diseases_of_Gall_bladder\u00a0_Bile\u00a0Ducts.json",
    "title": "Diseases Of Gall Bladder\u00a0 Bile\u00a0Ducts",
    "count": 30,
    "category": "Medicine"
  },
  {
    "file": "Drugs_Acting_on_Ganglia__Anti_Smoking_Drugs.json",
    "title": "Drugs Acting On Ganglia  Anti Smoking Drugs",
    "count": 7,
    "category": "Medicine"
  },
  {
    "file": "ECG.json",
    "title": "Ecg",
    "count": 20,
    "category": "Medicine"
  },
  {
    "file": "ECG_-_PQRS__T_Wave_Abnormalities_Part_3.json",
    "title": "Ecg   Pqrs  T Wave Abnormalities Part 3",
    "count": 19,
    "category": "Medicine"
  },
  {
    "file": "ECG__Cardiac_Arrythmias.json",
    "title": "Ecg  Cardiac Arrythmias",
    "count": 10,
    "category": "Medicine"
  },
  {
    "file": "ECG__Cardiac_Arrythmias_-_Atrial_Fib__Flutter.json",
    "title": "Ecg  Cardiac Arrythmias   Atrial Fib  Flutter",
    "count": 13,
    "category": "Medicine"
  },
  {
    "file": "ECG__Ischemic_Heart_Disease.json",
    "title": "Ecg  Ischemic Heart Disease",
    "count": 13,
    "category": "Medicine"
  },
  {
    "file": "ECG_Brugada_Wellens_Fascicular_Block.json",
    "title": "Ecg Brugada Wellens Fascicular Block",
    "count": 9,
    "category": "Medicine"
  },
  {
    "file": "ECG_Electrolytes__Misc.json",
    "title": "Ecg Electrolytes  Misc",
    "count": 6,
    "category": "Medicine"
  },
  {
    "file": "ECG_VTV_fib__Heart_Blocks.json",
    "title": "Ecg Vtv Fib  Heart Blocks",
    "count": 12,
    "category": "Medicine"
  },
  {
    "file": "Electrolyte_Abnormalities_-_Pottassium_Disorders.json",
    "title": "Electrolyte Abnormalities   Pottassium Disorders",
    "count": 17,
    "category": "Medicine"
  },
  {
    "file": "Emergency_Clinical_Vignettes.json",
    "title": "Emergency Clinical Vignettes",
    "count": 36,
    "category": "Medicine"
  },
  {
    "file": "Emergency_Medicine-Massive_Transfusion_Protocol__ARDS__Snakebite__AHA_updates__Altitude_Sickness.json",
    "title": "Emergency Medicine Massive Transfusion Protocol  Ards  Snakebite  Aha Updates  Altitude Sickness",
    "count": 18,
    "category": "Medicine"
  },
  {
    "file": "Emergency_Medicine-Previous_Year_Questions.json",
    "title": "Emergency Medicine Previous Year Questions",
    "count": 17,
    "category": "Medicine"
  },
  {
    "file": "Emergency_Medicine-Previous_Year_Questions_1.json",
    "title": "Emergency Medicine Previous Year Questions 1",
    "count": 17,
    "category": "Medicine"
  },
  {
    "file": "Emphysema.json",
    "title": "Emphysema",
    "count": 6,
    "category": "Medicine"
  },
  {
    "file": "Endocrine.json",
    "title": "Endocrine",
    "count": 101,
    "category": "Medicine"
  },
  {
    "file": "Endocrine_system_and_Breast.json",
    "title": "Endocrine System And Breast",
    "count": 27,
    "category": "Medicine"
  },
  {
    "file": "Endocrine_Tumors_of_Pancreas__MEN_Syndromes.json",
    "title": "Endocrine Tumors Of Pancreas  Men Syndromes",
    "count": 22,
    "category": "Medicine"
  },
  {
    "file": "Endocrinology.json",
    "title": "Endocrinology",
    "count": 76,
    "category": "Medicine"
  },
  {
    "file": "Endocrinology__Reproductive.json",
    "title": "Endocrinology  Reproductive",
    "count": 20,
    "category": "Medicine"
  },
  {
    "file": "Endocrinology_2.json",
    "title": "Endocrinology 2",
    "count": 36,
    "category": "Medicine"
  },
  {
    "file": "Endocrinology_3.json",
    "title": "Endocrinology 3",
    "count": 36,
    "category": "Medicine"
  },
  {
    "file": "Endocrinology_Clinical_Vignettes.json",
    "title": "Endocrinology Clinical Vignettes",
    "count": 109,
    "category": "Medicine"
  },
  {
    "file": "Endocrinology-Diabetes_Mellitus-I.json",
    "title": "Endocrinology Diabetes Mellitus I",
    "count": 19,
    "category": "Medicine"
  },
  {
    "file": "Endocrinology-Diabetes_Mellitus-II.json",
    "title": "Endocrinology Diabetes Mellitus Ii",
    "count": 19,
    "category": "Medicine"
  },
  {
    "file": "Endocrinology-Diseases_of_Anterior_Pituitary.json",
    "title": "Endocrinology Diseases Of Anterior Pituitary",
    "count": 16,
    "category": "Medicine"
  },
  {
    "file": "Endocrinology-Diseases_of_Thyroid.json",
    "title": "Endocrinology Diseases Of Thyroid",
    "count": 16,
    "category": "Medicine"
  },
  {
    "file": "Endocrinology-Disorders_of_Adrenal_Gland_and_Cushing_Syndrome.json",
    "title": "Endocrinology Disorders Of Adrenal Gland And Cushing Syndrome",
    "count": 20,
    "category": "Medicine"
  },
  {
    "file": "Endocrinology-Disorders_of_Parathyroid_Gland_and_MEN_Syndromes.json",
    "title": "Endocrinology Disorders Of Parathyroid Gland And Men Syndromes",
    "count": 16,
    "category": "Medicine"
  },
  {
    "file": "Endocrinology-DKA_and_Hyperosmolar_Coma__Pancreatic_Neuroendocrine_Tumors.json",
    "title": "Endocrinology Dka And Hyperosmolar Coma  Pancreatic Neuroendocrine Tumors",
    "count": 18,
    "category": "Medicine"
  },
  {
    "file": "Endocrinology-Parathyroid__Pituitary__and_Adrenal_Glands.json",
    "title": "Endocrinology Parathyroid  Pituitary  And Adrenal Glands",
    "count": 14,
    "category": "Medicine"
  },
  {
    "file": "Endocrinology-Thyroid_Gland.json",
    "title": "Endocrinology Thyroid Gland",
    "count": 14,
    "category": "Medicine"
  },
  {
    "file": "Esophagus__Gerd__Functional_Disorders.json",
    "title": "Esophagus  Gerd  Functional Disorders",
    "count": 22,
    "category": "Medicine"
  },
  {
    "file": "Extra_Advantage_Series.json",
    "title": "Extra Advantage Series",
    "count": 188,
    "category": "Medicine"
  },
  {
    "file": "Facial_Nerve_Paralysis.json",
    "title": "Facial Nerve Paralysis",
    "count": 9,
    "category": "Medicine"
  },
  {
    "file": "Fluid_and_Electrolyte_Disturbances-Previous_Year_Questions.json",
    "title": "Fluid And Electrolyte Disturbances Previous Year Questions",
    "count": 14,
    "category": "Medicine"
  },
  {
    "file": "FMGE_CT_-_Medicine_CNS.json",
    "title": "Fmge Ct   Medicine Cns",
    "count": 40,
    "category": "Medicine"
  },
  {
    "file": "FMGE_CT_-_Medicine_Gastro__Endo.json",
    "title": "Fmge Ct   Medicine Gastro  Endo",
    "count": 40,
    "category": "Medicine"
  },
  {
    "file": "FMGE_EndoGITRhumat_Dr_Rahul.json",
    "title": "Fmge Endogitrhumat Dr Rahul",
    "count": 45,
    "category": "Medicine"
  },
  {
    "file": "FMGE_July_2023.json",
    "title": "Fmge July 2023",
    "count": 282,
    "category": "Medicine"
  },
  {
    "file": "FMT_Dr_Mohit_Gupta.json",
    "title": "Fmt Dr Mohit Gupta",
    "count": 50,
    "category": "Medicine"
  },
  {
    "file": "Gastrointestinal_System_2.json",
    "title": "Gastrointestinal System 2",
    "count": 73,
    "category": "Medicine"
  },
  {
    "file": "Gastrointestinal_System-Inflammatory_Bowel_Disease-II.json",
    "title": "Gastrointestinal System Inflammatory Bowel Disease Ii",
    "count": 7,
    "category": "Medicine"
  },
  {
    "file": "Gastrointestinal_System-Irritable_Bowel_Syndrome.json",
    "title": "Gastrointestinal System Irritable Bowel Syndrome",
    "count": 6,
    "category": "Medicine"
  },
  {
    "file": "Gastrointestinal_System-Malabsorption_Syndromes.json",
    "title": "Gastrointestinal System Malabsorption Syndromes",
    "count": 13,
    "category": "Medicine"
  },
  {
    "file": "Gastrointestinal_System-Peptic_Ulcer_and_Gastrointestinal_Bleeding.json",
    "title": "Gastrointestinal System Peptic Ulcer And Gastrointestinal Bleeding",
    "count": 14,
    "category": "Medicine"
  },
  {
    "file": "Gastrointestinal_System-Zollinger_Ellison_Syndrome.json",
    "title": "Gastrointestinal System Zollinger Ellison Syndrome",
    "count": 4,
    "category": "Medicine"
  },
  {
    "file": "Gastrointestinal_Tract-Malabsorption_Syndrome__Celiac_Disease__and_IBD.json",
    "title": "Gastrointestinal Tract Malabsorption Syndrome  Celiac Disease  And Ibd",
    "count": 14,
    "category": "Medicine"
  },
  {
    "file": "Gastrointestinal_Tract-Peptic_Ulcer_Disease__Gastric_Polyps__and_Tumors.json",
    "title": "Gastrointestinal Tract Peptic Ulcer Disease  Gastric Polyps  And Tumors",
    "count": 20,
    "category": "Medicine"
  },
  {
    "file": "General_Microbiology-Culture_Media.json",
    "title": "General Microbiology Culture Media",
    "count": 16,
    "category": "Medicine"
  },
  {
    "file": "General-Previous_Year_Questions_1.json",
    "title": "General Previous Year Questions 1",
    "count": 3,
    "category": "Medicine"
  },
  {
    "file": "Genetics_and_Genetic_Disorders-Previous_Year_Questions.json",
    "title": "Genetics And Genetic Disorders Previous Year Questions",
    "count": 20,
    "category": "Medicine"
  },
  {
    "file": "GIT__Hepatobiliary_System.json",
    "title": "Git  Hepatobiliary System",
    "count": 55,
    "category": "Medicine"
  },
  {
    "file": "GIT_2.json",
    "title": "Git 2",
    "count": 79,
    "category": "Medicine"
  },
  {
    "file": "GIT_3.json",
    "title": "Git 3",
    "count": 11,
    "category": "Medicine"
  },
  {
    "file": "GIT_Clinical_Vignettes.json",
    "title": "Git Clinical Vignettes",
    "count": 47,
    "category": "Medicine"
  },
  {
    "file": "GIT_Hepatology.json",
    "title": "Git Hepatology",
    "count": 30,
    "category": "Medicine"
  },
  {
    "file": "GIT_Liver.json",
    "title": "Git Liver",
    "count": 115,
    "category": "Medicine"
  },
  {
    "file": "Guillian_Barre_Syndrome.json",
    "title": "Guillian Barre Syndrome",
    "count": 9,
    "category": "Medicine"
  },
  {
    "file": "Heamatology.json",
    "title": "Heamatology",
    "count": 132,
    "category": "Medicine"
  },
  {
    "file": "Heart_Failure.json",
    "title": "Heart Failure",
    "count": 11,
    "category": "Medicine"
  },
  {
    "file": "Heart_Murmurs_Part_1.json",
    "title": "Heart Murmurs Part 1",
    "count": 8,
    "category": "Medicine"
  },
  {
    "file": "Heart_Murmurs_Part_2.json",
    "title": "Heart Murmurs Part 2",
    "count": 10,
    "category": "Medicine"
  },
  {
    "file": "Heart_Sounds_S3_S4_Ejection_Click__OS.json",
    "title": "Heart Sounds S3 S4 Ejection Click  Os",
    "count": 7,
    "category": "Medicine"
  },
  {
    "file": "Hematology__Red_Blood_Cells-Introduction_to_Hematology.json",
    "title": "Hematology  Red Blood Cells Introduction To Hematology",
    "count": 20,
    "category": "Medicine"
  },
  {
    "file": "Hematology__Red_Blood_Cells-Macrocytic_Hypochromic_Anemia.json",
    "title": "Hematology  Red Blood Cells Macrocytic Hypochromic Anemia",
    "count": 10,
    "category": "Medicine"
  },
  {
    "file": "Hematology__Tranfusion.json",
    "title": "Hematology  Tranfusion",
    "count": 200,
    "category": "Medicine"
  },
  {
    "file": "Hematology__White_Blood_Cells-Previous_Year_Questions.json",
    "title": "Hematology  White Blood Cells Previous Year Questions",
    "count": 46,
    "category": "Medicine"
  },
  {
    "file": "Hematology_Clinical_Vignettes.json",
    "title": "Hematology Clinical Vignettes",
    "count": 25,
    "category": "Medicine"
  },
  {
    "file": "Hematology-Hodgkin_s_and_Non-Hodgkin_s_Lymphoma.json",
    "title": "Hematology Hodgkin S And Non Hodgkin S Lymphoma",
    "count": 18,
    "category": "Medicine"
  },
  {
    "file": "Hematology-Previous_Year_Questions.json",
    "title": "Hematology Previous Year Questions",
    "count": 50,
    "category": "Medicine"
  },
  {
    "file": "Hematology-Thalassemia_and_Hereditary_Spherocytosis.json",
    "title": "Hematology Thalassemia And Hereditary Spherocytosis",
    "count": 12,
    "category": "Medicine"
  },
  {
    "file": "Heme_Synthesis_and_Porphyrias_Lipids.json",
    "title": "Heme Synthesis And Porphyrias Lipids",
    "count": 22,
    "category": "Medicine"
  },
  {
    "file": "HEPATITIS.json",
    "title": "Hepatitis",
    "count": 22,
    "category": "Medicine"
  },
  {
    "file": "Hepatobiliary.json",
    "title": "Hepatobiliary",
    "count": 21,
    "category": "Medicine"
  },
  {
    "file": "Hepatobiliary_System-Hepatorenal_and_hepatopulmonary_syndrome_and_alcoholic_hepatitits.json",
    "title": "Hepatobiliary System Hepatorenal And Hepatopulmonary Syndrome And Alcoholic Hepatitits",
    "count": 16,
    "category": "Medicine"
  },
  {
    "file": "Hepatobiliary_System-Hereditary_Hyperbilirubinemia__Budd_Chiari_syndrome.json",
    "title": "Hepatobiliary System Hereditary Hyperbilirubinemia  Budd Chiari Syndrome",
    "count": 9,
    "category": "Medicine"
  },
  {
    "file": "Hepatobiliary_System-Liver_Cirrhosis_and_its_Complications.json",
    "title": "Hepatobiliary System Liver Cirrhosis And Its Complications",
    "count": 21,
    "category": "Medicine"
  },
  {
    "file": "Hepatobiliary_System-Viral_Hepatitis__NAFLD__ALI.json",
    "title": "Hepatobiliary System Viral Hepatitis  Nafld  Ali",
    "count": 27,
    "category": "Medicine"
  },
  {
    "file": "Hepatobiliary_System-Wilson_disease_and_Hemochromatosis.json",
    "title": "Hepatobiliary System Wilson Disease And Hemochromatosis",
    "count": 13,
    "category": "Medicine"
  },
  {
    "file": "Hepatorenal_Syndrome.json",
    "title": "Hepatorenal Syndrome",
    "count": 4,
    "category": "Medicine"
  },
  {
    "file": "Hirusitsm.json",
    "title": "Hirusitsm",
    "count": 9,
    "category": "Medicine"
  },
  {
    "file": "History_of_Medicine.json",
    "title": "History Of Medicine",
    "count": 13,
    "category": "Medicine"
  },
  {
    "file": "Hypersensitivity_Pneumonitis_1.json",
    "title": "Hypersensitivity Pneumonitis 1",
    "count": 1,
    "category": "Medicine"
  },
  {
    "file": "Hypertension.json",
    "title": "Hypertension",
    "count": 13,
    "category": "Medicine"
  },
  {
    "file": "Hypertrophic_Cardiomyopathy.json",
    "title": "Hypertrophic Cardiomyopathy",
    "count": 6,
    "category": "Medicine"
  },
  {
    "file": "IHD__Aortic_Dissection_Part_2.json",
    "title": "Ihd  Aortic Dissection Part 2",
    "count": 31,
    "category": "Medicine"
  },
  {
    "file": "Important_Concepts_Related_to_Medical_Negligence.json",
    "title": "Important Concepts Related To Medical Negligence",
    "count": 10,
    "category": "Medicine"
  },
  {
    "file": "Indian_Legal_System___Medical_Jurisprudence-Previous_Year_Questions.json",
    "title": "Indian Legal System   Medical Jurisprudence Previous Year Questions",
    "count": 22,
    "category": "Medicine"
  },
  {
    "file": "Infections_Clinical_Vignettes.json",
    "title": "Infections Clinical Vignettes",
    "count": 30,
    "category": "Medicine"
  },
  {
    "file": "Infectious_Disease_Hematology.json",
    "title": "Infectious Disease Hematology",
    "count": 55,
    "category": "Medicine"
  },
  {
    "file": "Infective_Endocarditis.json",
    "title": "Infective Endocarditis",
    "count": 4,
    "category": "Medicine"
  },
  {
    "file": "Infective_Endocarditis_1.json",
    "title": "Infective Endocarditis 1",
    "count": 4,
    "category": "Medicine"
  },
  {
    "file": "Inflammation-Mediators_of_Inflammation.json",
    "title": "Inflammation Mediators Of Inflammation",
    "count": 14,
    "category": "Medicine"
  },
  {
    "file": "Inflammatory_Bowel_Disease.json",
    "title": "Inflammatory Bowel Disease",
    "count": 14,
    "category": "Medicine"
  },
  {
    "file": "Inflammatory_Bowel_Disease_1.json",
    "title": "Inflammatory Bowel Disease 1",
    "count": 31,
    "category": "Medicine"
  },
  {
    "file": "Inflammatory_Bowel_Diseases.json",
    "title": "Inflammatory Bowel Diseases",
    "count": 12,
    "category": "Medicine"
  },
  {
    "file": "Internal_Genitalia_-_Uterus_And_Fallopian_Tube.json",
    "title": "Internal Genitalia   Uterus And Fallopian Tube",
    "count": 18,
    "category": "Medicine"
  },
  {
    "file": "Interstitial_Lung_Disease_Part_1.json",
    "title": "Interstitial Lung Disease Part 1",
    "count": 12,
    "category": "Medicine"
  },
  {
    "file": "Interstitial_Lung_Disease_Part_2.json",
    "title": "Interstitial Lung Disease Part 2",
    "count": 15,
    "category": "Medicine"
  },
  {
    "file": "Intracranical_Haemorrhages.json",
    "title": "Intracranical Haemorrhages",
    "count": 8,
    "category": "Medicine"
  },
  {
    "file": "Introduction.json",
    "title": "Introduction",
    "count": 18,
    "category": "Medicine"
  },
  {
    "file": "Investigations.json",
    "title": "Investigations",
    "count": 7,
    "category": "Medicine"
  },
  {
    "file": "Ischemic_Heart_Disease.json",
    "title": "Ischemic Heart Disease",
    "count": 11,
    "category": "Medicine"
  },
  {
    "file": "Ischemic_Heart_Disease_-_Chest_Pain__Investigations.json",
    "title": "Ischemic Heart Disease   Chest Pain  Investigations",
    "count": 6,
    "category": "Medicine"
  },
  {
    "file": "Ischemic_Heart_Disease_-_Risk_Factors__Dyslipidemia.json",
    "title": "Ischemic Heart Disease   Risk Factors  Dyslipidemia",
    "count": 7,
    "category": "Medicine"
  },
  {
    "file": "Ischemic_Heart_Disease_-_Stemi.json",
    "title": "Ischemic Heart Disease   Stemi",
    "count": 8,
    "category": "Medicine"
  },
  {
    "file": "Isolated_Nerve_Palsy__Gaze_Palsy.json",
    "title": "Isolated Nerve Palsy  Gaze Palsy",
    "count": 12,
    "category": "Medicine"
  },
  {
    "file": "JVP.json",
    "title": "Jvp",
    "count": 6,
    "category": "Medicine"
  },
  {
    "file": "Kidney_-_Urinary_Tract_Calculi_Part_1.json",
    "title": "Kidney   Urinary Tract Calculi Part 1",
    "count": 14,
    "category": "Medicine"
  },
  {
    "file": "Large_Intestine_Common_Large_Intestinal_Conditions.json",
    "title": "Large Intestine Common Large Intestinal Conditions",
    "count": 23,
    "category": "Medicine"
  },
  {
    "file": "Late_Night_PYQ_PYT_Marathon_Medicine-1_-_2024-12-06.json",
    "title": "Late Night Pyq Pyt Marathon Medicine 1   2024 12 06",
    "count": 60,
    "category": "Medicine"
  },
  {
    "file": "Late_Night_PYQ_PYT_Marathon_Medicine-10_-_2024-12-21.json",
    "title": "Late Night Pyq Pyt Marathon Medicine 10   2024 12 21",
    "count": 60,
    "category": "Medicine"
  },
  {
    "file": "Late_Night_PYQ_PYT_Marathon_Medicine-2_-_2024-12-07.json",
    "title": "Late Night Pyq Pyt Marathon Medicine 2   2024 12 07",
    "count": 60,
    "category": "Medicine"
  },
  {
    "file": "Late_Night_PYQ_PYT_Marathon_Medicine-3_-_2024-12-08.json",
    "title": "Late Night Pyq Pyt Marathon Medicine 3   2024 12 08",
    "count": 60,
    "category": "Medicine"
  },
  {
    "file": "Late_Night_PYQ_PYT_Marathon_Medicine-4_-_2024-12-09.json",
    "title": "Late Night Pyq Pyt Marathon Medicine 4   2024 12 09",
    "count": 60,
    "category": "Medicine"
  },
  {
    "file": "Late_Night_PYQ_PYT_Marathon_Medicine-5_-_2024-12-10.json",
    "title": "Late Night Pyq Pyt Marathon Medicine 5   2024 12 10",
    "count": 60,
    "category": "Medicine"
  },
  {
    "file": "Late_Night_PYQ_PYT_Marathon_Medicine-6_-_2024-12-17.json",
    "title": "Late Night Pyq Pyt Marathon Medicine 6   2024 12 17",
    "count": 60,
    "category": "Medicine"
  },
  {
    "file": "Late_Night_PYQ_PYT_Marathon_Medicine-7_-_2024-12-18.json",
    "title": "Late Night Pyq Pyt Marathon Medicine 7   2024 12 18",
    "count": 60,
    "category": "Medicine"
  },
  {
    "file": "Late_Night_PYQ_PYT_Marathon_Medicine-8_-_2024-12-19.json",
    "title": "Late Night Pyq Pyt Marathon Medicine 8   2024 12 19",
    "count": 60,
    "category": "Medicine"
  },
  {
    "file": "Late_Night_PYQ_PYT_Marathon_Medicine-9_-_2024-12-20.json",
    "title": "Late Night Pyq Pyt Marathon Medicine 9   2024 12 20",
    "count": 60,
    "category": "Medicine"
  },
  {
    "file": "Late_Night_PYQs_Mixed_Bag-7_-_2025-03-17.json",
    "title": "Late Night Pyqs Mixed Bag 7   2025 03 17",
    "count": 40,
    "category": "Medicine"
  },
  {
    "file": "Leprosy_2.json",
    "title": "Leprosy 2",
    "count": 36,
    "category": "Medicine"
  },
  {
    "file": "Leprosy_3.json",
    "title": "Leprosy 3",
    "count": 6,
    "category": "Medicine"
  },
  {
    "file": "Lipid_Chemistry-Cholesterol__Lipoproteins__and_Hypercholesterolemia.json",
    "title": "Lipid Chemistry Cholesterol  Lipoproteins  And Hypercholesterolemia",
    "count": 20,
    "category": "Medicine"
  },
  {
    "file": "Liver.json",
    "title": "Liver",
    "count": 70,
    "category": "Medicine"
  },
  {
    "file": "Liver__Biliary_System_and_Pancreas-Hepatic_Tumors_and_Pancreas.json",
    "title": "Liver  Biliary System And Pancreas Hepatic Tumors And Pancreas",
    "count": 13,
    "category": "Medicine"
  },
  {
    "file": "Liver__GIT___Haematology.json",
    "title": "Liver  Git   Haematology",
    "count": 28,
    "category": "Medicine"
  },
  {
    "file": "Liver_1.json",
    "title": "Liver 1",
    "count": 30,
    "category": "Medicine"
  },
  {
    "file": "Liver_Liver_Failure__Portal_Hypertension.json",
    "title": "Liver Liver Failure  Portal Hypertension",
    "count": 12,
    "category": "Medicine"
  },
  {
    "file": "Localization_of_Myocardial_Damage_with_ECG.json",
    "title": "Localization Of Myocardial Damage With Ecg",
    "count": 6,
    "category": "Medicine"
  },
  {
    "file": "Lower_Limb_Dislocation_Of_Hip_And_Fracture_Nof.json",
    "title": "Lower Limb Dislocation Of Hip And Fracture Nof",
    "count": 33,
    "category": "Medicine"
  },
  {
    "file": "Malabsorption_Celiac_Disease__Liver_Disorders.json",
    "title": "Malabsorption Celiac Disease  Liver Disorders",
    "count": 10,
    "category": "Medicine"
  },
  {
    "file": "Malabsorption_Celiac_Disease__Whipples_Disease.json",
    "title": "Malabsorption Celiac Disease  Whipples Disease",
    "count": 15,
    "category": "Medicine"
  },
  {
    "file": "Mast_Cell_Diseases.json",
    "title": "Mast Cell Diseases",
    "count": 5,
    "category": "Medicine"
  },
  {
    "file": "Mast_Cell_Disorders.json",
    "title": "Mast Cell Disorders",
    "count": 9,
    "category": "Medicine"
  },
  {
    "file": "Median_Nerve.json",
    "title": "Median Nerve",
    "count": 5,
    "category": "Medicine"
  },
  {
    "file": "Mediastinum.json",
    "title": "Mediastinum",
    "count": 48,
    "category": "Medicine"
  },
  {
    "file": "Mediators_of_Inflammation.json",
    "title": "Mediators Of Inflammation",
    "count": 33,
    "category": "Medicine"
  },
  {
    "file": "Medical_Jurisprudence-Medical_Jurisprudence.json",
    "title": "Medical Jurisprudence Medical Jurisprudence",
    "count": 16,
    "category": "Medicine"
  },
  {
    "file": "Medical_Jurisprudence-Previous_Year_Questions.json",
    "title": "Medical Jurisprudence Previous Year Questions",
    "count": 14,
    "category": "Medicine"
  },
  {
    "file": "Medical_Law__Ethics.json",
    "title": "Medical Law  Ethics",
    "count": 31,
    "category": "Medicine"
  },
  {
    "file": "Medical_Law__Ethics_1.json",
    "title": "Medical Law  Ethics 1",
    "count": 23,
    "category": "Medicine"
  },
  {
    "file": "Medical_Oncology.json",
    "title": "Medical Oncology",
    "count": 158,
    "category": "Medicine"
  },
  {
    "file": "Medical_Termination_of_Pregnancy_MTP.json",
    "title": "Medical Termination Of Pregnancy Mtp",
    "count": 2,
    "category": "Medicine"
  },
  {
    "file": "Medicine_-_AIIMS_JUNE_2020.json",
    "title": "Medicine   Aiims June 2020",
    "count": 11,
    "category": "Medicine"
  },
  {
    "file": "Medicine_-_AIIMS_MAY_2018.json",
    "title": "Medicine   Aiims May 2018",
    "count": 23,
    "category": "Medicine"
  },
  {
    "file": "Medicine_-_AIIMS_MAY_2019.json",
    "title": "Medicine   Aiims May 2019",
    "count": 10,
    "category": "Medicine"
  },
  {
    "file": "Medicine_-_AIIMS_NOV_2018.json",
    "title": "Medicine   Aiims Nov 2018",
    "count": 17,
    "category": "Medicine"
  },
  {
    "file": "Medicine_-_AIIMS_NOV_2019.json",
    "title": "Medicine   Aiims Nov 2019",
    "count": 21,
    "category": "Medicine"
  },
  {
    "file": "Medicine_-_INI_CET_JULY_2021.json",
    "title": "Medicine   Ini Cet July 2021",
    "count": 10,
    "category": "Medicine"
  },
  {
    "file": "Medicine_-_INI_CET_MAY_2022.json",
    "title": "Medicine   Ini Cet May 2022",
    "count": 11,
    "category": "Medicine"
  },
  {
    "file": "Medicine_-_INI_CET_MAY_2023.json",
    "title": "Medicine   Ini Cet May 2023",
    "count": 11,
    "category": "Medicine"
  },
  {
    "file": "Medicine_-_INI_CET_NOV_2020.json",
    "title": "Medicine   Ini Cet Nov 2020",
    "count": 36,
    "category": "Medicine"
  },
  {
    "file": "Medicine_-_INI_CET_NOV_2021.json",
    "title": "Medicine   Ini Cet Nov 2021",
    "count": 18,
    "category": "Medicine"
  },
  {
    "file": "Medicine_-_INI_CET_NOV_2023.json",
    "title": "Medicine   Ini Cet Nov 2023",
    "count": 20,
    "category": "Medicine"
  },
  {
    "file": "Medicine_-_INI_CET_NOVEMBER_2022_PART_-_A.json",
    "title": "Medicine   Ini Cet November 2022 Part   A",
    "count": 18,
    "category": "Medicine"
  },
  {
    "file": "Medicine_-_INI_CET_NOVEMBER_2022_PART_-_B.json",
    "title": "Medicine   Ini Cet November 2022 Part   B",
    "count": 19,
    "category": "Medicine"
  },
  {
    "file": "Medicine_-_INICET_MAY_2024.json",
    "title": "Medicine   Inicet May 2024",
    "count": 24,
    "category": "Medicine"
  },
  {
    "file": "Medicine_-_NEET_PG_2018.json",
    "title": "Medicine   Neet Pg 2018",
    "count": 46,
    "category": "Medicine"
  },
  {
    "file": "Medicine_-_NEET_PG_2019.json",
    "title": "Medicine   Neet Pg 2019",
    "count": 17,
    "category": "Medicine"
  },
  {
    "file": "Medicine_-_NEET_PG_2020.json",
    "title": "Medicine   Neet Pg 2020",
    "count": 17,
    "category": "Medicine"
  },
  {
    "file": "Medicine_-_NEET_PG_2021.json",
    "title": "Medicine   Neet Pg 2021",
    "count": 22,
    "category": "Medicine"
  },
  {
    "file": "Medicine_-_NEET_PG_2022.json",
    "title": "Medicine   Neet Pg 2022",
    "count": 21,
    "category": "Medicine"
  },
  {
    "file": "Medicine_-_NEET_PG_2023.json",
    "title": "Medicine   Neet Pg 2023",
    "count": 21,
    "category": "Medicine"
  },
  {
    "file": "Medicine_-_NEET_PG_2024.json",
    "title": "Medicine   Neet Pg 2024",
    "count": 41,
    "category": "Medicine"
  },
  {
    "file": "Medicine-_1_DVT_Revision_Test.json",
    "title": "Medicine  1 Dvt Revision Test",
    "count": 50,
    "category": "Medicine"
  },
  {
    "file": "Medicine-_2__DVT_Revision_Test.json",
    "title": "Medicine  2  Dvt Revision Test",
    "count": 50,
    "category": "Medicine"
  },
  {
    "file": "Medicine_AIIMS_2014-2018.json",
    "title": "Medicine Aiims 2014 2018",
    "count": 205,
    "category": "Medicine"
  },
  {
    "file": "Medicine_CNS-_Class_Test_With_Video_Solution.json",
    "title": "Medicine Cns  Class Test With Video Solution",
    "count": 50,
    "category": "Medicine"
  },
  {
    "file": "Medicine_CNS_Dr_Achin.json",
    "title": "Medicine Cns Dr Achin",
    "count": 50,
    "category": "Medicine"
  },
  {
    "file": "Medicine_CNS_Dr_Achin_1.json",
    "title": "Medicine Cns Dr Achin 1",
    "count": 50,
    "category": "Medicine"
  },
  {
    "file": "Medicine_CNS_Dr_Achin-2026.json",
    "title": "Medicine Cns Dr Achin 2026",
    "count": 50,
    "category": "Medicine"
  },
  {
    "file": "Medicine-CNSEndo.json",
    "title": "Medicine Cnsendo",
    "count": 20,
    "category": "Medicine"
  },
  {
    "file": "Medicine_CNSENDO_MIQ_Series.json",
    "title": "Medicine Cnsendo Miq Series",
    "count": 20,
    "category": "Medicine"
  },
  {
    "file": "Medicine_CVS-_Class_Test_With_Video_Solution.json",
    "title": "Medicine Cvs  Class Test With Video Solution",
    "count": 50,
    "category": "Medicine"
  },
  {
    "file": "Medicine_CVS_Dr_Arvind.json",
    "title": "Medicine Cvs Dr Arvind",
    "count": 51,
    "category": "Medicine"
  },
  {
    "file": "Medicine_CVS_Dr_Arvind_1.json",
    "title": "Medicine Cvs Dr Arvind 1",
    "count": 51,
    "category": "Medicine"
  },
  {
    "file": "Medicine_CVS_Dr_Arvind-2026.json",
    "title": "Medicine Cvs Dr Arvind 2026",
    "count": 50,
    "category": "Medicine"
  },
  {
    "file": "Medicine_CVSGIT_MIQ_Series.json",
    "title": "Medicine Cvsgit Miq Series",
    "count": 20,
    "category": "Medicine"
  },
  {
    "file": "Medicine_CVSGITCNSEndo_New_Season.json",
    "title": "Medicine Cvsgitcnsendo New Season",
    "count": 25,
    "category": "Medicine"
  },
  {
    "file": "Medicine-CVSGITGen.json",
    "title": "Medicine Cvsgitgen",
    "count": 20,
    "category": "Medicine"
  },
  {
    "file": "Medicine_ED_-_Mission_15_-_13-02-2024_-_2024-02-13.json",
    "title": "Medicine Ed   Mission 15   13 02 2024   2024 02 13",
    "count": 150,
    "category": "Medicine"
  },
  {
    "file": "Medicine_ED_-_Mission_15_Lap_2_-_04-06-2024_-_2024-06-04.json",
    "title": "Medicine Ed   Mission 15 Lap 2   04 06 2024   2024 06 04",
    "count": 100,
    "category": "Medicine"
  },
  {
    "file": "Medicine_ED_-_Mission_20_Batch_3_-_14-02-2025_-_2025-02-14.json",
    "title": "Medicine Ed   Mission 20 Batch 3   14 02 2025   2025 02 14",
    "count": 100,
    "category": "Medicine"
  },
  {
    "file": "Medicine_ED_-_Mission_20_Lap_2_-_19-03-2025_-_2025-03-19.json",
    "title": "Medicine Ed   Mission 20 Lap 2   19 03 2025   2025 03 19",
    "count": 100,
    "category": "Medicine"
  },
  {
    "file": "Medicine_ED_Part_1_-_Mission_20_INICET_-_16-09-2024_-_2024-09-16.json",
    "title": "Medicine Ed Part 1   Mission 20 Inicet   16 09 2024   2024 09 16",
    "count": 75,
    "category": "Medicine"
  },
  {
    "file": "Medicine_ED_Part-1_Mission_30_Early_Intern_Batch_-_07-06-2025_-_2025-06-07.json",
    "title": "Medicine Ed Part 1 Mission 30 Early Intern Batch   07 06 2025   2025 06 07",
    "count": 100,
    "category": "Medicine"
  },
  {
    "file": "Medicine_ED_Part-1_Mission_NEET_PG_-_11-08-2023_-_2023-08-11.json",
    "title": "Medicine Ed Part 1 Mission Neet Pg   11 08 2023   2023 08 11",
    "count": 74,
    "category": "Medicine"
  },
  {
    "file": "Medicine_ED_Part_2_-_Mission_20_INICET_-_18-09-2024_-_2024-09-18.json",
    "title": "Medicine Ed Part 2   Mission 20 Inicet   18 09 2024   2024 09 18",
    "count": 75,
    "category": "Medicine"
  },
  {
    "file": "Medicine_ED_Part-2_Mission_30_Early_Intern_Batch_-_13-06-2025_-_2025-06-13.json",
    "title": "Medicine Ed Part 2 Mission 30 Early Intern Batch   13 06 2025   2025 06 13",
    "count": 100,
    "category": "Medicine"
  },
  {
    "file": "Medicine_ED_Part-2_Mission_NEET_PG_-_10-11-2023_-_2023-11-10.json",
    "title": "Medicine Ed Part 2 Mission Neet Pg   10 11 2023   2023 11 10",
    "count": 75,
    "category": "Medicine"
  },
  {
    "file": "Medicine_ENDO-_Class_Test_With_Video_Solution.json",
    "title": "Medicine Endo  Class Test With Video Solution",
    "count": 26,
    "category": "Medicine"
  },
  {
    "file": "Medicine_Endo_Dr_Rahul.json",
    "title": "Medicine Endo Dr Rahul",
    "count": 50,
    "category": "Medicine"
  },
  {
    "file": "Medicine_Endo_Dr_Rahul-2026.json",
    "title": "Medicine Endo Dr Rahul 2026",
    "count": 50,
    "category": "Medicine"
  },
  {
    "file": "Medicine_EndoGastro_Dr_Rahul.json",
    "title": "Medicine Endogastro Dr Rahul",
    "count": 50,
    "category": "Medicine"
  },
  {
    "file": "Medicine_Except_CNS.json",
    "title": "Medicine Except Cns",
    "count": 40,
    "category": "Medicine"
  },
  {
    "file": "Medicine_FMGE_PYQ.json",
    "title": "Medicine Fmge Pyq",
    "count": 124,
    "category": "Medicine"
  },
  {
    "file": "Medicine_GastroEndo_Dr_Rahul.json",
    "title": "Medicine Gastroendo Dr Rahul",
    "count": 55,
    "category": "Medicine"
  },
  {
    "file": "Medicine_GIT-_Class_Test_With_Video_Solution.json",
    "title": "Medicine Git  Class Test With Video Solution",
    "count": 25,
    "category": "Medicine"
  },
  {
    "file": "Medicine_GIT_Dr_Arvind.json",
    "title": "Medicine Git Dr Arvind",
    "count": 25,
    "category": "Medicine"
  },
  {
    "file": "Medicine_GIT_Dr_Arvind-2026.json",
    "title": "Medicine Git Dr Arvind 2026",
    "count": 50,
    "category": "Medicine"
  },
  {
    "file": "Medicine_IBQ_CNSRespAbbEndo.json",
    "title": "Medicine Ibq Cnsrespabbendo",
    "count": 20,
    "category": "Medicine"
  },
  {
    "file": "Medicine_IBQ_CVSGIT_Nephro_Rehumat.json",
    "title": "Medicine Ibq Cvsgit Nephro Rehumat",
    "count": 20,
    "category": "Medicine"
  },
  {
    "file": "Medicine_Image_Based_Question.json",
    "title": "Medicine Image Based Question",
    "count": 40,
    "category": "Medicine"
  },
  {
    "file": "MEDICINE-INICET_NOV_2024.json",
    "title": "Medicine Inicet Nov 2024",
    "count": 21,
    "category": "Medicine"
  },
  {
    "file": "Medicine_INICET_PYQ.json",
    "title": "Medicine Inicet Pyq",
    "count": 266,
    "category": "Medicine"
  },
  {
    "file": "Medicine_NEET_PG_Revision_ED_-_30-11-2023_-_2023-11-30.json",
    "title": "Medicine Neet Pg Revision Ed   30 11 2023   2023 11 30",
    "count": 100,
    "category": "Medicine"
  },
  {
    "file": "Medicine_NEETPG_PYQ.json",
    "title": "Medicine Neetpg Pyq",
    "count": 152,
    "category": "Medicine"
  },
  {
    "file": "Medicine_Nephrology-_Class_Test_With_Video_Solution.json",
    "title": "Medicine Nephrology  Class Test With Video Solution",
    "count": 25,
    "category": "Medicine"
  },
  {
    "file": "Medicine_Nephrology_Dr_Srinath.json",
    "title": "Medicine Nephrology Dr Srinath",
    "count": 25,
    "category": "Medicine"
  },
  {
    "file": "Medicine_Nephrology_Dr_Srinath-2026.json",
    "title": "Medicine Nephrology Dr Srinath 2026",
    "count": 25,
    "category": "Medicine"
  },
  {
    "file": "Medicine-NephroRheumat_MIQ_Series.json",
    "title": "Medicine Nephrorheumat Miq Series",
    "count": 20,
    "category": "Medicine"
  },
  {
    "file": "Medicine-NephroRheumatResp.json",
    "title": "Medicine Nephrorheumatresp",
    "count": 20,
    "category": "Medicine"
  },
  {
    "file": "Medicine_NephroRheumatRespABB_Dr_Srinath_Chandramani.json",
    "title": "Medicine Nephrorheumatrespabb Dr Srinath Chandramani",
    "count": 50,
    "category": "Medicine"
  },
  {
    "file": "Medicine_NephroRheumatRespABB_New_Season.json",
    "title": "Medicine Nephrorheumatrespabb New Season",
    "count": 25,
    "category": "Medicine"
  },
  {
    "file": "Medicine_NephroRhumatRespAbb_Dr_Srinath.json",
    "title": "Medicine Nephrorhumatrespabb Dr Srinath",
    "count": 40,
    "category": "Medicine"
  },
  {
    "file": "Medicine_ResABB_Dr_Bharath_Kathi-2026.json",
    "title": "Medicine Resabb Dr Bharath Kathi 2026",
    "count": 50,
    "category": "Medicine"
  },
  {
    "file": "Medicine_Resp_abb-_Class_Test_With_Video_Solution.json",
    "title": "Medicine Resp Abb  Class Test With Video Solution",
    "count": 50,
    "category": "Medicine"
  },
  {
    "file": "Medicine_RespAbb_MIQ_Series.json",
    "title": "Medicine Respabb Miq Series",
    "count": 20,
    "category": "Medicine"
  },
  {
    "file": "Medicine_Rheumatology-_Class_Test_With_Video_Solution.json",
    "title": "Medicine Rheumatology  Class Test With Video Solution",
    "count": 25,
    "category": "Medicine"
  },
  {
    "file": "Medicine_Rheumatology_Dr_Srinath.json",
    "title": "Medicine Rheumatology Dr Srinath",
    "count": 25,
    "category": "Medicine"
  },
  {
    "file": "Medicine_Rheumatology_Dr_Srinath-2026.json",
    "title": "Medicine Rheumatology Dr Srinath 2026",
    "count": 25,
    "category": "Medicine"
  },
  {
    "file": "Medicine_RSABBNephroRheumat_Dr_Srinath.json",
    "title": "Medicine Rsabbnephrorheumat Dr Srinath",
    "count": 50,
    "category": "Medicine"
  },
  {
    "file": "Medicine_Test_The_Champion_Batch_Hyderabad_-_15-01-2025_-_2025-01-15.json",
    "title": "Medicine Test The Champion Batch Hyderabad   15 01 2025   2025 01 15",
    "count": 100,
    "category": "Medicine"
  },
  {
    "file": "Medicine_Test_The_Champion_Batch_Hyderabad_-_15-12-2024_-_2024-12-15.json",
    "title": "Medicine Test The Champion Batch Hyderabad   15 12 2024   2024 12 15",
    "count": 150,
    "category": "Medicine"
  },
  {
    "file": "Medicine_Test_The_Champion_Batch_Hyderabad_-_25-09-2024_-_2024-09-25.json",
    "title": "Medicine Test The Champion Batch Hyderabad   25 09 2024   2024 09 25",
    "count": 100,
    "category": "Medicine"
  },
  {
    "file": "Medico_-_Legal_Autopsy.json",
    "title": "Medico   Legal Autopsy",
    "count": 10,
    "category": "Medicine"
  },
  {
    "file": "Medico-Legal_Aspects_of_Injuries.json",
    "title": "Medico Legal Aspects Of Injuries",
    "count": 10,
    "category": "Medicine"
  },
  {
    "file": "Medico-Legal_Importance_of_Age_Groups.json",
    "title": "Medico Legal Importance Of Age Groups",
    "count": 5,
    "category": "Medicine"
  },
  {
    "file": "Men_Syndrome.json",
    "title": "Men Syndrome",
    "count": 6,
    "category": "Medicine"
  },
  {
    "file": "Microcytic_Anemia_Part_1.json",
    "title": "Microcytic Anemia Part 1",
    "count": 13,
    "category": "Medicine"
  },
  {
    "file": "Mid_Day_Module_Medicine-1_-_2024-12-07.json",
    "title": "Mid Day Module Medicine 1   2024 12 07",
    "count": 50,
    "category": "Medicine"
  },
  {
    "file": "Mid_Day_Module_Medicine-10_-_2024-12-22.json",
    "title": "Mid Day Module Medicine 10   2024 12 22",
    "count": 50,
    "category": "Medicine"
  },
  {
    "file": "Mid_Day_Module_Medicine-11_-_2025-02-06.json",
    "title": "Mid Day Module Medicine 11   2025 02 06",
    "count": 50,
    "category": "Medicine"
  },
  {
    "file": "Mid_Day_Module_Medicine-2_-_2024-12-08.json",
    "title": "Mid Day Module Medicine 2   2024 12 08",
    "count": 50,
    "category": "Medicine"
  },
  {
    "file": "Mid_Day_Module_Medicine-3_-_2024-12-09.json",
    "title": "Mid Day Module Medicine 3   2024 12 09",
    "count": 50,
    "category": "Medicine"
  },
  {
    "file": "Mid_Day_Module_Medicine-4_-_2024-12-10.json",
    "title": "Mid Day Module Medicine 4   2024 12 10",
    "count": 50,
    "category": "Medicine"
  },
  {
    "file": "Mid_Day_Module_Medicine-5_-_2024-12-11.json",
    "title": "Mid Day Module Medicine 5   2024 12 11",
    "count": 50,
    "category": "Medicine"
  },
  {
    "file": "Mid_Day_Module_Medicine-6_-_2024-12-18.json",
    "title": "Mid Day Module Medicine 6   2024 12 18",
    "count": 50,
    "category": "Medicine"
  },
  {
    "file": "Mid_Day_Module_Medicine-7_-_2024-12-19.json",
    "title": "Mid Day Module Medicine 7   2024 12 19",
    "count": 50,
    "category": "Medicine"
  },
  {
    "file": "Mid_Day_Module_Medicine-8_-_2024-12-20.json",
    "title": "Mid Day Module Medicine 8   2024 12 20",
    "count": 50,
    "category": "Medicine"
  },
  {
    "file": "Mid_Day_Module_Medicine-9_-_2024-12-21.json",
    "title": "Mid Day Module Medicine 9   2024 12 21",
    "count": 50,
    "category": "Medicine"
  },
  {
    "file": "Mid_Day_Module_Mixed_Bag-2_-_2025-03-12.json",
    "title": "Mid Day Module Mixed Bag 2   2025 03 12",
    "count": 40,
    "category": "Medicine"
  },
  {
    "file": "Mid_Day_Module_Mixed_Bag-3_-_2025-03-13.json",
    "title": "Mid Day Module Mixed Bag 3   2025 03 13",
    "count": 40,
    "category": "Medicine"
  },
  {
    "file": "Mid_Day_Module_Mixed_Bag-4_-_2025-03-14.json",
    "title": "Mid Day Module Mixed Bag 4   2025 03 14",
    "count": 40,
    "category": "Medicine"
  },
  {
    "file": "Mid_Day_Module_Mixed_Bag-7_-_2025-03-17.json",
    "title": "Mid Day Module Mixed Bag 7   2025 03 17",
    "count": 40,
    "category": "Medicine"
  },
  {
    "file": "Mid_Day_Module_Mixed_Bag-9_-_2025-03-19.json",
    "title": "Mid Day Module Mixed Bag 9   2025 03 19",
    "count": 40,
    "category": "Medicine"
  },
  {
    "file": "Miscellancous.json",
    "title": "Miscellancous",
    "count": 11,
    "category": "Medicine"
  },
  {
    "file": "Miscellaneous.json",
    "title": "Miscellaneous",
    "count": 51,
    "category": "Medicine"
  },
  {
    "file": "Miscellaneous-_Shock.json",
    "title": "Miscellaneous  Shock",
    "count": 10,
    "category": "Medicine"
  },
  {
    "file": "Miscellaneous_1.json",
    "title": "Miscellaneous 1",
    "count": 51,
    "category": "Medicine"
  },
  {
    "file": "Miscellaneous_2.json",
    "title": "Miscellaneous 2",
    "count": 51,
    "category": "Medicine"
  },
  {
    "file": "Miscellaneous_3.json",
    "title": "Miscellaneous 3",
    "count": 30,
    "category": "Medicine"
  },
  {
    "file": "Miscellaneous_4.json",
    "title": "Miscellaneous 4",
    "count": 30,
    "category": "Medicine"
  },
  {
    "file": "Miscellaneous_5.json",
    "title": "Miscellaneous 5",
    "count": 51,
    "category": "Medicine"
  },
  {
    "file": "Miscellaneous-Oxygen_Delivering_Systems.json",
    "title": "Miscellaneous Oxygen Delivering Systems",
    "count": 19,
    "category": "Medicine"
  },
  {
    "file": "Miscellaneous_Topics.json",
    "title": "Miscellaneous Topics",
    "count": 4,
    "category": "Medicine"
  },
  {
    "file": "Miscellaneous_Topics_1.json",
    "title": "Miscellaneous Topics 1",
    "count": 35,
    "category": "Medicine"
  },
  {
    "file": "Miscellaneous_Topics-Miscellaneous.json",
    "title": "Miscellaneous Topics Miscellaneous",
    "count": 15,
    "category": "Medicine"
  },
  {
    "file": "Miscellaneous_Topics_Part_1.json",
    "title": "Miscellaneous Topics Part 1",
    "count": 7,
    "category": "Medicine"
  },
  {
    "file": "Miscellaneous_Topics_Part_2.json",
    "title": "Miscellaneous Topics Part 2",
    "count": 6,
    "category": "Medicine"
  },
  {
    "file": "Miscellaneous_Topics_Part_3.json",
    "title": "Miscellaneous Topics Part 3",
    "count": 4,
    "category": "Medicine"
  },
  {
    "file": "Mixed_Bag_Topics.json",
    "title": "Mixed Bag Topics",
    "count": 6,
    "category": "Medicine"
  },
  {
    "file": "Mnemonics_to_Remember_Cancer_Staging.json",
    "title": "Mnemonics To Remember Cancer Staging",
    "count": 7,
    "category": "Medicine"
  },
  {
    "file": "Motor_Neuron_Disease.json",
    "title": "Motor Neuron Disease",
    "count": 12,
    "category": "Medicine"
  },
  {
    "file": "Multiple_Sclerosis.json",
    "title": "Multiple Sclerosis",
    "count": 20,
    "category": "Medicine"
  },
  {
    "file": "NAFLD.json",
    "title": "Nafld",
    "count": 2,
    "category": "Medicine"
  },
  {
    "file": "NAFLD__NASH.json",
    "title": "Nafld  Nash",
    "count": 13,
    "category": "Medicine"
  },
  {
    "file": "Named_X-Ray_Views.json",
    "title": "Named X Ray Views",
    "count": 5,
    "category": "Medicine"
  },
  {
    "file": "NEET_PG_Mock_2_5_Sections_1.json",
    "title": "Neet Pg Mock 2 5 Sections 1",
    "count": 200,
    "category": "Medicine"
  },
  {
    "file": "NEET_PG_Mock_3_5_Sections_1.json",
    "title": "Neet Pg Mock 3 5 Sections 1",
    "count": 200,
    "category": "Medicine"
  },
  {
    "file": "NEET_PG_Mock_6_5_Section_1.json",
    "title": "Neet Pg Mock 6 5 Section 1",
    "count": 200,
    "category": "Medicine"
  },
  {
    "file": "Nephrology.json",
    "title": "Nephrology",
    "count": 50,
    "category": "Medicine"
  },
  {
    "file": "Nephrology_1.json",
    "title": "Nephrology 1",
    "count": 33,
    "category": "Medicine"
  },
  {
    "file": "Nephrology_2.json",
    "title": "Nephrology 2",
    "count": 103,
    "category": "Medicine"
  },
  {
    "file": "Nephrology-AKI__Diabetic_Nephropathy__Renal_Stones.json",
    "title": "Nephrology Aki  Diabetic Nephropathy  Renal Stones",
    "count": 22,
    "category": "Medicine"
  },
  {
    "file": "Nephrology-Chronic_Kidney_Disease.json",
    "title": "Nephrology Chronic Kidney Disease",
    "count": 16,
    "category": "Medicine"
  },
  {
    "file": "Nephrology-Ciliopathies__PKD__TTP.json",
    "title": "Nephrology Ciliopathies  Pkd  Ttp",
    "count": 13,
    "category": "Medicine"
  },
  {
    "file": "Nephrology_Clinical_Vignette.json",
    "title": "Nephrology Clinical Vignette",
    "count": 61,
    "category": "Medicine"
  },
  {
    "file": "Nephrology-Disorders_of_Electrolyte_Imbalance.json",
    "title": "Nephrology Disorders Of Electrolyte Imbalance",
    "count": 8,
    "category": "Medicine"
  },
  {
    "file": "Nephrology-Electrolyte_Imbalance.json",
    "title": "Nephrology Electrolyte Imbalance",
    "count": 30,
    "category": "Medicine"
  },
  {
    "file": "Nephrology-Kidney_Urine_Analysis.json",
    "title": "Nephrology Kidney Urine Analysis",
    "count": 12,
    "category": "Medicine"
  },
  {
    "file": "Nephrology-Nephrotic_and_Nephritic_Syndromes.json",
    "title": "Nephrology Nephrotic And Nephritic Syndromes",
    "count": 15,
    "category": "Medicine"
  },
  {
    "file": "Nephrology-Renal_Tubular_Acidosis_and_Renal_Artery_Stenosis.json",
    "title": "Nephrology Renal Tubular Acidosis And Renal Artery Stenosis",
    "count": 12,
    "category": "Medicine"
  },
  {
    "file": "Nephrotic_Syndrome_Basics.json",
    "title": "Nephrotic Syndrome Basics",
    "count": 2,
    "category": "Medicine"
  },
  {
    "file": "Nephrotic_Syndrome_FSGS.json",
    "title": "Nephrotic Syndrome Fsgs",
    "count": 5,
    "category": "Medicine"
  },
  {
    "file": "Neurology.json",
    "title": "Neurology",
    "count": 133,
    "category": "Medicine"
  },
  {
    "file": "Neurology-Basics_of_Cranial_nerves__Mechanical_thrombectomy__Stroke.json",
    "title": "Neurology Basics Of Cranial Nerves  Mechanical Thrombectomy  Stroke",
    "count": 28,
    "category": "Medicine"
  },
  {
    "file": "Neurology_Clinical_Vignettes.json",
    "title": "Neurology Clinical Vignettes",
    "count": 44,
    "category": "Medicine"
  },
  {
    "file": "Neurology-CNS_hemorrhage__Headaches_and_Migraine.json",
    "title": "Neurology Cns Hemorrhage  Headaches And Migraine",
    "count": 21,
    "category": "Medicine"
  },
  {
    "file": "Neurology-Epilepsy_and_EEG.json",
    "title": "Neurology Epilepsy And Eeg",
    "count": 25,
    "category": "Medicine"
  },
  {
    "file": "Neurology-Guillian_Barre_Syndrome_and_Alzheimer_s_disease.json",
    "title": "Neurology Guillian Barre Syndrome And Alzheimer S Disease",
    "count": 14,
    "category": "Medicine"
  },
  {
    "file": "Neurology-Meningitis_and_CNS_infections.json",
    "title": "Neurology Meningitis And Cns Infections",
    "count": 16,
    "category": "Medicine"
  },
  {
    "file": "Neurology-Multiple_sclerosis__neuromyelitis_optica_spectrum_disorder__and_ALS.json",
    "title": "Neurology Multiple Sclerosis  Neuromyelitis Optica Spectrum Disorder  And Als",
    "count": 20,
    "category": "Medicine"
  },
  {
    "file": "Neurology-Myasthenia_Gravis.json",
    "title": "Neurology Myasthenia Gravis",
    "count": 10,
    "category": "Medicine"
  },
  {
    "file": "Neurology-Parkinsonism_and_Parkinson_s_disease.json",
    "title": "Neurology Parkinsonism And Parkinson S Disease",
    "count": 19,
    "category": "Medicine"
  },
  {
    "file": "Neurology_Part-_1.json",
    "title": "Neurology Part  1",
    "count": 33,
    "category": "Medicine"
  },
  {
    "file": "Neurology_Part-_2.json",
    "title": "Neurology Part  2",
    "count": 52,
    "category": "Medicine"
  },
  {
    "file": "Neurology-Stroke__TIA_and_image_based_questions.json",
    "title": "Neurology Stroke  Tia And Image Based Questions",
    "count": 29,
    "category": "Medicine"
  },
  {
    "file": "Neurology-Syringomelia__conus_medullaris__channelopathies_and_SAH.json",
    "title": "Neurology Syringomelia  Conus Medullaris  Channelopathies And Sah",
    "count": 21,
    "category": "Medicine"
  },
  {
    "file": "Neuromuscular_Disorders.json",
    "title": "Neuromuscular Disorders",
    "count": 9,
    "category": "Medicine"
  },
  {
    "file": "Non_Infective_Keratitis.json",
    "title": "Non Infective Keratitis",
    "count": 7,
    "category": "Medicine"
  },
  {
    "file": "Nuclear_Medicine.json",
    "title": "Nuclear Medicine",
    "count": 24,
    "category": "Medicine"
  },
  {
    "file": "Nuclear_Medicine_1.json",
    "title": "Nuclear Medicine 1",
    "count": 16,
    "category": "Medicine"
  },
  {
    "file": "Nuclear_Medicine_and_Radiotherapy.json",
    "title": "Nuclear Medicine And Radiotherapy",
    "count": 5,
    "category": "Medicine"
  },
  {
    "file": "Nuclear_Medicine-Nuclear_Medicine_and_Radiotherapy.json",
    "title": "Nuclear Medicine Nuclear Medicine And Radiotherapy",
    "count": 22,
    "category": "Medicine"
  },
  {
    "file": "Nuclear_Medicine-Previous_Year_Questions.json",
    "title": "Nuclear Medicine Previous Year Questions",
    "count": 2,
    "category": "Medicine"
  },
  {
    "file": "Nystagmus.json",
    "title": "Nystagmus",
    "count": 10,
    "category": "Medicine"
  },
  {
    "file": "Obstructive_Sleep_Apnea_Syndrome.json",
    "title": "Obstructive Sleep Apnea Syndrome",
    "count": 6,
    "category": "Medicine"
  },
  {
    "file": "Oncology-Oncology.json",
    "title": "Oncology Oncology",
    "count": 13,
    "category": "Medicine"
  },
  {
    "file": "One__Half_Syndrome.json",
    "title": "One  Half Syndrome",
    "count": 5,
    "category": "Medicine"
  },
  {
    "file": "Opioids.json",
    "title": "Opioids",
    "count": 20,
    "category": "Medicine"
  },
  {
    "file": "Orthopedics_AIIMS_2014-2018.json",
    "title": "Orthopedics Aiims 2014 2018",
    "count": 108,
    "category": "Medicine"
  },
  {
    "file": "Other_Nerve_Injuries.json",
    "title": "Other Nerve Injuries",
    "count": 4,
    "category": "Medicine"
  },
  {
    "file": "Pancreas_1.json",
    "title": "Pancreas 1",
    "count": 5,
    "category": "Medicine"
  },
  {
    "file": "Pancreas_Anomalies__Inflammation.json",
    "title": "Pancreas Anomalies  Inflammation",
    "count": 16,
    "category": "Medicine"
  },
  {
    "file": "Parkinsons_Disease.json",
    "title": "Parkinsons Disease",
    "count": 25,
    "category": "Medicine"
  },
  {
    "file": "Pediatric_Orthopedics-Pediatric_Orthopedics.json",
    "title": "Pediatric Orthopedics Pediatric Orthopedics",
    "count": 16,
    "category": "Medicine"
  },
  {
    "file": "Pediatrics_-_INI_CET_NOVEMBER_2022_PART_-_B.json",
    "title": "Pediatrics   Ini Cet November 2022 Part   B",
    "count": 9,
    "category": "Medicine"
  },
  {
    "file": "Peptic_Ulcer_Disease.json",
    "title": "Peptic Ulcer Disease",
    "count": 3,
    "category": "Medicine"
  },
  {
    "file": "Peptic_Ulcer_Disease_1.json",
    "title": "Peptic Ulcer Disease 1",
    "count": 3,
    "category": "Medicine"
  },
  {
    "file": "Pericardial_Diseases.json",
    "title": "Pericardial Diseases",
    "count": 7,
    "category": "Medicine"
  },
  {
    "file": "Pituitary_Disorders_-_Acromegaly_Part_2.json",
    "title": "Pituitary Disorders   Acromegaly Part 2",
    "count": 10,
    "category": "Medicine"
  },
  {
    "file": "Pituitary_Disorders_-_Prolactinoma_Part_1.json",
    "title": "Pituitary Disorders   Prolactinoma Part 1",
    "count": 11,
    "category": "Medicine"
  },
  {
    "file": "Platelets_and_Blood_Transfusion-Previous_Year_Questions.json",
    "title": "Platelets And Blood Transfusion Previous Year Questions",
    "count": 8,
    "category": "Medicine"
  },
  {
    "file": "Pleural_Diseases__Thoracic_Outlet_Syndrome_Part_2.json",
    "title": "Pleural Diseases  Thoracic Outlet Syndrome Part 2",
    "count": 16,
    "category": "Medicine"
  },
  {
    "file": "Pneumonia__ARDS.json",
    "title": "Pneumonia  Ards",
    "count": 6,
    "category": "Medicine"
  },
  {
    "file": "Pneumonia_Part_1.json",
    "title": "Pneumonia Part 1",
    "count": 18,
    "category": "Medicine"
  },
  {
    "file": "Pneumonia_Part_2.json",
    "title": "Pneumonia Part 2",
    "count": 34,
    "category": "Medicine"
  },
  {
    "file": "Primary_Headache_Part_1.json",
    "title": "Primary Headache Part 1",
    "count": 28,
    "category": "Medicine"
  },
  {
    "file": "Primary_Headache_Part_2.json",
    "title": "Primary Headache Part 2",
    "count": 7,
    "category": "Medicine"
  },
  {
    "file": "Primary_Hyperaldosteronism.json",
    "title": "Primary Hyperaldosteronism",
    "count": 5,
    "category": "Medicine"
  },
  {
    "file": "Prognosis.json",
    "title": "Prognosis",
    "count": 6,
    "category": "Medicine"
  },
  {
    "file": "Psychiatry_-_INI_CET_NOV_2023.json",
    "title": "Psychiatry   Ini Cet Nov 2023",
    "count": 3,
    "category": "Medicine"
  },
  {
    "file": "Pulmonary_Edema.json",
    "title": "Pulmonary Edema",
    "count": 2,
    "category": "Medicine"
  },
  {
    "file": "Pulmonary_Embolism.json",
    "title": "Pulmonary Embolism",
    "count": 23,
    "category": "Medicine"
  },
  {
    "file": "Pulmonary_Hypertension.json",
    "title": "Pulmonary Hypertension",
    "count": 15,
    "category": "Medicine"
  },
  {
    "file": "Pulmonary_Medicine__Critical_Care.json",
    "title": "Pulmonary Medicine  Critical Care",
    "count": 184,
    "category": "Medicine"
  },
  {
    "file": "Pulmonology-ABG_analysis.json",
    "title": "Pulmonology Abg Analysis",
    "count": 21,
    "category": "Medicine"
  },
  {
    "file": "Pulmonology-Bronchial_asthma_and_COPD.json",
    "title": "Pulmonology Bronchial Asthma And Copd",
    "count": 28,
    "category": "Medicine"
  },
  {
    "file": "Pulmonology-Bronchiectasis___Pneumonia.json",
    "title": "Pulmonology Bronchiectasis   Pneumonia",
    "count": 20,
    "category": "Medicine"
  },
  {
    "file": "Pulmonology-Cystic_Fibrosis__Obstructive_sleep_apnea.json",
    "title": "Pulmonology Cystic Fibrosis  Obstructive Sleep Apnea",
    "count": 16,
    "category": "Medicine"
  },
  {
    "file": "Pulmonology-Images_in_Pulmonology.json",
    "title": "Pulmonology Images In Pulmonology",
    "count": 11,
    "category": "Medicine"
  },
  {
    "file": "Pulmonology-INTERSTITIAL_LUNG_DISEASE_AND_PULMONARY_ALVEOLAR_PROTEINOSIS.json",
    "title": "Pulmonology Interstitial Lung Disease And Pulmonary Alveolar Proteinosis",
    "count": 13,
    "category": "Medicine"
  },
  {
    "file": "Pulmonology-Pleural_effusion_and_pneumothorax.json",
    "title": "Pulmonology Pleural Effusion And Pneumothorax",
    "count": 17,
    "category": "Medicine"
  },
  {
    "file": "Pulmonology-Pulmonary_Embolism_and_Fat_Embolism.json",
    "title": "Pulmonology Pulmonary Embolism And Fat Embolism",
    "count": 15,
    "category": "Medicine"
  },
  {
    "file": "Pulmonology-Tuberculosis.json",
    "title": "Pulmonology Tuberculosis",
    "count": 16,
    "category": "Medicine"
  },
  {
    "file": "Recombinant_DNA_Technology.json",
    "title": "Recombinant Dna Technology",
    "count": 20,
    "category": "Medicine"
  },
  {
    "file": "Renal_Physiology-Tubular_Transport.json",
    "title": "Renal Physiology Tubular Transport",
    "count": 20,
    "category": "Medicine"
  },
  {
    "file": "Renal_System-Nephritic_and_Nephrotic_Syndromes.json",
    "title": "Renal System Nephritic And Nephrotic Syndromes",
    "count": 18,
    "category": "Medicine"
  },
  {
    "file": "Renal_System-Renal_Tumors.json",
    "title": "Renal System Renal Tumors",
    "count": 10,
    "category": "Medicine"
  },
  {
    "file": "Respiratory_Clinical_Vignettes.json",
    "title": "Respiratory Clinical Vignettes",
    "count": 20,
    "category": "Medicine"
  },
  {
    "file": "Respiratory_System_6.json",
    "title": "Respiratory System 6",
    "count": 102,
    "category": "Medicine"
  },
  {
    "file": "Respiratory_System-Congenital_Anomalies_and_Lung_Infections.json",
    "title": "Respiratory System Congenital Anomalies And Lung Infections",
    "count": 10,
    "category": "Medicine"
  },
  {
    "file": "Respiratory_System-Obstructive_lung_disease.json",
    "title": "Respiratory System Obstructive Lung Disease",
    "count": 12,
    "category": "Medicine"
  },
  {
    "file": "Respiratory_System-Pulmonary_Hypertension_and_Lung_Tumors.json",
    "title": "Respiratory System Pulmonary Hypertension And Lung Tumors",
    "count": 18,
    "category": "Medicine"
  },
  {
    "file": "Respiratory_System-Sarcoidosis_and_Occupational_Lung_Diseases.json",
    "title": "Respiratory System Sarcoidosis And Occupational Lung Diseases",
    "count": 11,
    "category": "Medicine"
  },
  {
    "file": "Rheumatic_Fever_RHD__Heart_Failure.json",
    "title": "Rheumatic Fever Rhd  Heart Failure",
    "count": 15,
    "category": "Medicine"
  },
  {
    "file": "Rheumatic_Heart_Disease.json",
    "title": "Rheumatic Heart Disease",
    "count": 5,
    "category": "Medicine"
  },
  {
    "file": "Rheumatology.json",
    "title": "Rheumatology",
    "count": 50,
    "category": "Medicine"
  },
  {
    "file": "Rheumatology_1.json",
    "title": "Rheumatology 1",
    "count": 23,
    "category": "Medicine"
  },
  {
    "file": "Rheumatology_2.json",
    "title": "Rheumatology 2",
    "count": 120,
    "category": "Medicine"
  },
  {
    "file": "Rheumatology-Autoimmune_and_Inflammatory_Diseases_in_Medicine.json",
    "title": "Rheumatology Autoimmune And Inflammatory Diseases In Medicine",
    "count": 16,
    "category": "Medicine"
  },
  {
    "file": "Rheumatology_Clinical_Vignette.json",
    "title": "Rheumatology Clinical Vignette",
    "count": 68,
    "category": "Medicine"
  },
  {
    "file": "Rheumatology-Crystal_Arthropathy.json",
    "title": "Rheumatology Crystal Arthropathy",
    "count": 10,
    "category": "Medicine"
  },
  {
    "file": "Rheumatology-Rheumatoid_arthritis.json",
    "title": "Rheumatology Rheumatoid Arthritis",
    "count": 11,
    "category": "Medicine"
  },
  {
    "file": "Rheumatology-Scleroderma_and_Sjogren_syndrome.json",
    "title": "Rheumatology Scleroderma And Sjogren Syndrome",
    "count": 12,
    "category": "Medicine"
  },
  {
    "file": "Rheumatology-SLE___Anti_phospholipid_syndrome.json",
    "title": "Rheumatology Sle   Anti Phospholipid Syndrome",
    "count": 14,
    "category": "Medicine"
  },
  {
    "file": "Rheumatology-Vasculitis_Syndromes.json",
    "title": "Rheumatology Vasculitis Syndromes",
    "count": 14,
    "category": "Medicine"
  },
  {
    "file": "RPGN.json",
    "title": "Rpgn",
    "count": 5,
    "category": "Medicine"
  },
  {
    "file": "Sarcoidosis.json",
    "title": "Sarcoidosis",
    "count": 10,
    "category": "Medicine"
  },
  {
    "file": "Seizures__Epilepsy_Part_1.json",
    "title": "Seizures  Epilepsy Part 1",
    "count": 10,
    "category": "Medicine"
  },
  {
    "file": "Seizures__Epilepsy_Part_2.json",
    "title": "Seizures  Epilepsy Part 2",
    "count": 17,
    "category": "Medicine"
  },
  {
    "file": "Seizures__Epilepsy_Part_3.json",
    "title": "Seizures  Epilepsy Part 3",
    "count": 5,
    "category": "Medicine"
  },
  {
    "file": "Seizures_Epilepsy__Meningitis.json",
    "title": "Seizures Epilepsy  Meningitis",
    "count": 15,
    "category": "Medicine"
  },
  {
    "file": "Serous_Otitis_Media_Som.json",
    "title": "Serous Otitis Media Som",
    "count": 7,
    "category": "Medicine"
  },
  {
    "file": "Sexually_Transmitted_Diseases.json",
    "title": "Sexually Transmitted Diseases",
    "count": 54,
    "category": "Medicine"
  },
  {
    "file": "Shock.json",
    "title": "Shock",
    "count": 13,
    "category": "Medicine"
  },
  {
    "file": "Shock__Sepsis_Part_6.json",
    "title": "Shock  Sepsis Part 6",
    "count": 34,
    "category": "Medicine"
  },
  {
    "file": "Small_Intestine_Various_Common_Small_Intestinal_Conditions.json",
    "title": "Small Intestine Various Common Small Intestinal Conditions",
    "count": 41,
    "category": "Medicine"
  },
  {
    "file": "Snakes.json",
    "title": "Snakes",
    "count": 10,
    "category": "Medicine"
  },
  {
    "file": "Specific_Nerve_Injuries_Part-2.json",
    "title": "Specific Nerve Injuries Part 2",
    "count": 14,
    "category": "Medicine"
  },
  {
    "file": "Spinal_Cord_Disorder_Part_2.json",
    "title": "Spinal Cord Disorder Part 2",
    "count": 10,
    "category": "Medicine"
  },
  {
    "file": "STD.json",
    "title": "Std",
    "count": 34,
    "category": "Medicine"
  },
  {
    "file": "Stomach_Ulcer_Diseases.json",
    "title": "Stomach Ulcer Diseases",
    "count": 28,
    "category": "Medicine"
  },
  {
    "file": "Stomach_Upper_GI_Bleed.json",
    "title": "Stomach Upper Gi Bleed",
    "count": 14,
    "category": "Medicine"
  },
  {
    "file": "Stroke_-_Acute_Ischemic_Stroke_Part_3.json",
    "title": "Stroke   Acute Ischemic Stroke Part 3",
    "count": 17,
    "category": "Medicine"
  },
  {
    "file": "Stroke_-_Acute_Ischemic_Stroke_Part_4.json",
    "title": "Stroke   Acute Ischemic Stroke Part 4",
    "count": 3,
    "category": "Medicine"
  },
  {
    "file": "Stroke_-_Hemorrhagic_Stroke_Part_5.json",
    "title": "Stroke   Hemorrhagic Stroke Part 5",
    "count": 10,
    "category": "Medicine"
  },
  {
    "file": "Stroke_-_Stroke_Syndromes_Part_1.json",
    "title": "Stroke   Stroke Syndromes Part 1",
    "count": 12,
    "category": "Medicine"
  },
  {
    "file": "Stroke_-_Stroke_Syndromes_Part_2.json",
    "title": "Stroke   Stroke Syndromes Part 2",
    "count": 6,
    "category": "Medicine"
  },
  {
    "file": "SWT-Medicine-1-SET-A_Disorders_of_the_Cardiovascular_System__Disorders_of_the_Respiratory_System.json",
    "title": "Swt Medicine 1 Set A Disorders Of The Cardiovascular System  Disorders Of The Respiratory System",
    "count": 200,
    "category": "Medicine"
  },
  {
    "file": "SWT-Medicine-2-SET-A_Disorders_of_the_kidney_and_urinary_tract__Disorders_of_the_gastrointestina.json",
    "title": "Swt Medicine 2 Set A Disorders Of The Kidney And Urinary Tract  Disorders Of The Gastrointestina",
    "count": 195,
    "category": "Medicine"
  },
  {
    "file": "SWT-Medicine-SET-B.json",
    "title": "Swt Medicine Set B",
    "count": 200,
    "category": "Medicine"
  },
  {
    "file": "Systemic_Review_and_Meta_Analysis.json",
    "title": "Systemic Review And Meta Analysis",
    "count": 5,
    "category": "Medicine"
  },
  {
    "file": "Thorax_and_Mediastinum.json",
    "title": "Thorax And Mediastinum",
    "count": 6,
    "category": "Medicine"
  },
  {
    "file": "Thyroid.json",
    "title": "Thyroid",
    "count": 75,
    "category": "Medicine"
  },
  {
    "file": "Thyroid_-_Benign_Thyroid_Disorders_Part_2.json",
    "title": "Thyroid   Benign Thyroid Disorders Part 2",
    "count": 16,
    "category": "Medicine"
  },
  {
    "file": "Thyroid_-_Thyroid_Neoplasm_Part_3.json",
    "title": "Thyroid   Thyroid Neoplasm Part 3",
    "count": 23,
    "category": "Medicine"
  },
  {
    "file": "Thyroid_1.json",
    "title": "Thyroid 1",
    "count": 8,
    "category": "Medicine"
  },
  {
    "file": "Thyroid_Part_1.json",
    "title": "Thyroid Part 1",
    "count": 14,
    "category": "Medicine"
  },
  {
    "file": "Thyroid_Part_2.json",
    "title": "Thyroid Part 2",
    "count": 17,
    "category": "Medicine"
  },
  {
    "file": "Thyroid_Part_3.json",
    "title": "Thyroid Part 3",
    "count": 22,
    "category": "Medicine"
  },
  {
    "file": "Transfusion_Medicine.json",
    "title": "Transfusion Medicine",
    "count": 20,
    "category": "Medicine"
  },
  {
    "file": "Triage.json",
    "title": "Triage",
    "count": 1,
    "category": "Medicine"
  },
  {
    "file": "Tuberculosis_1.json",
    "title": "Tuberculosis 1",
    "count": 6,
    "category": "Medicine"
  },
  {
    "file": "Urethritis.json",
    "title": "Urethritis",
    "count": 14,
    "category": "Medicine"
  },
  {
    "file": "Urinalysis.json",
    "title": "Urinalysis",
    "count": 13,
    "category": "Medicine"
  },
  {
    "file": "Valvular_Heart_Disease_-_Aortic_Regurgitation.json",
    "title": "Valvular Heart Disease   Aortic Regurgitation",
    "count": 13,
    "category": "Medicine"
  },
  {
    "file": "Valvular_Heart_Disease_-_Aortic_Stenosis.json",
    "title": "Valvular Heart Disease   Aortic Stenosis",
    "count": 9,
    "category": "Medicine"
  },
  {
    "file": "Valvular_Heart_Disease_-_Mitral_Regurgitation.json",
    "title": "Valvular Heart Disease   Mitral Regurgitation",
    "count": 19,
    "category": "Medicine"
  },
  {
    "file": "Valvular_Heart_Disease_-_Mitral_Stenosis.json",
    "title": "Valvular Heart Disease   Mitral Stenosis",
    "count": 14,
    "category": "Medicine"
  },
  {
    "file": "Venous_Thrombosis.json",
    "title": "Venous Thrombosis",
    "count": 42,
    "category": "Medicine"
  },
  {
    "file": "Vitamins-Previous_Year_Questions.json",
    "title": "Vitamins Previous Year Questions",
    "count": 59,
    "category": "Medicine"
  },
  {
    "file": "Wilsons_Disease.json",
    "title": "Wilsons Disease",
    "count": 8,
    "category": "Medicine"
  },
  {
    "file": "Acanthamoeba.json",
    "title": "Acanthamoeba",
    "count": 5,
    "category": "Microbiology"
  },
  {
    "file": "Anthrax.json",
    "title": "Anthrax",
    "count": 4,
    "category": "Microbiology"
  },
  {
    "file": "Antigen_-_Antibody_Reactions.json",
    "title": "Antigen   Antibody Reactions",
    "count": 22,
    "category": "Microbiology"
  },
  {
    "file": "Antigen__Antibody.json",
    "title": "Antigen  Antibody",
    "count": 22,
    "category": "Microbiology"
  },
  {
    "file": "Antimicrobial_Susceptibility_Testing__Genetics.json",
    "title": "Antimicrobial Susceptibility Testing  Genetics",
    "count": 22,
    "category": "Microbiology"
  },
  {
    "file": "Bacteria_causing_UTI.json",
    "title": "Bacteria Causing Uti",
    "count": 18,
    "category": "Microbiology"
  },
  {
    "file": "Bacterial_Atypical_Pneumonia.json",
    "title": "Bacterial Atypical Pneumonia",
    "count": 19,
    "category": "Microbiology"
  },
  {
    "file": "Bacterial_Infections.json",
    "title": "Bacterial Infections",
    "count": 13,
    "category": "Microbiology"
  },
  {
    "file": "Bacterial_Infections_1.json",
    "title": "Bacterial Infections 1",
    "count": 23,
    "category": "Microbiology"
  },
  {
    "file": "Bacterial_Infections_2.json",
    "title": "Bacterial Infections 2",
    "count": 13,
    "category": "Microbiology"
  },
  {
    "file": "Bacterial_Infections-Bacterial_Infections.json",
    "title": "Bacterial Infections Bacterial Infections",
    "count": 9,
    "category": "Microbiology"
  },
  {
    "file": "Bacterial_Infections_of_Skin.json",
    "title": "Bacterial Infections Of Skin",
    "count": 4,
    "category": "Microbiology"
  },
  {
    "file": "Bacterial_Meningitis.json",
    "title": "Bacterial Meningitis",
    "count": 22,
    "category": "Microbiology"
  },
  {
    "file": "Bacterial_Typical_Pneumonia.json",
    "title": "Bacterial Typical Pneumonia",
    "count": 6,
    "category": "Microbiology"
  },
  {
    "file": "Bacteriology.json",
    "title": "Bacteriology",
    "count": 311,
    "category": "Microbiology"
  },
  {
    "file": "Bacteriology_Part-1.json",
    "title": "Bacteriology Part 1",
    "count": 15,
    "category": "Microbiology"
  },
  {
    "file": "Bacteriology-Part-1.json",
    "title": "Bacteriology Part 1",
    "count": 184,
    "category": "Microbiology"
  },
  {
    "file": "Bacteriology_Part-2.json",
    "title": "Bacteriology Part 2",
    "count": 15,
    "category": "Microbiology"
  },
  {
    "file": "Bacteriology-Part-2.json",
    "title": "Bacteriology Part 2",
    "count": 203,
    "category": "Microbiology"
  },
  {
    "file": "Cholera.json",
    "title": "Cholera",
    "count": 12,
    "category": "Microbiology"
  },
  {
    "file": "Clinical_Microbiology.json",
    "title": "Clinical Microbiology",
    "count": 17,
    "category": "Microbiology"
  },
  {
    "file": "Clinical_Microbiology-Previous_Year_Questions.json",
    "title": "Clinical Microbiology Previous Year Questions",
    "count": 2,
    "category": "Microbiology"
  },
  {
    "file": "CNS_Infections.json",
    "title": "Cns Infections",
    "count": 14,
    "category": "Microbiology"
  },
  {
    "file": "Communicable_Diseases__Zoonotic_Diseases_Surface_Infections_Intestinal_Infections_STD.json",
    "title": "Communicable Diseases  Zoonotic Diseases Surface Infections Intestinal Infections Std",
    "count": 6,
    "category": "Microbiology"
  },
  {
    "file": "Diphtheria.json",
    "title": "Diphtheria",
    "count": 3,
    "category": "Microbiology"
  },
  {
    "file": "DNA_Viruses_Skin_Infections.json",
    "title": "Dna Viruses Skin Infections",
    "count": 22,
    "category": "Microbiology"
  },
  {
    "file": "E_Coli_Diarrhoeal_Disease.json",
    "title": "E Coli Diarrhoeal Disease",
    "count": 34,
    "category": "Microbiology"
  },
  {
    "file": "Fungal_infection.json",
    "title": "Fungal Infection",
    "count": 28,
    "category": "Microbiology"
  },
  {
    "file": "Fungal_Infections.json",
    "title": "Fungal Infections",
    "count": 40,
    "category": "Microbiology"
  },
  {
    "file": "Fungal_Infections-Fungal_Infections.json",
    "title": "Fungal Infections Fungal Infections",
    "count": 12,
    "category": "Microbiology"
  },
  {
    "file": "Fungal_Infections-Previous_Year_Questions.json",
    "title": "Fungal Infections Previous Year Questions",
    "count": 4,
    "category": "Microbiology"
  },
  {
    "file": "Fungal_Pneumonia-Part_2.json",
    "title": "Fungal Pneumonia Part 2",
    "count": 7,
    "category": "Microbiology"
  },
  {
    "file": "Gas_Gangrene.json",
    "title": "Gas Gangrene",
    "count": 7,
    "category": "Microbiology"
  },
  {
    "file": "General_Bacteriology_GB.json",
    "title": "General Bacteriology Gb",
    "count": 22,
    "category": "Microbiology"
  },
  {
    "file": "General_Microbiology.json",
    "title": "General Microbiology",
    "count": 16,
    "category": "Microbiology"
  },
  {
    "file": "General_Microbiology_1.json",
    "title": "General Microbiology 1",
    "count": 49,
    "category": "Microbiology"
  },
  {
    "file": "General_Microbiology_2.json",
    "title": "General Microbiology 2",
    "count": 96,
    "category": "Microbiology"
  },
  {
    "file": "General_Microbiology-Bacterial_genetics.json",
    "title": "General Microbiology Bacterial Genetics",
    "count": 7,
    "category": "Microbiology"
  },
  {
    "file": "General_Microbiology-Sterilization_and_Disinfection.json",
    "title": "General Microbiology Sterilization And Disinfection",
    "count": 14,
    "category": "Microbiology"
  },
  {
    "file": "General_Mycology.json",
    "title": "General Mycology",
    "count": 22,
    "category": "Microbiology"
  },
  {
    "file": "General_Parasitology_Part-1.json",
    "title": "General Parasitology Part 1",
    "count": 16,
    "category": "Microbiology"
  },
  {
    "file": "General_Virology_Part-1.json",
    "title": "General Virology Part 1",
    "count": 22,
    "category": "Microbiology"
  },
  {
    "file": "General_Virology_Part-2.json",
    "title": "General Virology Part 2",
    "count": 12,
    "category": "Microbiology"
  },
  {
    "file": "Hepatic_Fascioliasis.json",
    "title": "Hepatic Fascioliasis",
    "count": 6,
    "category": "Microbiology"
  },
  {
    "file": "Hepatitis_A__B.json",
    "title": "Hepatitis A  B",
    "count": 19,
    "category": "Microbiology"
  },
  {
    "file": "Hepatitis_B_Part_2.json",
    "title": "Hepatitis B Part 2",
    "count": 17,
    "category": "Microbiology"
  },
  {
    "file": "Hepatitis_C__E.json",
    "title": "Hepatitis C  E",
    "count": 14,
    "category": "Microbiology"
  },
  {
    "file": "HIV_-_Opportunistic_Infections_Part_2.json",
    "title": "Hiv   Opportunistic Infections Part 2",
    "count": 25,
    "category": "Microbiology"
  },
  {
    "file": "HIV_Part_1.json",
    "title": "Hiv Part 1",
    "count": 20,
    "category": "Microbiology"
  },
  {
    "file": "Hospital_Infection_Control.json",
    "title": "Hospital Infection Control",
    "count": 16,
    "category": "Microbiology"
  },
  {
    "file": "Immunity_.json",
    "title": "Immunity ",
    "count": 28,
    "category": "Microbiology"
  },
  {
    "file": "Immunity_1.json",
    "title": "Immunity 1",
    "count": 50,
    "category": "Microbiology"
  },
  {
    "file": "Immunity_2.json",
    "title": "Immunity 2",
    "count": 50,
    "category": "Microbiology"
  },
  {
    "file": "Immunity-Immune_Tolerance_and_Autoimmune_Disease.json",
    "title": "Immunity Immune Tolerance And Autoimmune Disease",
    "count": 14,
    "category": "Microbiology"
  },
  {
    "file": "Immunity-Immunodeficiency_disorders.json",
    "title": "Immunity Immunodeficiency Disorders",
    "count": 17,
    "category": "Microbiology"
  },
  {
    "file": "Immunity-Types_of_Hypersensitivity_Reactions.json",
    "title": "Immunity Types Of Hypersensitivity Reactions",
    "count": 12,
    "category": "Microbiology"
  },
  {
    "file": "Immunology_1.json",
    "title": "Immunology 1",
    "count": 37,
    "category": "Microbiology"
  },
  {
    "file": "Immunology-Antigen__antibody_and_their_reactions.json",
    "title": "Immunology Antigen  Antibody And Their Reactions",
    "count": 21,
    "category": "Microbiology"
  },
  {
    "file": "Immunology-Hypersensitivity_reactions.json",
    "title": "Immunology Hypersensitivity Reactions",
    "count": 12,
    "category": "Microbiology"
  },
  {
    "file": "Immunology-Immunity.json",
    "title": "Immunology Immunity",
    "count": 16,
    "category": "Microbiology"
  },
  {
    "file": "Immunology-Transplant_immunology.json",
    "title": "Immunology Transplant Immunology",
    "count": 10,
    "category": "Microbiology"
  },
  {
    "file": "Infection.json",
    "title": "Infection",
    "count": 20,
    "category": "Microbiology"
  },
  {
    "file": "Infections.json",
    "title": "Infections",
    "count": 20,
    "category": "Microbiology"
  },
  {
    "file": "Infections_1.json",
    "title": "Infections 1",
    "count": 25,
    "category": "Microbiology"
  },
  {
    "file": "Infections-Aspergillosis__AIDS__and_COVID-19.json",
    "title": "Infections Aspergillosis  Aids  And Covid 19",
    "count": 20,
    "category": "Microbiology"
  },
  {
    "file": "Infections-PUO__Dengue__Nipah__Zika__and_Pneumocystis_jirovecii.json",
    "title": "Infections Puo  Dengue  Nipah  Zika  And Pneumocystis Jirovecii",
    "count": 15,
    "category": "Microbiology"
  },
  {
    "file": "Infectious_Diseases-Previous_Year_Questions.json",
    "title": "Infectious Diseases Previous Year Questions",
    "count": 42,
    "category": "Microbiology"
  },
  {
    "file": "Infectious_Disorders.json",
    "title": "Infectious Disorders",
    "count": 102,
    "category": "Microbiology"
  },
  {
    "file": "Introduction_to_Immune_System_Innate__Adaptive_Immunity.json",
    "title": "Introduction To Immune System Innate  Adaptive Immunity",
    "count": 21,
    "category": "Microbiology"
  },
  {
    "file": "Leprosy.json",
    "title": "Leprosy",
    "count": 6,
    "category": "Microbiology"
  },
  {
    "file": "Leprosy_1.json",
    "title": "Leprosy 1",
    "count": 6,
    "category": "Microbiology"
  },
  {
    "file": "Micriobiology_Dr_J_suriya_FMGE_CT.json",
    "title": "Micriobiology Dr J Suriya Fmge Ct",
    "count": 40,
    "category": "Microbiology"
  },
  {
    "file": "215_Microbiology.json",
    "title": "Microbiology",
    "count": 40,
    "category": "Microbiology"
  },
  {
    "file": "Microbiology.json",
    "title": "Microbiology",
    "count": 20,
    "category": "Microbiology"
  },
  {
    "file": "Microbiology_-_AIIMS_MAY_2018.json",
    "title": "Microbiology   Aiims May 2018",
    "count": 15,
    "category": "Microbiology"
  },
  {
    "file": "Microbiology_-_AIIMS_MAY_2019.json",
    "title": "Microbiology   Aiims May 2019",
    "count": 14,
    "category": "Microbiology"
  },
  {
    "file": "Microbiology_-_AIIMS_NOV_2018.json",
    "title": "Microbiology   Aiims Nov 2018",
    "count": 9,
    "category": "Microbiology"
  },
  {
    "file": "Microbiology_-_INI_CET_JULY_2021.json",
    "title": "Microbiology   Ini Cet July 2021",
    "count": 14,
    "category": "Microbiology"
  },
  {
    "file": "Microbiology_-_INI_CET_MAY_2022.json",
    "title": "Microbiology   Ini Cet May 2022",
    "count": 9,
    "category": "Microbiology"
  },
  {
    "file": "Microbiology_-_INI_CET_NOV_2020.json",
    "title": "Microbiology   Ini Cet Nov 2020",
    "count": 12,
    "category": "Microbiology"
  },
  {
    "file": "Microbiology_-_INI_CET_NOV_2021.json",
    "title": "Microbiology   Ini Cet Nov 2021",
    "count": 11,
    "category": "Microbiology"
  },
  {
    "file": "Microbiology_-_INI_CET_NOV_2022_PART_A.json",
    "title": "Microbiology   Ini Cet Nov 2022 Part A",
    "count": 12,
    "category": "Microbiology"
  },
  {
    "file": "Microbiology_-_INI_CET_NOV_2022_PART_B.json",
    "title": "Microbiology   Ini Cet Nov 2022 Part B",
    "count": 11,
    "category": "Microbiology"
  },
  {
    "file": "Microbiology_-_INI_CET_NOV_2023.json",
    "title": "Microbiology   Ini Cet Nov 2023",
    "count": 18,
    "category": "Microbiology"
  },
  {
    "file": "Microbiology_-_INICET_MAY_2024.json",
    "title": "Microbiology   Inicet May 2024",
    "count": 13,
    "category": "Microbiology"
  },
  {
    "file": "Microbiology_-_NEET_PG_2018.json",
    "title": "Microbiology   Neet Pg 2018",
    "count": 11,
    "category": "Microbiology"
  },
  {
    "file": "Microbiology_-_NEET_PG_2020.json",
    "title": "Microbiology   Neet Pg 2020",
    "count": 19,
    "category": "Microbiology"
  },
  {
    "file": "Microbiology_-_NEET_PG_2021.json",
    "title": "Microbiology   Neet Pg 2021",
    "count": 14,
    "category": "Microbiology"
  },
  {
    "file": "Microbiology_-_NEET_PG_2022.json",
    "title": "Microbiology   Neet Pg 2022",
    "count": 17,
    "category": "Microbiology"
  },
  {
    "file": "Microbiology-_Class_Test_With_Video_Solution.json",
    "title": "Microbiology  Class Test With Video Solution",
    "count": 100,
    "category": "Microbiology"
  },
  {
    "file": "Microbiology_1.json",
    "title": "Microbiology 1",
    "count": 20,
    "category": "Microbiology"
  },
  {
    "file": "Microbiology_2.json",
    "title": "Microbiology 2",
    "count": 20,
    "category": "Microbiology"
  },
  {
    "file": "Microbiology_Clinical_Vignettes_-_1.json",
    "title": "Microbiology Clinical Vignettes   1",
    "count": 104,
    "category": "Microbiology"
  },
  {
    "file": "Microbiology_Clinical_Vignettes_-_2.json",
    "title": "Microbiology Clinical Vignettes   2",
    "count": 80,
    "category": "Microbiology"
  },
  {
    "file": "Microbiology_Dr_J_Suria.json",
    "title": "Microbiology Dr J Suria",
    "count": 40,
    "category": "Microbiology"
  },
  {
    "file": "Microbiology_Dr_J_Suria-2026.json",
    "title": "Microbiology Dr J Suria 2026",
    "count": 100,
    "category": "Microbiology"
  },
  {
    "file": "Microbiology_Dr_Jay_Suria-2026.json",
    "title": "Microbiology Dr Jay Suria 2026",
    "count": 200,
    "category": "Microbiology"
  },
  {
    "file": "Microbiology_DVT_Revision_Test.json",
    "title": "Microbiology Dvt Revision Test",
    "count": 25,
    "category": "Microbiology"
  },
  {
    "file": "Microbiology_ED_-_Mission_15_Lap_2_-_24-05-2024_-_2024-05-24.json",
    "title": "Microbiology Ed   Mission 15 Lap 2   24 05 2024   2024 05 24",
    "count": 75,
    "category": "Microbiology"
  },
  {
    "file": "Microbiology_ED_-_Mission_20_Batch_3_-_11-01-2025_-_2025-01-11.json",
    "title": "Microbiology Ed   Mission 20 Batch 3   11 01 2025   2025 01 11",
    "count": 75,
    "category": "Microbiology"
  },
  {
    "file": "Microbiology_ED_-_Mission_20_INICET_-_30-09-2024_-_2024-09-30.json",
    "title": "Microbiology Ed   Mission 20 Inicet   30 09 2024   2024 09 30",
    "count": 75,
    "category": "Microbiology"
  },
  {
    "file": "Microbiology_ED_-_Mission_20_Lap_2_-_05-05-2025_-_2025-05-05.json",
    "title": "Microbiology Ed   Mission 20 Lap 2   05 05 2025   2025 05 05",
    "count": 75,
    "category": "Microbiology"
  },
  {
    "file": "Microbiology_ED_-_Mission_NEET_PG_20_-_Final_Batch_-_15-06-2025_-_2025-06-15.json",
    "title": "Microbiology Ed   Mission Neet Pg 20   Final Batch   15 06 2025   2025 06 15",
    "count": 75,
    "category": "Microbiology"
  },
  {
    "file": "Microbiology_ED_Mission_NEET_PG_-_20-10-2023_-_2023-10-20.json",
    "title": "Microbiology Ed Mission Neet Pg   20 10 2023   2023 10 20",
    "count": 50,
    "category": "Microbiology"
  },
  {
    "file": "Microbiology_ED_Test-1_-_08-05-2023_-_2023-05-08.json",
    "title": "Microbiology Ed Test 1   08 05 2023   2023 05 08",
    "count": 50,
    "category": "Microbiology"
  },
  {
    "file": "Microbiology_ED_Test-2_-_13-05-2023_-_2023-05-13.json",
    "title": "Microbiology Ed Test 2   13 05 2023   2023 05 13",
    "count": 50,
    "category": "Microbiology"
  },
  {
    "file": "Microbiology_Image_Based_Question.json",
    "title": "Microbiology Image Based Question",
    "count": 20,
    "category": "Microbiology"
  },
  {
    "file": "Microbiology_J_Surya.json",
    "title": "Microbiology J Surya",
    "count": 75,
    "category": "Microbiology"
  },
  {
    "file": "Microbiology_Last_Month_ED_-_30-07-2024_-_2024-07-30.json",
    "title": "Microbiology Last Month Ed   30 07 2024   2024 07 30",
    "count": 30,
    "category": "Microbiology"
  },
  {
    "file": "Microbiology_MIQ_Series.json",
    "title": "Microbiology Miq Series",
    "count": 20,
    "category": "Microbiology"
  },
  {
    "file": "Microbiology_New_Season.json",
    "title": "Microbiology New Season",
    "count": 25,
    "category": "Microbiology"
  },
  {
    "file": "Microbiology-Previous_Year_Questions.json",
    "title": "Microbiology Previous Year Questions",
    "count": 1,
    "category": "Microbiology"
  },
  {
    "file": "Microbiology_Test_The_Champion_Batch_Hyderabad_-_02-01-2025_-_2025-01-02.json",
    "title": "Microbiology Test The Champion Batch Hyderabad   02 01 2025   2025 01 02",
    "count": 75,
    "category": "Microbiology"
  },
  {
    "file": "Microbiology_Test_The_Champion_Batch_Hyderabad_-_12-06-2025_-_2025-06-12.json",
    "title": "Microbiology Test The Champion Batch Hyderabad   12 06 2025   2025 06 12",
    "count": 75,
    "category": "Microbiology"
  },
  {
    "file": "Microbiology_Test_The_Champion_Batch_Hyderabad_-_12-07-2024_-_2024-07-12.json",
    "title": "Microbiology Test The Champion Batch Hyderabad   12 07 2024   2024 07 12",
    "count": 75,
    "category": "Microbiology"
  },
  {
    "file": "Microscopy__Staining.json",
    "title": "Microscopy  Staining",
    "count": 23,
    "category": "Microbiology"
  },
  {
    "file": "Mid_Day_Module_Microbiology-1_-_2025-01-08.json",
    "title": "Mid Day Module Microbiology 1   2025 01 08",
    "count": 50,
    "category": "Microbiology"
  },
  {
    "file": "Mid_Day_Module_Microbiology-2_-_2025-01-09.json",
    "title": "Mid Day Module Microbiology 2   2025 01 09",
    "count": 50,
    "category": "Microbiology"
  },
  {
    "file": "Mid_Day_Module_Microbiology-3_-_2025-01-10.json",
    "title": "Mid Day Module Microbiology 3   2025 01 10",
    "count": 50,
    "category": "Microbiology"
  },
  {
    "file": "Mid_Day_Module_Microbiology-4_-_2025-01-11.json",
    "title": "Mid Day Module Microbiology 4   2025 01 11",
    "count": 50,
    "category": "Microbiology"
  },
  {
    "file": "Mid_Day_Module_Microbiology-5_-_2025-01-12.json",
    "title": "Mid Day Module Microbiology 5   2025 01 12",
    "count": 50,
    "category": "Microbiology"
  },
  {
    "file": "Miscellaneous_-_Slow_Viral_Diseases.json",
    "title": "Miscellaneous   Slow Viral Diseases",
    "count": 7,
    "category": "Microbiology"
  },
  {
    "file": "Miscellaneous__Fungal_Food_Poisoning.json",
    "title": "Miscellaneous  Fungal Food Poisoning",
    "count": 6,
    "category": "Microbiology"
  },
  {
    "file": "Morphology__Growth_of_Bacteria.json",
    "title": "Morphology  Growth Of Bacteria",
    "count": 22,
    "category": "Microbiology"
  },
  {
    "file": "Mycobacterial_Infections-Cutaneous_tuberculosis.json",
    "title": "Mycobacterial Infections Cutaneous Tuberculosis",
    "count": 10,
    "category": "Microbiology"
  },
  {
    "file": "Mycobacterial_Infections-Leprosy.json",
    "title": "Mycobacterial Infections Leprosy",
    "count": 10,
    "category": "Microbiology"
  },
  {
    "file": "Mycology.json",
    "title": "Mycology",
    "count": 15,
    "category": "Microbiology"
  },
  {
    "file": "Mycology_1.json",
    "title": "Mycology 1",
    "count": 62,
    "category": "Microbiology"
  },
  {
    "file": "Mycology_2.json",
    "title": "Mycology 2",
    "count": 72,
    "category": "Microbiology"
  },
  {
    "file": "Mycology-Introduction_to_Mycology_and_its_Classification.json",
    "title": "Mycology Introduction To Mycology And Its Classification",
    "count": 12,
    "category": "Microbiology"
  },
  {
    "file": "Mycology-Opportunistic_infections.json",
    "title": "Mycology Opportunistic Infections",
    "count": 17,
    "category": "Microbiology"
  },
  {
    "file": "Mycology-Superficial_and_subcutaneous_mycosis__and_dimorphic_fungi.json",
    "title": "Mycology Superficial And Subcutaneous Mycosis  And Dimorphic Fungi",
    "count": 20,
    "category": "Microbiology"
  },
  {
    "file": "Neutrophil_Extracellular_Traps.json",
    "title": "Neutrophil Extracellular Traps",
    "count": 1,
    "category": "Microbiology"
  },
  {
    "file": "Nocardiosis.json",
    "title": "Nocardiosis",
    "count": 4,
    "category": "Microbiology"
  },
  {
    "file": "Parasitic_Diseases.json",
    "title": "Parasitic Diseases",
    "count": 11,
    "category": "Microbiology"
  },
  {
    "file": "Parasitic_Encephalitis.json",
    "title": "Parasitic Encephalitis",
    "count": 12,
    "category": "Microbiology"
  },
  {
    "file": "Parasitic_Infection.json",
    "title": "Parasitic Infection",
    "count": 9,
    "category": "Microbiology"
  },
  {
    "file": "Parasitic_Pneumonia.json",
    "title": "Parasitic Pneumonia",
    "count": 7,
    "category": "Microbiology"
  },
  {
    "file": "Parasitology.json",
    "title": "Parasitology",
    "count": 70,
    "category": "Microbiology"
  },
  {
    "file": "Parasitology_1.json",
    "title": "Parasitology 1",
    "count": 83,
    "category": "Microbiology"
  },
  {
    "file": "Parasitology-Cestodes.json",
    "title": "Parasitology Cestodes",
    "count": 19,
    "category": "Microbiology"
  },
  {
    "file": "Parasitology-Coccidian_parasites__Plasmodium___Babesia.json",
    "title": "Parasitology Coccidian Parasites  Plasmodium   Babesia",
    "count": 20,
    "category": "Microbiology"
  },
  {
    "file": "Parasitology-Flagellates___Hemoflagellates.json",
    "title": "Parasitology Flagellates   Hemoflagellates",
    "count": 24,
    "category": "Microbiology"
  },
  {
    "file": "Parasitology-Nematodes.json",
    "title": "Parasitology Nematodes",
    "count": 25,
    "category": "Microbiology"
  },
  {
    "file": "Parasitology-Parasitology_-_Classification___Amoeba.json",
    "title": "Parasitology Parasitology   Classification   Amoeba",
    "count": 12,
    "category": "Microbiology"
  },
  {
    "file": "Parasitology_Part_1.json",
    "title": "Parasitology Part 1",
    "count": 15,
    "category": "Microbiology"
  },
  {
    "file": "Parasitology_Part_2.json",
    "title": "Parasitology Part 2",
    "count": 15,
    "category": "Microbiology"
  },
  {
    "file": "Parasitology-Previous_Year_Questions.json",
    "title": "Parasitology Previous Year Questions",
    "count": 94,
    "category": "Microbiology"
  },
  {
    "file": "Parasitology-Trematodes.json",
    "title": "Parasitology Trematodes",
    "count": 12,
    "category": "Microbiology"
  },
  {
    "file": "Plague.json",
    "title": "Plague",
    "count": 3,
    "category": "Microbiology"
  },
  {
    "file": "Rickettsia__Related_Diseases.json",
    "title": "Rickettsia  Related Diseases",
    "count": 24,
    "category": "Microbiology"
  },
  {
    "file": "RNA_Corona_Virus.json",
    "title": "Rna Corona Virus",
    "count": 14,
    "category": "Microbiology"
  },
  {
    "file": "RNA_Viruses_Skin_Infections.json",
    "title": "Rna Viruses Skin Infections",
    "count": 22,
    "category": "Microbiology"
  },
  {
    "file": "Sexually_Transmitted_Infections.json",
    "title": "Sexually Transmitted Infections",
    "count": 4,
    "category": "Microbiology"
  },
  {
    "file": "Sexually_Transmitted_Infections-Genital_Ulcer_Disease_and_STD_Discharge.json",
    "title": "Sexually Transmitted Infections Genital Ulcer Disease And Std Discharge",
    "count": 17,
    "category": "Microbiology"
  },
  {
    "file": "Specific_Vaccines_Vaccines_in_Special_Situations__Cold_Storage_of_Vaccines.json",
    "title": "Specific Vaccines Vaccines In Special Situations  Cold Storage Of Vaccines",
    "count": 14,
    "category": "Microbiology"
  },
  {
    "file": "Staphylococcal_Skin_Infections.json",
    "title": "Staphylococcal Skin Infections",
    "count": 22,
    "category": "Microbiology"
  },
  {
    "file": "Sterilization__Disinfection_Chemical_method.json",
    "title": "Sterilization  Disinfection Chemical Method",
    "count": 20,
    "category": "Microbiology"
  },
  {
    "file": "Sterilization__Disinfection_Physical_method.json",
    "title": "Sterilization  Disinfection Physical Method",
    "count": 16,
    "category": "Microbiology"
  },
  {
    "file": "Streptococcal_Skin_Infections.json",
    "title": "Streptococcal Skin Infections",
    "count": 23,
    "category": "Microbiology"
  },
  {
    "file": "SWT-Microbiology-SET-A.json",
    "title": "Swt Microbiology Set A",
    "count": 200,
    "category": "Microbiology"
  },
  {
    "file": "SWT-Microbiology-SET-B.json",
    "title": "Swt Microbiology Set B",
    "count": 205,
    "category": "Microbiology"
  },
  {
    "file": "Systemic_Bacteriology-E_coli_and_shigella.json",
    "title": "Systemic Bacteriology E Coli And Shigella",
    "count": 8,
    "category": "Microbiology"
  },
  {
    "file": "Systemic_Bacteriology-Hemophillus__Bordatella__and_Brucella.json",
    "title": "Systemic Bacteriology Hemophillus  Bordatella  And Brucella",
    "count": 6,
    "category": "Microbiology"
  },
  {
    "file": "Systemic_Bacteriology-Klebsiella__Proteus__Yersinia__Salmonella.json",
    "title": "Systemic Bacteriology Klebsiella  Proteus  Yersinia  Salmonella",
    "count": 19,
    "category": "Microbiology"
  },
  {
    "file": "Systemic_Bacteriology-Miscellaneous_bacteria.json",
    "title": "Systemic Bacteriology Miscellaneous Bacteria",
    "count": 7,
    "category": "Microbiology"
  },
  {
    "file": "Systemic_Bacteriology-Mycobacterium.json",
    "title": "Systemic Bacteriology Mycobacterium",
    "count": 16,
    "category": "Microbiology"
  },
  {
    "file": "Systemic_Bacteriology-Previous_Year_Questions.json",
    "title": "Systemic Bacteriology Previous Year Questions",
    "count": 154,
    "category": "Microbiology"
  },
  {
    "file": "Systemic_Bacteriology-Spore_Forming_Bacteria.json",
    "title": "Systemic Bacteriology Spore Forming Bacteria",
    "count": 24,
    "category": "Microbiology"
  },
  {
    "file": "Systemic_Bacteriology-Staphylococcus__Streptococcus__and_Neisseria.json",
    "title": "Systemic Bacteriology Staphylococcus  Streptococcus  And Neisseria",
    "count": 25,
    "category": "Microbiology"
  },
  {
    "file": "Systemic_Bacteriology-Syphilis__Chlamydia_and_Rickettsiae.json",
    "title": "Systemic Bacteriology Syphilis  Chlamydia And Rickettsiae",
    "count": 27,
    "category": "Microbiology"
  },
  {
    "file": "T-20_Microbiology_Test-1_-_25-05-2023_-_2023-05-25.json",
    "title": "T 20 Microbiology Test 1   25 05 2023   2023 05 25",
    "count": 20,
    "category": "Microbiology"
  },
  {
    "file": "T-20_Microbiology_Test-2_-_01-06-2023_-_2023-06-01.json",
    "title": "T 20 Microbiology Test 2   01 06 2023   2023 06 01",
    "count": 20,
    "category": "Microbiology"
  },
  {
    "file": "T-20_Microbiology_Test-3_-_21-06-2023_-_2023-06-21.json",
    "title": "T 20 Microbiology Test 3   21 06 2023   2023 06 21",
    "count": 20,
    "category": "Microbiology"
  },
  {
    "file": "T-20_Microbiology_Test-5_-_26-07-2023_-_2023-07-26.json",
    "title": "T 20 Microbiology Test 5   26 07 2023   2023 07 26",
    "count": 20,
    "category": "Microbiology"
  },
  {
    "file": "T-20_Microbiology_Test-6_-_10-08-2023_-_2023-08-10.json",
    "title": "T 20 Microbiology Test 6   10 08 2023   2023 08 10",
    "count": 20,
    "category": "Microbiology"
  },
  {
    "file": "T-20_Microbiology_Test-7_-_18-08-2023_-_2023-08-18.json",
    "title": "T 20 Microbiology Test 7   18 08 2023   2023 08 18",
    "count": 20,
    "category": "Microbiology"
  },
  {
    "file": "TB.json",
    "title": "Tb",
    "count": 21,
    "category": "Microbiology"
  },
  {
    "file": "Tuberculosis.json",
    "title": "Tuberculosis",
    "count": 6,
    "category": "Microbiology"
  },
  {
    "file": "Typhoid_Fever.json",
    "title": "Typhoid Fever",
    "count": 9,
    "category": "Microbiology"
  },
  {
    "file": "Vaccine___Cold_Chain.json",
    "title": "Vaccine   Cold Chain",
    "count": 9,
    "category": "Microbiology"
  },
  {
    "file": "Vaccines.json",
    "title": "Vaccines",
    "count": 19,
    "category": "Microbiology"
  },
  {
    "file": "Vaccines_1.json",
    "title": "Vaccines 1",
    "count": 19,
    "category": "Microbiology"
  },
  {
    "file": "Vaccines_and_Cold_Chain.json",
    "title": "Vaccines And Cold Chain",
    "count": 35,
    "category": "Microbiology"
  },
  {
    "file": "Viral_Encephalitis.json",
    "title": "Viral Encephalitis",
    "count": 19,
    "category": "Microbiology"
  },
  {
    "file": "Viral_Hemorrhagic_Fever.json",
    "title": "Viral Hemorrhagic Fever",
    "count": 6,
    "category": "Microbiology"
  },
  {
    "file": "Viral_infection.json",
    "title": "Viral Infection",
    "count": 23,
    "category": "Microbiology"
  },
  {
    "file": "Viral_Infections.json",
    "title": "Viral Infections",
    "count": 30,
    "category": "Microbiology"
  },
  {
    "file": "Viral_Infections_1.json",
    "title": "Viral Infections 1",
    "count": 38,
    "category": "Microbiology"
  },
  {
    "file": "Viral_Infections-Previous_Year_Questions.json",
    "title": "Viral Infections Previous Year Questions",
    "count": 5,
    "category": "Microbiology"
  },
  {
    "file": "Viral_Infections-Viral_infections.json",
    "title": "Viral Infections Viral Infections",
    "count": 11,
    "category": "Microbiology"
  },
  {
    "file": "Viral_Meningitis.json",
    "title": "Viral Meningitis",
    "count": 10,
    "category": "Microbiology"
  },
  {
    "file": "Viral_Pneumonia-Part_1.json",
    "title": "Viral Pneumonia Part 1",
    "count": 8,
    "category": "Microbiology"
  },
  {
    "file": "Viral_Pneumonia-Part_2.json",
    "title": "Viral Pneumonia Part 2",
    "count": 13,
    "category": "Microbiology"
  },
  {
    "file": "Virology.json",
    "title": "Virology",
    "count": 212,
    "category": "Microbiology"
  },
  {
    "file": "Virology-Hepatitis_virus.json",
    "title": "Virology Hepatitis Virus",
    "count": 16,
    "category": "Microbiology"
  },
  {
    "file": "Virology-Herpesviridae.json",
    "title": "Virology Herpesviridae",
    "count": 15,
    "category": "Microbiology"
  },
  {
    "file": "Virology-Myxovirus.json",
    "title": "Virology Myxovirus",
    "count": 17,
    "category": "Microbiology"
  },
  {
    "file": "Virology-Other_RNA_viruses_and_COVID-19.json",
    "title": "Virology Other Rna Viruses And Covid 19",
    "count": 9,
    "category": "Microbiology"
  },
  {
    "file": "Virology_Part-1.json",
    "title": "Virology Part 1",
    "count": 108,
    "category": "Microbiology"
  },
  {
    "file": "Virology_Part_1.json",
    "title": "Virology Part 1",
    "count": 15,
    "category": "Microbiology"
  },
  {
    "file": "Virology_Part_2.json",
    "title": "Virology Part 2",
    "count": 15,
    "category": "Microbiology"
  },
  {
    "file": "Virology_Part-2.json",
    "title": "Virology Part 2",
    "count": 111,
    "category": "Microbiology"
  },
  {
    "file": "Virology-Parvoviridae__Poxviridae__Adenovirus.json",
    "title": "Virology Parvoviridae  Poxviridae  Adenovirus",
    "count": 12,
    "category": "Microbiology"
  },
  {
    "file": "Virology-Picornaviridae_and_Rhabdoviridae.json",
    "title": "Virology Picornaviridae And Rhabdoviridae",
    "count": 12,
    "category": "Microbiology"
  },
  {
    "file": "Virology-Previous_Year_Questions.json",
    "title": "Virology Previous Year Questions",
    "count": 95,
    "category": "Microbiology"
  },
  {
    "file": "Virology-RNA_Virology-_Arboviridae_and_Retroviridae.json",
    "title": "Virology Rna Virology  Arboviridae And Retroviridae",
    "count": 23,
    "category": "Microbiology"
  },
  {
    "file": "Virology-Virology_-_General_properties.json",
    "title": "Virology Virology   General Properties",
    "count": 16,
    "category": "Microbiology"
  },
  {
    "file": "Whooping_Cough.json",
    "title": "Whooping Cough",
    "count": 8,
    "category": "Microbiology"
  },
  {
    "file": "Abdnomal_Uterine_Bleeding.json",
    "title": "Abdnomal Uterine Bleeding",
    "count": 25,
    "category": "Obstetrics & Gynaecology"
  },
  {
    "file": "Abnormal_Labor.json",
    "title": "Abnormal Labor",
    "count": 95,
    "category": "Obstetrics & Gynaecology"
  },
  {
    "file": "Abnormal_Labor_1.json",
    "title": "Abnormal Labor 1",
    "count": 37,
    "category": "Obstetrics & Gynaecology"
  },
  {
    "file": "Abnormal_Pelvis.json",
    "title": "Abnormal Pelvis",
    "count": 5,
    "category": "Obstetrics & Gynaecology"
  },
  {
    "file": "Abnormal_Uterine_Bleeding.json",
    "title": "Abnormal Uterine Bleeding",
    "count": 8,
    "category": "Obstetrics & Gynaecology"
  },
  {
    "file": "Abnormalities_of_Labor-Previous_Year_Questions.json",
    "title": "Abnormalities Of Labor Previous Year Questions",
    "count": 16,
    "category": "Obstetrics & Gynaecology"
  },
  {
    "file": "Abortion.json",
    "title": "Abortion",
    "count": 4,
    "category": "Obstetrics & Gynaecology"
  },
  {
    "file": "Abortions.json",
    "title": "Abortions",
    "count": 20,
    "category": "Obstetrics & Gynaecology"
  },
  {
    "file": "Abruption.json",
    "title": "Abruption",
    "count": 5,
    "category": "Obstetrics & Gynaecology"
  },
  {
    "file": "Adnexal_Diseases.json",
    "title": "Adnexal Diseases",
    "count": 14,
    "category": "Obstetrics & Gynaecology"
  },
  {
    "file": "Adnexal_Mass_and_Gyne_Cancers.json",
    "title": "Adnexal Mass And Gyne Cancers",
    "count": 26,
    "category": "Obstetrics & Gynaecology"
  },
  {
    "file": "Amenorrhoea.json",
    "title": "Amenorrhoea",
    "count": 37,
    "category": "Obstetrics & Gynaecology"
  },
  {
    "file": "Amenorrhoea_1.json",
    "title": "Amenorrhoea 1",
    "count": 66,
    "category": "Obstetrics & Gynaecology"
  },
  {
    "file": "Amniotic_Fluid.json",
    "title": "Amniotic Fluid",
    "count": 13,
    "category": "Obstetrics & Gynaecology"
  },
  {
    "file": "Amniotic_Fluid__Its_Disorders.json",
    "title": "Amniotic Fluid  Its Disorders",
    "count": 23,
    "category": "Obstetrics & Gynaecology"
  },
  {
    "file": "Anemia_In_Pregnanacy.json",
    "title": "Anemia In Pregnanacy",
    "count": 8,
    "category": "Obstetrics & Gynaecology"
  },
  {
    "file": "Anemia_in_Pregnancy.json",
    "title": "Anemia In Pregnancy",
    "count": 12,
    "category": "Obstetrics & Gynaecology"
  },
  {
    "file": "Aneuploidy_Screening.json",
    "title": "Aneuploidy Screening",
    "count": 13,
    "category": "Obstetrics & Gynaecology"
  },
  {
    "file": "Anovulation__Hormonal_Disorders_and_Amenorrheas.json",
    "title": "Anovulation  Hormonal Disorders And Amenorrheas",
    "count": 14,
    "category": "Obstetrics & Gynaecology"
  },
  {
    "file": "Antenatal_Care.json",
    "title": "Antenatal Care",
    "count": 152,
    "category": "Obstetrics & Gynaecology"
  },
  {
    "file": "Antenatal_Fetal_Monitoring.json",
    "title": "Antenatal Fetal Monitoring",
    "count": 10,
    "category": "Obstetrics & Gynaecology"
  },
  {
    "file": "Antenatal_Hydronephrosis__Hemolytic_Uremic_Syndrome.json",
    "title": "Antenatal Hydronephrosis  Hemolytic Uremic Syndrome",
    "count": 10,
    "category": "Obstetrics & Gynaecology"
  },
  {
    "file": "Antenatal_Screening.json",
    "title": "Antenatal Screening",
    "count": 9,
    "category": "Obstetrics & Gynaecology"
  },
  {
    "file": "Antepartum_Hemorrhage.json",
    "title": "Antepartum Hemorrhage",
    "count": 21,
    "category": "Obstetrics & Gynaecology"
  },
  {
    "file": "Antepartum_Hemorrhage_and_Complications.json",
    "title": "Antepartum Hemorrhage And Complications",
    "count": 13,
    "category": "Obstetrics & Gynaecology"
  },
  {
    "file": "Artificial_Reproductive_Technology.json",
    "title": "Artificial Reproductive Technology",
    "count": 8,
    "category": "Obstetrics & Gynaecology"
  },
  {
    "file": "Basic_Obs_and_Gynae.json",
    "title": "Basic Obs And Gynae",
    "count": 44,
    "category": "Obstetrics & Gynaecology"
  },
  {
    "file": "Basics_of_Obstetrics-Previous_Year_Questions.json",
    "title": "Basics Of Obstetrics Previous Year Questions",
    "count": 36,
    "category": "Obstetrics & Gynaecology"
  },
  {
    "file": "Basics_Of_Pregnancy.json",
    "title": "Basics Of Pregnancy",
    "count": 24,
    "category": "Obstetrics & Gynaecology"
  },
  {
    "file": "Benign_Gynae_Disorders.json",
    "title": "Benign Gynae Disorders",
    "count": 49,
    "category": "Obstetrics & Gynaecology"
  },
  {
    "file": "Cervical_Cancer.json",
    "title": "Cervical Cancer",
    "count": 40,
    "category": "Obstetrics & Gynaecology"
  },
  {
    "file": "Cervical_Cancer_1.json",
    "title": "Cervical Cancer 1",
    "count": 29,
    "category": "Obstetrics & Gynaecology"
  },
  {
    "file": "Cervical_Incompetence.json",
    "title": "Cervical Incompetence",
    "count": 4,
    "category": "Obstetrics & Gynaecology"
  },
  {
    "file": "Cesarean_Section.json",
    "title": "Cesarean Section",
    "count": 10,
    "category": "Obstetrics & Gynaecology"
  },
  {
    "file": "Clinical_Approaches_to_Conditions_in_Reproductive_Age_Group-Previous_Year_Questions.json",
    "title": "Clinical Approaches To Conditions In Reproductive Age Group Previous Year Questions",
    "count": 4,
    "category": "Obstetrics & Gynaecology"
  },
  {
    "file": "Clinical_Conditions_of_Reproductive_Age_Group.json",
    "title": "Clinical Conditions Of Reproductive Age Group",
    "count": 25,
    "category": "Obstetrics & Gynaecology"
  },
  {
    "file": "Complications_Specific_to_Pregnancy.json",
    "title": "Complications Specific To Pregnancy",
    "count": 133,
    "category": "Obstetrics & Gynaecology"
  },
  {
    "file": "Congenital_Mullerian_Malformations.json",
    "title": "Congenital Mullerian Malformations",
    "count": 16,
    "category": "Obstetrics & Gynaecology"
  },
  {
    "file": "Contraception_and_MTP.json",
    "title": "Contraception And Mtp",
    "count": 67,
    "category": "Obstetrics & Gynaecology"
  },
  {
    "file": "Contraception-Contraception.json",
    "title": "Contraception Contraception",
    "count": 23,
    "category": "Obstetrics & Gynaecology"
  },
  {
    "file": "Contraception-Previous_Year_Questions.json",
    "title": "Contraception Previous Year Questions",
    "count": 21,
    "category": "Obstetrics & Gynaecology"
  },
  {
    "file": "Diabetes_In_Pregnancy.json",
    "title": "Diabetes In Pregnancy",
    "count": 17,
    "category": "Obstetrics & Gynaecology"
  },
  {
    "file": "Diabetes_in_Pregnancy.json",
    "title": "Diabetes In Pregnancy",
    "count": 20,
    "category": "Obstetrics & Gynaecology"
  },
  {
    "file": "Diagnosis_of_Pregnancy.json",
    "title": "Diagnosis Of Pregnancy",
    "count": 9,
    "category": "Obstetrics & Gynaecology"
  },
  {
    "file": "Diseases_of_Uterus.json",
    "title": "Diseases Of Uterus",
    "count": 12,
    "category": "Obstetrics & Gynaecology"
  },
  {
    "file": "Drugs_in_Obs.json",
    "title": "Drugs In Obs",
    "count": 10,
    "category": "Obstetrics & Gynaecology"
  },
  {
    "file": "Early_Pregnancy_Complications.json",
    "title": "Early Pregnancy Complications",
    "count": 121,
    "category": "Obstetrics & Gynaecology"
  },
  {
    "file": "Early_Pregnancy_Complications_-_Abortions-Previous_Year_Questions.json",
    "title": "Early Pregnancy Complications   Abortions Previous Year Questions",
    "count": 10,
    "category": "Obstetrics & Gynaecology"
  },
  {
    "file": "Early_Pregnancy_Complications_1.json",
    "title": "Early Pregnancy Complications 1",
    "count": 24,
    "category": "Obstetrics & Gynaecology"
  },
  {
    "file": "Early_Pregnancy_Complications-Previous_Year_Questions.json",
    "title": "Early Pregnancy Complications Previous Year Questions",
    "count": 13,
    "category": "Obstetrics & Gynaecology"
  },
  {
    "file": "Eclampsia.json",
    "title": "Eclampsia",
    "count": 23,
    "category": "Obstetrics & Gynaecology"
  },
  {
    "file": "Ectopic_Pregnancy.json",
    "title": "Ectopic Pregnancy",
    "count": 21,
    "category": "Obstetrics & Gynaecology"
  },
  {
    "file": "Ectopic_Pregnancy_1.json",
    "title": "Ectopic Pregnancy 1",
    "count": 24,
    "category": "Obstetrics & Gynaecology"
  },
  {
    "file": "Emergency_Contraception.json",
    "title": "Emergency Contraception",
    "count": 2,
    "category": "Obstetrics & Gynaecology"
  },
  {
    "file": "Endometrial_Cancer.json",
    "title": "Endometrial Cancer",
    "count": 24,
    "category": "Obstetrics & Gynaecology"
  },
  {
    "file": "Endometrial_Carcinoma.json",
    "title": "Endometrial Carcinoma",
    "count": 11,
    "category": "Obstetrics & Gynaecology"
  },
  {
    "file": "Endometriosis.json",
    "title": "Endometriosis",
    "count": 10,
    "category": "Obstetrics & Gynaecology"
  },
  {
    "file": "Endometriosis_1.json",
    "title": "Endometriosis 1",
    "count": 23,
    "category": "Obstetrics & Gynaecology"
  },
  {
    "file": "Endometriosis-Previous_Year_Questions.json",
    "title": "Endometriosis Previous Year Questions",
    "count": 5,
    "category": "Obstetrics & Gynaecology"
  },
  {
    "file": "Epithelial_Ovarian_Cancer.json",
    "title": "Epithelial Ovarian Cancer",
    "count": 22,
    "category": "Obstetrics & Gynaecology"
  },
  {
    "file": "Factors_Influencing_Labour__Power__Passenger.json",
    "title": "Factors Influencing Labour  Power  Passenger",
    "count": 12,
    "category": "Obstetrics & Gynaecology"
  },
  {
    "file": "Female_Infertility.json",
    "title": "Female Infertility",
    "count": 71,
    "category": "Obstetrics & Gynaecology"
  },
  {
    "file": "Female_Infertility_1.json",
    "title": "Female Infertility 1",
    "count": 22,
    "category": "Obstetrics & Gynaecology"
  },
  {
    "file": "Fertilisation_and_implantation.json",
    "title": "Fertilisation And Implantation",
    "count": 8,
    "category": "Obstetrics & Gynaecology"
  },
  {
    "file": "Fertilization__Implantation.json",
    "title": "Fertilization  Implantation",
    "count": 6,
    "category": "Obstetrics & Gynaecology"
  },
  {
    "file": "Fetal_Monitoring.json",
    "title": "Fetal Monitoring",
    "count": 12,
    "category": "Obstetrics & Gynaecology"
  },
  {
    "file": "Fetal_Skull.json",
    "title": "Fetal Skull",
    "count": 5,
    "category": "Obstetrics & Gynaecology"
  },
  {
    "file": "Fibroid.json",
    "title": "Fibroid",
    "count": 26,
    "category": "Obstetrics & Gynaecology"
  },
  {
    "file": "Genital_Fistula.json",
    "title": "Genital Fistula",
    "count": 8,
    "category": "Obstetrics & Gynaecology"
  },
  {
    "file": "Genital_Infections-Previous_Year_Questions.json",
    "title": "Genital Infections Previous Year Questions",
    "count": 26,
    "category": "Obstetrics & Gynaecology"
  },
  {
    "file": "Genital_Prolapse.json",
    "title": "Genital Prolapse",
    "count": 23,
    "category": "Obstetrics & Gynaecology"
  },
  {
    "file": "Genital_Ulcerative_Diseases.json",
    "title": "Genital Ulcerative Diseases",
    "count": 20,
    "category": "Obstetrics & Gynaecology"
  },
  {
    "file": "Gestational_Trophoblastic_Neoplasia.json",
    "title": "Gestational Trophoblastic Neoplasia",
    "count": 6,
    "category": "Obstetrics & Gynaecology"
  },
  {
    "file": "Gynae_Oncology.json",
    "title": "Gynae Oncology",
    "count": 99,
    "category": "Obstetrics & Gynaecology"
  },
  {
    "file": "Gynaecology.json",
    "title": "Gynaecology",
    "count": 15,
    "category": "Obstetrics & Gynaecology"
  },
  {
    "file": "Gynaecology_AIIMS_2014-2018.json",
    "title": "Gynaecology Aiims 2014 2018",
    "count": 75,
    "category": "Obstetrics & Gynaecology"
  },
  {
    "file": "Gynaecology_Dr_Deepti.json",
    "title": "Gynaecology Dr Deepti",
    "count": 50,
    "category": "Obstetrics & Gynaecology"
  },
  {
    "file": "Gynaecology_Dr_Deepti__FMGE_CT.json",
    "title": "Gynaecology Dr Deepti  Fmge Ct",
    "count": 50,
    "category": "Obstetrics & Gynaecology"
  },
  {
    "file": "Gynaecology_Dr_Deepti-2026.json",
    "title": "Gynaecology Dr Deepti 2026",
    "count": 75,
    "category": "Obstetrics & Gynaecology"
  },
  {
    "file": "Gynaecology_IBQ.json",
    "title": "Gynaecology Ibq",
    "count": 20,
    "category": "Obstetrics & Gynaecology"
  },
  {
    "file": "Gynaecology_Image_based_questions.json",
    "title": "Gynaecology Image Based Questions",
    "count": 70,
    "category": "Obstetrics & Gynaecology"
  },
  {
    "file": "Gynecology-AUB__Hirsutism_and_Adnexal_Mass.json",
    "title": "Gynecology Aub  Hirsutism And Adnexal Mass",
    "count": 20,
    "category": "Obstetrics & Gynaecology"
  },
  {
    "file": "Gynecology-Cervical_Carcinoma.json",
    "title": "Gynecology Cervical Carcinoma",
    "count": 30,
    "category": "Obstetrics & Gynaecology"
  },
  {
    "file": "Gynecology-Disorders_of_Puberty__Amenorrhea__Menopause.json",
    "title": "Gynecology Disorders Of Puberty  Amenorrhea  Menopause",
    "count": 16,
    "category": "Obstetrics & Gynaecology"
  },
  {
    "file": "Gynecology_Dr_Deepti.json",
    "title": "Gynecology Dr Deepti",
    "count": 45,
    "category": "Obstetrics & Gynaecology"
  },
  {
    "file": "Gynecology-Embryology_and_Associated_Disorders.json",
    "title": "Gynecology Embryology And Associated Disorders",
    "count": 12,
    "category": "Obstetrics & Gynaecology"
  },
  {
    "file": "Gynecology-Endometrial_Carcinoma.json",
    "title": "Gynecology Endometrial Carcinoma",
    "count": 12,
    "category": "Obstetrics & Gynaecology"
  },
  {
    "file": "Gynecology-Endometriosis___Adenomyosis.json",
    "title": "Gynecology Endometriosis   Adenomyosis",
    "count": 14,
    "category": "Obstetrics & Gynaecology"
  },
  {
    "file": "Gynecology-Fibroids_and_Polyps.json",
    "title": "Gynecology Fibroids And Polyps",
    "count": 21,
    "category": "Obstetrics & Gynaecology"
  },
  {
    "file": "Gynecology-Infertility.json",
    "title": "Gynecology Infertility",
    "count": 21,
    "category": "Obstetrics & Gynaecology"
  },
  {
    "file": "Gynecology-Menstrual_Physiology.json",
    "title": "Gynecology Menstrual Physiology",
    "count": 21,
    "category": "Obstetrics & Gynaecology"
  },
  {
    "file": "Gynecology-Ovarian_Tumors.json",
    "title": "Gynecology Ovarian Tumors",
    "count": 20,
    "category": "Obstetrics & Gynaecology"
  },
  {
    "file": "Gynecology-Pelvic_Inflammatory_Disease.json",
    "title": "Gynecology Pelvic Inflammatory Disease",
    "count": 20,
    "category": "Obstetrics & Gynaecology"
  },
  {
    "file": "Gynecology-Pelvic_Organ_Prolapse.json",
    "title": "Gynecology Pelvic Organ Prolapse",
    "count": 20,
    "category": "Obstetrics & Gynaecology"
  },
  {
    "file": "Gynecology-Pelvis__Perineum_and_Pelvic_diaphragm.json",
    "title": "Gynecology Pelvis  Perineum And Pelvic Diaphragm",
    "count": 15,
    "category": "Obstetrics & Gynaecology"
  },
  {
    "file": "Gynecology-Polycystic_Ovarian_Syndrome.json",
    "title": "Gynecology Polycystic Ovarian Syndrome",
    "count": 8,
    "category": "Obstetrics & Gynaecology"
  },
  {
    "file": "Gynecology-Previous_Year_Questions.json",
    "title": "Gynecology Previous Year Questions",
    "count": 181,
    "category": "Obstetrics & Gynaecology"
  },
  {
    "file": "Gynecology-Urinary_Incontinence_and_Fistulas.json",
    "title": "Gynecology Urinary Incontinence And Fistulas",
    "count": 12,
    "category": "Obstetrics & Gynaecology"
  },
  {
    "file": "Gynecology-Vaginitis_and_Syndromic_approach_for_Vaginal_discharge.json",
    "title": "Gynecology Vaginitis And Syndromic Approach For Vaginal Discharge",
    "count": 12,
    "category": "Obstetrics & Gynaecology"
  },
  {
    "file": "Gynecology-Vulval_and_Vaginal_Malignancy.json",
    "title": "Gynecology Vulval And Vaginal Malignancy",
    "count": 16,
    "category": "Obstetrics & Gynaecology"
  },
  {
    "file": "Gynecology-Vulval_Infections_and_Genital_TB.json",
    "title": "Gynecology Vulval Infections And Genital Tb",
    "count": 12,
    "category": "Obstetrics & Gynaecology"
  },
  {
    "file": "Heart_Disease_During_Pregnancy.json",
    "title": "Heart Disease During Pregnancy",
    "count": 12,
    "category": "Obstetrics & Gynaecology"
  },
  {
    "file": "Heart_Diseases_In_Pregnancy.json",
    "title": "Heart Diseases In Pregnancy",
    "count": 12,
    "category": "Obstetrics & Gynaecology"
  },
  {
    "file": "Hellp_syndrome.json",
    "title": "Hellp Syndrome",
    "count": 2,
    "category": "Obstetrics & Gynaecology"
  },
  {
    "file": "High_Risk_Obstetrics.json",
    "title": "High Risk Obstetrics",
    "count": 9,
    "category": "Obstetrics & Gynaecology"
  },
  {
    "file": "High_Risk_Pregnancy-Previous_Year_Questions.json",
    "title": "High Risk Pregnancy Previous Year Questions",
    "count": 40,
    "category": "Obstetrics & Gynaecology"
  },
  {
    "file": "Hormonal_Contraception.json",
    "title": "Hormonal Contraception",
    "count": 14,
    "category": "Obstetrics & Gynaecology"
  },
  {
    "file": "Hypertension_During_Pregnancy.json",
    "title": "Hypertension During Pregnancy",
    "count": 18,
    "category": "Obstetrics & Gynaecology"
  },
  {
    "file": "Hypertensive_Disorders_of_Pregnancy-Previous_Year_Questions.json",
    "title": "Hypertensive Disorders Of Pregnancy Previous Year Questions",
    "count": 1,
    "category": "Obstetrics & Gynaecology"
  },
  {
    "file": "Imaging_in_Gynecology.json",
    "title": "Imaging In Gynecology",
    "count": 14,
    "category": "Obstetrics & Gynaecology"
  },
  {
    "file": "Impotency_Sterility_Virginity_Pregnancy_Delivery.json",
    "title": "Impotency Sterility Virginity Pregnancy Delivery",
    "count": 20,
    "category": "Obstetrics & Gynaecology"
  },
  {
    "file": "Induction_Of_Labor.json",
    "title": "Induction Of Labor",
    "count": 9,
    "category": "Obstetrics & Gynaecology"
  },
  {
    "file": "Infections_in_Gynecology.json",
    "title": "Infections In Gynecology",
    "count": 22,
    "category": "Obstetrics & Gynaecology"
  },
  {
    "file": "Infertility.json",
    "title": "Infertility",
    "count": 33,
    "category": "Obstetrics & Gynaecology"
  },
  {
    "file": "Jaundice_in_Pregnancy.json",
    "title": "Jaundice In Pregnancy",
    "count": 9,
    "category": "Obstetrics & Gynaecology"
  },
  {
    "file": "Labor_and_Delivery.json",
    "title": "Labor And Delivery",
    "count": 12,
    "category": "Obstetrics & Gynaecology"
  },
  {
    "file": "Labor_Normal.json",
    "title": "Labor Normal",
    "count": 53,
    "category": "Obstetrics & Gynaecology"
  },
  {
    "file": "Labour.json",
    "title": "Labour",
    "count": 38,
    "category": "Obstetrics & Gynaecology"
  },
  {
    "file": "Late_Night_PYQ_PYT_Marathon_OBG-1_-_2025-03-01.json",
    "title": "Late Night Pyq Pyt Marathon Obg 1   2025 03 01",
    "count": 60,
    "category": "Obstetrics & Gynaecology"
  },
  {
    "file": "Lesion_of_Cervix.json",
    "title": "Lesion Of Cervix",
    "count": 8,
    "category": "Obstetrics & Gynaecology"
  },
  {
    "file": "Live_Birth.json",
    "title": "Live Birth",
    "count": 6,
    "category": "Obstetrics & Gynaecology"
  },
  {
    "file": "Male_and_Female_Genital_Tract.json",
    "title": "Male And Female Genital Tract",
    "count": 36,
    "category": "Obstetrics & Gynaecology"
  },
  {
    "file": "Male_Infertility.json",
    "title": "Male Infertility",
    "count": 17,
    "category": "Obstetrics & Gynaecology"
  },
  {
    "file": "Malposition.json",
    "title": "Malposition",
    "count": 12,
    "category": "Obstetrics & Gynaecology"
  },
  {
    "file": "Maternal__Child_Health_1.json",
    "title": "Maternal  Child Health 1",
    "count": 50,
    "category": "Obstetrics & Gynaecology"
  },
  {
    "file": "Menopause.json",
    "title": "Menopause",
    "count": 12,
    "category": "Obstetrics & Gynaecology"
  },
  {
    "file": "Menopause_1.json",
    "title": "Menopause 1",
    "count": 13,
    "category": "Obstetrics & Gynaecology"
  },
  {
    "file": "Menopause_And_HRT.json",
    "title": "Menopause And Hrt",
    "count": 17,
    "category": "Obstetrics & Gynaecology"
  },
  {
    "file": "Menopause-Previous_Year_Questions.json",
    "title": "Menopause Previous Year Questions",
    "count": 2,
    "category": "Obstetrics & Gynaecology"
  },
  {
    "file": "Mid_Day_Module_OBG-1_-_2025-03-02.json",
    "title": "Mid Day Module Obg 1   2025 03 02",
    "count": 50,
    "category": "Obstetrics & Gynaecology"
  },
  {
    "file": "Mid_Day_Module_OBG-2_-_2025-03-03.json",
    "title": "Mid Day Module Obg 2   2025 03 03",
    "count": 50,
    "category": "Obstetrics & Gynaecology"
  },
  {
    "file": "Mid_Day_Module_OBG-3_-_2025-03-04.json",
    "title": "Mid Day Module Obg 3   2025 03 04",
    "count": 50,
    "category": "Obstetrics & Gynaecology"
  },
  {
    "file": "Mid_Day_Module_OBG-4_-_2025-03-05.json",
    "title": "Mid Day Module Obg 4   2025 03 05",
    "count": 50,
    "category": "Obstetrics & Gynaecology"
  },
  {
    "file": "Mid_Day_Module_OBG-5_-_2025-03-07.json",
    "title": "Mid Day Module Obg 5   2025 03 07",
    "count": 50,
    "category": "Obstetrics & Gynaecology"
  },
  {
    "file": "Mid_Day_Module_OBG-6_-_2025-03-08.json",
    "title": "Mid Day Module Obg 6   2025 03 08",
    "count": 50,
    "category": "Obstetrics & Gynaecology"
  },
  {
    "file": "Mid_Day_Module_OBG-7_-_2025-03-09.json",
    "title": "Mid Day Module Obg 7   2025 03 09",
    "count": 50,
    "category": "Obstetrics & Gynaecology"
  },
  {
    "file": "Mid_Day_Module_OBGPedia-1_-_2025-03-10.json",
    "title": "Mid Day Module Obgpedia 1   2025 03 10",
    "count": 50,
    "category": "Obstetrics & Gynaecology"
  },
  {
    "file": "Miscarriage_Abortion.json",
    "title": "Miscarriage Abortion",
    "count": 11,
    "category": "Obstetrics & Gynaecology"
  },
  {
    "file": "Molar_Pregnancy.json",
    "title": "Molar Pregnancy",
    "count": 8,
    "category": "Obstetrics & Gynaecology"
  },
  {
    "file": "Molar_Pregnancy___GTN-Previous_Year_Questions.json",
    "title": "Molar Pregnancy   Gtn Previous Year Questions",
    "count": 9,
    "category": "Obstetrics & Gynaecology"
  },
  {
    "file": "Molar_Pregnancy_1.json",
    "title": "Molar Pregnancy 1",
    "count": 23,
    "category": "Obstetrics & Gynaecology"
  },
  {
    "file": "Mullerian_Anomalies.json",
    "title": "Mullerian Anomalies",
    "count": 19,
    "category": "Obstetrics & Gynaecology"
  },
  {
    "file": "Multiple_Pregnancy.json",
    "title": "Multiple Pregnancy",
    "count": 22,
    "category": "Obstetrics & Gynaecology"
  },
  {
    "file": "Natural_Family_Planning_Method_And_Barrier_Method.json",
    "title": "Natural Family Planning Method And Barrier Method",
    "count": 14,
    "category": "Obstetrics & Gynaecology"
  },
  {
    "file": "Normal_Labor-Previous_Year_Questions.json",
    "title": "Normal Labor Previous Year Questions",
    "count": 16,
    "category": "Obstetrics & Gynaecology"
  },
  {
    "file": "OBG_-_AIIMS_MAY_2018.json",
    "title": "Obg   Aiims May 2018",
    "count": 26,
    "category": "Obstetrics & Gynaecology"
  },
  {
    "file": "OBG_-_AIIMS_MAY_2019.json",
    "title": "Obg   Aiims May 2019",
    "count": 15,
    "category": "Obstetrics & Gynaecology"
  },
  {
    "file": "OBG_-_AIIMS_NOV_2016.json",
    "title": "Obg   Aiims Nov 2016",
    "count": 11,
    "category": "Obstetrics & Gynaecology"
  },
  {
    "file": "OBG_-_AIIMS_NOV_2018.json",
    "title": "Obg   Aiims Nov 2018",
    "count": 11,
    "category": "Obstetrics & Gynaecology"
  },
  {
    "file": "OBG_-_INI_CET_JULY_2021.json",
    "title": "Obg   Ini Cet July 2021",
    "count": 21,
    "category": "Obstetrics & Gynaecology"
  },
  {
    "file": "OBG_-_INI_CET_MAY_2022.json",
    "title": "Obg   Ini Cet May 2022",
    "count": 12,
    "category": "Obstetrics & Gynaecology"
  },
  {
    "file": "OBG_-_INI_CET_NOV_2020.json",
    "title": "Obg   Ini Cet Nov 2020",
    "count": 9,
    "category": "Obstetrics & Gynaecology"
  },
  {
    "file": "OBG_-_INI_CET_NOV_2021.json",
    "title": "Obg   Ini Cet Nov 2021",
    "count": 12,
    "category": "Obstetrics & Gynaecology"
  },
  {
    "file": "OBG_-_NEET_PG_2018.json",
    "title": "Obg   Neet Pg 2018",
    "count": 22,
    "category": "Obstetrics & Gynaecology"
  },
  {
    "file": "OBG_-_NEET_PG_2019.json",
    "title": "Obg   Neet Pg 2019",
    "count": 25,
    "category": "Obstetrics & Gynaecology"
  },
  {
    "file": "OBG_-_NEET_PG_2020.json",
    "title": "Obg   Neet Pg 2020",
    "count": 20,
    "category": "Obstetrics & Gynaecology"
  },
  {
    "file": "OBG_-_NEET_PG_2021.json",
    "title": "Obg   Neet Pg 2021",
    "count": 17,
    "category": "Obstetrics & Gynaecology"
  },
  {
    "file": "OBG_-_NEET_PG_2022.json",
    "title": "Obg   Neet Pg 2022",
    "count": 25,
    "category": "Obstetrics & Gynaecology"
  },
  {
    "file": "OBG_Basics.json",
    "title": "Obg Basics",
    "count": 18,
    "category": "Obstetrics & Gynaecology"
  },
  {
    "file": "OBG_ED_-_Mission_15_Lap_2_-_26-05-2024_-_2024-05-26.json",
    "title": "Obg Ed   Mission 15 Lap 2   26 05 2024   2024 05 26",
    "count": 100,
    "category": "Obstetrics & Gynaecology"
  },
  {
    "file": "OBG_ED_-_Mission_20_Batch_2_-_05-11-2024_-_2024-11-05.json",
    "title": "Obg Ed   Mission 20 Batch 2   05 11 2024   2024 11 05",
    "count": 100,
    "category": "Obstetrics & Gynaecology"
  },
  {
    "file": "OBG_ED_-_Mission_20_Batch_3_-_10-03-2025_-_2025-03-10.json",
    "title": "Obg Ed   Mission 20 Batch 3   10 03 2025   2025 03 10",
    "count": 81,
    "category": "Obstetrics & Gynaecology"
  },
  {
    "file": "OBG_ED_-_Mission_20_Lap_2_-_01-05-2025_-_2025-05-01.json",
    "title": "Obg Ed   Mission 20 Lap 2   01 05 2025   2025 05 01",
    "count": 100,
    "category": "Obstetrics & Gynaecology"
  },
  {
    "file": "OBG_ED_Mission_NEET_PG_-_04-08-2023_-_2023-08-04.json",
    "title": "Obg Ed Mission Neet Pg   04 08 2023   2023 08 04",
    "count": 75,
    "category": "Obstetrics & Gynaecology"
  },
  {
    "file": "OBG-INICET_NOV_2024.json",
    "title": "Obg Inicet Nov 2024",
    "count": 16,
    "category": "Obstetrics & Gynaecology"
  },
  {
    "file": "OBG_Last_Month_ED_-_26-07-2024_-_2024-07-26.json",
    "title": "Obg Last Month Ed   26 07 2024   2024 07 26",
    "count": 40,
    "category": "Obstetrics & Gynaecology"
  },
  {
    "file": "OBG-Pediatrics_10_BTR_Test_-_2023-09-19.json",
    "title": "Obg Pediatrics 10 Btr Test   2023 09 19",
    "count": 100,
    "category": "Obstetrics & Gynaecology"
  },
  {
    "file": "OBG_Test_The_Champion_Batch_Hyderabad_-_28-09-2024_-_2024-09-28.json",
    "title": "Obg Test The Champion Batch Hyderabad   28 09 2024   2024 09 28",
    "count": 75,
    "category": "Obstetrics & Gynaecology"
  },
  {
    "file": "OBGY_and_Breast_Imaging.json",
    "title": "Obgy And Breast Imaging",
    "count": 4,
    "category": "Obstetrics & Gynaecology"
  },
  {
    "file": "OBGy_Imaging-Obstetrics__Gynaecology__and_Breast_Imaging.json",
    "title": "Obgy Imaging Obstetrics  Gynaecology  And Breast Imaging",
    "count": 20,
    "category": "Obstetrics & Gynaecology"
  },
  {
    "file": "Obs__Gynaecology-_Class_Test_With_Video_Solution.json",
    "title": "Obs  Gynaecology  Class Test With Video Solution",
    "count": 100,
    "category": "Obstetrics & Gynaecology"
  },
  {
    "file": "Obstetric_Hemorrhage___Obstetric_Emergencies-Previous_Year_Questions.json",
    "title": "Obstetric Hemorrhage   Obstetric Emergencies Previous Year Questions",
    "count": 22,
    "category": "Obstetrics & Gynaecology"
  },
  {
    "file": "Obstetrics.json",
    "title": "Obstetrics",
    "count": 20,
    "category": "Obstetrics & Gynaecology"
  },
  {
    "file": "Obstetrics__Gynaecology.json",
    "title": "Obstetrics  Gynaecology",
    "count": 200,
    "category": "Obstetrics & Gynaecology"
  },
  {
    "file": "Obstetrics__Gynaecology_Dr_Deepti.json",
    "title": "Obstetrics  Gynaecology Dr Deepti",
    "count": 50,
    "category": "Obstetrics & Gynaecology"
  },
  {
    "file": "Obstetrics__Gynaecology_DVT_Revision_Test.json",
    "title": "Obstetrics  Gynaecology Dvt Revision Test",
    "count": 50,
    "category": "Obstetrics & Gynaecology"
  },
  {
    "file": "Obstetrics__Gynaecology_MIQ_Series.json",
    "title": "Obstetrics  Gynaecology Miq Series",
    "count": 25,
    "category": "Obstetrics & Gynaecology"
  },
  {
    "file": "Obstetrics__Gynecology_Dr_Anil-2026.json",
    "title": "Obstetrics  Gynecology Dr Anil 2026",
    "count": 200,
    "category": "Obstetrics & Gynaecology"
  },
  {
    "file": "Obstetrics__Gynecology_Dr_Anil-2026_1.json",
    "title": "Obstetrics  Gynecology Dr Anil 2026 1",
    "count": 200,
    "category": "Obstetrics & Gynaecology"
  },
  {
    "file": "Obstetrics__Image_Based_Question.json",
    "title": "Obstetrics  Image Based Question",
    "count": 70,
    "category": "Obstetrics & Gynaecology"
  },
  {
    "file": "Obstetrics-Abnormalities_in_Labor.json",
    "title": "Obstetrics Abnormalities In Labor",
    "count": 22,
    "category": "Obstetrics & Gynaecology"
  },
  {
    "file": "Obstetrics-Abortions.json",
    "title": "Obstetrics Abortions",
    "count": 13,
    "category": "Obstetrics & Gynaecology"
  },
  {
    "file": "Obstetrics_AIIMS_2014-2018.json",
    "title": "Obstetrics Aiims 2014 2018",
    "count": 89,
    "category": "Obstetrics & Gynaecology"
  },
  {
    "file": "Obstetrics-Amniotic_Fluid_Abnormalities.json",
    "title": "Obstetrics Amniotic Fluid Abnormalities",
    "count": 10,
    "category": "Obstetrics & Gynaecology"
  },
  {
    "file": "Obstetrics-Anemia_in_Pregnancy.json",
    "title": "Obstetrics Anemia In Pregnancy",
    "count": 15,
    "category": "Obstetrics & Gynaecology"
  },
  {
    "file": "Obstetrics-Antepartum_Haemorrhage.json",
    "title": "Obstetrics Antepartum Haemorrhage",
    "count": 13,
    "category": "Obstetrics & Gynaecology"
  },
  {
    "file": "Obstetrics-Cesarean_Delivery.json",
    "title": "Obstetrics Cesarean Delivery",
    "count": 17,
    "category": "Obstetrics & Gynaecology"
  },
  {
    "file": "Obstetrics-Diagnosis_of_Pregnancy_and_Antenatal_Care.json",
    "title": "Obstetrics Diagnosis Of Pregnancy And Antenatal Care",
    "count": 17,
    "category": "Obstetrics & Gynaecology"
  },
  {
    "file": "Obstetrics_Dr_Deepti.json",
    "title": "Obstetrics Dr Deepti",
    "count": 40,
    "category": "Obstetrics & Gynaecology"
  },
  {
    "file": "Obstetrics_Dr_Deepti-2026.json",
    "title": "Obstetrics Dr Deepti 2026",
    "count": 75,
    "category": "Obstetrics & Gynaecology"
  },
  {
    "file": "Obstetrics_DR_Deepti_Class_Test_FMGE.json",
    "title": "Obstetrics Dr Deepti Class Test Fmge",
    "count": 50,
    "category": "Obstetrics & Gynaecology"
  },
  {
    "file": "Obstetrics-Ectopic_pregnancy.json",
    "title": "Obstetrics Ectopic Pregnancy",
    "count": 15,
    "category": "Obstetrics & Gynaecology"
  },
  {
    "file": "Obstetrics-Gestational_diabetes_mellitus.json",
    "title": "Obstetrics Gestational Diabetes Mellitus",
    "count": 10,
    "category": "Obstetrics & Gynaecology"
  },
  {
    "file": "Obstetrics-Gestational_trophoblastic_diseases_and_Molar_pregnancy.json",
    "title": "Obstetrics Gestational Trophoblastic Diseases And Molar Pregnancy",
    "count": 18,
    "category": "Obstetrics & Gynaecology"
  },
  {
    "file": "Obstetrics-Heart_diseases_in_pregnancy.json",
    "title": "Obstetrics Heart Diseases In Pregnancy",
    "count": 14,
    "category": "Obstetrics & Gynaecology"
  },
  {
    "file": "Obstetrics-Hepatic_Disorders_in_Pregnancy.json",
    "title": "Obstetrics Hepatic Disorders In Pregnancy",
    "count": 11,
    "category": "Obstetrics & Gynaecology"
  },
  {
    "file": "Obstetrics-Hypertension_in_pregnancy.json",
    "title": "Obstetrics Hypertension In Pregnancy",
    "count": 20,
    "category": "Obstetrics & Gynaecology"
  },
  {
    "file": "Obstetrics_IBQ.json",
    "title": "Obstetrics Ibq",
    "count": 20,
    "category": "Obstetrics & Gynaecology"
  },
  {
    "file": "Obstetrics_INICET_PYQ.json",
    "title": "Obstetrics Inicet Pyq",
    "count": 164,
    "category": "Obstetrics & Gynaecology"
  },
  {
    "file": "Obstetrics-Multifetal_Pregnancy.json",
    "title": "Obstetrics Multifetal Pregnancy",
    "count": 19,
    "category": "Obstetrics & Gynaecology"
  },
  {
    "file": "Obstetrics_NEETPG_PYQ.json",
    "title": "Obstetrics Neetpg Pyq",
    "count": 106,
    "category": "Obstetrics & Gynaecology"
  },
  {
    "file": "Obstetrics-Physiological_changes_in_Pregnancy.json",
    "title": "Obstetrics Physiological Changes In Pregnancy",
    "count": 18,
    "category": "Obstetrics & Gynaecology"
  },
  {
    "file": "Obstetrics-Post-Partum_Hemorrhage.json",
    "title": "Obstetrics Post Partum Hemorrhage",
    "count": 18,
    "category": "Obstetrics & Gynaecology"
  },
  {
    "file": "Obstetrics-Preterm_Labor_and_Post-dated_Pregnancy.json",
    "title": "Obstetrics Preterm Labor And Post Dated Pregnancy",
    "count": 21,
    "category": "Obstetrics & Gynaecology"
  },
  {
    "file": "Obstetrics-Puerperium.json",
    "title": "Obstetrics Puerperium",
    "count": 12,
    "category": "Obstetrics & Gynaecology"
  },
  {
    "file": "Obstetrics-Rh_Isoimmunization.json",
    "title": "Obstetrics Rh Isoimmunization",
    "count": 12,
    "category": "Obstetrics & Gynaecology"
  },
  {
    "file": "Obstetrics-Stages_of_labour.json",
    "title": "Obstetrics Stages Of Labour",
    "count": 22,
    "category": "Obstetrics & Gynaecology"
  },
  {
    "file": "Obstructed_Labour.json",
    "title": "Obstructed Labour",
    "count": 10,
    "category": "Obstetrics & Gynaecology"
  },
  {
    "file": "Operative_Gynecology.json",
    "title": "Operative Gynecology",
    "count": 48,
    "category": "Obstetrics & Gynaecology"
  },
  {
    "file": "Operative_Obstetrics.json",
    "title": "Operative Obstetrics",
    "count": 22,
    "category": "Obstetrics & Gynaecology"
  },
  {
    "file": "Ovarian_Cancer.json",
    "title": "Ovarian Cancer",
    "count": 43,
    "category": "Obstetrics & Gynaecology"
  },
  {
    "file": "Ovarian_Tumors.json",
    "title": "Ovarian Tumors",
    "count": 9,
    "category": "Obstetrics & Gynaecology"
  },
  {
    "file": "Partogram.json",
    "title": "Partogram",
    "count": 5,
    "category": "Obstetrics & Gynaecology"
  },
  {
    "file": "Pcos.json",
    "title": "Pcos",
    "count": 27,
    "category": "Obstetrics & Gynaecology"
  },
  {
    "file": "PCOS.json",
    "title": "Pcos",
    "count": 24,
    "category": "Obstetrics & Gynaecology"
  },
  {
    "file": "Pediatrics-OBG_40_BTR_test_-_2024-10-25.json",
    "title": "Pediatrics Obg 40 Btr Test   2024 10 25",
    "count": 100,
    "category": "Obstetrics & Gynaecology"
  },
  {
    "file": "Pediatrics_OBG_BTR_50_test_-_2025-03-08.json",
    "title": "Pediatrics Obg Btr 50 Test   2025 03 08",
    "count": 150,
    "category": "Obstetrics & Gynaecology"
  },
  {
    "file": "Pediatrics-OBG_BTR_Test_30_-_2024-03-04.json",
    "title": "Pediatrics Obg Btr Test 30   2024 03 04",
    "count": 100,
    "category": "Obstetrics & Gynaecology"
  },
  {
    "file": "Pelvic_Floor_Disorders_and_Urogynecology.json",
    "title": "Pelvic Floor Disorders And Urogynecology",
    "count": 18,
    "category": "Obstetrics & Gynaecology"
  },
  {
    "file": "Pelvic_Inflammatory_Disease.json",
    "title": "Pelvic Inflammatory Disease",
    "count": 27,
    "category": "Obstetrics & Gynaecology"
  },
  {
    "file": "Physiological_Changes_During_Pregnancy.json",
    "title": "Physiological Changes During Pregnancy",
    "count": 35,
    "category": "Obstetrics & Gynaecology"
  },
  {
    "file": "Physiological_Changes_In_Pregnancy.json",
    "title": "Physiological Changes In Pregnancy",
    "count": 28,
    "category": "Obstetrics & Gynaecology"
  },
  {
    "file": "Physiology_of_Labour.json",
    "title": "Physiology Of Labour",
    "count": 15,
    "category": "Obstetrics & Gynaecology"
  },
  {
    "file": "Physiology_of_Pregnancy.json",
    "title": "Physiology Of Pregnancy",
    "count": 6,
    "category": "Obstetrics & Gynaecology"
  },
  {
    "file": "Post_Partum_Hemorrhage.json",
    "title": "Post Partum Hemorrhage",
    "count": 25,
    "category": "Obstetrics & Gynaecology"
  },
  {
    "file": "Post_Partum_Hemorrhage_PPH.json",
    "title": "Post Partum Hemorrhage Pph",
    "count": 11,
    "category": "Obstetrics & Gynaecology"
  },
  {
    "file": "Post_Term_Pregnancy.json",
    "title": "Post Term Pregnancy",
    "count": 8,
    "category": "Obstetrics & Gynaecology"
  },
  {
    "file": "Postpartum_Period.json",
    "title": "Postpartum Period",
    "count": 15,
    "category": "Obstetrics & Gynaecology"
  },
  {
    "file": "Pregnancy__Antenatal_Care.json",
    "title": "Pregnancy  Antenatal Care",
    "count": 13,
    "category": "Obstetrics & Gynaecology"
  },
  {
    "file": "Pregnancy_Induced_Hypertension.json",
    "title": "Pregnancy Induced Hypertension",
    "count": 29,
    "category": "Obstetrics & Gynaecology"
  },
  {
    "file": "Premalignant_Lesion_Of_Endometrium.json",
    "title": "Premalignant Lesion Of Endometrium",
    "count": 10,
    "category": "Obstetrics & Gynaecology"
  },
  {
    "file": "Premalignant_Lesions_Of_Cervix.json",
    "title": "Premalignant Lesions Of Cervix",
    "count": 15,
    "category": "Obstetrics & Gynaecology"
  },
  {
    "file": "Preterm_IUGR.json",
    "title": "Preterm Iugr",
    "count": 6,
    "category": "Obstetrics & Gynaecology"
  },
  {
    "file": "Preterm_Labour.json",
    "title": "Preterm Labour",
    "count": 17,
    "category": "Obstetrics & Gynaecology"
  },
  {
    "file": "Preterm_labour_and_PROM.json",
    "title": "Preterm Labour And Prom",
    "count": 10,
    "category": "Obstetrics & Gynaecology"
  },
  {
    "file": "Previous_Caesarean.json",
    "title": "Previous Caesarean",
    "count": 8,
    "category": "Obstetrics & Gynaecology"
  },
  {
    "file": "Primary_Amenorrhea.json",
    "title": "Primary Amenorrhea",
    "count": 27,
    "category": "Obstetrics & Gynaecology"
  },
  {
    "file": "Prolapse.json",
    "title": "Prolapse",
    "count": 32,
    "category": "Obstetrics & Gynaecology"
  },
  {
    "file": "Prolapse_and_Contraception.json",
    "title": "Prolapse And Contraception",
    "count": 15,
    "category": "Obstetrics & Gynaecology"
  },
  {
    "file": "Puerperium.json",
    "title": "Puerperium",
    "count": 13,
    "category": "Obstetrics & Gynaecology"
  },
  {
    "file": "Puerperium-Previous_Year_Questions.json",
    "title": "Puerperium Previous Year Questions",
    "count": 12,
    "category": "Obstetrics & Gynaecology"
  },
  {
    "file": "Pverperium_Sepsis.json",
    "title": "Pverperium Sepsis",
    "count": 12,
    "category": "Obstetrics & Gynaecology"
  },
  {
    "file": "Reversible_Methods_of_Contraception.json",
    "title": "Reversible Methods Of Contraception",
    "count": 51,
    "category": "Obstetrics & Gynaecology"
  },
  {
    "file": "RH_Isoimmunization.json",
    "title": "Rh Isoimmunization",
    "count": 8,
    "category": "Obstetrics & Gynaecology"
  },
  {
    "file": "Rh_Negative_Pregnancy.json",
    "title": "Rh Negative Pregnancy",
    "count": 8,
    "category": "Obstetrics & Gynaecology"
  },
  {
    "file": "Shoulder_Dystocia.json",
    "title": "Shoulder Dystocia",
    "count": 6,
    "category": "Obstetrics & Gynaecology"
  },
  {
    "file": "Special_Topics_in_Obstetrics-Previous_Year_Questions.json",
    "title": "Special Topics In Obstetrics Previous Year Questions",
    "count": 4,
    "category": "Obstetrics & Gynaecology"
  },
  {
    "file": "Stages_of_Labour.json",
    "title": "Stages Of Labour",
    "count": 10,
    "category": "Obstetrics & Gynaecology"
  },
  {
    "file": "SWT-Obs__Gynaecology-SET-A.json",
    "title": "Swt Obs  Gynaecology Set A",
    "count": 200,
    "category": "Obstetrics & Gynaecology"
  },
  {
    "file": "SWT-Obstetrics__Gynaecology-SET-B.json",
    "title": "Swt Obstetrics  Gynaecology Set B",
    "count": 200,
    "category": "Obstetrics & Gynaecology"
  },
  {
    "file": "Twin_Pregnanacy.json",
    "title": "Twin Pregnanacy",
    "count": 16,
    "category": "Obstetrics & Gynaecology"
  },
  {
    "file": "Twin_Pregnancy-Previous_Year_Questions.json",
    "title": "Twin Pregnancy Previous Year Questions",
    "count": 1,
    "category": "Obstetrics & Gynaecology"
  },
  {
    "file": "Ultrasound_In_Pregnancy.json",
    "title": "Ultrasound In Pregnancy",
    "count": 12,
    "category": "Obstetrics & Gynaecology"
  },
  {
    "file": "Urinary_Incontinence.json",
    "title": "Urinary Incontinence",
    "count": 11,
    "category": "Obstetrics & Gynaecology"
  },
  {
    "file": "Urogynecology-Previous_Year_Questions.json",
    "title": "Urogynecology Previous Year Questions",
    "count": 8,
    "category": "Obstetrics & Gynaecology"
  },
  {
    "file": "Uterine_Fibroids.json",
    "title": "Uterine Fibroids",
    "count": 32,
    "category": "Obstetrics & Gynaecology"
  },
  {
    "file": "Vaginitis.json",
    "title": "Vaginitis",
    "count": 7,
    "category": "Obstetrics & Gynaecology"
  },
  {
    "file": "Vaginitis_1.json",
    "title": "Vaginitis 1",
    "count": 7,
    "category": "Obstetrics & Gynaecology"
  },
  {
    "file": "Virginity__Pregnancy.json",
    "title": "Virginity  Pregnancy",
    "count": 8,
    "category": "Obstetrics & Gynaecology"
  },
  {
    "file": "Vulval_Cancer.json",
    "title": "Vulval Cancer",
    "count": 6,
    "category": "Obstetrics & Gynaecology"
  },
  {
    "file": "Acquired_Cataract.json",
    "title": "Acquired Cataract",
    "count": 4,
    "category": "Ophthalmology"
  },
  {
    "file": "Acute_Congestive_Glaucoma.json",
    "title": "Acute Congestive Glaucoma",
    "count": 9,
    "category": "Ophthalmology"
  },
  {
    "file": "Allergic_Conjunctivitis.json",
    "title": "Allergic Conjunctivitis",
    "count": 16,
    "category": "Ophthalmology"
  },
  {
    "file": "Angle_Kappa.json",
    "title": "Angle Kappa",
    "count": 6,
    "category": "Ophthalmology"
  },
  {
    "file": "Anisocoria.json",
    "title": "Anisocoria",
    "count": 4,
    "category": "Ophthalmology"
  },
  {
    "file": "Anterior_Uveitis.json",
    "title": "Anterior Uveitis",
    "count": 13,
    "category": "Ophthalmology"
  },
  {
    "file": "Anti_Glaucoma_Drugs.json",
    "title": "Anti Glaucoma Drugs",
    "count": 16,
    "category": "Ophthalmology"
  },
  {
    "file": "ARMD.json",
    "title": "Armd",
    "count": 6,
    "category": "Ophthalmology"
  },
  {
    "file": "Astigmatism__Accommodation.json",
    "title": "Astigmatism  Accommodation",
    "count": 13,
    "category": "Ophthalmology"
  },
  {
    "file": "Bacterial_Corneal_Ulcer.json",
    "title": "Bacterial Corneal Ulcer",
    "count": 7,
    "category": "Ophthalmology"
  },
  {
    "file": "Binocular_Single_Vision.json",
    "title": "Binocular Single Vision",
    "count": 12,
    "category": "Ophthalmology"
  },
  {
    "file": "Calculation_of_Refractive_Error.json",
    "title": "Calculation Of Refractive Error",
    "count": 6,
    "category": "Ophthalmology"
  },
  {
    "file": "Cataract.json",
    "title": "Cataract",
    "count": 16,
    "category": "Ophthalmology"
  },
  {
    "file": "CMV_Retinitis.json",
    "title": "Cmv Retinitis",
    "count": 4,
    "category": "Ophthalmology"
  },
  {
    "file": "Congenital_Glaucoma.json",
    "title": "Congenital Glaucoma",
    "count": 9,
    "category": "Ophthalmology"
  },
  {
    "file": "Conjuctiva.json",
    "title": "Conjuctiva",
    "count": 28,
    "category": "Ophthalmology"
  },
  {
    "file": "Conjunctiva.json",
    "title": "Conjunctiva",
    "count": 11,
    "category": "Ophthalmology"
  },
  {
    "file": "Conjunctiva_-_Introduction.json",
    "title": "Conjunctiva   Introduction",
    "count": 4,
    "category": "Ophthalmology"
  },
  {
    "file": "Conjunctiva_1.json",
    "title": "Conjunctiva 1",
    "count": 32,
    "category": "Ophthalmology"
  },
  {
    "file": "Conjunctiva-Conjunctiva.json",
    "title": "Conjunctiva Conjunctiva",
    "count": 24,
    "category": "Ophthalmology"
  },
  {
    "file": "Conjunctiva-Previous_Year_Questions.json",
    "title": "Conjunctiva Previous Year Questions",
    "count": 29,
    "category": "Ophthalmology"
  },
  {
    "file": "Conjunctival_Degenerations.json",
    "title": "Conjunctival Degenerations",
    "count": 19,
    "category": "Ophthalmology"
  },
  {
    "file": "Conjunctivitis.json",
    "title": "Conjunctivitis",
    "count": 33,
    "category": "Ophthalmology"
  },
  {
    "file": "Cornea.json",
    "title": "Cornea",
    "count": 14,
    "category": "Ophthalmology"
  },
  {
    "file": "Cornea_-_Introduction.json",
    "title": "Cornea   Introduction",
    "count": 13,
    "category": "Ophthalmology"
  },
  {
    "file": "Cornea_1.json",
    "title": "Cornea 1",
    "count": 49,
    "category": "Ophthalmology"
  },
  {
    "file": "Cornea_2.json",
    "title": "Cornea 2",
    "count": 57,
    "category": "Ophthalmology"
  },
  {
    "file": "Cornea-Cornea.json",
    "title": "Cornea Cornea",
    "count": 35,
    "category": "Ophthalmology"
  },
  {
    "file": "Cornea-Previous_Year_Questions.json",
    "title": "Cornea Previous Year Questions",
    "count": 43,
    "category": "Ophthalmology"
  },
  {
    "file": "Corneal_Dystrophies.json",
    "title": "Corneal Dystrophies",
    "count": 11,
    "category": "Ophthalmology"
  },
  {
    "file": "CRAO__CRVO.json",
    "title": "Crao  Crvo",
    "count": 9,
    "category": "Ophthalmology"
  },
  {
    "file": "Diabetic_Retinopathy.json",
    "title": "Diabetic Retinopathy",
    "count": 7,
    "category": "Ophthalmology"
  },
  {
    "file": "Diseases_of_Lens.json",
    "title": "Diseases Of Lens",
    "count": 9,
    "category": "Ophthalmology"
  },
  {
    "file": "Diseases_of_Lens-Lens_and_Disorders.json",
    "title": "Diseases Of Lens Lens And Disorders",
    "count": 33,
    "category": "Ophthalmology"
  },
  {
    "file": "Diseases_of_Orbit.json",
    "title": "Diseases Of Orbit",
    "count": 7,
    "category": "Ophthalmology"
  },
  {
    "file": "Diseases_of_the_lens.json",
    "title": "Diseases Of The Lens",
    "count": 43,
    "category": "Ophthalmology"
  },
  {
    "file": "Evaluation_Of_Comitant_Squint.json",
    "title": "Evaluation Of Comitant Squint",
    "count": 11,
    "category": "Ophthalmology"
  },
  {
    "file": "Evisceration__Enucleation.json",
    "title": "Evisceration  Enucleation",
    "count": 2,
    "category": "Ophthalmology"
  },
  {
    "file": "Eye_Changes_After_Death.json",
    "title": "Eye Changes After Death",
    "count": 10,
    "category": "Ophthalmology"
  },
  {
    "file": "Fungal_Corneal_Ulcer.json",
    "title": "Fungal Corneal Ulcer",
    "count": 6,
    "category": "Ophthalmology"
  },
  {
    "file": "Glaucoma.json",
    "title": "Glaucoma",
    "count": 8,
    "category": "Ophthalmology"
  },
  {
    "file": "Glaucoma_-_Introduction.json",
    "title": "Glaucoma   Introduction",
    "count": 5,
    "category": "Ophthalmology"
  },
  {
    "file": "Glaucoma_1.json",
    "title": "Glaucoma 1",
    "count": 10,
    "category": "Ophthalmology"
  },
  {
    "file": "Glaucoma_2.json",
    "title": "Glaucoma 2",
    "count": 10,
    "category": "Ophthalmology"
  },
  {
    "file": "Glaucoma_3.json",
    "title": "Glaucoma 3",
    "count": 57,
    "category": "Ophthalmology"
  },
  {
    "file": "Glaucoma-Glaucoma_-_POAG__Tonometry__Perimetry.json",
    "title": "Glaucoma Glaucoma   Poag  Tonometry  Perimetry",
    "count": 18,
    "category": "Ophthalmology"
  },
  {
    "file": "Glaucoma-Previous_Year_Questions.json",
    "title": "Glaucoma Previous Year Questions",
    "count": 24,
    "category": "Ophthalmology"
  },
  {
    "file": "High_Myopia.json",
    "title": "High Myopia",
    "count": 5,
    "category": "Ophthalmology"
  },
  {
    "file": "Hypertensive_Retinopathy.json",
    "title": "Hypertensive Retinopathy",
    "count": 4,
    "category": "Ophthalmology"
  },
  {
    "file": "Imaging_in_Ophthalmology-Previous_Year_Questions.json",
    "title": "Imaging In Ophthalmology Previous Year Questions",
    "count": 3,
    "category": "Ophthalmology"
  },
  {
    "file": "Incomitant.json",
    "title": "Incomitant",
    "count": 7,
    "category": "Ophthalmology"
  },
  {
    "file": "Intraocular_Tumors.json",
    "title": "Intraocular Tumors",
    "count": 7,
    "category": "Ophthalmology"
  },
  {
    "file": "Introduction_to_Ophthalmology.json",
    "title": "Introduction To Ophthalmology",
    "count": 2,
    "category": "Ophthalmology"
  },
  {
    "file": "Introduction_to_Ophthalmology-Introduction_to_Ophthalmology.json",
    "title": "Introduction To Ophthalmology Introduction To Ophthalmology",
    "count": 10,
    "category": "Ophthalmology"
  },
  {
    "file": "Introduction_to_Ophthalmology-Previous_Year_Questions.json",
    "title": "Introduction To Ophthalmology Previous Year Questions",
    "count": 6,
    "category": "Ophthalmology"
  },
  {
    "file": "IOP.json",
    "title": "Iop",
    "count": 12,
    "category": "Ophthalmology"
  },
  {
    "file": "Lacrimal_Apparatus.json",
    "title": "Lacrimal Apparatus",
    "count": 38,
    "category": "Ophthalmology"
  },
  {
    "file": "Lacrimal_Drainage_System.json",
    "title": "Lacrimal Drainage System",
    "count": 5,
    "category": "Ophthalmology"
  },
  {
    "file": "Lacrimal_Drainage_System_1.json",
    "title": "Lacrimal Drainage System 1",
    "count": 14,
    "category": "Ophthalmology"
  },
  {
    "file": "Lacrimal_Drainage_System-Lacrimal_Drainage_System.json",
    "title": "Lacrimal Drainage System Lacrimal Drainage System",
    "count": 10,
    "category": "Ophthalmology"
  },
  {
    "file": "Lasers_in_Eye-Previous_Year_Questions.json",
    "title": "Lasers In Eye Previous Year Questions",
    "count": 4,
    "category": "Ophthalmology"
  },
  {
    "file": "Lens.json",
    "title": "Lens",
    "count": 24,
    "category": "Ophthalmology"
  },
  {
    "file": "Lens_Abnormalities.json",
    "title": "Lens Abnormalities",
    "count": 6,
    "category": "Ophthalmology"
  },
  {
    "file": "Macular_Function_Tests.json",
    "title": "Macular Function Tests",
    "count": 4,
    "category": "Ophthalmology"
  },
  {
    "file": "Mid_Day_Module_Ophthalmology-1_-_2025-01-18.json",
    "title": "Mid Day Module Ophthalmology 1   2025 01 18",
    "count": 50,
    "category": "Ophthalmology"
  },
  {
    "file": "Mid_Day_Module_Ophthalmology-2_-_2025-01-19.json",
    "title": "Mid Day Module Ophthalmology 2   2025 01 19",
    "count": 50,
    "category": "Ophthalmology"
  },
  {
    "file": "Mid_Day_Module_Ophthalmology-3_-_2025-01-20.json",
    "title": "Mid Day Module Ophthalmology 3   2025 01 20",
    "count": 50,
    "category": "Ophthalmology"
  },
  {
    "file": "Mid_Day_Module_Ophthalmology-4_-_2025-01-21.json",
    "title": "Mid Day Module Ophthalmology 4   2025 01 21",
    "count": 50,
    "category": "Ophthalmology"
  },
  {
    "file": "Neuro_Ophthalmology.json",
    "title": "Neuro Ophthalmology",
    "count": 11,
    "category": "Ophthalmology"
  },
  {
    "file": "Neuro_Ophthalmology_-_Introduction.json",
    "title": "Neuro Ophthalmology   Introduction",
    "count": 6,
    "category": "Ophthalmology"
  },
  {
    "file": "Neuro_Ophthalmology_-_Miscellaneous.json",
    "title": "Neuro Ophthalmology   Miscellaneous",
    "count": 6,
    "category": "Ophthalmology"
  },
  {
    "file": "Neuro_Ophthalmology_1.json",
    "title": "Neuro Ophthalmology 1",
    "count": 56,
    "category": "Ophthalmology"
  },
  {
    "file": "Neuro_Ophthalmology-Neuro_Ophthalmology.json",
    "title": "Neuro Ophthalmology Neuro Ophthalmology",
    "count": 26,
    "category": "Ophthalmology"
  },
  {
    "file": "Neuro_Ophthalmology_Part_1.json",
    "title": "Neuro Ophthalmology Part 1",
    "count": 4,
    "category": "Ophthalmology"
  },
  {
    "file": "Neuro_Ophthalmology_Part_2.json",
    "title": "Neuro Ophthalmology Part 2",
    "count": 5,
    "category": "Ophthalmology"
  },
  {
    "file": "Neurophthalmology.json",
    "title": "Neurophthalmology",
    "count": 38,
    "category": "Ophthalmology"
  },
  {
    "file": "Ocular_adenexae.json",
    "title": "Ocular Adenexae",
    "count": 21,
    "category": "Ophthalmology"
  },
  {
    "file": "Ocular_Adnexa.json",
    "title": "Ocular Adnexa",
    "count": 1,
    "category": "Ophthalmology"
  },
  {
    "file": "Ocular_Adnexa_1.json",
    "title": "Ocular Adnexa 1",
    "count": 25,
    "category": "Ophthalmology"
  },
  {
    "file": "Ocular_Adnexa-Lids_and_Disorders.json",
    "title": "Ocular Adnexa Lids And Disorders",
    "count": 17,
    "category": "Ophthalmology"
  },
  {
    "file": "Ocular_Adnexa-Previous_Year_Questions.json",
    "title": "Ocular Adnexa Previous Year Questions",
    "count": 20,
    "category": "Ophthalmology"
  },
  {
    "file": "Ocular_Injuries-Ocular_Injuries.json",
    "title": "Ocular Injuries Ocular Injuries",
    "count": 6,
    "category": "Ophthalmology"
  },
  {
    "file": "Ophthalmology.json",
    "title": "Ophthalmology",
    "count": 20,
    "category": "Ophthalmology"
  },
  {
    "file": "Ophthalmology_-_AIIMS_MAY_2018.json",
    "title": "Ophthalmology   Aiims May 2018",
    "count": 12,
    "category": "Ophthalmology"
  },
  {
    "file": "Ophthalmology_-_AIIMS_MAY_2019.json",
    "title": "Ophthalmology   Aiims May 2019",
    "count": 7,
    "category": "Ophthalmology"
  },
  {
    "file": "Ophthalmology_-_AIIMS_NOV_2018.json",
    "title": "Ophthalmology   Aiims Nov 2018",
    "count": 7,
    "category": "Ophthalmology"
  },
  {
    "file": "Ophthalmology_-_AIIMS_NOV_2019.json",
    "title": "Ophthalmology   Aiims Nov 2019",
    "count": 8,
    "category": "Ophthalmology"
  },
  {
    "file": "Ophthalmology_-_INI_CET_JULY_2021.json",
    "title": "Ophthalmology   Ini Cet July 2021",
    "count": 7,
    "category": "Ophthalmology"
  },
  {
    "file": "Ophthalmology_-_INI_CET_MAY_2022.json",
    "title": "Ophthalmology   Ini Cet May 2022",
    "count": 5,
    "category": "Ophthalmology"
  },
  {
    "file": "Ophthalmology_-_INI_CET_NOV_2020.json",
    "title": "Ophthalmology   Ini Cet Nov 2020",
    "count": 4,
    "category": "Ophthalmology"
  },
  {
    "file": "Ophthalmology_-_INI_CET_NOV_2021.json",
    "title": "Ophthalmology   Ini Cet Nov 2021",
    "count": 8,
    "category": "Ophthalmology"
  },
  {
    "file": "Ophthalmology_-_INI_CET_NOVEMBER_2022_PART_-_A.json",
    "title": "Ophthalmology   Ini Cet November 2022 Part   A",
    "count": 6,
    "category": "Ophthalmology"
  },
  {
    "file": "Ophthalmology_-_INI_CET_NOVEMBER_2022_PART_-_B.json",
    "title": "Ophthalmology   Ini Cet November 2022 Part   B",
    "count": 6,
    "category": "Ophthalmology"
  },
  {
    "file": "Ophthalmology_-_INICET_MAY_2024.json",
    "title": "Ophthalmology   Inicet May 2024",
    "count": 11,
    "category": "Ophthalmology"
  },
  {
    "file": "Ophthalmology_-_NEET_PG_2018.json",
    "title": "Ophthalmology   Neet Pg 2018",
    "count": 12,
    "category": "Ophthalmology"
  },
  {
    "file": "Ophthalmology_-_NEET_PG_2019.json",
    "title": "Ophthalmology   Neet Pg 2019",
    "count": 12,
    "category": "Ophthalmology"
  },
  {
    "file": "Ophthalmology_-_NEET_PG_2020.json",
    "title": "Ophthalmology   Neet Pg 2020",
    "count": 13,
    "category": "Ophthalmology"
  },
  {
    "file": "Ophthalmology_-_NEET_PG_2021.json",
    "title": "Ophthalmology   Neet Pg 2021",
    "count": 10,
    "category": "Ophthalmology"
  },
  {
    "file": "Ophthalmology_-_NEET_PG_2022.json",
    "title": "Ophthalmology   Neet Pg 2022",
    "count": 5,
    "category": "Ophthalmology"
  },
  {
    "file": "Ophthalmology_-_NEET_PG_2023.json",
    "title": "Ophthalmology   Neet Pg 2023",
    "count": 10,
    "category": "Ophthalmology"
  },
  {
    "file": "Ophthalmology_-_NEET_PG_2024.json",
    "title": "Ophthalmology   Neet Pg 2024",
    "count": 14,
    "category": "Ophthalmology"
  },
  {
    "file": "Ophthalmology-_Class_Test__With_Video_Solution.json",
    "title": "Ophthalmology  Class Test  With Video Solution",
    "count": 75,
    "category": "Ophthalmology"
  },
  {
    "file": "Ophthalmology_1.json",
    "title": "Ophthalmology 1",
    "count": 20,
    "category": "Ophthalmology"
  },
  {
    "file": "Ophthalmology_Clinical_Vignettes.json",
    "title": "Ophthalmology Clinical Vignettes",
    "count": 84,
    "category": "Ophthalmology"
  },
  {
    "file": "Ophthalmology_Dr_Manish.json",
    "title": "Ophthalmology Dr Manish",
    "count": 40,
    "category": "Ophthalmology"
  },
  {
    "file": "253_Ophthalmology_Dr_Manish.json",
    "title": "Ophthalmology Dr Manish",
    "count": 40,
    "category": "Ophthalmology"
  },
  {
    "file": "Ophthalmology_Dr_Sourabh.json",
    "title": "Ophthalmology Dr Sourabh",
    "count": 75,
    "category": "Ophthalmology"
  },
  {
    "file": "Ophthalmology_Dr_Sourabh-2026.json",
    "title": "Ophthalmology Dr Sourabh 2026",
    "count": 50,
    "category": "Ophthalmology"
  },
  {
    "file": "Ophthalmology_DVT_Revision_Test.json",
    "title": "Ophthalmology Dvt Revision Test",
    "count": 25,
    "category": "Ophthalmology"
  },
  {
    "file": "Ophthalmology_ED_-_Mission_15_-_30-04-2024_-_2024-04-30.json",
    "title": "Ophthalmology Ed   Mission 15   30 04 2024   2024 04 30",
    "count": 100,
    "category": "Ophthalmology"
  },
  {
    "file": "Ophthalmology_ED_-_Mission_20_Batch_2_-_19-12-2024_-_2024-12-19.json",
    "title": "Ophthalmology Ed   Mission 20 Batch 2   19 12 2024   2024 12 19",
    "count": 75,
    "category": "Ophthalmology"
  },
  {
    "file": "Ophthalmology_ED_-_Mission_20_Batch_3_-_21-01-2025_-_2025-01-21.json",
    "title": "Ophthalmology Ed   Mission 20 Batch 3   21 01 2025   2025 01 21",
    "count": 50,
    "category": "Ophthalmology"
  },
  {
    "file": "Ophthalmology_ED_-_Mission_20_INICET_-_14-10-2024_-_2024-10-14.json",
    "title": "Ophthalmology Ed   Mission 20 Inicet   14 10 2024   2024 10 14",
    "count": 75,
    "category": "Ophthalmology"
  },
  {
    "file": "Ophthalmology_ED_-_Mission_20_Lap_2_-_26-04-2025_-_2025-04-26.json",
    "title": "Ophthalmology Ed   Mission 20 Lap 2   26 04 2025   2025 04 26",
    "count": 75,
    "category": "Ophthalmology"
  },
  {
    "file": "Ophthalmology_ED_Mission_NEET_PG_-_27-08-2023_-_2023-08-27.json",
    "title": "Ophthalmology Ed Mission Neet Pg   27 08 2023   2023 08 27",
    "count": 50,
    "category": "Ophthalmology"
  },
  {
    "file": "Ophthalmology_FMGE.json",
    "title": "Ophthalmology Fmge",
    "count": 40,
    "category": "Ophthalmology"
  },
  {
    "file": "Ophthalmology-FMGE_PYQ.json",
    "title": "Ophthalmology Fmge Pyq",
    "count": 137,
    "category": "Ophthalmology"
  },
  {
    "file": "Ophthalmology_Image_Based_Question.json",
    "title": "Ophthalmology Image Based Question",
    "count": 20,
    "category": "Ophthalmology"
  },
  {
    "file": "Ophthalmology_Last_Month_ED_-_07-07-2024_-_2024-07-07.json",
    "title": "Ophthalmology Last Month Ed   07 07 2024   2024 07 07",
    "count": 25,
    "category": "Ophthalmology"
  },
  {
    "file": "Ophthalmology_MIQ_Series.json",
    "title": "Ophthalmology Miq Series",
    "count": 20,
    "category": "Ophthalmology"
  },
  {
    "file": "Ophthalmology_NEET_PG_Revision_ED_-_27-01-2024_-_2024-01-27.json",
    "title": "Ophthalmology Neet Pg Revision Ed   27 01 2024   2024 01 27",
    "count": 50,
    "category": "Ophthalmology"
  },
  {
    "file": "Ophthalmology_Test_The_Champion_Batch_Hyderabad_-_31-01-2025_-_2025-01-31.json",
    "title": "Ophthalmology Test The Champion Batch Hyderabad   31 01 2025   2025 01 31",
    "count": 50,
    "category": "Ophthalmology"
  },
  {
    "file": "Opthalmology_INICET_PYQ.json",
    "title": "Opthalmology Inicet Pyq",
    "count": 141,
    "category": "Ophthalmology"
  },
  {
    "file": "Opthalmology_NEETPG_PYQ.json",
    "title": "Opthalmology Neetpg Pyq",
    "count": 81,
    "category": "Ophthalmology"
  },
  {
    "file": "Optic_Disc_Changes.json",
    "title": "Optic Disc Changes",
    "count": 5,
    "category": "Ophthalmology"
  },
  {
    "file": "Optic_Neuritis.json",
    "title": "Optic Neuritis",
    "count": 9,
    "category": "Ophthalmology"
  },
  {
    "file": "Optics.json",
    "title": "Optics",
    "count": 6,
    "category": "Ophthalmology"
  },
  {
    "file": "Optics_1.json",
    "title": "Optics 1",
    "count": 61,
    "category": "Ophthalmology"
  },
  {
    "file": "Optics-Optics-I.json",
    "title": "Optics Optics I",
    "count": 22,
    "category": "Ophthalmology"
  },
  {
    "file": "Optics-Optics-II.json",
    "title": "Optics Optics Ii",
    "count": 15,
    "category": "Ophthalmology"
  },
  {
    "file": "Optics-Previous_Year_Questions.json",
    "title": "Optics Previous Year Questions",
    "count": 33,
    "category": "Ophthalmology"
  },
  {
    "file": "Orbit_1.json",
    "title": "Orbit 1",
    "count": 36,
    "category": "Ophthalmology"
  },
  {
    "file": "Orbit-Orbit.json",
    "title": "Orbit Orbit",
    "count": 25,
    "category": "Ophthalmology"
  },
  {
    "file": "Orbit-Previous_Year_Questions.json",
    "title": "Orbit Previous Year Questions",
    "count": 17,
    "category": "Ophthalmology"
  },
  {
    "file": "Orbital_Cellulitis.json",
    "title": "Orbital Cellulitis",
    "count": 6,
    "category": "Ophthalmology"
  },
  {
    "file": "Other_Cataract.json",
    "title": "Other Cataract",
    "count": 8,
    "category": "Ophthalmology"
  },
  {
    "file": "PACG.json",
    "title": "Pacg",
    "count": 6,
    "category": "Ophthalmology"
  },
  {
    "file": "Papilloedema__Optic_Atrophy.json",
    "title": "Papilloedema  Optic Atrophy",
    "count": 2,
    "category": "Ophthalmology"
  },
  {
    "file": "Pars_Planitis.json",
    "title": "Pars Planitis",
    "count": 3,
    "category": "Ophthalmology"
  },
  {
    "file": "POAG.json",
    "title": "Poag",
    "count": 7,
    "category": "Ophthalmology"
  },
  {
    "file": "Posterior_Uveitis.json",
    "title": "Posterior Uveitis",
    "count": 2,
    "category": "Ophthalmology"
  },
  {
    "file": "Primary_Meyelofibrosis.json",
    "title": "Primary Meyelofibrosis",
    "count": 3,
    "category": "Ophthalmology"
  },
  {
    "file": "Proptosis.json",
    "title": "Proptosis",
    "count": 12,
    "category": "Ophthalmology"
  },
  {
    "file": "Ptosis.json",
    "title": "Ptosis",
    "count": 14,
    "category": "Ophthalmology"
  },
  {
    "file": "Retina.json",
    "title": "Retina",
    "count": 12,
    "category": "Ophthalmology"
  },
  {
    "file": "Retina_-_Introduction.json",
    "title": "Retina   Introduction",
    "count": 14,
    "category": "Ophthalmology"
  },
  {
    "file": "Retina_1.json",
    "title": "Retina 1",
    "count": 38,
    "category": "Ophthalmology"
  },
  {
    "file": "Retina_2.json",
    "title": "Retina 2",
    "count": 30,
    "category": "Ophthalmology"
  },
  {
    "file": "Retina-Previous_Year_Questions.json",
    "title": "Retina Previous Year Questions",
    "count": 51,
    "category": "Ophthalmology"
  },
  {
    "file": "Retina-Retinal_Investigations_and_Vascular_Disorders.json",
    "title": "Retina Retinal Investigations And Vascular Disorders",
    "count": 35,
    "category": "Ophthalmology"
  },
  {
    "file": "Retinoscopy.json",
    "title": "Retinoscopy",
    "count": 15,
    "category": "Ophthalmology"
  },
  {
    "file": "Sclera.json",
    "title": "Sclera",
    "count": 20,
    "category": "Ophthalmology"
  },
  {
    "file": "Sclera-Previous_Year_Questions.json",
    "title": "Sclera Previous Year Questions",
    "count": 5,
    "category": "Ophthalmology"
  },
  {
    "file": "Sclera-Sclera.json",
    "title": "Sclera Sclera",
    "count": 10,
    "category": "Ophthalmology"
  },
  {
    "file": "Spherical_Errors.json",
    "title": "Spherical Errors",
    "count": 8,
    "category": "Ophthalmology"
  },
  {
    "file": "Squint___Strabismus-Previous_Year_Questions.json",
    "title": "Squint   Strabismus Previous Year Questions",
    "count": 26,
    "category": "Ophthalmology"
  },
  {
    "file": "Squint___Strabismus-Squint.json",
    "title": "Squint   Strabismus Squint",
    "count": 27,
    "category": "Ophthalmology"
  },
  {
    "file": "Squint__Optics.json",
    "title": "Squint  Optics",
    "count": 41,
    "category": "Ophthalmology"
  },
  {
    "file": "Squint_Strabismus.json",
    "title": "Squint Strabismus",
    "count": 7,
    "category": "Ophthalmology"
  },
  {
    "file": "Strabismus.json",
    "title": "Strabismus",
    "count": 43,
    "category": "Ophthalmology"
  },
  {
    "file": "SWT-Ophthalmology-SET-A.json",
    "title": "Swt Ophthalmology Set A",
    "count": 200,
    "category": "Ophthalmology"
  },
  {
    "file": "SWT-Ophthalmology-SET-B.json",
    "title": "Swt Ophthalmology Set B",
    "count": 100,
    "category": "Ophthalmology"
  },
  {
    "file": "Tonometry.json",
    "title": "Tonometry",
    "count": 9,
    "category": "Ophthalmology"
  },
  {
    "file": "Uvea.json",
    "title": "Uvea",
    "count": 8,
    "category": "Ophthalmology"
  },
  {
    "file": "Uvea_1.json",
    "title": "Uvea 1",
    "count": 64,
    "category": "Ophthalmology"
  },
  {
    "file": "Uveitis.json",
    "title": "Uveitis",
    "count": 44,
    "category": "Ophthalmology"
  },
  {
    "file": "Uveitis_in_Systemic_Diseases.json",
    "title": "Uveitis In Systemic Diseases",
    "count": 6,
    "category": "Ophthalmology"
  },
  {
    "file": "Uveitis-Previous_Year_Questions.json",
    "title": "Uveitis Previous Year Questions",
    "count": 12,
    "category": "Ophthalmology"
  },
  {
    "file": "Uveitis-Uvea.json",
    "title": "Uveitis Uvea",
    "count": 22,
    "category": "Ophthalmology"
  },
  {
    "file": "Viral_Corneal_Ulcer.json",
    "title": "Viral Corneal Ulcer",
    "count": 8,
    "category": "Ophthalmology"
  },
  {
    "file": "Vision_2020.json",
    "title": "Vision 2020",
    "count": 8,
    "category": "Ophthalmology"
  },
  {
    "file": "Visual_Acuity.json",
    "title": "Visual Acuity",
    "count": 13,
    "category": "Ophthalmology"
  },
  {
    "file": "Visual_Field_Defects.json",
    "title": "Visual Field Defects",
    "count": 10,
    "category": "Ophthalmology"
  },
  {
    "file": "Visual_Pathway__Junctional_Scotoma.json",
    "title": "Visual Pathway  Junctional Scotoma",
    "count": 14,
    "category": "Ophthalmology"
  },
  {
    "file": "Vitreous.json",
    "title": "Vitreous",
    "count": 3,
    "category": "Ophthalmology"
  },
  {
    "file": "Arthritis.json",
    "title": "Arthritis",
    "count": 98,
    "category": "Orthopedics"
  },
  {
    "file": "Arthritis-Arthritis.json",
    "title": "Arthritis Arthritis",
    "count": 15,
    "category": "Orthopedics"
  },
  {
    "file": "AVN.json",
    "title": "Avn",
    "count": 8,
    "category": "Orthopedics"
  },
  {
    "file": "Basic_Terminology__Coxa_Vara.json",
    "title": "Basic Terminology  Coxa Vara",
    "count": 8,
    "category": "Orthopedics"
  },
  {
    "file": "Basics_Of_Bone_Tumors.json",
    "title": "Basics Of Bone Tumors",
    "count": 13,
    "category": "Orthopedics"
  },
  {
    "file": "Benign_Lesions_Of_Bone.json",
    "title": "Benign Lesions Of Bone",
    "count": 11,
    "category": "Orthopedics"
  },
  {
    "file": "Blowout_Fracture.json",
    "title": "Blowout Fracture",
    "count": 3,
    "category": "Orthopedics"
  },
  {
    "file": "Bone__Imaging.json",
    "title": "Bone  Imaging",
    "count": 8,
    "category": "Orthopedics"
  },
  {
    "file": "Bone__Joint_Infections.json",
    "title": "Bone  Joint Infections",
    "count": 19,
    "category": "Orthopedics"
  },
  {
    "file": "Bone_and_Imaging-Bone_and_Imaging-I.json",
    "title": "Bone And Imaging Bone And Imaging I",
    "count": 16,
    "category": "Orthopedics"
  },
  {
    "file": "Bone_and_Imaging-Bone_and_Imaging-II.json",
    "title": "Bone And Imaging Bone And Imaging Ii",
    "count": 17,
    "category": "Orthopedics"
  },
  {
    "file": "Bone_Disorders-Previous_Year_Questions.json",
    "title": "Bone Disorders Previous Year Questions",
    "count": 5,
    "category": "Orthopedics"
  },
  {
    "file": "Bone_Infections-Bone_and_Joint_Infections.json",
    "title": "Bone Infections Bone And Joint Infections",
    "count": 27,
    "category": "Orthopedics"
  },
  {
    "file": "Bone_Infections-Previous_Year_Questions.json",
    "title": "Bone Infections Previous Year Questions",
    "count": 8,
    "category": "Orthopedics"
  },
  {
    "file": "Bone_Tumor.json",
    "title": "Bone Tumor",
    "count": 8,
    "category": "Orthopedics"
  },
  {
    "file": "Bone_Tumors-Bone_Tumours.json",
    "title": "Bone Tumors Bone Tumours",
    "count": 25,
    "category": "Orthopedics"
  },
  {
    "file": "Bone_Tumors-Previous_Year_Questions.json",
    "title": "Bone Tumors Previous Year Questions",
    "count": 27,
    "category": "Orthopedics"
  },
  {
    "file": "Bone_Tumour.json",
    "title": "Bone Tumour",
    "count": 40,
    "category": "Orthopedics"
  },
  {
    "file": "Breast_Bone_Skin_Soft_tissue.json",
    "title": "Breast Bone Skin Soft Tissue",
    "count": 15,
    "category": "Orthopedics"
  },
  {
    "file": "Cdh__Blounts_Disease.json",
    "title": "Cdh  Blounts Disease",
    "count": 9,
    "category": "Orthopedics"
  },
  {
    "file": "Complication_In_Orthopaedics.json",
    "title": "Complication In Orthopaedics",
    "count": 28,
    "category": "Orthopedics"
  },
  {
    "file": "Complications_of_Fractures-Complications_in_Orthopedics.json",
    "title": "Complications Of Fractures Complications In Orthopedics",
    "count": 14,
    "category": "Orthopedics"
  },
  {
    "file": "Complications_of_Fractures-Previous_Year_Questions.json",
    "title": "Complications Of Fractures Previous Year Questions",
    "count": 10,
    "category": "Orthopedics"
  },
  {
    "file": "Ctev__Achondroplasia.json",
    "title": "Ctev  Achondroplasia",
    "count": 8,
    "category": "Orthopedics"
  },
  {
    "file": "Elbow_Joint.json",
    "title": "Elbow Joint",
    "count": 6,
    "category": "Orthopedics"
  },
  {
    "file": "Eponyms_of_fractures.json",
    "title": "Eponyms Of Fractures",
    "count": 5,
    "category": "Orthopedics"
  },
  {
    "file": "Fracture_of_Humerus.json",
    "title": "Fracture Of Humerus",
    "count": 22,
    "category": "Orthopedics"
  },
  {
    "file": "Fractures_of_Facial_Bone__Csf_Rhinorrhea.json",
    "title": "Fractures Of Facial Bone  Csf Rhinorrhea",
    "count": 3,
    "category": "Orthopedics"
  },
  {
    "file": "General__Upper_Limb_Traumatology.json",
    "title": "General  Upper Limb Traumatology",
    "count": 156,
    "category": "Orthopedics"
  },
  {
    "file": "General-Miscellaneous_Topics_in_Orthopedics.json",
    "title": "General Miscellaneous Topics In Orthopedics",
    "count": 21,
    "category": "Orthopedics"
  },
  {
    "file": "General_Orthopedics.json",
    "title": "General Orthopedics",
    "count": 20,
    "category": "Orthopedics"
  },
  {
    "file": "Hip_Joint.json",
    "title": "Hip Joint",
    "count": 18,
    "category": "Orthopedics"
  },
  {
    "file": "Infective_Arthritis__Other_Infections.json",
    "title": "Infective Arthritis  Other Infections",
    "count": 20,
    "category": "Orthopedics"
  },
  {
    "file": "Introduction_to_Orthopedics_Typical_and_Atypical_Fractures.json",
    "title": "Introduction To Orthopedics Typical And Atypical Fractures",
    "count": 3,
    "category": "Orthopedics"
  },
  {
    "file": "Joint_Disorders.json",
    "title": "Joint Disorders",
    "count": 33,
    "category": "Orthopedics"
  },
  {
    "file": "Knee.json",
    "title": "Knee",
    "count": 25,
    "category": "Orthopedics"
  },
  {
    "file": "Lower_Limb_-_Tibia__Fibula.json",
    "title": "Lower Limb   Tibia  Fibula",
    "count": 7,
    "category": "Orthopedics"
  },
  {
    "file": "Lower_Limb_Other_Fracture_Till_Toes.json",
    "title": "Lower Limb Other Fracture Till Toes",
    "count": 11,
    "category": "Orthopedics"
  },
  {
    "file": "Lower_Limb-Previous_Year_Questions.json",
    "title": "Lower Limb Previous Year Questions",
    "count": 37,
    "category": "Orthopedics"
  },
  {
    "file": "Lower_Limb_Trauma.json",
    "title": "Lower Limb Trauma",
    "count": 10,
    "category": "Orthopedics"
  },
  {
    "file": "Lower_Limb_Traumatology-Previous_Year_Questions.json",
    "title": "Lower Limb Traumatology Previous Year Questions",
    "count": 53,
    "category": "Orthopedics"
  },
  {
    "file": "Lower_Limb_Traumatology-Spine__Pelvis__and_Lower_Limb_Traumatology-I.json",
    "title": "Lower Limb Traumatology Spine  Pelvis  And Lower Limb Traumatology I",
    "count": 23,
    "category": "Orthopedics"
  },
  {
    "file": "Lower_Limb_Traumatology-Spine__Pelvis__and_Lower_Limb_Traumatology-II.json",
    "title": "Lower Limb Traumatology Spine  Pelvis  And Lower Limb Traumatology Ii",
    "count": 20,
    "category": "Orthopedics"
  },
  {
    "file": "Lower_Limb_Trendelenburg__Pelvic_Fracture.json",
    "title": "Lower Limb Trendelenburg  Pelvic Fracture",
    "count": 11,
    "category": "Orthopedics"
  },
  {
    "file": "Malunion_and_Open_Fractures.json",
    "title": "Malunion And Open Fractures",
    "count": 4,
    "category": "Orthopedics"
  },
  {
    "file": "Metabolic_Bone_Diseases-Metabolic_Disorders_in_Orthopedics.json",
    "title": "Metabolic Bone Diseases Metabolic Disorders In Orthopedics",
    "count": 32,
    "category": "Orthopedics"
  },
  {
    "file": "Mid_Day_Module_Orthopedics-1_-_2025-01-28.json",
    "title": "Mid Day Module Orthopedics 1   2025 01 28",
    "count": 50,
    "category": "Orthopedics"
  },
  {
    "file": "Mid_Day_Module_Orthopedics-2_-_2025-01-29.json",
    "title": "Mid Day Module Orthopedics 2   2025 01 29",
    "count": 50,
    "category": "Orthopedics"
  },
  {
    "file": "Musculoskeletal_Disorders-Previous_Year_Questions.json",
    "title": "Musculoskeletal Disorders Previous Year Questions",
    "count": 5,
    "category": "Orthopedics"
  },
  {
    "file": "Orthopadic_DVT_Revision_Test.json",
    "title": "Orthopadic Dvt Revision Test",
    "count": 25,
    "category": "Orthopedics"
  },
  {
    "file": "Orthopaedic_Imaging.json",
    "title": "Orthopaedic Imaging",
    "count": 57,
    "category": "Orthopedics"
  },
  {
    "file": "Orthopaedics_-_AIIMS_MAY_2018.json",
    "title": "Orthopaedics   Aiims May 2018",
    "count": 8,
    "category": "Orthopedics"
  },
  {
    "file": "Orthopaedics_-_AIIMS_MAY_2019.json",
    "title": "Orthopaedics   Aiims May 2019",
    "count": 5,
    "category": "Orthopedics"
  },
  {
    "file": "Orthopaedics_-_AIIMS_NOV_2018.json",
    "title": "Orthopaedics   Aiims Nov 2018",
    "count": 8,
    "category": "Orthopedics"
  },
  {
    "file": "Orthopaedics_-_INI_CET_JULY_2021.json",
    "title": "Orthopaedics   Ini Cet July 2021",
    "count": 8,
    "category": "Orthopedics"
  },
  {
    "file": "Orthopaedics_-_INI_CET_NOV_2020.json",
    "title": "Orthopaedics   Ini Cet Nov 2020",
    "count": 5,
    "category": "Orthopedics"
  },
  {
    "file": "Orthopaedics_-_INI_CET_NOV_2022_PART_A.json",
    "title": "Orthopaedics   Ini Cet Nov 2022 Part A",
    "count": 5,
    "category": "Orthopedics"
  },
  {
    "file": "Orthopaedics_-_INI_CET_NOV_2022_PART_B.json",
    "title": "Orthopaedics   Ini Cet Nov 2022 Part B",
    "count": 3,
    "category": "Orthopedics"
  },
  {
    "file": "Orthopaedics_-_INI_CET_NOV_2023.json",
    "title": "Orthopaedics   Ini Cet Nov 2023",
    "count": 7,
    "category": "Orthopedics"
  },
  {
    "file": "Orthopaedics_-_NEET_PG_2020.json",
    "title": "Orthopaedics   Neet Pg 2020",
    "count": 2,
    "category": "Orthopedics"
  },
  {
    "file": "Orthopaedics_-_NEET_PG_2022.json",
    "title": "Orthopaedics   Neet Pg 2022",
    "count": 3,
    "category": "Orthopedics"
  },
  {
    "file": "Orthopaedics_-_NEET_PG_2024.json",
    "title": "Orthopaedics   Neet Pg 2024",
    "count": 16,
    "category": "Orthopedics"
  },
  {
    "file": "Orthopaedics_DR_Tushar_Class_Test_FMGE.json",
    "title": "Orthopaedics Dr Tushar Class Test Fmge",
    "count": 40,
    "category": "Orthopedics"
  },
  {
    "file": "Orthopaedics_IBQ.json",
    "title": "Orthopaedics Ibq",
    "count": 20,
    "category": "Orthopedics"
  },
  {
    "file": "Orthopaedics_Image_Based_Question.json",
    "title": "Orthopaedics Image Based Question",
    "count": 20,
    "category": "Orthopedics"
  },
  {
    "file": "Orthopaedics_INICET_PYQ.json",
    "title": "Orthopaedics Inicet Pyq",
    "count": 86,
    "category": "Orthopedics"
  },
  {
    "file": "Orthopaedics_MIQ_Series.json",
    "title": "Orthopaedics Miq Series",
    "count": 15,
    "category": "Orthopedics"
  },
  {
    "file": "Orthopaedics_New_Season.json",
    "title": "Orthopaedics New Season",
    "count": 20,
    "category": "Orthopedics"
  },
  {
    "file": "Orthopedic_Tests.json",
    "title": "Orthopedic Tests",
    "count": 10,
    "category": "Orthopedics"
  },
  {
    "file": "Orthopedics_Dr_Tushar.json",
    "title": "Orthopedics Dr Tushar",
    "count": 40,
    "category": "Orthopedics"
  },
  {
    "file": "Orthopedics_Dr_Tushar_1.json",
    "title": "Orthopedics Dr Tushar 1",
    "count": 40,
    "category": "Orthopedics"
  },
  {
    "file": "Orthopedics_Dr_Tushar_New.json",
    "title": "Orthopedics Dr Tushar New",
    "count": 40,
    "category": "Orthopedics"
  },
  {
    "file": "Orthopedics_ED_-_Mission_15_-_11-04-2024_-_2024-04-11.json",
    "title": "Orthopedics Ed   Mission 15   11 04 2024   2024 04 11",
    "count": 50,
    "category": "Orthopedics"
  },
  {
    "file": "Orthopedics_ED_-_Mission_20_Batch_3_-_31-01-2025_-_2025-01-31.json",
    "title": "Orthopedics Ed   Mission 20 Batch 3   31 01 2025   2025 01 31",
    "count": 75,
    "category": "Orthopedics"
  },
  {
    "file": "Orthopedics_ED_-_Mission_20_INICET_-_30-08-2024_-_2024-08-30.json",
    "title": "Orthopedics Ed   Mission 20 Inicet   30 08 2024   2024 08 30",
    "count": 50,
    "category": "Orthopedics"
  },
  {
    "file": "Orthopedics_ED_-_Mission_20_Lap_2_-_05-04-2025_-_2025-04-05.json",
    "title": "Orthopedics Ed   Mission 20 Lap 2   05 04 2025   2025 04 05",
    "count": 50,
    "category": "Orthopedics"
  },
  {
    "file": "Orthopedics_ED_Mission_NEET_PG_-_14-07-2023_-_2023-07-14.json",
    "title": "Orthopedics Ed Mission Neet Pg   14 07 2023   2023 07 14",
    "count": 50,
    "category": "Orthopedics"
  },
  {
    "file": "Orthopedics_ED_Mission_NEET_PG_INICET_20_-_10-08-2024_-_2024-08-10.json",
    "title": "Orthopedics Ed Mission Neet Pg Inicet 20   10 08 2024   2024 08 10",
    "count": 50,
    "category": "Orthopedics"
  },
  {
    "file": "Orthopedics_Last_Month_ED_-_04-07-2024_-_2024-07-04.json",
    "title": "Orthopedics Last Month Ed   04 07 2024   2024 07 04",
    "count": 25,
    "category": "Orthopedics"
  },
  {
    "file": "Orthopedics_NEET_PG_Revision_ED_-_12-12-2023_-_2023-12-12.json",
    "title": "Orthopedics Neet Pg Revision Ed   12 12 2023   2023 12 12",
    "count": 50,
    "category": "Orthopedics"
  },
  {
    "file": "Orthopedics_Oncology.json",
    "title": "Orthopedics Oncology",
    "count": 37,
    "category": "Orthopedics"
  },
  {
    "file": "Orthopedics_Test_The_Champion_Batch_Hyderabad_-_25-01-2025_-_2025-01-25.json",
    "title": "Orthopedics Test The Champion Batch Hyderabad   25 01 2025   2025 01 25",
    "count": 50,
    "category": "Orthopedics"
  },
  {
    "file": "Orthopedics_Test_The_Champion_Batch_Hyderabad_-_30-04-2025_-_2025-04-30.json",
    "title": "Orthopedics Test The Champion Batch Hyderabad   30 04 2025   2025 04 30",
    "count": 50,
    "category": "Orthopedics"
  },
  {
    "file": "Osteochondritis.json",
    "title": "Osteochondritis",
    "count": 6,
    "category": "Orthopedics"
  },
  {
    "file": "Osteomyelitis.json",
    "title": "Osteomyelitis",
    "count": 29,
    "category": "Orthopedics"
  },
  {
    "file": "Osteomyelitis_Osteochondritis_Avascular_Necrosis.json",
    "title": "Osteomyelitis Osteochondritis Avascular Necrosis",
    "count": 8,
    "category": "Orthopedics"
  },
  {
    "file": "Osteoporosis.json",
    "title": "Osteoporosis",
    "count": 15,
    "category": "Orthopedics"
  },
  {
    "file": "Park_Test.json",
    "title": "Park Test",
    "count": 7,
    "category": "Orthopedics"
  },
  {
    "file": "Pediatric_Orthopedics.json",
    "title": "Pediatric Orthopedics",
    "count": 69,
    "category": "Orthopedics"
  },
  {
    "file": "PertheS_Disease__Scfe.json",
    "title": "Perthes Disease  Scfe",
    "count": 9,
    "category": "Orthopedics"
  },
  {
    "file": "Prom.json",
    "title": "Prom",
    "count": 9,
    "category": "Orthopedics"
  },
  {
    "file": "Rickets__Osteomalacia.json",
    "title": "Rickets  Osteomalacia",
    "count": 20,
    "category": "Orthopedics"
  },
  {
    "file": "Salter_Harris.json",
    "title": "Salter Harris",
    "count": 3,
    "category": "Orthopedics"
  },
  {
    "file": "Shoulder_Joint.json",
    "title": "Shoulder Joint",
    "count": 13,
    "category": "Orthopedics"
  },
  {
    "file": "Skeletal_Dysplasia.json",
    "title": "Skeletal Dysplasia",
    "count": 4,
    "category": "Orthopedics"
  },
  {
    "file": "Skull_Fractures.json",
    "title": "Skull Fractures",
    "count": 10,
    "category": "Orthopedics"
  },
  {
    "file": "Special_X-Ray_views_in_Ortho.json",
    "title": "Special X Ray Views In Ortho",
    "count": 5,
    "category": "Orthopedics"
  },
  {
    "file": "Spine__Pelvis__Lower_Limb_Traumatology.json",
    "title": "Spine  Pelvis  Lower Limb Traumatology",
    "count": 185,
    "category": "Orthopedics"
  },
  {
    "file": "Spine_And_Regional_Conditions.json",
    "title": "Spine And Regional Conditions",
    "count": 24,
    "category": "Orthopedics"
  },
  {
    "file": "Splints__Tractions_In_Ortho.json",
    "title": "Splints  Tractions In Ortho",
    "count": 10,
    "category": "Orthopedics"
  },
  {
    "file": "Sports_Injuries-Sports_Injuries.json",
    "title": "Sports Injuries Sports Injuries",
    "count": 15,
    "category": "Orthopedics"
  },
  {
    "file": "Sports_Injury__NM_Disorders.json",
    "title": "Sports Injury  Nm Disorders",
    "count": 170,
    "category": "Orthopedics"
  },
  {
    "file": "Sports_Injury_Part-1.json",
    "title": "Sports Injury Part 1",
    "count": 7,
    "category": "Orthopedics"
  },
  {
    "file": "Sports_Injury_Part-2.json",
    "title": "Sports Injury Part 2",
    "count": 5,
    "category": "Orthopedics"
  },
  {
    "file": "SWT-Orthopaedics-SET-A.json",
    "title": "Swt Orthopaedics Set A",
    "count": 100,
    "category": "Orthopedics"
  },
  {
    "file": "SWT-Orthopaedics-SET-B.json",
    "title": "Swt Orthopaedics Set B",
    "count": 100,
    "category": "Orthopedics"
  },
  {
    "file": "TB_Osteomyelitis.json",
    "title": "Tb Osteomyelitis",
    "count": 28,
    "category": "Orthopedics"
  },
  {
    "file": "Tuberculosis_of_Bone.json",
    "title": "Tuberculosis Of Bone",
    "count": 7,
    "category": "Orthopedics"
  },
  {
    "file": "Tuberculosis_of_Bone__Joints.json",
    "title": "Tuberculosis Of Bone  Joints",
    "count": 19,
    "category": "Orthopedics"
  },
  {
    "file": "Tuberculosis_of_Bone_and_Joints-Previous_Year_Questions.json",
    "title": "Tuberculosis Of Bone And Joints Previous Year Questions",
    "count": 4,
    "category": "Orthopedics"
  },
  {
    "file": "Tuberculosis_of_Bone_and_Joints-TB_of_Bone.json",
    "title": "Tuberculosis Of Bone And Joints Tb Of Bone",
    "count": 11,
    "category": "Orthopedics"
  },
  {
    "file": "Upper_Limb_Clavicle__Shoulder_Dislocation.json",
    "title": "Upper Limb Clavicle  Shoulder Dislocation",
    "count": 16,
    "category": "Orthopedics"
  },
  {
    "file": "Upper_Limb_Fracture_Proximal__Shaft_Humerus.json",
    "title": "Upper Limb Fracture Proximal  Shaft Humerus",
    "count": 3,
    "category": "Orthopedics"
  },
  {
    "file": "Upper_Limb_Fracture_Sc_Humerus_Till_Fingers.json",
    "title": "Upper Limb Fracture Sc Humerus Till Fingers",
    "count": 9,
    "category": "Orthopedics"
  },
  {
    "file": "Upper_Limb_Trauma.json",
    "title": "Upper Limb Trauma",
    "count": 10,
    "category": "Orthopedics"
  },
  {
    "file": "Upper_Limb_Traumatology-Previous_Year_Questions.json",
    "title": "Upper Limb Traumatology Previous Year Questions",
    "count": 56,
    "category": "Orthopedics"
  },
  {
    "file": "Upper_Limb_Traumatology-Upper_Limb_Trauma-I.json",
    "title": "Upper Limb Traumatology Upper Limb Trauma I",
    "count": 27,
    "category": "Orthopedics"
  },
  {
    "file": "Upper_Limb_Traumatology-Upper_Limb_Trauma-II___Congenital_Torticollis.json",
    "title": "Upper Limb Traumatology Upper Limb Trauma Ii   Congenital Torticollis",
    "count": 15,
    "category": "Orthopedics"
  },
  {
    "file": "_FMGE_CT_-_Pathology_Systemic.json",
    "title": " Fmge Ct   Pathology Systemic",
    "count": 40,
    "category": "Pathology"
  },
  {
    "file": "_Neurodegenerative_Diseases.json",
    "title": " Neurodegenerative Diseases",
    "count": 85,
    "category": "Pathology"
  },
  {
    "file": "Acute_Leukemia_Clinical_Features__Classification.json",
    "title": "Acute Leukemia Clinical Features  Classification",
    "count": 16,
    "category": "Pathology"
  },
  {
    "file": "Adrenal_Gland_Adrenal_Cortex_Neoplasm__Pheochromocytoma.json",
    "title": "Adrenal Gland Adrenal Cortex Neoplasm  Pheochromocytoma",
    "count": 14,
    "category": "Pathology"
  },
  {
    "file": "Alcoholic_Liver_Disease_1.json",
    "title": "Alcoholic Liver Disease 1",
    "count": 4,
    "category": "Pathology"
  },
  {
    "file": "Amyloidosis.json",
    "title": "Amyloidosis",
    "count": 6,
    "category": "Pathology"
  },
  {
    "file": "ANS_Pharmacology-Sympatholytics.json",
    "title": "Ans Pharmacology Sympatholytics",
    "count": 13,
    "category": "Pathology"
  },
  {
    "file": "ANS_Pharmacology-Sympathomimetics.json",
    "title": "Ans Pharmacology Sympathomimetics",
    "count": 21,
    "category": "Pathology"
  },
  {
    "file": "Asphyxia.json",
    "title": "Asphyxia",
    "count": 41,
    "category": "Pathology"
  },
  {
    "file": "Atelectasis.json",
    "title": "Atelectasis",
    "count": 1,
    "category": "Pathology"
  },
  {
    "file": "Atrophy.json",
    "title": "Atrophy",
    "count": 7,
    "category": "Pathology"
  },
  {
    "file": "Autoimmune_Cholangiopathies.json",
    "title": "Autoimmune Cholangiopathies",
    "count": 5,
    "category": "Pathology"
  },
  {
    "file": "Autoimmune_Hemolytic_Anemia.json",
    "title": "Autoimmune Hemolytic Anemia",
    "count": 5,
    "category": "Pathology"
  },
  {
    "file": "Basic_Pathophysiology_of_Trauma__Stress_Part_1.json",
    "title": "Basic Pathophysiology Of Trauma  Stress Part 1",
    "count": 7,
    "category": "Pathology"
  },
  {
    "file": "Benign_Aggressive_Tumors.json",
    "title": "Benign Aggressive Tumors",
    "count": 20,
    "category": "Pathology"
  },
  {
    "file": "Bleeding__Platelet_Disorders.json",
    "title": "Bleeding  Platelet Disorders",
    "count": 25,
    "category": "Pathology"
  },
  {
    "file": "Blood_Banking_and_Transfusion_Medicine-Blood_Banking_and_Transfusion_Pathology.json",
    "title": "Blood Banking And Transfusion Medicine Blood Banking And Transfusion Pathology",
    "count": 11,
    "category": "Pathology"
  },
  {
    "file": "Blood_Disorders.json",
    "title": "Blood Disorders",
    "count": 15,
    "category": "Pathology"
  },
  {
    "file": "Bone_Disorders-Bone_and_soft_tissue_pathology.json",
    "title": "Bone Disorders Bone And Soft Tissue Pathology",
    "count": 20,
    "category": "Pathology"
  },
  {
    "file": "Brain_Death-Brain_death.json",
    "title": "Brain Death Brain Death",
    "count": 7,
    "category": "Pathology"
  },
  {
    "file": "Brain_Tumors.json",
    "title": "Brain Tumors",
    "count": 11,
    "category": "Pathology"
  },
  {
    "file": "Brainstem_Syndrome.json",
    "title": "Brainstem Syndrome",
    "count": 15,
    "category": "Pathology"
  },
  {
    "file": "Breast_Pathology-Benign_Breast_Lesions.json",
    "title": "Breast Pathology Benign Breast Lesions",
    "count": 14,
    "category": "Pathology"
  },
  {
    "file": "Breast_Pathology-Malignant_Breast_Lesions.json",
    "title": "Breast Pathology Malignant Breast Lesions",
    "count": 12,
    "category": "Pathology"
  },
  {
    "file": "Breast_Pathology-Previous_Year_Questions.json",
    "title": "Breast Pathology Previous Year Questions",
    "count": 6,
    "category": "Pathology"
  },
  {
    "file": "Cancers.json",
    "title": "Cancers",
    "count": 15,
    "category": "Pathology"
  },
  {
    "file": "Cell_Adaptation_Injury_And_Death.json",
    "title": "Cell Adaptation Injury And Death",
    "count": 66,
    "category": "Pathology"
  },
  {
    "file": "Cell_Injury.json",
    "title": "Cell Injury",
    "count": 53,
    "category": "Pathology"
  },
  {
    "file": "Cell_Injury-Cell_ageing__Autophagy_and_Cellular_adaptations.json",
    "title": "Cell Injury Cell Ageing  Autophagy And Cellular Adaptations",
    "count": 14,
    "category": "Pathology"
  },
  {
    "file": "Cell_Injury-Cell_Death.json",
    "title": "Cell Injury Cell Death",
    "count": 15,
    "category": "Pathology"
  },
  {
    "file": "Cell_Injury-Cell_Injury__Free_Radical_Injury__and_ER_Stress_Related.json",
    "title": "Cell Injury Cell Injury  Free Radical Injury  And Er Stress Related",
    "count": 12,
    "category": "Pathology"
  },
  {
    "file": "Cell_Injury-Intracellular_Accumulations.json",
    "title": "Cell Injury Intracellular Accumulations",
    "count": 12,
    "category": "Pathology"
  },
  {
    "file": "Cell_Injury_Part_1.json",
    "title": "Cell Injury Part 1",
    "count": 28,
    "category": "Pathology"
  },
  {
    "file": "Cell_Injury-Previous_Year_Questions.json",
    "title": "Cell Injury Previous Year Questions",
    "count": 30,
    "category": "Pathology"
  },
  {
    "file": "Central_Nervous_System-CNS_Pathology.json",
    "title": "Central Nervous System Cns Pathology",
    "count": 17,
    "category": "Pathology"
  },
  {
    "file": "Central_Nervous_System_Pathology.json",
    "title": "Central Nervous System Pathology",
    "count": 8,
    "category": "Pathology"
  },
  {
    "file": "Chronic_Inflammation.json",
    "title": "Chronic Inflammation",
    "count": 3,
    "category": "Pathology"
  },
  {
    "file": "Chronic_Lymphocytic_Leukemia.json",
    "title": "Chronic Lymphocytic Leukemia",
    "count": 5,
    "category": "Pathology"
  },
  {
    "file": "Chronic_Myeloid_Leukemia.json",
    "title": "Chronic Myeloid Leukemia",
    "count": 7,
    "category": "Pathology"
  },
  {
    "file": "Chronic_Myeloid_Leukemia_1.json",
    "title": "Chronic Myeloid Leukemia 1",
    "count": 7,
    "category": "Pathology"
  },
  {
    "file": "Chronic_Myeloproliferative_Neoplasms_Introduction.json",
    "title": "Chronic Myeloproliferative Neoplasms Introduction",
    "count": 3,
    "category": "Pathology"
  },
  {
    "file": "CNS_Tumors.json",
    "title": "Cns Tumors",
    "count": 8,
    "category": "Pathology"
  },
  {
    "file": "Coagulation_Pathways__Disorders.json",
    "title": "Coagulation Pathways  Disorders",
    "count": 28,
    "category": "Pathology"
  },
  {
    "file": "Complications.json",
    "title": "Complications",
    "count": 4,
    "category": "Pathology"
  },
  {
    "file": "Congenital_Anomalies.json",
    "title": "Congenital Anomalies",
    "count": 5,
    "category": "Pathology"
  },
  {
    "file": "Connective_Tissue_Disorders-Previous_Year_Questions.json",
    "title": "Connective Tissue Disorders Previous Year Questions",
    "count": 7,
    "category": "Pathology"
  },
  {
    "file": "CVS__Blood_Vessels_and_Vasculitis-Carditis_and_Cardiac_tumors.json",
    "title": "Cvs  Blood Vessels And Vasculitis Carditis And Cardiac Tumors",
    "count": 16,
    "category": "Pathology"
  },
  {
    "file": "CVS__Blood_Vessels_and_Vasculitis-Sclerosis_and_Vascular_Tumors.json",
    "title": "Cvs  Blood Vessels And Vasculitis Sclerosis And Vascular Tumors",
    "count": 11,
    "category": "Pathology"
  },
  {
    "file": "CVS__Blood_Vessels_and_Vasculitis-Vasculitis.json",
    "title": "Cvs  Blood Vessels And Vasculitis Vasculitis",
    "count": 13,
    "category": "Pathology"
  },
  {
    "file": "Cystic_Diseases_of_Kidney_ADPKD__ARPKD.json",
    "title": "Cystic Diseases Of Kidney Adpkd  Arpkd",
    "count": 11,
    "category": "Pathology"
  },
  {
    "file": "Cystic_Fibrosis_Pneumonia__ARDS.json",
    "title": "Cystic Fibrosis Pneumonia  Ards",
    "count": 31,
    "category": "Pathology"
  },
  {
    "file": "Defects_of_Inflammation.json",
    "title": "Defects Of Inflammation",
    "count": 3,
    "category": "Pathology"
  },
  {
    "file": "Diabetes_Criteria_Classifications__Pathophysiology.json",
    "title": "Diabetes Criteria Classifications  Pathophysiology",
    "count": 5,
    "category": "Pathology"
  },
  {
    "file": "Diagnosis__Type.json",
    "title": "Diagnosis  Type",
    "count": 3,
    "category": "Pathology"
  },
  {
    "file": "Diagnosis_of_Genetic_Disorders.json",
    "title": "Diagnosis Of Genetic Disorders",
    "count": 8,
    "category": "Pathology"
  },
  {
    "file": "Diseases_of_the_immune_system.json",
    "title": "Diseases Of The Immune System",
    "count": 22,
    "category": "Pathology"
  },
  {
    "file": "Disorders_of_Glands.json",
    "title": "Disorders Of Glands",
    "count": 4,
    "category": "Pathology"
  },
  {
    "file": "Esophageal_Disorders__Dysphagia.json",
    "title": "Esophageal Disorders  Dysphagia",
    "count": 22,
    "category": "Pathology"
  },
  {
    "file": "Esophagus_Carcinoma_Esophagus.json",
    "title": "Esophagus Carcinoma Esophagus",
    "count": 26,
    "category": "Pathology"
  },
  {
    "file": "Fate_of_Acute_Inflammation.json",
    "title": "Fate Of Acute Inflammation",
    "count": 2,
    "category": "Pathology"
  },
  {
    "file": "FMGE_Dec_CT_-_Pathology_Gen_Hema.json",
    "title": "Fmge Dec Ct   Pathology Gen Hema",
    "count": 40,
    "category": "Pathology"
  },
  {
    "file": "FMGE_Mini_Mock_Test_OphtalmologyENTPathologyPediatrics.json",
    "title": "Fmge Mini Mock Test Ophtalmologyentpathologypediatrics",
    "count": 80,
    "category": "Pathology"
  },
  {
    "file": "FSGS.json",
    "title": "Fsgs",
    "count": 5,
    "category": "Pathology"
  },
  {
    "file": "Fungal_Pneumonia-Part_1.json",
    "title": "Fungal Pneumonia Part 1",
    "count": 2,
    "category": "Pathology"
  },
  {
    "file": "Gastrointestinal_System-Inflammatory_Bowel_Disease-I.json",
    "title": "Gastrointestinal System Inflammatory Bowel Disease I",
    "count": 15,
    "category": "Pathology"
  },
  {
    "file": "Gastrointestinal_Tract-Intestinal_Polyps_and_Intestinal_Carcinoma.json",
    "title": "Gastrointestinal Tract Intestinal Polyps And Intestinal Carcinoma",
    "count": 14,
    "category": "Pathology"
  },
  {
    "file": "General_Pathology_Dr_Sanjeev.json",
    "title": "General Pathology Dr Sanjeev",
    "count": 25,
    "category": "Pathology"
  },
  {
    "file": "Genetics_and_Genetic_Disorders-Genetic_Disorders_and_Syndromes.json",
    "title": "Genetics And Genetic Disorders Genetic Disorders And Syndromes",
    "count": 19,
    "category": "Pathology"
  },
  {
    "file": "Genetics_and_Health.json",
    "title": "Genetics And Health",
    "count": 19,
    "category": "Pathology"
  },
  {
    "file": "Genetics-Diagnosis_of_Genetic_Disorders_and_Miscellaneous.json",
    "title": "Genetics Diagnosis Of Genetic Disorders And Miscellaneous",
    "count": 15,
    "category": "Pathology"
  },
  {
    "file": "Genetics-Non-Mendelian_Disorders.json",
    "title": "Genetics Non Mendelian Disorders",
    "count": 15,
    "category": "Pathology"
  },
  {
    "file": "Genital_System-Pathology_of_Female_Genital_Tract-I.json",
    "title": "Genital System Pathology Of Female Genital Tract I",
    "count": 11,
    "category": "Pathology"
  },
  {
    "file": "Genital_System-Pathology_of_Female_Genital_Tract-II.json",
    "title": "Genital System Pathology Of Female Genital Tract Ii",
    "count": 20,
    "category": "Pathology"
  },
  {
    "file": "Genital_System-Pathology_of_Male_Genital_Tract.json",
    "title": "Genital System Pathology Of Male Genital Tract",
    "count": 17,
    "category": "Pathology"
  },
  {
    "file": "Germ_Cell_And_Sex_Cord_Storms_Cancer.json",
    "title": "Germ Cell And Sex Cord Storms Cancer",
    "count": 23,
    "category": "Pathology"
  },
  {
    "file": "Glomerulonephritis_Basics.json",
    "title": "Glomerulonephritis Basics",
    "count": 3,
    "category": "Pathology"
  },
  {
    "file": "Graft_Rejection__GVHD.json",
    "title": "Graft Rejection  Gvhd",
    "count": 4,
    "category": "Pathology"
  },
  {
    "file": "Hairy_Cell_Leukemia.json",
    "title": "Hairy Cell Leukemia",
    "count": 5,
    "category": "Pathology"
  },
  {
    "file": "Hallmarks_of_Cancer__Cell_Cycle.json",
    "title": "Hallmarks Of Cancer  Cell Cycle",
    "count": 12,
    "category": "Pathology"
  },
  {
    "file": "Hematology.json",
    "title": "Hematology",
    "count": 35,
    "category": "Pathology"
  },
  {
    "file": "Hematology__Red_Blood_Cells-Hemolytic_Anemia-I.json",
    "title": "Hematology  Red Blood Cells Hemolytic Anemia I",
    "count": 15,
    "category": "Pathology"
  },
  {
    "file": "Hematology__Red_Blood_Cells-Hemolytic_Anemia-II.json",
    "title": "Hematology  Red Blood Cells Hemolytic Anemia Ii",
    "count": 16,
    "category": "Pathology"
  },
  {
    "file": "Hematology__Red_Blood_Cells-Microcytic_Hypochromic_Anemia_.json",
    "title": "Hematology  Red Blood Cells Microcytic Hypochromic Anemia ",
    "count": 22,
    "category": "Pathology"
  },
  {
    "file": "Hematology__White_Blood_Cells-ALL_and_AML.json",
    "title": "Hematology  White Blood Cells All And Aml",
    "count": 14,
    "category": "Pathology"
  },
  {
    "file": "Hematology__White_Blood_Cells-CML_and_CLL.json",
    "title": "Hematology  White Blood Cells Cml And Cll",
    "count": 12,
    "category": "Pathology"
  },
  {
    "file": "Hematology__White_Blood_Cells-Hodgkin_s_and_Non-Hodgkin_s_Lymphoma.json",
    "title": "Hematology  White Blood Cells Hodgkin S And Non Hodgkin S Lymphoma",
    "count": 20,
    "category": "Pathology"
  },
  {
    "file": "Hematology__White_Blood_Cells-Myeloid_Disorders.json",
    "title": "Hematology  White Blood Cells Myeloid Disorders",
    "count": 7,
    "category": "Pathology"
  },
  {
    "file": "Hematology__White_Blood_Cells-Plasma_Cell_Disorders.json",
    "title": "Hematology  White Blood Cells Plasma Cell Disorders",
    "count": 10,
    "category": "Pathology"
  },
  {
    "file": "Hematology_1.json",
    "title": "Hematology 1",
    "count": 37,
    "category": "Pathology"
  },
  {
    "file": "Hematology_2.json",
    "title": "Hematology 2",
    "count": 37,
    "category": "Pathology"
  },
  {
    "file": "Hematology-Acute_Lymphocytic_Leukemia.json",
    "title": "Hematology Acute Lymphocytic Leukemia",
    "count": 9,
    "category": "Pathology"
  },
  {
    "file": "Hematology-Acute_Myeloid_Leukemia.json",
    "title": "Hematology Acute Myeloid Leukemia",
    "count": 10,
    "category": "Pathology"
  },
  {
    "file": "Hematology-Chronic_Lymphocytic_Leukemia.json",
    "title": "Hematology Chronic Lymphocytic Leukemia",
    "count": 13,
    "category": "Pathology"
  },
  {
    "file": "Hematology-Chronic_Myeloid_Leukemia.json",
    "title": "Hematology Chronic Myeloid Leukemia",
    "count": 11,
    "category": "Pathology"
  },
  {
    "file": "Hematology-Multiple_Myeloma.json",
    "title": "Hematology Multiple Myeloma",
    "count": 12,
    "category": "Pathology"
  },
  {
    "file": "Hematology-Platelet_disorders_and_hematology_images.json",
    "title": "Hematology Platelet Disorders And Hematology Images",
    "count": 23,
    "category": "Pathology"
  },
  {
    "file": "Hematology-Sickle_cell_disease__G6PD_deficiency__and_other_Hemolytic_anemias.json",
    "title": "Hematology Sickle Cell Disease  G6Pd Deficiency  And Other Hemolytic Anemias",
    "count": 21,
    "category": "Pathology"
  },
  {
    "file": "Hemochromatosis.json",
    "title": "Hemochromatosis",
    "count": 12,
    "category": "Pathology"
  },
  {
    "file": "Hemolytic_Anemia_-_Hereditary_Sperocytosis.json",
    "title": "Hemolytic Anemia   Hereditary Sperocytosis",
    "count": 16,
    "category": "Pathology"
  },
  {
    "file": "Hemolytic_Anemia_-_Sickle_Cell_Disease.json",
    "title": "Hemolytic Anemia   Sickle Cell Disease",
    "count": 5,
    "category": "Pathology"
  },
  {
    "file": "Hemolytic_Anemia_Classification__Examples.json",
    "title": "Hemolytic Anemia Classification  Examples",
    "count": 25,
    "category": "Pathology"
  },
  {
    "file": "Hepatobiliary_System-Autoimmune_Hepatitis__Primary_Biliary_Cirrhosis__Primary_Sclerosing_Cholangitis__and_Paracetamol_Toxicity.json",
    "title": "Hepatobiliary System Autoimmune Hepatitis  Primary Biliary Cirrhosis  Primary Sclerosing Cholangitis  And Paracetamol Toxicity",
    "count": 11,
    "category": "Pathology"
  },
  {
    "file": "Hepatocellular_Tumors__Carcinoma.json",
    "title": "Hepatocellular Tumors  Carcinoma",
    "count": 6,
    "category": "Pathology"
  },
  {
    "file": "Histopathology.json",
    "title": "Histopathology",
    "count": 5,
    "category": "Pathology"
  },
  {
    "file": "History_Prognosis__Etiology.json",
    "title": "History Prognosis  Etiology",
    "count": 11,
    "category": "Pathology"
  },
  {
    "file": "Hodgkins_Lymphoma.json",
    "title": "Hodgkins Lymphoma",
    "count": 9,
    "category": "Pathology"
  },
  {
    "file": "Hydrocephalus.json",
    "title": "Hydrocephalus",
    "count": 8,
    "category": "Pathology"
  },
  {
    "file": "Hypersensitivity.json",
    "title": "Hypersensitivity",
    "count": 5,
    "category": "Pathology"
  },
  {
    "file": "Hypersensitivity_Pneumonitis.json",
    "title": "Hypersensitivity Pneumonitis",
    "count": 1,
    "category": "Pathology"
  },
  {
    "file": "Hypersensitivity_Reactions_-_Type-1.json",
    "title": "Hypersensitivity Reactions   Type 1",
    "count": 8,
    "category": "Pathology"
  },
  {
    "file": "Hypersensitivity_Reactions_-_Type-3__4.json",
    "title": "Hypersensitivity Reactions   Type 3  4",
    "count": 9,
    "category": "Pathology"
  },
  {
    "file": "Hypertrophy__Hyperplasia.json",
    "title": "Hypertrophy  Hyperplasia",
    "count": 12,
    "category": "Pathology"
  },
  {
    "file": "Immune_System__Vasculitis.json",
    "title": "Immune System  Vasculitis",
    "count": 46,
    "category": "Pathology"
  },
  {
    "file": "Immunity-Amyloidosis.json",
    "title": "Immunity Amyloidosis",
    "count": 4,
    "category": "Pathology"
  },
  {
    "file": "Immunity-Transplant_Immunity.json",
    "title": "Immunity Transplant Immunity",
    "count": 7,
    "category": "Pathology"
  },
  {
    "file": "Immunodeficiency_Disorders.json",
    "title": "Immunodeficiency Disorders",
    "count": 21,
    "category": "Pathology"
  },
  {
    "file": "Inflammation.json",
    "title": "Inflammation",
    "count": 50,
    "category": "Pathology"
  },
  {
    "file": "Inflammation_.json",
    "title": "Inflammation ",
    "count": 16,
    "category": "Pathology"
  },
  {
    "file": "Inflammation-Acute_Inflammation.json",
    "title": "Inflammation Acute Inflammation",
    "count": 17,
    "category": "Pathology"
  },
  {
    "file": "Inflammation-Chronic_Inflammation.json",
    "title": "Inflammation Chronic Inflammation",
    "count": 12,
    "category": "Pathology"
  },
  {
    "file": "Inflammation-Previous_Year_Questions.json",
    "title": "Inflammation Previous Year Questions",
    "count": 29,
    "category": "Pathology"
  },
  {
    "file": "Inflammation_Repair_And_Hemodynamics.json",
    "title": "Inflammation Repair And Hemodynamics",
    "count": 55,
    "category": "Pathology"
  },
  {
    "file": "Injuries_1.json",
    "title": "Injuries 1",
    "count": 44,
    "category": "Pathology"
  },
  {
    "file": "Intracellular_Accumulation.json",
    "title": "Intracellular Accumulation",
    "count": 15,
    "category": "Pathology"
  },
  {
    "file": "Introduction_to_Cell_Injury.json",
    "title": "Introduction To Cell Injury",
    "count": 5,
    "category": "Pathology"
  },
  {
    "file": "Kidney_-_Congenital__Other_Benign_Disorders_Part_3.json",
    "title": "Kidney   Congenital  Other Benign Disorders Part 3",
    "count": 14,
    "category": "Pathology"
  },
  {
    "file": "Kidney_-_Renal_Neoplasm_Part_2.json",
    "title": "Kidney   Renal Neoplasm Part 2",
    "count": 15,
    "category": "Pathology"
  },
  {
    "file": "Larynx-Voice_Pathologies_and_Congenital_Lesions_of_Larynx.json",
    "title": "Larynx Voice Pathologies And Congenital Lesions Of Larynx",
    "count": 16,
    "category": "Pathology"
  },
  {
    "file": "Late_Night_PYQ_PYT_Marathon_Pathology-1_-_2024-11-30.json",
    "title": "Late Night Pyq Pyt Marathon Pathology 1   2024 11 30",
    "count": 60,
    "category": "Pathology"
  },
  {
    "file": "Late_Night_PYQ_PYT_Marathon_Pathology-2_-_2024-12-01.json",
    "title": "Late Night Pyq Pyt Marathon Pathology 2   2024 12 01",
    "count": 60,
    "category": "Pathology"
  },
  {
    "file": "Late_Night_PYQ_PYT_Marathon_Pathology-3_-_2024-12-02.json",
    "title": "Late Night Pyq Pyt Marathon Pathology 3   2024 12 02",
    "count": 60,
    "category": "Pathology"
  },
  {
    "file": "Late_Night_PYQ_PYT_Marathon_Pathology-4_-_2024-12-03.json",
    "title": "Late Night Pyq Pyt Marathon Pathology 4   2024 12 03",
    "count": 60,
    "category": "Pathology"
  },
  {
    "file": "Late_Night_PYQ_PYT_Marathon_Pathology-5_-_2025-02-19.json",
    "title": "Late Night Pyq Pyt Marathon Pathology 5   2025 02 19",
    "count": 60,
    "category": "Pathology"
  },
  {
    "file": "Late_Night_PYQ_PYT_Marathon_Pathology-6_-_2025-02-20.json",
    "title": "Late Night Pyq Pyt Marathon Pathology 6   2025 02 20",
    "count": 60,
    "category": "Pathology"
  },
  {
